Speaker,Dialogue
burke,"Look, this is a multimillion dollar operation.  He can't make that kind of decision.  He's just a grunt!  No offense."
hicks," Ferro, you copying?"
ferro, Standing by.
hicks,Prep for dust-off.  We're gonna need an immediate evac.  I think we'll take off and nuke the site from orbit.  It's the only way to be sure.
burke,This is absurd!  You don't have the authority to --
ripley,"We're going home, honey."
ferro,Spunkmeyer?  Goddammit.
ferro, Where the fu --
ripley,Run!
hudson," Well that's great!  That's just fucking great, man.  Now what the fuck are we supposed to do, man? We're in some real pretty shit now!"
hicks,Are you finished?  You okay?
newt,"I guess we're not leaving, right?"
ripley,"I'm sorry, Newt."
newt,You don't have to be sorry.  It wasn't your fault.
hudson, Just tell me what the fuck we're supposed to do now.  What're we gonna do now?
burke, May be could build a fire and sing songs.
newt,"We should get back, 'cause it'll be dark soon.  They come mostly at night.  Mostly."
hicks,This is all we could salvage.  We've got four pulse-rifles with about fifty rounds each.  Not so good. About fifteen M-40 grenades and two flame throwers less than half full...one damaged.  And We've got four of these robot-sentry units with scanners and display intact.
ripley,How long after we're declared overdue can we expect a rescue?
hicks,About seventeen days.
hudson,"Man, we're not going to make it seventeen hours!  Those things are going to come in here, just like they did before, man... they're going to come in here and get us, man, long before..."
ripley,She survived longer than that with no weapons and no training.
ripley,"So you better just start dealing with it.  Just deal with it, Hudson...because we need you and I'm tired of your bullshit.  Now get on a terminal and call up some kind of floor plan file. Construction blueprints, maintenance schematics, anything that shows the layout of this place.  I want to see air ducts, electrical access tunnels, subbasements.  Every possible way into this wing."
hudson,Aye-firmative.  I'm on it.
bishop,I'll be in medical.  I'd like to continue my analysis.
ripley,Fine.  You do that.
ripley,This service tunnel is how they're moving back and forth.
hudson,"Yeah, right, it runs from the processing station right into the sublevel here."
ripley,All right.  There's a fire door at this end.  The first thing we do is put a remote sentry in the tunnel and seal that door.
hicks,We gotta figure on them getting into the complex.
ripley,"That's right.  So we put up welded barricades at these intersections...  ...and seal these ducts here and here.  Then they can only come at us from these two corridors and we create a free field of fire for the other two sentry units, here."
hicks,"Outstanding.  Then all we need's a deck of cards.  All right, let's move like we got a purpose."
hudson,Aye-firmative.
newt, Aye-firmative!
vasquez, Testing!
hudson,Hudson here.  A and B sentries are in place and keyed.  We're sealing the tunnel.
hicks, Roger.
hicks,"Here, put this on.  Then I can locate you anywhere in the complex on this --"
hicks,Just a...precaution.  You know.
ripley, Thanks.
hudson,"Uh, what's next?"
ripley,Now you just lie here and have a nap.  You're exhausted.
newt,I don't want to...I have scary dreams.
ripley,I'll bet Casey doesn't have bad dreams.
ripley,Nothing bad in here.  Maybe you could just try to be like her.
newt,Ripley...she doesn't have bad dreams because she's just a piece of plastic.
ripley,"Oh.  Sorry, Newt."
newt,My mommy always said there were no monsters.  No real ones.  But there are.
ripley," Yes, there are, aren't there."
newt,Why do they tell little kids that?
ripley,"Well, some kids can't handle it like you can."
newt,Did one of those things grow inside her?
ripley,"I don't know, Newt.  That's the truth."
newt,Isn't that how babies come? I mean people babies...they grow inside you?
ripley,"No, it's different, honey."
newt,Did you ever have a baby?
ripley,Yes.  A little girl.
newt,Where is she?
ripley, Gone.
newt,You mean dead.
newt,"Ripley, I was just thinking... Maybe I could do you a favor and fill in for her.  Just for a while.  You can try it and if you don't like it, it's okay. I'll understand.  No big deal. Whattya think?"
ripley,I think it's not the worst idea I've heard all day.  Let's talk about it later.
newt,Don't go!  Please.
ripley,"I'll be right in the other room, Newt.  And look...I can see you on that camera right up there."
ripley,Here.  Take is for luck.  Now go to sleep...and don't dream.
ripley, How is he?
bishop,I've isolated a neuro-muscular toxin responsible for the paralysis.  It seems to be metabolizing.  He should wake up soon.
ripley,"Now let me get this straight. The aliens paralyzed the colonists, carried them over there, cocooned them to be hosts for more of those..."
ripley,"Which would mean lots of those parasites, right?  One for each person...over a hundred at least."
bishop,Yes.  That follows.
ripley,But these things come from eggs...so where are all the eggs coming from.
bishop,"That is the question of the hour.  We could assume a parallel to certain insect forms who have hivelike organization. An ant of termite colony, for example, is ruled by a single female, a queen, which is the source of new eggs."
ripley,You're saying one of those things lays all the eggs?
bishop,"Well, the queen is always physically larger then the others.  A termite queen's abdomen is so bloated with eggs that it can't move at all.  It is fed and tended by drone workers, defended by the warriors.  She is the center of their lives, quite literally the  mother of their society."
ripley,Could it be intelligent?
bishop,"Hard to say.  It may have been blind instinct...attraction to the heat of whatever...but she did choose to incubate her eggs in the one spot where we couldn't destroy her without destroying ourselves.  That's if she exists, of course."
ripley, I want those specimens destroyed as soon as you're done with them. You understand?
bishop,Mr. Burke have instructions that they were to be kept alive in stasis for return to the company labs.  He was very specific.
ripley,Burke!
burke,"Those specimens are worth millions to the bio-weapons division.  Now, if you're smart we can both come out of this heroes.  Set up for life."
ripley,You just try getting a dangerous organism past ICC quarantine. Section 22350 of the Commerce Code.
burke,"You've been doing your homework. Look, they can't impound it if they don't know about it."
ripley,"But they will know about it, Burke. From me.  Just like they'll know how you were responsible for the deaths of one hundred and fifty-seven colonists here --"
burke,"Now, wait a second --"
ripley," You sent them to that ship.  I just checked the colony log... directive dates six-twelve-seventy-nine. Signed Burke, Carter J."
ripley,"You sent them out there and you didn't even warn them, Burke. Why didn't you warn them?"
burke,"Look, maybe the thing didn't even exist, right?  And if I'd made it a major security situation, the Administration would've stepped in.  Then no exclusive rights, nothing."
burke,"It was a bad call, that's all."
ripley,"Bad call?  These people are fucking dead, Burke!  Well, they're going to nail your hide to the shed... and I'll be there when they do."
burke," I expected more of you, Ripley. I thought you would be smarter than this."
ripley,Sorry to disappoint you.
hicks,They're coming.  They're in the tunnel.
hicks,Guns A and B.  Tracking and firing on multiple targets.
hudson,They must be wall to wall in there.  Look  at those ammo counters go.  It's a shooting gallery down there.
hicks,B gun's dry.  Twenty on A. Ten.  Five.  That's it.
ripley,They're at the fire door.
hudson,"Man, listen to that."
bishop, Bishop here.  I'm afraid I have some bad news.
hudson,"Well, that's a switch."
bishop,That's it.  See it?  Emergency venting.
ripley,How long until it blows?
bishop,I'm projecting total systems failure in a little under four hours.  The blast radius will be about thirty kilometers.  About equal to ten megatons.
hicks,We got problems.
hudson,I don't fucking believe this. Do you believe this?
ripley,And it's too late to shut it down?
bishop,"I'm afraid so.  The crash did too much damage.  The overload is inevitable, at this point."
hudson,"Oh, man.  And I was gettin' short, too!  Four more weeks and out. Now I'm gonna buy it on this fuckin' rock.  It ain't half fair, man!"
vasquez,"Hudson, give us a break."
ripley," We need the other drop-ship.  The on one the Sulaco.  We have to bring it down on remote, somehow."
hudson,How?  The transmitter was on the APC.  It's wasted.
ripley, I don't care how!  Think of a way.  Think of something.
hudson,Think of what?  We're fucked.
ripley,What about the colony transmitter? That up-link tower down at the other end.  Why can't we use that?
bishop,I checked.  The hard wiring between here and there was severed in the fighting.
ripley,Well then somebody's just going to have to go out there.  Take a portable terminal and go out there and plug in manually.
hudson,"Oh, right!  Right!  With those things running around.  No way."
bishop, I'll go.
ripley,What?
bishop,"I'm really the only one qualified to remote-pilot the ship anyway. Believe me, I'd prefer not to.  I may be synthetic but I'm not stupid."
ripley,All right.  Let's get on it.  What'll you need?
vasquez,Listen.  It's stopped.
hicks,"Well, they're into the complex."
bishop,"This duct runs almost to the up-link assembly.  One hundred eighty meters.  Say, forty minutes to crawl down there.  One hour to patch in and align the antenna. Thirty minutes to prep the ship, then about fifty minutes flight time."
ripley,It's going to be closer.  You better get going.
bishop, See you soon.
hicks, They're in the approach corridor.
ripley, On my way.
hicks,Twenty meters and closing. Fifteen.  C and D guns down about fifty percent.
ripley,Now many?
hicks,Can't tell.  Lots.  D gun's down to twenty.  Ten.  It's out.
ripley,They retreated.  The guns stopped them.
hicks,Yeah.  But look...
hicks,Newt time then can walk right up and knock.
ripley,But they don't know that.  They're probably looking for other ways to get in.  That'll take them awhile.
hudson,Maybe we got 'em demoralized.
hicks, I want you two walking the perimeter. I know we're all in strung out shape but stay frosty and alert. We've got to stop any entries before they get out of hand.
hicks,How long since you slept? Twenty-four hours?
ripley, They'll get us.
hicks,Maybe.  Maybe not.
ripley,"Hicks, I'm not going to wind up like those others.  You'll take care of it won't you, it if comes to that?"
hicks,"If it comes to that, I'll do us both.  Let's see that it doesn't Here, I'd like to introduce you to a close personal friend of mine."
hicks,"M-41A 10mm pulse-rifle, over and under with a 30mm pump-action grenade launcher."
ripley,What do I do?
hicks,"Just pull it in real right.  It will kick some.  When the counter here heads zero, hit this..."
hicks,"Just let it drop right out.  Get the other one in quick.  Just slap it in hard, it likes abuse. Now, pull the bolt."
hicks,You're ready again.
ripley,What's this?
hicks,"Well, that's the grenade launcher ...you probably don't want to mess with that."
ripley,"Look, you started this.  Now show me everything.  I can handle myself."
hicks,Yeah.  I've noticed.
ripley,How do you feel?
gorman,"All right, I guess.  One hell of a hangover.  Look, Ripley... I..."
ripley,Forget it.
gorman,You still want to kill me?
vasquez, It won't be necessary.
ripley,"There, there.  Sssshh.  It's all right."
bishop," Now, if I did it right..."
female voice,Attention.  Attention.  Automatic fueling operations have begun. Please extinguish all smoking materials.
ripley," Newt.  Newt, wake up."
newt,Wah...?  Where are...?
ripley, Sssh.  Don't move.  We're in trouble.
ripley, Hey...hey!
ripley,Hicks!  Hicks!
hicks, He's at the up-link tower.
burke, Excellent.
newt,Mommy...mommmyyyyy...
newt,"Mommy...I mean, Ripley...I'm scared."
ripley,"I know, honey.  Me too."
hicks,"Vasquez, Hudson, meet me in medical!  We got a fire!"
hicks,The corner!  Ready?
hudson,Do it!
ripley, Burke...it was Burke.
hudson, I say we grease this rat-fuck son of a bitch right now!
hicks, I don't get it.  It doesn't make any Goddamn sense.
ripley,"He wanted an alien, only he couldn't get it back through quarantine.  But if we were impregnated ...whatever you call it...and then frozen for the trip back at just the right time...then nobody would know about the embryos we were carrying. We and Newt."
hicks,Wait a minute.  We'd know about it.
ripley,The only way it would work is if he sabotaged certain freezers on the trip back.  Then he could jettison the bodies and make up any story he liked.
hudson,"Fuuuck!  He's dead.  You're dogmeat, pal."
burke,This is total paranoid delusion. It's pitiful.
ripley," You know, Burke, I don't know which species is worse.  You don't see them screwing each other over for a fucking percentage."
hicks, No offense.
ripley,Just find someplace to lock him up until it's time to --
ripley,They cut the power.
hudson,"What do you mean, they cut the power?  How could they cut the power, man?  They're animals."
ripley,"Newt!  Stay close.  Let's get some trackers going. Come on, get moving.  Gorman, watch Burke."
ripley, Anything?
hudson,There's something.
hudson,It's inside the complex.
vasquez, You're just reading me.
hudson,No.  No!  It ain't you.  They're inside.  Inside the perimeter. They're in here.
ripley,"Hudson, stay cool.  Vasquez?"
vasquez, Hudson may be right.
hicks, It's game time.
ripley,"Get back here, both of you.  Fall back to Operations."
hudson,This signal's weird...must be some interference or something. There's movement all over the place...
ripley, Just get back here!
hudson,Movement!  Signal's clean.
hudson,Range twenty meters.
ripley, Seal the door.
hudson,Seventeen meters.
hicks,Let's get these things lit.
ripley,"They learned.  They cut the power and avoided the guns.  They must have found another way in, something we missed."
hicks,We didn't miss anything.
hudson,Fifteen meters.
ripley,"I don't know, an acid hole in a duct.  Something under the floors, not on the plans. I don't know!"
hudson,"Twelve meters.  Man, this is a big fucking signal.  Ten meters."
ripley,"They're right on us.  Vasquez, how you doing?"
hudson,Nine meters.  Eight.
ripley,Can't be.  That's inside the room!
hudson,It's readin' right.  Look!
hicks,Well you're not reading it right!
hudson,Six meters.  Five.  What the fu --
ripley,Medical!  Get to medical!
ripley,Burke!  Open the door!
newt,Look!
hudson, Let's go!  Let's go!
hicks,Fuckin' A!
hicks, Hold you fire!
ripley, Locked.
hicks,Stand back.
gorman,You can't use those in here!
vasquez,Right.  Fire in the hole!
hicks, Thanks a lot!  Now I can't hear shit.
vasquez, What?
newt,Come on!  This way.
ripley,Stay behind me.
newt,Come on.  Crawl faster.
ripley,DO you know how to get to the landing field from here?
newt,Sure.  Go left.
newt,Go right.
hicks," Bishop, you read me?  Come in, over."
bishop," Yes, I read you.  Not very well..."
bishop, The ship is on its way.  ETA about sixteen minutes.  I've got my hands full flying... the weather's come up a bit.
hicks,"All right, stand by there.  We're on out way.  Over."
ripley,Back.  Go back!
vasquez, Losing fuel.
vasquez," You always were an asshole, Gorman."
newt,"This way.  Come on, we're almost there!"
ripley,"Newt, wait!"
newt,Here!  Go up.
newt,Just up there --
newt,Riiiiipppleee --
ripley,Newt!
newt, Mommy...where are you?
newt, Moooommeeee...
ripley," Hicks, get down here.  I need that locator."
ripley, Newt!  Star wherever you are!
hicks,This way.  We're close...
newt,Here!  I'm here.  I'm here.
ripley,"Climb down, honey.  We have to cut through this grate."
ripley,Newt!  Newt!
ripley,No!  Noooo!
hicks, She's gone!  Let's go!
ripley,No!  No!  She's alive!  We have to --
hicks,All right!  She's alive.  I believe it.  But we gotta get moving!  Now!
ripley,"Come on, you can make it. Almost there."
ripley,HOW MUCH TIME?
bishop,PLENTY!  TWENTY-SIX MINUTES!
ripley,WE'RE NOT LEAVING!
bishop,Ripley...
ripley,She's alive.  They brought her here and you know it.
bishop,In seventeen minutes this place will be a cloud of vapor the size of Nebraska.
ripley,"Hicks, don't let him leave."
hicks, We ain't going anywhere.
ripley,"See you, Hicks."
hicks,Dwayne.  It's Dwayne.
ripley,Ellen.
hicks," Don't be long, Ellen."
voice,Attention.  Emergency.  All personnel must evacuate immediately.  You now have fourteen minutes to reach minimum safe distance.
burke,"Ripley...help me.  I can feel it...inside.  Oh, God...it's moving!  Oh gooood..."
ripley,Here.
voice,You now have eleven minutes to reach minimum safe distance.
newt, I knew you'd come.
ripley,"Newt, I want you to hang on, now.  Hang on tight."
voice,You now have two minutes to reach minimum safe distance.
ripley,BISHOP!
ripley, BISHOP!
ripley," Close your eyes, baby."
voice,You now have thirty seconds to reach...
ripley,"Punch it, Bishop!"
ripley,"It's okay, baby.  We made it.  It's over."
bishop,"I gave him a shot, for the pain. We'll need to get a stretcher to cart him up to medical."
bishop,I'm sorry if I gave you a scare but that platform was just becoming too unstable...
bishop,I had to circle and hope things didn't get too rough to take you off.
ripley,"You did okay, Bishop."
bishop,"Well, thanks, I --"
ripley, Go!
ripley,Here!
ripley,"Get away from her, you bitch!"
ripley, Come on!
bishop,Not bad for a human.
newt, Mommy...Mommy?
ripley,"Right here, baby.  Right here."
newt,Are we going to sleep now?
ripley,That's right.
newt,Can we dream?
ripley,"Yes, honey.  I think we both can."
