Speaker,Dialogue
david,"Excuse me, won't you?"
little boy, I don't know who you are.
little boy,Why would a thief want to give me two pounds?
david,Thank you.
mother,"Yes, love?"
little boy,"A naked, American man stole my balloons."
mother,What?
little boy,"A naked, American man -- the famous balloon thief."
david, A lot of weather we've been having lately.
alex,David!  Where on earth have you been!?!
david,I'm freezing.
david,"Alex, I've lost my mind.  I woke up at the zoo!  But you know what?  I feel terrific!"
alex,The zoo?
david,"Waking up at the zoo, that's not so insane.  Having no clothes on?  That's insane. What did I do last night, Alex?"
alex,Don't you remember?
david,I said goodbye to you.  I was locked out of the flat.  I climbed the wall and came in through the bathroom window. I started to read and then I was naked at the zoo!  I guess I am out of my fucking mind.
alex,I worried about you.  We didn't know where you were.
alex,Where did you get that coat?
alex,I'll get it.
alex,Hello?
alex,He doesn't remember.  He woke up at the zoo.
alex,"Yes, he is.  He's very excited and confused, but he's not crazy, if that's what you mean."
alex,"No, why?"
alex,"No, not really."
alex,"Yes, I should think so."
alex,"Yes, Doctor."
alex,He's fine.  We'll come right over.
alex,"No, a cab will be faster."
alex,The next corner we can get a cab.
david, I should be committed.
alex,Dr. Hirsch will know what to do.
david, I don't know why I feel so good.  I haven't felt this good in a long time.
david,"My body feels alive, alert.  I feel like an athlete."
alex,Get in.
alex,Saint Martin's Hospital.
driver,Right.
driver,"It's like the days of the Mad Barber of Fleet Street, isn't it?"
alex,I beg your pardon?
driver,The murders.
david, What murders?
driver,Last night.  Haven't you heard?  Six people in different parts of the city mutilated.  A real maniac this one.
david,Pull over.
alex,But....
david, Pull over.
david,Pay the man.
alex,"David, wait!"
alex,"David, what are you doing?"
david,"Six people mutilated?  It had to be me, Alex."
alex,"David, stop!"
david,I am going to the cops. There's a full moon tonight. Jack was right.  I....
alex, Jack is dead!
david,"Jack is dead.  Look, six people have been killed.  I'm going to the police."
alex,"David, please be rational. Let's go to Dr. Hirsch."
david,"Rational!?!  I'm a fucking werewolf, for Christ's sake!"
david,"Officer, I killed those people last night."
bobbie," You did, did you?"
alex,"He's playing a stupid joke, sir."
david, What?
alex,We had an argument.  He's being silly.
david," I swear, I don't know this girl."
bobbie,"All right, you two, move along."
david,"Hey, you asshole!  I want you to arrest me!"
bobbie,There's no call for that kind of language.
david, Queen Elizabeth is a man! Prince Charles is a faggot! Winston Churchill was full of shit!
bobbie, Now see here young man.
david,Shakespeare was French!  The Queen Mother sucks cocks in hell!  Shit!  Fuck!  Piss!
bobbie,That's quite enough!
alex," David, please!"
david,Who is this girl?
bobbie,You're going to have to stop this disturbance or I shall arrest you.
david," That's what I want you to do, you moron!"
alex," Sir, he's very upset.  His friend was killed and...."
david,Will you shut up!?!!
bobbie, That's enough!  Now go about your business.
alex,"Yes, David, let's go."
david, You're not going to arrest me?
david,"Don't you think he should arrest me? ONLOOKER Well, I'm not sure.  How does he know this isn't a prank?"
david, A prank?
alex, David....
bobbie,I've no time for this foolishness.  Nothing to look at.  Move along.
david,Hopeless.  It's hopeless.
alex," David, let's go now."
david,"Leave me alone, dammit!  You people are crazy!  I've got to get away from here!  I've got to do something!"
alex," David, don't lose control."
david, Control!?!  What control!?! Get away from me!
david,Leave me alone!
alex,"David, wait!"
alex,He tried to have himself arrested.  He....
alex,He wants help.  He....
alex, What shall we do?
david,"Yes, operator.  I'd like to call the United States and reverse the charges.  David Kessler for anyone.  Yes, I'll wait.  Hello?  Yes, area code 315/472-3402.  Thank you.  Hello?  Rachel?  Just say yes, you'll accept the charges. Just say yes, Rachel.  Is Mom or Dad home?  Where are they? Where's Max?  You're all alone?  Mom and Dad wouldn't leave me alone when I was ten. No, not ten and a half either. I'm still in London.  I'm all better.  Look, would you tell Mom and Dad that I love them? I don't care, Rachel, just do it for me.  Okay?  Good.  And, Rachel, don't fight with Max. Well, try.  Look, kid, please don't forget to tell Mom and Dad I love them.  I love Max and you, too.  Well, I do. No, I'm not being weird, you little creep.  You promise? Okay.  Be a good girl.  I love you.  Bye."
ticket lady,"Two and a half quid, please."
david,Will you take a traveler's check?
ticket lady,"No, sorry."
david,Keep the change.
ticket lady,"Well, thank you, sir!"
david,"Hi, Jack."
jack,"Hi, David."
david,"What can I say, Jack?"
jack,You don't have to say anything.
david,"Aren't you going to say, `I told you so'?"
jack,"If I was still alive, I probably would."
david,You look awful.
jack,Thank you.
david, I didn't mean it.  I don't know what I'm saying.  I'm not even sure it was me who killed those people.  I don't remember doing it.
jack,What about the zoo?
david,"Well, even if I'm not the wolfman, I am crazy enough to do something like that.  I mean, here I sit in Leicester Square talking to a corpse. I'm glad to see you, Jack."
jack,I want you to meet some people.
jack,"David Kessler, this is Gerald Bringsly."
david,Hello.
jack,Gerald is the man you murdered in the subway.  We thought it best you didn't see him as he's a fresh kill and still pretty messy.
bringsly," Yes, I do look most unpleasant."
david," Why are you doing this to me, Jack?"
bringsly,"This isn't Mr. Goodman's idea. He is your good friend, whereas I am a victim of your carnivorous lunar activities."
david," Mr. Bringsly, I'm sorry.  I have absolutely no idea what to say to you."
bringsly,You've left my wife a widow and my children fatherless. And I understand that I am to walk the earth one of the living dead until the wolf's bloodline is severed and the curse lifted.
bringsly,"You must die, David Kessler."
jack,"David, this is Harry Berman and his fiancee Judith Browns."
jack,"And these gentlemen are Alf, Ted, and Joseph."
david, What shall I do?
jack,Suicide.
harry, You must take your own life!
david,That's easy for you to say - you're already dead.
bringsly,"No, David.  Harry and I and everyone you murder are not dead.  The undead."
david, Why are you doing this to me?
jack,Because this must be stopped.
david,How shall I do it?
judith,Sleeping pills?
david,I could hang myself.
jack,"If you did it wrong, it would be painful.  You'd choke to death."
jack,Do you mind?  The man's a friend of mine.
bringsly,"Gentlemen, please."
harry,A gun.
david,Don't I need a silver bullet or something?
jack,"Be serious, would you?"
david,Madness.  I've gone totally mad.
harry,A gun is good.
judith,You just put the gun to your forehead and pull the trigger.
bringsly,"If you put it in your mouth, then you'd be sure not to miss."
david,"Thank you, you're all so thoughtful."
david, Go away!  Please!  Go away!
david, Run!  Please...run.
ticket lady,"It's horrible, horrible! There's a beast!  A mad dog! It's killing people in there!"
alex,David?
cop,"It's some kind of animal, sir. We.... Suddenly the doors splinter apart and there stands the Wolf, eyes blazing.  It leaps on Lt. Villiers, savaging him.  The crowd falls back in panic."
alex,David!  It's David!
alex,Let me through!
cop,"Stand clear, miss!"
alex,I must get through!
alex,"David?  Is it you?  Is it true, David?"
alex,David?
officer,Fire!
