Speaker,Dialogue
blade,-----
senior resident,Intubate her!
resident,Blood-pressure's forty and falling --
senior resident,"Jesus, her water's broken --  She's going into uterine contractions --"
dennis,So where we going?
raquel,It's a surprise.
dennis,I likes surprises.
raquel,"What do you have down there, little man?"
dennis,Heat-seeker.
raquel,I'll bet.
dennis,What the fuck are we doing here?
dennis," Fuck, I need a drink!!!"
raquel,"What's wrong, baby?"
blade,Where is Deacon Frost?
blade,Got something in your throat.
quinn,"Fuck you, Day-walker, I ain't saying shit --"
blade,Frost.
quinn,"You won't stop him, Blade. The Tide's rising, the Sleeper's gonna --"
dennis,Please don't --
assistant,"Brought you a baked potato, nice and crispy. Still warm, too."
curtis,"Jesus, that's rank --"
curtis,What's his story?
assistant,Paramedics said he was still screaming when they found him. Looks like some joker had stapled him to a wall.
curtis,Pretty.
karen,You took this off a DOA?
karen,This isn't human blood.
curtis,Then what is it?
karen,I don't know --  Look at this blood smear --
karen,"The red blood cells are biconvex, which is theoretically impossible. They're hypochromic, there's virtually no hemoglobin in them.  Look at the PMNs, they're binucleated, they should be mononucleated."
curtis,What about the chemistry panel?
julie,"Blood sugar level is three times the norm, phosphorous and uric acid are off the scales.  Like the woman said, impossible."
karen,"Curtis, it's three in the morning. I'm really not in the mood for one of your practical jokes."
curtis," It's not a joke. I've got the stiff sitting in the morgue right now -- look, just come up and see him, okay? Five minutes, that's all I ask."
karen,I thought you promised to give me some distance?
curtis,"This is purely professional curiosity, Karen, I swear."
karen,"Five minutes, not a second more. And I don't want to hear a word about ""us""."
curtis,No problem.
karen,You haven't started in on the internal organs?
curtis,That's weird --
karen,What?
curtis,"He looks different now, burns are less extreme, some of these wounds have closed up --"
curtis,"Tell me something, honestly, you ever have second thoughts about us?"
karen, Sometimes --
karen,-- but then I remember what an ass-hole you were and I'm snapped back to reality.
curtis,"Jesus, Karen, you're breaking my heart here --"
quinn, -- more -- blood --
blade,Now don't we look dapper?
karen, My shoulder -- dislocated --
blade,Whistler!
blade,She's been bitten.
whistler,"You should've killed her, then."
blade,She hasn't turned yet.  You can help her.
whistler,"No promises. You watch her close. She starts to turn, you finish her off."
whistler,Localized necrosis. She's borderline. Another hour and she'd be well into the change.
whistler,"Can you hear me, woman?"
karen,What -- ?
whistler,"You've been bitten by a vampire. We've got to try and burn out the venom, just like a rattlesnake bite --"
whistler,Hold her.
whistler," ""Dr. Karen Jansen"". Listen close, I'm going to inject you with an antidote made from allium setivum -- garlic. This is going to hurt. A lot."
frost,The Day Walker represents a unique opportunity. We'd be fools to waste it by killing him.
dragonetti," Deacon Frost. You refuse to speak our language, you insult the House of Erebus by using the humans' gutter-tongue, have you no respect for tradition?"
frost,Why should I respect something which has outlived its purpose?
dragonetti," I see. And what would you have us do with this ""half-breed""?"
frost,Study him. Unlock the secrets of his DNA. He's the key we've been looking for.
dragonetti,He is an abomination!
frost,Why should we spend our lives cringing from the daylight when his blood offers us an alternative? Enough talk. It's time we stepped out of the shadows!
pallintine,"You're out of line, Frost."
frost,Am I? Or am I just the first to say out loud what we've all been thinking?
dragonetti,"The shadows suit us, Frost. We've existed this way for thousands of years. Who are you to challenge our ways?"
frost,"Someone who's sick of living off scraps. The coming age belongs to us, not the humans!  When the final war between our races comes, who do you want leading the charge?"
frost,Some withered up fossil ready to snap like a brittle bone at the first sign of change?
dragonetti,Get out!!!
frost,"Careful, old fang. You might wake up one day and find yourself extinct."
blade," Just do it, old man."
blade,You shouldn't be here.
karen,"I'm sorry, I --"
karen,Who are you people?
whistler,My name is Abraham Whistler.  This is Blade. As for our little homunculus here --
blade,-- he's a vampire.
karen,You're joking --
whistler,Not at all. You're looking at a prime specimen of the homines nocturna.
whistler,"If Blade hadn't brought you here, you would've wound up like him."
karen,Why did you help me?
blade,Stupidity.
whistler," Maybe not. I did some checking, she's a hematologist. Knowledge like that might come in handy."
blade,It's not worth the risk. We can't trust her.
karen,Why?
blade,Because you're tainted. The venom's still inside you. You could still turn on us.
karen,What happens then?
blade,"Then I have to take you out, just like any other bloodsucker."
blade,"We hunt them, moving from one city to the next, tracking their migrations. They're hard to kill. They tend to regenerate."
karen," So what do you use, then? A stake?"
whistler," Some of the old wives' tales are true -- they're severely allergic to silver, various types of wood. Feed them garlic and they'll go into anaphylactic shock --"
whistler,"-- and of course there's always sunlight, ultra-violet rays."
karen,And you honestly expect me to believe all this?
blade,"I don't care what you believe. I saved your life once, I don't plan on making a habit of it. You want my advice, you'll be out of the city by nightfall. If you're stupid enough to stay, that's your business."
karen,"I can't just leave. I have a life here, a career --"
whistler,"There's a war going on out there. Blade, myself, a few others -- we've tried to keep it from spilling over onto the streets.  Sometimes people like yourself get caught in the cross-fire."
karen,I can go to the police. I have blood samples back at the hospital. I can show them.
blade,Do it. You'll be dead before you can file the complaint.
karen,That's ridiculous! No one's that powerful.
blade,Get in. Youre leaving.
whistler,Wait.
whistler,"Consider it a parting gift. Vampire mace -- silver nitrate, essence of garlic."
karen, So that's it? You guys just patch me up and send me on my way?
whistler,"There is one other thing. I'd buy yourself a gun if I were you. If you start becoming sensitive to the daylight, if you start becoming thirsty regardless of much you've had to drink -- then I suggest you take that gun and use it on yourself. Better that, than the alternative."
dragonetti, These archives are restricted to members of the House of Erebus.
frost,"Please. You and the other Elders wouldn't know what to do with these texts if your lives depended on it.  Which, of course, they do."
dragonetti,"You're wasting your time, Frost. Far greater scholars than you have tried to decipher these words. Whatever secrets they hold have been lost."
frost,Perhaps.
dragonetti,"What are you up to, Frost?"
frost's voice,"Wouldn't you like to know, Old Fang?"
blade,Remember what we said. Keep your eyes open. They're everywhere.
karen,I need the police. This is an emergency --
karen,"Hello? My name is Karen Jansen, I was with Curtis Webb at Mid-Town Hospital last night -- that's right, I witnessed the attack --  115 Aurora, apartment 3G. Yes, I'll wait here. Please hurry."
karen,"Get a grip on yourself, girl."
karen,Who is it?
gideon,Sergeant Gideon. I'm responding to a 911 call.
karen,"Yes, that was me, I'm Karen Jansen --"
gideon,"Are you all right?  I'm glad you called, Ms. Jansen, we've been anxious to get a hold of you. You disappeared on us for a while."
karen,"I know. Listen -- do you have any idea what happened to Curtis, the other doctor?"
gideon," Oh, he's dead. But I wouldn't worry about that if I were you."
karen, Why?
gideon,Because you're dead too.
gideon,Garlic?
karen,He said it would work against vampires --
gideon,Who said I was a vampire?
gideon,Thanks for the laugh. You can shut your eyes if you want to.
blade,You okay?
karen,How did you know?
blade,Figured they'd send someone after you. Thought I'd wait around and see who showed up.
karen,You used me as bait?!
blade,"It worked, didn't it?"
karen,"But, he could've --"
blade,He didn't. Get over it.
karen,But he's a policeman --
blade,He's a familiar. A human who works for the vampires. See this mark?
blade,"That's a glyph, kind of like a vampire cattle brand. That means Officer Friendly here is someone's property. Any of the other vampire's try to bleed him, they'll have to answer to Friendly's owner --  This glyph belongs to Deacon Frost. We've been tracking him for a while now --"
karen,Why in God's name would anyone want to work for them?
blade,"Because they're vampire wanna-bes. If they're loyal, if they prove themselves, then their masters will turn them."
karen,And that's a good thing?
blade,"For some. Live forever, never get old. The ultimate high."
blade,"How 'bout you, Officer? You a good little bloodhound?"
blade,Looks like our friend was blood-running.  Where were you headed?
gideon,Mphuck you --
gideon,Jesus -- 1227 Brookner -- Holliston Clinic --
karen,What are you doing?!
blade,Preventive medicine.
karen,"You can't do this, he's human, it's murder."
blade,"It's war, now get the fuck out of the way!"
blade,God-damnit!!! Do you have any idea what you just did?! He'll warn them. They'll be waiting!
karen,You were going to kill him. What was I supposed to do?! Shut my eyes and pretend I didn't see what I saw?
blade,"Let me set you straight on something, Doctor. What you've ""seen"" so far is nothing. The world you live in's just the sugar-coated topping. There's another world beneath it, the real world -- and it's a fucking bloodbath. If you want to survive in it, you'd better pull your head out of your ass."
gideon,"Look, I know you're disappointed --"
frost,Crestfallen.
gideon,Blade was waiting for me. There wasn't anything I could do.
frost,"Tell me something, Gideon, what blood type are you?"
gideon,I don't really know --
frost,"Take a wild stab. A? B? O, perhaps? I'm interested in the antigens here, the agglutination reaction --"
frost,I'm going to guess AB positive.
frost,AB positive. Give the man a prize.
blade,What the hell are you doing?! I could have killed you!
karen,I remembered the address. I followed you --
blade,Do you have a death wish or are you just stupid?
karen,"Look, if what you say is true, if there's a chance I could turn into one of them, then I've got no choice, do I? I have to work with you. I need to learn everything I can about them. It's the only way I'll be able to find a cure for myself."
blade,There is no cure.
karen, You don't know that.
karen,What are you looking at?
blade, What do you see here?
karen,Graffiti --
blade,Look closer.
blade,"This isn't a gang tag, it's a vampire marking. It means there's a safe-house nearby. A place they can go if dawn is coming."
karen, I know this place -- it's a blood bank.
blade,"Owned by vampires. There's one of these in every major city, and just like Domino's, they always deliver.  You telling me you're ready to walk through that door?"
blade,"All right, then, listen up, Vampire Anatomy 101. Crosses and running water don't do dick, so forget what you've seen in the movies."
blade,"You use the stake, silver, or sunlight, got it?"
blade,Know how to use one of these?
karen,No.
blade,"Safety's off, round's already chambered --  Silver hollow-points filled with garlic. You aim for the heart or the head, anything else is a one-way ticket to a pine box."
blade,Get out. Now.
blade,I know you're blood-running. Who's your sponsor?
tanaka,I don't know what you're --
karen,What if you've made a mistake?
blade,What's this? A birthmark?
blade, How much are you shipping?
tanaka,Bite me!
blade,I've got a message for your masters -- the night's no longer safe for their kind.
karen,"You let him go --  An hour ago you were ready to kill a man for less, this one didn't even talk."
blade,He will.
automated voice," ""You've reached a number that is no longer in service. Please consult your operator and try again""."
tanaka's voice," It's Tanaka, PIN number sixteen-zero-zero-nine --"
voice, Yes?
tanaka,Get me Pearl!
voice, Pearl is feeding --
tanaka,"Look, I'm not fucking around here! That hunter Frost has been talking about? He was just at the clinic. Tore the goddamn place apart!"
blade,Looks like we hit pay-dirt. This place is crawling with them.  See the valets over there? They're vampires. So is the doorman.
karen,How can you tell?
blade,"The way they move, they way they smell --"
blade,"The whore on the corner, she's one too. So are the two men standing under the streetlight."
karen,So many of them -- I still can't believe they're real.
blade,There are worse things than vampires out there.
karen,Like what?
blade, Like me.
doorman,"I'm sorry, sir -- do you have an invitation?"
kid,Hey --
blade,Where's the entrance?!
tanaka,I can't -- they'll kill me!
blade,"I got news for you, butt-boy. You're already dead."
tanaka," Oh God, shit -- behind the bookcase --"
blade,After you.
karen,What is this place?
blade,Some kind of archive --
karen,Isn't this all a little high-tech? I thought vampires were more into cobwebs and coffins.
blade,"You've been watching too much TV. They've got their claws sunk into everything -- finance, real estate, politics. Probably own half of Downtown."
blade,This must be where they keep their records --
pearl's voice," Lorca, is that you?"
pearl, He's here!
frost's voice," Congratulations, Day-Walker."
blade,Frost?
frost,"In the flesh, Blade. I understand you've been looking for me. I'm flattered."
blade," Don't be. You're another notch on my sword hilt, nothing else."
frost,"You're quick, Blade, I'll give you that. In the space of an hour you've crossed my familiar, destroyed a blood bank --  Now here you are in the heart of our archives, terrorizing our curator."
pearl's voice,"He has a knife to my throat, Frost! He --"
frost," Round one to you, Blade."
pearl,What is that?
blade,"A sun lamp. We're gonna play twenty questions. Depending on your answers, you might get to have yourself a tanning session."
blade,What were you in such a big hurry to delete just now?
pearl," It's an epistle, a letter Frost has been translating -- it prophesizes LaMagra's return."
blade,And who is LaMagra?
pearl,LaMagra is The Sleeper!!!
blade,"Where's the original, Pearl? You must have it around here somewhere."
pearl,The vault --
blade,"If he moves, cook him."
pearl,"Please, I'll give you the combination -- you'll damage the documents --"
blade,That's the point.
karen,He moved.
karen,What are these?
quinn," Hola, amigo. Remember me?"
quinn,"You took my arm, Blade. But that's okay, I'm growing a new one --"
quinn,"Nice, huh? Think I'll ever play the piano again?  You can slice him, you can dice him, and the man just keeps on coming."
quinn,"Stay with me, sweetness, I'm not through with you yet."
quinn,"Teak. Nice craftsmanship.  Which reminds me, Blade, think I owe you one --"
quinn,"Actually, if you want to get technical, I owe you two."
quinn,"What's so funny, bright eyes?"
blade,I'm expecting some company.
voice, Get down!
whistler,"Christ, I'm too old for this. Somebody get me a goddamn wheelchair."
karen,How did you find us?!
whistler,We keep in radio contact.
karen, You've been listening in the whole time?
whistler,"You think I'd let him run loose without a chaperone? Blade ferrets their rat-holes out, I map them. Then we blow them all to kingdom come."
whistler,There's a subway line due East of here. We'd best make tracks.
karen,Whistler!
whistler,"Go on, I'll be fine!"
blade,He can take care of himself! GO!!!
karen,You're hurt --
blade,Nothing that won't heal by dawn.
blade, I need help with this --
karen,What am I injecting you with?
blade, Serum -- it's a human hemoglobin substitute.
karen,"You're one of them, aren't you?"
blade,"Not quite. I'm a hybrid. Half-human, half-vampire."
whistler,What took you so long?
blade,"Don't even start, old man."
karen,Why didn't you tell me the truth about him?
whistler,We weren't sure we could trust you.
whistler,"Blade's mother was attacked by a vampire while she was pregnant. Ultimately, she died, but her unborn child lived. Unfortunately, he'd undergone certain genetic changes while in the womb --"
whistler,"I found Blade when he was thirteen. He'd been living on the streets, feeding off the homeless. Apparently the Thirst manifested itself at puberty --  I took him for one of them at first, almost killed him, too. But then I realized what he was."
quinn,He took my fucking hand! Again!
frost,"You seem to be in the habit of losing them fairly often, Quinn. Maybe the amputee lifestyle just suits you."
quinn,"We need to find him, tonight."
frost,"Down, boy. Blade's not going anywhere. I promise. Right now, though, we've more pressing business --  It's time Dragonetti paid the piper."
whistler,"Blade's unique, you know. A one in a billion anomaly. He can withstand sunlight, garlic, even silver. But he still has the Thirst."
karen,What happens if he doesn't take the serum?
whistler,"The Thirst overcomes him, just like the others. It's not something he can control.  The problem is, time's running out. His body's starting to reject the serum. And so far, all my efforts to find a cure have ended in failure --"
karen,"No offense, Whistler, but you're not exactly working with state of the art equipment here. You might have missed something."
whistler, Which is why you're here. We could use someone with your experience.
whistler,"This used to be mine, you know. It's been passed down through the centuries, from one hunter to the next --"
karen,Why do you hunt them?
whistler,"Habit, mostly, just like this."
whistler,"I had a family once -- a wife, three daughters. Then a drifter named Deacon Frost came calling one evening --"
karen,He killed them?
whistler,"Eventually. He toyed with them first. He made me choose, do you understand? Which order they would die in --"
karen,How did you escape?
whistler,I didn't. He was cruel enough to let me live.  Even gave me a souvenir to remember him by.
karen,And now you're using Blade to exact your revenge?
whistler," Frost's bodycount keeps rising, and I'm not getting any younger, am I?"
whistler,I wouldn't go in there if I were you. It's best to leave him alone when he's like this.
karen,I'll take my chances.
karen,Blade?
karen,It's dark in here.
blade,You get used to the darkness.
karen,Whistler told me about your mother.
blade,I can't close my eyes without hearing her scream.
karen,Those aren't real memories. No one has that kind of recall.
blade,"I do. I remember from day one. People staring at me, sensing I was different. Watching the fear grow in their eyes, knowing in their hearts I wasn't human."
karen,"If you're not human, then why do you bleed like us? I've seen vampire blood, you don't have it running through your veins."
blade,Just get out of here.
karen,Blade --
blade,"I said, GET OUT!!!"
frost's voice,"Rise and shine, little wing."
dragonetti, What is this? Where am I?!
frost,"When was the last time you stopped to appreciate a sunrise, Dragonetti? Three, four hundred years?"
frost,How do you like that? Right on time.
dragonetti, The other elders will never let you get away with this!
dragonetti," Don't you see, you fools?! He'll betray you too! He's planning on invoking LaMagra himself!"
frost,"The wheel turns, old fang. Guess you just got a little too long in the tooth."
frost,Dragonetti was right. You were fools to trust me.
whistler,Going somewhere?
blade,China Town. I need more serum.  What's all this?
karen,"I made a trip to the hospital last night, borrowed some equipment."
blade, For your miracle cure?
whistler,"She's been making real progress, Blade.  Show him --"
karen,"This is sodium citrate. It's an anti-coagulant. We use it to treat blood-clots sometimes. Vampire blood is thinner than humans, though. Watch what happens when I introduce some into a sample --"
whistler,Can you imagine what a dash of that would do on your sword?
karen,"Before you go, I'd like to take a sample of your blood."
karen,Is he sick?
blade,Cancer.
karen,"You care about him, don't you?"
blade,"We've got a good arrangement, that's all. Whistler makes the weapons, I use them, the vampires die -- end of story."
karen, My mother used to say that a cold heart is a dead heart.
blade,Your mother sounds like a Hallmark greeting card.
blade,"I'd wish you luck, Doc, but I never put much stock in optimism."
blade,"How's it going, Kam?"
kam, You're a week early.
blade,I was in the neighborhood.
blade,Whistler says I'm building up a resistance to it.
kam,I was afraid that might happen.
blade,Maybe it's time to start exploring other alternatives.
kam,There's only one alternative to the serum.
blade,Yeah. I know.
blade,"Thanks, Kam.  One other thing. Have you ever heard of a vampire called the Sleeper?"
blade,I found this in there archives. I need to find someone who can read their language.
kam,"I've heard about a woman named Miracia. Some say she's a mayombero, a Santeria witch. Supposedly she lives in that tent community down by the city dump. I'm told she only sees people at night."
man,"Afternoon, Blade."
frost,Easy.
frost,"Wouldn't want our little friend here to wind up on the back of a milk carton, would we?"
frost,"Beautiful day, isn't it?"
blade, How can you be out here?
frost,"I dabble in pharmaceuticals, medical research. We've developed a type of sun-blocker using octyl salicylate, a few others things."
frost,"It's not very effective in direct sunlight, but it's a start. The goal, of course, is to be like you, ""the Day-walker""."
blade,I don't buy it.
frost,"Why not? The future of our race runs through your bloodstream. You've got the best of both worlds, Blade. All of our strengths and none of our weaknesses."
blade,Maybe I don't see it that way.
frost,"Oh, so it's back to pretending we're human again, is it? Spare me the Uncle Tom routine. You can't keep denying what you are. You're one of us, Blade. You always have been."
blade,You're wrong.
frost,Am I? You think the humans will ever accept a half-breed like you? They can't. They're afraid of you.  The humans fear us because we're superior. They fear us because in their hearts they know their race has become obsolete.
frost,"Look at them, just an endless stream of cattle in a mad race to the slaughterhouse."
frost,"The pause that refreshes --  Care for some? Smells good, doesn't it? Pungent, with just an irrepressible hint of iron."
blade,Pass.
frost,You sure now? I bled a newborn for this. You won't find a drink that's sweeter.
frost,"Tell me honestly, do you really get the same rush from that pasteurized piss-serum of yours?  You're surprised I know about your serum? You shouldn't be. I know everything about you."
frost,"You can't keep walking the razor's edge, Blade. The day will come -- and soon, when you'll have to choose between our kind and their's. If I were you, I'd take care not to wind up on the wrong end of the fang."
frost,"Love to continue this chat, but it appears I'm melting."
blade,You're not going anywhere.
frost, Watch me.
mercury, This is Mercury. Tell Deacon I've found their hiding place.
blade,Any progress?
karen,Some. It's been slow --
blade,You don't look so good.
karen,"I'm just tired, that's all. We've been up all night."
karen,Excuse me.
blade,You've got another day or two at most.
blade,"For what it's worth, I'm sorry."
karen,You make it sound like I'm already dead.
man,Extranjero. Quien es?
blade,I'm here to see Miracia. Kam sent me.
woman,This way.
karen,"All right, let's start with the basics -- why do vampires need to drink blood?"
whistler,Their own blood can't sustain hemoglobin.
karen,"Then vampirism is a genetic defect, just like Hemolytic anemia?"
karen,So what about gene therapy?
karen,"Basically you'd have to re-write the victim's DNA, alter it so that the DNA will produce proteins capable of generating hemoglobin."
whistler,How?
karen,"With a retrovirus. It's injected into the bone marrow cells, it causes the host's DNA to mutate. They've been using them to treat Sickle-cell anemia."
whistler,You're serious? You actually think this could work?
karen,"On me, yes. On Blade, I'm not so sure --  The problem is, Blade didn't contract the vampire virus from a bite like I did. He was born with it. The irony is, I could probably cure every vampire but him."
whistler,"Then we're back to square one, aren't we? Sooner or later, the Thirst always wins."
karen,What happened to the power?
whistler," I don't know, but the back-up generator should've kicked in."
whistler,UV floodlights are down too.
whistler,Get it!!!
whistler,"Understand this -- they are monsters. Hesitate for even a moment, and you've lost."
frost,"It's been a long time, hasn't it, ""old friend""?"
miracia,"Is something wrong, my friend?"
blade,You're blind --
miracia,There are other ways to see. Sit.
miracia,Perhaps you have brought me something -- an offering for the orishas?
miracia,Hold out your hands.
blade,I didn't come here to get my palms read. I need something translated.
miracia,Show me.
miracia,Sangre. Written in blood.
miracia,"This is an old tongue, from an old world. It concerns LaMagra."
blade,Who is LaMagra?
miracia,The vampire God. This speaks of His return.
miracia,"""-- there will come a Day Walker.""  ""His blood will call the Sleeper from beyond the Veil of Tears."""
blade,His blood -- ?
