Speaker,Dialogue
miracia,"The Day Walker's blood is a disparador -- a trigger, you see? For LaMagra's return. One need only consume it and the spirit of his ancestors will settle upon him.  ""And the Sleeper will rise from the shadows anew, cleansing the world in a Tide of Blood."""
blade," ""The Blood Tide""."
miracia, Yes. The vampire apocalypse. It is said that all who feel its taint will succumb to the Thirst.
blade,How do I stop it?
miracia,"The Great Wheel turns, my friend. The Dark is rising. How would you fight a shadow?"
miracia,I am tired. Dawn is coming.
blade,But I just got here --
miracia,You've been here longer than you think.
blade,WHISTLER?!
blade,"Jesus, Whistler, what did they do to you?"
whistler,Frost took her --
blade,Don't try to talk --
whistler,Listen. You have to -- finish me off. You don't want me coming back.
blade,"No, we can treat the wounds --"
whistler,"Too far gone, you know that."
blade,"Whistler, I can't."
whistler,Yes you can. Now get on with it.
blade,"Whistler, I --"
whistler," Just be quick about it, will you? Do it right."
frost,"Hello, Blade. By the time you watch this, Whistler will no doubt be winging his way to Heaven, thanks to your capable hands. If it makes any difference to you, he put up quite a fight."
frost,"Now, I'm sure you're wondering about Ms. Jansen's well-being. She's alive and kicking -- ""ambulatory"", as they like to say in the trade. Whether or not she remains so is entirely up to you.  I'll make this as easy as possible for you, Blade. You can find us at the Edgewood Towers. We'll be waiting with baited breath."
frost,"Well, here we are, Doctor."
karen,Why haven't you killed me yet?
mercury,Deacon likes to play with his food before he eats it.
karen,How many of you are there?
frost,"A few thousand scattered about the globe. In the past, we've had to restrict our numbers for fear of discovery. That won't be necessary after tonight."
karen,What happens then?
frost,"The Blood Tide. Our long-prophesied holy war against the humans. There's a force, you see -- a spirit that exists in our blood. I've discovered a way to invoke it."
karen,LaMagra --
frost,"That's right. The answers were there all along, of course, scribbled down in the forgotten languages of my kind. Waiting for someone with the patience to decipher them. My elders were foolish enough to dismiss them as wives tales. But I knew better.  Imagine my surprise when Blade turned out to be the key which would set that force free."
frost,"LaMagra isn't a physical being. He's a spirit, requiring a flesh and blood host in order to manifest himself."
karen,You.
frost,Who better to usher in the Blood Tide?
karen,There's no need for any of this. Your condition can be treated. Whistler and I were working on a cure when --
frost,"What makes you think we want to be cured? Blood is only part of the equation. The hunt, the killing, that's what the Thirst is really about."
karen,But you use blood banks --
frost,"Only as a last resort. Preserved blood is inferior. There's no flavor left to it, no life.  Fortunately, I've found a way around that particular obstacle."
frost,"Under these conditions I can keep a donor alive for years, producing anywhere from fifty to a hundred pints of blood.  Of course, this is just a pilot program, really. Once the Tide comes, we'll need to expand production. So many more mouths to feed --"
karen,You're a monster.
frost,"Why? Because we live at another species' expense? Your people farm cattle and veal, don't they? Fattening them up with steroids? It's called evolution, Doctor. Survival of the fittest."
frost,I have a wake-up call for the human race. You're no longer at the top of the food chain.
vampire,You think I'm afraid of that toothpick of yours?
blade,You should be. I've made some improvements.
vanessa,Jason.
blade,Mother -- ?!
vanessa,"I've missed you so much, Jason.  You have no idea what I've been through, how much I've wanted to see you --"
blade,But you -- died --
vanessa, Deacon brought me back.
blade,Fight him --
frost,"She can't. She's one of my thralls now. She has about as much free will as a puppet on a string.  You love me, don't you, Vanessa?"
vanessa,Yes.
frost,What do we have here? Your precious serum? I don't think you'll be needing this anymore.
blade,Please --
vanessa,"Listen to your father, Jason. It's going to be a better world."
frost,"Don't look so surprised, Blade. You've spent your life looking for the vampire who fathered you. Well you can rest easy now, you've found him.  Daddy's here."
frost,"It's true, Blade. You've got my blood running through your veins.  Thirty years ago. A moonlit street, a woman on her way home alone. You were conceived the night I tore my fangs into your mother's flesh."
karen,Are you all right?
blade, I've been better --
blade,How long have we been driving?
karen, I don't know. I woke up just before you did --
karen,Is it bad?
blade," We get out of this alive, maybe I'll take that miracle cure of yours."
karen, It won't work on you.
blade,What are you talking about?
karen,"Your condition's congenital, the genetic mutations occurred in utero. All the other victims contracted vampirism after birth."
karen,"I can't cure you, Blade. I can cure myself, but I can't cure you.  I'm so sorry."
frost,"Welcome home, children."
frost,"On its surface, this building houses one of the city's oldest financial institutions -- and for over two-hundred years its served our corporate needs. Look beneath the surface, however, and you'll discover another truth entirely --"
frost,"As above, so below."
frost,"Welcome to our hall of ancients, Doctor. We call it the Temple of Night."
frost,Let's see this sword of his.
frost,"Still quite sharp, I see."
karen,Blade --
frost,"You're wasting your breath, woman. He can't hear you now. It's the Thirst, you see? It already has him in its grip."
frost,How long has it been since you had your serum? Twelve hours? More? You must be quite thirsty by now.
frost,"What does it feel like? Is your blood on fire? Are you burning up inside? Give in to the Thirst, Blade. Embrace your true nature."
blade,-- go to hell --
frost,"I've got news for you, Blade. We're already here."
frost,Take him to the sanctuary. It's time he was bled.
frost,"I'd let you watch the proceedings, Doctor, but I'm afraid that privilege is reserved for members of my own race. Don't worry, though, I've made alternate arrangements for you."
frost,"We call this the Bone Pit. It's where we keep our mistakes, the ones who couldn't successfully make the transition from human to vampire."
frost,"They'll feed on anything, given the chance -- animals, corpses, even other vampires."
frost,"Of course, a strapping young woman like yourself -- well I think you just might be considered finger food."
frost,"It's been a long road, hasn't it? Such a pity Whistler led you so far astray."
frost,"I don't blame you, though. I want you to know that. Even after all you've done. I understand, Blade, I really do. It's the human side of you which has corrupted your reasoning, made you weak. But we'll take care of that, won't we?"
blade,I'd kill myself -- before I turned into something like you.
frost,"No you wouldn't. I'm going to bleed you dry, Blade. All the poison that makes you human.  When the Tide comes, you'll be begging me put you through the Change."
frost,It's done. We should ready ourselves for the ritual of invocation.
blade,How could you be a part of this?
vanessa,These are my people now. I'm one of them.
blade,You don't have to be.
vanessa,"You don't understand. I've killed, I've hunted, and I've enjoyed it."
vanessa,I wish you could see the world as I do. Deacon opened my eyes. There's no turning back from that.
blade,I don't believe that.
vanessa,"You will. Time is on our side. Sooner or later, the Thirst always wins."
blade,Mother!
vanessa,Your mother died the night you were born.
revenant,Karreennnnnn. I never thought I'd see you againnnnn.
karen,Curtis?!
curtis revenant,"Tell, me, Karennn -- ever have second thoughts -- about us?"
mercury,"It won't be long now, lover."
quinn,We should finish him off.
mercury, No. Deacon wants him turned.
quinn,"Fucking waste, if you ask me."
frost,"Tonight is the night we've waited our entire lives for. Tonight, the blood-dimmed Tide is loosed upon the world. Tonight, the Age of Man comes to an end."
karen, Blade.
frost," ""And what rough beast, its hour come round at last, slouches towards Bethlehem to be born?"""
blade,Get out of here --
karen,I'm not leaving without you.
blade,You don't understand. The Thirst --
blade, -- tearing me -- apart.
karen,I know. Take some of my blood.
blade,No --
karen,It's the only way. You know that. We'll never get out of here alive if you don't.
blade,I can't -- I won't be able to stop --
karen,Yes you will. The human side of you is stronger. I know it is.
blade,NO!!!!
karen,Don't stop --
karen,My God --
karen, Are you -- all right?
blade, Never been better.
mercury,Deacon?
frost,No longer.
blade,Who dies first?
frost, Take him.
quinn,Grew another hand for you sweetmeat --  -- and now I'm gonna kill you with it.
blade,Let's see if you can grow a new one of these!
blade,Next?
mercury,Have a taste of your own medicine!
frost,"You're too late, Blade. I'm already changing. Don't you see? The Sleeper has awakened. I'm not just Frost anymore. I'm becoming a god now, blood incarnate."
vanessa,"Did you think I'd forgotten you, you little whore?"
frost,You can't hurt me anymore.
blade,Where are you?!
frost,Everywhere.
frost,You want my blood so much?! Take it!
frost,"I was wrong about you, Blade. You were never one of us. You're a traitor to your race."
karen,Blade!
blade,Guess you're not quite as invulnerable as you thought.
frost,"You're wrong -- a few minutes more, and my transition will be complete. Even your sword won't be able to affect me then."
blade,"You don't have a few minutes, Frost."
frost, Just as I thought. Still chained to your mother's breast after all these years.
frost," You're too human, Blade."
blade, It's because I'm human that I can do this.
karen,"I never imagined I'd be so happy to see the sun rise --  It's over, isn't it?"
blade,For them. But for me --
blade,I feel like it's finally beginning.
