Speaker,Dialogue
3,"I think your fire is out A: I think Dad . . . I'm sorry. I need a woman, Dad. I'm going out and find a woman, Dad- F. startled, very distant, slowly wondering aloud:"
4,"first,     group        of   friends        following       dressed    in    fancy    threads ready    to      go someplace. ITother, looking at                 in elevator, at first unable A.                                                    to"
"a dylan-type, freaky hair",4.                              opening. Elevator and corduroys and knee-high boots  is leaning up against the side of the elevator in same pose as A's as elevator opens.                          Looks at the party of people     wth        cold   blue     eyes.      Goes       in    elevator   after    last has     left.
5,A .:        No. !I. :       Why not: A .:        No. 14. :       why not? A .:        No. Anthony returns             to pocket of his jeans. comb
10,"a lion's head telling us what sort of rug.                  She is Her Doberman Pincer warming A's cold feet in her lap. is quietly resting on the couch above them, surveying. Sound of fire crackling. D-. : Oh we will eventually. It takes time.     Right now you're perfectly dreadful . . . You don't know you're    uptight. Look what to do with yourself. They're   beautiful at your hands. long creative hands, Shot of hands. D .:       but they're tense, quivering as if you'd had malaria in the East. Smells him, a bit of disgust in her face. D .:       You're giving off no scent. You're cold . . . No smell. You're clammy. Shot:            painting of black man with large red flaming D'   S"
...,"want me . . . be yourself don't be honest either . . . there's no such thing as honesty . . . those who try it inevitably come off smelling stained. Cut: Coming closer together on the rug. Shot his fingers kneading the inside of her mouth, Shot D. playing with his zipper. Shot A. taking his brown leather pants off. Shot dog watching,"
15,"13.                      The sound of jazz now, as an increasing Clash. We go faster. senseof unreality envelopes the city. It's cold, he Anthony     walking the dark night streets. briskly, driving on in spite of his hugs himself. Walks growing     fear.    Pliles-Davis-type jazz playing off. Shot of cat  from the top, his striped back undulating, gliding, jumping up, sitting. Shot of A.'s other cat, the Siamese, sitting, watching the striped cat. The former Shot of the street, a homosexual is digging A. wearing a fur overcoat festooned with flower patterns and Xoroccan     lace."
17,"Bumping up against the door of the toilet as they hear A. coming    in.     One of them saying in husky drugged voice Yea . . . well a . . . Shot:     A. combing his long hair in the mirror with the light blue comb. Closer. Shot: A's calmer face. Shot: A. in his forest threads, his hair longer, in the forest,    combing       his    hair        with    a     small     jagged    pocket    mirror. His face reflected on a jagged screen. Long shot from side of                      in woods combing his hair. A."
20,"17,          Voice      off,    Ibther's      regalvoice,       previous    scene dissolving   into    bedroom     of   Mother's     who    is    in   bed    looking"
21,"Father's voice, off: My son, blessed be the stars that bring f7ou to me. -"
22,"glancing through their shades at each other, unconcerned. An utter silence,,            A. casually strolling back and forth. Advertisements on walls for soups, intermixed with posters Dean.      Dette Davis. of   people's   faces,blownup.         Brando. Superman, Batman, Wonder Woman- Edward G. Robinson, etc. A. stops at Blowup of The Silver Surfer. Walks on.          Shot of him through colored cat's light pink lens across the tracks.               A. reading a Poster: Believe That Love is the Greatest Thing w   I"
23," and then through the brother's pink shades. Suddenly train whistles down tunnel, coming down A.'s track.                                  Then brother's. -Train Shot through A-Is eyes. approaching,    screaming.    Shot through rich man's eyes. Nervously pacing at the very edge of the track.         Roar of train.     Rich man jumping head on into the tracks.        Roar as train goes by, pulls to a stop.        Long shot A. casually getting into subway.                      Shot of brother, left Pulls away. alone. on subway platform.      Watching the train pull out. Train through his pink shades.         Looking at the bloodied tracks.     Do not see what he sees.      Camera on his unsurprised eyes.     Greys can kill greys."
this,implying        his        own     ability        to     see       himself      comically.
a       dime      mister?,"Voices        off: A:                If     you       need     bread      man,    steal     it"
of     eden.,Shot       of Shot:         unframed         blowup            of        Dylan         on     wall.
going       to        be.,"Alexander,            handsome             all         in        voluptuous            black,          walking This away     from         poster,          down      a     few        steps,          into         his     apartment."
"anthony,","Rimbaud,              the     young        French       poet           he     identifies              with. in     the        apartment         with        him,        is     more          modern,            more     uncertain            Of"
31,"force yourself, these crazy people pin a label on it -- Masochist, why do you punish yourself? Alexander:                     So now what? , A soft Alexander picking it up- Telephone    rings. feminine voice, husky, saying over the phone: Is    Diana      there?"
33,"Images end. Alexander:     . . . I don't think you know yet whether you want to live or die. Close shot A's face.     Pause,  who after all"
very few of us young ones ever,"get    on"" . . . and so few,                    SO"
all      else      had,"what I found . . . I                     found        nothing         but     myself. fallen --           Truth       Illusion,            whatever          it     is,       and       The      Dream       had"
oh!     the     banner            of       raw        meat       against the,"silk     of       seas       and     artic         flowers.                             veerings                 of     chasms! Music, and     the       clash        of        icicles     against         the             stars                      I*11     re-"
37,"1 will be raving mad and never work and never show my jewels - . . . and one night  . . . at the musicend of death .,. staring flatfaced into a pond . . . the sea, the ghosts of the lungs . . . the promise of things to be . . . A bony damp cavern where women grow like in the night, seaweed from the sea, they owl iboo iboo.        cry"
38,". . . porous . . . stumbling towards spectrum . . . slipping on sound ,.t eating air.       I tell myself, reminding myself, it is wet in my shell, in my strong, strong shell, it is wet and 0 now I feel . . . I feel the days melting into years and light- years liquidating the years and time itself crumbling . . . through the lungs the ghosts sing, their songs carry into the air, air atmmsphere, air all about  and float my starved eyes on the wide window of the sea.       And lull my eyesockets to a wide-eyed sleep . . . strange sample of the sea, transfusing the spark of ingenuity"
39,"                 there       is     no        ingenuity          in    the     sea       is    there? ... I        wonder:        what     sharks          are        poised       between        here        and      there,"
"street, these                words        following            him,","Anthony,            on     the He's          tired,        exhausted,           worn leans        up     against       the        blue    fence."
40,"To Be Real! To Feel! FREE! (But instead of the previous semi-documentary style, this scene is shot again with a closer, realer camera, catching the strong desire in Anthony to achieve what he writes."
the city,"Time and place and worlds have changed. has been unreal, frightening.     Here a much more relaxed primitive world -- that of snakes, slow quiet, but suddenly Anthony moves very fast, very violent, and very dangerous. from the Fear of the Cat into the Dream of the Snake. He And never for- will be bitten by it, and he will kill it. getting it, will journey on into the final, deep-sea world of silence.    Then Freedom. A, has gone to the East to fight with the mercenary He's part soldiers against the wild tribes of the Forest. of a small detachment of fifteen-twenty men resting deep . in the jungle-forest of a small old abandoned Buddhist temple.   The relics are broken, the statues on the floor, mixed with the mercenaries' light individual equipment --"
41,"rifles, small    knapsacks,   grenade    belts.     In this temple Buddha still stands , some stray unknown forest people still coming to worship here,       There are fresh joss sticks burn- ing.   Several   mercenaries, mostly black in their early twenties r are inside the temple, sprawled on the floor on their ponchos, a small fire going.         One is sleeping, another reheating a piece of meat; they have killed a wild deer and his half-eaten corpse is still slowly roasting on a stick built over the fire.       Several of the blacks are smoking the Forest Hash which they are passing sound in They wear an two pipes which are very long and beautiful. individual mixture of uniforms although their pants are all If they wear the same -- light    tight-fitting      breeches. shirts -- several are bare-chested with medallions  and tattoos -- the shirts are loose, some of them ruffled, and mixing with the camouflage of the jungle -- green and tan gold, Some wear head bands around black and white striped, etc. their long hair, silver bracelets, beads, one wears sun- glasses, another brother with a thin hawklike nose wears a black bandanna tightly wrapped on his head, as if, like the other brothers, he was just off the city block taking This is to be kept in mind for the a trip in the Jungle. Fate that befalls this outfit results from the fact that they are not really part of The Forest."
very few of them,"spite of their disguises, from The City. will be able to survive the primitive ordeal of this world,"
42,"Though th@ outfit has been several weeks in the Forest, the blacks have no beards.     A small transistor.radio   plays inside the Temple and two of the Brothers are dancing softly to the sound of soul music. The white world is for the most part outside the Temple, sprawled about it in the thick grass, relaxing. Some have beards, others have shaved, but their faces are hard and dirty, dust and dirt is deeply ingrained in the cracks of skin,    Anthony is an exception, he has kept him- self clean, his beard barely visible, although there are small lines of fatigue under his eyes and a small scar under his left eye, the result of a previous wound, not serious.    He tends to rub it occasionally.    Ironically,    in the war, he has become even softer. Time has crumbled: he is spacing himself. The contrast is made then, by camera CloseuPs, of the black and white features,     The Blacks are tenderer, softer.     The Whites are tired, cruel.   The blacks Sing- Dance.     Although inside they are as blue as the sky, and scared."
43,"as he walks, the sun gleaming through the trees, almost moving with him, seen and then not seen and seen again. From a distance, inside the temple, on the radio, Sam Cooke's song ""Cupid"" is playing loud, and sort of sad like all Cooke's songs , giving a texture of music and sunlight to his walk."
44,"from    the           temple. *                                                                Isaac,      a A.     approaching         from       a   distance                        moder-"
with     sharp         attractive,"ately    tall,              slender,      muscled       Indian, features, no beard whatever, his long black hair curling"
shakes,as he feels the camera on him.                                  Looks at camera. his head.              Turns away from the camera-
in here cannot,"can't, this wrld a     picture          but     knows      he"
"goes and sits by francis, a brother","be     photographed,                 He has tender features- He who     is       very        close     to      Anthony."
45,"is playing, and as the two brothers dance, Francis, who has a very high singing voice, though not as good as Smokey's whom most people mistake for a woman he sings so 'tenderly,   starts to sing with the radio:"
46,"As he sings, the rest do not look at him sing, they know he can sing, they've heard this song a hundred times, they know it too.      They lie where they are, look at what they do, and deep inside, where it's blue, they listen."
47,"Camera moving from Adams to the ones he calls his friends.    To King, who is the biggest brother, very black, with big white cotton picker*s    nails.   His large pink hand- some tongue, as he says: Adams:      The King has a pink tongue es. He says he eats a lot of chicken *.. there ain't no chicken here .a. in the forest."
49,"told me when I asked him why he took allthcse pictures, he said he'd never used his eyes before . . . he says this wasteland is beautiful . . . that's what makes him crazy . . . talking like that . . . those kind of people never seem to"
51,"Lerner taking his head into his hands, shaking his hair, pretending to     weep:"
picked cotton till,"parachutist, an officer, a scout,              I"
then i picked,"there weren't no more cotton to be picked, smoked more shit rocks and sold those.      I done my time.             I"
been busted four five,than you`ll smoke in a lifetime.           I
52,"=li-&ed the walls, we balled ourselves ask a King young ma, ask him if in all the time we been together he ever"
53,"with it.      As when Francis was singing, most of the brothers have not seemed to listen to F&&I make his scene,                               They hear but they don't look, as if their ears, eyes, and mind were all separate senses. Manny toying with the radio, gets it playing again    but some crazy station and Lili                      Marlene   is    being"
54,"almost sympathize      with the poor snake, fighting wildly, through the circle and they .are running Suddenly   it breaks after it again.       They cannot catch it, but the powerful snake, making one mistake and unable to pick out Isaac, the Indian, who is standing perfectly still watching, slithers   unknowingly through Isaac's spread silent legs. We haven't seen Isaac yet.            First shot of his legs and the snake sliding through. His hand speeding downandpinning it by the neck.              Tilt up, medium shot, to his face as he scoops it up.          A grimace of pleasure on his face, snake dangling by its neck, its tongue flickering Sees it helplessly.                                  Lets it dangle, Isaac    hisses   at   it. Wraps it around his is   non-poisonous.     Stops    hissing. wrist; on the other wrist, coincidentally, he has a replica"
55,"that it is not poisonous) its tongue and head swaying over Isaac's chest.     On his bicep, Isaac has a small graceful tatoo Born To Kill, Long shot of him approaching Temple. Francis:    [off) Crazy people dig snakes, crazy people. A.         Violence is like snakes. We hear the snap of his shutter as he takes another picture of Isaac approaching . . . very quick ,o,"
56,"snake makes when it sways.                                Frontal They turn swiftly. shot of Isaac standing right behind them the snake wrapped around his arm, its head swaying out in front of Francis. Francis doesn't move, but his face muscles tighten and his eyes dilate a little. Francis:        Don't fool with me man, don't fool with me, Isaac    smiling.     Behind him, still   sprawled around, the radio Flaying, are the brothers and Shah and Lerner and Adams, but things are quieter and without look- ing they listen. Isaac Anthony is also repulsed by the snake. sees this.     Smiling a bit, says slowly, Isaac:          You been staying a long time in the shade Anthony.              fixing to get a tan? . . . Like his YOU"
57,"a tremendous joy in this living wet damp creature, his fear of it disappearing.     The snake responding P beginning to calm down on Anthony'sbody. At this point, Isaac says: Give it to me. Anthony    hesitating.   Attracted by the power in Isaac's eyes."
58,"his left hand and without hesitating violently slices its head off, a cruel look of brutality on his face. With his left hand, Isaac whips the snake's *im?iw head in the air, as if it were a scalp. His arm is quivering.    His head is down, the gesture not deing that solemn, but more spontaneous, quick, contemporary, the gesture has already faded, he pulls in his arm. Puts the head to his lips.     Drinks. A. looking Turns to A.    Offers him the head. at Isaac, powerfully attracted by the look of strength in Drinks. Isaac's eyes.    Takes the snake head. it goes down Tastes the blood in his mouth. strong.    A smear of it on his lips making them corral- Close shot of Isaac's colored.    Close shot of his lips. wide strong mouth. A shot, a single rifle shot is heard from out- side. Its echo dies. They look at Anthony and Isaac haven't moved. Isaac's eyes alight with anticipation at the each other. Anthony's    eyes   completely - rifle shot, the call of danger. lost in Isaac's animal eyes, feeling a powerful attraction to this almost human fire. Shot of fire.    Scene 1. Anthony     under- close, of Isaac's face. Shot, standing the fire is in people and between them- The other soldiers The rifle shot is repeated."
59,"are hurrying out of the temple now, not having been alarmed by the first shot.      The radio going with them. Shot of Isaac and Anthony standing in front of Buddha. Solitary shot of the rifle that fired being raised by an arm into the air.          Resting in the sky, flat, in Indian style.     A cry is heard.       . Dissolve"
60,"The screen slowly comes to light and we see a young tribe, maybe a dozen, dancing freely in the forest by a stream.        Perhaps they are the enemy, it is not made clear yet.     They are a mixture of young men and women and their children, white and black.                  They dance hugging each other, their long hair jumping, in all sorts of love contortions that display their freedom.                     They are all in love with each other, with                                                         And easy as it iS forest. their     god, with    the to make fun or laugh at, this scene at first must be done with the camera truly involved in their spirit of joy and freedom. The hair Some are blondes, some black haired. long; the players young and contemporary looking and above to preserve the spirit of the scene, they must move all, well, in some sort of time to the tambourine, throwing their bodies into it.               Ideally, they are naked, and some But    barring       that,      they   wear    fiasy of     them   body    painted."
61,"want to be is left up to them,     In his mind, the writer forms the image of the black panther -- a sort of ineradic- able wariness at the root of their Freedom, unlike the White who when he loses his mind, really proceeds to lose it, and to embrace the new.    Whether the blacks actually dance is left up to them.     They could be sentinels in the woods, they could be on the stream watching the others do their dance."
62,"Comes up on Bunny.     Puts binoculars over his eyes.     Do not know what he sees.     Brings binoculars down. Looks at his map.     Is puzzled.                           around. Squints.     Turns Motions to the men with his arm to sweep out downslope, slowly.    Finger to his lips to indicate silence, although the men know what they are doing anyway and can hardly see his gestures. Frontal    shot The men disappearing in the forest. of them inching down the slope to the stream.              Then side There are view of them approaching.        Music growing louder. no sentinels around, oddly. They approach the stream and quietly crouch down behind rocks, trees, dead logs.        Take off their knapsacks. What they see at first does not really excite them, they are much too wary and as a group have up to now functioned as soldiers. Shot of A's face.     A. moving up further, very interested.     They have been watching for a while and Un- Francis and controllably,    they start inching further up. They pass another brother joining A. from different sides. Anthony, putting his rifle and each other a puzzled look. knapsack down, taking his camera out and shooting the tribesmen. Others. Shots of Adams, Lerner."
63,"Puts the binoculars down.       Picks his rifle up, puts it to his shoulder, his eye squinting, medium to close shot, he is an expert marksman, his legs loosely spread and the stock of his rifle deeply imbedded in the shoulder, the rifle slightly twisted inward, his rear elbow coming up off the ground as he sights in; for a little man, he shoots high off the body, very confident, very precise. Camera dwells on him as he is about to shoot. But he hears footsteps behind him.       Takes his eye from the stock, squinting, not looking around.       The footsteps getting closer.                                      On the feet Shot of the feet next to Lee, are moccasins, they are Isaac's,       Lee looking up at Isaac, who has a small French submachine gun cradled in his arms, and is looking down at the stream bed.       Isaac giving Lee a look and proceeding down to the stream, his action fore- stalling a massacre.     Lee with hate in his eye, staring at Isaac's back.     He squints."
66,"hugging her.     She is so far gone into the ecstasy she doesn't notice really who it is.          He grins madly and The other starts making off into the woods with her. whites with shouts following him, hugging the women like satyrs at the rape, kicking the almost unconscious, help- less men away with their boots, some knocking them away with their rifles.       Lerner fighting for the women but The women begin to realize what is being knocked aside. One A few screams. happening and start struggling. heavily bearded white chasing a girl, no more than sixteen, Shah wading out to into the stream, thrashing with her. help her, struggling with the big soldier who throws him off.     Shot of Lee in the woods raising his rifle and expertly firing into the water around Rhah, warning him off.                                                  A black Rhah looking wildly up into the woods. tribesman jumping on him.       They scramble in the water- Shot of Lee, putting the rifle away, Doesn't He squints, looking down at the chaos, pleased. move."
68,A:            No. She smiles.
69,"begins, a long sequence.       Their movement is deeper into the forest away from the fast-fading music. They increase their speed until they are running as fast as they can through the trees.       Joanna is as swift as a deer and al- But ways seems to elude Anthony, who is also very swift. rather than lose him, she hides, and he finds her or she lets him see her, and the chase begins again, the only sound their speeding naked feet on the forest floor- As Anthony runs, he sees the snakes in the trees and at their foot, and in his path too but the chase has made a young savage out of him and he runs by these hissing snakes without thought or concern.       Just to take her, like his companions are taking back at the stream. The chase is long.     He catches her at the base of a tree, perhaps the same tree where they began, the same snake hissing in the tree.       They entwine, taking long deep breaths  they are falling togeth- er onto the forest floor, their eyes closed, Anthony SO happy f so out of breath, his breathing her breathing, his (Shot animal moan the only sound now in the forest . low"
bunny's boyish,"The screen still in darkness. 44. angry voice off: F?hat's the matter do I smell bad? Am I dirty?                        How to feel!   she screams very loud,"
71,dead girl.
trying to kill,"46.           Cut.        Anthony springing on Bunny. Bunny, Butit'san even match and they go on fighting use- lessly and camera, losing interest in them, pans to tribe people running off into the woods on the other side of the stream like fauns.            Some soldiers are standing around the dead girl, some of them amazed that the rape should end in murder.   Anthony and Bunny, both exhausted, are struggling off to the side, out of breath.             The Leader of the Tribe striding up to the girl, picking her up, she dangles wax white in his strong arms, a lifeless puppet.             He speaks to the soldiers, clearly, slowly: .                   All of you will pay for this, black as well as white            . .  you are animalsi you are beasts1 l"
they squat on,"Bunny, motions for them to take a break. the rocks on the edge of the stream, pulling their ponchos"
"his voice,","Shot: A's face, his eyes cast down. off: Without you Joanna .*. I loved you. . . . it is darkness. Shot of the woods. His eyes rising. Thinking. Even tu- Shot: F&ah's face in profile. ally, he says in passing: Isaac didn't come back. During this scene of thought on the rocks between Rhah and Anthony, Francis and a few other brothers, includ- ing the white smoker, Adams, make a slow individual pro- They cessional by Rhah and A. to take a pass on the pipe. come by in ones and leave again to go back to their own rocks; the effect is almost of a ceremony celebrated for the last time."
