Speaker,Dialogue
one of the tribes-,"rifle no sooner crashes on his head. men straddles him as he lies on the ground, his head bleed- ing, about to scalp him, a brutal look of revenge on his face.    It is the former leader of The Tribe.         His knife in the air.                                             The   tribes- A hand grips it hard.      Stays it. man turning to Isaac.       Hesitates.    RUGS off to kill again. Isaac looking at the unconscious Anthony.         His smashed camera lies next to him.       Seeing the dead snake, taking it all in with a little gleam of the eyes, perhaps amused"
86,"On my back A:  Rhah:                                              You You got to be strong man, to live. got to be strong to smoke.          got to be strong to do what YOU"
". . . swim,",care of yourself . . . and if you do go to jail
picking the,"few hippies hanging from statues watching. Walking slowly like High fqoon down the suitcase up. little sidestreet. Shot: Twenty-five California cops in motorcycle boots and plastic helmets with Brando goggles and gun belts Pan of their and sticks and badges gleaming like diamonds. bodies and faces, the camera going down the barridade           they have set up.     The faces, all white, are strong, their thighs husky. Music off, starting Shot: A walking towards them. very lowly: When I wake up,          put on my makeup . . . and I I"
a small,"Aretha Franklin. say a little prayer for you. portion of the song.                          A   approaching Cut to silence. closer, zooming out from him to catch him with machine gun in his gloves.                                Rlow Up of Joanna on Stopping.   Close up. the cover of a magazine, the title of the magaiine in large letters CINEPTA."
91,Explosion picture.   A. throwing his huge pineapple grenade.
posters    advertising,"53.          The California airport. Anthony, his shades on, in his afghan coat having THE SUN. his bags examined.      Flash is one counter down, also being examined.     They are both very stoned: at least Anthony is and everything he sees is through a detached fish-eyed lens, slightly colored blue.       They look up, catch each other's eye. A looking around through his fish-eye at the roving officials who circle outside the baggage line, their hands behind their backs, watching the examiners and the examined."
94,This way. please. Long shot of the official pointing to it. Looking Anthony walking stiffly to the door. His voice off: one last time to the exit doors. Run!
the,"54.        Shot: Anthony at the examining room door. official from behind, opening it. Stepping inside. Anthony scratching his scar. Officials behind a large police station type desk. One brother in front of it, putting his things back in his pockets, smiling at A. giving him the fist of triumph sign. Heavyset official looking up at A. disinterestedly: Well, you know the procedure. Pause A:         No Take every- Official: We run a bodysearch here. Put it on the desk. thing out of your pockets. Shot: desk A. slowly, resignedly but still hoping, taking The items out of his overcoat.     Taking his coat off. contraband tightly laced to his back under his green, ruffled shirt.     The official running through the items On the desk, holding a pistol slug in the air, a couple of teeth, a small black skull  Arms out please.     Stretch the legs."
97,"coat.    The FBI man, nodding his flat crewcut head as if to say 'I like it'. An attractive, rich-looking            in   her    thirties woman"
99,"S* as distinguishing      marks, they use their threads. Each walks differently from the other, like different types of fish in an aquarium.         There is also a large minority of old 'hippy' types, Youngr not so tough, a fatalistic young romantic look about them,"
voice off:,"58.          Camera panning through the block. Getting into the car. Over there, Camera fading to catch three of the prisoners, swarming high up near the ceiling on the barsI like fish rather than monkeys, looking out the small slit of a window looking down into the parking lot. VOICE :      The yellow chick in blue. Side Shot  of their faces, catching the sunlight.    One of them sucking in his breath. Shot:     Blonde getting into the car in the Sun- light, slamming the door.       In the background we see the sealed prison building, modern, small windows, in the heart of the city."
100,"Shot: their faces looking out through the bars, wide eyed, exaggerated          effect.       Fading into Shot of the head trustee  bearded, coming up behind the prisoners.                   Pointing. Get down."
passes two,Walks further on down the block.
the water,"63.         The sparring brother in the shower. The He pushes a button. squirting out like a fire hose. shower stops.       Comes out.    Dries himself, humming, then singing. Fade"
104,"bread, no butter, ravioli and a small sticky piece of cake, Nothing to drink but coffee.        Anthony eating with them, his undershirt still on, his hair a mess.           There is little talk. The sparring bro.ther, the same one who was in the shower, is sitting with another brother across from A.           Looking at A. curiously.        Asks:"
106,"Once I spoke to you of long silences where we stare, just stare at air.     Once        spoke to you and I"
107,"What did you do? Jonah, smiling, wrapping his hands around his shoulders under the blanket:"
108,"Jonah:        (not            him do this, a slight seeing"
you,short: Ant.bony      killing the sneke)        You have to love. to be free           . . . and you have to be
110,"voice off: I remember.     Anthony slowly takes Jonah's head in his hands, brings it together with his.      Anthony releases his breath.     Jonah's hand feels his cheek, gropes along on it.   They kiss each other's mouth, tenderly, their eyes closed.   Fade, past the faces of Joanna, Francis, Isaac, Rhah, in that order back to the face of Alexander, who sits all in black by himself in his apartment, slumped in a chair, his hands between his knees, looking very sad, his head hanging off his left shoulder.       His voice off, very low:"
we dreamt,"68.                    Your mind was mine Anthony. together.   We discovered reality and it died with the dream We grew another and what we dreamt, we could never have. mind,   We emancipated our souls, and the cost . . . was that our feeli:;gs died.    We buried ourselves in the security Of thought and not knowing it, we fell prey to our own minds. If ir. cannot eat other minds and Our thought was hungry. other minds cannot eat it, then like some horrible plant, which yc~ accused me of being, the mind will curl in and eat its own self. Fading into Alexander rises from the chair. Anthony and Jonah together fading into"
112,Alexander          rising        on        camera.       His      voice        still
"i&     holds it next to him,","Lighting           the     torch. burning        brilliantly, casting                   a    weird        surreal       light       on     his"
113,"What, who is this laughing at who? Which Alexander laughs at which Alexander? . . . Which Alexander shall inherit the Earth? . . . - shall inherit Ye the Earth.    but alas! A face is a the birth of faith follows.     Faith and face. face.   For have I not functioned on, samefaced everyday forever, believing,    having to believe in as simpk a thing . . e as divine good, divine aid, all the divinities my fear"
114,"still holding it in his hand, tasting             the    fire)   disappears"
115,"Gush pond . . . foam, roll over and by ice, alerted.       Alert1 over, rise and roll, rise and roll  Sound fades.      His voice off, calmer, more lucid, bringing to an end: In the garden when I was young the They are beasts of a fabulous small graceful lions run. elegance they sniff flowers and crack open pink parasols, when I was young, in the aethiopian gloom, in the shaded of   afternoons   splendid   with   ambitious   odors   and memory"
116,"In the north was the nothing, towards the south the void, and over it an old God had hung an invisible mantle he       In its bosom we play the practice of our hearts . . . our hearts expire, puff adders vex the desert sand . . . we titter . . . we stop . . . without warning, we see"
the r&ream.,"12)     Francis crying   for    help   in 13) Anthony dancing to the James Brown with the colored chick, the sound of the song breaking the silence of the movie camera's purr. 14) Anthony and Jonah touching each other for the first time 15) Anthony in a cardin           double-breasted suit and turtleneck, wide brimmed hat, expensive gators, flowery handkerchief,    looking very strange and out of character passing between two chicks  Joanna and Isaac bendingoverAnthony              at the stream, nursing him"
