Speaker,Dialogue
letty,"Listen, Beast. What have I told you about linen?"
letty, It's liver saute.
chandra,Miss Mayer. Miss Mayer.
letty," Goodness, this is a bad one.   Tip your head back."
letty,"Come on. Pinch it, Chandra. Pinch it."
johansen,"Well, I have a full calendar today, and I'm afraid..."
letty,"Mr. Johansen, hello. I'm so sorry I'm late. It's very nice to meet you."
principal gail,The Superintendent was just getting ready to leave.
letty,I do apologize.    A student had a crisis.
letty,A bloody nose...
letty,A bloody nose of epic proportions.
johansen,"OK, Miss Mayer. Ten minutes.     Wow us."
letty,"No cherry drops, Jenny.  He can't? Um, well, tell him, tell him that they went for my math idea. Thanks."
letty," No, about work. How about dinner?"
letty," Paul's fine, just fine."
letty,"Got to go, Mom.   The monsters call."
ruth,Sorry I'm late.
ruth," Tell, tell."
letty,"So, I got the district to approve my after-school math program."
letty,"I'll be running it three days a week, and..."
letty,"Not now, but maybe later, if they like the program."
letty, What's up with you?
ruth,Me? Nothing. Tell me more about the job.
letty,"No, Mom, it's more of a prestige thing."
ruth,Mmmmmmm.
letty,Ruth.   Calling Ruth.
ruth, Sorry.
letty,Just go ahead and tell us.
ruth,There's nothing to tell.
letty,Come on.
ruth,"No, really. Tell me about the promotion."
letty,"Well, my theory is that people can really enjoy math, but they lose interest..."
ruth, I'm getting married.
letty,Wow.   Congratulations.
ruth, Can you believe it?
letty,You've only known Jake a few months.
ruth,Three and a week.  Isn't it great?
paul,"So, another one bites the dust."
letty,It's not another one. It's my sister.  Aren't you happy for her?
paul,She's only known the guy a few months.
paul,Can I put these here for tonight?
letty," It's kind of romantic, don't you think?"
paul,I really think if you're going to spend your life with someone you want to know them pretty damn well.
letty,"Believe me, I know your feelings on the matter."
paul,The receptionist said you called earlier about something.
letty,My math program. The Superintendent said he'd fund it.
paul,Good going. I knew you could do it.
paul,It looks like we're both bucking for advancement.
letty,Yeah?
paul,"Huntley told me today that if I come through on the Benton deposition, they may consider me for senior associate."
letty,Congratulations.    We should celebrate.
paul,I was thinking dinner on Friday with James and Meg at the Saint Mark.
letty,I mean tonight.
letty,Like right now...
paul,"Actually, I need to review the deposition questions tonight. Maybe tomorrow?"
letty,"Oh, ok.   Maybe."
paul,"But I thought if you don't mind, you could listen and see how I come across?"
letty, Sure. Of course.
paul,"Letty, please, I need your full attention."
letty,Let me have it.
bobby,"My dog ate my turtle, and the shell went crunch. I brought it for show- and-tell."
letty,"I'm sorry about your turtle Bobby, but you know we only have show-and- tell on Mondays. Today, we're scheduled for grammar."
bobby,But my mom says I have to throw it away tonight.
letty,Don't even think about it.
letty,"Class, why don't you..."
letty, You guys pull out your verb sheets and review them.
ruth,She says she won't even come if Dad brings Monica.
letty,Mom won't miss your wedding. She'll come around. I promise she will.
ruth,How?
letty,"I'll talk to her, and to Dad, too.  A few wisely-chosen guilt tactics and they'll be ours."
ruth,Maybe if we had them both to dinner or something.
letty,Maybe.
ruth,"You always throw the best dinner parties, Letty."
letty,"Oh, wait a minute, now I see where you're going."
ruth,"Please, Letty."
letty,Mom and Dad? At dinner together? Are you crazy?
letty,"Maybe, though. Maybe it would work. I could throw you an engagement party maybe."
ruth,Really?
letty," You know what, Ruthie? I better get back to my class, OK?"
ruth,And the party?
letty,"Yeah, it'll be fun."
ruth,Thank you so much.
letty,"Who can come up here and give me a sentence with a ""to be"" verb in it?"
zach,Who was that girl?
letty,"Come on up, Zach."
letty,"Neater, Zach."
letty,"Zach, you know the line by the ""a"" has to come straight down or it looks like an ""o."""
letty,"What's wrong, Zach?"
letty,I don't believe it.    You still can't do it.
zach,"I'm sorry, OK, Miss Mayer?"
letty,"No, it's not OK. You'll never get to college on OK."
letty,"It has to be good, Zach.   Do you understand me?"
letty,"I'm very, very sorry, Zach."
letty,"You know what, guys? Wednesday's not a grammar day. It's a collage day. It's a collage ON THE WALL day."
letty,"And, Zach? Zach, I want you to be in charge of paste."
paul,What are you doing?    You're going to be late.
letty,I'm calling in sick.
paul,You don't have a fever.
letty,I don't feel like going to work today.
paul,Won't it be hard for them to get a substitute this late?
letty,It'll be OK.
paul,But what about that math project?
letty,"Paul, I just can't go. Is that OK with you or am I committing some horrible crime?"
paul,Forget I asked.
letty,I'm sorry.  I'm just...I'm so tired lately.
paul,Maybe you ought to see a doctor.
letty,"No, it's not like that."
letty,"It's just I've got those parent conferences, and I'm supposed to set up the math program by next week. "
16.,"LETTY And shopping for Ruth's dress and that, that engagement dinner."
paul,You can get out of the dinner.
letty,"No, I can't. I've already convinced both Mom and Dad to come."
paul,"Come on, Letty.   It'll get done."
letty,I don't think so.
paul,Of course it will. Remember the big talent show you planned last year? And what about the Christmas benefit when Santa canceled at the last minute? But you still pulled it off.
letty,Yeah.
paul,You just need to get more organized. L
letty,Maybe.
paul,"Let's make a list of the things you need to do, OK?"
letty,I see.
letty,Well...
letty,Oh.
letty,What the fuck. It's my job.
clerk,More coffee?
letty,Hit me.
clerk,Danish?
letty, No more bear claws left?
clerk, Danish?
ruth,"Oh, no thanks, I'm too excited to eat."
ruth, Where's Mommy?
letty,Do you have to call her Mommy?
ruth,Where's the old bag I sometimes call Mommy?
ruth,What do you think of this one?
letty,I'd have to see it on.
ruth,Have you been crying?    Your eyes are all puffy.
letty,Things have been kind of stressful lately.
ruth,But everything's OK?
letty,"Yeah, everything's under control."
ruth,What about the engagement party?
letty,Everything's ready for tomorrow night--except the artillery.
ruth,"Thanks so much for planning it, Letty. Jake's really looking forward to it."
letty,You better start trying on before the vultures get all the good ones.
ruth,What about this one?
letty, You look beautiful.
ruth,Really?
letty,Truly.
letty,"Hi, Mom."
ruth,"Look, Mom, I think I've found the dress."
letty,"No, not yet. But you know Paul. He's sure to get it."
ruth,No more. I can't stand to try on one more dress.
letty,Oh no.
letty,"Mom, please."
ruth,"Go on, Letty. I want to see it on you."
letty, Do you think I should?
ruth,"Yes, yes.    It'll be fun."
letty,Mom?   Mom? Ruth?
clerk,I think they went over to the next shop to take a peek at shoes.
letty, Can I get you a glass of champagne?
letty,"Hi, Dad, Monica.   I'm so glad you could come."
letty,"Mom, this is Monica.   Monica, my mother, Martha."
letty,"Dad, Mother, you've met before, right?"
letty,"It's mushroom-time, folks."
letty,"You can always call it, Dad. M ONICA You must get your cooking skills from your father, Letty."
letty,"Ruth's narrowed the dress hunt down to two, Dad."
ruth,One's a silk...
monica,I remember how hard it was looking for my dress. I must have been to 100 stores.
letty,You know what I think we need? Martinis. How about martinis to celebrate?
paul,Yes.
letty,Puglia olives. Would I forget?  A round of martinis coming right up.
ruth,How can I help?
letty,"Paul, can you hand me the olives? Ruth, I need you to, what was it?"
ruth,What about the souffle?    Has that gone in?
letty,"Yeah, I just put it in. But the squab, I think that needs to be basted."
paul, Kind of icy in there.
ruth, Thank God we have alcohol.
letty,Fuck me.
ruth,What's the matter?
paul,Letty?
paul,Let?       L LETTY Olives Aux Herbes De Provence.    I got the wrong kind of olives.
ruth,What's all the dreck?
letty,"Sage, rosemary...  Les Herbes."
ruth,It'll be fine.
letty,"No, no. They've got to be Puglia olives, packed in a light brine with a flavor that doesn't overpower the palate."
jake,What do you think of those Lakers?
paul,What are you doing?
letty, Can you loan me a 20?
paul,Sure. Why?
letty,I'm going to the store.
paul,I think you're overreacting.
ruth,"Letty, dinner's almost ready.   The souffle..."
letty,I'll be back before you can say souffle.
letty,I can't find martini olives.     All you have are black.
store clerk, Aisle 2A.
old lady,"Excuse me, Miss. I can't reach the cat food."
old lady,"And a turkey and giblets, too, please. She does like her turkey."
letty,They're not there. I need the ones from Puglia.
letty,"They're the ones that are packed in brine, but they don't overpower the, you know, the palate."
store clerk, Specialty foods. 7B.
letty,Where are they?   Where are they?
letty,Where are they?
manager,"What's wrong, Miss?"
letty,Tell me where they are.
manager,I think you should go now.
letty,I need my olives.
manager,It's time to leave.
manager,"Call security. Where's security, please?"
letty,"Fucking olives. Fucking, fucking olives."
letty,"No, no, no. Go away."
manager, Call police. Now.
michael,Miss Mayer? Miss Mayer?
michael,"I know you've had a rough night, but I have a few questions for you, Miss Mayer, or Letitia."
michael,Do you mind if I call you Letitia?
letty,Letty.
michael," First off, Letty, can you tell me where you are?"
letty,I answered these questions last night.
michael,"I know this can be a real drag, but the attending physician on day shift is required to do his own prelim exam when a patient is admitted during the night."
letty,Hillview Psychiatric Hospital.
michael,"Great. Now, Letty, I'd like you to remember three items. I'm going to ask you to repeat them in just a few minutes. They are chair, cup and ball. Did you get that?"
michael,"OK, let's subtract 6 from a succession of numbers starting with"
michael,And 85 minus 6?
letty,"No, 79. Sorry, this makes me nervous."
michael,It's OK. It's not a pass-fail kind of thing. L Letty smiles uncomfortably.
michael,Now the three things I asked you to remember.
letty,"Chair, cup and ball."
michael,Terrific.
michael,Let me shift gears here a minute...  Do you ever hear voices that other people don't hear or see things they don't?
letty,No.
michael,What about patterns? Do you find yourself checking and re-checking locks? Or washing your hands over and over again?
michael,How about arranging your possessions in a certain way?
michael,Yes?   Go right ahead.
letty,"Sometimes my food, and my clothes, and my underwear."
michael,How do you sort it--by lace and cotton?
letty,By color.
michael,What if it's got a pattern?
letty,Is this really important? Because I don't think it's a problem.
michael,"I see.  How long has it been since you've done something you've enjoyed, Letty?"
letty," A while, I guess."
michael,That must be really difficult.
michael,"Hey, it'll be OK.   We'll make sure of that."
michael,"For now, why don't you just take it easy while I confer with my colleagues. A nurse should be in shortly."
letty,I did this already.
letty,To be interviewed every hour?
letty,"Well, I don't have hallucinations. Honest."
letty,"Yeah, and a dimple."
letty,"Psychologist, therapist, whatever."
letty,What?
letty,What kind of place is this?
letty,I want to see my mother immediately.
letty,I don't think you understand.    I won't wait.
john,I'm in for 5 for manic depressive.
thomas,I'll go with that as well.
marie, Tell me more about the guard she strangled.
michael,"No, just hit in the head."
john,What about voices?    Does she hear voices?
michael,Not that she admits to.
marie,Is she a washer?
michael,"No, but she is exceptionally organized."
thomas,How organized?
michael,She arranges her underwear by color.
michael,"Mrs. Hallstrom, you want in?"
michael,I'll float you.
marie, It's been weeks since she played.
michael,"What about you, Marie?"
marie, And could I get my change in ones?
nurse gates,"Treatment schedules are posted on the bulletin board. Dinner at 6, lights out at 10 and no fraternizing between patients."
nurse gates, That's the rec room. We show movies there on Wednesdays and Fridays...And this is the dining hall.
letty,I'm really not that hungry.
nurse gates,Just eat whatever you want. This will give you a chance to meet some people.
letty,"You know, my mom's coming to get me tomorrow. I'll be leaving."
nurse gates,"It's OK, Letty. I'll be right here with you."
thomas,"So I said to my publisher this afternoon, I said, don't you even--"
nurse gates," Letty, this is Mrs. Hallstrom and Marie, and John and Thomas."
thomas, Just discussing my pesky publisher. May I ask what you do when you're not vacationing?
marie," Let the poor girl get some food, for Heaven's sake."
letty,I'm a teacher.
thomas,"As you may have gathered, I'm a writer."
thomas,"I don't like to say novelist. That sounds a little grandiose, but I am on my third novel and..."
nurse gates,"Excuse me for interrupting, Thomas, but we really should get some food..."
michael, Now I'm going to say that the card you picked was the Ace of Spades.
nurse gates,Michael.
nurse gates,"Michael, this is Letty.      She just arrived yesterday."
letty,We've met.  I missed you during rounds this morning.
nurse gates, This doctor thing has got to stop.
letty,I'm sorry.     I'm so sorry.
letty,"Mom, I was there, and I just, I was so... "
40.,"LETTY They didn't have the olives, and I, I got so upset. I don't know how it happened."
letty,I'm so glad to see you. You can't believe the people in here. They've got patients posing as doctors...
letty,I just want to go home.   Can we go home now?
letty,"Maybe I should talk about this with Ruth, or Paul."
letty,You all really think I need to be here?
letty,But what about Beast?   Who'll...?
letty,And my class. It'll be hard to find a good substitute. And what about my math program?
letty,Charges?
letty,"Mom, no, please don't go.    Please."
letty,Tomorrow?
marie,Especially the OCD.
michael,"Hey there. They're showing ""Groundhog Day"" if you..."
letty,You took bets on my diagnosis?
michael,It's no big deal.   We all compare.
letty, W ho do you think you are?
michael,Don't take it personally.
letty,"You have no right, no right to take the worst thing that's ever happened to me and make it into some kind of game."
michael,Stop acting like you're someone special. You're just like the rest of us.
letty,"I'm not the one who's masquerading as a doctor. I'm not the one who's, who's..."
john, He's schizophrenic.
letty,I'm not the one who's schizophrenic. I don't see people who aren't there or run around acting crazy.
patients,"Go, Girl!/ Come on, Michael."
michael,"Oh, no, you're perfectly sane. That's why you're here."
letty,Go fuck yourself.
patients,Bravo./Encore./Re-match.
thomas,"Hell's bells, you can count me in on that. I haven't had enough Z's since I ran those sleep disorder experiments at Stanford back in the 70s."
marie,"We really miss doing things with you, Mrs. Hallstrom."
john,I've noticed Letty doesn't much like to do things with us.
letty,"Oh, no. Of course I do."
john,Then why are you so defensive?
michael, I don't think we need to sacrifice Letty to pep up a slow session.
john, You're the one who told everyone about her panties.
letty,Do we have to talk about this?
letty,Excuse me?
michael,What are you looking to read?
letty,Anything interesting.
michael,This is good.
letty,But you're checking it out.
michael,I've already checked it out 17 times.
letty,You keep the book.   I'm looking for Emily Dickinson.
michael,"Hey, if you take the magic book, I'll feel like maybe you accept my apology and don't hate me anymore."
letty,I haven't heard an apology.
michael,I'm really sorry I hurt your feelings. I got a little carried away. Can you ever forgive me?
michael,"Mrs. Hallstrom, I'm pretty sure you could use that."
michael,"Now, don't you have a gin rummy, Mrs. Hallstrom?  Go ahead, now, just lay those cards down."
michael,Hot damn. Gin rummy. I told you so. You're three games up on me.
paul,It's prettier here than I thought it would be.
letty,"Yeah, I guess it's all right."
paul,Are you all right?
letty,That's a big question.
paul,I hope it wasn't something I did.
letty,Something you did?
paul,That put you in here.
letty,"Of course not, no.  Is that why you're here?"
paul,I think we need to talk about some things.
letty,"Yes, I suppose so."
paul,"This has been really difficult, this whole thing. "
49.,"PAUL I mean, we've been going out for four years, and it hasn't always been so easy."
letty,No.
paul,Especially this last year.
letty, Especially now.
paul,"So, I've been thinking a lot..."
letty,"I have too, Paul."
paul,"I talked to Ruth a little bit, and I think it's about time..."
letty,I know. We can't just keep going through the motions.
paul,Exactly. It's time to make decisions.
letty,You don't have to say anything else. I've known for a while that this was coming.
paul,I just wish we'd done it sooner.
paul,Will you marry me?
paul,I had to smuggle it in here. I guess you're not really supposed to have jewelry.
letty, Or be up past ten or fraternize with other patients.
paul,"I hope you like it. It's a Marquis cut, 1.5 carats. They had one with emeralds around it, but this was simpler, more classic in its lines.  L Letty?"
letty,"It's, it's really nice, Paul."
paul,You can take it back and we can have one custom made if you want.
letty,"No, you've done a perfect job."
paul,"So, what do you say, Let?"
letty,"Do you think, really, that it's OK to get engaged when I'm in here?"
paul,Sure. We'll save the formal announcement for when you're out. I already told your mother. I hope you don't mind.
letty,"No, no."
paul,So will you?
letty, Of course. Yes. I will.     I do.
michael,You missed out on some great broccoli florets at dinner.
letty,I wasn't hungry.
michael,John even managed to lob a load of mashed potatoes into Mrs. Hallstrom's milk.
letty, Finally. I was getting tired of watching him try every night.
michael,Was it bad news--the visit from Peter?
letty,Paul.
michael,He looked pretty serious.
letty,He asked me to marry him.
michael,Very romantic setting.
letty,It was romantic.   He's very romantic.
michael,"So are you engaged, or what?"
letty,What have you done with the ring?
michael,It's magic.
letty,This isn't funny.   Paul would kill me.
michael,Guess which hand.
letty,Enough with the abracadabra.
michael,Guess.
letty,T he left one.
michael, The audience says one more try. What guess you now?
letty,The right one.
letty,"Come on, Michael."
michael,"With this ring, I thee..."
letty,"Really, this isn't funny."
michael,"OK, OK, I'll give it back."
michael,For a price.
letty,Good God.
michael,A small price.
letty,I won't do your portion of kitchen cleanup.
michael,No.
letty,And I'm not covering for you when you sneak out to call Dominos.
michael,I want a kiss.
letty,Get serious.
michael,I'm serious.
letty, Everything's a joke with you.
michael,Here.
letty,The medicine's still bothering me. It feels like I have cotton wrapped around my brain.
letty,"I think I've told you all the news. Let's see--the engagement. Oh, and my sister's coming to visit me, and they say my cat misses me."
letty,"I miss Beast a lot, too."
intercom,Hark the Herald Angels sing...
nurse gates,What are you doing?
michael, Not me.
nurse gates,Mrs. Hallstrom?
nurse gates,"Come on. Come with me, Mrs. Hallstrom."
marie,Hot boxers.
letty,I can't believe you finally gave me the shirt.
ruth,Loaned you. And it's only 'til you get out of here.
letty,That settles it. I'm never leaving.
ruth,I can hardly wait 'til you're free. Planning the wedding without you has been a disaster.
letty,You're slowing.
ruth, Mom and I fought for 20 minutes over whether we should go with ecru invitations or brilliant white.
ruth,What do you think?
letty,Ecru.
ruth,And then the gold scroll or the black Romanesque print?
letty,Do we have to talk wedding details?
ruth,"Oh, no, of course not."
letty,"I mean, you can always send me fabric samples to look at or pictures of dresses. But, it's been so long since we've seen each other."
ruth,"Of course. You're right. Besides, we should be talking about your engagement."
letty,Tell me more about Beast beating up that other cat.
ruth,"Bloody furry mess, like I said.  Letty?"
ruth,"What's going on with you, Letty?"
letty,"Ruthie, do you ever wonder if you'll meet someone else...someone besides Jake?"
ruth,"What's his name, Letty?"
letty,I didn't say...
ruth,Don't even try.    What's his name?
nurse gates,"Lights out, Letty."
letty,We're supposed to be asleep.
michael,Exactly.
letty,We'll get caught.
michael,No rounds for another three hours.
michael,Nervous? Scared? Worried you're not fit for a caper of epic proportions? L LETTY Don't be ridiculous.
nurse gates,"Letty, you should be in bed."
letty,There's a spider in my room.
nurse gates,Yeah?
letty,It's got a green dot on its back. I can't go to sleep with it watching me.
nurse gates,Sounds awful. I guess we better check it out.
michael,Extra large pepperoni and mushrooms.  Hillview Psychiatric Hospital on Glenfield. Off the Fourth Street exit.
letty,It had this red spot on its back.
nurse gates,Green spot.
letty,Mottled really.   Green and red.
nurse gates,"I don't know why you feel you have to lie, Letty."
letty,Lie?
nurse gates,"If you feel lonely, or need to talk, all you have to do is say so."
letty,"To talk?  Well, OK, that might be good. N URSE GATES I understand you just got engaged. Maybe that's where we should start."
jim,I'm afraid I can't let you take that in without the proper invoice.
michael,It's a pizza.
jim,"All the same, rules are rules."
michael,"You don't understand. This is a very important, very special, morale-boosting pizza."
jim,"What I understand is how low morale gets when you're posted at a guard station all night, Val."
letty,I don't mean to go on and on like this.
nurse gates,It's OK.   It's good to let it out.
nurse gates,Did you ever tell Paul how you felt?
letty,"He was graduating from law school, and he just assumed I was OK with dropping out.  We never really talked about it. But I know he was disappointed in me."
letty,I mean I'm just not sure I want the same things now that I did even a month ago.
letty,Is that so wrong?
nurse gates,You can only do what feels best to you now.
letty,I guess so. I think that's right.
letty,You've been so great. I just feel a lot clearer about things.
nurse gates,I'm glad.
letty,And if I need to talk again...
nurse gates,"Yes, of course. Whenever you want."
letty,Sorry I'm late...
michael,Shhh.
michael,How's it look?
michael,I like those sapphire earrings myself.
marie,Jesus...just get a room.
letty,I couldn't really say anything because of that fraternizing rule.
letty,"I'm a grown woman, Dr. Emlee.   I can take care of myself. D R. EMLEE What about Michael? Do you know the extent of his..."
letty,"I know Michael's a schizophrenic, and Mrs. Hallstrom's manic- depressive, and John Lockyer has episodes of psychosis, and I heard a rumor that you suffer from delusions of grandeur."
letty,I don't need a lecture.   I care about Michael.
66.,"DR. EMLEE You could be lying next to Michael in bed one night, and he could have a hallucination, or a delusion. It might happen when you're driving or..."
letty,"Look, I know he's almost through with treatment here. And, he's on medication."
letty,I don't want to hear anymore.
letty,"First you tell me to do what I want to, then you tell me to stop."
michael,A daisy for the lady.
letty,The lady knows this is a dandelion.
michael,A rose is a rose.
letty,Thanks.    Where've you been all day?
michael,Back-to-back sessions with the shrink.
letty,Sounds important.
michael,I'm not allowed to see you anymore.
letty,Really?    Me too.
michael,"I had to sneak by the guards to get here. They say you're highly unstable, have a depressive personality, and may hold back my own recovery."
letty,Wow.    I'm bad news.
michael,What's my rap?
letty,Schizophrenic recidivism marked by hallucinations and paranoid delusions.
michael,Fuck.    That's all true.
michael,"Really, though. My thoughts go haywire sometimes."
letty,What are the delusions like?
michael,"I think people are after me, crap like that. "
68.,"MICHAEL When I was 18, my mom came home and found me sitting naked on the kitchen table. I thought I was God."
michael,"Shocking, huh?"
letty,Sure. But I took out a whole grocery store.
michael,I wish I could have seen that.
letty,I'm starting to think that everyone's crazy to some extent.
michael,"M y Grandma Rosa says that some trees get planted in rich top soil, and they grow right up to the sun, tall and straight. Other trees, they start as seeds in the crevices between rocks so they have to twist and bend to reach the light.  But even though they end up crooked, they're still trees, just like the straight ones."
michael, Why in the world did you let me start talking in metaphors? That's no way for us to break up.
letty,Break up?    They wish.
delivery man,"I need a signature, please."
nurse gates,What is all this stuff?
delivery man,"I just deliver it, Ma'am."
nurse gates,"Well, who exactly is it for?"
delivery man,A Mrs. Eunice Hallstrom.
nurse gates,I see. Can you wait a moment?
john,She doesn't know what the hell she's talking about.
nurse gates,"I'm sorry, Doctor. I just need a moment with Mrs. Hallstrom."
nurse gates,"They say she ordered...Mrs. Hallstrom, did you order a bunch of stuff, because Federal Express... M rs. Hallstrom's face glows."
john, Thomas got a crown and all I got was a lousy bracelet?
nurse gates,"Your mother's in the rec room, Letty."
