Speaker,Dialogue
letty,"You too, Mom."
letty,Which flowers did you order?
letty,"Oh, OK, well, better to choose the table cloths first anyway."
letty,This would complement the blue in the bride's maids' dresses. Look.
letty,"We aren't allowed to wear jewelry in here, Mom."
letty,I haven't had a crush since I was
letty,I'll put it out if it bothers you.
letty,What?
letty,"Mom, please."
letty,"Mom, look, if I want to dump Paul, I'll dump him. If I want to screw Michael or live with him or marry him, then I'll do that."
letty," And if I want to smoke, I'll fucking smoke."
thomas,"Mrs. Mayer, I'm sorry but I couldn't help overhearing. I just wanted to say, not that it's any of my business..."
thomas,"I think, really, I think I'd go with the cream damask. I NT. REC ROOM - LATER"
nurse gates,It's OK to be upset.
michael,"Mrs. Hallstrom, why don't you join my family for dinner. You'll love my Grandma Rosa."
letty,"If you change your mind, we'll be in the dining hall."
rosa, Send down the lamb. This girl's as thin as a stick.
letty,"Oh, no.   I'm stuffed."
rosa,"Tell her to eat, Frank."
michael, You can't turn down Grandma Rosa's lamb.
rosa,"Or my eggplant. I make the best eggplant in L.A. The mozzarella I use, it's so fresh it sweats."
letty,I was. I'm hoping I'll still have a job when I get out.
letty,What's she doing?
rosa,Grazie.
michael,"Mrs. Hallstrom, join us. Please."
letty,"Michael, we've got to stop her."
michael,You must have thought about it. Everyone does.
letty,I just want to see Beast.  Where would you go?
michael,The mission up in Santa Barbara.
letty,No way.
michael,That's where I always go when I get out.
letty,Why?
michael,My dad used to take me there when I was little. It's totally quiet. And you can see the ocean for miles.
letty,What else would you do?
michael,I'd like to drink a bottle of red wine with you and then make love to you and spend the whole night together. And we'd get up in the morning and spend hours lounging around and reading the paper.
letty,And we'd eat Spaghetti-O's in bed from the can.
michael,How can you even mention Spaghetti- O's after eating Grandma Rosa's dinner tonight?
letty,I have a terrible confession.
michael,Tell the doctor.
letty,I don't like lamb.
michael,Then it's over.
letty,Lie down.
michael,It's a good thing my family loves you.
letty,Your family just met me.
michael,"You're right. I guess I was projecting. What I should have said is, ""It's a good thing I love you."""
letty,Do you?
michael,I do.
letty,"Michael, I..."
michael,It's OK. You don't have to say anything.
letty,"But I do.     I love you, too."
michael,"Your Honor, I feel I should be released. I'm sufficiently able to look after..."
michael, What? What?
letty,John and Nurse Gates are waiting for you.
michael,"Oh, right.     I'm ready.   How do I look?"
letty," Great. I came to tell you to break a leg, and to give you this for good luck."
judge milton,Why have you petitioned to leave the institution?
john,"I haven't had an episode in more than a month, Sir."
judge milton,How do you plan to support yourself?
john,"My family's helping me out, Your Honor."
judge milton,Where will you live upon release?
john,Live?
judge milton,"Where do you plan to reside, Mr. Lockyer?"
john,With my mother.
judge milton,Is your mother here today?
john,That's the bitch. That cock- sucking bitch. She put me here. She did. She's the Satan that did this all.
judge milton,The records indicate no major episodes in the past four months. And it seems you have the support of the staff.
michael,"Yes, Sir."
judge milton,But I see you've been in and out of the hospital more than ten times.
michael,"Eleven, Your Honor.   But I'm on a new medication now."
judge milton,Do you feel ready to re-enter the world?
michael,"Yes, Sir. My family is    prepared to support me until I find   a job. They've already located   an apartment for me that's   very near them."
judge milton,"Very well, then. By order of the court, you are released. I wish you good luck."
paul,What's so urgent?   You've got me worried.
letty,"I need to tell you something, and I'm not sure how."
paul,You can tell me anything.  Do you want to postpone the wedding? Is it too much pressure?
letty,No...
paul,That's a load off my mind.
letty,"Paul, I want to break off the engagement. P AUL You what?"
letty,I don't mean to hurt you.    I know this is a terrible thing.    And I have really loved you.
paul,"Whoa. Whoa. Have really loved me? Letty, it's natural to be nervous. But we're going to work through our problems."
letty,I've met someone else.
paul,Who?
letty,It doesn't matter who.
paul,Have you been seeing another teacher?
letty,No.
paul,"It's a doctor, isn't it? That's unethical. I'll have him rung up on malpractice charges so fast his head will spin."
letty,He's a patient here.
paul,"Of all the crazy things. I understood when you dropped out of law school. And during this whole mess, I've tried to be supportive. But, really, Letty, what can you be thinking?"
letty,I love him.
paul,You're going to throw away our life together for some shared experience with a looney-tune that you misguidedly think is love?
letty,Here's the ring.
paul,No way. You keep the ring.     You'll come to your senses.
letty,"I've made my decision, Paul."
paul,"You keep it, Letty. This is not over. Our life is not over."
michael,"How's it hanging, Paul?"
michael,Visitor for Ms. Mayer.
letty,Well?        M ICHAEL Home free.
nurse,"Letty, Michael, you have about five minutes until visiting hours end."
letty,Tell me all.
michael,"I was brilliant, or at least boringly sane."
letty,So there were no problems?
michael,Not a one.
letty,And did you go to the mission?
michael,"No, you goof, I came to see you."
letty,Just checking.
michael,I saw Paul leaving.    Did you do the dirty deed?
letty,Yeah.
michael,"So, it's over?"
letty,All over.  Did you see your new apartment?
michael,"One bedroom, second floor, no view."
letty,Furnished?
michael,"No, I need some serious household advice."
letty,"First off, you'll need to go to Target. And, let's see, what should you buy?"
michael,I better make a list.
letty,List schmist. You'll remember.
thomas,Hit me.
thomas,I'm over.
nurse gates," Dr. Stone will ask you some questions, and then we'll get you settled."
nurse gates," Lights out in 15, Guys."
arie,"Wow, that first night is hard."
letty,It's going to be a difficult few weeks for him.
thomas,It really makes you think.
letty,It really does.
marie,I'll put in 5 that it's a straight diagnosis of depressive personality.
letty,"Are you kidding? With those glazed eyes? I'm willing to bet 10 there was some break with reality going on there. Psychosis. Without a doubt, psychosis."
letty,But what I really can't believe is that I'm starting to actually miss work.
letty,"I thought about calling, but I want to wait until I know when I'll be out."
letty,What?
letty,Are you saying I'm through with therapy?
letty,"It's good exercise, Mom."
letty,I've already made arrangements.
letty,"Mom, we agreed. You can visit, but you're not allowed to mention Michael."
letty,Nyet.   That's the condition.
letty,One more and you're out.
letty,A deal's a deal.
letty,"OK, good. That's good. Thanks an awful lot for everything, and for coming down here to see me off."
letty,"I have a going-away gesture for you, too."
letty,"I'll miss you, Mrs. Hallstrom."
nurse gates,"Take care, Letty. And, let me know if you need help with any spiders."
letty,You know I will.       Thanks for everything.
michael,"See you later, guys."
michael,Aren't you supposed to throw a bouquet or something?
letty,Aren't you ever quiet?
michael,Where to?
letty,I've heard the mission in Santa Barbara is the place to go.
michael,This is it -- 3B.     Check it out.
letty,Open up.    I want to see.
michael,Close your eyes.
michael,OK.    Open them.
letty,Wow.
michael,You like it?
letty,I love the pillows.
michael,"Throw pillows, Letty. The sales lady said they're the latest thing."
letty,Very trendy. Let's see the rest.
letty,It's TV heaven.
michael,I was tired of watching what everyone else wants to watch. Now we can watch two shows at once.
letty,Let's try out the bed.
michael,You've got to see the kitchen first.
michael,Do you like it?
letty,I love your apartment.
michael,Really?
letty,You'll never get rid of me.
letty,What do you say we go out to dinner to celebrate?
michael,Out? Are you kidding?     I've got all the fixings here.
letty,How can you not like the Top 10 List?
michael,I like it.     But Headlines are better.
letty,You're so wrong.
michael,Hey.
letty,It's sex time.
michael,I think it's my turn.
letty,Did I get spaghetti sauce on my face?
michael,No.
letty,Michael.
michael,Shhhh.
michael,Letty?   Rise and shine.
letty,Not yet.
michael,I'll be forced to tickle you.
letty,I'm supposed to meet the principal in half an hour.
michael,I'll see you tonight.
letty,Good luck.
michael,"You, too. Kick ass today."
letty,My apartment tonight.   You can meet Beast.
michael,"Sounds good. Oh, and Letty?"
letty,Yeah?
michael, You've got one hell of a great body.
principal gail,I didn't have any choice but to include the parents' letters in your file.
letty,"Well, I understand.     I know my behavior was poor."
principal gail,"So, in light of how the parents feel, and the fact the students are doing so well with the substitute, I don't think I can put you back in the classroom just yet."
letty,"Look, Gail, I've been a good teacher."
principal gail,"I know, Letty. But the incident with Zach was frightening for the children.  Now if you'd come to me, explained what was going on..."
letty,"Believe me, I wish I'd understood what was going on. I've worked really hard to get better. P RINCIPAL GAIL I'm glad you're doing well."
letty,I've already thought about how to tell the kids where I was.
letty,"And I'd like to send the parents this letter of explanation. With your support, I think they can accept me."
principal gail,It's a very nice letter. But I have to go with what's best for the students.
letty,What does that mean?
principal gail,I need someone to work on budget projections.
letty,Office work?
principal gail,"Or, of course, you could take a sabbatical the rest of the year."
michael,"I know, but as I said..."
michael,I can do the job.
michael,Right.   Thanks for your help.
letty,It's open.
michael,"Gosh, Letty, this is a great place."
letty,Thanks.
letty,That's Mr. Beast to you.
michael,How was your day?
letty,I bombed. It's either work in the office or nothing.
michael,Sounds grim.
letty,Yeah.    How was the job search?
letty,Who ever said sanity was fun?
michael,It doesn't matter.    It'll work out.
letty,Promise?
michael,Promise.  As long as we have steak.
letty,Steak?
michael,It's a well-known fact that a red- meat dinner can cure the blues.  You and Beast wait here. I'll be back in a jiff.
michael,While I'm gone why don't you slip into something a little more naked?
lady one,I can't believe he did that.
lady two,What a weirdo.
michael,"Don't ever talk about me again, you hear me?"
letty,I thought maybe you got lost.
michael,The store was busy.
letty,You got wine. That's great.
michael,Would you mind if we just called it an early night?
letty,You go ahead and relax. I'll cook. M ICHAEL I think I should go home.
letty,Are you OK?
michael,Big restaurant interview tomorrow.
letty,But what about the red meat-blues thing?
michael,"You know, we've got that dinner with my parents tomorrow, too. I should really get some rest tonight."
letty, How's filet sound?
michael," No, no, no. Not now. No."
letty,I'll never Mget the hang of this.
letty,"Hi, Frank."
letty, Maybe we should make lamb next week.
letty,How'd it go?
letty,What happened?
michael,Four interviews. Four no-gos.
letty,"The restaurant, too?"
michael,I couldn't even face that one.
letty,That's OK. We can call and reschedule in the morning.
michael,"You don't have to take care of me, you know."
michael, Just promise you'll love me even if I end up in a job where I have to wear a blue polyester cap.
letty,I think you know I'd love you even more in a blue polyester cap.
michael,Coming.
letty,I think I could get the program up and running in the next two weeks.
johansen,From what I understand the principal has removed you from student activities.
letty,She's worried that I'm unstable.
letty,But I wouldn't push for the program if I wasn't ready.
johansen,What about the office work?
letty,"I'd have to do that, too. But I've gotten better at pacing myself."
johansen,Are you sure?
letty,I'll call you if I have problems. Scout's honor.
johansen,I have to say I'm inclined to give it another try.
johansen,"But, Letty, why don't you give yourself three weeks to set it up this time?"
michael,"Hey, Letty. Mrs. Mayer."
letty,I got worried. Are you OK?
letty,Congratulations.
letty, Michael just got a job.    Couldn't you congratulate him?
letty,"He's been looking everywhere for weeks, Mom.   It's not that easy after you've been locked away."
letty,I'm going to take that as an honest effort at being open minded.
letty,Just remember that I love him.
michael,Aunt Lily is the one who married your father's cousin?
letty,"No, that's Aunt Connie. Lily is the one who looks like a hooker."
michael,"Oh. And, Harry, he's the one who likes magic?"
letty,You don't have to know all this by Saturday. It took me years.
aunt lily, What a beautiful wedding.
michael, Aunt Lily?
letty,Bingo.
ruth,The worst was when I stammered Jake's name.
letty,I don't think people even noticed. I thought the ceremony was perfect.
ruth,That's thanks to all your help.
letty,"Uh oh, Uncle Cort at 6 o'clock."
ruth,Sorry to do this to you. But I am the bride.
cort, I don't think I've seen you in two or three years.
letty,Has it been that long?
cort,You were with that lawyer.
letty,I'm dating Michael now.
cort,Met him in the receiving line. What is it that he does for a living?
letty,"Well, he just got a job... M ICHAEL In the restaurant business."
cort,Speak of the devil.  How did you guys meet again?
letty,At the psych hospital.
cort,"I would've sent a card, but your aunt and I, we weren't sure if that was the thing to do."
letty,"That's fine, Uncle Cort."
cort, So you were a volunteer over at the hospital?
michael,Something like that.
letty,When he could get time off from the restaurant business.
michael, How about a dance?
cort,You two go ahead. I'm going to go bother that pretty sister of yours for a dance.
letty,"Bye, Uncle Cort.  What's with the lie?"
michael,It wasn't exactly a lie.
letty,Pretty close.
michael,People at weddings don't want the truth.
letty,It's not good to drink so much with the medication you're on.
michael,What's with this music? I'll go talk to the D.J. and see if we can't get something good going.
letty,"Thanks, dad."
letty,Michael?  Michael? You should come to bed.
letty,Did you take the aspirin and water? You don't want to feel awful in the morning.  I'll get you some.
letty,What is it? Are you OK?
michael, Always the drugs.
letty,What?
michael,I saw you talking to my Mom.
letty,"We both talked to her, Michael. And your dad."
michael,Why'd you tell her I wasn't taking my meds?
letty,What do you mean not taking your meds?
michael,Why'd you tell?
letty,"I didn't talk to her about medications, Michael. Don't be silly."
michael,Silly?   Silly am I?
letty,"Michael, take it easy."
michael,"Silly, silly, silly."
letty,I think I should call someone.
michael, Don't upset my Mom.     Don't you upset my Mom.
letty,"Michael, calm down. Please. It's OK."
letty,"Michael, stop."
michael,Not my Mom. Not my silly silly Mom.
letty,I've got an emergency.    I'm at...
letty,1450 North Jenkins. Apartment 2. My boyfriend's out of control.
letty," No, he's having an attack. He's schizophrenic..."
letty,"I'm sorry, so sorry.   I never should have called."
ruth,You did the right thing.
letty,I ruined your wedding night.
ruth,"I'm glad you called. Now, not another word about it."
ruth,Oh my God.
ruth,Did he hurt you?
letty,"Oh, Ruthie, what am I going to do? R UTH You don't have to make any decisions tonight."
letty,But what am I going to do?
ruth,Do you want to go see him? I'll take you if you want to go.
letty,I can't.    I can't see him there.
letty,"I was so sure. I really thought it would work.  We have plans, Ruth."
ruth,I know.    I know.
paul,I'm glad you agreed to see me.
letty,I'm just glad there aren't any hard feelings.
paul,"Oh, none. None. I completely understand what was going on."
letty,Oh.
paul,How's work going?    Are you back at school?
letty,I start on Monday.
paul,So things are back on track?
letty,Getting back.
paul,I heard about your friend.
letty,What?
paul,I heard your friend was back in the hospital.
letty,Michael.   Yes.
paul,"I just wondered, well, if this meant there was a chance for us. Because I think about you a lot, and I still feel..."
letty,"Our relationship meant a lot to me, too, Paul. But it's over.  And Michael being in the hospital doesn't really change things."
paul,I think I've heard this speech before.
letty,I'm really sorry.
letty,"Sure, I understand."
letty,Wait. Wait.
letty,I need to give you this.
nurse gates,He's in Jamie's old room.
letty,Hi.
michael,Hey.
letty,I guess we need to talk.
michael,I guess so.
letty,It's hard to know where to start.
michael,Pretend like I'm your shrink.
michael,Sorry.   I'll be quiet.
letty,I think about you all the time.
michael,I sure know what that feels like.
letty,And all the plans we have.
michael,"Yeah, the plans."
letty,"I've been thinking I could try to visit you at night after work, and then there'd be more time on weekends to see..."
michael,"Letty, please. L LETTY What?"
michael,Like I've told you before I don't want you taking care of me.
letty,"Someone has to take care of you right now, Michael. You tore up the apartment. You stopped taking your medications."
michael,But that wasn't me.    I didn't mean to do that.
letty,Well then why'd it happen?
michael,I don't know. I don't fucking know.
letty,I'm sorry.     I didn't come here to blame you.
michael,I didn't mean for any of this to happen.
letty,"Oh, God, Michael, I know.  Why does everything have to be so hard?"
letty,What are we going to do?
michael,What do you want to do?
letty,I know I don't want to lose you.     I don't think I could stand it.
michael,"Yeah, but can you stand to be with me like this?"
letty,"No. I can't, Michael. I'm so sorry, but I just can't handle all this right now."
michael,I know.   I can't either.
letty,I love you so much.
michael,"I love you too, Letty.     I love you, too."
letty,Maybe we could just run away to Tahiti and live on the beach.
michael,That's the best idea I've heard in a long time.
letty,Don't you have a magic trick or something to make this easier?
michael,How about something better?   Like a kiss. T he couple kisses more tenderly than ever before.
letty,"I can still come visit you, you know."
michael,Would that really be such a good idea for either of us?
letty,"Just promise me you'll be OK, OK?"
michael,I will. And you make sure you take care of yourself.
michael,Promise you won't fall for any guys pretending to be doctors.
letty,I guess I should go now.
michael,You should go.
letty,"First of all, I want to welcome you to MathShop. I have lots of fun games planned for us.  Let's see, Bobby, can you help me pass out these cards?"
letty,"Is something wrong, Bobby?"
bobby,Why were you gone so long?
jenny,My mom said you went crazy.
letty,I had what some people call a nervous breakdown. I wasn't dealing with life so well so I went...
bobby,To a place for psychos.
letty,To a psychiatric institution. J ENNY What's that?
letty,"It's a place where you figure out what you want, and what things in your life aren't working. You learn to look out for yourself and not get..."
letty,Let me show you the best thing I learned.
