Speaker,Dialogue
written by, Mark Bomback & Patrick Marber
jonathan,Do-you have tomorrow's Times yet? The grizzled OLD MAN behind the counter doesn't look up.
old man,It is tomorrow.
jonathan,"Right. I forgot. The Old man grudgingly bends to cut the plastic on a fresh stack of newspapers. As he does, Jonathan glances at numerous porn magazines on display. Naked women smile back at him --"
old man,Anything else?
jonathan,"Uh - no. No that's it, thanks."
jonathan,"Solange, you're up so late?"
solange,"So early, Jonathan. We open in one hour."
solange,But why else does a young man come home at such an hour?
jonathan,"Just working late, that's all."
solange,"Every night working late, working late.  Ah, you can't fool me. You are Mister Mischief maker - I know this! You come by"
lawyer 1,"So, the Knicks win last night?"
lawyer 2,"I'm pretty sure, yeah."
jonathan,"Actually, they lost by 4. Both pause, turn to Jonathan. Jonathan smiles awkwardly."
jonathan,It was supposed to be a good game though.
lawyer 1,"Oh.  Hey, so. did you get a chance to look over that memo from Watkins?"
jonathan,Yes?
jonathan,That certainly is                                               - something.
jonathan,Maybe they're developing a fly with a nursing degree. A superfly.
jonathan,"Uh, Jonathan Messer."
jonathan,"None. I'm from Worth and Berman. I've been over here a few wee-- A FLUSH from the next stall cuts him off. The sound of zipping up, of a belt buckled, then of a stall door opening."
jonathan,"Audit manager, yeah."
jonathan,"Have laptop, will travel. What about you?"
jonathan,"Well, I didn't get your name for one.th-- The SOUND OF A FAUCET RUNNING drowns him out."
jonathan,Sorry - I didn't catch that?  Hello...?
wyatt,"Sorry if I scared you. I was heading home and saw the lights. We met before, in the can..."
jonathan,"Sure. It's Wyatt, right? WYATT BOSE nods as he steps into the room. There's something very likeably ""on"" about him."
wyatt,So do you normally work this late?
jonathan,Pretty much. I'm supposed to be out of here by tomorrow so I'm just trying to finish up. What about you?
wyatt,You kidding? This is an early night. Hard to believe that once upona time a man's success was measured by how little he had to work. You know in Sweden the average worker gets 7 weeks a year vacation?  Do-you like accounting?
jonathan,"It's all right, if you enjoy working with numbers. Do you like being a lawyer?"
wyatt,"It's all right. If you enjoy working with assholes. Jonathan laughs, glances at his monitor screen."
wyatt,"Well, I'm probably disturbing you -"
jonathan,No - it's okay. Really.
wyatt,"So Worth and Berman, huh? Don't you have to like be in Mensa to work there? Jonathan smiles, shrugs modestly."
wyatt,Been with them long?
jonathan,Since my senior year of college. They subsidized my graduate degree.
wyatt,Really. So you were poor? Jonathan is given pause by the bluntness of the question.
jonathan,"Well - I guess you could say that. I was raised by a single mother, and she died when I was nineteen, so... yeah. It wasn't so bad though. I'm sure a lot of people have had it worse."
wyatt,Not around here. Practically every suit I know is Harvard by way of Andover.
jonathan,Are you?
wyatt,"Me? Hell no... I'm Princeton. By way of Exeter. Jonathan laughs. Wyatt smiles, takes a few idle paces."
wyatt,So. Jonathan.
jonathan,"I don't know... I used to have friends. But it's like I've spent so much time trying to prove myself, working these hours                                                           - you can only do it so long before you look up and realize you've lost"
wyatt,Jonathan?
jonathan,Yeah?
wyatt,"By the clock on the wall there? You've just talked for                                                 37                                       minutes straight. Wyatt looks at Jonathan -- and cracks up. Jonathan hesitates, then he too starts to laugh so now they can't stop, their laughter filling the expansive room -- until it's drowned by the SOUND ADVANCE OF POURING RAIN..."
jonathan,"Uh,.either one is                                               -- I mean the N and the R both stop there so, you know, either way, I mean, this is the right train. Yes. SOS Of Thanks. ""S"" enters her car. Jonathan wavers, wants to follow into her car but doesn't have the nerve. He enters a different car."
jonathan,I guess that's it. then. Nice meeting you.
assistant controller,"Uh huh. Jonathan turns to go, takes two paces - then turns back."
jonathan,Listen - could you point me toward Wyatt Bose's office? The Assistant Controller looks up in mild annoyance.
jonathan,"Wyatt Bose. He's an attorney here. She sighs, put upon, then slides out a desk drawer in which a laminated page of names and extensions is taped. Jonathan's eyes follow her lazy finger down the list --"
wyatt,"Leaving, huh? So where to next?"
jonathan,Clancey Funds on Thursday. Clute Nichols after that. Wyatt's about to reply - when ANOTHER LAWYER passes him in the hall. Wyatt taps the lawyer's shoulder.
wyatt,"Hey, wait up a sec.  Well, good meeting you, Jonathan. ,Wyatt turns and starts to walk off with the other lawyer. Jonathan bends for his briefcase -"
wyatt,"You don't happen to have .a. decent backhand, do you?"
wyatt,Out!
wyatt,"Commiserations, Messer. Good game. They shake hands at the net. Jonathan is exhausted."
wyatt,"They asked if we'd fancy a post-game cocktail. Don't worry, I got us out of it. Jonathan is barely able to speak."
jonathan,Oh? I would've been happy to.
wyatt,"Are you kidding? They're a couple of first years at Merrill. Screw that, we can do better. Hey, you OK? Jonathan nods as an amused Wyatt helps him to his feet."
wyatt,"Man, I remember when these first came out. I think I was a frosh at boarding school.  Jeez, are these strings natural gut?"
jonathan,"Actually, it's a hybrid weave: natural gut and Kevlar. They're pretty obscure now. I should replace them, they're all frayed..."
wyatt,"Have you ever considered contacts? Jonathan halts, confused to find Wyatt studying his face       - his eyeglasses in particular."
jonathan,"Huh? Oh - yeah, I tried once, but I was allergic to something in the solution."
wyatt,Too bad. You have an attractive face. Your eyes especially. Jonathan looks self-conscious in his towel.
wyatt,"It's not a come on, just an observation.  You don't get much, do you."
jonathan,What - you mean sex?
wyatt,"No, flood insurance. How many women have you slept with?"
jonathan,"Oh, I don't know, not a whole-"
wyatt,Of course you know. Everyone knows.
jonathan,Maybe - four.
wyatt,Maybe four?
jonathan,"Okay fine, just four. What about you?"
wyatt,Me? I have no idea.
jonathan,What? You just said everyone -
wyatt,"I meant everyone like you. Confused, Jonathan looks up -- as Wyatt disappears into a shower stall."
wyatt,"There better be. Wyatt hangs up, looks up to find Jonathan staring, puzzled."
wyatt,"Something wrong? Jonathan reaches into his locker for his hanging jacket, and pulls out his own cell phone. It's identical to Wyatt's."
jonathan,We have the same phone.
wyatt,"Oh - and you thought I was using yours? I can afford my own phone calls, you know."
jonathan,"No, I wasn't                                                   -- of course you can-"
wyatt,"I'm pulling your dick, Jonathan.  Actually, I was just firming up some plans for tonight. Are you free?"
wyatt,"You're not. What do you say, are you in?"
jonathan,I guess I could go home and change.
wyatt,"To Brooklyn? Forget it, you can borrow something of mine."
wyatt,"t                                                               a                       uten Abend, Herr Kleiner.  This way, Jonathan."
wyatt,"Like it? It's a Gerhard Richter. Kleiner downstairs is a hot shot art dealer - he hooked me up with the gallery in Munich. Wyatt disappears into the next room. Alone, Jonathan wanders, pauses by the framed snapshots. The young people in them are like Wyatt -- beautiful, strong, wealthy. Jonathan pauses by one photo in which Wyatt looks a bit younger, his hair bleached blonde and loosely spiked."
wyatt,"Here, try this one.  What?"
jonathan,"Nothing, I just hope I can pull it off."
wyatt,You hope you can pull it off. You know who you remind me of? James Getz.
jonathan,Who?
wyatt,"A guy I roomed with freshman year at Princeton.. Real smart                                 - witty too, when you loosened him up. Only from day one, he just didn't fit in. For starters, he was dirt poor. But it wasn't that. See, there was always this boundary - this wall - between Getz and everyone else. You could argue we laid the foundation, but he built it. Built it by believing the lie."
jonathan,What lie?
wyatt,"That he was any different. The clothes, the money, the wry anecdotes - it's all one big masquerade. Anyone can get in, you've just got to wear a costume. But Getz never got that. He assumed he could never scale the wall, when the truth is he was the only one guarding it. It never occurred to him his anonymity could be an asset. No one gets over like the guy who's just a face, an impression. We are - all of us                                                  - only who we're perceived to be."
jonathan,So what happened to him?
wyatt,"Who, James Getz? Oh - he killed himself."
jonathan," You're pulling my dick, aren't you. Wyatt turns to him with a grave look... then smirks."
wyatt,With both hands. Jonathan can't help but laugh as Wyatt hands him the suit.
emcee,"And now, straight from the Cafe Germaine, the Velvet Rope is proud to introduce you to the lovely Miss Lu Lu Lamour!"
wyatt,"It's a little self-conscious, but I thought you'd get a kick out of it. How's that suit working out?"
jonathan,"Oh - great, actually."
wyatt,"Keep it then. I've got two just like it. Jonathan's about to protest, when a WAITRESS arrives."
waitress,"Two Macallan 25 year. Enjoy, gentlemen."
jonathan,Isn't this like fifty bucks a glass?
wyatt,"We'll try not to spill any.  So what's the wildest thing you've ever done? Sexually, I mean."
jonathan,"The wildest thing? Oh I don't know, I've never been too adventuresome."
wyatt,"All right, what's the lamest thing then?"
jonathan,"The lamest... Wyatt's focused on him, amused, eager to hear it."
jonathan,"Actually, that was probably a few months ago. I was flipping through money magazine and saw this small ad in the back. It read something like ""Are. you feeling all alone? Looking to meet women but have forgotten how?"" And-there was this number."
wyatt,And you called it? So what happened?
jonathan,"Nothing actually. The phone just kept ringing. And that's it. Wyatt stares at Jonathan a beat, then starts to crack up."
jonathan,Lame enough for you?
wyatt,"You called a sex ad - from Money Magazine. That is beyond lame. Jonathan too starts laughing - when the phone at their table lights'up. Wyatt looks to Jonathan, raises a brow - then picks up. He listens a moment, smiles, hands it to Jonathan."
jonathan,".Hello? Wyatt taps his shoulder, directs his gaze to a SEXY BRUNETTE at a distant table, receiver to her ear, eyeing Jonathan."
jonathan,".All right... Goodbye. Jonathan hangs up, turns to Wyatt."
jonathan,She wants to dance.
jonathan,"She's a hooker. Wyatt shrugs, grinning."
jonathan,Hold on - you knew? What - are all the women here prostitutes?
wyatt,"That depends on what you mean by that word. Stretch the definition and you could incorporate most of the men as well.  You know in Amsterdam prostitutes not only belong to a union, they have to pay taxes."
jonathan,You seem to possess quite a store of international trivia.
wyatt,"Not really. I just get around... Jonathan, relax. It's not like she just shot your dog. I was only trying to help. Besides, what are you looking for - a relationship? As if you have time for one? This was your first day off in how long?"
jonathan,Three weeks.
wyatt,"Four for me. Face it, we've mortgaged our youth. Pimped out our twenties. But we still have needs. And there's nothing shameful about wanting them met."
jonathan,So you sleep with hookers?
jonathan,"So how do you - meet your needs? Wyatt studies him a beat, another French love song drifting in the background as the Emcee introduces a new girl."
wyatt,"What if I told you...  Christ, I sound like an infommercial."
jonathan,What were you going to say?
wyatt,"Listen. You don't think that women have these same urges? Young women, just like ourselves, successful and working their asses off to stay that way? You better believe they do."
jonathan,And?
wyatt,"And - well - let's just say, there's a way...a way it can be taken care of."
jonathan,"You make it sound like a mob hit. Wyatt smiles, and turns his attention back to the floor show."
jonathan,"What you were talking about, before. Peoples' needs... Wyatt turns to Jonathan with a grin:"
wyatt,Some other time. 
wyatt,Hey. You had a good time tonight?
jonathan,Yeah. Yeah I did. Thanks.
wyatt,"I'm glad. Listen, that thing with the hooker, I'm really sorry if I                                   -"
jonathan,"Forget it. It was funny. Wyatt smiles warmly, pats Jonathan's shoulder."
wyatt,"I'll give you a call tomorrow. Wyatt                                                           climbs out. Jonathan watches through the cab window as Wyatt disappears into the golden glow of the lobby. LATER: Driving in the cab, Jonathan catches his reflection in the glass. He smiles, liking how he looks in Wyatt's suit. Outside, rainy Manhattan passes by ina hypnotic blur."
jonathan," Hey. Could you let me out at the next corner over there, on 7th Avenue?"
clancey controller,"Any problems, you'll want to see Julie Levinson, she's our assistant controller                       - or if she's busy, Scott Werner, our senior accountant. If Werner's unavailable, we have two staff accountants                                     - but like I said, I don't anticipate any problems. I mean we've never had any before, so..."
jonathan,Right.I just need the access codes for the accounts and sub-accounts? The Controller suddenly looks uneasy.
jonathan,"You've got account numbers, but no access codes. Without those I can't get the banks to authorize statement verification.  Besides, how else can I steal the money?"
clancey controller,What?
jonathan,"Nothing, I was just pulling your-- leg. I do need those codes though, when you get a chance."
jonathan,How'd you know it was-
wyatt,"I wonder what the Founding Fathers would make of this scene. Wyatt regards face after face of young men and women wearing expensive suits, wolfing down lunch so they can get back to work - a good 2/3 of them talking on cell phones as they eat."
jonathan,"I'm just glad to be outside.  I've got to tell you, this has been great, meeting up for lunch. I used to just- A cell phone RINGS. They both instinctively reach in their jackets, take out their identical phones. It's Wyatt's that's ringing. Jonathan rests his down on the ledge."
wyatt,"Yes?... Shit. Okay, see if you can.gettme on the 6:15                                                     out of JFK tonight... Fine. Wyatt rests his phone on the ledge next to Jonathan's."
wyatt,Rutherford needs me to join him asap in London to paper some financing with Lloyds. I tell you about this?
jonathan,No - no you didn't.
wyatt,"Yeah, I should be gone a few weeks. Jonathan tries to mask the wave of loneliness setting in."
jonathan,Sounds exciting.
wyatt,"Nah, it'll be boring as sin."
wyatt,"Shit, I'd better get back. You ready?"
jonathan,"Jonathan Mess- CLICK. Dead air. More puzzled, Jonathan frowns a beat          - then replaces the battery with one fresh off the charger."
secretary 1,".That's just it. You caught him in a lie, so now everything he says you have to- RING of a cell phone. RING... RING... It's Jonathan's. Surprised, he takes out the phone, presses talk."
jonathan,"Hello? A soft, electronic rustle from the other end... then:"
jonathan,Excuse me?
jonathan,"I'm sorry, I think you have the wrong--"
jonathan,Hello? The CRACKLE OF STATIC on the other end. Then:
jonathan,"Actually I am, but I don't think I'm who The static on the other end worsens."
jonathan,"I said I am free, but I                                         -"
jonathan,"The hotel? I - I guess, but -"
jonathan," Hi, it's Jonathan, I've got your cell! I guess you must have mine. I imagine you're in the air now, but call when you get this. if you do. Oh, and you got a call from someone who I'm...forget it, just call me. Jonathan hangs up."
cabbie,So where ya visiting from?
jonathan,Excuse me?
cabbie,"You're from out of town, right?"
cabbie,Huh. I can usually tell. You seem like a tourist.
jonathan,I've lived here all my life!
cabbie,"No offence, pal. The cabbie pulls over on Central Park South. Jonathan leans forward, peers up at the gorgeous French Renaissance facade."
cabbie,"Well, here ya are. The Plaza."
the blonde,Are you waiting for me?
jonathan,"I                                                                - think so, yes. You're here for Wyatt, right?"
the blonde,"Excuse me?  I'm sorry, did we speak earlier?"
jonathan,Yes. Yes we did -
the blonde,Good. Let's go then.
jonathan," Look, I don't think I'm -- I mean; you and I., we don't know each other...? She turns to him, the slightest smile on her thin lips."
the blonde,No fooling. DING. The doors open. She steps out. A beat. He follows.
the hallway,"Walls, carpeting - details all classically gorgeous. The Blonde keeps a quick pace, headed toward a room."
jonathan,"What I mean to say is, I'm fairly certain there's been some kind of mistake."
the blonde,You're not who I spoke with on the phone?
jonathan,"No - I mean, yes, but -"
the blonde,You're not attracted to me?
jonathan,"Oh no, it's not that at all, it's just                          -"
the blonde,"It's just what... exactly? She turns, steps toward him. Jonathan opens his mouth to explain -- when she covers it with hers. It takes him a moment to succumb to her kiss... but not too long."
the blonde,"Fuck. LATER: Jonathan lies post-coital. A smile. And then a look of mild anxiety, 'what's going on'? He turns to the Blonde but she's fast asleep."
desk clerk,"Sir, I'm showing that room as having checked out at                                                 6:20                                   this morning."
jonathan,Well could you tell me the name of the guest who was staying there?
desk clerk,"I'm afraid we're not allowed to disclose information regarding our guests. If you give me her name, I can confirm if she was registered here."
jonathan,"Actually, the thing is... it's okay. Forget it."
jonathan,Hello?
wyatt's voice,"Hey, you're up early!"
jonathan,Hi! How's London?
wyatt's voice,Raining. So you've got mine-and I've.got yours?
jonathan,"Yeah. Listen, last night...um...I met this-"
wyatt's voice,"Damn! Sorry, I'm gonna have to call you back, they want me in a meeting. Hey, no long distance calls, okay! Wyatt hangs up. Jonathan shakes his head, amused. He hails a cab, glances back at the hotel. His lips curl into a vaguely proud, if still dazed, smile."
jonathan,"Hello, um - I'm sorry to bother you                             -"
jonathan,Through a friend.
jonathan,wait - Jonathan fumbles for what else to say before she hangs up.
jonathan," Are you free tonight? He shuts his eyes, ready for a hang up. A long silence."
jonathan,Where. Right... The Plaza?
jonathan,The Shakespeare?
jonathan,I'm - supposed to meet someone here and-
british accent,"You're rather new to this, aren't you? Jonathan falters. She smiles."
british accent,That's okay. I like that.
lobby elevator,"She enters first, then Jonathan. He waits for her.to push a button - only it seems she's waiting for him to do the same."
jonathan,"I'm sorry, what floor? She rolls her eyes."
british accent,Frankly I'm surprised that whoever gave you access didn't explain more.
british accent,The initiator is responsible for the room.
jonathan, Oh - so I should...?
british accent,Precisely.
jonathan,So are there a lot of - people - who do this? She turns to him with a look of growing impatience -- when the CREAK OF A CART causes them to glance up: a ROOM SERVICE WAITER is crossing past the far end of the hall. Jonathan turns back to find her staring at him uneasily.
british accent,How did you get into this?
jonathan,"Well, a friend of mine -"
british accent,He uploaded your numbers but failed to explain the basics?
jonathan,"He's                                                          - well, he was going out of town.  I'm doing something wrong, aren't I?"
british accent,"It's not that, it's just... well, you strike me as something of a stowaway. In fact if I were more suspicious, I'd say you didn't belong here at all. Flustered, Jonathan's about to offer some explanation ---"
british accent,But obviously somebody felt you did. The notion suddenly registers with Jonathan -- Wyatt!
british accent,"And I'm a sucker for bashful boys... She takes his wrist, traces a finger over his palm... and removes the key card from his hand."
jonathan,Can I ask you something? Why do you do this?
british accent,Why are any of us doing this? For the economics of the arrangement.  It's intimacy without intricacy. Jonathan's about to reply --
british accent,"Look, I've got a 7                                            a.m. breakfast, so... She says no more. Jonathan stares up at the ceiling a beat."
jonathan,Well - good night.
jonathan, I've been kinda busy too! I've been wondering - did you mean for me to take your phone?
solange,"Jonathan, for so long I don't see you!"
jonathan,J'ai ete tres occupe. with work. He's exhausted. And no longer so exhilarated by his nightly activities.
solange,"Work? No, no. You believe you can trick me, Mr. Mischief Maker! I want to meet this lady friend of yours. Jonathan is about to protest -"
solange,"Ah., ah                                                        - ecoutez, I have beautiful winter- roses, just. arrived. She.will swoon... Jonathan smiles, but there's a reticence to it."
jonathan,"Maybe later, okay?"
solange,"There is no later when it comes to love! If you find it, you must not let it go."
solange,There really is no one? Jonathan evasively shakes his head.
solange,"There should be, Jonathan. It is not good for a young man to be too much alone. He gives her an uncomfortable smile. She smiles back, but as she heads inside, she looks both-sad and worried for him. Jonathan continues up the steps, opens the front door and disappears inside. We remain on the vacant street, hear his FOOTSTEPS climbing the steps - and then the muted RING of his cell phone. A beat, then another... .and the front door opens again as Jonathan steps back out into the night."
woman,"Excuse me... He doesn't breathe. Utterly stunned, he turns to confirm... It's her.                                                       -It's ""S""."
jonathan,"Before we...um, the thing is                                   - I know you. She glances up, curious                                        - her hand lingering by the front clasp of her bra."
jonathan,"Not 'know' exactly, but we sort of met before. In the Times Square subway station. It was raining..."
jonathan,You had no umbrella. You were soaked.
jonathan,"Then you asked me if the N train stops at Canal. She squints back at him, vaguely recalling him. She smiles warmly and continues to unbutton her blouse."
jonathan,Wait.
jonathan,"This just seems strange, that's all."
jonathan,"Maybe. I don't know, it's just                                 -"
jonathan,It's just that-
jonathan,Wait - don't go. She glances back curiously.
jonathan,"What I mean is, by any chance... are you hungry?"
jonathan,"sorry, I'm a messy eater. s Me too. Jonathan rubs at his chin with a napkin, misses. she takes the napkin, dabs it in water and cleans him up."
jonathan,Thanks.
jonathan,"By the way, my name's-"
jonathan,"The 'rules' seem to specify no conversation either. as., They are a little rigid, aren't they? But I think we should obey the 'no names'. It'll be fun!"
jonathan,"Ah, but I know.yours begins with an 'S'. Sir Is that right?"
jonathan,"I saw part of the monogram on your briefcase. ./ S If I see-Excellent work, Holmes.  Maybe I'll tell you if.you guess... Her face is an inch from his, the moment mysterious   and           sexy."
jonathan," Hmrn...what do we know of her? She sports a camel coat, a briefcase and possesses no umbrella. I deduce...her name is 'Sybil'. 'S' laughs."
jonathan,Sarah? Sara? Samantha? Sandra? Susan? She makes a little sound of encouragement. Hun...
jonathan,Aha! Sue?  Suzie with a 'z'? You're saying my name is 'Suzie'?
jonathan,is it?
jonathan,"I've got to tell you, I'm much better with numbers... How about Sonia? Sheena? Wait - Sophie! You're definitely a Sophie."
jonathan,Either.
w7,Neither.
jonathan,How about Syd? As in Syd Charisse? She was Cyd with a 'C'!
jonathan,"But maybe you spell it with an 'S'? ,, S . If I do not."
jonathan,Steffi? Sexy Steffi soaking in the:rain?. She                                                         mock-frowns.
jonathan,"Sally? Sally with three 'l's? She                                                         shakes her head, amused. Jonathan rubs his chin."
jonathan,"Hmmm. Hmmm. The mysterious 'S' alighted from the train at Canal Street. She may well be from 'downtown'...hmm...ah! Of course! How foolish I've been; Sinead. 'S'                                                         giggles, charmed by him."
jonathan,Stella? Sky? Sunbeam?
jonathan,Absolutely. To me you are 'Sunbeam'.
jonathan,Can I ask what you do for a living? You first.
jonathan,I sit behind glass and watch people pass like fish. She smiles - a more interesting answer than she expected.
alsip,You work in a bank?
jonathan,"Nahh, I'm... I'm kind of an accountant. us,, Now I bet that's just what you wanted to do when you were a kid!"
jonathan,Oh yeah. I'm living the dream. Feel free to leave now. u S Still here.
jonathan,So what about you?
jonathan,A pro tennis player.
