Speaker,Dialogue
jonathan,"This is Detective Russo, NYPD, badge number 274655.                                                                                                                     1   just need some information from you guys. Jonathan sits in suspense, awaiting a response. Finally -"
jonathan,"You've got a case, a missing person named William Bansky. I'm wondering if you can tell me the date he was last seen?"
jonathan,"That's it, thanks. Jonathan quickly hangs up, equally encouraged and chilled by the connection he's made. TILT DOWN to a post-it, on which he's scribbled: ""BOSE = BANSKY = HOLLOWAY."" To this he adds: ""= JAMES GETZ"""
teller,"M'kay, if you'll just swipe your ATM card. She gestures to a small punch pad to Jonathan's right."
jonathan,"Actually, my card was stolen."
teller,Mmm'kay... do you see those two taupe colored telephones over there? Just pick up either one and you'll be connected with our automated system.
jonathan,"The thing is, I already used your automated system and...look, this passport's all I have left, it's the only thing proves who I am and now I'm down to like my last ten dollars here, so... Jonathan's cool is cracking. The Teller wrinkles her brow."
teller,"Mm'kay, if you press ""0"" on either phone? A customer service representative will -"
jonathan,Give me a goddamn break.
teller,"Sir, there's no need for profanity."
jonathan," Oh no? In the last few days I've seen a woman I thought might be dead turn up alive and a woman I assumed was alive turn up dead, both at the hands of a guy about whom everything I know is apparently a lie. I've had my building set on fire, my neighbor nearly killed, and my apartment ransacked. So please forgive my language, but it's been one fuck of a week. The stunned Teller stares back at him slack-jawed."
jonathan,"Look, I know I'm just another face on this side of the glass, I get that. But I'm begging you, as one human being to another, please let me into your life just long enough to help me out here. Please. The Teller stares back at him a beat - and nods. She starts quickly typing into her monitor, finally looks up."
teller,I'm showing that card as having been sent out four days ago. It definitely went out. We even heeded the change of address request.
jonathan,"Well, like I                                                    -- wait, what request?"
teller,Apparently you informed the bank of an address change? She swivels her monitor so he can see.
teller,"Mr. Jonathan Messer,                                            140                      E.   91st Street -"
"jonathan rounds the corner at a jog, checking awning numbers,","finally halts on one: ""140             E.   91st."""
the bedroom,"A room as empty as the others - with the exception of a small pile of envelopes beneath a window in a far corner. Jonathan slowly nears...to find it's a stack of mail. He picks up an envelope -- O.S. the CREAK of a door hinge. Jonathan whips around -- no one behind him. He steps out of the room to investigate. We remain alone in the empty room an excruciating beat... .until Jonathan finally steps back in, only slightly at ease. He returns to the stack of mail, picks up an envelope. He reads: ""Mr. Jonathan Messer 140 E.                           91    St..."" Eyes wide, he hurriedly flips through the rest of the mail - all addressed to him at this address. Jonathan still staring at this mail in disbelief, when he finds at the bottom of the stack: another PHOTOGRAPH. It's of ""S"" standing fearfully on the subwa latform across the track from Jonathan. And suddenly Jonathan is gripped with fear, unaware of a blurred, nearing intruder..."
wyatt,Long time no see.
wyatt,I have some instructions. Follow them and I might let her live.
jonathan,Where is she?
wyatt,"This should've been simpler. I frame you, you panic..."
jonathan,Where is she?! A terrifying silence - Jonathan erupts:
jonathan,Goddamn it tell me what you did to--
wyatt,Press pause on the questions and listen. The brokerage firm you're auditing is Clute Nichols. As a standard part of that audit you're temporarily privy to all client accounts as well as access codes required for transactions. At                                   11                              p.m. tonight you're going to skim from those accounts a total of                                             $200 million and transfer that money to an account I've established overseas.
jonathan,I can't                                                         - I have no idea how to even-
wyatt,"I know you don't. But I do. Your passport.  Now, please. Jonathan takes it out and tosses it to him. Wyatt catches it. And hands Jonathan an ENVELOPE."
wyatt,It's all in there.                                              11                              pm tonight. Their banks will just be opening.
jonathan,It won't work - they screen for stuff like this. It'll be discovered eventually.
wyatt,I can live with eventually. I always have.
jonathan,"This account overseas                                   - it's in my name, isn't it? A moment of tense silence. Jonathan just stares back hard a quiet beat; then:"
jonathan,"Why'd you pick me? Wyatt raises a brow, vaguely amused the question."
wyatt,"You answered the ad, Jonathan.  ""Feeling all alone out there? Have a great job, fine personality and good looks to match, but no time to.meet that special someone? Help is just a phone call away -"""
jonathan,The ad - in Money magazine...
jonathan,Why should I believe you? Everything you told me was lies.
wyatt,"Not lies, Jonathan. Foreplay. And now... now you're fucked. He grins his 'charming' grin and starts for the door."
wyatt,"Remember: be smart. I'll be watching you. And... feel free to take a shower, looks like you could do with one. The front door slams. Jonathan just stands there, staring shell-shocked at the envelope."
assistant,"Mr. Peterson, one of the audit managers is here to see you. Jonathan Messer?"
peterson,"Jonathan, good to see you again!"
young man,"Actually, I was just looking for Fred Whipple's office?"
peterson,"Jonathan, good to see you again!"
peterson,"Well, I have to say, your resignation comes as something of a surprise. Most of our auditors seem to like the freedom the position affords."
wyatt,Absolutely.
peterson,So do you have any plans?
wyatt,Yes. I'm going to travel. I want to see the world. Peterson nods benignly.
jonathan,I wondered if you were monitoring this.
jonathan,"Not until I see her.  The transfer's impossible without an access code. And there's no way I'm entering it until I'm sure that she's safe. So you tell me. How do we do that? Wyatt still remains unnervingly silent. We tighten on Jonathan, holding his breath, any plan he's concocting clearly hinging on this..."
jonathan,Where is she?
wyatt,In one of the rooms. Safe.  I got us a table.
waitress,Two Macallan 25 year. Enjoy. The Waitress leaves. Wyatt raises his glass.
wyatt,To friendship. Jonathan just stares back at Wyatt.
jonathan,"Bansky's dead, isn't he?"
wyatt,He was dead when I met him. Just like you. The rest was a mere formality.  Of course he didn't have your bargaining chip. Speaking of which...
jonathan,Not until I see her. She's the only reason I'm here and not at the police.
wyatt,"I told you, she's in a room. Alive."
jonathan,"Give me the key then. Wyatt considers this, then takes out an electronic key card and slides it across the table. Of course there's nothing on the key card to indicate a room number."
wyatt,"As soon as you're done, I'll tell you the room number."
jonathan,Not good enough. Wyatt reaches for the key card; as he does we glimpse a handgun concealed by his suit.
jonathan,"You won't let her live. You killed all the others, you'll have to kill us too."
wyatt,"Hey, I like you, okay? You'll be fine."
jonathan, You like me.
wyatt,"I do, Jonathan. In my way. After all, you're my creation. I'm the one who gave you life."
jonathan,"Don't you get it? It was her, not you! She's the one. She gave me life! You can steal my identity, but not what's here."
wyatt,"Yeah, well, I'm weeping big wet ones for you both. Now, let's get on with it."
wyatt,What is it?
jonathan,"My wireless modem - I must have left it in the conference room. I can't get back online. Wyatt glares at Jonathan, seething."
wyatt,You stupid fuck.
jonathan,I can go back there and-
wyatt,No.  Get up.
jonathan,"They don't let you use your own computer. Wyatt takes out a hundred dollar bill, gives it to Jonathan."
wyatt,"They will now. Jonathan takes the hundred, and heads into"
employee,You forgot your. own room number?
jonathan,I just checked in and it's been a hectic day. Look at me! The Employee looks uneasy - something about the ill-concealed tension in Jonathan's eyes.
employee,You could just ask at the front desk. I'm sure they can-
jonathan,"I really don't have time, okay? Jonathan presses the bill into the Employee's palm, peers up"
auburn hair,"Pardon me, but may I ask you something - personal? Wyatt quickly looks up at her, momentarily confused."
auburn hair,Are you waiting for me?
jonathan,907                                                             - thanks.
wyatt,"What the hell are you -- And then he sees Auburn Hair glance unsurely at the Eloise portrait, then at her cell phone's clock -- and now realizes:"
wyatt,"Motherfucker! He jumps up, shoves Auburn Hair aside - eyes darting to the Business Center to find Jonathan no longer behind the glass, just his laptop resting on the counter where he'd been standing."
close on a door marked by a placard:   9th floor -- as it's,"banged open by Jonathan's shoulder. The sound of the fire alarm is fainter up here as Jonathan races down the carpeted corridor, room numbers blurring past in sporadic fits                                                -                                      925...921...           918...   913...   910... Jonathan finally lurches to a halt before room 907. He takes out his key card, about to slide it in the slot -- when a hand grabs his forearm! He spins in panic to -- - a CLEANING WOMAN. She says something.in Vietnamese, indicating the ringing alarms."
jonathan,"Fire, I know - I'll be out in a minute. The scared Cleaning Woman nods and hurries off as Jonathan quickly slides the key in the slot. The light blinks green. He jerks the door handle and throws open the door to find -"
jonathan,What do you say we stick together from now on?
jonathan,He's down there! I saw him -
jonathan,"Up - we've got to go up! Clutching her arm, Jonathan and ""S"" turn back up, against the flow of traffic. Stories above, less and less people are evacuating. ANGLE ON WYATT as he presses upward, his steely gaze even more rapacious. The crowd is thinning as Jonathan and ""S"" race upward as well. INSERT JONATHAN'S POV: a shaky, dizzying blur as they race higher and higher... INSERT WYATT'S POV: from below but gaining on them, Jonathan and ""S"". appearing and disappearing with each twist and turn of the staircase... CLOSE ON JONATHAN AND ""S"", desperately racing upwards... CLOSE ON WYATT bounding the stairs, footsteps echoing, the staircase now empty and quiet, save for the footfall of Jonathan and ""S""                                                 - no more than three floors above Wyatt now... Wyatt slows his pace, leans into the railing, takes aim... CLOSE ON JONATHAN AND ""S"" still hurrying up - when a shot rings out, a jolting echo clanging through the stairwell, the"
jonathan,"Come on! She grabs his hand, and they waste no time disappearing into the mass of bodies. They keep moving. Shoulder to shoulder within the swell of partiers, they fit right in - instantly anonymous                - though not as smartly attired. BACK TO THE STAIRWELL DOOR as Wyatt enters the party, scanning the dense crowd, all senses alert. INSERT WYATT'S POV: just a mass of successful, attractive, partying young men and women. There's no way to pick Jonathan and ""S"" out. Wyatt's smirk fades to an icy glare as he stalks the periphery. WITHIN THE CROWD ""S"" clutches Jonathan's hand, their heads ducked low as they press forward... CLOSE ON WYATT, frustration gnashing at him as he quickens his pace, the idiotic enthusiasm of the crowd enraging him, sweat beading on his face                                        -- -- when suddenly the music stops. Wyatt frowns., eyes darting. CLOSE ON JONATHAN AND ""S"" glancing around in confusion -"
wyatt,"Nice try back there, Jonathan. Looks like you picked up a thing or two from me. Jonathan tries to strike him - when with a lightning quick movement Wyatt whips the iron rod through the air, cracking Jonathan across the face."
wyatt,"Killer instinct, pall"
wyatt,"Me? No - no, I'm just a face in the crowd. I'm a tourist, just passing through. JONATHAN'S POV: Wyatt's face presses closer, now almost in focus as he presses Jonathan's torso back over the ledge -"
wyatt,"As for you, you had your fun... Wyatt presses closer, crushing Jonathan's back to the edge."
wyatt,"Now we're going to go back down... INSERT JONATHAN'S HAND reaching into Wyatt's pocket, his fingers fumbling for the cell phone                            ."
wyatt,We're going to get that laptop... CLOSE ON JONATHAN'S FINGERS blindly prodding - he has the phone now - his fingers feel for the antenna...
wyatt,"And we're going to finish this, once and for - - when with all his strength Jonathan jams the cell phone up into Wyatt's eye, the antenna punching into the retina."
jonathan,"Yours, I believe."
jonathan,Can I ask you something personal? She nods.
jonathan,"What's your name? ""S"" considers the request, then smiles gently, leans in close and whispers the answer in his ear. Jonathan gazes at her a moment - whatever her name is, it must be perfect."
jonathan,So what now? She smiles up at him.
jonathan,"Yes. I'm free. They gaze at each other. We leave Jonathan and ""S"" to their privacy, pulling back as they continue talking, continuing away until we're"
