Speaker,Dialogue
jonathan,"You're kidding? s Really! I loved the idea of sitting in that big, high chair.  'The ball was good,'Mr McEnroe.'"
jonathan,"I can see it. An 80's new wave love song comes on the radio. She beams, reaching across Jonathan to turn it up."
jonathan,"Trust me, it's not a pretty sight."
jonathan,"I'd like to see you again. Not in a hotel. it S+ "" Hmm. I'd have to think about that."
jonathan,"How about tomorrow? /. S to It is tomorrow. She curls up next to him, rests her head on his arm, closes her eyes and drifts off. Jonathan gazes over at her. The perfect line of her jaw. The petite divot above her lip. The tiny pierced comma in a presently unadorned earlobe. And then he notices, in the far corner: her purse. He stares at it; her name and personal details less than 20               feet away. He hesitates, then tries to silently slide his arm out from under her -- when she stirs and nuzzles closer. He looks over"
jonathan,Hey! Are you back in town?
jonathan,Oh. Because I thought I saw you last night - at the Hudson.
jonathan,"Yeah. I mean, I was. Only now - well, I met a girl. Not just any girl. The girl."
jonathan,She's a member of your naughty little sex club. I have broken all the rules and had an honest-to-God conversation.
jonathan,"I'd like to say it's a long story but it's not. When you are coming back, you gotta meet her."
jonathan,"I-have no idea, I don't know all that much about her. All I know is I can't wait to see her again."
jonathan,What do you mean by that?
jonathan,"Yeah, yeah, yeah but - sometimes you just have to go with what you feel, don't you?"
jonathan,Hello?
jonathan,Hello? Intermittent static on the other end. And then what sounds like a WOMAN GASPING; it's unclear if it's a sound of pleasure or pain.
jonathan,".Hello? The Gasping comes faster; Jonathan debates hanging up - when the gasps halt,--replaced by the faintest whisp__of_ a female voice: ""No... No please..."" There's no mistaking the tone now it's fear - then. suddenly a shrill, terrified SCREAM... - and the line goes dead. Jonathan stares breathlessly at the phone in his hand, like he's just witnessed something awful. He quickly checks the display: ""Number Unavailable."" Jonathan looks panicked with the possibility that it was ""S""- - when the phone rings again. He hesitates, then picks up."
jonathan,"Sure you don't mean ""clashing?"" She laughs                                                      - then notices how tense he seems."
",/s",Are you all right?
jonathan,. Now you're the one who looks scared.
jonathan,"You gotta respect him; he just keeps at it. A WAITER arrives and sets down a laminated menu - entirely in Chinese. ""S"" points to the characters like an expert. J! $ Ft We'll have this... and this... oh, and let's try one of these. Thank you. The Waiter nods, walks off."
jonathan,What did you order?
jonathan,How do you know we'll like it?
jonathan,This is so...not my life.
jonathan,More than you know.
jonathan,Ever since that night on the subway - I haven't stopped thinking about you. She lowers.her eyes.
jonathan,"Sorry, I didn't mean to freak you out. She slowly looks up again, touched."
jonathan,"No. it S., Even so, I'm not sure I believe you. Jonathan's look, 'why not?'"
jonathan,Point taken. But I've thought about you a lot.
jonathan,And sometimes during. She laughs. The waiter brings them their drinks.
jonathan,"So how come you got involved in the club? She frowns slightly, thinks. s . If Wouldn't it be great if you could just meet someone and not have to do the 'work/ family/previous relationships' thing? Isn't who we are right now so much more interesting than where we've come from?"
jonathan,"Sure... but that didn't really answer my question. She reaches over and takes his hand, holds it tenderly. S of I know it seems like I'm holding out on you, but I'm not. It's just                                  - I turned thirty this year, and I made this vow to live only in the present. And it's good, you know? And yes, maybe it's because there are things in my past I don't care to think about - but that's the same for everyone, isn't it? He nods, still holding hands, loving every moment of this. is S . I like you. I hope you like me. Can't that be enough? Jonathan smiles, completely disarmed by her. The waiter brings their food and goes."
jonathan,"I wasn't asking for an autobiography, you know. I was just curious."
jonathan,You mean the intimacy without intricacy.
jonathan,Oh - no thanks.
jonathan,"Hey, are you all right?"
jonathan,"Too late.                                                       -- I want all the complication you've got. She gazes at him, blinks back her emotions. it Sc, Your glasses. They're fogging up. She reaches out and gently removes his glasses."
jonathan,"Maybe you should stay. She smiles as he kisses her even more passionately. Again they feel the awning's drops, and Jonathan moves to shelter them - - only ""S"" leans into him instead, leading him out from under the awning, the falling rain suddenly drenching their faces as they continue to kiss, the moment purely exhilarating. wiping the rain from her face, Jonathan gazes at her, soaked and utterly beautiful, with something akin to awe - like he's just breathed for the very first time. Rack focus on a hotel down the street, its neon sign reads: ""Hotel Lotus."""
jonathan,Perfect. They watch together. s_.. So were you any good?
jonathan,"Yeah. But I didn't want it enough. The guys who make it really need it. I played recently, first time in years. I've got this friend - a new friend, he's great."
jonathan,On a level with this feller? He points to 'Duck on bike' watching over them like a charm.
jonathan,"I know we said we wouldn't rush. But for the record, I'm doing everything Ican to apply.the brakes here. S                                                             . of Me too."
jonathan,It's a wise and mature choice we've made.
jonathan,"But say we did, just say... Mmhmm...?"
jonathan,Say we were to suddenly tear off these robes... Would that be such a terrible thing? For two people in Manhattan -
jonathan,To consummate their deep human needs in a frenzy of...of... Fucking and sucking?
jonathan,Beautifully put. Its. I. You were saying?
jonathan,Who - who would blame these two people?
jonathan,"And who would know? His face is inches from hers                                  - when she rolls over and reaches for a glass of water on the night stand. She sips her water, as she turns back to Jonathan. Still, Jonathan picks up on her subtle shift."
jonathan,"is everything okay? She starts to say something, then stops herself and nods instead. She sets down her glass, starts to get out of bed."
jonathan,Where are you going?
jonathan," Ice, huh?"
jonathan,"That's all right, I'll go. He hops off the bed, grabs an ice bucket from the mini bar and a key card from the table, he surreptitiously adjusts his penis                                                           : and goes to the door. He's about to turn the handle when -"
jonathan," Yes? She hesitates a cryptic beat - then shakes her head, and smiles at him with immense tenderness. Jonathan beams back. its . P1 Hurry, okay? He blows her a kiss, she blows one back. Almost in SLOW MOTION. She looks stunning."
jonathan,"Would you like some help, ma'am?"
old woman,"I can manage, thank you. Finally, her bucket is full and she goes on her way. .Jonathan quickly fills his bucket with ice."
jonathan,"I can't get the card to work. He tries the card again. Leaning in, he thinks he hears something behind the door. He peers down at the key panel: red. He knocks harder, waits for a response. None. Dead silence."
jonathan,"Hello?... Hello? He jostles the door handle: it won't budge. He's getting anxious now, his breath quickening. He tries the key card again: red. He pounds harder, then slams his shoulder into the door. Nothing. Desperate, he tries the key card again -- and the light turns green.                                                          - A millisecond's surprised hesitation - then he jerks the handle, throws open the door and Jonathan tumbles into"
the room,"He peers up into the small entryway: empty. Ahead of him we glimpse the foot of the bed, its mussed blanket and sheets. Jonathan gets to his feet, starts for the bed, his breath quickening as he now notices a few red specks on the blanket. Panicked, he rushes forward to find BLOOD soaking the bed, splattered all over the crumpled sheets... Jonathan gapes, horrified, the world crashing in on him just as he senses something behind him and BANG!                     - something hits him to the back of the head -- he goes down like a sack of potatoes."
the lobby,"His undershirt tugged and misshapen, boxers twisted around his bare thighs, robe open, Jonathan scans the lobby, wild- eyed and shaking. It's utterly vacant at this hour, the only sound a piped-in muzak rendition of the Beatles' ""Yesterday."""
jonathan,help...
jonathan,".I saw blood on the bed and then someone hit me. When I came to, she was gone."
security 1,"This woman you were with. What's her name? Jonathan looks blank, his mind racing."
security 2,Sir?
jonathan,I don't know.  It starts with an 'S'. I think.
security 2,Was shea prostitute?
jonathan,"No! No, she's just a person. A friend."
security 2,A friend with no name.
jonathan,Of course she has a name! I just don't - we have to find her - something must have happened to her!
security 1,I thought you said there was blood?
jonathan,"I told you, whoever did this must have cleaned it up while I was out."
jonathan,My wallet and keys                                          - they're gone! They were right here... He looks over to the chair where his crumpled suit lies.    His SCARF is gone too.
security 2,Maybe she took them.
jonathan,What?!
security 2,It happens.
jonathan,"She didn't do this, okay?! Something happened to her! You don't understand, we were... Wait! He sees something on the floor between the bed and night stand. He runs to to pick it up: a Chinese Gum Wrapper."
jonathan,"This                                                        -- this was hers... Jonathan clutches it desperately, the lone trace of her existence. The Guards exchange a look like he's INSANE."
security                                                    1,Sir - are these your clothes? Jonathan nods absently.
security 1,How about putting them on.
russo,"Mr. Messer, I'm Detective Russo."
jonathan,I told you how we met.
russo,Through a sex group. Her flat words hang in the air. He guiltily avoids her eyes.
russo,Does this group have a name?
jonathan,I don't                                                         -- it's not like that.
russo,"Mr. Messer, I spoke to the desk clerk. She only recalled seeing you check in."
jonathan,That's... that's the way it works.
russo,"All right. But now you're telling me that in addition to this mystery woman, there was another individual in the room?"
jonathan,"Not at first -- look, I know how it sounds, but I'm telling you, whoever hit me must have - I don't know -- taken her. Maybe even... He stops himself, shuddering to think of the implications."
russo,"Mr. Messer, have you had - experiences like this before? Taking any sort of medication?"
jonathan,"I'm not crazy, okay?! A woman vanished back there! There was blood all over the goddamn bed! He becomes very conscious that this sounds crazy - when A CELL PHONE RINGS: it's Russo's. She pauses, struck by the genuine desperation in Jonathan's face. She finally picks up."
russo,"Yeah.  No, I don't think it's necessary... Right. She hangs up and turns to Jonathan. He looks away, barely able to contain his devastation."
jonathan,"What am I supposed to do? An awkward silence, then:"
russo,"If you want to file a report regarding the items she -  - the items you claim were stolen... Jonathan shakes his head, crushed and exasperated."
jonathan,I'd like to go now. Is that all right? Can I just                                                          - can I go?
jonathan,"I was told you sell this gum here? The Old Woman studies him a wary beat, then gestures to a candy display. In one box is the same gum."
jonathan,A woman - a white woman - buys this brand of gum. I need to find- The Old Woman interrupts him in raspy Chinese.
jonathan,"I'm sorry, I don't                                              -- Do you know the woman I'm talking about? A white woman...? Please, it's very important that I                              --"
jonathan,"Can you ask if she knows the name of the white woman who buys this gum? The Girl questions the old woman in rapid Chinese. She takes. a dragon her smoke, then gives a lengthy answer. The girl nods, finally turns to an anxiously waiting Jonathan."
girl,She says they sell that gum in practically every store in Chinatown.
jonathan,Hello?
detective russo,Mr. Messer?
russo,"The body came in late last night, although time of death's still unclear. She was found in a taxi: driver was in a .coffee shop on his break, came back to his cab and there she was in the back seat. The elevator shudders to a metallic stop."
russo,"Her purse was recovered from a dumpster about a block away, so we've got a name. Jonathan tenses as the elevator doors BANG OPEN."
russo,Simone Forester. Jonathan looks sick with fear.
russo,"Mr Messer...? He tries to speak, but can hardly breathe, let alone answer."
russo,"Was this the woman you were with last night? She frowns, suspicious of Jonathan's hesitation. His tense eyes whip across the morgue: the two cops still idling there. They're out of earshot, but their mere presence amps tension. Angle on the guns in their holsters. The handcuffs dangling --"
russo,Mr. Messer?
jonathan,No - she's not. Not last night... no. Russo studies his strained expression a suspicious beat.
russo,I figured it was a long shot. The only reason I called you down is she was last seen with a man in the bar of the Hudson hotel.
jonathan, The Hudson?
russo,"You mentioned this group of yours meets up at various hotels. I thought it was worth a shot. Russo glances up at him, trying to read him - something about his reaction not sitting right with her."
russo,"Mr. Messer, is there anything else you want to tell me? Nervous and torn, Jonathan manages to shake his head."
jonathan,"Wyatt, it's me. I need to talk to you. Call me, OK? Please."
receptionist,May I help you? Jonathan is standing across from her.
jonathan,"Yes, I need to get in contact with one of your attorneys, Wyatt Bose - it's extremely important. He's working out of the London office right now. If I could speak to his assistant or someone who'd know how-to reach him immediately..."
receptionist,"Of course. Just a minute. The Receptionist types into her PHONE SYSTEM. She shakes her head, confused."
jonathan,B-o-s-e. First name Wyatt.
receptionist,Wyatt with a 'Y'?
jonathan,Yes... The. receptionist frowns.
receptionist,Oh -- Ms. Pomerantz? Angle on a MIDDLE-AGED WOMAN walking past.
receptionist,Ms. Pomerantz works in H.R..
jonathan,Messer. Jonathan Messer. I'm an auditor from worth and Berman.
pomerantz,Are you sure you have the right firm?
jonathan,"Yes                                                             -- yes, I'm                         --- He works here. I've seen him working here. I net him here."
pomerantz,When was this?
jonathan,A few weeks ago. Wyatt Bose. Wait... here. He hands her Wyatt's business card with the Rutherford Stern masthead on it. She studies it with a look of confusion.
pomerantz,"I don't know what's going on, but I can assure you, there is nobody here named-"
jonathan,"I've seen him in the halls                                      - for Chrissake we smoked pot in the conference room! Ms. Pomerantz abruptly frowns, when Jonathan spots a LAWYER -"
jonathan,"Thank God. Look, I'm trying to find Wyatt."
lawyer,Who?
jonathan,"Wyatt Bose. I saw you talking with him, cracking jokes in the coffee lounge. FLASH ON SAME SCENE: Wyatt looks up, eyes meet Jonathan's. Jonathan smiles in greeting... but Wyatt just nods coolly."
lawyer,I crack jokes with a lot of people.
jonathan,"Hold on, you're telling me you don't--"
lawyer,"Hey - easy with the hands, okay? Jonathan realizes he's got the man's sleeve in his fist. He lets go, spins back to Ms. Pomerantz."
jonathan,"He said he was in London with Mr. Rutherford, paperinga -"
jonathan,"Wyatt - .by a MAN in his early 60's, his WIFE behind him; both strike us as wealthy, downtown patron-of-the-arts types."
jonathan,"Sorry, I                                                        -- I need to speak to Wyatt."
man,Excuse me - Wyatt?
jonathan,Wyatt Bose. He lives here.
woman,"In this building? He must be new. See, we've been out of town the past2 months -"
jonathan,Not in this building - in this apartment.
jonathan,"But... I was right-here-with him... The Man takes a step back, catching his wife's equally wary expression, his hand making for the chain lock."
woman, Yes?
jonathan,From a gallery! In Munich - the one that Herr Kleiner handles? The art dealer downstairs?
man,"Downstairs? You must mean Mr. Moretti, but he's in the carpet business                                   -"
jonathan,But Wyatt smoke to him.
man,"Unless it was in Italian I doubt he got very far. Jonathan steps back, looking like he's losing his mind."
woman,Young man... are you all right?
receptionist,"Sir, we asked around, nobody knows the guy"
jonathan,"When I was working over here, you made a photocopy of my I.D..'"
receptionist,"We do all freelancers, it's policy."
jonathan,"You have to. She looks at him', sees his desperation."
receptionist,"That's him? He was real cute. Only he wasn't a lawyer. He was a systems analyst, I think. He was here for a few days to work on the computers. RECEPTIONIST'S POV: of the photocopy in Jonathan's hand. It's of a Massachusetts Driver's License. Staring back up at us is Wyatt's smiling face."
receptionist,I thought you said his name was Wyatt? PAN TO THE NAME beside the photo: Sansky. WilliamR. Jonathan is already running for the EXIT.
jonathan,Hello?
jonathan,"Oh - right, I was just - checking in, to see if you had any leads..."
russo,"On that missing girl of yours? No, not yet."
jonathan," Oh - okay, thanks-"
jonathan,I told you before -
jonathan,I don't                                                    -- why are you-
jonathan,"I cancelled them all, the day they got stolen."
jonathan,Kevlar?
jonathan,"Yes                                                            - yes, I'm              --"
jonathan,"I know, okay? I know your name isn't Wyatt Bose. I know you killed that woman. And I know you're trying to frame me for it, so - so - WHY? What the hell is going on? And where is she?! If you hurt her I swear to God I'll... Jonathan falters, unsure where he's going with this and realizing he's now talking to himself."
jonathan,"It's me. I need to talk to you. He hits pound. Breathes. At least he's done something. Suddenly from O.S. a faint creak. Jonathan spins, scans the room, grabs the nearest blunt object: his tennis trophy. QUICKLY CUT SHOTS of Jonathan searching his apartment, his trophy raised as a makeshift weapon."
jonathan,"wait! Wait, right there! Jonathan stands on the edge reeling, desperate to get,to her. He looks around, hears the distant: .nimble of afar. off train, and suddenly he does something we'd have never thought him capable of: he jumps onto the tracks! He lands hard, nearly breaking his ankle, but quickly scrambles to his feet, splashing in the sludge between rails, eyes darting along the track, anxious to avoid the third rail, ears attuned to the sound of that distant train as he races for"
jonathan,"I thought you were dead! She looks like she wants to say something, but doesn't. And all at once he's hit with a crushing realization:"
jonathan,"You are in on this, aren't you?! She holds his eyes a moment longer, fighting back emotion - then she abruptly turns and starts back for the exit again."
jonathan,"How do you know him?  Damn it answer me! She halts, slowly looks back at him. of cam Through the club. He caught me trying to steal his wallet. Jonathan looks confused; she's struggling to stay composed but looks like she could break down at any moment."
jonathan,So everything between us - was nothing? She fights back tears.
jonathan,Go through with what?
jonathan,Then why didn't you?
jonathan,"Wait, Jonathan? I'm Jonathan. Jonathan Messer. You're                                                           -? O.S. we hear the approaching roar of an INCOMING TRAIN... ii S                                                             7f Did you go to the police?"
jonathan,I can't. He's framing me for murder. What?
jonathan,"He killed a woman from the club, someone I'd been with. ""S"" is shocked., instantly terrified. Clearly she had no idea. I/ S$f Jonathan, you have to leave! Do you understand? You need to get the hell out of here, he's going to kill you! The roar of the incoming train is growing LOUDER... Don't you understand? He's going to kill - - when the INCOMING TRAIN completely drowns him out... and swipes ""S"" out of Jonathan's view. Jonathan struggles to peer through the train windows but its passengers prevent him from getting a look at her. Just then the TRAIN DOORS OPEN WITH THE NOISE of passengers getting on and off. Panicked, Jonathan cranes his neck, trying to see her through the windows."
ticket agent,"Let's see - there's one to New Haven, leaving in... six minutes. If you need to go farther, you can transfer from there. ""S"" peers anxiously around her, like someone hunted."
wyatt,Suit yourself.
jonathan,Hello...? Not a word from the other end. We barely make out BREATHING.
jonathan,"Wyatt? Is that you? Jonathan takes a tentative step forward, as if fearful that the least movement will cost him this connection."
jonathan,Say something damn it! From the receiver we hear a well-exhaled breath. And then:
jonathan,What do you want from me?
jonathan,Answer me!
jonathan,Why are you doing this to me?!
jonathan,"I'm going to find you, you hear me? I'm- CLICK. Dead air."
jonathan,"Hello?... Hello?! Jonathan SLAMS the phone down, tension in his face joined by a new emotion, something closer to. fury."
jonathan,I'm going to find you.
woman's voice,Mr. Messer? Jonathan is too lost in thought to hear it.
russo,"I was gonna call, but I was in the area. Just doing some follow-up. Jonathan tries to mask his uneasiness."
jonathan,Follow-up?
russo,"On that missing girl of yours. The.one whose name began with. an ""S."" Have any luck finding her? Jonathan absently tightens his grasp on his briefcase."
jonathan,No. No luck.
russo,"I see. That's too bad. she studies him a cryptic beat, then smiles flatly."
russo,"Well, who knows, maybe she'll turn up yet. You have a good day, Mr. Messer. Jonathan nods tensely, then walks off, feeling her watching him from the curb as he goes."
jonathan,Are you free tonight?
jonathan,Do you know Wyatt Bose?
blue pashmina, Excuse me?
jonathan,"What about William Bansky? Does that name-- She darts.for the ""Door Open"" button, but he blocks her path."
blue pashmina,I swear to God I'll scream.
jonathan,"Please, I'm not trying to scare you, I just                                                            -- I'm looking for someone.and it's very important that I find him. she tries to push past him, again Jonathan blocks her."
jonathan,"He does this too - or he did. someone had to give him the numbers. Someone let him in. If I can-'find who it was that knew him, they might know where he's                                 -- she suddenly kicks him in the shin with a spiked heel. Jonathan grasps his leg - she presses the button and is out the opening doors before he's even looked up. SOUND ADVANCE: TENSE CLACKING of computer keys..."
jonathan,"I need to ask you something, it's incredibly important..."
jonathan,"You told him. About this. A beat, and she nods, crushing out her other cigarette."
jonathan,Wait - thank you.  Have you ever run into him again?
jonathan,Getz?
solange,"Jonathan, you're home early - Only when he looks up, she finds the young man in the overcoat isn't Jonathan. It's Wyatt."
solange,"Oh - je suis desole. My mistake. Wyatt flashes her an icy smile, continues down the steps. Solange watches him walk away, a puzzled look on her face."
jonathan,"Shit. Jonathan exhales, about to log off - when a name among the H's jumps out at him: Holloway. Reed. Jonathan stares at it tensely - then clicks on the name. ""Sort no contact information available."" Jonathan thinks a moment - then tries a search engine, types: ""Holloway Reed"" then decides to add the word ""missing."" An article appears. From the Chicago Tribune: ""BODY OF MISSING BUSINESSMAN FINALLY DISCOVERED."" A head-shot style photograph shows a man in his early 40s whom we recognize from Black Business Suit's story. Beneath his photo, his name: ""Reed Holloway."""
jonathan,Can I print this out?
solange,Jonathan... He squeezes her hand as she's lifted into the ambulance.
ems worker,"Yeah, she'll make it."
jonathan,I live here.
fire worker,Lucky we were able to contain it somewhat. Better get your valuables together.
jonathan, How did it start?
jonathan,Just                                                            - give me a minute.
fire worker,"That everything? Jonathan regards his minimal possessions, realizes how little evidence there is of a life. A wrenching sense of isolation."
jonathan,I guess it is.
fire worker,You got someone you can stay with?
night clerk,"It's fifty for the night. Jonathan fishes out his film cannister, and parts with what he discovers are his last three                                 $20s."
