Speaker,Dialogue
by, Mark Frost and Michael France
reed,"High open space, exposed structural elements.  Obviously aimed at first time visitors to create feelings of... smallness, inadequacy."
ben,"Good thing it ain't workin... Reed, what are we doing here?  This guy's fast-food, strip-mall science --"
reed,"This wasn't our first stop, in case you forgot NASA.  And Victor's not that bad.  He's just a little...  Larger than life."
reed,He's financed some of the biggest breakthroughs of this century.
ben,You'd never know it.
reed,Reed Richards and Ben Grimm to see --
female receptionist,"Executive elevator, top floor."
ben,What's the price for a smile round here?
shadowed figure,Turn it off.  Please.
reed,But I haven't fully explained my --
shadowed figure,Yes you have... Imagination. Creativity.  Passion.  Those were always your trademarks.
victor,"But dreams don't pay the bills, do they?  Same old Reed, the hopeless optimist. Still reaching for the stars, with the world on your back."
reed,You remember in school we talked about working together.  That's what I was about to explain...
victor,"So it's not my money you want.  It's my toys... Tell me: if NASA doesn't trust you, why should I?"
ben,I can't take this.
reed, Ben.  This is business.  Just work.
victor,"I think you both know my Director of Genetic Research, Susan Storm."
ben,Heya Susie.  One more thing he's got.
sue,"Ben, it's been too long."
reed,"You're, you've, I mean, how have you bee--"
sue,Never better.
victor,"This isn't going to be a problem, is it?"
reed,Not at all.
sue,Ancient history.
victor,"Good.  Then you're just in time to hear the great Reed Richards ask me for help.  You know, you made a lot of folks at MIT feel like a junior high science fair.  So you'll excuse me if I savor the moment."
reed,"You back this mission, and I'll sign over a fair percentage of any applications or --"
victor,The number's seventy-five.  And it's applications and patents.
ben,What about his first born?
reed," Ben, the money's not important.  We could save lives."
victor,"Twenty-five percent of a billion is enough to keep the lights on, isn't it?  Maybe even pay off your fourth mortgage on the Baxter Building."
reed,Hilarious.
victor,"If Reed's right, then this little trip will double our stock offering."
leonard,And if he's not...?
victor,Reed's always right.  Good thing he doesn't always know what he's got...
ben,He knew about NASA.  What if he made the call to shut us down --
reed,"Ben, think about all the people we can help if this works --"
ben,Maybe you should think about yourself for once.  You always let this guy push you round --
reed,We got what we wanted.  That's enough.
ben,"I know, I know.  I'm just worried about what he wants... Speaking of which..."
sue,"You sure about this, Reed?"
reed,"Those solar winds are flaring, but I factored them into my coordinates and --"
sue,I was talking about us.  Working together.
reed," Well, uh, based on our history...you can handle the biogenetics, and I'll focus on the molecular physics.  Or, uhm, maybe I should take the biotech, you work the microscopes, since you have some background in electropho--"
sue, Right.  That's exactly what I meant.
ben,Way to not overthink it.  So when do we leave?
sue,I'll schedule the launch.  Call me in the morning to talk about resources and crew.
reed,"I, uh, think I remember the number."
sue,It's been changed.
reed,"As far as crew, I was hoping Ben could pilot the mission --"
sue,"Well, he's welcome to ride shotgun, but we already have a pilot on our payroll.  You remember my brother Johnny..."
ben,Can't do it.  I cannot do it.
reed,"External SRBs, orbital system engines. Its just like the shuttles you flew in --"
ben,No.  I cannot take orders from that underwear model.  That wingnut washed out of NASA for sneaking two Victoria Secret wannabes into a flight simulator.
reed,Youthful high spirits.
ben,They crashed it into a wall.  A flight simulator.
reed,I'm sure he's matured since then.
ben,Five times.
reed,I had it at four.
ben,This makes five.
ben,I can handle the ship.  I can even handle Mr. Blonde Ambition.  But I don't know if I should be flying or playing Vegas in these suits.  Who the hell came up with them?
sue,Victor did.
johnny,"Keep the hot side hot, and the cool side cool!"
reed,Wow.  Fantastic.
sue,Great minds think alike.
leonard,"They're ready for you, sir."
victor,Showtime.
leonard,"Our numbers are through the roof.  The IPO's tracking at fifty, sixty a share.  The bank's five times oversubscribed --"
victor,It's not just the money.  I could make money in my sleep.
leonard,Then what is it?
victor,"History, Leonard.  History. Everything else is conversation...  How's the other matter?"
leonard,Harry Winston sends his regards.
victor,Today we stand on the edge of a new frontier.  In the furthest depths of outer space...we will find the secrets to inner space.  The final key to unlocking our genetic code lies in a cosmic storm...
ben,Isn't that your speech?
reed,He's made a few changes.
ben,"This is your dream, Reed.  You should be the one up there."
reed,Victor's better at these things.
ben,I'll be watching over you.
debbie,"Just get back soon, or I start looking for a new groom."
ben,"Soon as I'm back, I'm gonna trade that in for a bigger rock."
debbie,"I don't care about rocks, I care about you.  You bring him back in one piece, or you can forget being Best Man."
ben,"What the hell you smiling at?  Just keep your mouth shut, and your mind on those SMBs --"
johnny,"Actually, the engines are SMEs. Hydrogenbase, carbon propellant. Couple generations past your last ride.  I'm not as dumb as you look."
victor,"Think of a world without genetic flaws -- no asthma, allergies, baldness, breast cancer..."
ben,What's wrong with being bald...?
victor,Darwin discovered evolution.  Now we -- I -- will define it.  Only in America could...
johnny," If you behave, maybe next time daddy'll let you drive."
ben,"Keep talking, there won't be a next time."
sue,"Long way from the projection booth at the Hayden Planetarium, isn't it?"
reed,Yes.  Yes it is.
victor," Leonard, how's the feed?"
sue,We can monitor the cloud's approach and observe the tests from here.
ben,Is it safe?
reed,The shields on the station should protect us.
ben,Should?
victor,"What's wrong, Ben?  Eighty-million dollars worth of equipment not enough for you?"
reed,"Let's start loading those samples. Get your suit ready, Ben."
victor,So you still do all the heavy lifting?
ben,He does the talking.  I do the walking.  Got it?
victor,"Got it.  So take a walk, Ben...I'm going to borrow Susan for a second."
reed,Sure.
johnny,Please tell me your dawg's not trying to rekindle things with my sister.
ben,'Course not.  Strictly business.
johnny,"Yeah, well, his eyes say different."
ben,"Hey, two hearts got busted last time. Maybe she's not over it either."
johnny,"Let's see: you got Victor, stud of the year, more coin than God?  Or Reed, the world's dumbest smart guy worth less than a postage stamp.  Hmmm, it's a toss-up."
ben,Put your tiny little mind at ease.
johnny,"Don't you wander off, boy."
victor,Surprised I agreed to Reed's proposal?
sue,I understand the business reasons.
victor,"Well, when you're looking at your future, it never hurts to find closure about the past."
reed,No...no...impossible.  It's...too fast.
victor,You've been with me two years now.
sue,"It's been a good two years, Victor... The company's accomplished so much."
victor,"Right, of course, the company... But you see, I've come to realize all the accomplishments in the world mean nothing without someone to share them with --"
sue,"Uh, Victor, I hope I haven't done something to make you think..."
victor,"Sue, I've lived my life unafraid of taking big steps.  And this is the biggest step yet.  If it helps, think of this as a promotion.  A merger of sorts...  Four little words that can change our lives..."
reed,The cloud is accelerating!
victor,Get a grip.  Reed.  We didn't come all this way to lose our nerve at the first little glitch.  Just close the shields...
reed,Ben's still out there --
victor,So reel him in.  But we came here to do a job.  So let's do it.  Quickly.
automated voice,Event threshold in two minutes.
reed,"Come on, Ben, come on..."
sue,Johnny... Reed...
victor,"Reed, you need to get up here so we can close the shields!  Now!"
victor,"It's too late for him, and soon it'll be too late for all of us."
sue,What are you doing?
victor,Raising the shields.
sue,You can't leave them out there.
victor,Watch me.  Reed had his chance.  You can't help them any more than I can.
sue,I can try.
reed,"Victor's right.  Johnny, get to the command center.  Close the shields."
johnny,What about you?
automated voice,Event threshold in thirty seconds.
automated voice,Event threshold in ten seconds. TEN...
sue,Johnny!  Reed!
automated voice,FIVE...FOOOOUUUR...
reed,He's not responsive --
johnny,Ben!  Ben!
johnny's voice,"Ben, wake up!  Wake up!"
johnny,Back on Earth.  Victor's medical facility... We're in quarantine.
johnny,They're fine.  Everybody else...is fine.
johnny,"I swear to you they've done everything humanly possible.  The best plastic surgeons in the world, Ben.  You had the best --"
johnny,"They said that's not such a good idea, the shock alone could --"
johnny,"Unfortunately, the doctors just couldn't do anything to fix your face!"
johnny,"Nice 'do.  Going for the ""grandpa"" look?"
victor,Accused by who?  My competitors?
victor,"Danger is always part of discovery. What would have happened if Ben Franklin never went out in a storm? Without risk, there's no reward."
victor,And you'll have it.  I've never come up short.  And I'm not going to start now.
victor,"Yes, of course.  I've never been more confident in the compan--"
reed,How's she doing?
doctor,Stable.  Vitals are strong.
reed,"Blood panels show no irradiation. Good.  You'll step up this protocol, every --"
doctor,"Four hours.  We know what we're doing... One more day of observation, then you're all cleared."
reed,Sue...I want to tell you...I'm...
sexy nurse,And where do we think we're going?
johnny,"I don't know if ""we've"" noticed, but the sickest runs this side of the Alps are right outside that window --"
nurse,"I've noticed... But doctor's orders, you're not allowed to leave until we --"
johnny,"Finish the tests, I know -- could you give me a hand with this zipper?"
nurse,You know this is not a ski resort.
johnny,Not yet.
nurse,You are trouble.
johnny, Brubbles my Triddle Name.
sexy nurse,You're hot!
johnny,So are you!
sexy nurse,"I mean, you feel a little feverish."
johnny,I've never felt better in my life. When do you get off work?
sexy nurse,"My shift ends at four, but I couldn't --"
johnny,"Meet me at 4:01, top of the run. That'll give you a minute to freshen up."
ben,How long was I out?
reed,Three days.  I was worried about you. How are you feeling?
ben,Solid.
reed,I don't know.  I just keep going over and over the numbers.
ben,Reed.  Even you can't compute every little thing.
reed,"I should have done more, run more tests --"
ben,"It was a freak of nature.  Last I checked, you don't have a crystal ball.  Let it go."
reed,"Yeah, you and Debbie and perfect --"
ben,"Reed, I'm not talking about Debbie."
reed,What?  Come on.  She's got a good thing with Victor --
ben,"I'm sorry, did that cosmic-bath loosen your screws?"
reed,"He's smart, powerful, successful --"
ben,Well maybe you should date him.
reed,Ben.  He'll give her the life she deserves.  She ended up with the right guy.  Things worked out for the best.
ben,Do I have to do everything myself?
johnny,Me like-y.
sexy nurse,Stay right.  Left is trouble.
johnny,I though we went over this.
sexy nurse,Last one down springs for room service.
sexy nurse,You're on fire!
johnny,Not this again --
sexy nurse,No: You're ON FIRE!
johnny,Care to join me?
victor,How's the IPO?
leonard,"Stable.  We're looking at low twenties.  It's a good number, considering the fallout from --"
victor,"Reed's disaster.  You know, I half- think he did this to me on purpose."
leonard,"Sir, I'm sure he wouldn't put himself --"
victor,"Get me on the AM shows, Larry King, cover of the Journal...  I've got to do something about this scar.  Make sure they only shoot my right side."
leonard,"Actually, uh, people seem to think the scar ""humanizes"" you."
victor,And that's a good thing?
leonard,"You know, maybe you should get some rest --"
victor,"Later.  First, I've got some unfinished business.  A deal that needs closing..."
leonard,"Sir, I've always wondered... Why Sue? You could have any woman in the world but --"
victor,"That's why.  Because I could have any other woman... You know, when they asked Caesar ""why England,"" he said, ""because it's not mine."""
sue,"I can only stay for one drink, Ben. I've got to meet with Victor."
ben,Wouldn't want to keep Vic waiting.
ben,Pardon me...
reed,Are you alright?
ben,I think I need to lie down.  Bad shrimp.
reed,Feeling better?
sue,"Yes, thanks."
reed,That's good.  That's uh...good.
sue,You always had a way with words.  I should be getting back.
reed,I'm really happy for you and Victor.
sue,You're happy for me and Victor.
reed,I can tell you guys are enjoying what was the best part of our relationship --
sue,Which was?
reed,Passion.
sue," You are such a dork, Reed... You never got it and never will unless it's explained to you in quantum physics."
reed,What?  What did I say?
sue,It's never what you say.  It's what you don't say. What you don't do...
reed,I...I...I just wanted to --
sue,"It's been two years, and all you can say is you're happy for me and some other guy...  And it's nice to be wanted sometimes. To be heard...seen... Reed, look at me."
reed,"Uh, Sue...?  I can't."
sue,What?  What do you mean you --
reed,Sue...look at your hands.
sue,It has to be the cloud.  It's fundamentally altered our DNA.
reed,"Let's not jump to conclusions, we need a massive amount of evidence before making that leap."
johnny,Now what is up with that?
reed, The cloud has fundamentally altered our DNA.
johnny,Cool.  What'd it do to you guys?
sue,Apparently I can disappear.
johnny,Please tell me you go silent too.
reed,We have to find Ben.
johnny,"Flame on, flame off.  Flame on, flame off --"
sue,Johnny.
johnny,"Okay, ""mom."""
ben,LEAVE ME ALONE!!!
johnny,Ewwwwwwww.  That is disgusting.
reed,...Ben?
johnny,What is that thing?
sue,I think that thing is Ben.
victor,What's going on?
sue,"Victor, are you feeling alright?"
victor,Just a little banged up.  A couple scrapes.  Why?
reed,Ben did this.
victor,Ben did this?
reed,He's had some kind of...reaction to exposure from the cloud.  And he's not the only one.
sue,We need to find him.
victor, Just find him.
johnny,Anybody know where the big guy's going?
reed,He's going home.
ben,"Hello, Operator?"
debbie,"Out front?  You home, baby?  I got a surprise for you."
ben,I got a surprise for you too.
debbie,Ben?
debbie,"Baby, you're scaring me."
debbie,Oh my G-g-g.  What did you...do to Ben?
ben,"Deb, it's me.  It's still me."
debbie,Don't...don't...DON'T TOUCH ME!
ben,"I love you, Deb."
victor,"Make sure you find Ben, bring him back here.  And keep it quiet.  I don't need this to hit the press."
leonard,"Yes sir.  You've got the Mayor at eight, then a nine-thirty interview with the Journal --"
victor,Front page?
leonard,"Top left, like you asked.  Today Wall Street.  Tomorrow, who knows...maybe Washington."
victor,Leonard.  Think bigger.
ben,"A few days in space, it'll be great, what's the worst that could happen?"
ben,"A little help here?!  You wanna hit that button, sir?"
cop,FREEZE!  PUT THE MAN AND THE SEAT DOWN!
johnny,Not even Ben deserves that.
bridge cop,Back!  We're evac-ing the bridge.
sue,What now?  Reed...?  What do we do?
bridge cop,"Maybe you didn't hear me.  Those cars are gonna blow sky high, any second."
reed,"Look, we've got a friend out there in trouble.  We need to get to him before --"
sue,What?
reed, We need to get past them.
reed,Sue.  Your clothes.  Lose them.
sue,What...?  Oh.
johnny,This is wrong in so many ways.
reed,You've been working out.
sue,Shut up.
reed,"Uh, Sue?"
johnny,I'm gonna need serious therapy.
ben,What the --!
reed,Ben.  Are you okay?
ben,Am I okay?!  You wanna explain that?!
reed,"I swear to you, I will do everything in my power until there is not a breath left in me: you are going to be Ben again."
leonard,"Uh, sir...Larry King called, to cancel.  Apparently, there's a bigger story."
chief fireman,"There's some folks outside, want to talk to you."
reed,"We're not going public with this. We're scientists, not celebrities."
chief fireman,"Too late, son."
johnny,Nice.
sue,"Johnny, slow down.  Let's think this through, a second."
johnny,Okay.  Done thinking.
chief fireman,So which one of you's the leader?
johnny,That'd be me.
chief fireman,No seriously.
reed,"Uh, during our recent mission to the Von Doom space station, we were exposed to as yet-unidentified radioactive energy, most likely some kind of nucleotide compoun--"
various reporters,What happened on the bridge?  Does it hurt to stretch?  Were you really on fire?  Is it true that one of you can fly?
johnny,Working on it.  And it's a lot harder --
sue,"We don't know much more than you do, at this point.  Which is why we will be going directly to the lab, where we can diagnose our symptoms and --"
johnny,"Symptoms?  Please.  If having powers is a disease, then yeah we got it. And we are gonna blow your minds. There's a new day dawning.  The day of the Fantastic Four."
reed,Ben Grimm is a genuine American hero who's been through a terrible orde--
johnny,What he's trying to say is: every team needs a mascot...
reed,"Look, we went up to space to find a way to understand DNA, to cure disease, save lives.  Well, now it's our DNA, our disease, our lives on the line...  Thank you.  No more questions."
ben,Be nice.
ned cecil,"Well, Victor, the bank would like to congratulate you.  On the fastest freefall since the Depression.  We can't even give your stock away."
victor,"Ned, you know I can turn this around."
ned cecil,"You promised a cure-all, and came back with this.  Who the hell's going to invest in a biotech company that turns its workers into circus freaks?"
victor, I really appreciate all your support.
ned cecil,"You've got a week, Victor.  One week to turn this around.  Or we pull out...  This meeting is over."
victor,Goddamn book-keeper doesn't know preferred stock from livestock.
leonard,Sir.  Reed's comments at that press conference killed us.  How are we going to turn this around?
victor,"Very simple.  I cure them.  If I can cure these freaks, then I can cure anyone.  What better way to restore my reputation?"
johnny,"Smile, Ben.  They want to like you. Give 'em your good side.  Or your less bad side."
ben,Uh...don't do drugs.
reed,I'm afraid so...
sue,Jimmy.  Good to see you again.
reed,Any visitors while I was away?
reed,We had a tough year.
ben,"Yeah, nine years straight."
johnny,Twenty?  From outside the place looks a lot taller.
reed,"Oh, it is."
johnny,Either we're moving really fast...or not at all.
ben,I'll take the stairs.
sue,How come Ben can't turn it on and off like us?
reed,That's what we're here to find out.
sue,"If it happened to him, then it could..."
johnny,Wait.  You mean there's chance we could be full-on-24-7-fantastic?
sue,"Grow up, Johnny.  You want to run around on fire for the rest of your life?"
johnny,"Is that a trick question?  C'mon, I can't be the only one who thinks this is cool."
reed,We should stay here until we can define the extent of our changes...
johnny,This place is deluxe.  You got cable?
reed, ...and figure out how to reverse them. Let me show you to your rooms.
victor,"God, I've been so worried about you."
sue,"Victor, your scar --"
victor,"I told you, I'm fine.  It's you I'm worried about."
sue,I'm sorry I didn't get a chance to --
victor,"Please, no apologies.  I've arranged for your things to be moved to one of my condos.  You'll have round-the clock care."
sue,"Thank you, that's generous, but I think I should stay here.  With my brother.  Until we get a handle on this."
victor,Sue.  I think you should let my doctors have a look at you.
victor,I'm starting to wonder the same thing... How much do you know about what happened to you?
reed,Not much.  We need to run tests to see the extent of the damage.
victor,"Well, let me know if there is anything I can do.  We're all in this together now."
reed,"Victor wait... I just wanted to say, I'm sorry the mission didn't go as planned --"
victor,Didn't go as planned?  It was a catastrophe.  You ruined the lives of four people --
reed,"I ruined?  With all due respect, I told you to abort --"
victor,"Abort?  Reed, I put my company, my name, billions of dollars on the line, and I will not let you make me look like a fool --"
reed,"Victor, if we could understand what happened to us --"
victor,I don't want to understand it.  This isn't one of your science projects.  I just want to fix it.  Fast!
victor,"No problem, Ben."
ben,You got a chisel round here?
reed,"If we're going to identify the source of the mutation, we need to isolate your recombinant DNA so we can activate positional genomes."
sue,"We need to give you a physical, so we know what got zapped."
ben,Well why didn't you say so?  You want me to lift some weights or something?
reed,"No, just sit back.  We have a good sense of your strength from the firetruck.  We need to find the source of your strength."
ben,How bad is it?  You know I used to smoke.
reed,"Okay, this might smart a little."
reed,"Back it down, Johnny!"
johnny,I can go hotter!
sue,"You were at 4000 Kelvin.  Any hotter, you're approaching supernova --"
johnny,Sweet.
sue,That's the temperature of the sun.
reed,"Not only could you kill yourself, but you could set fire to Earth's atmosphere and destroy all human life as we know it."
johnny,Gotcha.  Okay.  Supernova bad.
sue,He cooked the equipment.
reed,"Okay.  I've uh, got some questions, from Sue.  That she thought might be better coming from me... Can you, you know, go to the bathroom...like normal..."
ben,Yeah.  You don't wanna know the details.
reed,"Ben, I'm afraid I've got to ask --"
ben,Not unless you want that clipboard stretched up your --
reed,O-kay.  We'll skip that question.
reed,"Is there something about flames? About flaming, that you --"
johnny,What are you trying to say?  Just because I dress well and like to dance --
reed, What?  No.  I'm trying to figure out why we each ended up with different symptoms.
johnny,"Oh, well that's easy: I'm hot. You're...well, you're a little limp. Sue's easy to see through.  And Ben's always been a hardass.  Why aren't you writing this down?"
reed,"It's not ""invisibility"" per se. You're bending the light around you with some kind of malleable force field.  That's what you projected on the Bridge."
sue,What about you?  You haven't eaten in days.  How come you're never on this side of the microscope?
reed,"Have you had any side-effects, from your powers?"
sue,I've had some headaches.  Migraines.
reed,"You should be able to bend light around other objects, even people, if you could control your emotional state better --"
sue,Excuse me?
reed,"I'm saying, if you had a little more self control, you could locate the trigger.  Can you remember the exact emotions when --"
sue,Anger.  Rage.  Frustration.
reed,Okay.  Is there any way to duplicate that feeling?  Some memory or...
sue, I'm sure I can come up with something.
reed,How's that coming -- whoa --
sue,"I'm sorry, I'm sorry, I didn't mean to do that... You must think that was some kind of latent hostility or --"
reed,What in the world would give me that idea?
sue,Are you kidding?
reed,"No, I distinctly remember: you walked out my door.  Ergo..."
sue,"Reed.  I was ready for the next step, you weren't, ergo, I walked."
reed,I think it was a little more complicated than --
sue,I just wanted to share an apartment. What was so complicated about that?
reed,There were a lot of variables to consider --
sue,"No.  There weren't.  There was you. And me.  No variables, no math.  It was actually the simplest thing in the world.  But your head got in the way... like it always does."
reed,Sue...I just...I thought...
sue,Same old Reed.  Too much thinking...
johnny,"Okay guys, we have a serious problem."
ben,You look like an eighties rock band.
sue, The suit will stretch.  You should try it --
ben,I wouldn't be caught dead in that.
johnny,He's right.  These costumes are... missing something.  I can't put my finger on it --
reed,They're not costumes.
sue,"We're not taking them out.  Johnny, we need to stay here till we've stabilized."
johnny,I'm getting sick of being trapped here.  NASA wasn't even this strict!
ben, Maybe it's missing a utility belt.
doctor,"Your tissue, your organs, your entire biophysical structure is changing. Every system is still functioning, somehow --"
victor,And they're changing into...
doctor,I don't really know.  A compound organic-metallic alloy.  Stronger than titanium or carbon steel.  Harder than diamonds --
victor,Like the shields Reed said would protect us.  How long?
doctor,"At this rate, the infection should be complete in two, maybe three weeks --"
victor,"What do you mean ""complete""?"
doctor,I wish I could tell you.  I can't pretend to know what we're dealing with here.  I'll notify the CDC and --
victor,What?
doctor,The Center for Disease Control.  If this thing is contagious --
victor,"Look at me.  I have a life.  I'm the face of a billion-dollar-company... We need to keep this confidential, understand?"
doctor,But...this disease...is progressive... degenerative...
victor,That's terrible news...
reed,Nothing...nothing...nothing...
sue,What are you doing?
reed," The plants, from space.  Their particles are still charged.  With the right amount of energy, those ions could create the elemental profile of the cosmic storm."
reed,"If we can build a machine to re-create the storm, we can reverse the polarity --"
