Speaker,Dialogue
sue, And reverse the mutations --
reed," Curing countless diseases, not just ours."
sue,"But we're the focus, right Reed? Reed...?"
reed,Of course.  Of course.
sue,And you sure you can control this thing?  Last time didn't work out so well.
reed," With the right energy, we can stabilize the storm.  Maybe tie into the city grid..."
sue,You really need to get a janitor.
reed,There's a system to it.
sue,Sorry.  My fault.  I won't...touch anything.
leonard,Is Reed any closer to a cure?
victor,The only thing he's closer to is Sue...
the thing,God.  I was good looking.
johnny,How far's that rubber bend?
reed,"That's what I'm trying to calculate. And it's not rubber.  It's muscle, tendon.  I seem to have the ability to manipulate the malleability of my molecular structure and redistribute my density to --"
johnny,"Right, whatever, have fun."
ben,That's not funny!
ernie,"Hey, that's Ben Grimm there, the first mook from Brooklyn to go to outer space, so pay him some respect!"
ben,"Ernie.  Sorry for killing your business.  I'll take the usual, then I'm out... Better make it a double."
alicia,Who killed the party?
ben,"If there's a God, she hates me."
alicia,I don't think She's real big on hate.
ben,"You wouldn't say that, if you could see me."
alicia,Can I...?  See you...?
ben,"Trust me, this ain't one of those times."
alicia,"See you round, Benny..."
victor,Thank you for coming out to see me.
sue,You said it was urgent.
victor,It is.  There's something we need to talk about.  Something I need to ask you...
sue," Victor, wait, slow down a second.  I want you to know I appreciate everything you've done for me, but I just don't --"
victor,Susan.  What are you doing?
sue,"He's working round the clock.  But the data needs to be tested, analyzed before --"
victor,"Same old Reed.  All analysis, no action.  Wasn't that the problem with you two?"
sue,"If these molecules aren't stable, they could make us worse, maybe even kill us."
victor,"Then why is Reed dragging his feet? Maybe he likes having his prize specimen under glass...  It's ironic, isn't it?  You're finally the perfect woman for him...because you're his science project."
sue,Please don't make this personal --
victor,"Oh, I think you already have."
sue,"Victor, we can't do anything until the research is ready."
victor,"""We,"" huh?"
businessman,I wish my wife would disappear.
johnny,"Hey, Ronnie Renner!  I'm a big fan."
kenny bartram,Heard you like to ride.  Wanna take her for a spin?
ronnie renner,"Come on, bro.  I'll teach you some tricks...if you can keep up."
johnny,"My bad.  Sorry about that.  Thanks for the lesson, bro."
sue,That's new...
reed,"No way to know.  Without more tests, experiments."
sue,"We're not specimens, we're patients. This isn't just another science project to you, is it...?"
reed,BEN!  What?  What's going on!?
sue,He didn't.
ben,"Oh, he did."
sue,What did he do to the uniform?!
reed,He talked me into it.
sue,Girl...?!
johnny,"Well, I wouldn't say he's the leader."
ben,Could be worse.
johnny,"That's it.  Just The Thing.  We would have gone with The Rock, but it was taken.  And ""Thing"" pretty much sums it up."
ben, Okay.  I'm gonna go kill him now.
reed,Ben!  Slow down a second and --
reed, ...wait for me...
sue,I'm driving.
johnny, Where's my ride?
sue,"You gave us names?  What are you, the ""face"" of the Fantastic Four now?"
ben,It's about to be a broken face.
reed,"This isn't permanent, Johnny.  We need to be careful until we're normal again."
johnny,"What if some of us don't want to be ""normal"" again?  We didn't all turn into monsters like --"
ben,Did you just --
johnny,Let's see if we can get blood from a stone.
sue,You two need a time-out.
johnny,Blockhead started it!
sue,"Damn it, Johnny."
reed,You need to control yourself and think before you --
johnny,"Act.  Here we go again.  Reed, what if we got these gifts for a reason?  What if we have some, you know...like, calling?"
reed,A higher calling like getting girls and making money?
johnny,Is there any higher?
sue,Ben!  Slow down...
ben,It's not him.  It's them.  I can't live like this.
sue,Just give Reed a little more time. You know how he works -- analyzing every little step before he takes one --
ben,It's easy for you to be patient.
sue,"No, it's not.  I thought I was done waiting for Reed... We're all in this together now, Ben."
ben,"Together?  Look at me, Susie.  You got no idea what I'd give...to be invisible.  Your nightmare...is my dream."
ned cecil,"This is how you ""turn things around""? These freaks are on the front page and your company's in the obituaries."
victor,I have a plan to use their publicity for --
ned cecil,"Victor, stop.  The bank's lost enough already.  This isn't a negotiation. It's a notification.  We're pulling out."
victor,"You need to look long-term here. Without risk, there's no --"
ned cecil,"Reward.  We all know the sales pitch, Vic.  And frankly, we're done buying... Gentlemen."
ned cecil,Hello...?
victor,"It's pronounced Latveria.  This meeting's over, Ned."
leonard,"Sir, is everything okay?  What happened to your...?"
victor, Everything he wanted...he took from me.
reed,"Victor, are you...are you okay?"
victor,Don't worry about me.  Worry about yourself.
reed,What are you doing here?
victor,"What I should have done a long time ago.  Applications and patents, Reed. This all belongs to me."
reed,But I'm not done with the machine --
victor,Which is precisely the point. Analysis is over.  It's time for action.  My men could have mass- produced this by now.
reed,Mass-produced?  This isn't a toaster.  You have no idea how it works.
victor,"Re-create the storm, invert the polarity here, reverse the mutation there.  Don't talk to me like I'm some schoolboy.  I've got the same Phd you do."
reed,"The storm needs to be handled exactly right, or it could make our mutations worse, much worse, maybe even kill us..."
victor,"Reed.  I'm not asking permission.  We'll build it, while you check the specs."
sue,Can I talk to you?
sue,Don't let Victor push you into making a mistake --
reed,"He was going to take away all my data, equipment --"
sue,Better than your life.  Victor's not the one who has to get into that thing.  We are.
reed,"Which is why I'm working twenty hours a day, checking every variable --"
sue,"Every variable but yourself.  You don't eat, sleep.  You can't live in your head like --"
reed," I'm not the only one in there.  I got you, Vic, Ben, Johnny, all rattling around in there."
sue,So clear it out.  Get out of your head.  Get out of here...
little girl,"Mister, Mister!  Please help me!  My kitty is stuck in a tree."
ben, Eyebrows are a little big...
ben,How'd you know it was me?
alicia,"I'm blind, not deaf.  Wanna come in?"
ben,I'm not really dressed for a party.
alicia,"Relax, it's casual."
ben,"No, I mean...I'm a little...dusty..."
ben,Those yours too?
alicia,My step-dad's.  I'm strictly into stone.  I was wondering when you'd walk by.
the thing,"You know, you could'a run an ad in the personals."
alicia,"""Sensual blind chick seeks three-ton, rock-hard he-man for deep spiritual relationship."""
the thing,This ain't permanent.  My friend Reed's working on a cure...I think.
alicia,Bennie.  You feel pretty good as is.
the thing,"You don't know what it's like out there.  Walking around like some kind of circus freak.  People staring, whispering --"
alicia,I wouldn't know anything about that.
the thing,I mean...
alicia,"Tell me.  When you grew up in Brooklyn, how many astronauts did you know?  You went your own way then.  You didn't listen to people.  So why start now...?"
victor,"Need a ride, Johnny?"
victor,A few fans.  Hope you don't mind.
johnny,"Gotta take care of the fans, right?"
victor,"Look, I built my business knowing what people want.  And right now, the people want you."
johnny,"And we don't want to let the people down now, do we?"
johnny,Videogames?  You serious?
victor,"Johnny.  Let's be honest here.  Ben, Reed, Sue.  Good people, all.  But stars?  I don't want to break up the band, but you're the one they want.  Don't you think it's time to go solo...?"
reed,I could get Ben to tap into the Baxter's main power to generate enough voltage --
sue,Reed.  Shh.  Just be quiet.  And look up.
reed,You were?
sue,Of course I was.  I'd read all your papers on bioethics.  Some of them two times just so I'd have something to say to you.
reed,"You know, I bribed the projectionist ten bucks to keep it open late?"
sue,I gave him twenty.
reed,"Sue, you were right.  It wasn't complicated.  I just wasn't ready to be...to become...  You can be a little intimidating."
sue,"I did.  I did, Reed...but I wanted you to be that man."
reed,Why didn't you say something?
sue,That would have kinda defeated the purpose.  And Reed...  I'm saying it now.
alicia,Look around.  I'll get us drinks. They always let blind girls cut the line.
patron,I don't know about this one.  It lacks a certain...realism.
ben,What are you doing here?
victor,I'm worried about you.
ben,About me?  How sweet.
victor,Come on.  Let me buy you something to eat.  Looks like you could use the company.
the thing,'Scuse me.
victor,"I know it can't be easy.  Life hasn't changed that much for Reed, Sue and Johnny.  At least they can go out in public.  But for you?  People staring. Whispering behind your back..."
the thing,If you're trying to cheer me up you're doing a helluva job --
victor,"I'm just saying, I know what it's like to lose something you love.  To see it slip away, and know it's never coming back."
the thing,Reed's gonna fix me up --
victor,For your sake I hope you're right. I'm sorry if that sounds a little skeptical.
the thing,Skeptical...?
victor,"Look, he's a brilliant man, we should trust he's working as hard as he can. You're his best friend.  So what possible reason could he have for taking his time?  I mean, other than getting close to Sue?"
ben,"Yeah, I have that effect on people."
reed,Ben --
ben,"Oh, you remember my name do you?  You happen to remember what you swore to do with every breath in your body?"
reed,We're working as hard as we can --
ben,Yeah.  I can tell.  Victor was right.
reed,"Come on, this is nothing."
ben,"Glad ""nothing"" could take you away from your work."
reed,"Ben, I don't know if this thing'll change us back or make us worse. I need you to be patient for a little while longe--"
ben,"Look at me, Reed.  Look at me!"
reed,"I am looking.  That's why I can't make a mistake!  I've got to get it right, and it's not right yet!  We need to test this."
ben,"I spent my whole life protecting you, from the schoolyard to the stars.  For what?  So you could play Twister with your girlfriend while I'm the freak of the week?"
sue,Ben!  Stop it!  Or I'll stop it.
ben,Stay out of this Susie.
reed,"I'm OK.  Just go, go after him.  Stop him."
johnny,Christmas come early!  Check it out!
johnny,Hey!  That's a prototype!
ben,Go back to the drawing board.
sue,Johnny?  Did you see Ben?
johnny,"Yeah, for the last time, I hope.  I'm done with this freak show.  I'm moving back to the real world."
sue,"Is that what you call it?  ""Real""?"
johnny,At least it beats living in a lab like somebody's science project.
sue,"Johnny, slow down.  Think.  You know mom didn't raise us to --"
johnny,"Look around, sis!  She's not here.  So you can stop talking to me like I'm your little boy --"
sue,"As soon as you stop acting like one. Come on, you're smarter than this. You think those people out there care about you?  You're just a fad to them."
johnny,Let's try something new: you live your life.  And I'll live mine.  And just for the record: they LOVE me.
sue,"Oh god, Reed."
sue,"What did you do, Reed?  What did you do?"
reed,I can...make it work.
sue,"Reed, stop, you need to rest your --"
reed,The power...I need...more power...to control...the storm --
sue,You need a doctor.
victor,More power...?
leonard,Ben!  They need you back at the Baxter building.  It's...Reed.
johnny,What do you say we get out of here?
boyfriend,Is that all you do?  Bar tricks and stealing chicks...
girlfriend,What are you doing?!  You could have burned somebody!
victor,"Ben, come in."
ben,What is this?  Where's Reed?
victor,Where do you think?  With Sue.
leonard,Yes sir.
ben,"What do you want, Vic?"
victor,To help you.  I've run every test known to man.  And they all yield the same result: the machine is ready.
ben,Reed said it'd be weeks till --
victor,He also said we'd avoid that storm in space.  And we know how that turned out.
ben,And you can?  Power it up?
victor,Yes.  I've found a new energy source.
ben,Let's do it.
ben,Oh my God... Th-thank you.  THANK YOU...VIC?!
doom,Everyone thought I was safe behind those shields...
ben,"Victor, the machine worked for me.  It can work for you --"
doom,"It did, Ben.  It worked perfectly."
ben,You planned this...?
doom,I've always wanted power.  Now I've got an unlimited supply...
ben,And no Thing to stand in your way.
doom,"Take a good look, Ben.  This is what a man looks like who embraces his destiny."
reed,"Oh god Ben.  Are you okay?  You did it, you really did it..."
doom,"No, Reed.  I did."
reed,"Victor...?  What, what happened to you?  What did you do to your --"
doom,"Exactly what I said I would: I built a better, stronger being.  And outsmarted the great Reed Richards --"
reed,"Victor, this isn't the way to --"
doom, You always know best.  So tell me. What happens when you superheat rubber?
doom,"Never better, Jimmy.  And it's Doctor Doom now."
doom,Why the long face?
sue,Ben?!
sue,"No, I'm sorry, for pushing you out."
johnny,"Jesus, Ben!  I go away, look what happens.  You got a lot of explaining to do."
ben, The machine works.  And Vic's gone Mister Hyde on us --
johnny,Really?  With a name like Von Doom? Never saw that one coming.
sue,Where is Reed?
ben,Victor must've taken him.
doom,"Chemistry 101, Part Two.  What happens to rubber when it's super- cooled?"
johnny,Great.  Heat-seeker.
sue,What are you doing --
johnny,Sis.  Let me take care of you for once.
sue,But Johnny...you can't fly.
johnny,Well then this'll be one hell of a basejump.
ben,We need to help Reed --
sue,"Ben, you got what we all wanted. You need to stay here.  It's too dangerous."
ben,What...what have I done?
sue,What has he done to you?
sue,"Victor, please --"
doom,It's Doctor Doom to you.
sue,"We know the machine works.  It worked on Ben, it'll work on you.  We can turn you back --"
doom,Do you really think fate turned us into gods so we could refuse these gifts?
sue,Victor.  You always thought you were god.
doom,"Sue please, let's not fight."
sue,"No, Victor... Let's."
doom,Susan...... You're fired.
doom,One more down.  Now it's just the scientist and his specimen.
reed,Sue.  The only thing I ever knew without thinking was...  I...love...
sue,"Me too, Reed."
doom, And so four became none.  It's my time now.
ben,IT'S CLOBBERING TIME!
ben,"Excuse me, Maam.  Can I borrow your car?"
old lady,The clutch sticks a little.
ben,Not gonna be a problem.
doom,And you can't stop me.
johnny,"Had a little relapse, huh?"
doom,This is going to be fun.
reed,JOHNNY!  SPOT-WELD!
sue,Can't...hold...on...
reed,Johnny.  SUPERNOVA.
johnny,But all these people...
reed,Now.
thing," Flame on, kid."
reed,"Sue, I need some of that anger, rage, frustration --"
sue, I'm sure I can come up with something.
doom,Is that the best you can do...?  A little heat...?
reed,"Time for your lesson, Vic.  Chem 101: what happens when you supercool hot metal...?  Ben..."
ben,"Got it, teach."
doom,No.
johnny,"Damn, I love this job."
ben,"Job, huh...?"
reed,"Well, we do have the suits..."
sue,"You know, about what we said up there, I think maybe --"
ben,"Funny how things turn out, isn't it?"
sue,Hilarious.
reed,"Ben, I've been crunching the numbers on the machine.  I think if we can rework the power settings..."
ben,"Forget it, egghead.  I'm good as is."
ben,I like the sound of that.
reed,"Sue, can I talk to you for a second?"
reed,"I found a broken gasket, from space --"
sue,"A gasket?  Reed, we're at a party."
reed,If one of us were to wear it...
sue,Reed.  What are you doing?
reed,"No more thinking, no more variables... Sue Storm...will you...  Sue?  Sue?  You there?"
ben,No more cracks about how I look.
johnny,"Hey, I'm Mr. Sensitivity now.  Clear the way, wide load coming through."
ben,Showoff.
