Speaker,Dialogue
ted,You met any of those old stars?
ted,Ted.
ted,"I don't think so, not like yours."
ted,Beats me.
ted,Who?
ted,What do you mean?
ted,"No way, not me. You got any other advice."
betty,"Sam! Hey, Sam, wait a minute!"
betty,I just want to say good-bye.
betty,"Uhhh, Betty. The concierge. Your boss."
betty,"Yeah, sure."
betty,"I just want you to know, from the owner and all the staff, your fifty years of service have been an inspiration to us all. You're a legend in your own time, and the Mon Signor will never be the --"
ted,Sam the bellboy. Now there was a man.
betty,"Yeah. Oh, hi, Teddy. Ready to start the night shift?"
ted,Yeah.
betty,"Well, let me buy you a drink."
ted,You wanna buy me a drink? I'm starting my shift.
betty,"You're not an alcoholic, are you; one drink won't kill you."
ted,"Yeah, sure."
betty,"After fifty years, Sam retires, and you're taking over the night shift."
ted,Correct.
betty,You're filling some mighty big shoes.
ted,"Oh, I know."
betty,Sam was a legend in the hotel business.
ted,"Oh, I know..."
betty,A bellhop's bellhop.
ted,An inspiration to us all.
betty,"He ran the night desk for fifty years, all by himself."
ted,An amazing man.
betty,"No desk clerk. No night man. No help. Just fuckin' Sam, and his wits."
ted,A man alone.
betty,And you're gonna do the same.
ted,I know.
betty,Tonight.
ted,Tonight!
betty,"Yes, tonight."
ted,I can't.
betty,"Yes, you can."
ted,"No, I can't. I never worked the night shift before."
betty,Oh night shift -- smight shift.
ted,We were supposed to work it together.
betty,"I know, but I can't."
ted,Why not?
betty,I'm having a New Year's Eve party.
ted,Since when?
betty,"Actually, I'm not having it. My roommate is. And there's this guy. German guy. He's gonna be there. And so am I."
ted,I can't run this place by myself.
betty,"Oh, sure ya can."
ted,"No, I can't."
betty,Sam ran this place by himself for fifty years.
ted,"Yeah, and he had fifty years of fuckin' practice, too. I haven't had a day."
betty,"Look, Teddy, calm down --"
ted,-- Don't call me Teddy.
betty,"Ted, the night's cake. It's easy. The day's when it's busy. During the night there's nothing to do."
ted,It's New Year's Eve.
betty,"Which'll make it less busy than normal. Ever worked on Christmas? Unless you sell turkeys, business is dead. You just got butterflies, that's all."
ted,What I have ain't butterflies. I can't handle this hotel all by myself.
betty,"Okay, let's calm down a minute. Slow it down, cool it off. Let's just talk."
ted,You can say any goddamn thing you want --
betty,-- Ted? I thought we were calming down? I thought we were cooling off? No hostility. Say good-bye to hostility. We're just talking.
ted,"Okay... okay... okay... I'm calm, I'm cool, let's talk."
betty,"Ted, in a nutshell, all you have to do is hold the fort. It's New Year's Eve. Most of the guests are going out. You'll just be giving them a little nod as they come staggering in at three... four... five... in the morning. Nobody's having any parties, a few get-togethers, but no parties. You got about three people checking in tonight, that's it. The only variable is Chester Rush in the penthouse."
ted,Chester Rush? The guy from The Wacky Detective?
betty,"Yeah, him and his entourage checked in last night. They're in the penthouse. The only reason I refer to it as a variable is that he's a movie star. Ya never know about movie stars. I'm tellin' ya, Ted, it's cake."
betty," And look, if you have any problems, call me at the party."
ted,Okay.
betty,Great --
ted,-- For fifty bucks.
betty,Fifty bucks!
ted,"You're shirking your duties for this Nazi. For that you pay a price, and the price is fifty bucks."
betty,"One, Horst is not a Nazi. Two, that's not a fair price. You're taking advantage of the situation. Twenty bucks. Now, twenty bucks is a fair price."
ted,"Yeah, but what you're doin' to me ain't fair. And, you are completely and totally taking advantage of me and your position. So fifty bucks is the perfect price."
betty,"Okay, but don't be a pussy. You don't bother me unless it's an emergency. In fact, for fifty bucks, you better not call me unless the fuckin' building's burning down."
betty,Get ready to take the desk.
room 321,"""STRANGE BREW"""
athena,Pleeze be careful -- my God. You have no idea...
athena,"I'm usually a good tipper, but this one -- this cab driver -- he had green all around him. I don't like that in a man."
ted,Green? Is that bad? Like you read auras or something like that?
athena,Something like that.
ted,"Yeah, well what color are you seein' around me... how's the tip lookin?"
athena,"I see purple... in your face, and..."
athena,...you're okay.
athena,Athena Z.
ted, You're booked in the Honeymoon Suite -- just one night? With all this luggage?
athena,I will only need to stay till sunrise.
ted,Okay... and how will you be paying?
athena,With gold.
athena,Well -- the other bag -- I need it.
ted,Right.
ted,"What the hell you got in here, lady? Nuclear weapons?"
athena, The White Cliffs of Dover.
athena,"The others will be coming soon. Send them, pleeze."
ted,Oh -- I forgot to show you how to turn on the Jacuzzi.
athena,"I been in dis' place many New Year's. So... you send the others to me, huh. Go now."
athena,"On this night, oh great goddess Diana, we restore your virgin flesh and bring you back to real life."
athena,"Soon -- I take you to the pond for a cleansing. Well, it's a swimming pool, but it will be under the setting sun, okay?"
ted,May I help you?
elspeth,I... we... have a reservation.
elspeth,Kiva!
kiva,"Wait up, gawd! I had to get supplies for this boring ass night."
elspeth, We have a reservation in the Honeymoon Suite.
ted,"Oh yeah... you must be one of ""the others."" And what're you carrying -- the Rock of Gibraltar?"
elspeth,What'd I tell you about smoking?
kiva,You smoke.
elspeth,"That's right -- I smoke, and I'm addicted to it, and I don't want the same thing to happen to you."
kiva," ""Hello -- welcome to this week's edition of the Hypocrite of the Year Award --"""
elspeth,Kiva! That's enough --
kiva,You're not my mother!
elspeth,Yes I am.
kiva,Then why're we sleeping together?
elspeth,Well... I didn't mean it... literally. I... I happen to be the only one who... cares about you --
elspeth,Please -- take us to our room!
elspeth,Flea powder. One of the others is bringing her cat.
elspeth,You're gonna have to wait in the other room.
kiva,Why?
elspeth,Because I said so.
kiva,I'll watch TV.
elspeth,You can't watch TV because the noise will interfere with our ritual.
kiva,Okay... Mommy.
athena,Soon -- our goddess will come. I will go get her negligee.
athena,What are you doing! Have you no respect -- who -- who is dis girl?
elspeth,"Kiva. My friend. Kiva, turn off the TV! I can't leave her at home -- she's on probation and I gotta keep an eye on her."
athena,"Well, Elspeth, your friend cannot stay here during the ritual. She may be one of your kind, but she is not one of us."
elspeth,She stays!! Or I go -- along with my offering!
athena,"TURN OF THE FUCKING TV, MAN!"
kiva, Make me...
athena,Let's not forget -- I am the High Fucking Priestess. Deal with dis girl!
athena, Tell me -- did we have these problems in Salem? I don't think so...
elspeth,Kiva... you know what I love about you?
elspeth,Your sweet side.
kiva,And what do I get if I'm sweet?
elspeth,You get whatever you want. And you know what else I love about you?
kiva, What?
elspeth,Your nose.
elspeth,And I saw you checking her out.
jezebel, Oh you little stinker... oh you sweet little muffin. Yes... Mama loves the baby.
jezebel,"Well, this is just darlin'! Just darlin' Hi-dee, girls..."
jezebel,Toodle-loo.
jezebel,Well -- I see Elspeth has herself a new lil' fool -- what the hell is she doin' here on our night of annual ritual?
athena," I have sanctioned her presence, as long as she behaves. Come on -- there is more work to be done to welcome our great Diana."
kiva,I WANT ROOM SERVICE!!
elspeth,Why do I always attract girls who are looking for a babysitter?
jezebel,"Well now, honey, maybe Juvenile Hall ain't the best place to find serious relationship material."
raven,I'm looking for the room for making love.
ted,You might be referring to the Honeymoon Suite. Straight thata way... you can't miss it -- see all that furniture in the hallway --
raven,Oh I know the way. I just wanted you to know that I knew where I was going and that you needn't bother yourself with me. The others are here -- great!
ted, Oh yeah -- it's so great -- it's fantastic.
raven, Ohhh... I know it all seems very strange but you're coping with us much better than the bellboys of past New Year's.
ted,Past New Year's?
raven,Oh yes -- we've been coming here every New Year... for a long time. Thanks for your patience.
ted,"Oh hey -- no problem -- wreck the place. Bring in cats. Ruin the carpet with flea powder, pour paint in the Jacuzzi. Throw the furniture out the... where're your bags?"
raven,I travel very light.
ted," Yeah, yeah, Honeymoon Suite."
eva,Oh... yes... I'm late.
ted,All right -- lemme give ya a hand.
eva,"Oh... no, that's all right. I can carry them by myself."
ted,I'm a man doin' a job -- no hero.
eva,Well gosh -- thank you!
eva,"Tell me, how long have the others been here?"
ted,About an hour.
athena,"You are very late, Eva."
eva,"I'm sorry, Athena. I was attending a birth and the placenta was late in coming."
eva,"Oh, wait, lemme give you a little more than that..."
elspeth,"Which birth is more important to you, that of a mortal or that of a goddess?"
eva,"All life is precious... but I do apologize for being late, Elspeth."
jezebel,"Back home, they jist yank on the umbilical cord, do a Karate chop on the mama's belly, and them things come right out."
eva,"They do that here, too, Jezebel, in the hospitals, but it causes hemorrhages. I fed the mother a bowl of comfrey tea and it brought the afterbirth down perfectly. The couple are going to use it for fertilizer to plant a lovely tree for their baby."
kiva,"Oh wow -- if they were really back- to-nature, they'd eat it, like other mammals do."
raven,"In some Native American cultures, they dry the umbilical cord, grind it to a fine powder, and put it in a leather pouch that the baby wears to ward off evil. But burying the placenta is also a very sound ecological practice -- 'cause of the oxygen it carries."
eva, Yes -- because you see when the placenta detaches from the uterine wall...
ted," Uh, thank you, ladies -- I'll be going now. If you need anything --"
athena,Wait. We do need a few things.
athena,"We need fresh rosemary from the kitchen. Mostly what we need is from the kitchen. Hey, are you listening?"
ted,"Yeah, yeah, rosemary."
athena,"And a little bit of sea salt or Kosher salt if you don't got no sea salt. A bottle of spring water -- Italian please, not French shit."
kiva,And some french fries!
elspeth,"Kiva, shut up."
athena," And some ginger, two of the eyes of a trout fish, and a piece of raw meat, liver if you have it."
kiva, I want fries -- you dumb jerks with your stupid fucking ritual!
athena,"Shut up, you little shit."
elspeth,Don't talk to her that way!
athena,"Get to work, man."
elspeth,Kiva...
kiva,What?
elspeth,You have to go in the next room now.
kiva,"Oh, wow, like I'm bummed out that I can't watch.  I'm bored!"
elspeth,UP!
kiva,Don't put me in there by myself. I'll miss you way too much.
elspeth,"Kiva, don't do this to me."
kiva,"Please... if you just lemme... I'll play dress-up with you, the way you like it... you know what I mean... remember...?"
kiva,We can pretend and I'll do it exactly... the way you want it... with the egg whites and the kilt.
elspeth,You mean... like last week?
elspeth,"We'll talk about this later, Kiva."
kiva, No!
jezebel,"Aw, really now -- child abuse?"
elspeth,You stay outta this!
athena,"I demand this stop now, Elspeth!"
kiva,I'm running away from you!
elspeth,Fine. Go ahead. And I'll call your parole officer and she'll find you and send you back to Eastlake!
athena,"Now that the fucking melodrama is over, can we start the goddamn ritual -- pleeze?"
athena,"We are communing here on New Year's Eve to bring to life the great goddess Diana, who was turned to stone in this very room forty years ago today."
athena,"Diana, great beautiful one, we make these offerings to you, that we may undo the wicked spell which deprived you of the seed of your lover, your virginal blood, of your very life. We now form the symbolic rock with our bodies."
athena,"On this night, in this hour, we Call upon the Ancient Power O Goddess bride, I offer thee Milk from a mother's sweet titty!"
elspeth,"To reverse the evil which has been done I make this offering to the Divine One A whore not, an innocent was, For whom I seized a virgin's blood."
jezebel,"Goddess of Light, Goddess of Lust, To undo this awful spell is a real must. To bring you life and get you high I offer the sweat of five men's thighs."
raven,"Diana, oh great one, we live without sun Until this wicked curse is undone. In hope that you live, and to us appear, I have collected a year's worth of tears."
eva,"Great Goddess Diana, fail you I will, I was to bring fresh sperm from my Bill. I had him erect, and his semen would follow But alas I was hot, so hot that I swallowed."
athena,You stupid little witch! You swallowed the sperm! Aye-yi--yi!
elspeth,"It just shows what an amazing lack of control you have over yourself, Eva!"
jezebel,"Honey, why didn't you just use your hands? Didn't your mama teach you not to put them things in your mouth?"
raven,I understand though...
athena,"There is no time to cry over swallowed sperms. You're gonna have to get some, baby. You have one hour to prove what kind of witch you really are."
athena, What do you want?!
ted,Ted... the bellboy.
athena,"Mr. Bellboy, come right in!"
ted,"Here's the things you asked for. Oh, and uhh, sorry, but I'm not gonna pick the eyes outta this dead fish."
athena, And don't use your mouth!
elspeth,"If she doesn't get his goop in ten minutes, I'm going to take him myself."
jezebel,Ha! That'll be a first for you.
elspeth,Oh shit -- Kiva!
elspeth,And just where do you think you're going?
kiva,"Well, gawd -- I need a candy bar or something -- you haven't fed me all day. I'm getting all shaky. My blood sugar's really low."
jezebel,Elspeth -- honestly now -- some babysitter you're turnin' out ta be!
athena,"Enough, girls. I will collect fresh earth. Jezebel, I want you to gather damp moss. Raven, you bring me a birch branch."
ted,"Help me out, lady. I gotta earn this fifty bucks!"
eva,"Oh look, they don't care if I smile or not! All they want is..."
eva,"You won't understand, believe me."
ted,"Try me. I've been around, y'know."
eva,"Well... okay. The five of us -- Elspeth, Jezebel, Athena, Raven and me -- are a coven."
ted,"Ha, like a coven of witches?"
eva,Yes.
ted, Oh.
ted,I knew that!
eva," And you see, our coven has spent forty years trying to perfect a ritual to undo a wicked curse put on our goddess Diana."
ted,"Gee, you don't look a day over twenty!"
eva,"Oh... ha ha... I mean the witches before us tried and failed. But Athena, our High Priestess, discovered a great potion to reverse the evil spell which turned our beautiful goddess into an old rock."
ted, Yeah? Is... is that her?
eva,"She was a beautiful virgin. An entertainer by trade, but a great sorceress by design. It was here in this very room, on her wedding night, a jealous rival placed the curse on Diana."
ted,She turned to -- that -- here?
eva,Yes... and her young husband turned into a pink fish! They found him swimming in the pool in circles. While our dear goddess: a stone in her honeymoon bed.
eva,This was Diana.
ted,This girl here? This is the goddess Diana?
ted,"I hate to tell you this, but I kinda doubt she was a virgin."
eva,"Oh, but she was! She had lovers, but she saved that for marriage. Which is the example I've tried to follow: to do everything but that till I marry..."
ted,"Hey, don't cry... a virgin is a rare and beautiful thing. If you say she was a virgin, I'll believe it."
eva,"Well, it doesn't matter now... and she won't be resurrected tonight 'cause I failed her. I let my whole coven down!"
ted,Wait a sec -- that rock was gonna turn back into this?
ted,"Now, that would be something worth seeing!"
eva,"Only, not now -- we were each supposed to bring something -- a life fluid."
ted," If this is gonna be like one of those afterbirth conversations, I don't think I wanna hear this."
eva,Only... I swallowed it...
ted,You swallowed what?
ted,"You mean, you were supposed to bring... like... like a guy's... and you...?"
eva,"And now, you're my last chance!"
ted," Whoa, what? You want my -- for the -- witchy poo -- ahh no -- no way -- nope. Besides, it's against hotel policy. I was warned: ""No sex with the clientele""!"
ted,"Ha, c'mon now, joke's over.  Hey, we're gonna step in the flea powder."
eva,"That's not flea powder, that's sacred dust ground from the horns of Albino goats."
ted,Right! I knew that!
ted,"What's a nice girl like you doing in a coven, anyway?"
eva,"Well, see, what I really want to do is be a midwife. I've attended four births already! I can prevent vaginal tears and everything."
ted," Well, that's a good thing! A guy doesn't like surprises down there."
eva,I joined the coven to attain greater understanding of my feminine power so I could become a truly great midwife!
ted," Oh, well, I see you've been gaining a lot of insight into your... girl powers..."
eva,Do you really think so?
ted," Ohhh, God! Betty's gonna kill me!"
eva,Who's Betty -- your girlfriend?
ted,No. My boss.
eva,Oh good!
ted,Oh no!
eva,My phone number in Topanga. Call me?
ted," Sure, baby. Yeah, I'll give ya a call."
kiva,What's that used for?
raven,"It's a birch branch, symbolizing eternal life. You can also use the bark for a tea which assists in astral travel."
kiva,Hey -- I wanna be a witch!
eva,I'm a woman now!
athena,"But where is his ""stuff""?"
eva," We did it right there, in the big cauldron!"
jezebel,"Ooohhh honey, you're gonna be sore tomorra! Didn't your mama teach you that water strips a girl's lubrication?"
raven,"Sex in water is great in the movies, not in real life... but you will learn. As we all did."
jezebel,"Yeah, when she can't walk...  I guess you wouldn't have those kinds of problems -- without penetration."
elspeth,"No. And virtually no cervical cancer, either."
athena,"Okay, girls, enough Sex Education 101, let's get going with our ritual, goddammit."
eva,"Goddess Diana, I offer you The jism of one I wooed for you That you may live and know such bliss Of getting laid by a guy like this."
athena,I don't understand what went wrong.
elspeth,I say Eva pulled one over on us.
eva,What?
jezebel,"Honey -- Eva was wearing the face of someone just fucked good... and the best actress in this world, or any other, can't fake a thing like that!"
elspeth,"Exactly -- if she was fucked so good, how could she save his come?"
raven,It could be done...
athena,"Girls, knock it off.  Maybe... maybe it needed to be the sperm of a virgin male."
eva, He was no virgin!
athena,"Let's leave her here, with the sword, until dawn. I will come back for her before checkout time. I just... feel too sad to carry her away before the sun comes up to warm her."
jezebel, I can't believe we have to carry our own bags out! My mama would have a hissy fit!
kiva, I'll carry your bags.
elspeth, You're carrying my bags!
athena,"Next year, we try again -- with virgin sperm."
ted,"Oh, Jesus, what did I tell you? Do you want milk and cookies, or do you not?  You be good and you'll get milk and cookies, but for now leave me alone, please. I'll be up later to put you both to sleep."
ted, Goddamn kids.
ted,Room Service.
yuppie scum,What room am I in?
ted,"This is the front desk, sir."
yuppie scum,What room are we in?
real theodore,How should I know? I just got here.
yuppie scum," You know, don't you have one of those light things?"
ted,"If you care to go to the door and look on the other side, you'll find the room number."
yuppie scum, Call my assistant and ask her what floor we're on.
real theodore,Who's your assistant?
yuppie scum,The girl you party with every night.
real theodore, Who?
ted,"I'm here alone, sir."
real theodore,"It's room 404, I think."
yuppie scum,I could have sworn we were on the fifth floor.
ted,"What do you need, sir?"
yuppie scum, What do we need?
real theodore,Ice.
yuppie scum,Ice?
real theodore,Ice.
yuppie scum, Ice.
ted,Ice.
yuppie scum,Yeah. Ice.
ted,"Right, sir. Ice. 404. I'll be with you momentarily."
room 404,"""THE WRONG MAN"""
ted,Anybody home?
man's voice,No one here but us chickens.
ted,"Say, it's pretty dark in here, sir."
man's voice,"What do you expect, Theodore, a fuckin' floor show?"
ted,Do I know you?
man's voice,I don't know. Do you?
ted,I brought your ice.
sigfried,"That's cute. In fact, the whole getup's kind of cute. The monkey suit's a nice touch, honey puss."
ted,This has to be a mistake. Is this room 404?
sigfried,"Theodore? What do you take me for, Theodore?"
ted,A very upset man?
sigfried," I am an upset man, Theodore."
ted,"How do you know my name, sir?"
sigfried,"I'm psychic, Theodore."
ted,"Look my name is Ted, actually, and I have no idea what's going on here, but I've obviously come at a bad time."
sigfried,"Let's not belabor the fact that you have no sense of timing, Theodore. The fact is you're here."
sigfried, And I couldn't think of a better time for you to introduce me to your beau than on New Year's Eve.
ted,"Oh fuck, there's a mistake. You're fucking wrong here. My name is Theodore, yes! My mother named me that and I hate the name. But I'm a fucking bellhop. People call me Ted. I work here."
sigfried,"Look, I'd love to sit here all night with you talking about things like when you broke in your first mitt --  That was insensitive of me, wasn't it, T H E O D O R E? But let's cut to the chase, okay?"
ted,Okay.
sigfried,So apologize!
ted,For what?
sigfried,"You are really beginning to annoy me, Theodore."
ted,"Look, obviously you two are working something out and if I could help you with your problem I would."
sigfried,What are you saying? Are you saying I got a problem? Are you trying to say I don't give her what she needs? That I'm FUCKING INSENSITIVE!!
ted,"Look, is this about another man? Or something?"
sigfried,"Let's get our ABC's right, here, Theodore. Theodore, right?"
ted,Ted's better.
sigfried,"Ted, okay... Are you saying my wife cheats on me?"
ted,I didn't say that... I...
sigfried,"Oh, for Christ's sake, Theodore, this is about as intimate a situation as you can get, you, me, and Angela here. It's pretty cozy. To say nothing of how stupid an idea it is to lie to a man with a loaded gun without considering the possible response. I demand an apology!"
sigfried,Don't move. I've got to take this.
sigfried," We ain't got any needles here, kid. Just a big fucking gun."
sigfried," Now, where was I? Oh yeah, I remember."
sigfried,"I want you to pray for forgiveness, Theodore."
sigfried," Now say after me, ""I apologize..."""
ted,I apologize...
sigfried,For what?
sigfried,For fucking what?
ted,That I said you might have been unfaithful?
sigfried,"""That I said you might have been unfaithful?"" Listen, Theodore, you're in church here... you're kneeling in front of an altar. Truth... truth is all it hears. Say the following, ""I, Theodore, must humbly and sincerely apologize for saying that you fucked another man!"""
sigfried, Satisfied?
sigfried, Do you accept the fucking apology?
sigfried," You always gotta get the last word, don't you? It's one way with you, Angela, isn't it? I give and I give and I get nothing back."
sigfried, She just sits there waiting for me to jump through hoops...
sigfried," Stupid me, for a second I thought you were going to say something... something like, ""I'm sorry."" HA! ""I'm sorry."" You're absolutely right, love cakes, I wouldn't want it that way. That's one thing you can say about Angela. She'll never do anything she doesn't want to do. If the feeling ain't there, she just isn't going to do it. There is nothing in this world as fucked as a woman who gives when she doesn't want to. Never let that happen to you, Theodore. It makes you feel very little indeed."
ted,You mind if I...?
sigfried,Go ahead. Spit it out.
ted,"I don't mean to upset you further, sir, but I think she was trying to say yes."
sigfried,"Are you condescending to me, Theodore?"
ted,"Absolutely not, I would never do that."
sigfried,Why don't you just say it?
ted,Say what?
sigfried,That you think I'm an idiot.
ted,I would never say that.
sigfried,"You think you're superior to me, don't ya, Theodore? You don't think I notice there is a gag in the woman's mouth."
ted,Of course you do.
sigfried,"Naturally ""of course."" And do you know how I know that?"
ted,"How, sir?"
sigfried,"Because I PUT THE GAG IN HER MOUTH! I'm gonna let you in on a little secret about communication, Theodore. It's all in the eyes...  Or me? Him or me? No one? Okay. Let's drag it out."
ted,What!
angela,"We don't have time to play charades here, asshole! Untie me quick."
ted,"Listen, lady, I don't know what in the hell is going on here, but I'd appreciate it if you would explain to that nutcase that he's making a big mistake."
angela,"Look, whether you like it or not, you're in the middle of a situation here you can't just wish your way out of."
ted,"But I've never seen you people before, we're complete strangers."
angela,"Everyone starts out strangers, Ted, it's where we end up that counts. Hurry up."
ted,I don't know if I can do this. It's too hard.
angela,"Life is hard, Ted. You ever stopped to consider how many times you change your underwear in a lifetime?"
angela,"I don't mean literally, you ignoramus."
ted,What?
angela,"Forget it, listen to me. There's a gun in my suitcase behind the bed, it's loaded..."
ted,I'm not going to shoot anybody.
angela,"Fine. Get the gun and I'll shoot ""anybody."""
ted,And make me an accessory in the murder of your husband?
