Speaker,Dialogue
chester," Pay no attention to Norman here, Ted, he's just fuckin' wit' ya, that's all. That's from Quadrophenia. Now me, myself, when I think of bellboys I think of -- ""bellboy"" isn't an insult, is it? Is there another name for what you do that I'm ignorant of? Bellman, bellperson --"
ted,Bellboy's fine.
chester,"Good. I'm glad they haven't changed that. There's a friendliness to ""bellboy."" As I was saying, Ted, when Norman thinks of bellboys, he thinks of Quadrophenia."
ted,No.
chester,"You should, it's one of Jerry's better movies. He never says a word through the entire film. A completely silent performance. How many actors can pull that off? And he has to go to France to get respect. That says it all about America right there. The minute Jerry Lewis dies, every paper in this fuckin' country gonna write articles calling the man a genius. It's not right. It's not right and it's not fair. But why should that surprise anybody? When has America ever been fair? We might be right every once in a while, but we're very rarely fair."
ted,Where do you want this?
chester,"You in a hurry, Ted?"
ted," No, not particularly."
chester,"Good, then stop playing ""Beat the Clock."" Now let me introduce you to everybody."
chester,Our friend from downstairs you already seem to be acquainted with.
angela,"Oh, me and Theodore go way back. Don't we, Theodore?"
ted,"The name's Ted, Angela. I only let people with loaded guns at my head call me Theodore."
chester,"Angela's like you, Ted, a newfound friend."
angela,We met at the pool.
chester, Have you ever seen Angela in a one- piece?
ted,No.
chester,"Well, it's somethin' to see.  The Man sitting in the chair, with the bottle of Jim Bean in his hand and the sense of humor, is Norman. Norman, say hello to Ted."
norman,What's up?
chester,"The sociable son of a bitch on the telephone is Leo. And the person on the other end of the phone is his lovely wife Ellen.  Leo, say hello to Ted."
leo,"Hi, Ted, glad you could make it.  What does punctuality have to do with love?"
chester,"Which brings me to me, Chester Rush, Ted. Pleased to meetcha."
ted,I know. I'm sorry I haven't seen your movie.
chester,"It's quite all right, Ted, nothing to feel sorry about. That's why God invented video. But you know, Ted, a lot of people did see it."
chester,Who drank out of this bottle last?
chester,Who drank out of this bottle -- not the other bottles -- this bottle last?
norman,"What's wrong, Chester?"
chester,"It's fuckin' flat, Norman, that's what's wrong. The champagne -- the fuckin' Cristal's fuckin' flat."
chester,"I was saying, Ted, a lot of people did see it. And not just on video, either. Leo, what was the final take on domestic?"
leo,"72.1 million.  You okay, champ?"
chester," I'm cool, so talk to your wife."
chester," Before all that other shit, The Wacky"
chester,"And my new one, The Dog Catcher, it's projected to break a hundred.  The Dog Catcher."
ted,The Dog Catcher.
chester,Now let's stroll over here and see what goodies you brought us.
ted,Do you mind me asking what's all this stuff for?
chester,"One thing at a time, Ted. I'm not a frog and you're not a bunny, so let's not jump ahead. C'mon, Norman, you should be interested in this."
norman,Damn Skippy!  Tell it.
ted,A block of wood.
chester,Good.
ted,Three nails.
norman,Why three nails?
chester,"That's how many Peter Lorre asked for. Continue, Ted."
ted,A roll of twine.
chester,That's definitely a roll of twine. Continue.
ted,A bucket of ice.
chester, You into it?
norman, I'm into it.
chester, Go on.
ted,A donut.
chester,That's for me. Continue.
ted,And a hatchet.
chester,A hatchet as sharp as the devil himself is what I asked for.
ted,"Well, you be the judge."
norman,I'll be the judge.
chester,Whadya think?
norman,That's a sharp motherfucker. Bring all this bullshit over to the bar.
chester,"You heard him, Ted."
leo,Bitch!
norman,You still married?
leo,"Maybe, maybe not, but I don't give a flyin' fuck either way. I've had it with that Machiavellian bitch! I'm too drunk to drive home. I'm sorry about that, I'm real sorry about that. I got drunk on New Year's Eve, cut my fuckin' head off...  What's going on here?"
chester,"We now return you to The Man from Rio, already in progress."
leo," Noooo, you're gonna do it?"
norman,Looks like.
leo,"You guys ain't bullshittin', you're gonna really go for it?"
angela,"After talkin' about it all night, they better. I wanna see a show."
chester,"When we do it, you'll have something to see."
leo,You are one radical dude.
ted,"Well, that's everything, so if you don't need me for anything else, I'll go back downstairs."
chester,"Not so fast, Ted. We ain't quite done yet. Why don't you take a seat at the bar, get comfortable, and have an open mind when we explain the festivities of the evening to you."
ted,"Look, guys, you paid for the room. As long as you don't break up the furniture, you can do whatever the fuck you want. And me personally, I don't care if you break up the furniture. You don't have to explain anything to me. Whatever constitutes a good time as far as you guys are concerned is your business."
chester,"Well, it's your business, Ted. 'Cause we want you to take part."
ted,Take part in what?
leo,"Chester, your way of breaking the news to him gently is scarin' the shit outta him."
angela,Look at the poor guy. Just spit it out.
chester,"First off, let me say that there's nothing homosexual about what we're going to ask you to do. There's nothing sexual at all about what we want. But I was thinkin' you might be thinkin' we want you to do some sex thing. Pee on us, suck us off, shit like that. Let me assure you nothing could be farther from what we want --"
angela,Can I jump in here?
chester,"No, you can't jump in here, this is my story."
angela,Theodore's been here fifteen minutes and you've talked about everything but.
chester,"Hey, if you don't like it, you can get the fuck out."
leo,"If it'll please the court, let me explain to Ted our intentions."
norman, I second the nomination!
chester, Move the nomination be closed!
chester," Leo, the floor is yours."
leo,"Thank you.  Ted, did you ever watch the old ""Alfred Hitchcock Show""?"
ted, Yeah.
leo,"Did you ever see the episode The Man from Rio, with Peter Lorre and Steve McQueen?"
ted,I don't think so.
leo,"Oh, you'd remember it all right. In the show, Peter Lorre makes a bet that Steve McQueen can't light his cigarette lighter ten times in a row. Now if Steve McQueen can light his cigarette lighter ten times in a row, he wins Peter Lorre's new car. If he can't he loses his little finger.  Norman's putting up his pinky against Chester's mint convertible, 1964 red convertible Chevy Corvelle that he can light his Zippo ten times in a row."
ted,You guys are drunk.
chester,"Well, that goes without saying, but that doesn't mean we don't know what we're doing."
norman,I'll tell ya what I'm doin'.
norman,"I drive a motherfuckin' Honda my sister sold me. You hear what I'm sayin'? A little white motherfuckin' Honda Civic.  Now you take a good look at that machine that this motherfucker over here is standing next to. That's a 1964 nigger-red, rag-top Chevy Corvelle. And I love that car more'n I love hips, lips, and fingertips. Cut to we sittin' here celebrating, gettin' high, drinkin' champagne --"
chester,"-- Cristal. When you're drinkin' anything else, you're drinking champagne. When you're drinkin' Cristal, you say you're drinkin' Cristal."
norman,"-- drinkin' Cristal. Watchin' TV. ""Rockin' New Year's Eve."" When all of a sudden we flip on Steve McQueen and Peter Lorre bein' fuckin' badass. And I look at this funny motherfucker over here, and I say, ""I'd do that for the Chevelle."""
leo,And Chester replies...
chester,"""...Oh, really?"""
ted,You guys wouldn't be doin' something this stupid unless you were drunk.
norman,"I think that pretty much goes without sayin'. We'd probably chicken out. But when you're fucked-up, you don't lie. You tell the fuckin' truth. And the fuckin' truth is, my lucky Zippo's gonna win me Chester's car."
ted, Why are you doing this?
chester,Thrill of the bet. I'm the one with something to lose here. 'Cause I can pretty near guarantee that I love my car more'n Norman loves his pinky.
ted," How 'bout you guys, you're just gonna sit back and let your friends mutilate each other?"
leo,"Why not? Life don't get much more exciting than this. I mean if Norman was puttin' his dick on the choppin' block, I'd step in, 'cause, ya know in the morning, we'd really regret that. But his pinky? Who gives a fuck? I mean theoretically, he could lose that choppin' onions tomorrow. Life still goes on."
ted, How 'bout you?
angela, I don't care.
chester,Which brings us to your part in this little wager.
ted,I don't have a part.
chester,"Now, Ted, my old granddaddy used ta say: ""The less a man makes declarative statements, the less he's apt to look foolish in retrospect."" Now there're some inherent obstacles in this undertaking. First of all, I'm not some sick fuck like Peter Lorre on that show, travelin' the countryside collecting fingers. We're all buddies, here. Nobody wants Norman to lose his finger. We just wanna chop it off. So if fate doesn't smile on ol' Norman, we'll put his finger on ice and rush 'im to a hospital, where in all likelihood be able to sew it back on."
ted,Hopefully.
leo,Eighty percent.
norman,Our side.
chester,"So Norman's protected. His interests have been looked after. My interests, on the other hand, have not. I am as emotionally attached to my car as Norman is physically to his finger. I'm putting up a very expensive piece of machinery on this wager. Now, if I lose, I lose, I have no problem with that. I'm a big boy, I knew what I was doing. However, if I win, I wanna win. If Norman lights his lighter ten times in a row, he's gonna have no emotional problems about taking my car keys whatsoever. But if I win, it's not inconceivable that Leo or myself, at the last minute, might not be able to wield the ax. Which brings us full circle to you, Ted. Sober Ted. Clear-eyed Ted. We want you to be the diceman."
angela,"Helluva night, huh, Ted?"
ted,I gotta get out of here.
chester,"Ted, I got a hundred-dollar bill here with your name on it, whether you do what we ask or not, just to sit back down in the chair for one minute more."
ted,I'm not gonna cut off his finger!
chester,"Maybe you will and maybe you won't, but that has nothing to do with this hundred-dollar bill in my hand. You can tell us all to go fuck off and walk right out that door. But if you sit back down and wait sixty seconds before you do it, you'll be a hundred dollars richer."
angela,Ted. Take the money.
leo,"Ted, you're gonna do whatever you want to do. We're just askin' you to indulge us for another minute more. And Chester's willin' to pay for it."
ted,"I'll take your money, and I'll sit back down. But a minute from now, I'm gonna walk out the door, and when I do, there'll be no hard feelings?"
chester,"Well, I want you to have a bit more of an open mind than that, but, yeah, we'll either convince you or we won't. No hard feelings. Right, guys?"
chester,"Okay, Leo, you be the timekeeper. Let us know when one minute begins and when it ends."
leo,"You got it.  Gentlemen, start your engines."
leo,Begin!
chester,"Okay, pay attention here, Ted, I ain't got much time. Now I'm gonna make two piles here on the bar. "
norman,You can buy a lot of soup with that pile.
chester, How much is on the bar already? I lost count.
angela,Six hundred.
chester,"Six hundred. Ted, do you know how long it takes the average American to count to six hundred?"
ted,No.
chester," So, are you gonna remember for the next forty years, give or take a decade, how you refused a thousand dollars for one second's worth of work, or how you made a thousand dollars for one second's worth of work?"
leo,Time!
chester,"Well, Ted, what's it gonna be?"
ted,Okay.
ted,"But when it's over, no matter what happens, I get the money?"
chester,"As long as you do your part, you can take the pile, walk out the door, and not say another word."
ted,"Let's do it right now, before I change my mind."
norman,"Here, here."
chester,"Perfect, perfect, perfect, perfect! This is great! This is a moment in time none of us will ever forget."
chester,"Norman, you ready?"
norman,Ready!
chester,"Ted, you ready?"
ted,Ready.
chester,"Okeydoke. Norman, begin."
norman,"My finger, my fucking finger!!"
angela,"You know, I'm gonna call it a night and go back to my room. It's been fun."
angela,"You okay, lady?"
angela,I said -- you looking for someone?
diana, Uhhh... yes... my husband... I think. Have you seen him?
angela,"Lady, I haven't seen anybody."
sigfried,Where the hell have you been?
