Speaker,Dialogue
ted,That's not fair. It just isn't fair.
angela,"Get a fucking grip on yourself. First off, who says he's my husband? And second, we are a long way from fair here, fair is back in jolly old England eatin' crumpets and sipping on tea."
ted,"Tut. Tut. Tut. Not so fast. Well, maybe there are two sides to this thing."
angela,"There are two sides to a plate, still you only eat off of one. Now GET THE GUN!"
ted,So why's he got you tied up?
angela,"I'm a werewolf, Ted! Get the gun!"
angela,"Come on, Ted. Come over here just for a minute. You can do it. Come on, Ted. You look like a good guy."
angela,"That's it, Teddy. You look so much more attractive when you're self- assured."
angela," Quick, he's coming back. Put the gag back in, and remember the gun!"
ted,"Nine thousand, three hundred and twenty-two times, to the best of my estimation."
sigfried,"I was just beginning to think I could trust you, Theodore. Silly me."
ted,I was just trying to help her breathe a little.
sigfried,"Don't let me stop you, Teddy. You don't mind me calling you Teddy, do you?"
ted,That's fine.
sigfried,"I used to have a little bunny rabbit named Teddy, it looked real cute nibbling on Angela's ear. Only problem here is you're no bunny rabbit, Theodore, and it really fuckin' razzes me to picture you doin' it. But don't let me stop you, Teddy... no need to play sneaky-poo."
ted,"Look, man, if this is some kind of Voodoo thing and you want me to have sex with your wife, there is absolutely no way."
sigfried," I said, nibble, asshole! Now!"
ted," Sorry, lady."
sigfried,"What's the matter, no whiz left in the cheese? I'm not cramping your style, am I?"
ted,"Look, I'm not playing this game anymore."
sigfried,"It's almost all over, Theodore, and soon you can go home to Mommy."
ted,"My name is not Theodore, it's TED, TED, TED, T... E... D... TED... NOT TEDDY, NOT THEODORE... TED... Yes, my mother did me the service of naming me Theodore and I haven't a clue as to how you know that because everyone who knows that lives a long way away from here. Do you have any idea what it's like to go to school where all the other kids' parents are in jail doing time for crimes like grand larceny, aggravated assault, burglary and murder, and you get stuck with a mother who names you Theodore and dressed you up in little matching pink outfits with, get this, a little blue bow fucking tie! Well, I'll tell you what happens. Pretty soon Theodore becomes ""Theo the Thumper,"" and when Theo the Thumper gets old enough, he packs his bags and goes thousands of miles away where he can put the whole bloody mess behind him. So, if you don't mind, shoot me now, because no one is going to call me that again. My name is Ted, okay? Got it? TED!"
sigfried,Sigfried.
ted,What?
sigfried,My name is Sigfried.
ted,Sigfried?
sigfried,"Yah, Sigfried."
ted,"Nice to meet you, Sigfried."
sigfried,"Very impressive, Ted. ""Theo the Thumper?""... Ouch. It's a deal, kid. Ted it will be."
ted,Thanks.
ted,"You okay, mister? I'll get help!"
ted," That's the wrong door, sir."
sigfried,Get me the nitro... it's in the bathroom cabinet. Now!
ted,Hi...
ted,"Listen, I'm stuck here in a situation that I can't even begin to explain, but would you be so kind as to get help? Could you call the police, please?"
ted, You okay?
ted,Sigfried?
angela,Where's the fucking nitro?
ted,I couldn't find it!
angela,"You took long enough. Untie me, for Christ's sake, you fucking upset him and he's dying."
ted,I thought you wanted to kill him.
angela,"You'd make a great cop, Theodore."
ted,"I can't handle this alone, I'd better get help."
sigfried,"I tie a pretty good knot, don't I, Ted?"
ted,Thank God you're okay...
sigfried,Never felt better.
angela,You bastard!
sigfried," Come on, honey, don't get mad. It was just a little test, and I'm glad I did it because now I'll know forever that you really do love me. Truly and deeply."
angela,"If the simple fact that I didn't want your bloated, dead body lying out on the floor is love, then no wonder we find ourselves as we are at this very fucking moment."
sigfried,"Oh, no. I heard you and there was genuine care in that voice. Can't be denied. Can it, Ted?"
ted,"I think you're right and, if you just keep this kind of open dialogue going, you'll go a long way to resolving this misunderstanding."
ted, You'd be surprised what happens when people just listen to each other without succumbing to all that pain and anger.
angela,"You heard shit, monkey boy. Easy for you to say after you fuck another man's wife. You should at least have the guts to stand by your convictions."
ted,"That's a lie, Sigfried. I swear to God."
angela,"When I think of all the times you were inside me promising me a better life, it makes me want to puke."
ted,Why are you doing this? What have I ever done to you people?
angela,"What didn't you do, stick man? Unfortunately, you don't have the balls to back up the actions of your huge cock."
sigfried, He's got a huge cock?
ted,"She's lying again, mister. It's not that big."
sigfried,Show it to me.
ted,"Come on, man, she's lying. Can't you see she's fucking with you?"
angela,"Put it this way, God made up for what he did to Gumby with Ted here."
sigfried,Show it to me.
angela,"Show him your cock, Theodore."
sigfried,"Stop talking about his cock, will you?!"
angela,"It's hard to stop talking about something so huge. I could go on and on about his cock, bone, nob, bishop, wang, thang, hotrod. Hump mobile, Oscar, dong, dagger, banana, cucumber, salami. Sausage, kielbasa, schlong, dink, tool, Big Ben, Mister Happy, prick, disk, pecker, peter, pee-pee, wee-wee, weiner, pisser, pistol, joint, hose, horn, middle-leg, third- leg, meat, stick, joystick, dipstick."
angela," Junior, the little head, little guy, Rumple Foreskin, Tootsie Roll. Snake, one-eyed monster, one-eyed wonder, shaft, sword, meat whistle, skin flute, love muscle, Roto-Rooter, instrument, banger, rammer, ramrod, cherrypicker, log, pole."
sigfried,"Please, don't leave me. I'll call you Ted from now on."
ted,"It's not me, mister, I swear."
sigfried,"Personally, I don't give a fuck, Ted, it's just I don't want to be alone right now. I'm feeling a little vulnerable."
sigfried," No guns, okay? Just you and me, Ted. You know my father used to say that forgiveness is the only thing that evil can't sink its teeth into."
ted,That's beautiful.
sigfried,"Kind of nice down here on the floor, isn't it, Ted?"
ted,"Yes, actually."
sigfried,"Things take on a whole new perspective... You'd like my trust, wouldn't you, Ted?"
ted,Yes I would.
sigfried,I just got one thing to ask you and I'll let you go.
ted,Okay. Okay.
sigfried,Tell me straight now.
ted,What?
sigfried,What was it like?
ted,What was what like?
sigfried,"You know, you and her."
ted,"Oh, for fuck sake, Sigfried, what do you want me to say?"
sigfried,"Either way you're fucked, right? You ever gonna see her again, Theodore?"
ted,"If I ever saw her again, I'd run the other way."
sigfried,Promise?
ted,I promise.
sigfried,"You're lying, but I can respect that, Ted. If you told me, it would no longer be a secret, and secrets have a power, kid. You open that box and they disappear forever. A bad secret will rip you apart, but the good one are all you got. In the end, when all the people you knew are dead and gone, all you'll have left are you secrets. And when you die, the box is open and it all blows away -- dust to dust -- all the anger, jealousy, desire and love just blow away."
sigfried," So you know what I say, let's call it a truce, kiddo."
sigfried," I'm a man of love, Theodore. Love is all I live for."
ted,I can see that.
sigfried,Maybe to a fault.
ted,Don't beat yourself up over it.
sigfried,"That's nice of you to say, Ted, but I probably should make a clean break of it, cut her loose and get my own place. I just can't imagine living without her. Do you think I should seek professional help?"
ted,"It's not for everyone, but maybe in your case it could help."
sigfried,You ever been out on the ocean at night?
sigfried," I have... scary as a motherfucker, all that darkness around you. It's like a big black carpet rolled out as far as the eye can see. Sometimes, if you're lucky, you'll see a light. It could be as small as a little spark, but it will cut a path straight through all that blackness, straight to you. It could be another boat, or some distant fire on an island, but that light will shed a shining path of diamonds cutting through mile after mile of darkness to lie at your feet. That's love, Ted, it's like a path of light in an ocean of darkness."
angela, You'd better go check to see if I killed anybody downstairs.
ted,You people gonna be okay?
angela,"We're fine, Ted."
ted,Would you like me to...?
angela,"Another time, Ted."
young guy,"Happy New Year, buddy."
ted,Happy New Year.
young guy,"I was just in room 404, what a party! You know where room 409 is at?"
ted,Beats me. It's somewhere around here.
ted," Hey, what's your name?"
room 716,"""THE MISBEHAVERS"""
ted,Front desk.
man,Bottle of Moet et Chandon. Fast.
man,Give me that...
man,There... see? You look cool with your hair up like this. Like me...
man,"Not down and to the side, all stupid like your mom likes to comb it."
man,You've got your mother's hair.
man,I can't do anything with it.
man,There. Go.
wife, There. Go.
wife," So, are we gonna have fun tonight?"
wife,I didn't think so.
man,Hey.
man, Let's just leave the kids here.
wife,Here in the room? By themselves?
man,No... with the television.
man,"You want to have fun tonight, don't you?"
wife,Yes.
man,They'll be fine.
man,Hey.
man,You guys are going to stay here and watch TV.
man,I want you to be in bed asleep before twelve. Your mother and I will be back later on.
man,Okay?
man,Don't misbehave.
sarah,Why did we have to get all dressed up if we weren't going with them?
sarah,What are you doing?
juancho,"Escaping. Stinks in here, anyway."
man, What did I say?
man,Behave.
juancho,"Yes, Papa."
ted,"The champagne you ordered, sir."
man,No time for this. Leave it on ice.
wife,But I want some now...
man,"There'll be plenty for you and the party, baby, you can bomb yourself all you want at the party."
wife,What a waste.
man, Hey.
man,You want five hundred bucks?
ted,Sure!
man,How about three?
ted,Three hundred?
man,Yeah.
ted,Three's good.
man,My children are staying here tonight watching TV. I want you to check up on them every thirty minutes.
ted,Check up on 'em?
man,"Make sure they're all right, make sure they're fed, make sure they go to bed."
ted,We can call out and hire a babysitter.
man,I don't trust babysitters. My children are safer alone than with some fucked- up pedophile babysitter I don't know from the man in the fucking moon.
wife,What about him? What makes you think you can trust him?
man,Tell me that's not a face you can trust.
ted,"Look, sir, I'd like to help you out, but I really can't. I'm all alone here tonight."
man,One hundred... two hundred... three hundred...
ted,I thought you said five hundred.
man,I said three hundred.
ted,"No, you distinctly said five hundred."
man,You calling me a liar?
ted,"No, I'm not saying you're lying. I'm saying you accidentally forgot that what you first said was five hundred."
man,"I don't do anything accidentally, jerk. I might've first said five hundred, but what I last said was three hundred, and what you say last is what counts."
ted,"Well then, if you say five hundred one last time, we got a deal."
man,"You fuckin' with me, Pendejo?"
ted,"No, not at all. It's New Year's Eve and I'm here alone. If there was somebody else here, no problem, but I'm by myself. And looking after your kids is a pain in the ass I don't need --"
man,You callin' my kids a pain in the ass?
ted,"-- No, they're not a pain in the ass, it's the situation that's a pain in the ass."
man,"No, you were right the first time. You win, tough guy, five hundred."
wife, You kids are getting expensive.
man, What's your name? Ted?
ted,Yeah. It's Ted.
man," His name is Ted. If you need anything, dial 0 and ask for Ted."
man," If something happens to my children, I wouldn't want to be you."
wife,Make sure they're in bed before midnight.
ted, Before midnight? Then should I wake them up for the countdown to the New Year?
wife,No...
man,Don't misbehave.
ted,Okay. These are the rules. Don't break the rules and I won't break your necks.
ted, I always wanted to say that. Someone said that to me when I was a kid.
ted,Except they were joking. I'm not.
ted,"The rules are simple. Don't do anything you wouldn't do if your parents were here. If there's an emergency, call me on the phone, like your dad said."
sarah,That's not what he said.
sarah,He said to call if we need anything.
ted,"Well, I've got a lot of work to do and I can't have you calling me every time you want a drink of water, so please limit your calls to emergencies only."
sarah,We paid you five hundred dollars. We'll call you if we need anything. You don't want to upset my dad.
ted,"Okay. Please. Try to call only when necessary. Watch TV, and if you're good, I'll bring up some milk and cookies. Bye."
sarah,Your feet stink.
juancho,They don't stink.
juancho,Check it out. T & A.
sarah,Change it. You're not supposed to watch this.
juancho,We're supposed to watch TV.
sarah,Not this kind of TV. Change it.
ted,Front desk.
sarah,"Ted? Hi. It's me, Sarah. You're our sitter for tonight."
ted,"Oh, Jesus, what did I tell you? I said if you don't bother me, you'll get milk and cookies. Now, do you want them or do you not?"
sarah,I want you to turn off the Nudie station in our room.
ted, I can't turn on an adult station without permission from your parents.
sarah,"No.  Not turn it on, turn it off. It's already on."
ted,That's not what the machine tells me.
sarah,"Well, stop listening to the machine and listen to me. There's naked ladies dancing on my TV and I want 'em off."
ted,"If you're good, you'll get milk and cookies, so leave me alone, please. I'll be up later to put you both to sleep."
sarah,"Change the channel, now!"
juancho,"Man, you're the one with the stinky feet."
sarah,They don't stink.
juancho,"Yeah, they do."
sarah,"Here, smell for yourself."
sarah,Go ahead.
juancho," Hey, get a bottle opener!"
sarah,Don't shake it!  Ted? Hi. It's me. Sarah.
ted,Yeah. Who died? No one? Then don't call me.
sarah,I thought I'd tell you that your cleaning ladies are doing a bum job. There's all kinds of leftover stuff around here.
sarah,"Needles and things. We're not supposed to have needles here, are we? I mean, they don't come with the room, do they? Send someone up here to clean this place up right."
sarah," I gotta go. My brother just exploded the champagne all over the room. Oh, and bring us a couple of toothbrushes. There's a card in the bathroom that says you'll bring free toothbrushes if we ask for them."
sarah,"I'm calling another room, give me three numbers."
sarah,"Hello? Hi. You don't know me, and I don't know you, but... do you have any needles? We've got needles here and I was wondering if they come with the room or not. Don't have any? Thanks. Just checking."
sarah," The center is the bull's eye, 100 points, this one's 10 points, this one's 20 points."
sarah,"Hey, wait a minute. Let me get out of the way!"
ted,"I brought you some milk and cookies. If you want some you have to eat them now, because you're going to sleep."
sarah,We're going to sleep now?
ted,"Your parents said put you to bed before midnight. Well, it's before midnight. Maybe that way you'll leave me alone."
sarah,Those aren't milk and cookies.
ted,"We were out of cookies, so I brought you milk and Saltines. Don't complain! Now hurry up and eat. You're going to bed right now."
juancho,These are old.
sarah,They're stale.
ted, Dip 'em in the milk! The milk will make them soft.
ted,"No crackers? Okay, fine. Sleepy time. Now, I don't want you guys wandering around, so if you need to go to the restroom, go now."
juancho,What about our pajamas?
ted,"You wanna look nice in case there's an earthquake, don'tcha?"
ted,Okay. Then stay in those clothes.
sarah,What's that?
ted,"Oh, this is just some Mentholatum ointment. Come on, under the covers. Close your eyes and I'll tell you a story."
ted,"Your dad says he doesn't trust babysitters. I don't blame him. You know what my babysitter did to me once?  I never told my parents, either."
ted,"I hated going to sleep. You know, it's nighttime and you wanna run around and act crazy. So what my babysitter did to make sure I'd go to sleep and not be tempted to get up, was, she'd take some of this vapor rub stuff... Can you smell this?"
ted,"Well, she'd just dab a little of this over each eyelid, so that I would be sure and keep my eyes closed all night."
ted,"There. Now you've got some, too! Don't open your eyes or it'll burrrn, burn, burn. The smell helps clear your sinuses too, so it's doing double duty."
juancho,What happens when it's morning?
ted,"If you keep your eyes closed all night, it will wear off by morning. But DON'T OPEN YOUR EYES BEFORE THAT..."
sarah,Did you ever open your eyes?
ted,Yes... I did.
ted,And now look at me.
children, We can't.
ted,Good. You'll do just fine. Sleep well and I won't tell your parents about the champagne.
juancho,Are you watching TV?
sarah,"Yep. If you wanna watch too, you have to go wash your face."
sarah,Be careful...
sarah,Ted!
ted,"What do you want now, for Christ's sake! Who died?"
sarah," I don't know, but she's in my bed!"
ted,What?
sarah,There's a dead body in my bed!
ted,That's just your brother. Sound asleep.
sarah,"No, there's a woman's dead body inside the bed, in the mattress."
ted,You saw the body?
sarah,Yes!
ted,Impossible. You've got ointment on your eyes! You can't see shit! Now go to sleep!
ted,"Godammit, go to sleep!"
sarah, I washed it off...
ted,You washed off the ointment?
sarah," Yeah, didn't you ever think to do that?"
sarah," You never tried it, did you? Then you agree I'm smarter than you..."
ted,All right. Now you listen to me...
sarah,"Get your ass up here and call the police, because there's a dead body in my bed and it smells like shit and it looks even worse, and if you don't help us, my dad is gonna lay you down right next to her, I swear to fucking God!"
juancho,"Go, sis."
ted," I'm coming up and if there isn't a dead body by the time I get there, I'll make one myself. You!"
ted,Oh shit!
ted,What the fuck is going on??!!
ted,Your parents are on their way up and I'm not taking responsibility for this mess!
sarah,Check under the mattress!
ted,For what?
sarah," For the body, can't you smell it?"
ted,It's your feet!
ted, Jesus fucking Christ! What the fuck is this?
ted," Hello, Police, this is the Mon Signor Hotel, get someone up here right fucking now, there's a DEAD WHORE stuffed under the mattress!"
sarah,Don't call her that...
ted," I'm dead fucking serious, there's a dead fucking Whore stuffed in the bedsprings of the fucking bed!"
sarah,Stop calling her that!!
ted,FUCK!!
ted,Jesus!!
man,Did they misbehave?
guinness girl,Happy New Year!
ted,Let me speak to Betty.
guinness girl,"Party's over, she probably went home."
ted,She lives there.
guinness girl,"Oh, well, I haven't seen 'em in a while."
ted,Do you even know who I'm talking about?
guinness girl,"Yeah... yeah... yeah... I know 'em, I know Eddy."
ted,"Betty, not Eddy."
guinness girl,Yeah... yeah... I know Betty too... Tall...
ted,"No, not particularly. She's got curly red hair."
guinness girl,"No, no, no, no, no, I know, I know. Japanese girl."
ted,She's not Japanese! I just said she had red hair.
guinness girl,Yeah... yeah... yeah... I know her.
ted,"Well, then get her on the phone, it's an emergency."
guinness girl,Who -- who should I say's calling?
ted,"Tell 'em Teddy from work's on the phone, and it's a major fuckin' emergency."
guinness girl,"Gotcha, Betty from work."
ted,"Not Betty from work, I'm calling Betty! I'm Teddy. Just say Ted."
guinness girl,"Hi, Ted, I'm Margaret. You sound down. Has this not been the happiest of New Year's?"
ted," No Margaret, this hasn't been my best New Year. This year's starting off pretty badly."
margaret,"Awww, how come?"
ted,"Well, Betty -- the chick whose house you're at, even though you don't know her -- leaves me here all by myself on New Year's Eve. And first thing right off the bat, I'm fucked by a coven of witches."
margaret,An oven full of witches fucked you? Is that like at the circus when they stick all those clowns in an itty- bitty car?
ted,"A coven. A coven of witches. Well, one witch in particular."
margaret,"Was she an old hag with a mole, with hair growing out of it?"
ted,"No-no-no, she was... quite beautiful."
margaret,Ted?
ted,Yes.
margaret,What's the problem?
ted,"Well, admittedly, that was the best part of the night. It was pretty fuckin' cool, actually. But it was still an unnerving way to start off the night."
margaret,Sounds to me like a pretty great way to start off the night.
ted,"Okay, let's just skip over the witches."
margaret,-- Skipping over the witches.
ted,"So, later, in another room, some crazy sucking maniac sticks a gun in my face and forces me to play out some psychosexual drama with his wife."
margaret,He made you have psycho sex with his wife?
ted,"No, he didn't make me fuck his wife, he thought I'd fucked his wife! He held me at gunpoint with a loaded gun!"
margaret,What kinda gun?
ted,"I don't know, I'm not a gun guy. It was big."
margaret,Like Dirty Harry's gun.
ted,"Yeah, something like that."
margaret,Did it have a real long barrel or a short barrel?
ted,What difference does it make?
margaret,"Well, for one thing it's the difference between a .44 Magnum and"
ted,"Who cares if it was a .44 or a .392, it was a fuckin' loaded gun, pointed at my fuckin' head!"
margaret,"You wanna skip over this part, too?"
ted,I want you to get Betty on the phone!
margaret,Hold on.  What's her name again?
ted,Betty.
margaret,Betty!
betty,"Yeah, whatcha screamin' about?"
margaret,You're Betty?
betty,"Yeah, I'm Betty, it's my fuckin' place, who the fuck are you?"
margaret,I'm Margaret  And this is Ted.
betty,"Ted, what's the problem?"
ted,"What's the problem? I don't got a problem, I got fuckin' problems! Wanna hear?"
betty, Sure.
ted,"Well, most recently, there's room 716. There's a scary Mexican gangster dude pokin' his finger in my chest. There's his hooligan kids snapping their fingers at me. There's the putrid rotting corpse of a dead whore stuffed in the springs of a bed. There're rooms blazing afire... There's a needle from God knows where stuck in my leg, infecting me with God knows what, and finally, there's me walking out the fuckin' door right now! Buenas noches."
betty, Is that the penthouse?
ted,Yeah.
betty,"That's the Chester Rush party, they want something."
ted,"Yeah, well, tough titty. They're just gonna have to wait, 'cause I'm out the door."
betty," Now, Ted, wait a minute. I know you're freaked, I know you're stressed. You've had a real bad night --"
ted,"Yes, Betty, I've had-a-real-bad-night --"
betty,-- You say there's a dead body in a room?
ted,"Yes, I did."
betty,"No problem, this is a hotel, we've had dead bodies before, it's just the price of doing business. You said the hotel was on fire. Is it still on fire?"
ted,"No, it's out."
betty,"Good, sprinkler system worked like a charm. Now, you wanna leave, you've had enough. Perfectly understandable. I'll take care of everything else. The only thing I ask is that you take care of Chester Rush. Then you can leave."
ted,"Now, look --"
betty,"Ted, he's a very important guest of this hotel. In fact, he is the most important guest at the hotel. The Mon Signor used to be a haven for movie stars. Through the thirties and forties, and the first half of the fifties, more movie stars -- if you break it down on a night-by-night basis -- stayed at the Mon Signor than any other hotel in Hollywood. Now, we had some hard time in the eighties, even though we were the official hotel of Cannon Pictures, but we're coming back strong in the nineties. And a movie star clientele is important to that comeback. If we can keep stars of his magnitude happy, we're on our way. So, Ted, just take care of him, then you can leave."
ted,"Look, I don't feel like --"
betty,"He probably just wants some champagne! You can do that, can't you? Please just take care of him, the entire staff of the Mon Signor is begging you!"
ted,Okay. But get your ass here pronto.
betty,"You're a good man, Ted. Thanks."
ted,"Hello, Mr. Rush. Sorry for the delay. How can I help you?"
the penthouse,"""THE MAN FROM HOLLYWOOD"""
angela,"Hi, Theodore."
ted,What the hell are you doing here?
angela,Having a drink.
ted,Is that crazy husband of yours in there?
angela,"Are you kidding, he'll be asleep till Christmas."
chester," Entrez, entrez, come in, come in."
ted," Hi, sorry I took so long, but I got everything you asked for --"
chester,"-- Not a problem, my friend Mr. Bellboy."
angela, His name's Theodore.
ted,"Actually, it's not Theodore,  It's Ted."
chester,"So, Ted the Bellboy, as I was saying -- would you care for some champagne? That's not what I was saying, but would you care for some champagne?"
ted,"No, thank you."
chester,"Ya sure? Cristal. It's the best. I never liked champagne before I had Cristal, now I love it."
ted,"Okay, yeah, sure."
chester,"-- As I was saying, Ted, don't worry about being late. For our purposes, promptness is far behind thoroughness."
chester,Chin-chin.
chester,"Whadya say, Ted?"
ted,Thank you?
chester,"No, not thank you. Whadya say about the tasty beverage?"
ted,It's good.
chester,"Fuckin' good, Ted. It's fuckin' good. Let's try it again, shall we? So, Ted, whadya think about the beverage."
ted,It's fuckin' good.
chester,"You bet your sweet bippy, Ted. It's fuckin' Cristal, everything else is piss."
norman,Bellboy! Bellboy! Bellboy!
