Speaker,Dialogue
harry,Will you marry me?
harry,"It's not too late to keep going, up to Vancouver? Be the smartest thing."
frances,"Thanks, Harry, really, but... I can't explain it. She's my mother. She's just... I can't give up on her that easy."
harry,You give up on her?
frances,"Yeah. It's just... something I gotta do, I guess."
harry," Frances, You're crazy."
frances, I know. Don't tell anyone.
harry,Anyway... if you need me...
frances," I got your number, Mister Man."
lillian," Welcome home, little sister."
frances,"Well, who have we here...?"
lillian," Frances, you remember my lawyer, Alma Styles?"
styles,"Hello, Frances. You seem to be having quite a time of it."
lillian,I called Alma because I think we'll need...
styles,"Frances, the doctors at Meadow Wood have petitioned the court for your return. Your mother has asked me to intervene so you can stay here."
lillian,I swear I didn't know what they were doing to you. I wouldn't have let them...
frances,"It's okay, Mama. It's okay."
styles,"You realize, of course, your mother is now your legal guardian. In the eyes of the law, you no longer have any rights as an adult. You're going to have to hold your tongue and be selective about whom you mix with. That man who drove you here, for instance --"
frances,You leave him out of this!
lillian,"Frances, please don't..."
styles,Never mind. We won't have to worry about him much longer.
fbi man," How ya doin', Al?"
harry,You got the wrong guy. Name's Slocum.
fbi man,"No, it ain't. And it ain't Harry York, neither."
harry,"Look, I'm tellin' you..."
fbi man,"I'd give you till ten, Al, but we ain't got the time."
hillier,"Alvin Hanson, a.k.a. Ronald Burns, Thomas Slocum, Harry York... Mr. Hanson, this warrant has been outstanding for many years. Normally that circumstance would prompt me toward leniency, but the crime you committed -- inciting to riot -- and the cause you sought to promote -- a worker's rebellion -- are such anathemas to this court that I feel compelled to mete out the full sentence. I only wish it were longer.  Six months in the state penitentiary."
lillian,"Frances, play 'Flow Gently Sweet Afton'."
frances,"Oh Mama, I'm so... tired of that song."
lillian,Please. I want you to. It would make me so happy.
lillian,"It's just a flow gently sweet Afton day. Life has been so good to me. Why, I have just about everything one could wish... but I still have so many blank pages in my scrapbook."
frances,I think I need a little air.
lillian,What's wrong?
frances,Nothing. I think I'll just go out for awhile.
lillian,Where are you going?
frances,"For a walk, Mama. Just a walk."
lillian,How long will you be?
frances,Not long.
lillian, I'll have lunch ready by one.
frances,I'll be back.
lillian,At one. Promise?
frances,Sure.
lillian,Say you promise.
frances,"I promise I'll... I promise, Mama."
lillian,"You know, the surest way to lose an appetite, is to drink, little sister."
frances," Yes, Mama."
lillian,"I don't want you drinking, Frances."
frances,"Yes, Mama."
frances,...So what do you think?
ernest,"I don't know, honey. Your mother has such big plans for you."
frances,"I know that, Dad, but --"
ernest,"What you have to understand, Francie, is that she... well... she wanted so much for herself too, and for me, and she never really got to... The only time I ever saw her happy was if her name was in the papers... but she could have been... if times were different she could have been a politician or... I don't know."
frances,"But Dad, I'm asking about me. What do you think I should do?"
ernest," Well, Francie, sometimes after you get your hands on something you want, it just doesn't look the same. Then you have to be real smart to know if you should hold onto it because it's all you've got... or just let it go. This is the way of things, but I guess you already know that."
frances,"Dad... whatever I decide, will it be okay with you?"
ernest,Always. Always.
ernest,"I'm sorry, I... I don't have a desk in my room, and... "
frances,"I don't care, Dad. I love you."
ernest,"I love you too, Francie."
lillian," Oh Frances, do I have news for you! Guess who --"
frances," Wait, Mama, wait. I have something to tell you. I've decided... well... I'm not going to make movies anymore. I thought that's what I wanted, and I went after it with all my soul, the way you taught me, but I was miserable, Mama, and it nearly killed me. So now... now it's over. I want a different kind of life, something... simple. I want to live someplace quiet and peaceful... in the country maybe, and I'll have dogs and cats -- I feel so light suddenly, so clear for the first time in... It's going to be okay, Mama, I know it. And I love you."
lillian, Don't... talk crazy.
frances,Mama...?
lillian," They want you back! Your agent called today! Don't you understand? He's sending the scripts. He wants to fly up here in a week with the publicity people! Frances, you can't do this to your fans! Why, they've been praying for you all through this nightmare. You can't turn your back on them now! Look at this fan mail I've been answering!"
frances,Haven't you heard what I said?
lillian,"I told him to come up! I told him you wanted to show them all that there's nothing wrong with you any more, that you're completely cured!"
frances,I'm not cured. I was never sick! They had no business putting me in there! My only responsibility is to myself now!
lillian,"You... you selfish, selfish child. At least talk to him, hear what he has to say."
frances,No!
lillian,"You want to throw it all away, is that it? You had everything, little sister. Beauty... a brilliant career... a wonderful husband. You were a movie star!"
frances,"Mama, shut up!"
lillian,And now you're throwing everything away? You're gonna be a nobody! Nobody! You know what that's like?!
frances," You... You'd send me back, wouldn't you? You would."
lillian,Where are you going?
frances,I'm going out!
lillian,You're not going anywhere!
frances,"Yes, I am, and you can't stop me! You can't tell me what to do, mother. I'm a grown woman, and I can decide about my own life."
lillian,Frances!
frances,Don't you try and stop me. Don't you dare!
frances,"If you follow me, Mama, I swear I'll fucking kill you!"
lillian,"That's it. You've done it now, little sister."
lillian,"All my life, I've tried to live up to my parents' example. To have the independence of mind and fortitude of spirit that have made this country great. I taught that to Frances: Speak out. Aspire. Make something of yourself, something -- "
alma styles,"Frances has always been a battleground, Lillian."
doyle,The point is: it's your opinion that Frances is getting steadily worse?
lillian,Well... yes.
doyle,And you feel you're unable to control her any longer?
lillian,"No... I mean, yes, Doctor."
doyle,And the only course open to you is to commit your daughter for a period of time to a mental institution?
lillian,"Well, Alma told me that..."
lillian,...Yes.
doyle, I believe that's all I need to know about Miss Farmer.
hillier,I think in all future documents she should be referred to as Mrs. R. H. Richardson.
lillian,Her married name?
hillier,Yes. It's less recognizable. I'm sure you'd prefer to keep unpleasant publicity to a minimum.
lillian,...Oh yes.
hillier,Now. Can you tell us where we might find Frances?
frances,"...Looking for a drink, and the town is deserted, he can't understand it. Finally he finds a bar, goes in -- the place is empty, bartender's closing up. Salesman says, 'Gimme a martini.' Bartender's real nervous, he says, 'No, no, no, I gotta close. Big Otis is coming to town.'"
frances,"Salesman says, 'I don't care. I gotta have a martini.' So the bartender fixes him a martini real fast, grabs his money, and runs out the back. Salesman sits there sipping his martini,... he's got the bar all to himself... Then he hears it. This big roaring in the street. RRRAAAAAAA!!!  Gigantic footsteps... coming closer. Stopping."
frances,"Enormous hands reach in, grab the swinging doors and rip them off their hinges. This huge man stomps in. Picks up a chair and hurls it over the bar, smashing the mirror -- whiskey and glass flying everywhere."
frances,"He turns to the salesman: 'What the hell're you doing in here!' Salesman says, 'I'm just drinking a martini.' 'Oh yeah?' the guy says. 'Well you better get outa here! Big Otis is coming to town!'"
doyle,"...From her history, it's apparent the patient suffers from a paranoid reaction with pronounced egotism. Her violent responses have recently included aggression against her mother. In view of the deep-seated nature of her ailments and her failure to respond satisfactorily to insulin shock, it is my opinion she may ultimately require permanent institutional care."
hillier," Counsellor, as Guardian ad litem for Mrs. Richardson, do you waive jury trial?"
styles,"Yes, your Honor."
hillier,"Having heard the testimony of a legally qualified and reputable physician... and being further satisfied of the truth of all matters set forth in the certificates of said physician, I do hereby order that the said Mrs. R. H. Richardson, an insane person, be confined to the Western State Hospital for the Insane at Steilacoom."
hillier,So ordered! Are the gentlemen from Steilacoom present?
student,Can I push the button on this one?
frances," Doctor, it may sound odd, but I believe I've profited from my stay here. It's just what I've needed, to get away like this. But I'm recuperated now. I've had lots of time to think and I've made a few decisions about my life. I'm ready to get on with it."
doyle,I know you believe that.
frances,...Don't you?
doyle,"I'm afraid not. You see, we observe things that you're unaware of: signs, indicators. Your problem cuts very deep, Frances, and we have to get at that deeper stuff so that when you do get out, you'll really feel secure. Does that make sense?"
frances,"No. Cut this runaround, Doctor. I know better."
doyle," Listen to yourself, Frances. The resistance, the anger in your voice."
frances," You... I'm sorry, forgive me. Doctor, tell me honestly, what do I have to do to get out of here?"
doyle,"Be patient, that's all. Take an interest in your treatment and don't dwell on your resentments. You'll be yourself again, I assure you."
frances,...I see.
doyle,We'll talk more about this. I'll see you later.
frances,"One question. If I'm not myself now, just who do you think I am?"
doyle,We'll talk.
frances,What the hell!
chant,Come and get it! Come and get it! Come and get it!
chant,We want Frances! We want Frances!
frances,Come and get it...
harry, Frances! Frances!
frances,Who?
harry,"Frances, it's me, Harry?"
frances,"...Touch me again and I'll kill you, you pig."
doctor,"Watch out, Harry. Let me look her over."
harry,"Oh, God! Let's get her out of here tonight, right now! Let's take her with us!"
doctor,"The hearing's tomorrow. If she gets out legally, they can't come after her."
harry,Look at her! She'll never pass that sanity test tomorrow...
doctor,"I'm taking care of that, Harry. Just hold her.  Reserpine. I guarantee you this'll clear her head. She'll wake up feeling smart and sailright through the hearing."
doctor,Yeah... she knows about these. Shut her up.
harry," You'll be okay, honey. He's just givin' you something to make you think, so that tomorrow you can tell 'em what they want to hear, okay? Tell 'em you were crazy as a loon and they cured you and you're grateful."
doctor,This stuff takes pretty quick. Let's go.
frances, Please! Take me!
doctor, Let's get out of here! I'll lose my job!
harry,"Frances, we gotta do it this way. Just remember tomorrow, remember what I told you. What're you gonna tell 'em?"
frances, I'm grateful... grateful.
doctor, Harry!
harry,I gotta go now.
frances,"Harry, please!"
doctor,"We're all square now, Harry. Right?"
harry,"All square, Doc."
doctor,Good. 'Cause I don't want to see you again.
frances,"I love you, Harry. I love you."
harry,"I love you too, Frances."
frances,I realize now that I was a very sick woman.
frances,I couldn't relate to others in a normal way.
one patient, She's... not... normal...!
frances,"And I was not taking responsibility for my actions. But now, thanks to your treatment, I feel ready to face myself, ready to resume the career which I so single-handedly shattered. I only hope... I hope I can make you all proud of me. Thank you. Thank you so much."
lillian,"Of course, she hasn't anything definite in mind."
frances,"No. No, it all depends on what offers I get."
reporter,"Who did your hair, Frances?"
frances,"Well, I like to try different styles. Sometimes if you're old-fashioned enough, you find you're modern. Right, Mama?"
reporter,"What do you think of all this, Mrs. Farmer?"
lillian,It's a miracle. Just a miracle.
lillian,"Oh, just leave those things for now."
frances,"No, Mama, I'll take care of it. I'll wash them in the morning."
lillian,"You know, little sister, I never resented you for refusing to see me in the... the hospital. I knew you had to manage on your own before you could come back."
frances,"Thank you for understanding, Mama."
lillian,"Little sister, I don't want you to feel any rush to get back to work. I want you to rest... for a while anyway."
frances,"I will, I promise."
lillian,"Good night, dear."
harry,Where to?
frances,Oh Harry...
harry,"This is it, kid. This is our chance. When you got a chance, you better take it."
frances,Yeah. I don't know.
harry,You don't need to screw around anymore. You don't need Dwayne Steele or Odets or your mother. You need me.
frances,"I know, but... There were so many people in there, Harry. Every time I turned around someone was pressing against me... watching, looking over my shoulder, touching me, grabbing, sticking things into me. When I feel somebody near me now... anybody... my skin starts to crawl."
frances,"You can't change the things they did to me, Harry. Only I can do that... by myself."
harry,"Been a lot of years, you know. A long time waiting. For what? End up feeling like a sap."
frances,"Oh please, Harry... don't even think it. You're the only person who ever... It's just... Can't you wait for me?"
harry,I don't know.
frances," Yes you do. If you love me you can wait, right? A month, six months, whatever it takes."
harry,Right. Except... time has a way of --
frances,"No, Harry, it's not time, it's us. You and me. And I'm telling you now that I'll come to you, okay? I'll find you. I will."
harry," I hope so, Frances."
frances, I'm sorry.
harry,"I'll be seeing you, kid."
hitchhiker,Pretty morning.
frances, It's always beautiful at this time. Peaceful...
hitchhiker,And no people.
frances,Yes.
hitchhiker,Where you goin'?
frances,"Wherever they're going, I'm going."
hitchhiker,"Yeah, I know what that's like... Where you been?"
frances,"Well, I was picking fruit with some migrant workers until..."
hitchhiker,What's the matter?
hitchhiker,"They're looking for you, huh?"
frances,Yeah.
hitchhiker,What'd you do?
frances,"You know, I've never been able to figure that out."
hitchhiker,"I've got a little whiskey here, warm you up."
frances,Thank you.
frances,Wait. Maybe they'll pick you up.
frances,Shit!
hitchhiker,Run!
frances,Dad...? Why don't you stop at a side road and let me out?
ernest,"Francie, you know I can't do that."
frances,Why? It's such a simple thing. You just let me out and I disappear down a road and you never have to see me again.
ernest,"They'll just catch you again, Francie. Besides, your mother will know."
frances,"Dad, here! You don't have to stop, just slow down. You can tell Mama I jumped out. She knows that's the kind of thing I'd do. She won't blame you."
ernest,"But I gave her my word. Besides, she's still your legal guardian. My hands are tied."
frances,"You know where you're taking me. You know what she'll do. Just give me a minute, slow down, give me an instant for once in your life, please?"
ernest,"Please, Francie..."
frances, Daddy!
ernest,"I'll try to protect you, Francie. I will, I'll talk to her. We'll have a real talk."
ernest,Are you... are you hungry?
frances,"I pity us, Dad. I pity us both."
frances, Do I go right away or do I have time to take a bath?
lillian,"I was hoping for a kind word, little sister."
frances,You were hoping for a kind word?! You're my mother! You're supposed to nourish me! Support me!
lillian,I have!
frances,"No! All you've done is try to break my spirit, try to turn me into you! But I'm not you, mother, and I never will be, and thank god for it!  But I've got to tell you, Lillian, that one day before you die, you will realize what you've done and hang your head in shame. In shame!"
lillian,But what -- 
frances,"No! You're not talking now. You listen. You can send me away, Lillian, you can pretend I'm crazy and pretend I'm still your little girl who can't take care of herself, but one thing you can't pretend anymore. You can't pretend I love you because I don't. I can't. Not after what you've done to me. Because you see... I'm still me... I'm trying real hard all this time to be me... and you, 'little sister', you haven't been any help at all.  Okay, boys, I'm ready."
frances,"We shall hear the angels, we shall see the whole sky all diamonds..."
older nurse,I don't know why they even bother. She's had enough of this to knock sense into a bull elephant.
young nurse,Yeah?
older nurse, I checked the files. This one holds the record for shock treatments. Four hundred seventeen and no end in sight.
young nurse, You're kidding.
older nurse," Yeah, well, you know doctors. They sure hate to use that word."
young nurse,What?
older nurse,'Incurable.'
frances," Harry? Oh Harry, I knew you'd come. I love you, Harry. I love... Take me home, Harry."
doyle,"We'll get you home, Frances."
frances,"Thank you, Harry."
lillian,"What was I saying? Oh yes, it was the Communists that did it to Frances."
lillian,They capture the mind by first seducing the heart. I suppose I never taught Frances to close her heart...
reporter,"Uh... excuse us, Mrs. Farmer. We're going to have to... uh..."
third reporter," Yeah, I better pack it in too."
lillian," Pardon? Oh, would you like more lemonade?"
fourth reporter," I think we've had enough. Thank you, Mrs. Farmer. Goodbye."
lillian,"You know, Ernie, I think we should have Frances' room repainted for when she comes home. That'll brighten her day."
edwards,"...Dwayne Steele divorced you, and from this point on, your story takes a darker turn. Shunned by the Hollywood you criticized so harshly, alienated from your family and friends, you turn your back on professional commitments in New York, and alcohol and drugs enter your life. These are sad, desperate times for you."
edwards,"...until finally your mother finds it necessary to commit you to a state mental institution. Were you mentally ill, Frances?"
frances,"...No, Ralph. I don't believe I ever was sick. But when you're treated like a patient long enough, you're apt to act like one..."
edwards,"...and over 200 producers have been invited to watch your appearance here tonight... so who knows, Frances Farmer, anything's possible on your comeback trail!  And since your friends tell me they have to drive you everywhere, look what we've got for you!"
edwards,A brand new 1958 Edsel!
frances,"Thank you, Ralph."
edwards,"Thank you, Frances. And after the show we're hosting a reception for you and your friends at Hollywood's own Roosevelt Hotel!"
edwards,"So, Frances Farmer, this is your life. Good night. God bless you."
woman,"Where shall we drop you, Frances? Home?"
frances," No... no, someone's picking me up."
harry,C'mere. I want to talk to you.
frances," Oh. Why, Harry York. How nice to see you."
harry,"How... how ya doin', Farmer?"
frances,"Fine, thank you. Did you watch the show?"
harry,"Sure I did, that's why I'm here."
frances, How did I look?
harry,"Oh, you...  ...ennh."
frances, Well... you're looking well.
frances,I got a new car. Only it's red. Did you know Mama died?
harry,"Yeah. Yeah, I heard about that."
frances,"Dad, too. I sold the house. I'm a faceless sinner, Harry..."
harry,Why do you say that?
frances,"I'd ask you to take me home, but I'm a faceless sinner.  ...You smell good, Harry. Familiar, you know? I'd ask you to take me home, but..."
harry, Frances!
frances,"Don't get mad at me, Harry. Please. It's just... Some things happen for the best."
frances,"It's going to be slow from now on. Do you know what I mean, Harry?"
harry,I'm not sure.
frances,"Very slow.  But we're not going to stop, are we?"
harry,No.
frances," No, we're not."
frances,"Goodbye, Harry. It was very good to see you again."
harry,Yes. Would you like me to walk a little way with you?
frances,That would be okay.
harry,Just a little way.
