Speaker,Dialogue
clurman,"...Not only an artist, but an instrument of change. We must look to the world around us, not content to observe, but to take an active hand in redressing its wrongs. We will not stand idly by as Fascist bombs obliterate democracy. We contribute our profits, for if fascism is not stopped in Spain, it will spread across Europe, jeopardizing the struggle of civilized man to survive.  The artist, to be vital, must be a soldier too."
frances,"I'm not afraid of struggle, Clifford."
clifford,Yes you are. We all are. The first step is to acknowledge our fear.
clifford,Face it! Confess it! You're weak!
frances,I'm not!
clifford,You're afraid!
frances,I'm not!
clifford,"You don't want to show your whole soul -- ugly, mis-shapen, and pitiful -- you don't want to show it --"
frances," God damn it, Clifford, will you shut up! I tell you, I want to give these things! I want to give them to the audience, and I can give them, I will give them, so shut up!"
clifford,"Good, good. Give them that."
frances,What?
clifford,Madam...?
frances,Thank you.
clifford,"Oh my God! Frances, I'm such a cad. I can't go through with this. My wife is in Europe, but this is her house...  her bedroom. I can't ask you to..."
frances, Oh well. I guess I better leave then.
clifford,"Okay, but come here first."
frances,Huh.
clifford, Come here. I want to show you something.
lawyer,"And on top of her political activities, now she's got a lawyer. She wants out of her contract, Mr. Bebe. She says she's through with motion pictures."
bebe," I'm sure it wasn't me, it wasn't me..."
lawyer,"Excuse me, sir?"
bebe,"I don't know who she fucked to get where she is, but I don't think it was me."
lawyer," Well... you could always dump her, Mr. Bebe. Teach her a lesson. There are a million beautiful girls out there who don't give a damn about politics."
bebe,"That's not the point. Frances Farmer has the world by the tit because of this studio, and now she thinks she can waltz off without a thank you. No. No, that young lady has a contract, and she's going to honor it."
lawyer,"Oh. I mean, good."
bebe,I think it's time to take the gloves off.  Particularly Louella Parsons!
young man,Miss Farmer... I've never done this before... but... I had to tell ya' you're great!
frances,Thank you very much. I'm glad you liked the play.
young man,I'm really sad it's closing. Now what am I gonna do on Tuesday nights?
frances,You can always come see it in London.
young man,Only if you were in it. Are you?
frances,I wouldn't miss it.
young man,"Boy, I'd love to... but I'm going to Hollywood."
frances, Are you an actor?
young man,"Hell yes!... well, okay, I'm still in school. But as soon as I graduate... California, here I come!"
frances, Are you really serious? About acting?
young man,Why... yes.
frances,Then don't go to Hollywood.
young man,Why?
frances,"I'm telling you straight, if you have any serious ambitions, stay clear of the place. It'll crush you."
young man,You sound as if you hate it.
frances,"No, I don't hate it."
young man,Aren't you ever going back?
frances,...Not if I can help it.
young man,Gosh! You'll break a lot of hearts.
frances,They'll mend.
young man, What about your husband?
frances,What?
young man,"Will you be getting back together? When you quit Hollywood, I mean."
frances,What is this?
young man,Is it true you're getting a divorce? Comrade?
frances,"Why, you... you little bastard!"
young man,"Thanks for our chat, Miss Farmer. Be seeing you."
frances,Just one minute...
young man," You're wasting your time, lady. Nothing's off the record with me."
odets,How'd it go?
frances,'But how do I know you love me?'
odets,Your big speech?
frances,"'How do I know it's true? You'll get to be the champ. They'll all want you, all the girls! But I don't care. I've been undersea a long time. When they'd put their hands on me I used to say, ""This isn't it! This isn't what I mean!"" It's been a mysterious world for me! But Joe, I think you're it! I don't know why, I think you're it. Take me home with you.'"
odets, I already have.
frances,How's it sound?
odets,The speech? Real good.
frances,You think I got it?
odets,You got it.
frances,"Yeah. Yeah, tonight I think I got it."
frances,"Hello, Harold."
clurman, Frances.
frances, Where's Clifford?
clurman,He's not here.
frances,Oh.
clurman,Bourbon?
frances,What's up?
clurman,I hear you're meeting with the studio lawyers to get out of your contract.
frances,That's right. I don't want them breathing down my neck while we're in London.
clurman,"Well... well, you see, that's the point. You won't be opening in London."
frances, You don't think I'm good enough?
clurman,"What?! Good Lord no, it's just... It's money. We needed backing and... well, we found it."
frances,Who?
clurman,An actress.
frances,A rich actress.
clurman,Yes. That's the deal. She plays Lorna.
frances," But... but wait a minute. We're supposed to be different, right? Clifford says... This theatre is supposed to be different! And this play... this play is all about what greed and money do to people!"
clurman,"I know, but --"
frances, What does Clifford say?
clurman,Right now we have to be practical.
frances,Does Clifford even know?  I'm gonna tell him. Where is he?
clurman,"He knows, Frances."
clurman, He approved it.
clurman,"I'm very sorry, but... well, Hollywood wants you back, right?"
frances,Prick!
harry,"Of course it can be done, ""Mr. Jones,"" but it's how you do it. There's a way to pay off L.A. cops and a way to get yourself arrested. First you gotta know who to approach --"
frances,"Harry? Harry, where are you?!"
frances,"I called your god-damned office! I want you to kill him, Harry. You'll do that for me, won't you? I loved him, I loved him... that bastard."
harry,"Calm down, Frances."
frances,Two lines! Two fucking lines! 'My wife returns from Europe tomorrow. I can't see you any more.' Just like that!
frances," Harry, I hate being in love. I don't ever want to be in love again. I just hate it!"
harry,"I know, Frances... I know."
director," Good, good. One more time."
frances, For God's sake... why?
director,"Because we want to get it perfect... just the right combination of fury and confusion. You can understand that, can't you, Miss Farmer? We're serious artists here, right? Right."
frances,"Look, Mr. Bebe, you can hold me to my contract, but you can't break me. I'm back, and I'm gonna make the best of it."
bebe, I'd like nothing better.
barnes,Well... come on.
frances,This is a mistake. No. This is a disaster.
barnes,"Come on, it's just what you need! Let everyone see you. Talk to them, live it up!"
frances, But we've been at it since six this morning. At least you could've let me go home and change.
barnes,"Look, Frances, I didn't want this job. Think I'm crazy? But you begged me: improve your image. So please... lemme try, huh?"
frances," Okay, let's go get 'em."
barnes," Here, take a few of these. Studio makes 'em in the basement. They keep the fat off."
frances," So not only am I a troublesome bitch, but I'm fat too?"
barnes,Come on. They make you feel nice and peppy.
barnes,Hi! Bob Barnes! Looks like a swell party!
connie, Frances!
frances," God, who's here?"
connie," The usual vermin, I'm afraid."
frances, Get me a drink.
frances,Hi everybody.
snide voice,"So nice to have you back, Frances."
frances,"Connie, can I use the upstairs bathroom?"
connie,Sure.
frances,Come in.
frances, Hi.
barnes,You wouldn't believe the offers! Just piling in. I mean piling. Some of the best scripts I've read in years!
young reporter, Yes? My employer will be glad to hear that.
barnes,Louella? Is she here?
young reporter,How could you miss her?
barnes,Louella's here and I'm talking to you?
barnes,Frances?  Oh no.
frances,"Refill my drink, will you, Bob?"
barnes, What're you doing?
frances,Putting on my armor.
barnes,"Come on, Frances. Louella Parsons is here. She wants to talk to you, help you out."
frances, Louella... didn't she call me a spoiled little bitch?
barnes,"Come on, she's an important columnist! What's the matter? I thought you wanted these people to forgive you."
frances, 'Forgive'...? For What?
barnes,I'm sorry... that was an unfortunate choice of words.
frances,"You're not kidding.  Get me a refill, Bob. I'll be down in a minute."
frances,Thank you.
young reporter," Gee, awful good to see ya again, Miss Farmer."
young reporter,My employer would like to know something very important: is it true your friend Clifford sleeps in the nude?
frances,You seem like an intelligent young man.
young reporter,Huh?
frances,Can't you find a more dignified way to make a living?
cop,Okay...
cop," Hey, where's the fire, sister?"
frances," In my eyes, officer."
cop,"Cool off, beautiful. Didn't you see the sign says ""Dimout Zone?""  There's a war on, you know?"
frances,Come on. You're seriously trying to tell me the Japs can't find Los Angeles without my headlights?
cop," I didn't make the law, lady. I just enforce it."
frances,"God, you bore me."
frances,Don't touch me!
cop,Hey!
cop," Santa Monica, this is motor six-sixty- six. I got a live one here."
frances,Take a look.
frances, How the hell do you find me anyway?
frances,What's left of my blood.
frances,Help yourself. Everyone else has.
harry,Very tasty.
harry, Nice joint. Can you afford it?
frances,"Nope. The studio pays. Thank you, Harry."
harry,What for?
frances,For not chopping off his head and serving it to me on a platter.
harry,"Well, I would have, you know? I just didn't know how to cook it."
harry,"Six months' probation...? You gotta learn when to do battle, Farmer. You're not going to win many bouts with 200 pound cops."
frances,I took the early rounds.
harry, I'll bet.
frances,"I don't know. It hurts, Harry. Some things, no matter what you do with them, they just hurt."
harry,"So you drink, and you fight with a cop...?"
frances,"Yeah, and you look at people and you wonder who the hell they are, what's going on inside their heads. Sometimes you can hear it, like a buzzing, the things that happen in their heads. And you wonder: does anybody ever love anybody, really?"
harry,Beats me.
frances,I gotta get outta here. I gotta get out of this town.
harry,"Hey look, I got some business down in San Diego. Whattaya say you come with me, stay a few days?"
frances,"No, Harry, I can't -- "
harry,You're coming.
frances,"You know... when I started acting, you know what I wanted?"
frances,"I just wanted to be part of something... one thing, one play or one movie, something that was really fine... memorable. And I could say: I did that, I made something good."
harry,And?
frances,"Well... to get a crack at something good, you gotta earn it, you gotta climb the ladder first. So you do, you work hard, and all these people behind you are pushing you up, shouting you on. And then one day you realize you are, you're at the top... and there's nothing there. And you look behind you and there's no one below. You're just left there all alone... swaying in the god-damned breeze."
harry,"Well, like the man said: ""You can make a fresh start with your last breath."""
frances," Hey, watch it."
sailor, Watch what?
frances,"Get away from me, you foul slime."
sailor,That's no way for a lady to talk.
harry,"Take a walk, pal."
frances,Who said I was a lady?
sailor,Sorry I insulted you... bitch.
harry,Hey!
frances,"Ahhh, go eat a toilet seat."
frances,What happened? Who're you?
man,Who're you?
frances,I live here.
man,"You're Farmer? Oh... Well, look, they took your stuff out. Moved it to some hotel, I think."
frances,What?
man,"I'm preparin' it for the next tenant, he's coming in tomorrow."
frances, I don't believe this. They can't do this to me!
frances," Barnes? It's my diary! They stole my fucking diary! Find it, will you? Find it! God damn it, that's my life!"
director,"Never. Never again. I swear, I swear I will never work with this broad --"
director,You're four hours late! It's insane! It's unprofessional!
frances,I'd say I'm behaving as professionally as anyone else in this town.
director,Where were you?!
frances,"Terribly, terribly sorry; I overslept. What's the name of this fine entertainment we're all so involved in?"
frances," Oh yes. ""No Escape."" That's it. There's no escape."
tora,"It's about time! You're not the star on this show, y'know!"
tora,"Of course, it's not up to me to say anything. I'm just crew... Y'know, you hair's so fine you'll lose it if you're not careful. Wonder you all don't, the things you do to yourselves. In fact, I think you are already... Fact, I think you better --"
frances,That's it! I'm not taking this any more! I quit!
frances,Goodbye!... goodbye!... goodbye!...
frances,Shit.
frances,What the hell's going on here?  Hello?
frances,Hey!
frances,What...? Help!
frances,Don't kill me! Don't kill me!
frances,"Mama, help me, help me, Mama! Don't let them kill me!"
cop,Get your clothes on.
frances," You have no right! You have no fucking right, you bastards! Get the hell out of here --"
cop,"Get your clothes on, lady --"
frances,GET OUT!
cop,You're under arrest.
sergeant,Name?
frances,I don't believe this! You jerks drag me down here in the middle of the night and you don't even know who the hell I am!
sergeant,Age?
frances,Fifteen.
sergeant, Address?
frances,"Just put me down as a avg -- a vagrant vagabond. Come on, this is a joke! Assault and battery? I barely touched that bitch!"
sergeant,Occupation?
frances,Cocksucker.
frances,"Hey! I'd like to leave a wake-up call for say, ten? Hey! I'll have my bread and water in bed!"
photographer,"Hey Frances! Why don't you comb your hair, okay?"
frances,...Take me the way I am.
judge,...Is that not true?
frances, Who's writing this guy's lines?
judge,Answer the question! Have you driven a car since you were placed on probation?
frances,"No, I couldn't get my hands on one."
judge,Have you reported to your Probation Officer as directed?
frances,I never saw him. Why didn't he show up?
judge,Did you expect him to look you up?
frances,"Why, certainly. I wanted to get a peek at his face..."
judge,"You're on your way to a contempt citation, young lady."
frances,"That's fine with me...  Get it? Fine. A fine! Hey c'mon, c'mon, what is this, an audience or a jury?"
judge,"Miss Farmer, is it true you fought with the policeman who arrested you last night?"
frances,Sure it's true. I was fighting for my country as well as myself.
judge,"Miss Farmer, you were advised at the last hearing that if you took one drink of liquor or failed to be a law-abiding citizen --"
frances,"Are you telling me you didn't have a little rum in your pineapple juice this morning? I can smell it from here, Your Honor."
judge,That's enough!
frances,It's the truth! I can smell it from here -- you old hypocrite!
judge,"Miss Farmer! In light of your flagrant disregard for the conditions of your probation, coupled with the unwarranted assault on the Plaintiff here... I am forced to order you to begin serving a sentence of 180 days in the County Jail."
frances,Fine!
judge, You are a deeply troubled young lady... I only hope you change your course before it's too late.
frances, Wait a minute... I haven't got a lawyer...
frances, What I want to know is do I have any civil rights?
frances,I want to make a phone call...
frances,I have a right to make a phone call!
reporter," ""The kleig-lighted road to fame and fortune is strewn with heartbreak and despair. Today film star Frances Farmer, tarnished by alcohol and drugs"" -- 'm I going too fast for ya?"
frances,"They're stealing my civil rights! Help me! I'm being kidnapped! Oh God, help me! Help me!"
frances, Haven't you ever had a broken heart?
reporter,"Oh my God, she's loose!"
reporter,"She's attacking your correspondent! Right here in the Court Building! Good God, this bitch is crazy! Someone stop her!"
frances, Harry!
frances,I have a right! I have a right!
reporter," With what must surely be the final act of madness, the curtain falls on Frances Farmer's once promising career. The crazed blonde who at"
reporter,"Hold it a second, Bub..."
woman,...and we feel that this would be more appropriate.
judge,"...a difficult decision, but, I'm sure, the proper one."
frances,What?
lillian," It's alright now, little sister, everything's going to be just fine."
frances,"Mama, what's..."
lillian,"Shhh, shhh. You're not going to jail, Frances. The Judge has put you under my care. I'll see you get the rest you need."
frances,You're taking me home!
lillian," First things first, little sister. Trust me."
lillian,Why it's beautiful here! What a view!
man,"Good afternoon, Miss Farmer. I'm Dr. Symington."
lillian,"Good afternoon, Doctor."
symington,"I'm very pleased to meet you, Mrs. Farmer. I'm sure we'll have more of a chance to talk later. Right now I think it's important that your daughter have a chance to settle in. Perhaps it would be best if you said your goodbyes here."
lillian,"Oh. Well, I have some background that you should probably know about if you're..."
symington,"I have no doubt, Mrs. Farmer. If you'll speak to the girl at the desk, she'll arrange an appointment."
lillian,"I'll be back real soon, little sister. You be a good girl."
frances, Mama!
frances," ...I want to go home, Mama."
lillian,"You'll see, little sister. Everything will be fine. The doctors know best."
symington,I find these initial meetings to be much easier without the concerned relatives in attendance.
frances,Am I supposed to say 'thank you'?
symington,Thanks are hardly necessary.
frances,"Aw, shucks, ma'am. T'weren't nothin'."
symington,I'm glad to see you haven't lost your sense of humor.
frances,It ain't for lack of trying.
symington,So it seems. May we be serious for a moment?
frances," Why, Doctor! We've only just met!"
symington,"I feel I've known you for a long time... you see, I've followed your career... you're a fascinating case... I'm looking forward to resolving your predicament."
frances,Oh! Are you really?
symington,"Among persons such as yourself, creative people under great stress, erratic behavior is not at all uncommon and certainly nothing to be ashamed of. It's just that the neuroses which fuel your talent can also generate certain character disabilities which... "
frances,"Do you expect me, for one moment, to believe you have greater insight into my personality than I do?"
symington,Please sit down...
frances,"You may discuss my predicament, Doctor. You may discuss it with anyone you like, but not with me. I'm not interested. I can solve my problems without recourse to a veternarian."
symington,I see.
frances,"Besides, I don't want to be what you want to make me."
symington,And what's that?
frances,Normal. Average.
symington,All right. Will you please sit down now?  Symington says.
frances,...Did you really say that?
symington,"Just a little joke, Miss Farmer."
frances,This whole thing is a joke!
symington,"Stay calm, please."
frances,"No, you stay calm, Doctor! But you're finding that difficult, aren't you?  then you'll really get your kicks, won't you, ""Doctor?"""
symington,I'll have someone show you to your room.
frances,"Oh, that's good, very professional. In control. But the tiny beads of sweat on your upper lip give you away."
symington,You really should get some rest now. Nurse will meet you outside. Good day.
symington,Is there something else?
frances,You didn't say 'Symington says'.
symington,Symington says.
lillian,"Not much on hospital corners, are you?"
matron,You Farmer?
frances,So this is the nuthouse...
nurse,Honey... take my word for it. This is a resort.
lillian,Tell them who I am! Tell them who I am!
frances,Are you crazy? Unhand that woman! That's Amelia Earhart!
frances,You've got to tell me what it is!
thin nurse,It's insulin. It throws your body into shock.
lillian,...and here's the one from Duluth. A war widow with five children. She works in a defense plant and she's very worried about you. I answered her that she shouldn't let worry over you affect her vital work; and that you'd be back on the silver screen in no time.
lillian,And here's one from nice Mr. Zeiss. He says that...
frances,Why are these all opened?
lillian,"Well, they needed immediate answers, Frances. It's good manners and good sense. You shouldn't be bothering yourself with these right now."
frances,Then why did you bring them?
lillian,"It's your fan mail, little sister."
frances," You kill me, Mama."
lillian,What?
frances,Go on...
symington,"...I'm sorry to keep you waiting, the staff review ran over. Did you enjoy your mother's visit?"
frances, Yes. It was very good to see her.
symington,Really? Any problems?
frances,Not at all. She brought me my fan mail.  I had no idea there were so many strangers concerned about me. But I guess that's the best thing about working in the movies. You make so many friends. I want to go back and show them that the faith they put in me wasn't a mistake.
symington,You're telling me you feel guilty.
frances," No... What I mean is... I'm just very excited by the prospect of getting on with my life, that's all."
symington, Do you really believe your mother's trying to kill you?
frances, What?
symington,"She told me you said, ""Mama, you want to kill me."""
frances,"I never said... Oh look. That's just a figure of speech. She said something funny, and I said..."
symington,And you accused her of tampering with your mail.
frances,Oh for Christ's...
frances,"I'm sorry. She misunderstood, that's all."
symington,But you tell me you had a pleasant visit and your mother says you were sullen and uncommunicative. Whom do you think I should believe?
frances,"Doctor, I hate to break this to you, but my mother is a little batty."
symington,"Frances, you're still filled with anxiety. You feel guilty and hostile toward your family and friends. Consequently, I didn't recommend your release at the staff review."
frances,You what?
symington,"Mental illness is an elusive thing, and though I'm pleased you're feeling more... capable, it's perhaps unrealistic to expect you to be completely cured after so short a time. Don't you agree?"
symington, I'm sure you'll see it my way in the end.
frances,"Dr. Symington, how big is your dick?"
symington,Huh?
frances,"'Cause if it's long enough, which I doubt, why don't you wrap it around and fuck yourself in the ass!"
frances,"I want outta here, you understand? I'm ready to get out! So you go back there... you go back and you tell them to let me out!"
symington," Frances, I'm warning you..."
frances,"No, I'm warning you! Who do you think you are, God? You bumble around with your folders...  ...all your badges of authority! But you have no authority! You're nothing! You're a zero!"
orderly,Doc?
frances,Symington says...
symington, Sedate her.
frances,"Oh my God, I look awful."
harry, You've looked a whole lot better. C'mon.
frances,"They're doin' stuff to me, Harry. Can you see it? You feel it? They're putting stuff in my food or something, my water, and they're using it to put thoughts in my head. You understand? They're trying to re- arrange what's in my head, they're trying to drive me crazy! Oh, Harry!"
frances,"I can't stay here anymore, you understand? I can't, I can't. I gotta get home. I gotta get somewhere else, anywhere, okay?"
attendant,"Oh, Miss Farmer! Time for your bath, Miss Farmer!"
harry, Listen: to the left. Straight through the trees and over the wall to your left. My car is there.
attendant, It's time for your bath!
frances,Oh good. I love my baths.
attendant,Come along now.
harry,Frances! Did you hear what I said?
frances,"Of course, Harry."
frances, Over the walls!
harry,You want crazy? I'll show you crazy!
harry, Here.
harry,"Evening, gorgeous."
frances, You know how long it's been since I was behind the wheel?
harry,"Forget it, Frances. You're not driving."
frances,"Have I told you how mean you're turning, York?"
frances,"Where are we, mean man?"
harry,Couple hours from Idaho. We'll cut across to Montana. I've got friends there with a ranch.
frances,I should've known...
harry,What?
frances,This is another one of your schemes to get me off alone...
harry,That's right.
frances, ...Take advantage of me.
frances,I don't think I'd be much good in a war...
harry,Whattaya think you're in now?
frances, I don't know. Not a war exactly. It's more a... a misapprehension maybe...
harry,Huh?
frances,"A misunderstanding, people taking the wrong meaning from things. I wasn't declaring war, Harry. I was just saying my prayers."
harry,Who to?
frances,"Harry, I have to go home. I have to talk to Mama."
harry,"Frances, you're fulla drugs. You don't know what you're saying. Who do you think put you into Meadow Wood? Your mother thinks you're crazy and she'll keep on thinking it as long as it suits her."
frances," No, she just didn't want me going to jail, that's all."
harry,"Yeah? She's a shark, Frances. I'm not taking you there, and that's that!"
frances,"You know something, Harry?"
harry,I guess.
frances,"Aside from meanness, you're almost perfect. There's only one other thing wrong with you."
harry,What's that?
frances,You can't drink.
frances," Ohhh, that's lousy Scotch!"
harry, Hey! Another shot for the lady and a double for me!
frances,What a man!
harry,"Hey, you're a good quarter-horse, kid, but you can't go a route of ground."
frances, To quarter-horses.
harry,No. To thoroughbreds.
bing's voice,Love is so terrific Such a funny feeling Makes you want to cuddle And coo...
frances,"Why are you always leaving me, Harry?"
harry,Huh?
frances,You should stickaround sometimes. Look out for me.
harry,"Look, Frances, I'm only gonna ask this one time. I mean it. I swear after this, I'll never ask again: Will you marry me?"
frances," I know a thing or two about marriage. You... you understand me more than anyone, Harry... maybe even more than Mama. But... you're too important to me. I'd fail you. I don't know how or why, but I would. And that's a chance I just can't take. Do you understand?"
harry, Well... I'll act like I do until I do.
harry,There's just one more thing.
frances,What's that?
