Speaker,Dialogue
nichols,No. And it seems like we've been over this ground before. Now if you'll excuse me.
gerard,Dr. Nichols. Do you know the other man in the photograph?
nichols,I never saw him before.
renfro, I bet they line up to hear that one.
kimble,"Half the people in the study were indigents. No follow-up, no baseline on them. Who could say they didn't come into the study with bad livers?"
wahlund,The one on the right is one of the samples you sent me. It shows a lot of perriportal inflammation loaded with eosinophils. When you see that with the accumulation of bile it's a classic for -
kimble,- drug induced hepatitis.
wahlund,I'm impressed. Now look at this.
wahlund,"According to the study, this is a slice from the same liver."
kimble,Cold normal.
wahlund,Clearly not from the same tissue. In fact.
wahlund,See this small area of bile duct proliferation? Von Meyenberg's Complex. Occurs in only 2% of the population. But it's in every one of your five samples.
kimble,That's statistically impossible.
wahlund,That's because they're all from the same liver.
betty,His name's Lentz. A pathologist. I only remember him because he died last summer.
newman,Anybody down in pathology who might know something about the guy?
betty,"It's kinda late to catch anyone, but you might go by the morgue. There's an old guy down there who's been around forever."
biggs,Just what I want to do before dinner.
newman,Are you Mr. Roosevelt?
roosevelt,Yes.
biggs,"We're United States Marshals. We're trying to find out some information about a pathologist, named Lentz. He used to be on staff here."
roosevelt,He's dead.
newman,"Yeah, we heard. We wanted to know if he knew or had any contact with Dr. Richard Kimble?"
roosevelt,I... I haven't seen Dr. Kimble.
newman," That's not what I asked, sir. I just wanted to know if Dr. Kimble and Dr. Lentz knew each other?"
roosevelt,"I... I don't know. Excuse me, I got to go."
biggs,I think you're lying to us.
kimble,They'd be home free if I hadn't been leaning on them to account for the livers I was seeing. And I wouldn't have seen the livers if I hadn't told the guys on my service to call me when they had cases that were bleeding excessively in surgery.
wahlund,"Big bucks. One schmuck standing in the way. Easy, get rid of him and his wife. But why Lentz?"
kimble,"Why not? He's one of the original patent holders. Toss the samples I sent, replace them with healthy samples, issue the path report on the healthy stuff-piece of cake."
kimble,When did Lentz die?
wahlund,"Oh, last summer sometime. August... Why?"
kimble,Because a good third of the samples Lentz approved were signed after he died.
kimble,Someone else used Lentz's name.
wahlund,A pathologist at Devlin-Macgregor?
kimble,They wouldn't have had the access. They would have needed someone at the hospital.
wahlund,Where are you going?
kimble,To see an old friend.
poole,It's Newman. Line two.
newman,The old guy didn't know where he was going. But he picked up some tissue samples.
gerard,Tissue samples?
newman,... From a drug study. And signed for by Dr. Charles Nichols.
newman,Nichols also knew Lentz. He was a pathologist.
renfro,He was covering for Kimble.
gerard, Get CPD to bring in Sykes.
host,"Tonight to close our conference, we're honored to hear a report from one of the most respected men in his field..."
host,... He is the A. Jude Robinson Fellow and Administrative Chief of Pathology at Chicago Memorial Hospital... and just recently has been appointed member of the board of directors for Devlin-Macgregor Pharmaceuticals. Please welcome...
host,... Dr. Charles Nichols.
stevens,I checked Sykes' calls for the last two years against Kimble's like you asked and found nothing.
gerard,All right. It was a thought.
stevens,But when I cross-checked Kimble's phone records... one came up.
gerard,Kimble called Sykes.  Renfro! Get C.P.D. to bring in Sykes!
stevens,Night of his wife's murder - seven-thirty in the evening from his car.
stevens,I have the phone record right here.
gerard," No, Stevens... I believe you."
poole,"Sam, C.P.D. just checked Sykes' apartment. He's not there."
sykes,"Back up. Move to the door, Doc."
transit cop," This is transit unit, 23. I have a possible sighting of Richard Kimble. Northbound coming into the Balbo station. Request immediate back-up at the station."
sykes,"This is my stop, Doc."
kimble,"Good, it's my stop, too."
transit cop,"Kimble.  Sir, move away from him."
sykes,Go ahead. You don't have it in you .
kimble,"Not as easy as Helen, was it?  You missed your stop."
renfro,Balbo station. That's -
gerard," Poole, get Biggs and Newman."
gerard, Damn...
newman,C.P.D. just reported -
gerard,I heard. Was it Kimble?
biggs,"Conflicting reports, but the cops are considering him a shooter."
police captain,Witnesses say he entered hotel from the subway.
kelly,Okay. I want it locked down. Start on the lower levels.
gerard,"That's my man in there, Kelly."
kelly,"Not since he took down one of ours, Gerard. This is a police matter, now. Stay, the hell, out of it."
gerard,"C'mon, I know where he's going."
nichols,... And I especially would like to thank my researchers who helped me...
nichols,Richard...
kimble,"What's wrong, Charlie? Surprised?"
crowd,It's Richard. It's Kimble.
kimble,"After Lentz died, you were the only one that had access to the pathology reports."
nichols,Reports? What are you?
kimble,You switched the samples and falsified the reports so R.D.U.90 could get approval.
nichols,"Richard, I don't know what you're talking about?..."
kimble,I have a set of the original samples.
kimble,"You almost pulled it off, Charlie. But I know all about it now, and I can prove it."
kimble,"Ladies and gentlemen. My friend, as you can see, is obviously not well. Richard, if you want to talk -"
kimble,I didn't come here to talk
biggs,"C.P.D. has the perimeter, hotel security has the parking structure."
gerard,"Let them keep busy down below. Newman, get with security. See if you can locate Kimble from the monitors. Keep in radio contact."
nichols,"Your best quality, Richard, is that you don't give up -"
nichols,... even when it's clearly in your best interest to...
nichols,I always knew that I'd have to kill you.
nichols,"Now, I must thank you for giving me 200 witnesses tonight who will support me... when I tell them it was self-defense..."
kimble,"You missed your chance, Charlie..."
newman, I've got Kimble on the roof with Nichols. Southeast exit.
biggs, Keep and eye on him. Biggs has roof plans.
biggs,There are four exits to the roof.
gerard,I want them covered.
kimble,You took everything away from me... for money.
gerard,This way.
kimble,"I want to know, Charlie... was it worth it...?"
nichols,"This thing is bigger than even you think, Richard. You can't stop it."
gerard, Get that door open.
gerard, Stay at this door.
kelly,Bring him down.
gerard, This is a United States Marshal. Get that helicopter out of here!
renfro,There is a U.S. Marshal out there. Hold your fire!
gerard,Kimble!
gerard, Where did the elevator stop?
newman, Level five.
gerard,Get out of here.
gerard, We're going in. Give me five minutes. Keep C.P.D. out.
gerard,... There is no way out of here.
gerard,... Nichols borrowed your car the night of the murder and called Sykes from it.
gerard,... That's why there was no forced entry at your house. He'd used your keys.
gerard,Kimble... Come meet me out here.
gerard,"It's time to quit running... if you don't, you know I'll stop you. He listens, there is no answer."
another reporter,... there are unconfirmed reports from police of new evidence which may exonerate Kimble while implicating some of the biggest names in medicine...
stunned doctor,He just walked in... We didn't know what he was going to do. My wife was very frightened... The next thing I knew cops were charging in and...
reporter,"Dr. Kimble, is it true you can prove your innocence!"
gerard, Get them back.
biggs,"Watch your head, Dr. Kimble."
gerard, Give me your hands.
gerard,"Take care of those hands, Doc, you're going to need them again soon."
kimble,I thought you told me 'you didn't care.'
gerard,"Yeah, well, don't spread it around."
