Speaker,Dialogue
patrick,He was probably killed by Sgt. Detective Remy Bressant or anyone else who wanted the 130K in his backpack.
beefy officer,You charge money as a detective. But you were at the quarry and yet you had no idea it was a set up?
patrick,"I trust the Police when they tell me something. And I had a fake ransom note and Amanda's blanket the cops left in my mailbox. And I heard the tape from when Cheese, or I guess it was Chris pretending to be Cheese, called the station."
captain,A 911 call?
patrick,No. The call into the station from Cheese to Remy.
captain,We don't tape calls into the station.
beefy officer,Did you hear a tape?
patrick,No.
beefy officer,Did you see a transcript?
patrick,I must have remembered it wrong. Remy read it to me.
captain,Calm down.
angie,What happened?
patrick,They kept my shoelaces.
angie,We'll go down to Zayre's tomorrow and get you some new ones.
patrick,I don't want to do that tomorrow.
angie,What do you want to do?
patrick,Take a trip.
angie,You want to tell me where our trip has taken us?
patrick,You know where we are.
patrick,Are you sure?
angie,Yes.
patrick,"He was a part of it. They don't tape calls. He handed us a transcript like it was evidence and he knew it was a forgery- -maybe he forged it himself. He knew what they were doing, he supported it and he covered it up."
angie,Why? For a third of a hundred and thirty grand? What for?
patrick,Had to be for something.
angie,"When you're talking about ruining an old man who lost his child and gave years of service . . . ""something"" isn't enough."
patrick,"For a guy who tried to ruin us, something' s plenty."
angie,"This is the kind of thing where if you do it, you want to be sure."
patrick,No.
angie,No.
amanda,"Don't forget mine, gramma."
francine,"I'd never forget yours, sweetheart. Doyle lifts Amanda off the porch and carries her to the Suburban. He dips down, allowing Amanda to place her back- pack inside."
amanda,"Can I have a, please a sandwich?"
doyle,What kind do you want.
amanda,Grill Cheese.
doyle,"You like the crusts on, right?"
amanda, Noooo! I don't like the crusts on!
patrick,Jesus.
angie,She's alive.
angie,She's happy.
patrick,No.. .
angie,She' s happy here.
patrick,"Angie, don't do this."
angie,If you call the Police they'll send her back.
patrick,I need you on my side.
angie,I am on your side but I can't send her back.
patrick,We're not sending her anywhere. That's her mother. She has a right to her child.
angie,He's better for her.
patrick,Why? Because he has money and makes sandwiches?
simply),Because he loves her.
patrick,"Helene loves her, too."
angie,No.
patrick,She might learn from this.
angie,No.   People don't change.
patrick,You can't take away someone's kid.
angie,I don't want to.   I want to leave their child with them.
patrick,~ l this time we wanted to bring her
angie,Because I know right and wrong when I see it.
patrick,I need you to understand me right now. I need you to love me and say I know this is a hard decision but I stand by you. I need you to take me home and make this okay.
angie,I can do that. I can take you home and I know how to make it okay.
patrick,You can't ask me to do something I can't do.
angie,"You can't ask me to live with it,"
doyle,Patrick Kenzie. To what do I owe the pleasure?
patrick,Remy Bressant died last night.
doyle,I was told. It's a shame.
patrick,Hard to understand.    He seemed like a good man.
doyle,"He was a good man. You don't know why people do what they do. Only they see out their own windows. With that, AMANDA walks out the door, running to Jack and clinging to his leg. Jack holds Patrick's look."
amanda,Papapa.    Come make sandwiches now please.
patrick,Men killed for.
doyle,I'm giving that little girl a life.
patrick,"It's not your life to give. Helene is her mother. You think she's a bad mother you should have gone to social services. Short of that, it's her mother, it's where she belongs."
doyle,"Turn around, get back in your car and wait thirty years. You don't know what the world is made of yet."
patrick,I know I'm tired of being lied to   and tired of being lectured by a gang   of criminals. I'm calling the State    Police in five minutes. They'll be here    in ten.
doyle,No.
patrick,See you at the arraignment.
doyle,You can do one good pure thing here today. One right thing. Most men don't get that chance in a lifetime.
patrick,"Then I guess I will. I'll tell them I'm sorry and I'll live with it. And maybe that will happen, what I'm not gonna do, is have to apologize to a grown woman who says, why did you leave me? I got kidnapped, my aunt hired you to find me, and you did. You found me with a strange family but you broke your promise and you left me there. Why? Why didn't you bring me home?"
i still,Then you'll have to excuse me. have a sandwich left to make.
angie,Sorryr I had to come back and get some stuff.
patrick,It's okay. She looks at himl almost sympathetic.
angie,There's nothing to say
s,You think hef11 like me? Patrick looks over to Helene standing in the doorwayf all dolled up -- striking a pose. She wears too much makeup. Her clothes reveal too much of what she hasn't got.
patrick,Who?
helene,My date.
patrick,I'm sure he will.
helene,Aww' you' re sweet. He seen me on my American Victim and he wrote me letters and I was like whatever' but then he saw my Katie Couric and drove down here from Providence so I was likef that's romantic' right? Patrick forces a smile.
patrick,Howfs Bea?
helene,I wouldn't let her in the apartment.
patrick,Yeah.
helene,Don' t think she didnft hate you for Lionel goinr to jail.
patrick,Probably why she never paid my bill.
helene,You should fuckin' sue.
patrick,How about youf Helene? You hate me?
helene,Euck no. Brother or not he took my kid. Euck him. She could' a been hurt.
patrick,What about Amanda?
helene,What about Amanda?
patrick,Who's watching her?
helene,Dottie.
patrick,Dottie know that?
helene,"She will in five minutes.   Shit, I'm gonna be late, too."
patrick,Sure.
helene,For real?
patrick,It's fine.
helene,She likes you.
