Speaker,Dialogue
sue,It's tough. The boys float around. The fathers belong in a totally different world and the boys have no one to turn to. Does that make sense?
walt,Not sure. No.
sue,"The boys don't ask their fathers for advice, because over here, their fathers no longer have the answers."
walt,The girls go to college and the boys go to jail.
sue,"It's more common than not. Walt reflects on this for awhile, then changes the subject."
walt,You still going out with that clown?
sue,No. I dumped him. He was a dim- wit. Walt nods.
walt,Good girl.
tao,"You know, the Hmong consider gardening to be women's work."
walt,"Is that why I see you out in your garden all the time? Besides, zipper head, we ain't in Hu-Mong."
tao,Funny. Walt lights a cigarette.
tao,You should quit those. It's bad for you.
walt,"So is joining a gang, you dipshit."
tao,"Seriously, you should quit, I saw you cough up blood."
walt,"So, you ever think about what you want to do with your life?"
tao,I don't know.
walt,You've never thought about it?
tao,Of course I have.
walt,"Well, while you're thinking about it, try not to stomp all over my chives, you dipshit. Tao looks down; sure enough, he's standing on Walt's chives."
tao,Sorry.
walt,Put some mulch around the cucumbers. Tao spreads more mulch.
tao,"I was thinking about sales, maybe."
walt,My oldest son's a salesman. He sells cars.
tao,Does he do well?
walt,License to steal. I worked in a Ford plant for thirty years and my son sells goddamned Japanese cars.
tao,You made cars?
walt,That's right. And I put the steering column in the Gran Torino when it rolled down the line in
tao,"Wow, that's cool."
walt,"It is, isn't it?"
tao,Does your son come over much?
walt,How are you going about getting into sales? You thinking about school?
tao,Kinda.
walt,"Well, you should."
tao,School costs money.
walt,Maybe you should get a job and save instead of spreading mulch in my garden.
tao,Maybe you could just pay me.
walt,That's funny.
tao,What kind of job could I get?
walt,Good question. Who the hell would hire you?
walt,"Aw, go on. I'm kidding. You could get a job, easy."
tao,Like what?
walt,I'd think about construction.
tao,"Me? Construction? What, do you have Alzheimer's or something?"
walt,"Naw, you could hack it. You just need a little adjustment."
tao,You said yourself I'm worthless and I have soft little girl hands.
walt,"That's exactly the point. I know some guys in the trades, but you have to get your shit together. We have to man you up a bit."
tao,Man me up?
walt,Yes. And you should ask out Yum Yum too.
walt,You have to learn how guys talk. Now watch how me and Martin communicate. We just throw it back and forth. You ready?
tao,Sure.
walt,"Okay, let's go in. Walt holds the door for Tao and they enter. The Barber has his feet up reading a Playboy."
barber,"Oh great, a Pollack and a chink."
walt,"Afternoon, Martin, you dumb Italian prick."
barber,"Walt, you cheap asshole, I should have known you'd come in, I was having such a pleasant day."
walt,"Why, did you jew some blind man out of a few bucks, give him the wrong change? Walt and the Barber shake hands warmly. Tao is wide- eyed."
barber,Who's the Nip?
walt,This is Tao. He's a pussy kid who lives next door and I'm trying to man him up a little. Walt points at Tao.
walt,Did you see? That's how men talk to each other.
tao,They do?
barber,"What, do you have shit in your ears?"
walt,"Okay. You go out, come back in and give it a try."
tao,"Come on, Walt."
walt,"I said go out there, come back in and talk to the barber like a man. Do it. Tao shrugs, goes outside, lets the door shut then comes back in. The Barber stands there with a sneer on his face."
tao,"Wus up, you old Italian prick? The Barber levels a sawed-off SHOTGUN at Tao."
barber,"Get outta my shop before I blow your head off, you long-haired faggy little gook! Tao is terrified, frozen stiff. Walt and the Barber throw their heads back and laugh. The Barber lowers the shotgun."
walt,"Jesus Christ, Toad, you don't walk in and insult a guy. What are you, an idiot?"
tao,But... but that's what you said. That's what you said men say.
walt,"Not if you never met the guy. If you say that shit to the wrong stranger, they'll blow your goddamned gook head off! Walt and the Barber laugh again."
tao,What should I have said?
walt,Anything but that.
barber,"Kid, you shoulda just started with Hi' or Hello.'"
walt,"Right. You should have said, Excuse me, I'm looking for a haircut if you have time.'"
barber,"Yeah. Be polite, but don't kiss ass."
walt,"Or, even better is act like you just got off a construction job."
barber,"Right. Son of a bitch, I just got my brakes fixed and those sons a bitches really nailed me. Screwed me right in the ass."
walt,"Exactly. Don't swear at the guy you're talking to, swear about another guy who ain't there. My son of a bitch prick fucking boss made me work overtime and he knew I had bowling tonight."
barber,"Or, my old lady bitches to me for two fucking hours about how they don't take expired coupons at the grocery store and the minute I turn on the goddamned game, she starts crying how we never talk."
walt,"See? You come back in, Toad. Be polite and then you bring up something you can both talk about. It ain't rocket science."
tao,"Yeah, but I don't have a job or a car or a girlfriend. Walt and the Barber laugh."
barber,"Sweet Jesus, I shoulda blown his head off when I had the chance."
walt,"Just go back outside and try it again. And don't mention you're a pussy with no car, girl, job, future or whatever. Come in and act like a man, Toad. Tao goes out, turns around and comes back in."
tao,"Excuse me, sir, I need a haircut, if you ain't too busy... you Italian son-of-a-bitch prick barber."
tao,Boy does my ass hurt from all the guys at my construction job. Walt and the Barber laugh harder.
walt,"If you do this, you're going to follow through, right?"
tao,"Yeah, yeah."
walt,"No, not yeah, yeah. Yes, as in yes, sir, I'll do my best."
tao,"Yes, I'll do my best."
walt,"You better, because when I vouch for someone, it's my word and I don't want anyone making me look bad."
tao,"No, I'm good. I'm totally into this."
walt,"And don't lay down to people all the time. Always look a person in the eye. When you shake a man's hand, you can usually tell where you stand with him. Walt hands a pair of beat-up WORK GLOVES to Tao."
walt,"Here, stuff these in your back pocket."
tao,Cool.
walt,Just don't blow this.
walt,"Kennedy, you drunken Irish goon, how the hell are ya?"
kennedy,"Shitty, but who's gonna listen?"
walt,Not me. Walt pours himself a cup of the bad job-site coffee.
kennedy,"Help yourself, Walt, you dumb Pollack."
walt,"I already did. This is the kid I told you about. Tao, this is Tim Kennedy, he's the super on the job. Kennedy looks Tao up and down. Tao looks him in the eye."
kennedy,"What do we got, Walt?"
walt,"He's done construction here and there. Whatever you need, he'll pick it up quick."
kennedy,You sure?
walt,Sure.
kennedy,You speak English?
tao,"Yes, sir."
kennedy,You born here?
tao,You bet.
kennedy,You got a vehicle? I see Walt drove you here.
tao,Not at the moment. I'm taking the bus for now.
kennedy,"The bus? Jesus Christ, you don't have a car?"
tao,My headgasket cracked and the goddamned prick at the shop wants
kennedy,I just replaced the tranny in my Tahoe and the sons a bitches
tao,Goddamned thieves. It ain't right.
kennedy,You got that right. Come on in on Monday and we'll find something for you to do. Tao puts out his hand to shake.
tao,"Thanks, Mr. Kennedy. Tim Kennedy shakes Tao's hand."
kennedy,It's Tim. What's your name again?
tao,Tao.
kennedy,"Okay. You owe me one, Walt."
walt,I'll send you a fucking fruitcake at Christmas.
kennedy,"Fuck the fruitcake, why don't you hand over the keys to that Gran Torino."
walt,"Yeah, everybody seems to want that car."
kennedy,I bet.
walt,"You don't know the half of it. Come on, zipper head, let's let this big Mick get back to screwing off. Walt and Tao exit and walk back to the truck."
tao,What are we doing?
walt,"What are you gonna put all your tools in, an empty rice bag?"
walt,You'll need this. Walt then tosses Tao a utility knife holder.
walt,And you'll need that. Now where the hell do they hide the hardware holders?
tao,I can't afford any of this.
walt,"I'll get it, but you're paying me back with your first check."
tao,Cool. Walt pitches a hardware pouch at Tao.
walt,And you need this too. That should about do it.
tao,"Not to bitch, but won't I be needing some tools?"
walt,"Tools I got, but I ain't loaning you my tool belt. You can buy tools as you go."
tao,I appreciate all this.
walt,"Aw, forget it."
tao,"No, I really do. Thank you. Walt sticks out his jaw and looks Tao straight in the eye. Tao doesn't know what to expect. A PAUSE. Walt puts out his HAND to Tao. Tao extends his and they SHAKE HANDS. It's really quite a moment for both of them."
tao,What now?
spider,"Just seeing what you're up to, cuz."
tao,"I'm getting home from work, not that you guys would know much about that."
spider,So it's true? You got a job.
tao,"Come on, what do you guys want with me?"
smokie,"Jesus Christ, Tao. What do you think? I've been sooooo easy on you, but I can't just go on like nothing happened."
tao,You can't just leave me alone?
smokie,Afraid not. The gangbangers grab Tao. Tao kicks and struggles as they yank away his tool belt.
tao,Keep your hands off my stuff.
smokie,"Your stuff? You and everything you have is mine. I own you. Smokie pulls the tape measure off the belt and smashes it against the pavement. Whatever tools Smokie can't destroy, he tosses onto the roof of the closest building."
smokie,"You can't just walk away from us, Tao. It looks bad. It makes me look bad. Smokie lights a CIGARETTE and exhales..."
smokie,"What's the phrase I'm looking for? Oh yeah, I need to save face.' Smokie grabs Tao by the neck and presses the lit CIGARETTE into Tao's cheek. Tao screams as his flesh burns."
walt,Hey there. Tao looks to the ground and heads in the other direction.
tao,"Hey, I gotta run."
walt,"Wait a minute. Where have you been, I haven't seen you in days?"
tao,"Busy. Walt squints at Tao. He steps closer. Tao looks away. Walt tilts Tao's head up, he sees the burn."
walt,What in the hell happened to you?
tao,Don't worry about it.
walt,Don't worry about it? Look at your goddamned face!
tao,I said don't worry about it. It's not your problem. Walt looks at the ground and spits.
walt,When?
tao,Couple days ago. Grabbed me after I got off the bus coming home from work.
walt,Cowards.
tao,I did everything I could possibly do. They broke some of your tools. I'll replace them.
walt,Forget the tools. Where does your cousin live?
tao,"No, Walt, I can manage. I don't want you doing anything. Walt is angry, but eventually nods at Tao."
walt,Alright. You need any other tools for work?
tao,I could use a roofing hammer.
walt,Go in the garage and get whatever you need.
walt,That's the last of them. Walt pulls out his Colt .45 automatic and chambers a round.
smokie,How the fuck did you get here?!
walt,You aren't that hard to track down. Walt boots him again. Smokie curls up in the fetal position.
smokie,What do you want? Walt kicks him a second time.
walt,I came to give you a chance. SOMETHING comes out of the shadows under the porch. Walt swings the barrel of the big Colt .45 at the movement. It's a cat. Walt puts his pistol away. Smokie exhales.
walt,"It's just you and me. Nobody knows or has to know I was here. You lay off Tao. Tell your guys he ain't worth it or whatever the hell you want. You don't talk to him, you don't go near him. This is your one chance. You lay off and no one will ever be the wiser. Smokie says nothing."
walt,"I'll take that as a yes. I don't want to come back here. But if I do, believe me, it'll be goddamned ugly. Walt kicks Smokie again and stalks off into the dark."
walt,"How do you want your dog... I mean steaks cooked? Medium, medium well?"
tao,Funny. Walt pops open a beer and grabs an appetizer that Vu made.
walt,Is this Hmoog or Laab?
sue,Laab.
walt,"Isn't it usually a little spicier? Tao, Wa Xam and Sue laugh."
sue,"Oh whatever, Wally."
walt,It does. Usually it's got more zing.
sue,"Jesus Christ, look at you. I've never seen you like this."
walt,What?
sue,"Look at you smile, old man. Kicking back, having a good old time. You're sure pleased with yourself today."
tao,And it's a little unnerving if you ask me.
walt,"Aw, go on."
sue,"No, admit it. You are. You're feeling pretty good, aren't you?"
walt,"Well, who wouldn't? I'm surrounded by beautiful women, it's a beautiful day. Great food, good friends. Hell, even Toad isn't driving me nuts for once."
tao,It never ends.
walt,"I'm just kidding. Let me tell you something, Yum-Yum. If Tao doesn't ask you out soon, I will."
sue,"Don't listen to him, Wa Xam. He's a white devil."
walt,I'll be damned. Movie? Dinner? Wa Xam and Tao nod. They're a bit embarrassed.
sue,"Yeah, they're taking the bus."
walt,The bus?! That's no good. A charming young lady like this deserves to go in style.
tao,Like what? Take a limo? Walt nods towards the GRAN TORINO.
tao,The Gran Torino? You'd let me drive it?
walt,Sure. Why not.
tao,Really? Walt smiles.
walt,Really. They shake hands.
walt,"Is everyone okay? Is anyone hit? Sue? Vu? Tao, where's Tao? Tao sits up from behind the couch. Blood pours down his neck. He's stunned."
walt,Oh no. Walt lays Tao down and rips open the collar of his shirt. Walt probes around Tao's neck.
tao,What... what is it?
walt,"Hang on... you're just cut, is all."
tao,Is everybody else okay?
walt,Yeah. Walt looks around at the BULLET HOLES in the walls. Tao follows his gaze.
tao,It's a miracle no one was killed.
walt,They aimed high. Sure enough -- most of the bullet holes are above head level on the walls.
walt,Where's Sue?
tao,She went to our aunt's.
walt,Call her.
tao,What?
walt,I said call her. Get the goddamned phone and call and see if she's there. Tao scrambles for the phone and dials. Tao speaks Hmong to whomever answered. Tao starts to speak faster. He looks at Walt and shakes his head no. For once -- Vu and Phong understand what Walt was talking about. There is anguish on every face in the room.
walt,This is exactly what I didn't want. Damn gooks. Why the hell am I even here?
tao,Maybe one of her friends called and she just changed plans. Walt sips the rice liquor. Walt now speaks quietly to Tao.
walt,"In Korea I learned not to care. The best friends of my life are still missing somewhere in Korea. You harden yourself. Don't let anything get to you. Phong looks out the window and screams. She runs over and swings open the door. Everyone expects the worst... And it comes like a cold wind -- SUE WALKS IN LIKE A ZOMBIE. She has been brutally beaten. Her clothes are dirty and torn. BLOOD runs down SUE'S legs from under her shirt. Walt looks at her and the glass falls from his hand. Sue staggers into Vu's arms. Vu weeps. Sue hugs her mother and sobs. Tao reaches to hug his sister, but Phong screeches at him, pointing at Walt and back to Tao. Walt is destroyed. He steps outside into the dark."
walt,"No, no, no, no, no."
father janovich,"Mr. Kowalski, are you in here?"
walt,Come on in. Father Janovich comes in and sits down across from Walt.
father janovich,Are you okay? Walt nods.
father janovich,"The police finally left. No one is talking. One thing about the Hmong, they keep their mouths shut."
walt,I've noticed that. Father Janovich picks up a photo album and flips through it. Pictures of Mitch and Steve as babies.
walt,"You know, there's no way that Tao or Sue are gonna have any peace if these gang guys don't go away. Go away forever. You know it as well as I do."
father janovich,What are you saying?
walt,You heard what I said.
father janovich,They took Sue to the hospital. She's scared. They're all scared.
walt,I'm not.
father janovich,"I know that. Believe me, they all know that. Tao especially. He's sitting out there staring at your front door. You know what he expects, Mr. Kowalski."
walt,"Yeah, well what would you do if you were me? If you were Tao? What would you do? Father Janovich shakes his head."
father janovich,"I know what I'd do if I was you, or at least what you think you should do. If I was Tao I guess I'd want vengeance. I'd want to stand shoulder to shoulder with you and kill those guys."
walt,And you?
father janovich,"What would I do? I'd come over here and talk to you I guess. I know you're close with these people, but this pisses me off too, Mr. Kowalski. Walt nods."
walt,Wanna beer?
father janovich,I'd love one.
walt,"They're in the cooler, grab me one too."
father janovich,Damn all this. It just isn't fair.
walt,"Nothing's fair, Father. Father Janovich and Walt sit for awhile."
father janovich,"So, what are you going to do, Mr. Kowalski?"
walt,Call me Walt. Father Janovich nods.
father janovich,"Alright, what are you going to do, Walt?"
walt,Not sure yet. All I do know is they don't have a goddamned chance.
tao,What are you doing?
walt,I'm thinking.
tao,Thinking time is over. Now it's time to knock the ass out of those pricks.
walt,"I know you don't want to hear this, but you have to calm down."
tao,What?!
walt,"You have to have a clear head, otherwise mistakes get made. Back away from what's happened, Tao."
tao,"No. Don't let me down, Walt. Not you. This is going to end, today. Walt stands up and pulls out a chair for Tao to sit in."
walt,Sit down.
tao,I don't want to sit.
walt,I SAID SIT DOWN! Just listen up for a second and don't say anything. Tao sits down. Walt rubs his hands together.
walt,"I know what needs to be done. I need to prepare, this needs to be carefully planned. You know I'm the right man for this. So cool down for a little while and meet me back here at 4 P.M. I promise you, what needs to be done, will be done."
tao,I say we go now. Right now.
walt,"And do what? You want to go kill your cousin and those other Zips. Mr. Tough-Guy-All-Of-A-Sudden is out for blood. What do you even know about it? Tao is furious, but says nothing."
walt,"Trust me, Tao. Cool down and we'll meet back here at four. Okay? Tao doesn't answer."
walt,I said okay?' You won't do anything without me. You meet me back here at four? Say okay.'
tao,Okay. Tao storms out the back door. Walt pours more coffee.
walt,"I know, I know. Give me a break, it's the first time I've ever smoked in the house."
barber,"There, all done. Ten bucks American."
walt,"I don't suppose you still have steady enough hands to give a guy a straight shave, you withered, old Italian mummy?"
barber,"You? A straight shave? You've never ordered a straight shave, ever."
walt,That's right. I always wondered what they were like. Unless you're too goddamned busy?
barber,"No, no. That's fine. Let me heat up a towel. Walt hands Martin the Barber a twenty."
walt,Here's a twenty. Keep the change in case you slip and hit my jugular.
walt,So you can take it in right here?
tailor,"Yes, sir. Take about an hour."
walt,That's great. Thank you.
tailor,"Yes, sir."
walt,Never had a fitted suit.
father janovich,"Mr. Kowalski, what can I do for you?"
walt,I've come for confession.
father janovich,"Oh Lord Jesus, what have you done?"
walt,Nothing. Take it easy.
father janovich,What are you up to?
walt,Are you going to let me confess or not?
father janovich,How long has it been since your last confession?
walt,"Forever. Bless me, Father, for I have sinned."
father janovich,"What are your sins, my son."
walt,"In 1968, I kissed Betty Jablonski at the work Christmas party. Dorothy was talking with the other wives and it just happened."
father janovich,Yes. Go on.
walt,I made nine hundred dollars profit selling a boat and motor and never reported the taxes which is the same as stealing.
father janovich,Yes. Fine.
walt,"And lastly, I was never close to my two sons. I don't know them. I didn't know how."
father janovich,That's it?
walt,"Whatta you mean, That's it?' It's bothered me for years."
father janovich,God loves and forgives you. Say ten Hail Marys' and five Our Fathers.' Are you going to retaliate for what happened to Sue? Walt says nothing. Father Janovich looks hard at Walt.
father janovich,"I'm going over to that house today, Mr. Kowalski."
walt,Is that so?
father janovich,It is. And every other day until you see the folly in what you are planning.
walt,"I gotta go, Padre. Busy day ahead."
father janovich,Go in peace.
walt,I am at peace. Walt and Father Janovich shake hands. Walt exits. Father Janovich exhales loudly and drops into his chair.
father janovich,Je -- zuz -- Christ.
tao,Which one do I get?
walt,You ever fire a weapon?
tao,No. Tao aims the rifle at an imaginary target.
walt,Put that down. I got something for you.
tao,What?
walt,"In Korea, October, 1952. We were sent up to sweep a Chink machine gun nest that had carved us up pretty bad. I was the only one who came back... I received the Silver Star. I want you to have it."
tao,Why?
walt,"When we went up that hill, we knew it was ten to one against us, but we went anyway. This trouble now, it's similar. We're walking right into it. We might not be coming home tonight."
tao,The hell we won't. We're going to roll in there and tear ass.
walt,"Don't be a fool, these guys are waiting for that exact reaction. Tao is quiet for a minute."
tao,How many?
walt,How many what?
tao,How many men did you kill in Korea?
walt,Thirteen for sure. Probably more.
tao,What was it like to kill a man?
walt,You don't want to know.
tao,Why not?
walt,Go get the Silver Star. It's in a blue wooden box in the cellar. Tao goes downstairs. He turns on the light and goes into the cellar. Tao locates a BLUE WOODEN BOX and opens it. Tao holds up the MEDAL. He looks at it closely. AND WHAM -- Walt slams the heavy cellar DOOR shut behind him. Walt slides the BOLT LOCK into place with a loud
tao,"What the hell are you doing?! Let me out of here, you goddamned son- of-a-bitch!!"
walt,"Quit smashing everything. You'll never get out of there, so just relax."
tao,"You let me out, you crazy old fuck, or I will kill you when I get out of here. Tao pounds on the door. Walt pounds back with a strength and authority which startles Tao."
walt,"You want to know how it feels to kill a man? It feels goddamned lousy. And it feels even worse when you get a medal for bravery right after you mowed down some scared kid when he tries to give up. A dumb, scared, little gook, just about your age. I shot him with the same rifle you just held upstairs."
tao,No! Let me out!! Tao pounds on the door.
walt,"You've come a long way. I'm proud to call you a friend. You have your whole life ahead of you, whereas this is what I do. I finish things. You'd just get in the way. Sorry. Walt goes back upstairs, leaving Tao locked up in his cellar. Tao howls to be let out."
walt,"Aw, pipe down, you hag."
walt,"Fine, I hate you too."
walt,I need you to watch my dog. Walt holds the leash closer. Phong folds her arms in defiance. Walt exhales loudly. Walt lifts up one of the LEGS OF HER LAWNCHAIR and slips the loop of the leash underneath it so Daisy can't follow him.
walt,Her name is Daisy. Walt bends down on one knee and lovingly pets Daisy. He scratches her belly.
walt,"You take it easy, old gal. You good old girl. Walt gets up and walks away without looking back. Phong is stunned; she is silent for once."
walt,"Good afternoon, gentlemen."
darrel,"Walter, how are you doing?"
walter,Never been better.
bartender,"Beer and a shot, Walt?"
walt,I think I'll have something different. Walt looks at the liquor display. At the pinnacle of bottles sits a bottle of Johnnie Walker Blue.
walt,Think I'll try that Johnnie Walker Blue Label.
mel,"Whatta ya win the lottery, Wally?"
walt,"Naw, just having something special. Walt sips his Scotch and nods. It's good."
walt,Why don't you get all the guys the same.
bartender,You sure?
walt,I'm sure. This is too good not to be shared. Walt finishes his Scotch and points for one more. Several regulars hold up their drinks towards Walt.
sue,Hello?
officer,"Sorry, Father, we have to go."
father janovich,"I'm telling you. If we're not here, there will be bloodshed."
officer,We've been here for hours. We can't afford to anchor a unit to one location.
father janovich,I'm begging you to stay.
officer,"I just got word from my Sergeant, we're pulling the plug."
father janovich,I'm staying.
officer,"No you aren't. My orders are specific. You came with us, you're leaving with us. Father Janovich looks hard at the duplex before getting into the SQUAD CAR. The SQUAD CAR drives off. Walt pulls up in front, gets out of his pickup and slams the door. He looks at the duplex. It's a total eyesore."
walt,Is that all you swamp rats or is there more vermin scurrying in the shadows? Smokie and Spider step out and stand on the porch. Smokie smiles at Walt. Walt spits on the ground.
smokie,I wasn't sure that you'd...
walt,"Shut up, gook. I'm not here to listen to one goddamned syllable of what a shrimp-dicked little baby midget like you has to say. Spider pulls his PISTOL."
walt,"That's right, boy. Defend your boyfriend after he or you or whoever rapes a member of your family. Your own blood, for Christ's sake. Go ahead, pull your pistols, just like a bunch of ridiculous miniature toy cowboys. Smokie and several other Hmong gangbangers pull their guns."
walt,"You have no honor. You're the scum of the earth and when you're gone, do you think anyone will care? No one will mourn. You won't be missed. All the Hmong are spooked at Walt's absolute lack of fear."
smokie,"Where's Tao, old man? He too scared to come and stick up for himself?"
walt,No. Tao is too good for this. You pukes aren't worth one second of his time. Walt slowly puts a CIGARETTE in his mouth. Even this slight movement has the gangbangers waving their PISTOLS around. Walt laughs.
walt,You boys are a little bit jumpy.
spider,"You watch it, old man."
