Speaker,Dialogue
walt,"No, I think you'd better watch it. Walt looks around. Other than the gangbangers, a small group of people have gathered to watch this showdown."
sue,"Tao? Tao, are you alright?"
tao,Goddamn it!
sue,What's going on?
tao,He left without me!
sue,Where? Where'd he go?!
tao,He went to Smokie's without me. Tao takes the stairs two steps at a time.
sue,"No! No, Tao! Sue grabs Tao's legs and hangs on."
sue,"No! Don't you dare! Stay away from them, Tao! I don't want anyone else getting hurt."
tao,Leave me alone.
tao,Oh God! NO!!
walt,Anybody got a light? No? I got one. Walt's slight grin fades. He mutters to himself...
walt,"Hail Mary, full of grace. Walt reaches into his coat pocket. Six Hmong gangbangers simultaneously level their PISTOLS and FIRE. BULLETS FLY. Walt is struck down. People scream. Walt falls dead. A ZIPPO lighter clutched in his hand. Walt never intended to kill anyone. Self-sacrifice."
tao,What happened?
police officer,You have to step back.
tao,He was a friend of mine.
police officer,I said step back. Tao turns to the HMONG POLICE OFFICER.
tao,"What happened, man? The Hmong Police Officer looks at the WHITE POLICE OFFICER and then to Tao."
police officer,"Officer Chang, get those people back."
father janovich,"Walt Kowalski once said to me I didn't know anything about life or death because I was an overeducated, 27-year-old virgin who held the hands of superstitious old women and promised them eternity.' Walt definitely had no problem calling it like he saw it.' But Walt was right. I knew really nothing about life or death until I got to know Walt. And boy, did I learn."
lawyer,"Which brings us to our last item. And again, please forgive the language used in Mr. Kowalski's will. I'm simply reading it as it was written. The LAWYER takes a sip of water before reading..."
lawyer,"And to my friend, Tao Vang Lor, I leave my 1972 Gran Torino on the condition that you don't choptop the roof like a damned spick, don't paint any idiotic flames on it like some white-trash hillbilly and don't put a big gay spoiler on the rear-end like you see on all the other zipper heads' cars. It just looks like hell. If you can refrain from doing any of that, it's yours."
