Speaker,Dialogue
walt,"Still, you'd think the cold would keep all the assholes away. Sue laughs again at Walt's conscienceless racism."
sue,Thanks for the ride.
walt,"Sure... You know, you seem okay. What the hell's the matter with your half-wit brother? He a little slow or something?"
sue,"Tao is actually really bright, he just doesn't know which direction to go in."
walt,"Oh, poor Toad."
sue,"It's really common. Hmong girls over here fit in better, we adjust. The girls go to college, the boys go to jail."
walt,"Old hag, giving me the evil eye? Walt opens the paper to the TV guide section and lingers at the HOROSCOPES for a second."
walt,"Aw, what the hell... Walt reads aloud to himself."
walt,"Your birthday today; This year you have to make a choice between two life paths. Second chances come your way. Extraordinary events culminate in what might seem to be an anti-climax. Your lucky numbers are: 84, 23, 11, 78 and"
walt,What a load of crap. Walt lights up a cigarette and exhales. Walt watches as the only white woman on the block struggles to unload her groceries from her car. One of her bags rips.
walt,"Christ all Friday. What's wrong with kids today? Walt gets up to go help, but before he can get to the sidewalk, another neighbor has gone over to help... It's TAO. Tao bends down and carries her bags up to her door."
walt,"Well, I'll be damned."
mitch,"Go ahead, Dad. Open it."
walt,What is it?
mitch,"Just open it. Walt opens the package, it's a Gopher Reaching Tool -- the kind that has an alligator clamp so you can pick up objects that have fallen behind the stove, etc. Walt looks at his son and daughter-in-law."
mitch,"It's a Gopher. It's so you can reach stuff. You know, it makes things easier."
karen,Here's one from me. KAREN slides over a another wrapped gift. Walt opens it. It's a PHONE with really big numbers for old people.
karen,It's a phone.
karen,I just thought... we thought that it would... make things easier.
walt,"Yeah, I see that."
karen,There's nothing wrong with making things less hard on yourself.
mitch,"Karen's right, Dad. You've worked hard your whole life. Maybe you should think about taking it a little easier? Walt lights up a cigarette."
mitch,"And that's another thing, Dad. You should get rid of the coffin nails. Walt says nothing."
mitch,"And the house, now that Mom's gone, it's got to be a lot to maintain, let alone clean... and you're all alone in here. It's worse than Walt thought. He puffs smoke."
karen,"There's these great places now, these communities where you don't have to worry about mowing the lawn or shoveling snow. People who are like you, alert, active, but are alone and would benefit by being with other folks their own age."
mitch,"Dad, take a look. We brought some pamphlets."
mitch,"I told you, I told you this was a bad idea."
karen,"I know, you were right."
mitch,Son of a bitch! He just won't let anyone help him.
karen,"Well, we tried. Now we can just drop it. No one can say we didn't try."
mitch,"To hell with him, kicking us out on his birthday?! We should've stayed home with Ashley and Josh. They knew better, they wouldn't even come. The goddamned kids are smarter than we are! Mitch screeches the tires as they take off. Walt waits for them to clear out, before coming out on the porch with a can of Pabst. Daisy comes out and lies at his feet. Walt covers his mouth as he coughs. A dime-sized circle of dark, red blood is left in the palm of his hand. Walt looks at the blood as he takes another sip of beer."
walt,"We miss Momma, don't we, Daisy. A vehicle pulls up to Tao's house. A party is in full swing. Sue comes out and helps the Hmong women unload big platters of food and carry them to the house. Sue catches Walt's gaze and steps over to his porch."
sue,"Hey, Walt, what are you up to? Walt points his index finger at the can of Pabst in his hand."
sue,We're having a barbecue. You want to come over?
walt,What do you think?
sue,There's tons of food.
walt,I'll bet. Just keep your paws off my dog.
sue,"No worries, we only eat cats."
walt,Really?
sue,"No, I'm kidding, you moron. Come on, come on over. You can be my special guest."
walt,"I'm fine right here. Walt reaches into the cooler for another beer. It's empty, just water and ice."
walt,Son of a bitch.
sue,"What have you had to eat today, Walt?"
walt,A piece of cake and some beef jerky.
sue,"Come on over and get something to eat. We've got beer, too. Walt exhales loudly --"
walt,"Oh, what the hell. It's my birthday, I may as well drink with strangers instead of myself. Walt gets up and walks with Sue towards her house."
sue,"Happy Birthday, Wally."
walt,Don't call me Wally.
walt,"You do have a lot of beer, but no Pabst."
sue,"As they say, When in Hmong."
walt,"Ha ha. Are you sure it's okay I'm here? Everyone keeps looking at me and when I look back, they look at the ground."
sue,It's fine. Phong appears from the crowd and points at Walt.
walt,What'd she say?
sue,She said welcome to our home.
walt,No she didn't.
sue,"No, she didn't."
walt,She hates me.
sue,"Yes, she hates you."
walt,What did I do? A little Hmong girl walks past and Walt pats her on the head. Everyone in the room looks in horror at Walt.
walt,What?! What the hell are all you fish heads looking at?! Sue looks around and then pulls Walt out of the room.
sue,Maybe we should go in the other room.
sue,"A lot of the people in this house are very traditional. Number one, never touch a Hmong person on the head, not even a child. Hmong people believe that the soul resides in the head, so don't do that."
walt,"That's dumb, but fine."
sue,Hmong people also consider looking someone in the eye to be rude. That's why everyone looks away when you look at them.
walt,Swell. Anything else?
sue,"Yeah, some Hmong smile or grin when they're yelled at or get into a confrontation. It's a cultural thing. It expresses embarrassment or insecurity, not that they're laughing at you."
walt,"Good God, you people are all nuts."
walt,"Hey, Sue."
sue,What?
walt,"You said you guys don't look you in the eye, but that guy keeps staring at me. Sue laughs and gestures to the Old Hmong Man. The Old Hmong Man steps over and nods to Walt."
sue,This is Kor Khue. He's the Lor family shaman.
walt,Witch doctor? Sue smiles and nods.
sue,Something like that. The Hmong hold their clan Shaman in very high regards.
walt,"Boo-ga, boo-ga. Kor Khue says something to Sue in Hmong. She turns and translates to Walt."
sue,"Kor Khue is interested in you, he heard what you did. He says he would like to read you."
walt,Huh?
sue,"He wants to read you. Tell you your soul. It'd be rude not to allow him this, it's a great honor."
walt,"Tell Kor to be my guest, fire away. Sue speaks Hmong to the Shaman. The Shaman responds and sits down across from Walt. He looks at Walt for a long time. Walt stares straight back at him. The Shaman mumbles to himself. Finally the Shaman turns to Sue and speaks very rapidly. As Sue translates, the Shaman watches Walt's reaction."
sue,Kor Khue says that you think you've been disrespected. You do not live your life. Your food has no flavor. You are scared of your past.
walt,Excuse me. Walt gets up and steps into the kitchen. He takes several deep breaths. He's pretty shook up.
walt,Je -- zuz -- Christ. Walt looks around at all the Hmongs eating and carrying on. Walt sees a young man give up his seat to an Elder. Walt sees a young woman go to each of the older folks and offer tea and cookies from a tray. Walt sees a child help an old man out of the bathroom. Walt coughs hard. He wipes blood from his lips. Sue comes in and looks at Walt.
sue,Are you okay? Walt brushes past her and goes into the bathroom.
walt, Son of a bitch. I've got more in common with these goddamned gooks than my own spoiled-rotten family.
walt,Happy birthday. Walt opens the bathroom door. Sue stands there with a concerned look on her face.
sue,Are you okay?
walt,Me? I'm fine.
sue,You were bleeding? Walt smiles disarmingly.
walt,"I just bit my tongue. I'm fine. I'm great. Let's get some of that gook food, I'm starving."
sue,"Come on, you glutton, let's go downstairs."
walt,Why?
sue,To mingle.
walt,I'm fine right here. I'm mingling.
sue,"Come on, you said not to leave you alone.'"
walt,Oh great.
sue,"Well, look who's over there."
walt,What's-his-name who tried to steal my Gran Torino.
sue,My brother Tao.
walt,"Yeah, Toad. Tao is in the corner, he avoids Walt's gaze. Sue walks over to a group of boys, leaving Walt alone. Walt doesn't know what to do with himself. He leans against the DRYER. The DRYER wobbles. Walt gets on his hands and knees. He looks under the dryer. He adjusts the short leg to balance out the machine. He just can't help it. All the Hmong kids watch Walt, trying not to laugh at this strange white man on his hands and knees fixing a dryer during a party. Walt looks up -- deer in the headlights."
walt,"It was wobbly, but I fixed it. It's fine now, shouldn't wobble anymore. The Hmong kids look away, covering their mouths with their hands. Walt glares at Tao, who immediately wipes the smile from his face. Sue walks over and hands Walt a drink."
walt,What's this?
sue,Rice liquor. Try it.
walt,"Alright. Sue walks off. Walt sips his rice liquor and watches the interaction between the boys and girls. One particularly gorgeous young willow-wisp of a GIRL stares across the room at Tao. Tao looks back at her, but then looks away. The Girl keeps looking at Tao, smiling and twisting her hair. Tao doesn't approach her, but three other young men do. They do their best to charm her. She's polite, but not interested, she keeps looking at Tao. Walt laughs at Tao's ineptitude, shakes his head at this wasted opportunity. Suddenly the Girl steps over to Walt. She smiles --"
walt,"Good question. What am I doing here? Anyways, I'm Walt."
wa xam,"Hi, Walt. I'm Wa Xam."
walt,Wa Yum?
wa xam,"No, Wa Xam. So... what do you do?"
walt,Me? Not too much... I fix stuff I guess.
wa xam,Like what?
walt,"Well, I fixed my wife's friend's sink yesterday."
wa xam,You're funny.
walt,"That's one thing I've never been accused of. A bastard, yes. Funny, no. Wa Xam laughs."
wa xam,"Well, have fun. I'm going to take off."
walt,"A pleasure to meet you, Yum Yum. She laughs at Walt butchering her name and goes upstairs. The three young suitors follow her up. Tao watches her. Walt comes over to Tao, who is startled. Walt laughs."
walt,"Relax, zipper head, whatta you think I'm gonna do, shoot you? Tao looks like he wants to run away."
walt,"I wouldn't say anything either, if I was you. Walt sips his rice liquor. Walt can't help but rib Tao."
walt,"You know, I knew you were a dipshit even before the whole garage deal, but I have to say you're even worse with women than you are stealing cars, Toad."
tao,It's Tao.
walt,What's that?
tao,"It's Tao, not Toad. My name is Tao."
walt,"Good for you. Anyways, you're blowing it with that girl. Not that I give two shits about a Toad like you."
tao,You don't know what you're talking about.
walt,"Wrong, egg roll. I completely know what I'm talking about. I know I'm not always the most pleasant person to be around, but I got the greatest woman who ever lived to marry me. I had to work at it, but I got her and it was the best thing that ever happened to me. Hands down. Walt points across the room. He sways slightly."
walt,"But you? You just sit there and watch as Ding Dong and Click Clack and Charlie Chan walk away with what's-her-face. She likes you, you know."
tao,Who?
walt,"She was standing over there, orange dress, twisting her hair and smiling at you."
tao,You mean Wa Xam? Walt takes a long swig off his drink and nods.
walt,"Yeah, yeah. Anyways, she likes you, I know, I talked to her. Great girl, charming girl. Love her. I love Yum Yum. But you? You just watch her walk out the door with the Three Stooges. Why? Because you're a big fat pussy! Walt drains his drink."
walt,"I gotta go home. Good luck, puss- cake. You need it."
walt,No. No thanks. No more flowers. The elderly Hmong Women nod and speak rapid sentences in Hmong to Walt. He has no idea what they are saying.
walt,"No more. Please, keep your flowers. The Hmong women nod, smile and chatter away, ignoring Walt. They walk past him and set the BOUQUETS on his porch."
walt,"What now, Gee? Gee holds up a plate covered with tinfoil."
walt,No. Forget it. Stop bringing me stuff. Gee scolds Walt in Hmong.
walt,No. I've had it. Gee opens the corner of the tinfoil. Walt looks at the food.
walt,I can't. You have to stop. Gee pulls the tinfoil off. Walt gazes at the food.
walt,Is that the chicken dumpling thing you brought the other day?
walt,What now? What? Vu rambles on in Hmong. Walt looks at his watch. He looks at Sue for the translation.
sue,"Tao is here to make amends, he's here to work for you."
walt,No he's not.
sue,Mother says that Tao dishonored the family and now he has to work off his debt. He'll start tomorrow morning.
walt,"No. The kid is useless, I don't even want him on my property. I thought we already went over that."
sue,It's very important to my mother that you accept. It'd be an insult to refuse.
walt,How is this all of a sudden turned around on me? The goddamned kid tries to steal my car and somehow I'm the bad guy if I don't accept?
sue,My family is very traditional and it will very much upset them if you don't let Tao repay... Tao interrupts from the sidewalk...
tao,"Come on, Sue. If he doesn't want to, let's just go. Sue and Vu yell at Tao to shut up at the same time; Sue in English, Vu in Hmong."
walt,Fine. Great. Tomorrow. Walt walks past them and into his house.
walt,"Jesus, Joseph and Mary. These Hmong broads are like badgers."
walt,"Son of a bitch, I didn't think he'd show. Walt waves Tao over. Tao barely looks at Walt."
walt,Okay. What are you good at?
tao,Like what?
walt,That's what I'm asking. What are you good at?
tao,I don't know.
walt,"That's about what I expected. Okay, why don't you go over by the spruce tree and count how many birds feed at the bird feeder."
tao,Count the birds?
walt,"Yeah, you can count? You slopes are supposed to be good at math, right?"
tao,"Yes, I can count."
tao,You want me to do that?
walt,No.
tao,Why not?
walt,"I want it done right, that's why."
tao,"But you've got me just standing here. What am I supposed to be doing, anyway?"
walt,Scaring away crows. Tao shoots Walt a dirty look.
walt,"It's a perfect job for you, plus you people don't seem to mind squinting in the sun all day."
tao,What do you have for me today? You want me to watch paint dry or maybe count the clouds that pass by?
walt,"Don't get flip with me, zipper head. I ain't the one who tried to steal and don't forget it."
tao,Go ahead. I don't care if you insult me and say racist things. I'll take it.
walt,"That I know. You have no teeth, kid. That's your problem. You have no balls."
tao,"Look, I'm stuck here. Why don't you give me something useful to do."
walt,"Because unlike you I'm not useless. I maintain my property, whereas you swamp rats let your houses go to hell. Walt looks across the street at one very dilapidated house."
walt,Wait a minute... How long do I have you for? Tao pauses... he doesn't want to answer.
walt,"How long, Toad?"
walt,Go get my ladder out of the garage.
walt,"When you're done caulking the siding, nail that gutter back up, I can see it right out my kitchen window, it's been bugging me for three years. The neighbor says something in Hmong to Walt."
walt,"You said it, brother."
grandson,Grandpa says he want to know if you can have Tao clear out the big wasp nest under our porch? Walt reaches in his pocket and studies a small note pad.
walt,I don't see why not.
walt,"Jesus Lord almighty, knock it off."
tao,"It's my last day, whatta you want me to do?"
walt,"Take the day off, you've done enough."
walt,"Toad. Tao turns around. Walt wants to say something, but stops."
walt,"Nothing, never mind. Walt shuts the door."
asian doctor,Mr. Kowalski?
walt,That's right.
asian doctor,Good afternoon. I looked over your paperwork and I think we should immediately start on a full battery of tests. I feel that this...
walt,"Wait a minute. Where's my regular doctor, where's Dr. Fellman?"
asian doctor,"Dr. Fellman retired three years ago. I'm his replacement, Dr. Chang."
walt,Jesus Christ.
ashley,It's Grandpa Walt.
karen,"Well, pick it up."
ashley,You talk to him.
karen,Mitch?
mitch,I'm doing bills here.
karen,He's your father. Ashley hands him the phone and he pushes the TALK button.
mitch,"Hello, Dad."
mitch,I know. What's up? The CAMERA INTERCUTS BETWEEN Mitch in his huge kitchen and Walt sitting on the edge of his bed.
walt,"Um... not much, how about you?"
mitch,"I'm fine, fine."
walt,Fine. That's fine... How about the kids and Karen?
mitch,Everyone is fine.
walt,"Good. There is a long, uncomfortable pause. Walt looks at some Xeroxed medical pamphlets scattered on his bed."
mitch,Good.
walt,"Well, that's good... How's... work?"
mitch,Busy.
walt,Right. I s'pose.
mitch,"Speaking of busy, I have a lot on my plate right now, unless there's something pressing. Walt looks at a pale, blue pamphlet. Mitch looks at his housekeeping bill."
walt,No. Nope. Another pause.
walt,Okay then.
mitch,"Okay. Yeah, so it's not a good time right now. Why don't you call me over the weekend."
walt,Sure.
mitch,"Okay, it was nice talking to you, bye, Dad. Walt hangs up. He lies down on his bed."
walt,"Hey, moron. Tao is startled and almost falls off the ladder."
tao,What?
walt,"I appreciate you're doing something on your own, but you're the only person I know dumb enough to get himself killed trimming tree branches."
tao,What now?
walt,"You don't stand on the top step of a ladder and if you cut through that branch you're hacking away at, you'll end up kaput. Tao looks and sure enough -- a thick, black POWER LINE is five feet below the branch he's almost severed."
walt,"Go grab the extension ladder from my garage and I'll show you how to do it right, zipper head."
walt,Looks good. Good job. Tao nods.
walt,Make sure you put the ladder back when you're done raking up the leaves.
tao,"I know. I will. Walt walks back over to his porch, grabs a Pabst from the cooler and watches Tao rake. A white Honda turns the corner and drives slowly past Tao. Smokie and Spider smile menacingly at Tao as they pass."
walt,"This kid doesn't have a chance. The Honda now slowly passes Walt's house. Walt just stands there, sipping his beer. The Honda slows to a stop and the gangbangers glare at Walt. The REAR WINDOW of the Honda opens. Walt holds out his RIGHT HAND like a GUN. He closes one eye to better aim his imaginary gun and moves his thumb several times as if firing. Bang -- bang -- bang. The Honda takes off. Walt watches it drive off and lights another cigarette. Walt doesn't notice, but Tao witnessed this whole interaction from his yard."
tao,What do you know about faucets? Walt stares at him for a second and then laughs.
walt,For the love of Pete.
tao,What?
walt,"It must be a hundred degrees in here, turn on the fan. Tao flips the switch on the CEILING FAN, the fan wobbles and shakes, it looks like it's about to fly off. Walt stares up at the fan and shakes his head."
tao,"Man, where did you get all this stuff?"
walt,What are you talking about?
tao,All the tools and stuff.
walt,"Where the hell do you think I got them, Toad? This may come as a shock to a thief, but I actually bought the things I have with money I earned."
tao,"Yeah, yeah, yeah, that's not what I meant. There's just so much shit packed in here."
walt,You need the right tool for the right job. Every single thing here has a purpose.
tao,"Okay, what's this? Tao points to a tool."
walt,"Post hole digger. Tao starts pointing at things on the workbench in quick succession, questioning Walt with his expression."
walt,"Hand spade. Tin snips. Nail punch. Tack hammer. Putty knife. Wire stripper. Drywall saw. Tile spacers. Silence. Walt can see something is bothering Tao, but he's too uncomfortable to speak up --"
walt,What?
tao,I can't afford to buy all this stuff.
walt,"I didn't buy all this stuff at once, blockhead. I've lived here for fifty years. A man stays in one place long enough he tends to attract a decent set of tools."
tao,"Yeah, but..."
walt,"Look, kid, I think I know where you're going with this. You don't need everything to maintain a house. I'm going to let you in on a little secret. Walt rattles around his tool bench and slaps down THREE items in quick succession."
walt,"This is for you. Roll of duct tape, can of WD-40 and a pair of vise-grips. Any man who's worth a shit can do half his household jobs with these three things. In the odd chance that doesn't work out, you can borrow something."
tao,Okay. Cool. Walt coughs and covers his mouth. Both Tao and Walt see the spot of BLOOD in his hand.
tao,What's with that?
walt,What's with what?
tao,"The blood you just coughed up. That's not good, you should see a doctor. Walt quickly changes the subject -- while tightening the screws that hold the fan blade to the motor hub."
walt,So... what exactly was the deal with those guys out on my lawn that night? Who are they?
tao,A gang. Hmong gangbangers.
walt,I gathered that. What did they want with you?
tao,They wanted to take me away because I blew my first initiation.
walt,"You joined up with those pukes? Damn, you are a pussy. Why in the hell did you do that?"
tao,I don't know. They were persuasive. My cousin's in the gang. They just talked me into it I guess.
walt,"Well, at least you're honest about it. A LONG SILENCE. Walt finishes fixing the ceiling fan."
walt,So how'd you blow your first initiation? Tao nods towards the GRAN TORINO.
walt,The Gran Torino? Tao nods. Walt laughs.
walt,Christ all Friday.
karen,"See you later, I'm taking the kids to the mall. Mitch never looks up from the TV."
mitch,"Yeah, fine. Just don't spend too much goddamned money."
karen,I will. We hear Karen and the kids exit.
mitch,Thank God. Finally get the house to myself for once. The PHONE RINGS. Mitch looks at the Caller ID. It says; Dad. Mitch almost doesn't pick it up...
mitch,Hello.
mitch,"Hey, Dad. What's up? The CAMERA INTERCUTS BETWEEN Walt in his small kitchen and Mitch in his huge den."
walt,Well... I... um... I'm getting the old Westinghouse up out of the basement. Mitch mouths the word Shit.
mitch,Uh-huh.
walt,So... I got it on the dolly.
mitch,"Yeah, that'll help."
walt,Yeah... And it's a bit heavy... for one guy.
mitch,Uh-huh.
walt,Yeah... I need a hand.
mitch,Oh.
walt,So are you busy?
mitch,Does it have to be done right this second? It's been down there for years.
walt,"Well... Yeah, I'd like to get on it."
mitch,Does it work? We were thinking about getting a freezer. What are you going to do with it?
walt,Giving it to Aunt Mary.
mitch,Oh... Can't she give you a hand?
walt,She's eighty-one.
mitch,"I know, I was joking... What does she need it for?"
walt,To freeze food. Mitch opens another beer.
mitch,"Yeah, well, I'd love to help you out, Dad, but I'm just walking out the door. I have to bring the kids to the mall. Sorry."
walt,Uh-huh.
mitch,Why don't you call Stevie?
walt,Your brother lives out of state.
mitch,"Well, I don't know what to tell you, I'm on my way out. Keys in my hand."
walt,Okay then.
mitch,"If you can't find anyone by next week, give me a call. Walt nods and hangs up. Mitch hangs up and takes a sip of beer."
mitch,Aunt Mary. Like she needs a freezer.
walt,"You got a minute, Toad?"
walt,"I just need a little push. All the weight is up top, so you stay down and give me a little shove at each step."
tao,Let me take the top.
walt,"Naw, I got it."
tao,"No really, I'll take the top. It looks pretty heavy."
walt,I'm not crippled. I got it.
tao,"If you don't let me take the top, I ain't helping. I'll go home."
walt,"Listen, zipper head, now's not the time to go and..."
tao,"You listen, old man. You came and got me because you needed help, so let me help you. Either it's top or I'm out of here. Walt studies Tao for a second. Tao doesn't blink, he holds his ground. Walt nods, trying not to grin."
walt,"Okay then, be my guest. Just don't let it slip out of your little girl hands and crush me. Tao laughs."
tao,Don't give me any ideas.
tao,That thing weighs a ton.
walt,"Yeah, but it runs like new. They don't make them like that anymore."
tao,What are you going to do with it?
walt,Sell it. I haven't used it in years and it was always in the way down there.
tao,How much?
walt,"Oh, I don't know. Sixty bucks, maybe. Why, you need a freezer?"
walt,Twenty-five and it's yours.
tao,Twenty-five? You just said sixty?
walt,Save me from wasting money on putting an ad in the paper.
sue,"Kind of ironic, huh?"
walt,What?
sue,What the hell do you think I'm referring to? Toad washing the car he tried to steal from you.
walt,"It seems like justice to me. And if he misses a spot, he's doing it all over."
sue,It's nice of you to kind of look after him like this. He doesn't have any real role models in his life.
walt,I ain't a role model.
sue,"You're a good man, Wally. I wish our dad would have been more like you."
walt,Don't call me Wally.
sue,"No, I'm serious. He was hard on us, really traditional, really old school."
walt,I'm old school.
sue,"Yeah, but you're American."
walt,What's that supposed to mean? Sue shrugs him off. They look at Tao for awhile.
sue,"You like him, don't you?"
walt,Him? Don't be crazy. He tried to steal my car.
sue,And you spend time with him and you teach him how to fix things and you saved him from that fuck cousin of ours and...
walt,Hey. Watch the language.
sue,And you're a good man.
walt,"Hand me a beer, Dragon Lady. Sue hands him a beer and Walt pops the top."
walt,So tell me the problem with Hmong boys again. I'm not completely clear.
sue,"Hmong girls slip in and out of the culture more easily. Date who we want, stay close to our mothers, but are able to keep a foot on each side of the fence. The boys fall through the cracks."
walt,Why?
