Speaker,Dialogue
burt,"That dog attacked my boy for no reason. Just got it into his mind one day. Same with John Coffey. He was sorry afterwards, of that I have no doubt...but those little girls stayed raped and murdered nonetheless. Maybe he's never done it before--my dog never bit before, but I didn't concern myself with that. I went out there with my rifle and grabbed his collar and blew his brains out."
paul,I'm sorry for your trouble.
burt,"I'm as enlightened as the next man, Mr. Edgecomb. I would not bring back slavery for all the tea in China. I believe we have to be humane and generous in our efforts to solve the race problem. But we have to remember that the negro will bite if he gets the chance, just like a mongrel dog will bite if it crosses its mind to do so.  Is Coffey guilty? Yes, he is. Don't you doubt it, and don't you turn your back on him. You might get away with it once or even a hundred times...but in the end..."
burt,You understand?
burt,I'm gonna have to tear that old doghouse down one of these days.
paul,"No, it's not for you."
del,Oh. Oh my.
coffey,I'm smelling me some cornbread.
paul,It's from my missus. She wanted to thank you.
coffey,Thank me for what?
paul,You know. For helping me.
coffey,Helping you with what?
coffey,Ohhh.  Was your missus pleased?
paul,Several times.
coffey,This all for me?
del,"Oh my. John, I can smell it from here. I surely can."
coffey, Can I give some to Del?
paul,"It's yours, John. You do with it as you please."
coffey,Here's for Del and Mr. Jingles then.
billy,"Hey! What about me? I'm'a get some too, ain't I"
paul,"It's yours, John. As you please."
coffey,"Well. Fine. I think I'll keep the rest, then."
paul,Courtesy of the gentleman across the way.
del,"Oh, John. So very fine of you. So very kind. Mr. Jingles t'ank you."
coffey, ...wel'cm...
billy,"Hey! What about me? Don't you hold out on me, ya big dummy nigger!"
paul,You'll keep a civil tongue on my block.
paul,You get that one for free. But that's the last one.
billy,"That's it? Just that little bitty one? Guess I'll have to pay out for the rest, huh?"
billy,"Yeehaaw! Good shot, weren't it? Oh, the look on your face!"
harry,You believe this? Son of a bitch pissed on me!
billy,"Hey, d'jall like that? I'm currently cooking some turds t'go with it! Nice soft ones! I'll have 'em out t'yall tomorrow!"
paul,We've been looking to clear that room out anyway.
billy,"Hey! Whassit now, movin' day? Y'all wanna come in and dust a little? Y'can shine my knob for me while yer at it!"
billy,"You can come in here on your legs, but you'll go out on your backs, Billy the Kid guarantee ya that.  C'mon, fuckstick. No sneakin' up on me this time. We'll go man to man, see who's the better fel--"
paul,"C'mon, Wild Bill. Little walky walky."
billy,Don't you call me that! Wild Bill Hickock wasn't no range rider! He was just a bushwackin' John Law! Dumb sonovabitch sat with his back to the door and kilt by a drunk!
brutal,"Oh, my suds and body! A history lesson! You just never know what you're gonna get when you come to work everyday on the Green Mile. Thank you, Wild Bill."
billy,"Oh, not in there! C'mon now, I'll be good! Honest Injun I will! No! No! Ummmmhhhh...urg...ah!"
harry,"Holy Christ, he's pitchin' a fit!"
paul,"He'll be fine, boys. Trust me on this one."
billy,"ALL I WANTED ME WAS A LITTLE CORNBREAD, YOU MUTHERFUCKERS!"
billy,I learnt my lesson. I'll be good.
billy,Pssss. Hey. Give'ya nickel for that Moon Pie.
billy,"Li'l Black Sambo, yassuh, boss, yassuh, howdoo you do?"
brutal, Hope your bags are packed.
paul,The Moon Pie thing was pretty original. Gotta give him that.
paul,"Del, grab your things. Big day for you and Mr. Jingles."
del,Whatchoo talkin' bout?
paul,"Important folks heard about your mouse, wanna see him perform. Not just guards, either. One of them's a politician all the way from the state capital, I believe."
del,You fellas comin'?
harry,"We got other fish to fry just now, Del, but you knock 'em for a loop."
coffey,"You knock 'em for a loop like Mr. Harry says, Del."
paul,"Let's move along briskly, folks. There's not much time."
toot,"I'm sittin' down, I'm sittin' down, I'm sittin' down."
earl,"Been sweepin' floors here ten years, never had to wear no damn tie before."
bill,"You're a V.I.P. today, Earl, so just shut up."
del,Messieurs et mesdames! Bienvenue au cirque de mousie!
percy,Roll on two.
van hay,That's that.
paul,Very good. Very professional.
paul,Well?
del,They love Mr. Jingles! They laugh and cheer and clap they hands!
percy,"Well, that's just aces. Pop back in your cell, old-timer."
brutal,"Percy, you shit."
percy,"Del! Hey, you numb wit, I didn't mean nothin' by it! You all ri--"
billy,"Ain't you sweet. Soft. Like a girl. I druther fuck your asshole than your sister's pussy, I think."
paul,Wharton!
billy,"I let 'im go, I'us just playin' and I let 'im go! Never hurt a hair on his purty head!  ...oooh, but smell you."
del,"Lookit, he done piss his pants! Look what the big man done! He bus' other people wid 'is stick, mais oui some mauvais homme, but someone touch him, he make water in his pants jus' like a baby!"
brutal,"Shut up, Del."
percy,"You talk about this to anyone, I'll get you all fired. I swear that to God."
paul,"What happens on the Mile, stays on the Mile. Always has."
percy,"You keep laughing, you French- fried faggot. You just keep laughing."
paul,"What about Dean? He's got a little boy would love a pet mouse, I bet."
del,"How could a boy be trust wid Mr. Jingles? Maybe forget to feed him. And how he keep up wid his trainin', just a boy, n'est-ce pas?"
paul,"All right, I'll take him."
del,"T'ank you kindly, merci beaucoup, but you live out in the woods, and Mr. Jingles, he be scared to live out dans la foret."
paul,He whisper that in your ear?
brutal,How about Mouseville?
del,Mouseville?
brutal,"Tourist attraction down in Florida. Tallahassee, I think. Is that right, Paul? Tallahassee?"
paul," Yeah, that's right. Tallahassee. Just down the road apiece from the dog university."
brutal,You think they'd take Mr. Jingles? You think he's got the stuff?
paul,Might. He's pretty smart.
del,Hey! What dis Mouseville?
brutal,"Tourist attraction, I said. They got this big tent you go into--"
del,Like a cirque? You have to pay?
brutal,"You shittin' me? Course you pay. Dime a piece, two cents for the kids. And inside the tent there's this mouse city made out of boxes and toilet paper rolls..."
brutal,"...plus they got the Mouseville All-Star Circus. There's mice that swing on trapeze, mice that roll barrels, mice that stack coins..."
del,Dat's it! Dat's da place for Mr. Jingles! You gonna be a circus mouse after all! Gonna live in a mouse city down in Florida!
brutal,"Percy, no!"
percy,"Knew I'd get him sooner or later. Just a matter of time, really."
coffey,Give'm to me.
coffey,Give'm to me. Might still be time.
brutal,What are you doing?
brutal,"Paul, what the hell--"
del,"Please, John. Oh Johnny, help him, please help him, s'il vous plait."
brutal," Oh, dear Jesus. The tail. Look at the tail."
dean,What did you do?
coffey,I helped Del's mouse. He a circus mouse. Goan live in a mouse city down in...down in...
brutal, Florida?
coffey,"Boss Percy's bad. He mean. He step on Del's mouse.  I took it back, though."
paul,"Brute, come along with me.  You fellas go on back to you cribbage game."
percy,Don't start in on me. It was just a mouse. Never belonged here in the first place.
paul,The mouse is fine. Just fine. You're no better at mouse-killing than anything else around here.
percy,You expect me to believe that? I heard the goddamn thing crunch.
paul,Aren't you glad Mr. Jingles is okay? After all our talks about how we should keep the prisoners calm? Aren't you relieved?
percy,What kind of game is this?
paul,No game. See for yourself.
percy,"You switched them! You switched them somehow, you bastards!"
brutal,I always keep a spare mouse in my wallet for occasions such as this.
percy,"You're playing with me, the both of you! Just who the hell do you think you are--"
paul,"We're the people you work with, Percy, but not for long. I want your word."
percy,My word?
paul,"I put you out front for Del, you put in your transfer to Briar Ridge the very next day."
percy,What if I just call up certain people and tell them you're harassing me? Bullying me?
paul,Go ahead. I promise you'll leave your share of blood on the floor.
percy,Over a mouse? You think anyone's gonna give two shits?
paul,"No. But four men will swear you stood by while Wild Bill tried to strangle Dean to death. About that people will care, Percy. Even your uncle the governor will care."
brutal,"Thing like that goes in your work record. Work record can follow a man around a long, long time."
paul,"I put you out front, you put in your transfer. That's the deal."
paul,"You make a promise to a man, you shake his hand."
del,"Hey, boys. Say hi, Mr. Jingles."
paul,"Eduard Delacroix, will you step forward?"
del,Boss Edgecomb?
paul,"Yes, Del?"
del,"Don' let nothin' happen to Mr. Jingles, okay?"
del,"Here, take him."
paul,Del. I can't have a mouse on my shoulder while...you know.
coffey,"I'll take him, boss. Jus' for now. If Del don' mind."
del,"Yeah, you take 'im, John. Take him til' dis foolishment done--bien!  After, you take him down to Florida? To dat Mouseville?"
brutal,"We'll do it together, most likely. Maybe take a little vacation time."
del,"People pay a dime apiece to see him. Two cents for the kiddies. Ain't dat right, Boss Howell?"
brutal,"That's right, Del."
del,"You a good man, Boss Howell. You too, Boss Edgecomb. Wish I could'a met you bot' someplace else."
del,"Au revoir, mon ami. Je t'aime, mon petit."
fat lady,"Hope he's good and scared. Hope he knows the fires are stoked, and that Satan's imps are waiting."
percy,Roll on one.
coffey,"You be still, Mr. Jingles. You be so quiet and so still."
percy,"Eduard Delacroix, you have been condemned to die by a jury of your peers, sentence imposed by a judge in good standing in this state. You have anything to say before sentence is carried out?"
del,"I sorry for what I do. I give anything to take it back, but I can't. God have mercy on me.  Don' forget 'bout Mouseville."
percy,"No such place. That's just a fairy tale these guys told you to keep you quiet. Just thought you should know, faggot."
percy,"Electricity shall now be passed through your body until you are dead, in accordance with state law. God have mercy on your soul."
percy,Roll on two.
paul,It's dry!
paul,JACK!
brutal,Don't you tell him to stop. Don't you do it. It's too late for that.
billy,"HE'S COOKIN' NOW! THEY COOKIN' HIM GOOD! NEAR ABOUT DONE, I RECKON!"
witnesses,"What the hell's happening to him?...Are those clamps going to hold?...Christ, the smell!...Is this normal?"
van hay,SHOULD I KILL THE JUICE?
paul,"NO! ROLL, FOR CHRIST'S SAKE, ROLL!"
paul,No water! No water! You crazy?
fat lady,"Stop it, stop it, oh can't you see he's had enough?"
hal,Why don't you shut it down?
paul,He's still alive! You want me to shut down while he's still alive?
paul,"You watch, you son of a bitch!"
paul,Kill it!
brutal,"You do it. You're running the show, ain't you?"
hal,"It's all right, folks, it's all under control. Just a power surge from the storm, that's all, nothing to worry about..."
paul,"Dean, get doc's stethoscope."
man,Oh my God! Is it always like this? Why didn't somebody tell me? I never would have come!
percy,I didn't know the sponge was supposed to be wet--
paul,"Brutal, no!"
brutal,"What do you mean, no? How can you say no? You saw what he did!"
paul,"Delacroix's dead, nothing can change that, and Percy's not worth it!"
brutal,So he just gets away with it? Is that how it works?
hal,"What the fuck was that? Jesus Christ, three witnesses puked all over the floor up there! And the smell! I got Van Hay to open both doors, but that smell won't come out for five damn years, that's what I'm betting! And that asshole Wharton is singing about it! I can hear him!"
paul," Can he carry a tune, Hal?"
hal,"Okay, boys. Okay. Now what the hell happened?"
hal,Percy? Something to say?
percy,I didn't know the sponge was supposed to be wet.
hal,How many years you spend pissing on the toilet seat before somebody told you to put it up?
paul,"Percy fucked up, Hal. Pure and simple."
hal,Is that your official position?
paul,Don't you think it should be?
paul,"He'll be putting in a transfer request to Briar Ridge tomorrow. Moving on to bigger and better things. Isn't that right, Percy?"
hal,"You're a little asshole, and I don't like you a bit.  Have that transfer request on my desk first thing."
billy," Barbecue! Me and you! Stinky, pinky, phew-phew-phew! Weren't Billy or Jilly or Hilly or Roy--it was a French-fried faggot named Delacroix!"
paul,You're about ten seconds away from spending the rest of your life in the padded room.
coffey,Poor Del. Poor old Del.
paul,"Yes. Poor old Del. John, are you okay?"
coffey,I could feel it from here.
paul,What do you mean? You could hear it? Is that what you mean?
coffey,"He's out of it now, though. He's the lucky one. No matter how it happened, Del's the lucky one."
paul,Where's Mr. Jingles?
coffey," Awful tired now, boss. Dog tired."
paul,"Me too, John. Me too."
paul,I hate this.
jan,I know.
hal,She's having one of her good days. I thank God for that.
paul,What a bad day?
hal, Sometimes she's...not herself anymore. She swears.
paul,Swears.
hal,"It just pops out, the most awful language you can imagine. She doesn't even know she's doing it. I didn't know she'd ever heard words like that...and to hear her say them in her sweet voice...  I'm glad she's having a good day, Paul. I'm glad for you and Jan."
jan,"Honey? If you don't say what's on your mind, I'm afraid I'll have to smother you with a pillow."
paul,I'm thinking I love you. I'm thinking I don't know what I'd do if you were gone.
jan,Oh.
paul, I'm also thinking I'd like to have the boys over tomorrow.
the men," Ma'am, you sure know how to fry up some fine chicken...Brutal, don't hog the taters now...Try that corn yet? It's something special..."
paul,You saw what he did with the mouse.
brutal,I could'a gone the rest of the day without you bringing that up.
dean,I could'a gone the rest of the year.
paul,He did it to me too. He put his hands on me and took my bladder infection away.
jan,"When he came home, he was...all better."
dean,You're talking about an authentic healing. A praise-Jesus miracle.
paul,I am.
brutal,"If you say it, I accept it. But what's it got to do with us?"
jan,"Melinda? Oh, Paul..."
brutal,Melinda? Melinda Moores?
jan,You really think you can help her?
paul,"It's not a bladder infection, or even a busted-up mouse. But there might be a chance."
harry,Hold on now. You're talking about our jobs. Sneak a sick woman onto a cellblock?
paul,"Hal would never allow that. You know him, he wouldn't believe something unless it fell on him."
brutal,"So you're talking about taking John Coffey to her. That's more than just our jobs, Paul."
dean,Damn right. That's prison time if we get caught.
harry,"Let's not discuss this like it's even an option. Brutal, help me out here..."
brutal,I'm sure she's a fine woman...
jan,The finest.
paul,"What's happening to her is an offense, Brutal. To the eyes and the ears and the heart."
brutal,I have no doubt. But we don't know her like you and Jan do...do we?
paul,That's why it's a lot to ask.
harry,"It is. Let's not forget Coffey's a murderer. What if he escapes? I'd hate losing my job or going to prison, but I'd hate having a dead child on my conscience even more."
paul,"I don't think that'll happen...  ...in fact, I don't think he did it at all."
paul,I just can't see God putting a gift like that in the hands of a man who would kill a child.
dean,"Well, that's a tender notion, but the man's on death row for the crime. Plus, he's huge. If he tried to get away, it'd take a lot of bullets to stop him."
brutal,"We'd all have shotguns in addition to sidearms. I'd insist on that.  He tried anything, we'd have to take him down. You understand."
paul,I understand.
brutal, So. Tell us what you had in mind.
brutal,I was never here.
orderly,"Shit, for five bucks, you was never nowhere."
brutal,Fellas thirsty? Fresh out of the icebox.
dean,"Oh, thanks. That's swell."
harry,"Yeah, hot in here."
billy,"Hey. Hey, I'm'a get some too."
brutal,My ass you get some too.
paul,You think you deserve any?
harry, Day report says he's been okay.
billy,"Hell, yes, I been behaved. C'mon, now, don't be stingy hogs."
paul,You gonna stay behaved?
billy,"C'mon, you clunk, gimme that."
paul,"You promise me, or I'll drink it myself right here in front of you."
billy,"C'mon now, don't be that way. I be good."
paul,Cup.
billy,We'll break out the fire hose and take it anyway. And you will have drunk your last R.C. cola. Unless they serve 'em down in hell.
paul,"Anybody wants to back out, now's the time. After this, there's no turning back.  So? We gonna do this?"
coffey,Sure. I'd like to take a ride.
brutal, Guess were all in.
percy,What is this?
paul,Payback.
percy,Let go of me! Let go!
paul,"Settle down, Percy!"
brutal,"Oooo, Poicy! What would your mother say?"
percy,"Let go, you ignoramus! I know people! Big people!"
paul,"So you've said. C'mon, stick out your arms like a good boy."
percy,I won't. And you can't make me.
brutal,"You're dead wrong about that, you know."
brutal,You gonna put your arms up? I'll rip your ears off. Use 'em for tea caddies. You know I will.
paul,"The man's ripping your ears off, Percy. I'd do as he says."
percy,"Please, Paul. Don't put me in with Wild Bill. Please."
paul,You would think that.
brutal,"You'll get 'em back, don't worry."
percy,That's more than I can say about your jobs. All your jobs! You can't do this to me! You can't!
paul,Let you in on a little secret. We can and we are.
paul,"You're going to have a few hours of quiet time now, so you can reflect on what you did to Del."
brutal, ...uk-uk-uk-uk!
paul,One more time--what do you say if somebody comes by?
dean,"Coffey got upset, so we put him in the restraint room. They hear any noise, they'll think it's him."
coffey,We goan for the ride now?
paul,That's right.
paul,What about us?
dean,"You're over in Admin, going over Del's file. Brutal and Harry are in the laundry doing their wash--"
billy, Where you fink you're goin'?
coffey,You're a bad man.
billy,"S'right, nigger. Bad as you'd want."
billy,Whooeee. Whole room's spinning. Like I'm shit-ass drunk. I have me some shine or what?
billy,"Niggers oughtta have they own 'lectric chair. White man oughtn't havta sit in no nigger 'lectric chair, nossir..."
coffey,He's a bad man.
coffey,"They're still in there. Pieces of them, still in there. I hear them screaming."
paul,"John, come along! Right now, y'hear? C'mon! Toward that door!"
paul,Lie down on this.  It'll be easier for you and no harder for us.
coffey,Say. This is fun.
coffey,"Look, boss! It's Cassie, the lady in the rocking chair!"
paul,"Shhh. John, you have to be quiet now."
coffey, You see her? You see the lady?
brutal,"We see her, John."
paul,"C'mon, big boy, keep moving."
brutal,How far is it?
harry,Just up ahead...
coffey,"Hey there, little firefly. Where's Mrs. Firefly this evening?"
coffey,"Oh, there you is. You come out to play too?"
paul,They seem...drawn to you.
coffey,"I love 'em, is why. They don't think no hurtful thoughts. They's just happy to be. Happy little lightning bugs..."
paul,"C'mon, big boy. Upsy-daisy."
paul,John? Do you know where we're taking you?
coffey,Help a lady?
paul,That's right. Help a lady. But how did you know?
coffey,"Dunno. Tell the truth, boss, I don't know much'a anything. Never have."
coffey,"Bye, fireflies. Bye."
brutal,We can still turn back.
coffey,"Boss, look. Someone's up."
brutal,"This is a mistake. Christ, Paul, what were we thinking?"
paul,"Too late now. Harry, keep John here until we call you."
hal,Who the hell goes there at two- thirty in the goddamn morning?
paul,"Hal, it's us! It's Paul and Brutal--it's us!"
hal,"Paul, what are you doing here at this hour? Jesus, it's not a lockdown, is it? Or a riot?"
paul,"Hal, God's sakes, take your finger off the trigger..."
hal,Are you hostages? Who's out there? Who's by that truck?
hal,John Coffey! Halt! Halt right there or I shoot!
paul,No one's hurt. We're here to help.
hal,Help what? I don't understand. Is this a prison break?
paul,I can't explain what it is. You just have to trust me.
hal,What do you...want?
melinda,Hal! Make them go away! No salesmen in the middle of the night! No Fuller brushes! No French knickers with come in the crotch! Tell them to take a flying fuck in a rolling d...d...
coffey," Just to help. Just to help, boss, that's all."
hal,You can't. No one can.
hal,Don't you go up there! Don't you do it!
coffey,"Boss, you just be quiet now and let me be."
melinda,"Oh, so big! Pull down your pants! Let's have a look!"
melinda,"Don't come near me, pigfucker."
melinda,Why do you have so many scars? Who hurt you so badly?
coffey,"Don't hardly remember, ma'am."
melinda,What's your name?
coffey,"John Coffey, ma'am. Like the drink, only not spelt the same."
coffey,Ma'am?
melinda,"Yes, John Coffey?"
coffey,I see it. I see it.
coffey,You be still now. You be so quiet and so still.
brutal,John! Sick it up! Cough 'em out like you done before!
brutal,"He's choking! Whatever he sucked out of her, he's choking on it!"
melinda,"How did I get here? We were going to the hospital in Indianola, weren't we? We stopped and you bought me a packet of posies..."
hal,Shhh. It doesn't matter. It doesn't matter anymore.
melinda,Did I have the X-ray? Did I
paul,Yes.
paul,It was clear. There was no tumor.
melinda,Who is that man?
paul,John? Can you turn around? Can you turn around and see this lady?
melinda,What's your name?
coffey,"John Coffey, ma'am."
melinda,"Like the drink, only not spelled the same."
coffey,"No, ma'am. Not spelt the same at all."
hal,"Melly, no..."
melinda,"I dreamed of you. I dreamed you were wandering in the dark, and so was I. We found each other. We found each other in the dark."
melinda,"It's St. Christopher. I want you to have it, Mr. Coffey, and wear it. He'll keep you safe. Please wear it for me."
coffey,"Thank you, ma'am."
melinda,"Thank you, John."
paul,"C'mon, John, stay on your feet."
harry,"Christ, he goes down, we'll need three mules and a crane to pick him up again..."
brutal,"He'll never sit in Old Sparky. You know that, don't you?  He swallowed that stuff for a reason. I give him a few days. One of us'll be doing a cell check and there he'll be. Dead on his bunk."
paul,"If that's his choice, he's earned it.  Let's get him back on the Mile."
dean,Am I glad to see you! You were gone so long! Wild Bill's making noises like he's gonna wake up...  What the hell's wrong with him?
brutal,"He's hurting, Dean. Hurting bad."
paul,"John, we're gonna set you on your bunk now. Ready?"
dean,What about Mrs. Moores? Was it like the mouse? Was it a...you know...a miracle?
paul,Yes. Yes it was.
harry,Damn. I think we got away with it.
brutal,We still gotta convince a certain somebody to keep his trap shut.
paul,Get his stuff.
paul,"I want to talk, not shout. I take the tape off, you gonna be calm."
brutal,"My mother always said if you do it fast, it won't hurt so much."
brutal,I guess she was wrong.
percy,Get me out of this nut-coat.
paul,In a minute.
percy,Now! Now! Right n--
paul,"You shut up and listen. You deserved to be punished for what you did to Del. You'll accept it like a man, or we'll make you sorry you were ever born. We'll tell people how you sabotaged Del's execution--"
percy,Sabotaged!
paul,"--and how you pissed yourself like a frightened little girl. Yes, we'll talk, that's a given--but, Percy, mind me now...we'll also see you beaten within an inch of your life."
paul,"We know people, too, are you so foolish you don't realize that? People with friends and loved ones doing time in this prison. People who'd be happy to amputate you nose or your penis just so someone they care about could get an extra three hours in the exercise yard every week.  Let bygones be bygones. Nothing's hurt so far but your pride...and nobody need ever know about that except the people in this room."
brutal,"What happens on the Mile, stays on the Mile. Always has."
percy,May I be let out of this coat now?
percy,My things?
paul,"Think it over, Percy."
percy,"Oh, I intend to. I intend to think about it very hard. Starting right now."
brutal,He'll talk. Sooner or later.
paul,"Easy, easy. You all right?"
billy,"What'a you looking at, you limp noodle? You wanna kiss my ass or suck my dick?"
dean,"Oh God, oh God, no..."
coffey,Punished them bad men.
paul,Why Wild Bill? Why?
coffey,"I saw in his heart. When he grab my arm, I saw what Wild Billy done. Saw plain as day. Can't hide what's in your heart."
paul,What? Saw what?
coffey,"Take my hand, boss. You see for yourself."
brutal,"Paul, no!"
coffey,My hand.
paul,No...please...
coffey,"Gots to, boss. Gots to give you a little bit of myself. A gift, like. A gift of what's in me so you can see..."
billy,"You lover your sister? You make any noise, know what happens? I'll kill her instead of you.  And if you make any noise, I'll kill her."
coffey,He kill 'em with they love. They love for each other. You see how it is?
coffey,That's how it is ever' day. That's how it is all over the worl'...
dean,"...well, I dunno, he just snapped, I guess..."
harry,"...s'right, one minute he's fine, the next--blammo..."
brutal,"...bastard grabbed him through the bars a few days back, scared the boy so bad he wet himself..."
medic,I think this boy's cheese slid off his cracker.
hal,"I'll cover you as much as I can, even if it mean my job, but I have to know. Does this have anything to do with what happened at my house? Does it, Paul?"
paul,No.
