Speaker,Dialogue
paul,"It makes sense. I read the file. Hal even said it himself. Wharton rambled all over the state last few years, causing trouble. Hell, longer than that. Been at it since he was ten. Vandalism. Petty theft. Setting fires."
jan,You saw him. You actually saw this Wild Bill person take those girls.
paul,"Their father hired him on for a few days last spring, help repair the barn. Cheap labor, just another drifter..."
brutal,Only not.
paul,"Sick bastard came back a month later, just before dawn. Took the girls...did what he did. Coffey found them afterwards and tried to help. It was too late."
jan," Then you can stop it. The execution, I mean. Get Coffey a new trial."
paul,"Based on what, honey? Some kind of magical vision I had?"
jan,"Show this farmer--what's his name, Detterick?--show him a picture of Wild Bill.  Why not? If Wharton was there...if the farmer can identify his picture and they know he was there..."
brutal,Him being there in May doesn't mean he came back and killed those girls in June. Even if he was committing other crimes.
paul,They got their killer as far as they're concerned.
jan,Then lie.
paul,Lie? About what?
jan,"Tell them Wharton confessed to the crime. Brutus, you can back him up, say you heard it too. You can say that's what set Percy off. He shot Wharton because he couldn't stand thinking of what happened to those two little girls, it snapped his mind...  ...what? What now?"
dean,"We never reported anything like that. We would've, too, everybody knows it. It's part of our job."
brutal,"Besides, confessing don't make it so. Slugs like Wild Bill lie about everything. Crimes they committed, women they had, even the weather."
jan,But he was there! He painted their barn! He ate dinner with them!
paul,"All the more reason he might take credit for the crime. He's gonna fry anyway, so why not boast?"
jan,All right. Then you've got to get John Coffey out on your own.
harry,Ma'am?
jan,"You did it once, didn't you? Only this time, don't bring him back."
dean,"Ma'am, your son's grown up and moved away. My kids are just starting kindergarten. Will you be the one to explain to them why their daddy's in prison?"
jan,Work out a plan. Make it look like a real escape.
harry,Better be a plan an imbecile could dream up. Nobody'd believe it otherwise.
brutal,"Even if we did think of something, it wouldn't do any good."
jan,Why not? Just why the hell not?
paul,Because he's a six-foot-eight-inch baldheaded black man with barely enough brains to feed himself. How long you think it'd be before he was recaptured? Two hours? Six?
jan,"Do you mean to kill him, you cowards? Do you?"
jan,"Don't touch me! Next week this time you'll be a murderer, no better than that man Wharton, so don't touch me!"
jan,I'm so sorry I called you a coward. I feel worse about that than anything I've ever said to you in our whole marriage.
paul,Even that time we went camping and you called me Old Stinky Sam?
jan,"Does Hal know? That Coffey's innocent, I mean?  Can he help? Does he have the influence to do something about this?"
paul,No.
jan,"Then don't tell him. If he can't help, don't tell him. Ever."
paul,I won't.
jan," There's no way out of this for you, is there?"
paul,"No. I've been thinking about it, too, believe me.  Tell you the truth, honey. I've done some things in my life I'm not proud of, but this is the first time I've ever felt in real danger of hell."
jan,Hell? Oh Paul...  Talk to him. Talk to John. Find out what he wants.
coffey,"Hello, boss."
paul,"Hello, John."
paul,I guess you know we're coming down to it now. Another couple of days.  Is there anything special you'd like for dinner that night? We can rustle you up most anything.
coffey,"Meatloaf be nice. Mashed taters with gravy. Okra, maybe. I's not picky."
paul,What about a preacher? Someone you could say a little prayer with?
coffey,"Don't want no preacher. You can say a prayer, if you want. I could get kneebound with you, I guess."
paul,Me?
paul,"S'pose I could, if it came to that."
paul,"John, I have to ask you something very important right now."
coffey,I know what you gonna say. You don' have to say it.
paul,"I do. I do have to.  John, tell me what you want me to do. You want me to take you out of here? Just let you run away? See how far you can get?"
coffey,Why would you do such a foolish thing?
paul,"On the day of my judgement, when I stand before God, and He asks me why did I kill one of his true miracles, what am I gonna say? That is was my job? My job?"
coffey,"You tell God the Father it was a kindness you done.  I know you hurtin' and worryin', I can feel it on you, but you oughtta quit on it now. Because I want it over and done. I do."
coffey,"I'm tired, boss. Tired of bein' on the road, lonely as a sparrow in the rain. Tired of not ever having me a buddy to be with, or tell me where we's coming from or going to, or why. Mostly I'm tired of people being ugly to each other."
paul,"Yes, John. I think I can."
brutal,"There must be something we can do for you, John. There must be something you want."
coffey,I ain't never seen me a flicker show.
fred astaire," Heaven, I'm in heaven...and my heart beats so that I can hardly speak..."
coffey,"Why, they's angels. Angels. Just like up in heaven..."
coffey,"I be all right, fellas. This here's the hard part. I be all right in a little while."
paul,"John, I should have that just for now. I'll give it back after."
coffey,"You know, I fell asleep this afternoon and had me a dream. I dreamed about Del's mouse."
paul,"Did you, John?"
coffey,"I dreamed he got down to that place Boss Howell talked about, that Mouseville place. I dreamed there was kids, and how they laughed at his tricks! My!"
coffey,"I dreamed those two little blonde- headed girls were there. They 'us laughing, too. I put my arms around 'em and sat 'em on my knees, and there 'us no blood comin' outta their hair and they 'us fine. We all watch Mr. Jingles roll that spool, and how we did laugh. Fit to bus', we was."
paul,"What should we pray for, John?"
coffey,Strength?
paul,"God, please help us finish what we've started, and please welcome this man, John Coffey--like the drink, but not spelled the same-- into heaven and give him peace. Please help us to see him off the best we can and let nothing go wrong. Amen."
coffey,I know a prayer I once heard. Can I say it?
paul,"You go right ahead, John. Take all the time you need."
coffey,"Baby Jesus, meek and mild, pray for me..."
coffey,...be with me until the end. Amen.
marjorie,"Die slow, you bastard."
coffey,They's a lot of folks here hate me. A lot. I can feel it. Like bees stinging me. It hurts.
brutal,"Feel how we feel, then. We don't hate you--can you feel that?"
marjorie,"Kill him twice, you boys! You go on and kill that raping baby- killer twice, that'd be fine!"
paul,"Wipe you face before you stand up, Dean."
paul,Roll on one.
marjorie,Does it hurt yet? I hope it does! I hope it hurts like hell!
paul,John Coffey...you have been condemned to die in the electric chair by a jury of your peers...sentence imposed by a judge in good standing in this state. Do you have anything to say before sentence is carried out?
coffey,I'm sorry for what I am.
marjorie,"You ought to be! Oh, you monster, you damn well ought to be!"
coffey,"Please, boss, don't put that thing over my face. Don't put me in the dark, I's afraid of the dark."
paul,"All right, John."
coffey,...heaven...I'm in heaven... heaven...heaven...heaven...
brutal, Paul. You have to say it. You have to give the order.
coffey, He kill 'em with they love. That's how it is ever' day. All over the worl'...
paul,Roll on two.
paul,"That was the last execution I ever took part in. Just couldn't do it anymore after that. Brutal either. We both transferred out, took jobs with Boys' Correctional.  That was all right. Catch 'em young, that became my motto. Might even have done some good."
paul,You don't believe me.
elaine,"I don't imagine you would lie to me, Paul. It's just that..."
paul,...It's quite a story.
elaine,Yes. Quite a story.  But if that's true...
paul,"The math doesn't work, does it?"
paul,You feel up to a walk?
paul,There. It's in there.
elaine,Paul? This thing you want to show me. Is it scary?
paul,Scary? No. Not really.
paul,There.
paul,"Hey. Wake up, old boy. Wake up."
elaine,Paul? It isn't...it can't be...
paul,"Come over here, boy. Come on over her and see this lady."
elaine,That can't be Mr. Jingles.
paul,Messieurs et mesdames. Beinvenue au cirque du mousie.
elaine,"Oh, Paul. Don't make him do it again. I can't bear to watch."
paul, But he loves it so much.
paul,"This isn't exactly the Mouseville we had in mind...but we make do, don't we, old fella?"
brad,"Fooled you, didn't I Got yourself a little love nest here, I see..."
brad,...what the fuck? Is that a mouse?
paul,"Don't hurt him, okay? Okay?"
brad,"It's a goddamn mouse, y'old fool, they carry all kind'a disease..."
brad,...now step aside.
paul,"You leave him alone, Percy! You leave him alone, or by God I'll--"
brad,"Who you calling Percy? Name's Brad, you senile fucker. And I'm gonna nail that mouse, you can take that to the everfucking bank."
elaine,How dare you? Get out!
brad,"Piss off, you wrinkeldy old bitch. Me and Paulie are talking."
elaine,"His name is Mr. Edgecomb. If you ever call him Paulie again, your days of employment at Georgia Pines will end."
brad,Who the hell you think you are?
elaine,"I am the grandmother of the man who is currently Speaker of the Georgia House of Representatives. A man who loves his relatives, Mr. Dolan. All it would take is a phone call."
elaine,"At first I thought I'd let you be. I'm old, and that seemed easiest. But when my friends are threatened and abused, I do not let it be.  Now get out, or you won't work another day here. Not another hour. I swear it."
brad,Don't know what you're getting so het up about. Just a damn mouse.
elaine,"Get out, you ignorant man. What little mind you have is ugly and misdirected."
brad,"Don't bother coming back here tomorrow...Mr. Edgecomb Gonna be a new lock on this door. This is off-limits to residents, no matter what Mrs. My Shit Don't Stink has to say about it."
elaine,Little trick I learned from Percy Wetmore.
paul,Is your grandson really Speaker of the House?
elaine,He is.
paul,You gonna thank the lady? She just saved your old mousie hide.
paul,"I think Mr. Jingles happened by accident. I think when we electrocuted Del, and it all went so badly...well, John could feel it, you know...and I think a tiny part of whatever was inside of him just leapt out...  Me, I was no accident. John had to give me a little part of himself...a gift, like...so I could see for myself what Wild Bill had done. When John did that, a part of whatever power worked through him spilled into me."
elaine,He...what? Infected you with life?
paul,"That's as good a word as any. He infected us both, didn't he, Mr. Jingles. With life.  I'm a hundred and five years old, Elaine. I was forty the year John Coffey walked the Green Mile."
elaine,...oh my God...
paul,"I haven't even had a cold since 1935. I've had to watch my friends and loved ones die off through the years...Hal and Melinda...Brutus Howell...my wife...my son...  ...and you, Elaine. You'd die, too, and my curse is knowing I'll be there to see it..."
paul,Mr. Jingles?
paul,"Where you been, boy? I've been worried about you. You hungry?"
