Speaker,Dialogue
agent bob,"Ray Sanchez, you are under arrest, under the"
phreak,"What are you waiting for, arrest me already!"
cop,You get one call. Uno. Understand?
operator,"Hello, operator services."
phreak,"Hello, operator? I'm having trouble dialing a number."
operator,What number please?
operator,Just one moment.
phreak,Thank you.
kate,Hello?
phreak,"Hey, it's me."
kate,Phreak?
phreak,"I'm freaking! Joey wasn't making it up! He really hacked into Ellingson! He gave me the disc with a file he copied and now I'm in jail! They're charging me with some serious shit! And there's stuff I didn't even do, like inserting some virus called Da Vinci, and they keep asking about you guys."
kate,You think they're going to bust us?
phreak,"Yeah! You better figure out what's on that disc, cause we're being framed. It's in that place where I put that thing that time?"
cereal,It's a nice room.
kate,We need your help.
dade,Do my ears deceive me?
cereal,"Nonononono. Truce, you guys. Listen, we got a higher purpose here, alright? A wake up call for the Nintendo Generation. We demand free access to data, well, it comes with some responsibility. When I was a child, I spake as a child, I understood as a child, I thought as a child, but when I became a man I put away childish things.  What... It's Corinthians I, Chapter 13, verse 11, no duh. Come on."
kate,Phreak and Joey are being framed. We need your help to figure out what's on this disc.
dade,"I can't. Everybody who touches that thing gets busted, I can't afford to get arrested, I'm sorry."
cereal,Maybe I should just go to the bathroom or something.
kate,"What is it with you? I know we've been playing games, but, we're supposed to be on the same side and we really need your help. I really need your help."
dade,"I'm sorry, I can't."
kate,"Well, could you just make a copy of the disc? And just hide it in case we get busted, so we have something to give our lawyers, something that hasn't been tampered with? Can you do that?"
kate, Thank you.
dade,Okay. I'll copy it.
kate,"Okay, thank you."
plague,The girl. The girl has the disc I need.
dade,"I told you, I don't play well with others."
plague,Turn on your laptop. Set it to receive a file.
plague,"Lauren Murphy is now a wanted felon in the state of Washington. Forgery, Embezzlement, two drug convictions, plus she jumped parole. When she's arrested, she will not have a trial, she will not pass go, she will go directly to jail. Then I change this file back to the original, and your mom disappears."
dade,That's bullshit.
plague,"What can I tell you. Computers never lie, kid. Your mom will be arrested at work, she'll be handcuffed, and later, strip searched."
dade,You lay a finger on her and I'll kill you.
plague,"Kid, don't threaten me. There are worse things than death and, uh, I can do all of them!"
plague,Talk to me.
dade,"I got it. But listen, Kate didn't know what's on it. I mean, she came to me to figure it out. She's not the one who planted the virus. You leave her alone."
plague,"Hey, don't worry, kid. If she's innocent, she'll be fine. Your mommy's safe now, okay?"
dade,"Kate, listen."
kate,"Uh, hold on..."
dade,I have to tell you something.
cereal,Hold on a second!
nikon,"Look at this, it's so lean and clean."
cereal,Looks like a hacker wrote it.
kate,"Come here, look at this. This thing is dense."
nikon,"But that's ill, man. It's incomplete. This is taking forever and a day to figure out. I'm gonna make some coffee."
cereal,"Tag, you're in."
dade,This isn't a virus. It's a worm!
nikon,What's this one eat?
dade,It nibbles. You see this?
dade,"This is every financial transaction Ellingson conducts, yeah? From million dollar deals to the ten bucks some guy pays for gas."
kate,The worm eats a few cents from each transaction.
dade,And no one's caught it because the money isn't really gone. It's just data being shifted around.
kate,"Right. And when the worm's ready, it zips out with the money and erases its tracks."
dade,"Joey got cut off before he got to that part. Check it out. By this point, it's already running at, what, twice the speed as when it started."
kate,"Right, and at this rate it ends its run in..."
nikon,Two days.
dade,"And judging by this segment alone, it's already eaten about..."
kate,"Whoever wrote this needs somebody to take the fall. And that's Phreak, and that's Joey, and that's us. We've got to get the rest of the file, so we can find out where the money is going before the worm disappears, so we can find out WHO created it."
dade,"I know, I know who wrote it."
kate,What?
dade,This Ellingson security creep. I gave him a copy of the disc you gave me.
kate,You what?
dade,I didn't know what was on it.
cereal," Oh man. That's universally stupid, man!"
nikon,"Yo, man, you an amateur, man."
kate,Why did he come to you?
dade,I got a record. I was Zero Cool.
nikon,Zero Cool? Crashed fifteen hundred and seven systems in one day?
nikon,"Biggest crash in history, front page, New York Times, August 10th, 1988. I thought you was black, man! Yo, man, this is Zero Cool! Oh, shit!"
cereal,That's far out!
nikon,"This is Zero Cool, man! Whooo, haha!"
kate, Well that's great. There goes MIT.
dade,I'll make it up to you!
kate,How?
dade,I'll hack the Gibson.
nikon,"They'll trace you like that  man, cops are gonna find you, they're gonna find you with a smoking gun."
dade,"Fucked if I care, man."
nikon,"Look, even if you had the passwords, it'll take you ten minutes to get in, and you've still gotta find the files, man, I mean, the cops will have you in... five minutes."
cereal,"Oh wow, we are fried."
kate," Never send a boy to do a woman's job. With me, we can do it in seven."
cereal,"You're both screwed. I help, we can do it in six."
nikon,"Jesus, I gotta save all your asses. I help, we can do it in five minutes, man."
dade,Okay. Let's go shopping.
cereal,Woo hoo! Boom!
dade,"You know, if I didn't live by a strict code of honor, I might take advantage of this situation.  Erotically, as it were."
guard,"Alright, hold it right there!"
dade,Shit!!
kate,It's my subway defense system.
nikon,He's way down there.
cereal,Ta-da!
nikon,"Yo, brain dead, the manual!"
woman,Find it?
cereal,Phone's alright. The problem must be somewhere else.
margo, They had a large chunk of the garbage file? How much do they know?
plague,Not everything. But enough to implicate us.
margo,You said the worm was untreaceable!
plague,"Yeah. To civilians. But they're hackers. But don't worry. All we have to do is launch the Da Vinci virus, and then they'll all be put away."
margo,Launch the Da Vinci virus? You can't do that!
plague,"No one believes the guilty. Besides, by the time they realize the truth, we'll be long gone with all of our money."
plague,"Look, there is no right and wrong.  There is only fun and boring. A thirty year prison sentence sounds pretty dull to me.  Who do you prefer serves it, us? Or them?"
virus,"Unless five million dollars are transferred to the following numbered account in seven days, I will capsize five tankers in the Ellingson fleet."
plague," The virus goes off tomorrow morning at 10:30, and those hackers tried to get into our system again. At this point I insist you take more strenuous action, or Ellingson Mineral will hold the Secret Service responsible."
gill," Get me arrest warrants on Kate Libby, alias Acid Burn, Emmanuel Goldstein, alias Cereal Killer, Dade Murphy, alias Crash Override, also known as Zero Cool, and Paul Cook, alias Lord Nikon. We pick them up tomorrow morning at nine o'clock."
cereal,Snoop onto them...
nikon,...as they snoop onto us.
kate,"Yeah, it's Kate."
nikon,"Hey, Burn. We got a little problem here."
kate,"Alright, so what have we got?"
dade,"Well, we have fifty passwords, plus whatever Polaroid head here got inside Ellingson."
nikon,"Well, I got a lot, alright? I don't know how many but... my head hurts."
cereal,"Yo, everyone check this out. Hey, what's the Da Vinci virus?"
dade,What?
cereal,Check this out. It's a memo about how they're gonna deal with those oil spills that happened on the fourteenth.
kate,What oil spills?
nikon,"Whoa, whoa. Yo, brain-dead, today is the thirteenth."
cereal,Well this hasn't happened yet.
kate,"Wait a minute, the fourteenth, that's the same day the worm ends its run.  I mean... Da Vinci virus, didn't Phreak say that's what he was being charged with? Look...  ""Infecting ballast programs of Ellingson tankers"" - they blame hackers!"
nikon, Damn!
cereal,A worm AND a virus? The plot thickens.
nikon,"Whoa, whoa whoa whoa, where are you going, huh?"
kate,"I got an idea. We've got a few hours, right, till we get arrested. So just stay low. I'm gonna go get some help. I'll beep you, okay?  Are you coming?"
cereal,"May the Force be with you, man."
kate,There they are!
dade,Razor and Blade! They're flakes!
kate,They're elite! Let's get 'em.
kate,I lost 'em. Where were you?
dade,I don't like this.
dade,AAAAAUGH! I definitely don't like this!
blade, What do you want?
dade,Ummm... we come in peace?
kate,We need your help.  If you're up to it.
razor,She's buff. Ballsy.
blade,Let's keep her.
razor,Waste the dude.
kate,A virus called Da Vinci will cause oil spills at 10:30 AM Eastern Time tomorrow.
dade,It's somehow connected with the worm that's stealing the money.
kate,We need your help to overload the Gibson so we can kill the Da Vinci virus and download the worm program.
razor,"She's rabid, but cute."
blade,"See, we're very busy. A TV network that wishes to remain nameless has expressed an interest in our show."
dade," Let's go, Kate."
razor,Wait. Nobody said no. But you are going to need more than just two media icons like us. You need an army.
blade,"That's it! An electronic army! If I were us, I'd get on the internet, send out a major distress signal."
razor,"Hackers of the World, Unite!"
blade,How are you going to take care of the cops?
grand central,HACK THE PLANET
cereal,"Yo. I'm blowing up. It's Kate, Grand Central. Let's hit it!"
cereal,"Hey Joey, you made it!"
kate,"Now listen up, use your best viruses to buy us time, we have to get into Plague's file and copy the worm."
cereal,"Ai! Boom boom aiaiaiaiaee! Alright, that was a little tension breaker, that had to be done, alright?"
kate,Cereal.
cereal,Yeah?
kate,Go fix the phones.
cereal,Roger.
kate,"Joey, take his place."
joey,"What, me?"
kate,"Take his place, man, do it. You can do it."
kate,Ready?
dade,Yeah.
kate,"Alright, let's boot up."
margo,What is it? What's wrong?
plague,"Nothing, it's just a minor glitch."
margo,"""Minor glitch"" with you seems to turn into a major catastrophe."
hal,There's a new virus in the database.
margo,What's happening?
hal,"It's replicating, eating up memory. What do I do?"
plague,"Type ""Cookie"", you idiot. I'll head 'em off at the pass."
hal,We have a Zero Bug attacking all the login and overlay files.
plague,Run anti-virus. Give me a systems display!
plague,"Die, dickweeds!"
hal,The rabbit is in the administration system.
plague,Send a Flu-shot.
margo,"Rabbit, Flu-shot, someone talk to me."
hal,"A rabbit replicates till it overloads a file, then it spreads like cancer."
margo,Cancer?
kate,"It's the Gibson, it's finding us too fast."
dade,"Man, there's too many garbage files, I need more time."
plague,"They're at Grand Central Station, lower level. Don't screw up."
plague,"Game's over. Last chance to get out of this without a prison sentence.  You're not good enough to beat me, you little shit."
dade,"Yeah, maybe I'm not. But we are, you asshole."
plague,Give it up! Just give it up.
razor,Are we fashionably late?
sysop,We have massive infection.  Multiple GPI and FSI viruses.
hal,They're coming in from remote nodes. They're going after the Kernal!
margo,Colonel who?
hal,"The System Command Processor, it's the brain."
margo,"Cancer, brain... Brain Cancer?"
duke ellingson,"Belford, what's going on?"
plague,"In short, Duke, a shit storm."
dade,I found it! I found it!
plague,"This is the end, my friend.  Thank you for calling!"
dade,"Oh, shit! He got me."
nikon,Joey's getting stupid busy.
dade,"Joey. I need you to drop your viruses, go after the worm. You're the closest."
dade,It's root slash period workspace slash period garbage period.
gill,Freeze!
gill, Ahhh Come on!
kate, Kill the Gibson.
razor,Roger that.
plague,"Come on you son of a bitch, is that all you got, huh? Come on, let's see what else you can do! You talking to me? Huh? Hahahaha. Are you nuts? Come at me!"
hal,They're in the kernal.
woman, The tankers have stopped capsizing.
someone else, Ballast tanks are emptying. It'll be okay.
plague,Little pissant!
nikon,Yes!
dade,We did it!
kate,Let's get out of here!
gill,FREEZE!
dade,"They're TRASHING our rights, man! They're TRASHING the flow of data! They're TRASHING! TRASHING! TRASHING! HACK THE PLANET! HACK THE PLANET!"
gill,Shut up and get in the car!
cereal, HACK THE PLANET! HACK THE PLANET!
plague,Hello?
gill,We caught 'em.
plague,Good.
gill,Red handed! You won't be having any more trouble from them.
dade,"Me, alright? I did it. She knows shit about computers. She... she's just my girlfriend."
gill, I suggest you modify your attitude. Because you are floating. And I'm about to flush your ass.
agent,"You've got a Mrs. Murphy to see you, sir."
kate,Are you crazy? What are you doing?
dade,I'm trying to help you.
kate,Dade.
dade,What?
kate,Thanks for your help.
gill, Your son is in big trouble. He has violated his probation and he has engaged in criminal activity.
agent bob,The news crew you requested is here.
gill,Your son is facing thirty felony counts in an ongoing investigation. You face possible arrest if you do that.
gill,Mrs. Murphy stays right here.
kate,"Oh, wow, she's great."
dade,Yeah.
reporter,...and attacked the Ellingson's computer network. Is the last we've seen of this type of high-tech espionage?
gill,"Well, I'm afraid not. Hackers are a grave threat to the national security. This incident just proves without a doubt that we need increased funding to stop..."
someone,That kid cut him off!
cereal,"Hold on, boys and girls. It is I, the Cereal Killer, making my first coast to coast, world wide, global television appearance. Yes, that's right, I'm here to tell you about this heinous scheme hatched from within Ellingson Mineral."
cereal,"But for what, you ask? World domination? Nay. Something far more tacky. A virus called Da Vinci, that when launched, would cause Ellingson Mineral tankers to capsize was to be blamed on innocent hackers. But this virus was really the smokescreen, right. What could be so vitally important to protect that someone would create such a nasty, antisocial, very uncool virus program?"
cereal,"But why? Could it be to cover the tracks for this worm program? A worm that was to steal 25 million bucks. The password for this hungry little sucker belongs to Margo Wallace, head of public relations at Ellingson Mineral..."
margo,Oh my God!
cereal," ...and Eugene Belford, Computer Security Officer."
gill, Son of a BITCH!
cereal, What's this? Is this the unnamed account in the Bahamas where the money was to be stashed? I think so!
cereal,Yo. I kinda feel like God!
margo,Plague? Eugene?
margo,"I don't even know how to work a VCR, let alone a computer! Get off! Look, listen, I'll make a deal. Eugene Belford! I know where his mother is, I promise you. Get offa me! I need a lawyer!"
stewardess,"Here you are, Mr. Babbage.  Flight time to Tokyo should be about 14 hours today. Can I get you anything else?"
plague,Just a pillow please.
plague,Thank you.
gill,You're welcome.
plague,What's going on? Let go of me! Stewardess! I'll never fly this airline again!
dade,You look good in a dress.
kate,You would have looked better.
dade,Wanna go for a swim?
kate,I can't believe they decided you won.
dade,"They didn't. The guys felt it was the only way I'd get a date. Anyway, you're pretty good. You're elite."
kate,"Yeah? You know if you would have said so in the beginning, you would have saved yourself a whole lot of trouble."
dade,Beat that!
dade,"You know, I've been having these really weird.."
kate, Dreams?
