Speaker,Dialogue
voice,"January, 1961 - President Dwight D. Eisenhower's Farewell Address to the Nation -"
eisenhower,"The conjunction of an immense military establishment and a large arms industry is new in the American experience.  The total influence - economic, political, even spiritual - is felt in every city, every statehouse, every office of the Federal Government... In the councils of government we must guard against the acquisition of unwarranted influence, whether sought or unsought, by the military industrial complex. The potential for the disastrous rise of misplaced power exists and will persist... We must never let the weight of this combination endanger our liberties or democratic processes.  We should take nothing for granted..."
voice 2,"November, 1960 - Senator John F. Kennedy of Massachusetts wins one of the narrowest election victories in American history over the Vice- President Richard Nixon by a little more than 100,000 votes.  Rumors abound that he stole the election in Illinois through the Democratic political machine of Mayor Daley...  At his inauguration, at a time when American males all wore hats, he let his hair blow free in the wind. Alongside his beautiful and elegant wife of French origin, Jacqueline Bouvier, J.F.K. is the symbol of the new freedom of the 1960's, signifying change and upheaval to the American public, scaring many and hated passionately by some.  To win the election and to appease their fears, Kennedy at first takes a tough Cold War stance."
voice 3,"He inherits a secret war against the Communist Castro dictatorship in Cuba, a war run by the CIA and angry Cuban exiles out of bases in the Southern United States, Panama, Nicaragua and Guatemala.  Castro is a successful revolutionary frightening to American business interests in Latin America - companies like Cabot's United Fruit, Continental Can, and Rockefeller's Standard Oil.  This war culminates in the disastrous Bay of Pigs invasion in April 1961, when Kennedy refuses to provide air cover for the exile brigade.  Of the 1600 men who invade, 114 are killed, 1200 are captured.  The Cuban exiles and the CIA are furious at Kennedy's irresolution... Kennedy, taking public responsibility for the failure, privately claims the CIA lied to him and tried to manipulate him into ordering an all-out American invasion of Cuba.  He vows to splinter the CIA into a thousand pieces and fires Director Allen Dulles, Deputies Charles Cabell and Richard Bissell, the top leadership of the Agency."
voice 4,"The CIA, however, continues it's secret war on Castro with dozens of sabotage and assassination attempts under it's ZR/RIFLE and MONGOOSE programs - The Agency collaborates with organized crime elements such as John Roselli, Sam Giancana, and Santos Trafficante of Tampa, whose casino operations in Cuba, worth more than a hundred million dollars a year in income, Castro has shut down."
voice 5,"In October 1962, the world comes to the brink of nuclear war when Kennedy quarantines Cuba after announcing the presence of offensive Soviet nuclear missiles 90 miles off American shores.  The Joint Chiefs of Staff and the CIA call for an invasion. Kennedy refuses.  Soviet ships with more missiles sail towards the island, but at the last moment turn back. The world breathes with relief but backstage in Washington, rumors abound that J.F.K. has cut a secret deal with Russian Premier Khrushchev not to invade Cuba in return for a Russian withdrawal of missiles.  Suspicions abound that Kennedy is ""soft on Communism."""
voice 6,"In the ensuing months, Kennedy clamps down on Cuban exile activities, closing training camps, restricting covert operations, prohibiting shipment of weapons out of the country.  The covert arm of the CIA nevertheless continues its plan to assassinate Castor... In March '63, Kennedy announces drastic cuts in the defense budget.  In November 1963, he orders the withdrawal by Christmas of the first 1000 troops of the 16,000 stationed in Vietnam. He tells several of his intimates that he will withdraw all Vietnam troops after the '64 election, saying to the Assistant Secretary of State, Roger Hilsman, ""The Bay of Pigs has taught me one, not to trust generals or the CIA, and two, that if the American people do not want to use American troops to remove a Communist regime 90 miles from our coast, how can I ask them to use troops to remove a Communist regime 9,000 miles away?""... Finally, in August 1963, over the objections of the Joint Chiefs of Staff, the United States, Great Britain and the Soviet Union sign a treaty banning nuclear bomb tests in the atmosphere, underwater and in space...  Early that fateful summer, Kennedy speaks of his new vision at American University in Washington."
jfk,"What kind of peace do we seek?  Not a pax Americana enforced on the world by American weapons of war... We must re-examine our own attitudes towards the Soviet Union... If we cannot now end our differences at least we can help make the world safe for diversity.  For, in the final analysis, our most basic link is that we all inhabit this small planet.  We all breathe the same air.  We all cherish our children's future.  And we are all mortal..."
rose,"They're going up to Dallas... to whack Kennedy.  Friday the 22nd, that's when they're going to do it. In Dealey Plaza.  They're gonna whack him!  You gotta call somebody, these are serious fuckin' guys."
doctor, Higher'n a kite on something.  Been like this since she came in.
voice 7,"More rumors emerge of J.F.K.'s backdoor efforts outside usual State Department and CIA channels to establish dialogue with Fidel Castro through contacts at the United Nations in New York.  Kennedy is seeking change on all fronts.  Bitter battles are fought with Southern segregationists to get James Meredith into the University of Mississippi. Three months after Kennedy submits a sweeping civil rights bill to Congress, Martin Luther King leads 250,000 in a march on Washington. Robert Kennedy, as Attorney General, for the first time ever vigorously prosecutes the Mafia in American life, bringing and winning a record number of cases - 288 convictions of organized crime figures including 13 grand juries against Jimmy Hoffa and his Teamsters Union.  The President also takes on Big Business, forcing back steel prices, winning 45 of 46 antitrust cases during 1963 and he wants to help everyday taxpayers by ending age- old business privileges like the oil depletion allowance and the fees paid to the Federal Reserve Bank for printing America's currency. Revolutionary changes are foreseen after J.F.K.'s assumed re-election in 1964.  Foremost in the political consciousness of the country is the possibility of a Kennedy dynasty. Robert Kennedy in '68, Teddy Kennedy in '76.  In November, 1963 John Kennedy travels to Texas, his popularity sagging to 59% largely due to his civil rights stand for which he is particularly hated in the South.  Texas is a crucial state for him to carry in '64.  With him is Vice-President, Lyndon Johnson and Texas Governor John Connally. On November 21, they visit Houston and San Antonio.  On the morning of November 22, he speaks in Fort Worth, then flies 15 minutes to Love Field in Dallas, where he takes a motorcade through downtown Dallas on his way to speak at 12:30 at the International Trade Mart.  Later, the motorcade takes him through Dealey Plaza at"
ambulance voice,We are en route to Parkland.
voice,We'll be there in about five minutes.
jackie kennedy," And in the motorcade, you know I usually would be waving mostly to the left side and he was waving mostly to the right, which is one reason you're not looking at each other very much.  And it was terribly hot. Just blinding all of us... We could see a tunnel in front of us. Everything was really slow then. And I remember thinking it would be so cool under that tunnel."
cbs bulletin," We interrupt this program to bring you this flash bulletin.  A burst of gunfire!  Three bursts of gunfire, apparently from automatic weapons, were fired at President Kennedy's motorcade in downtown Dallas."
voices,"OH NO!  MY GOD THEY'RE GOING TO KILL US ALL!  Be still.  You're going to be all right.  LET'S GET OUT OF HERE. WE'RE HIT!  LAWSON, THIS IS KELLERMAN. WE ARE HIT.  GET US TO THE HOSPITAL IMMEDIATELY.  PULL OUT OF THE MOTORCADE.  TAKE US TO THE NEAREST HOSPITAL."
voices, IT CAME FROM THERE.  SECURE THAT AREA BEHIND THE FENCE.  IT'S THAT BUILDING UP THERE.
jim,"What's wrong, Lou?"
lou,"Boss, the President's been shot.  In Dallas.  Five minutes ago."
jim,Oh no!... How bad?
lou,No word yet.  But they think it's in the head.
jim,Come on.  Napoleon's has a TV set.
newsman 1,Apparently three bullets were found. Governor Connally also appeared to be hit.  The President was rushed by the Secret Service to Parkland Memorial Hospital four miles from Dealey Plaza.
jim,"There's still a chance, dammit! Come on, Jack - pull through."
manager," I don't believe it.  I don't believe it.  Here, in this country."
walter cronkite,"From Dallas, Texas - the flash apparently official, President Kennedy died at 1 p.m.  Central Standard Time, 2 o'clock Eastern Standard Time, some 38 minutes ago.  Vice-President Johnson has left the hospital in Dallas, but we do not know to where he has proceeded. Presumably, he will be taking the oath of office shortly, and become the 36th President of the United States."
jim,"I didn't always agree with him - too liberal for my tastes - but I respected him.  He had style... God, I'm ashamed to be an American today."
newsman 2,Many arrests have been made here today.  Anyone looking even remotely suspicious is being detained.  Most of the crowd has gone home but there are still many stunned people wandering around in Dealey Plaza unable to comprehend what happened here earlier today.
black woman," It's all so terrible.  I jes' can't stop crying.  He did so much for this country, for colored people. Why?"
man," I grabbed my kids and wife and hit the ground.  The bullets were coming over our heads - from that fence back on the knoll - I was just so shaken.  I saw his face when it hit... he just, his ear flew off, he turned just real white and then went stiff like a board and flopped over on his stomach, with his foot sticking out."
woman 2,"I thought... it came from up there, that building."
man 2,I heard shots from over there.
newsman 2,How many shots?
man 3,I never thought it could happen in America.
banister,All this blubbering over that sonofabitch!  They're grieving like they knew the man.  It makes me want to puke.
martin,"God's sake, chief.  The President was shot."
banister,"A bullshit President!  I don't see any weeping for all the thousands of Cubans that bastard condemned to death and torture at the Bay of Pigs. Where are all the tears for the Russians and Hungarians and Chinese living like slaves in prison camps run by Kennedy's communist buddies - All these damned peace treaties! I'm telling ya Jack, that's what happens when you let the niggers vote.  They get together with the Jews and the Catholics and elect an Irish bleeding heart."
martin,"Chief, maybe you had a little too much to drink."
banister,Bullshit!  Here's to the New Frontier.  Camelot in smithereens.  I'll drink to that.
newsman 3,"This is the rifle, it is a Mannlicher - Carcano Italian rifle, a powerful World War II military gun used by infantry and highly accurate at distances of 100 yards."
newsman 3,"The assassin apparently fired from this perch... but so far no word, much confusion and..."
newsman 4,"A flash bulletin... the Dallas Police have just announced they have a suspect in the killing of a Dallas police officer, J.D. Tippit, who was shot at 1:15 in Oak Cliff, a suburb of Dallas."
newsman 4,"The suspect, identified as Lee Harvey Oswald, was arrested by more than a dozen police officers after a short scuffle at the Texas movie theatre in Oak Cliff, several blocks from where Officer Tippit was killed, apparently with a .38 revolver found on Oswald.  There is apparently at least one eyewitness."
tv oswald,"No, I don't know what I'm charged with... I don't know what dispatches you people have been given, but I emphatically deny these charges."
lou,One little guy with a cheap rifle - look what he can do.
jim,"Let's get outta here, Lou.  I saw too much stuff like this in the war."
banister,"Well, the kid musta gone nuts, right?  I said Oswald must've flipped.  Just did this crazy thing before anyone could stop him, right?"
martin,"I think I'll cut out here, chief.  I gotta get home."
banister," Get home my ass.  We're going to the office, have another drink.  I want some company tonight."
banister," Well, bless my soul.  Your eyes are as red as two cherries, Jack.  Don't tell me we have another bleeding heart here.  Hell, all these years I thought you were on my side."
martin,"Chief, sometimes I don't know whether you're kidding or not."
banister,"I couldn't be more serious, Jack. Those big red eyes have me wondering about your loyalty."
banister,"Who the hell opened my files!  You've been looking through my private files, haven't you, you weasel?"
martin,"You may not like this, chief, but you're beginning to act paranoid.  I mean, you really are."
banister,You found out about Dave Ferrie going to Texas today and you went through all my files to see what was going on.  You're a goddamn spy.
martin," Goddammit chief, why would I ever need to look in your files?  I saw enough here this summer to write a book."
banister,"I always lock my files.  And you were the only one here today...  What do you mean, you son of a bitch?"
martin,You know what I mean.  I saw a lot of strange things going on in this office this summer.  And a lotta strange people.
banister,"You didn't see a goddamn thing, you little weasel.  Do you get it?  You didn't see a goddamn thing."
newsman 5, Did you shoot the President?
tv oswald,"I didn't shoot anybody, no sir.  I'm just a patsy."
liz,"My god, he sure looks like a creep. What's he talkin' 'bout... a patsy?"
tv oswald,"Well, I was questioned by a judge. However, I protested at the time that I was not allowed legal representation during that very short and sweet hearing.  Uh, I really don't know what the situation is about.  Nobody has told me anything except that I am accused of, uh, murdering a policeman.  I know nothing more than that and I do request that someone come forward to give me, uh, legal assistance."
newsman 5,Did you kill the President?
tv oswald,"No.  I have not been charged with that.  In fact nobody has said that to me yet.  The first thing I heard about it was when the newspaper reporters in the hall, uh, asked me that question."
newsman 6,You have been charged.
tv oswald,Sir?
newsman 6,You have been charged.
newsman 5,Were you ever in the Free Cuba Movement or whatever the...
ruby, It was the Fair Play for Cuba Committee.
newsman 6,What did you do in Russia?  What happened to your eye?
tv oswald,A policeman hit me.
garrison,He seems pretty cool to me for a man under pressure like that.
liz,"Icy, you mean.  Mattie - get ahold of yourself."
mattie,"Why, Mr. Jim?  He was a great man, Mr. Jim, a great man..."
tv wade,There is no one else but him.  He has been charged in the Supreme Court with murder with malice.  We're gonna ask for the death penalty.
frank," So several hours after the assassination, a disturbed portrait is emerging of Lee Harvey Oswald. Described as shy and introverted, he spent much of his childhood in New Orleans, Louisiana and went to high school there.  After a stint in the Marines, he apparently became fascinated by Communism and in 1959 defected to the Soviet Union."
bob," He married a Russian woman there, Frank, had a child, and then returned to the United States after 30 months. But he is still believed to be a dedicated Marxist and a fanatical supporter of Fidel Castro and ultra left wing causes.  He spent last summer in New Orleans and was arrested in a brawl with anti-Castro Cuban exiles."
frank," And apparently, Bob, Oswald had been passing out pro-Castro pamphlets for an organization called Fair Play for Cuba, a Communist front he reportedly belongs to."
bob," And we have Marina Oswald, his Russian- born wife, who has identified the rifle found in the Book Depository as belonging to her husband.  And we have..."
jim," Lou, I'm sorry to disturb you this late...  yeah, matter of routine but we better get on this New Orleans connection of Oswald's right away. Check out his record, find any friends or associates from last summer. Let's meet with the senior assistants and investigators day after tomorrow,"
marina oswald, Lee good man... he not shoot anyone.
lou,"As far as Oswald's associates, boss, the one name that keeps popping up is David Ferrie."
jim,I know David - a strange character.
lou,"He's been in trouble before.  Used to be a hot shot pilot for Eastern Airlines, but he got canned after an alleged homosexual incident with a 14-year old boy."
bill, Get Kohlman... he told somebody the Texas trip... yesterday mentioned to somebody about Ferrie... find it out.
newsman 1,"These backyard photos were found yesterday among Oswald's possessions in the garage of Janet William's home in Riving, Texas, where Marina Oswald and her children are living. The picture apparently was taken earlier this year.  Police say the rifle, a cheap World War II Italian- made Mannlicher-Carcano, was ordered from a Chicago mailing house and shipped to Oswald's alias A. Hidell at a post office box in March, 1963. This is the same rifle that was used to assassinate the President."
cox,That ties it up...
numa,"Another nut.  Jesus, anybody can get a rifle in Texas."
bill, So it seems that Dave Ferrie drove off on a Friday afternoon for Texas - a source told Kohlman he might have been a getaway pilot for Oswald.
jim,Hold your horses.  What kinda source?
bill," The anonymous kind, Chief."
oser,I think I remember this guy Ferrie speaking at a meeting of some veteran's group.  Ranting against Castro.  Extreme stuff.
newsman 1,We go back now to the basement of police headquarters where they're about to transfer Oswald to County Prison...
announcer,He's been shot!  Oswald's been shot!
various voices,Goddamn!  Look at that... Look at that... I don't believe this... Right on TV!  What is going on?  Who is this guy... oh Jesus.
lou,Seventy cops in that basement.  What the hell were they doing?
newsman 1,Jack Ruby... Who is Jack Ruby?  Oswald is hurt.
lou,"Well, no trial now.  Looks like somebody saved the Dallas D.A. a pile of work."
jim," Well, let's get Ferrie in here anyway."
lou,Chief... David Ferrie.
jim," Come in, Dave.  Have a seat, make yourself comfortable.  Coffee?"
ferrie,"Do you remember me, Mr. Garrison?  I met you on Carondolet Street right after your election.  I congratulated you, remember?"
jim,"How could I forget?  You make quite a first impression.  I'm a bit of a pilot myself, you know.  Flew grasshoppers for the field artillery in the war."
ferrie,"Do you mind if I smoke, Mr. Garrison?"
jim, We've heard reports that Oswald spent the summer in New Orleans and we've been advised you knew Oswald pretty well.
ferrie,That's not true.  I never met anybody named Oswald.  Anybody who told you that has to be crazy.
jim,"But you are aware, he served in your Civil Air Patrol unit when he was a teenager."
ferrie,"No... if he did, I don't remember him.  There were lots of kids in and out... y'know."
jim, I'm sure you've seen this.  Perhaps you knew this man under another name?
ferrie,"No, I never saw him before in my life."
jim,"Well that must've been mistaken information we got.  Thanks for straightening it out for us.  There is one other matter that's come up, Dave.  We were told you took a trip to Texas shortly after the assassination of Friday."
ferrie,"Yeah, now that's true.  I drove to Houston."
jim,What was so appealing about Houston?
ferrie,"I hadn't been there ice skating in many years, and I had a couple of young friends with me, and we decided we wanted to go ice skating."
jim,"Dave, may I ask why the urge to go ice skating in Texas happened to strike you during one of the most violent thunderstorms in recent memory?"
ferrie,"Oh, it was just a spur of the moment thing...  the storm wasn't that bad."
jim,I see.  And where did you drive?
ferrie,"We went straight to Houston, and then Saturday night we drove to Galveston and stayed over there."
jim,Why Galveston?
ferrie,No particular reason.  Just to go somewhere.
jim,And then Sunday?
ferrie,"In the morning we went goose hunting. Then headed home, but I dropped the boys off to see some relatives and I stayed in Hammond."
jim,Did you bag any geese on this trip?
ferrie,I believe the boys got a couple.
jim,But the boys told us they didn't get any.
ferrie," Oh yes, well, come to think of it, they're right.  We got to where the geese were and there were thousands of them.  But you couldn't approach them.  They were a wise bunch of birds."
jim,"Your young friends also told us you had no weapons in the car.  Dave, isn't it a bit difficult to hunt for geese without a shotgun?"
ferrie,"Yes, now I remember, Mr. Garrison. I'm sorry, I got confused.  We got out there near the geese and it was only then we realized we'd forgotten our shotguns.  Stupid, right?  So of course we didn't get any geese."
jim,"I see.  Dave thank you for your time.  I'm sorry it has to end inconveniently for you, but I'm going to have you detained for further questioning by the FBI."
ferrie, Why?  What's wrong?
jim,"Dave, I find your story simply not believable."
fbi spokesman,"Gentlemen, this afternoon the FBI released David W. Ferrie of New Orleans.  After extensive questioning and a thorough background check, the Bureau found no evidence that..."
fbi spokesman," ...Mr. Ferrie knew Lee Harvey Oswald or that he has had any connection with the assassination of President Kennedy.  The Special Agent in Charge would like to make clear that Mr. Ferrie was brought in for questioning by the District Attorney of Orleans parish, not by the Federal Bureau of Investigation.  The Bureau regrets any trouble this may have caused Mr. Ferrie..."
newsman 9,"In national news, President Johnson has announced the creation of a blue ribbon presidential commission to probe the events in Dallas."
lou,Correct me if I'm wrong.  I thought we were on the same side.  What the hell business is it of theirs to say that?
bill,"Pretty fast, wasn't it.  The way they let him go."
jim,"They must know something we don't.  So, let's get on with our lives, gentlemen... we got plenty of home grown crimes to prosecute."
newsman 9,"The Commission will be headed by Chief Justice of the United States Supreme Court, Earl Warren, and is expected to head off several Congressional and Texas inquiries into the assassination.  On the panel are Allen Dulles, ex-chief of the CIA, Representative Gerald Ford, John J. McCloy, former head of Chase Manhattan Bank..."
long," Sad thing is the way it's screwing up this country, all these hippies running around on drugs, the way young people look you can't tell a boy from a girl anymore.  I saw a girl the other day, she was pregnant - you could see her whole belly, and you know what she painted on it? ""Love Child.""  It's fuckin' outa control.  Values've gone to hell, Jim... Course it figures when you got somebody like that polecat Johnson in the White House."
jim,"I sometimes feel things've gone downhill since John Kennedy was killed, Senator."
long,Don't get me started on that.  Those Warren Commission fellows were pickin' gnat shit out of pepper.  No one's gonna tell me that kid did the shooting job he did from that damned bookstore.
stewardess,"Here you go, Senator Long."
jim, I thought the FBI test-fired the rifle to make sure it could be done?
long,"Sure, three experts and not one of them could do it!  They're telling us Oswald got off three shots with world-class precision from a manual bolt action rifle in less than six seconds - and accordin' to his Marine buddies he got Maggie's drawers - he wasn't any good.  Average man would be lucky to get two shots off, and I tell ya the first shot would always be the best.  Here, the third shot's perfect.  Don't make sense.  And then they got that crazy bullet zigzagging all over the place so it hits Kennedy and Connally seven times. One ""pristine"" bullet?  That dog don't hunt."
jim,"You know, something always bothered me about that from day one, and I can't put my finger on it."
long,"If I were investigatin', I'd round up the 100 best riflemen in the world and find out which ones were in Dallas that day.  You been duck hunting?  I think Oswald was a good old-fashioned decoy.  What'd he say?  ""I'm just a patsy.""  Out of the mouth of babes y'ask me."
jim,"You think there were other men involved, Russell?"
long,"Hell, you're the District Attorney. You read the Warren Report - and then you tell me you're satisfied Lee Oswald shot the President all by his lonesome."
jim,"Russell, honestly you sound like one of those kooky critics spreading paranoia like prairie fire.  I just can't believe the Chief Justice of the United States would put his name on something that wasn't true."
long," Honey, another one of these.  This one's as weak as cricket pee-pee. Yessir, you mark my words, Jim, Vietnam's gonna cost Johnson '68 and it's gonna put that other varmint Nixon in - then watch your hide, 'cause there ain't no offramps on a freeway to Hell!"
liz,"Jim, dinner's just about ready... I've got a surprise for you... tried something new... Jim?  Jim, dinner."
jim," Mmmmm... sure smells good... but Egghead, do you realize Oswald was interrogated for twelve hours after the assassination, with no lawyer present, and nobody recorded a word of it?  I can't believe it.  A police captain with 30 years experience and a crowd of Federal agents just had to know that with no record anything that Oswald said would be inadmissible in court."
