Speaker,Dialogue
jean hill,He asked me why I thought I was in danger and I said:
jean hill,"Well if they can kill the President, they can certainly get me."
lawyer,"That doesn't make sense, Mrs. Hill. We have the man that killed the President."
jean hill,"No, you don't!"
jean hill,"He kept trying to get me to change my story about the shots.  He was getting hot under the collar, and telling the woman not to write when he wanted."
jean hill,"Look, do you want the truth, or just what you want me to say?"
lawyer,I want the truth.
jean hill,The truth is that I heard between four and six shots.  I'm not going to lie for you.
lawyer,...you heard echoes.
jean hill,No.  I had guns all my life.  I used to go turtle shooting.
lawyer,I realize you're under a great deal of stress .. it's clouded your judgement.
lawyer,"Look, we can put you in a mental institution.  We can make you look crazier'n Marguerite Oswald, and everybody knows how crazy she is."
jim,"Are you willing to testify, Mrs. Hill?"
jean hill, Damned right I would.  Somebody's got to tell the truth around here 'cause the Government sure ain't doing it.
lou,The Zapruder film establishes 3 shots in 5.6 seconds.  Here.  I'm Oswald. Time me.
jim,Go!
lou,Time?
jim,Between six and seven seconds.
lou,"The key is the second and third shots came right on top of each other, and it takes a minimum 2.3 seconds to recycle this thing.  Blocking the first two shots at the time they occur in the Zapruder film."
jim,Didn't Hoover say something about that?  The leaves had fallen off in November?
lou,"It was a Texas Live Oak, boss.  It sheds it's leaves the first week of March.  You try to hit a moving target at 88 yards through heavy foliage with this cheap 13-dollar sucker, the world's worst shoulder weapon.  No way.  The FBI tried two sets of tests and not one of their sharpshooters could match Oswald's performance.  Not one.  And Oswald was at best a medium shot.  The scope was defective on it, too.  I mean this is the whole essence of the case to me.  The guy couldn't do the shooting.  Nobody could.  And they sold this lemon to the American public."
jim,"The Zapruder film is the proof they didn't count on, Lou.  We gotta get our hands on it."
lou,That means we gotta subpoena Time- Life on it.
jim, Why not just shoot Kennedy coming up Houston?  There's plenty of time - he's out in the open - a frontal shot?
lou,"I asked myself the same thing.  Common sense.  Even if you miss the first shot, if he accelerates you still got him for a second shot.  No... the only reason for waiting to get him on Elm is you got him in a triangulated crossfire.  You got him on a flat low trajectory from the front at the fence there."
lou,"...you put a third team there - in that building, on a low floor."
lou,"When Kennedy gets to the kill zone, it's a turkey shoot."
jim, How many men?
lou,"One shooter.  One spotter on a radio. Maybe three teams.  I'd say these were professional riflemen, chief, serious people.  Hunters...  patient. It takes skill to kill with a rifle, that's why there's been no execution of an executive with one in 200 years... ""3-2-1...  green!""  Or else ""Abort!  Abort!"""
lou,Main Street's over there - the original parade route on the way to the Trade Mart.  Too far right? Impossible shot.
lou,So they changed the route to bring it this way.
jim,Who do you think changed the parade route?
lou,"Beats me.  City officials.  Secret Service.  Dallas police.  They did a dry run with Chief Curry a few days before.  But they didn't bother running through Dealey.  They stopped right there, said something like, ""and afterwards there's only the freeway,"" and went home."
jim,You know who the mayor was?
lou,No.
jim,Earle Cabell.  And guess who his brother is?
lou,Who?
jim,"General Charles Cabell.  Deputy Director of the CIA.  Fired by Kennedy in '61 because of the Bay of Pigs fiasco, he moved back to the Pentagon, called Kennedy a ""traitor"".  When he came to New Orleans to address the Foreign Policy Association, you know who introduced him?  Our friend Clay Shaw."
lou,The Warren Commission call him?
jim, His boss was the one on the Warren Commission who handled all the leads to the intelligence community.
lou,Allen Dulles?
jim," Talk about the fox investigating the chicken coop.  Now we'll have to subpoena them, Lou."
lou,"They're gonna love you, chief."
jim,"Maybe we should just call it a day, Lou.  Go home.  While we're still a little behind.  We got two people killed, maybe more we never thought about."
lou,"You never got anyone killed, boss. Their actions killed them years before.  If we stopped now, it'd be even more wrong."
jim," Subpoena them, Lou - Dulles, the Cabells, Time-Life... the whole damned lot of 'em!"
al,"The U.S. Attorney in Washington ""declines"" to serve our subpoena on Allen Dulles, Charles Cabell, CIA Director Richard Helms, or any FBI agent we named."
jim,"Well, what do you expect from a pig but a grunt."
al,"Without them, it's going to be near impossible, chief, to prove Shaw's connection to the CIA.  We got the same problem with the governors. All of them.  Reagan in California won't give us Brading, Ohio refuses Orville Townsend, Texas on Arcacha, and Nebraska on Sandra Moffet."
bill,What the hell is going on?  Never before has an extradition request from this office been refused.
al,We haven't tried to get Julia Anne Mercer in?
jim,"No, she could get hurt.  If you believe what's happening to these other people."
numa,She's the best damn witness we have!
jim,I just don't want to do it.  What else?
numa,Hate mail here.  Fan mail here.  The bad news is the IRS has just requested an audit on your income from this office.
jim," Well, maybe that's good news - it was never as good as combat, but this is.  Bill, any more on Oswald and Shaw?"
bill,Yeah.  They were seen together in Clinton in early September.  The Civil Rights Movement was running a voter registration drive.
bill,"...rumor is Shaw, a local boy, was working on some arms deal to discredit the civil rights movement.  No one really knows what they were doing there, but everyone sure saw 'em. They stood out like cottonballs.  I got whites and blacks saw 'em, but last time I checked there was nothing illegal with registering to vote. We still got the Negro junkie, Vernon Bundy, saw 'em talkin' at the seawall near Lake Pontchartrain.  But it's tough, boss - no one wants to talk about Shaw.  He's..."
lou, You know you keep saying that.
bill,Keep saying what?
lou,You're not digging.
jim,"I think Clinton is a breakthrough. Shaw denies he knows Ferrie or Oswald. Is that right?  It proves he's a liar.  Keep on it, Bill. "
susie,"This is interesting - are you ready for this?  Oswald went to see the FBI two weeks before the assassination.  It seems Special Agent Hosty made three routine visits to his house, supposedly to keep an eye on Marina Oswald."
oswald,I want to see Special Agent Hosty.
receptionist,"I'm sorry, he's not in.  Can someone else help you?"
oswald,Can I use a pen?
susie,But what the note really said no one knows because his boss Shanklin told Hosty...
jim," Come on guys, think - that's the only reason to destroy it, because if it was any kind of threat, like Hosty said, they would've kept it 'cause it makes their case against the ""angry lone nut"" stronger! Remember the New Orleans meeting with Agent Quigley the day he got busted?"
jim,...there again Quigley destroyed the notes of the meeting.  I think we can raise the possibility that Oswald not only was an informant but that he may well have been the original source for the telex we have dated November 17 warning of the Kennedy assassination in Dallas on November
jim,"William Walter, the night clerk on duty here in the FBI office, gave me a copy of this.  It went all over the country.  Nothing was done, and the motorcade went ahead on schedule - and this wasn't even mentioned in the Warren Report!  Read it, Al."
jim,"I have a hunch that from the get go, Oswald had infiltrated this group, probably Cubans or right-wing extremists.  He was at the Book Depository that day, told to be there by their handlers, either to prevent the assassination or to take part in it.  They coulda told him anything, either 1) they were going to close down the plotters that day, or 2) they were going to fake an attack on Kennedy to whip up public opinion against Russia or Cuba and reverse his policies - it doesn't really matter what they told him, 'cause he was under orders, he was a foot soldier."
oswald, I can get you in and up there.  This is a shot out the southeast window of the sixth floor.  That floor will be unoccupied between noon and one.
bull,What about the elevator?
oswald,I can close it off.  The only access is a stairwell.
bull,We get them in as an air-conditioning unit.
ruby,"No.  A floor refurbishing group. Got the van, the uniforms..."
oswald, He's a dead duck.
bill,"I don't buy it, chief - why would the FBI cover it up?  You're talking the whole FBI here.  A telex that disappears from every single FBI office in the country?"
jim,There's a word - orders.
susie,"Or a cover up!  Jesus, Bill, don't you have enough proof of the FBI's complicity now?"
bill," Maybe I have a little more respect for this country's institutions than you do, Susie.  You tell me how the hell you can keep a conspiracy going between the Mob, the CIA, FBI, and Army Intelligence and who knows what else, when you know you can't even keep a secret in this room between 12 people!  We got leaks everywhere! We're going to trial here!  What the hell do we really got?  Oswald, Ruby, Banister, Ferrie are dead.  Shaw - maybe he's an agent, I don't know, but as a covert operator in my book he's wide open for blackmail 'cause of his homosexuality."
jim,"Shaw's our toehold, Bill.  I don't know exactly what he is, where he fits, and I don't care.  I do know he's lying through his teeth and I'm not gonna let go of him!"
bill,"So for those reasons, you're going to trial against Clay Shaw, chief? Well, you're gonna lose!  We should be investigating all our Mafia leads here in New Orleans - Carlos Marcello, Santos Trafficante - I can buy that a hell of a lot easier than the Government.  Ruby's all Mob, knows Oswald, sets him up.  Hoffa - Trafficante - Marcello, they hire some guns and they do Kennedy and maybe the Government doesn't want to open up a whole can o'worms there because it used the Mob to get to Castro.  Y'know, Castro being assassinated sounds pretty wild to John Q.  Citizen.  So they close the book on J.F.K.  It makes sense to me."
jim,"I don't doubt their involvement, Bill, but at a low level.  Could the Mob change the parade route, Bill, or eliminate the protection for the President?  Could the Mob send Oswald to Russia and get him back?  Could the Mob get the FBI, the CIA, and the Dallas Police to make a mess of the investigation?  Could the Mob appoint the Warren Commission to cover it up?  Could the Mob wreck the autopsy?  Could the Mob influence the national media to go to sleep? And since when has the Mob used anything but .38's for hits, up close? The Mob wouldn't have the guts or the power for something of this magnitude.  Assassins need payrolls, orders, times, schedules.  This was a military-style ambush from start to finish... a coup d'etat with Lyndon Johnson waiting in the wings."
bill,"Oh, now you're saying Lyndon Johnson was involved?  The President of the United States?"
jim,"I know this, Bill - Lyndon Johnson got $1 billion for his Texas friends, Brown and Root, to dredge Cam Ranh Bay for the military in Vietnam. That's just for openers."
bill,"Boss, are you calling the President a murderer?"
jim,"If I'm so far from the truth, why is the FBI bugging our offices?  Why are our witnesses being bought off and murdered?  Why are Federal agencies blocking our extraditions and subpoenas when we were never blocked before?"
bill,Maybe 'cause there's some rogue element in the Government!
jim,"With a full-blown conspiracy to cover it up?  Y'ever read your Shakespeare, Bill?"
bill,Yeah.
jim,"Julius Caesar:  ""Brutus and Cassius, they too are honorable men.""  Who killed Caesar?  Twenty, twenty-five Senators.  All it takes is one Judas, Bill - a few people, on the inside, Pentagon, CIA..."
bill," Jim sighs, saddened.  Bill was one of his best men."
lou,"Chief, I've had my doubts about Bill for a long time.  He's fighting everything."
jim,We need him back.
al,Bill wasted a goddamn month trying to prove that mob boys like Barding and Jack Ruby played ball in right field with Hunt Oil.
lou,I don't trust the guy.
jim," We all need to make room for someone else's ideas, Lou, especially me. Maybe Oswald is what everyone says he is and I'm just plain dumb wrong."
al,"I've seen him copying files, leaving here late at night."
lou,I just plain don't trust him anymore.
jim," Maybe you didn't hear what I said. I will not tolerate this infighting among the staff, I warn you that..."
lou," Boss, then I'm afraid I can't continue working with Bill."
jim," Are you giving me an ultimatum, Lou?"
lou,"Well, if that's what you want to call it.  I didn't ever think it would come to this.  I guess I am, boss."
jim,"I will not have any damned ultimatums put to me, Lou.  I'll accept your resignation."
lou,You sure got it.  You're one stubborn and stupid sonofabitch D.A. and you're making one hell of a mistake!
susie,Aren't you being a little hard?
jim,"No, I don't think I am, Susie.  Anyone else?"
mattie,My God!  My God!  What have they done!  It's lynchin' time!
virginia,I'll get it.  Hello.
male voice,Hello.  Is this Jim Garrison's daughter?
virginia,Yes?
male voice,Virginia or Elizabeth?
virginia,Virginia.
male voice,"Virginia, you're a lucky little girl. Your daddy has entered you in a beauty contest.  Would you like to be in a beauty contest?"
virginia,That sounds fun.
male voice,I need some information from you then.  How old are you?
virginia,Six.
male voice,And how tall are you?
newsman 9,"To repeat - 39-year-old Martin Luther King, who preached non-violence and won the Nobel Peace Prize, was cut down earlier today by a sniper's bullets while standing on the porch of the Lorraine Motel in Memphis, Tennessee.  He was surrounded by his closest aides.  The police say they have no suspects at this time.  Mr. King..."
male voice,And you get of from school at 3 every day?
virginia,Yes.
male voice,Do you walk home?
virginia,Uh huh.
liz, Who are you talking to?
male voice,"Okay, Virginia, that's all I need to know.  I'll call you again when it's time for the beauty contest."
liz,Who's this?... Hello?... Hello?
virginia," Mama, I'm going to be in a beauty contest!"
liz,What did he ask you?
virginia,"Well, he asked me everything.  He asked me..."
liz,Did you enter Virginia into a beauty contest?
jim, What?
liz, A man just called.  He asked her everything!
jim," Honey, some crackpot.  Martin Luther King was killed in Memphis today!"
liz, Your daughter's life was just threatened!
jim,Just a crank making phone calls. Happens a dozen times a day at the office.
liz,"Our home, Jim!  A kidnapper, a murderer, who knows!"
jim,"Only cowards make crank calls, sweetheart, nothing is going to happen."
liz,"How do you know?  How do you even know what goes on in this house anymore!  You're too busy making speeches, stirring up every crazed Klansman in Louisiana after us!"
jim,Get a hold of yourself.
liz,I'm leaving.  I'm taking the kids and I'm leaving!  I won't stand it anymore.
jim,"Honey, come on.  The government wants you to be scared.  They want everybody to be scared to speak out.  They count on it.  But there's nothing to be scared of."
liz,You and your government!  What's the matter with you?  Don't you have any feelings?  Your daughter!  What kind of man are you?
jim,"I'll take them up to my mother's if it'll make you feel better.  Spend a week.  I'll change the locks, the phone lines, I'll even get a bodyguard, all right?  Elizabeth, get a hold of yourself."
liz,"Jim, before this Kennedy thing, nothing mattered to you in this life more than your children.  The other night Jasper tried to show you a drawing.  You didn't even notice he was there.  He came to me bawling his little eyes out.  Jim, he's sensitive - he needs more from you."
jim,I promise I'll make more time for Jasper.
liz,Is it such a chore?  I don't understand you.
jim,"Damn it, if I say I'll spend more time with him, I'll spend more time with him.  I can't fight you and the world too, Liz."
liz,"I'm not fighting you, Jim, I'm just trying to reach you.  You've changed."
jim,"Of course, I've changed!  My eyes have opened, and once they're open, believe me, what used to look normal seems insane!  And now King.  Don't you think this has something to do with that?  Can't you see?"
liz," I don't want to see, goddammit!  I'm tired.  I've had enough!  They say you don't have anything anyway! Everybody in town's talking.  You're ruining this man Shaw's life!  You're attacking him because he's homosexual! Going ahead with this stupid ""trial""! Did you ever once stop and consider what he's going through?"
jim, That's not why I'm attacking him! You don't believe me - all this time you never believed me.
liz,"Oh, I don't know anymore!  I believe there was a conspiracy, but not the government.  I just want to raise our children and live a normal life! I want my life back!"
jim,"Well so do I, goddammit!  So do I! I had a life too, y'know - I had a life, too.  But you just can't bury your head in the sand like some ostrich, goddammit, Elizabeth!  It's not just about you - and your well- being and your two cars and your kitchen and your TV and ""I'm jes fine honey.""  While our kids grow up into a shithole of lies!  Well, I'm not ""fine"" about that, I'm angry. My life is fucked, Liz!  And yours is, too!  And if you don't want to support me I can understand that but don't you go start making threats of taking the children away."
liz,"You never talked to me this way before, Jim Garrison.  I'm not making any threats.  I'm leaving you.  I'm taking the kids to my mother's.  I am - I am."
jim,"Go on then, get out!  Go hide someplace.  Join the rest of them! They'll tell you I'm crazy.  You got plenty of people'll tell you Jim Garrison's crazy.  You won't have a problem filing your divorce papers on me ...somebody's got to try, goddammit, somebody!"
jasper,"Are we going away, Daddy?"
jim,"Well, it looks like it, Jasper."
jasper,"Because of Kennedy?  Are the same people gonna kill us, Daddy?"
jim,"No, Jasper, nobody's gonna kill us."
virginia,Do you love us?
jim,"Yes, of course I do, honey."
virginia,No.  I mean like mommy loves us. She really loves us.
jasper,I'm scared.
jim," There's nothing wrong with feeling a little scared, Jasper, Virginia. Telling the truth can be a scary thing.  It scared President Kennedy, but he was a brave man.  If you let yourself be too scared, then you let the bad guys take over the country, don't you - and then everybody gets scared."
sidekick,"And now, Jerry, here's Big Jim Garrison, District Attorney of New Orleans, Louisiana."
johnson,"Welcome, District Attorney Garrison. May I call you Jim?"
jim,"I've been called everything under the sun, Jerry.  Call me whatever you like."
johnson,"First we had your charge that the Cuban exiles killed the President, then the Mob, then you said the oil billionaires did it, then you said the Minutemen and the Ku Klux Klan collaborated to do it, now your latest theory seems to be that the CIA and the FBI and the Pentagon and the White House all combined in some elaborate conspiracy to kill John Kennedy.  Let me ask you, is there anyone besides Lee Harvey Oswald who you think did not conspire to kill the President?"
jim,"How many hours do I have to answer that one?  Well let's just say this, Jerry - I've stopped beating my wife.  Or maybe you should ask Lyndon Johnson.  We know he has some answers."
johnson,"There have been a number of reports in reputable news media - Time, Newsweek, our own NBC - that you have gone way beyond the legal means available to a prosecutor, that you've intimidated and drugged witnesses, bribed them, urged them to commit perjury.  What is your response?"
jim,"Your faith in the veracity of the major media is touching, Jerry.  It indicates that the Age of Innocence is not yet over.  But seriously, Jerry, people aren't interested in Jim Garrison - they want the hard evidence!  They want to know why he was killed and what forces were opposed to..."
johnson, Some people would say you're paranoid.
jim,"Well, if I am, why is the Government concealing evidence?"
johnson,Are they?  Why would they?
jim," That's exactly my question, Jerry. Maybe I'd better show you some pictures so you can begin to understand what I am talking about."
jim,"These arrests were photographed minutes after the assassination, and were never shown to the American public.  They show..."
johnson, Pictures like this don't show up on television!
jim, Sure they do.  The camera can pick this up.
johnson," No, it can't!"
jim," Those men you just saw were arrested in Dallas minutes after the assassination.  They were never seen again.  No record of arrest, no fingerprint, no mugshot, nothing. They all got away."
johnson,We'll be back after these messages.
al,"Jim, bad news.  Bill's turned, boss. I think he's given everything we've got to the Feds."
numa,"We studied the memos - there was nothing there, chief, nothing!  When we went to confront him, the landlady said that sonofabitch just took off, left everything."
susie,I'm sorry.
jim,I know.
liz, I'm sorry.
numa,Something sure scared him.
jim,Bill doesn't scare that easy. Somebody got to his thinking.  He was never that good a thinker.
newsman 9,"Much is at stake tonight in California.  Public opinion polls show Senator Robert Kennedy of New York leading Senator Eugene McCarthy of Minnesota.  Their anti-Vietnam War message is obviously striking a chord with the voters, and whoever wins tonight will certainly emerge as the favorite over Vice-President Humphrey to win the nomination in Chicago in August.  That man now seems to be Senator Kennedy."
numa,Sure sounds like he's winning.
jim,"He'll never make it.  If he wins, they'll kill him.  He wants to avenge his brother.  He'll stop that war. No, they'll kill him before they let him become President."
al,"Boss, with Broussard they have everything.  All our witnesses, our strategy for the trial.  We'd have to doublecheck all his work, there could be false leads... we gotta rethink this trial."
jim,"I don't think so, Al.  You remember the Hemingway story, ""The Old Man and the Sea""?  The old fisherman manages to catch this great fish - a fish so huge he has to tie it to the side of the boat to get it back in.  But by the time he reached shore, the fish had long since been picked apart by sharks and nothing was left but the skeleton."
numa,Then what are we going through all this trouble for?
jim,"It's a means to an end.  This war has two fronts - in the court of law, we hope, against the odds, to nail Clay Shaw on a conspiracy charge. In the court of public opinion, it could take another 25 or 30 years for the truth to come out, but at least we're going to strike the first blow."
liz,And if you're wrong?
jim," Will you come to the trial, Elizabeth?"
liz,"I don't think so, Jim..."
newsman 1,"With 53% of the precincts reporting, Senator Kennedy continues to hold a lead of 48% to 41% over Senator McCarthy.  CBS News has projected Senator Robert Kennedy the winner of the crucial California primary."
robert kennedy," ...and that is what has been going on within the United States over the last three years - the division, the violence, the disenchantment, whether it's between blacks and whites, between poor and the more affluent, or between age groups or the war in Vietnam - we can start to work together.  We are a great country, an unselfish country and a compassionate country.  I intend to make that my basis for running."
newsman 1, SENATOR KENNEDY HAS BEEN SHOT!  WE DO NOT KNOW HOW SERIOUS IT IS YET. SENATOR KENNEDY HAS BEEN SHOT.
jim,"They killed him, honey."
liz, Huh?
jim, He won... and they killed Robert Kennedy.  They shot him down.
liz," Oh no!  No!  I can't believe it.  I can't believe it.  Both of them, both brothers, oh my God!"
liz,"You're right, it hasn't ended, has it?"
jim, I wish I could've loved you more... I feel sometimes like I didn't ever.. love you or the children enough... I'm sorry.
dymond," That's who you say you saw... a confessed homosexual, convicted of solicitation, pandering... a man who has lied about most everything, who..."
bundy,"It was that man there, yessir.  He was at the Pontchartrain wall with the man who shot the President.  I remember him cause o' his limp there."
dymond,"A heroin addict, injecting himself at the wall, barely conscious..."
collins," ...that was the man there.  He dropped Oswald off on the voter line.  I remember 'cause they were the only white strangers around that morning. That big, black Cadillac of his made me think they might be FBI."
town marshall, ...said he was a representative of one International Trade Mart in New Orleans.
dymond,"...more than five years ago, for two minutes.  It's fair to say you could be mistaken, isn't it?"
andrews,"...figment of my imagination... The cat's stewing me, the oyster's shucking me I told him, you got the right at-at but the wrong oh-oh... Bertrand is not Shaw, scout's honor and you can tell him I said so..."
susie," Objection, your Honor.  This office has won a conviction of perjury against Dean Andrews on this matter."
dymond,Exception taken.  That case is on appeal!
dymond," Mr. Goldberg, you claim you met David Ferrie and Clay Shaw while on a vacation here from your accounting business in New York, you had drinks and, under the influence discussed killing Kennedy, is that not so?"
goldberg,I did.
dymond,Why?
goldberg,"Well, I wanted to make sure she's the same girl I sent."
