Speaker,Dialogue
liz,"Come on now, we'll talk about it at the table, dinner's getting cold.  What are you doing in here?"
jasper,Daddy said it was all right if I was real quiet.
jim," Sure it is.  Freckle Face, if I ever handled a minor felon like that, it'd be all over the papers.  I'd catch hell.  And this is the alleged murderer of the President?"
jim,"Again and again they ignore credible testimony, leads are never followed up, its conclusions are selective, there's no index, it's one of the sloppiest, most disorganized investigations I've ever seen.  Dozens and dozens of witnesses in Dealey Plaza that day are saying they heard shots coming from the Grassy Knoll area in front of Kennedy and not the Book Depository behind him, but it's all broken down and spread around and you read it and the point gets lost."
mattie,I never did believe it either!
liz," Uh huh... Mattie, I'll do the dishes, you take Be up now.  And Elizabeth, too, your bedtime, honey."
liz,"Honey, that was three years ago - we all tried so hard to put that out of our minds, why are you digging it up again?  You're the D.A. of New Orleans.  Isn't the Kennedy assassination a bit outside your domain?  I mean all those important people already studied it."
jim,I can't believe a man as intelligent as Earl Warren ever read what's in those volumes.
liz,"Well maybe you're right, Jim.  I'll give you one hour to solve the case... until the kids are in bed.  Then you're mine and Mr. Kennedy can wait 'til morning.  Come on, everybody say goodnight to Daddy."
jasper," Dad, look what I drew."
jim," That's something, Jasper.  What is it?"
jasper,A rhinoceros.  Can I stay up another hour?
jim," Pickle and Snapper, my two favorite dancing partners."
jim,"Goodnight, my doodle bugs."
kids,"Goodnight, Daddy."
liz,"One hour, y'hear?  Some Saturday night date you are.  Mama warned me this would happen if I married such a serious man."
jim,"Oh, she did, huh?  When I come up I'll show you how Saturday night got invented."
bowers,"I sealed off the area, and I held off the trains until they could be examined, and there was some transients taken on at least one train."
attorney,Mr. Bowers... is there anything else you told me I haven't asked you about that you can think of?
bowers,Nothing that I can recall.
attorney,Witness is excused.
bowers,"Towards the underpass, I saw two men standing behind a picket fence... they were looking up towards Main and Houston and following the caravan as it came down.  One of them was middle-aged, heavyset.  The other man was younger, wearing a plaid shirt and jacket."
bowers,There were two other men on the eastern end of the parking lot. Each of 'me had uniforms.
bowers,At the time of the shooting there seemed to be some commotion... I just am unable to describe - a flash of light or smoke or something which caused me to feel that something out of the ordinary had occurred there on the embankment...
jim,NO!
liz,"Honey, you all right? "
jim,"It's incredible, honey - the whole thing.  A Lieutenant Colonel testifies that Lee Oswald was given a Russian language exam as part of his Marine training only a few months before he defects to the Soviet Union.  A Russian exam!"
liz," I cannot believe this.  It's four- thirty, Jim Garrison.  I have five children are gonna be awake in another hour and ..."
jim,"Honey, in all my years in the service I never knew a single man who was given a Russian test.  Oswald was a radar operator.  He'd have about as much use for Russian as a cat has for pajamas."
liz,"These books are getting to your mind, Mr. Garrison.  I wish you'd stop readin' them."
jim,"And then this Colonel tries to make it sound like nothing.  Oswald did badly on the test, he says.  ""He only had two more Russian words right than wrong.""  Ha!  That's like me saying Touchdown here...  ...is not very intelligent because I beat him three games out of five the last time we played chess."
liz," Jim, what is going on, for heaven's sake!  You going to stay up all night every night?  For what?  So you'll be the only man in America who read the entire 26 volumes of the Warren Report?"
jim,"Liz, do I have to spell it out for you?  Lee Oswald was no ordinary soldier.  That was no accident he was in Russia.  He was probably in military intelligence.  That's why he was trained in Russian."
liz," Honey, go back to sleep, please!"
jim,Goddammit!  I been sleeping for three years!
liz,"Will you stop rattling on about Kennedy for a few minutes, honey... come on."
jim,"Morning, boys.  Ready for a walking tour?"
bill,"At 7:30 Sunday morning?  It's not exactly fresh blood we're sniffing here, boss."
jim," Old stains, Bill, but just as telling."
jim,Remember whose office this was back in '63?  531 Lafayette Street.
lou,"Yeah, Guy Banister.  Ex-FBI man.  He died couple years ago."
jim,"544 Camp Street.  Same building as 531 Lafayette, right... but different address and different entrances both going to the same place - the offices on the second and third floors."
jim,Guess who used this address?
banister, Asshole.
jim,"He was arrested that day for fighting with some anti-Castro Cubans... but actually he had contacted them a few days earlier as an ex-Marine trying to join the anti-Castro crusade. When they heard he was now pro-Castro, they paid him a visit."
carlos," You sonofabitch, you liar, you're a Communist, go back to Moscow."
oswald,"Okay, Carlos, if you want to hit me, hit me."
jim,But the arrest gets him a lot of publicity and as a result Oswald appears on a local TV debate that established his credentials as a Communist.
bringuier,"But you're a Communist, are you not, and you defected to Russia."
oswald,"No, I am not a Communist.  But I am a Marxist-Leninist."
bringuier,What did you do when you were in Russia?
oswald," I worked while I was there.  I was always under the protection of... that is to say, I was not under the protection of the U.S. Government."
bill,What the hell's a Communist like Lee Oswald doing working out of Banister's?
jim,"Y'ever heard of a double agent, Bill? I'm beginning to doubt Oswald was ever a Communist... after the arrest, 544 Camp Street never appeared on the pamphlets again.  Now here's another one for you:  What would you say if I told you Lee Oswald had been trained in the Russian language when he was a Marine?"
lou,I'd say he was probably getting intelligence training.
jim,"Lou, you were in the Marines.  Who would be running that training?"
lou,The Office of Naval Intelligence.
jim,Take a look across the street.
lou,Post Office.
jim,"Upstairs.  In 1963 that was the Office of Naval Intelligence - And just by coincidence, Banister, before he was FBI, was ONI.  What do they say?"
lou,"""Once ONI, always ONI""?"
bill,"Well, he likes to work near his old pals."
jim,"Bill, Lou, we're standing in the heart of the United States Government's intelligence community in New Orleans.  That's the FBI there, the CIA, Secret Service, ONI.  Doesn't this seem to you a rather strange place for a Communist to spend his spare time?"
lou,"What are you driving at, boss?"
jim,"We're going back into the case, Lou - the murder of the President.  I want you to take some money from the Fees and Fines Account and go to Dallas - talk to some people.  Bill, I want you to get Oser on the medical, the autopsy, Susan on Oswald and Ruby histories, tax records..."
bill,"Lord, wake me, please.  I must be dreaming."
jim,"No, you're awake, Bill, and I'm dead serious.  And we're going to start by tracking down your anonymous source from three years ago.  How did you find out Dave Ferrie drove to Texas that day?"
jim,"You're not under cross-examination here, Jack."
jim,"Here's my problem, Jack.  You told me you and Guy were good friends for a long time?"
martin,More than ten years.
jim,And he never hit you before?
martin,Never touched me.
jim,"Yet on November 22, 1963 - the day of the President's murder - our police report says he pistol-whipped you with a .357 Magnum.  Now, does a simple argument over phone bills sound like a believable explanation to you?"
martin," No, it involved more than that."
jim,How much more?
martin, I don't know if I should talk about this.
jim,"Well, I'd ask Guy - we were friendly, you know - heart attack, wasn't it?"
martin,If you buy what you read in the paper.
jim,You have other information?
martin,I didn't say that.  All I know is he died suddenly just before the Warren Report came out.
jim,"Why did Guy beat you, Jack?"
martin,"Well, I guess now that Guy's dead, it don't really matter... it was about the people hanging around the office that summer.  I wasn't really part of the operation, you know.  I was handling the private-eye work for Guy when that came in - not much did - but that's why I was there... it was a nuthouse.  There were all these Cubans coming and going.  They all looked alike to me."
martin,Dave Ferrie - you know about him?
martin,"Anyway, late summer the party ended. Kennedy didn't want another Bay of Pigs mess, so he ordered the FBI to shut down the camps and confiscate the napalm and the C-4.  There were a buncha Cubans and a couple Americans arrested, only you didn't read about it in the papers.  Just the weapons got mentioned... 'cause the first ones behind bars would've been Banister and Ferrie, but I think the G-men were just going through the motions for Washington.  Their hearts were with their old FBI buddy Banister."
martin,"Like I said, a fuckin' nuthouse."
jim,And Oswald?
martin," Yeah, he was there, too... sometimes he'd be meeting with Banister with the door shut.  Other times he'd be shooting the bull with Ferrie.  But he was there all right."
jim,"Anything more specific, Jack?  It's important."
secretary,"I can't believe it, Mr. Banister. Lee Oswald is down on Canal Street giving out Communist leaflets supporting Castro!"
banister,"It's okay, Delphine, he's with us."
jim,Anyone else involved at Banister's level?
martin, Oswald was with him.
martin,"He had something to do with money. I remember him cause Guy, who didn't kiss anybody's ass, sure kissed his."
martin,"Clay something, that was his name - Clay."
jim,Bertrand.  Clay Bertrand?
martin,Yeah!  That's it.  I don't know.  Maybe it wasn't.  I gotta go.
jim," Was Kennedy ever discussed, Jack?"
martin,"Sure.  'Course they hated the sonofabitch, but..."
jim,"The assassination, Jack?"
jim,"Hold on, Jack.  What's the problem?"
martin,"What's the problem?  What's the problem?  Do I need to spell it out for you, Mr. Garrison?  I better go."
jim,"Nobody knows what we're talking about, Jack."
martin,"You're so naive, mister."
bill,"Well, it's a terrific yard, Chief, but the man's an obvious alcoholic with a reputation lower than crocodile piss."
jim,"Does that bother you, Bill?  I always wondered in court why it is because a woman is a prostitute, she has to have bad eyesight."
bill,"He'll never sign a statement, boss, let alone get on a witness stand."
jim,"When something's rotten in the land, Bill, it generally isn't just one fish, we'll get corroboration... find this Clay Bertrand.  If I were a betting man, I'd give you 10 to 1 it's an alias.  Start checking around the Quarter."
bill,"And the six of us, with almost no budget and in secret, are going to solve the case that the Warren Commission with dozens of support staff and millions of dollars couldn't solve.  We can't keep up with the crimes in the Parish as it is, Chief."
jim,"The murder of a President, Bill, is a crime in Orleans Parish too.  I didn't pick you because of your legal skill, you know."
bill,"Gee, thanks boss."
jim,But because you're a fighter.  I like a man who isn't scared of bad odds.
black woman,"How ya doing, Mr. Garrison?  Remember me - from the piano bar at the Royal Orleans?"
jim,"I sure do.  We sang ""You're the Cream in My Coffee."""
jim," Make sure we come back here, now."
jim,"Been too busy, Paul - an elected man can't have as much fun as he used to.  Welcome back, Lou.  Find out anything on those hobos?"
lou,"They took 'em to the Sheriff's office, not the police station, and they let 'em go.  No record of them ever being questioned."
jim,I can't say that comes as a surprise anymore.
lou,A photographer from The Dallas Times Herald got some great shots of them never published...
lou,"...take a good look, chief, do any of 'em look like the hoboes you remember?"
jim,Hoboes I knew of old used to sleep in their clothes - these two look pretty young.
lou,"...not a single frayed collar or cuff, new haircuts, fresh shaves, clean hands - new shoe leather. Look at the ear of the cop... That's a wire.  What's a cop wearing a headset for?  I think they're actors, chief; they're not cops."
jim,"Who the hell are they, then!  Hi, Susie, sit down.  This could be it.  Let's start looking for 'em."
lou,Graveyard dead.  August this year. 
jim," We need to find more witnesses, Lou."
lou,There was Rose Cheramie.  A whore. Two Cubans threw her out of a car on the way to Dallas.
jim,Can we find her?
lou,"Graveyard dead near Big Sandy, Texas in '65.  Two in the morning on some highway.  A hit and run."
bill,"Why not go right to the horse's mouth, chief?"
jim,"If we go to him our investigation'll hit the front pages by sunrise. Blow up right in our face.  Ruby was just given a new trial.  If he has something to say, it'll be there. Susie, what did you find out on Oswald?"
susie,"Negative on his tax records. Classified.  First time I know a D.A. can't get a tax record.  I put together a list of all the CIA files on Oswald that were part of the Warren Report and asked for them.  There are about 1200 documents...  Oswald in the USSR, in Mexico City, Oswald and the U2, a CIA 201 personnel file, a memo from the Director on Oswald, travel and activities - can't get one of them.  All classified as secret on the grounds of national security.  It's real strange."
bill,"Maybe there's more to this, Susie. The CIA's keeping something from our enemies."
susie,"Yes, but we're talking about a dead warehouse employee of no political significance.  Three years later and he's still classified?  They gave us his grammar school records, a study of his pubic hairs... Put it in context, Bill, of what we know about Oswald.  Lonely kid, no father, unstable childhood, high school dropout - wants to grow up and be a spy, joins the Marines at 17.  He learns Russian, he acts overtly Marxist with two other marines, but he's stationed at a top secret base in Japan where U2 spy flights over Russia originate.  He's discharged from the Marines supposedly because his mother's sick.  He stays home 3 days, then with a $1500 ticket from a $203 bank account, he goes to Moscow..."
oswald," I want to renounce my citizenship and become a Soviet citizen.  I'm going to make known to them all information I have concerning the Marine Corps and my specialty therein, radar operation..."
oswald,"I will never return to the United States for any reason.  It is a capitalist country, an exploitive, racist country.  I am a Marxist since I was 15.  I've seen poor niggers and that was a real lesson.  People hate because they're told to hate, like school kids.  It's the fashion to hate people in the U.S."
susie,"Finally they shuttle him to a radio factory in Minks where he lives as high on the hog as he ever has - he's given 5,000 rubles, a roomy apartment with a balcony, has affairs with local girls."
jim,Makes sense - he's a spokesman.
susie,"But he never writes, speaks, or does any propaganda for the Russians.  He meets Marina, whose uncle is a colonel in Soviet intelligence, at a trade union dance; she thinks he's Russian the way he speaks, six weeks later they marry, have a daughter."
numa,Didn't someone say he didn't speak good Russian?
jim,"It's a contradiction, Numa, get used to them.  The only explanation for the royal treatment is he did give them radar secrets.  Or fake secrets."
bill,"Susie, you're an assistant D.A., remember.  Stick to what you can prove in court."
susie,"You want facts, Bill?  Okay.  From 1945 to '59 only two U.S. soldiers defect to Russia.  From '59 to '60, seven defect, six return, one of them another Marine a month before Oswald.  All of them young men made to seem poor, disenchanted."
jim,Don't get sidetracked!  How does he get back to the States?  That's the point.  Does he have any problems?
susie,"None!  The State Department issues him a new passport in 48 hours and loans him the money to travel.  He's never investigated or charged by the Navy for revealing classified information or, as far as we know, debriefed by the CIA."
jim,This is a man whose secrets cause us to change our radar patterns in the Pacific!  He should've been prosecuted as a traitor!
susie,The FBI finally gets around to talking to him in Dallas and runs a file on him as a miscreant Communist type.
jim,But who meets him when he gets off the boat in New York in June '62?
jim,"Dammit, it doesn't add up!  Ordinary people get blacklisted for leftist affiliations!  The State Department did everything short of dispatching a destroyer to Minks to insure Oswald's return.  Only intelligence people can come and go like that."
jim,Sort of like Benedict Arnold coming back to George Washington's cabinet.
susie,Equally incongruous is Oswald becoming chummy with the White Russian community of Dallas - all rabid anti- Communists.
susie,"His closest friend is an oilman named George de Mohrenschildt who's about 35 years older than Oswald, who's only 23 and supposedly broke.  De Mohrenschildt is a member of the Dallas Petroleum Club, speaks five languages and was in French Vichy Intelligence during the War.  Also rumoured to have been a Nazi sympathizer and member of the ""Solidarists"", an international anti- Communist organization with many Eastern Europeans and ex-Nazis, many of them brought here by the CIA after the war, many of them involved in oil and munitions interests in Dallas and the Southwest.  You figure it."
al,Where'd you get all this Nazi stuff?
susie," Read it.  They called it ""Project Paperclip."""
oswald,"I think he's made some mistakes on Cuba, but he's doing a pretty good job.  If he succeeds, in my opinion, he'll be a great President.  And a really attractive one too - open features, great head of hair... "
jim,"That's scenery.  Don't get sidetracked.  This is the man, bottom line, who nailed Oswald to the Warren Commission as a potentially violent man, and linked him to the rifle."
george,"So, Lee, what are you taking a potshot at this week - rabbits or fascists?"
susie,"The only Russian that suspects Oswald of still being a Communist is Anna Meller.  But her Russian friend tells her ""he's checked"" with the local FBI and was told Oswald is all right."
susie,"The Oswalds are introduced by George de Mohrenschildt to Janet and Bill Williams.  It's through Janet Williams in October '63 that Lee gets the warehouse job, right smack on Elm Street at the Book Depository, which is owned by another oilman with ties to defense and military intelligence."
jim,"I wonder about the Williams'.  Just where did the first description of Oswald come from at 12:44?  No one knows.  They claimed it was Brennan's, but his description came after 1 P.M.  Who called?  Somehow the FBI's been tapping the Williams' and picks up a call between Bell Helicopter and Janet's phone, an unidentified voice saying ""We both know who's responsible.""  Who called?  Why's the Bureau been tapping them?"
susie,"When he's arrested, Marina buries him with the public.  Her description of him is that of a psychotic and violent man."
marina,"I do not want to believe, but I have too much facts.. tell me that Lee shot Kennedy."
bill,"I'm lost, boss.  What are we saying here?"
jim,"We're saying that when Oswald went to Russia, he was not a real defector, that he was an intelligence agent on some kind of mission for our government and he remained one till the day he died, that's what we're saying."
bill,"And therefore because Oswald pulled the trigger, the intelligence community murdered their own commander in chief.  That's what you're saying!"
jim,"I'll go you one better!  Maybe Oswald didn't even pull the trigger, Bill. The nitrate test indicates he didn't even fire a rifle on November 22nd. And on top of that, they didn't even bother to check if the rifle had been fired that day."
bill,He had his palm print on the weapon.
jim,"It went to the goddamn FBI and they didn't find a goddamn thing.  It comes back a week later and one guy in the Dallas police department suddenly finds a palm print which for all I know he could've taken off Oswald at the morgue.  There's no chain of evidence, Bill.  And what about the tow guns actually seen in the Depository?  One an Enfield photographed by a newsman and the other a Mauser, described by Deputy Weitzman... Maybe, just maybe, Lee Oswald was exactly what he said he was Bill - ""a patsy"".  Take it at face value.  Lou, Susie, I'm going with my gut here.  He's got an alias of Hidell to buy the rifle, ""O.H. Lee"" to rent the room, right?  What's in a name, right?  In intelligence, they're assumed to be fake.  A name is sort of like a postbox number, a code - several different people can use the same name, right?  Then why can't somebody be using Oswald's name?"
bill,But why?
jim,"To frame him, obviously.  You got to get in your minds how the hell spooks think, Bill!  They're not ordinary crooks."
lou,"I never could figure out why this guy orders a traceable weapon to that post office box when you can go into any store in Texas, give a phony name and walk out with a cheap rifle which can never be traced."
jim,"Unless he or someone else wants him to get caught.  Maybe he never ordered the weapon, Lou.  Somebody else did. It was picked up at the post office early morning when Oswald's time sheet shows him clocked in at his job.  Lou, come alive.  These things are not adding up."
bill,"I still have to question what the legal basis is that supports this, boss.  Susie's stuff is colorful, but..."
jim,"Let's start making some assumptions about the man.  Why would he leave a path as big as Lee Harvey Oswald's? This is not a thin trail, gentlemen, it is a very wide one.  Who found the evidence?  Who set him up?  Lou, Bill, Susie, I want you to go back and check all the sightings of Oswald in Dallas, New Orleans and Mexico in the summer and fall of '63 - see if it's the same guy."
al,"Boss, Oswald impersonators?  Sounds like James Bond now."
jim,"Al, you can't tell a mink from a coonskin unless you see the fur up close.  Goddamn, Sam!  If we don't start reading between the lines here! Y'all gotta start thinking on a different level - like the CIA does. We're through the looking glass. Here white is black and black is white."
bill,"What do you think, Lou?"
lou,"I'm just an investigator, Bill.  I leave the theories to you lawyers."
bill,"You, Numa?"
numa,"A week ago I would've said this is nuts, but now ...  There's a lot of smoke there, but there's some fire."
bill,"Now you guys, come on.  You're talking about the United States Government here!"
jim,"We're talking about a crime, Bill. No one is above the law.  Reduce it. A crime was committed.  Let's get to work."
ruby,"Christ, what the hell kinda needle is that?  I just got a cold for Chrissake.  I don't want any shot!"
doctor,"Please relax, Mr. Ruby.  This'll calm you down and clear this up."
ruby,"Doc, I'm telling you, I don't need any shots."
doctor,"Mr. Ruby, I don't want to involve the guards.  It'll just take a few seconds."
ruby,Then do you understand that I cannot tell the truth here?  In Dallas. That there are people here who do not want me to tell the truth... who do not want me to have a retrial?
official,"Mr. Ruby, I really can't see why you can't tell us now."
ruby,"When are you going back to Washington, sir?"
official, I am going back very shortly after we finish this hearing - I am going to have some lunch.
ruby,"Can I make a statement?  If you request me to go back to Washington with you right now, that is if you want to hear further testimony from me, can you do that?  Can you take me with you?"
official,"No, that could not be done, Mr. Ruby. There are a good many things involved in that."
ruby,What are they?
official,"Well, the public attention it would attract.  And we have no place for you there to be safe, we're not law enforcement officials, and many things are at stake in this affair, Mr. Ruby."
ruby,"But if I am eliminated there won't be any way of knowing.  Consequently a whole new form of government is going to take over this country, and I know I won't live to see you another time.  My life is in danger here. Do I sound screwy?"
official,"Well I don't know what can be done, Mr. Ruby, because I don't know what you anticipate we will encounter."
ruby,"Then you don't stand a chance, Mr. Chief Justice, you have a lost cause. All I want is a lie detector test, and you refuse to give it to me. Because as it stands now - and the truth serum - how do you pronounce it - Pentothal - whatever it is. They will not give it to me, because I want to tell the truth... And then I want to leave this world."
andrews,"Why you keep dancing on my head for, my man?  We been thicker'n molasses pie since law school."
jim,"Because you keep conning me, Dean. I read your testimony to the Warren Commission and..."
andrews,There you go.  Grain of salt.  Two sides to every coin.
jim,"You tell them the day after the assassination you were called on the phone by this ""Clay Bertrand"" and asked to fly to Dallas and be Lee Oswald's layer."
andrews,Right.
jim,"Now that's pretty important, Dean. You also told the FBI when you met him, he was six foot two.  Then you tell the Commission he was five foot eight.  How the hell did the man shrink like that, Dean?"
andrews,"They put the heat on, my man, just like you're doing.  I gave'em anything that popped into my cabeza.  Truth is, I never met the dude."
