Speaker,Dialogue
bertie,You look like a Christmas tree.  He smiles wanly.
elizabeth,"Buck up, Bertie. The BBC said it wouldn't rain."
elizabeth,Why wasn't he told?
cosmo lang,"Ten million people listening around the world, Mam. Possibly more.  His brother, and father, have been broadcasting since last year."
bertie,"Luh-luh-lords, la-la-ladies, gen-tell-men."
cosmo lang,I wouldn't miss His Highness' maiden voyage for all the world. And on such an important occasion.
bertie,No doubt you wish the Prince Of Wales was standing before you today.
elizabeth,Are you there?
elizabeth,Pardon?
lionel,"Iago...world's greatest villain. Just wants to be bad. Sorry, no receptionist."
elizabeth, I'd be more comfortable in your office.
lionel,That's for clients. Where's Mister J?
elizabeth,He doesn't know I'm here.
lionel,That's not a promising start.
elizabeth,My husband's seen everyone. They were all useless. He's given up hope.
lionel,A bit premature.
elizabeth,Because he hasn't seen you?
lionel,I'm sure of anyone who wants to be cured.
elizabeth,Of course my husband wants to be cured! His position requires public speaking upon occasion. A torment. I fear the requirement may grow more frequent.
lionel,He should change jobs.
elizabeth,He can't.
lionel,Indentured servitude?
elizabeth,Something of that nature.
lionel,"Well, have your `hubby' pop by and give his personal history. I'll make a frank appraisal."
elizabeth,Doctor...
lionel,"Sorry, this is my game, played on my turf, by my rules."
elizabeth,Perhaps you'll make an exception?
lionel,"I thought the appointment was for ""Johnson""?"
elizabeth,"A name used during the Great War, when the Navy didn't wish the enemy to know His Royal Highness was aboard."
lionel,I'm considered the enemy?
elizabeth,"You will be, should you continue to be un- obliging."
lionel,"For my method to succeed there must be mutual trust, complete honesty, and total equality. That process takes place in my consultation room. No exceptions."
elizabeth,"In which case...  I should have kept my pledge. I promised my husband I'd stop seeking ""The Great Cure."" I've wasted your time. And mine."
lionel,"Bloody hell, I buggered that."
valentine,Stand and deliver!
lionel, `ow dares molest...Jack The Ripper?!
peter,"We're Swagmen, not Highwaymen, Dad."
lionel,"Oh.  Beware, jolly Swagmen, I'll skewer yer gizzards."
myrtle,You'll all hang from the gallows if you don't come for tea.
lionel,"Boys, I think we'd best go up."
lionel,Had a visit from a lady today.
myrtle,Another spoiled silly?
valentine,May we be excused?
lionel,"You must stay, bored stupid, listening to your parents' inane conversation."
the boys," Thanks, dad!"
lionel,And mum.
the boys,And mum!
myrtle,Take your plates.
lionel,At what I do.  Twas a Lady with a capital L.
myrtle,"Oh, Lionel, that'd get us home in grand style wouldn't it?!"
lionel,She came on behalf of her husband. Which is not the proper way. I told her I was fully booked.
myrtle,We wouldn't want that.
lionel,Had a call. Wish me luck?
myrtle,"Course, Lionel. Loads and loads."
elizabeth,"""Mr. and Mrs. Darling and Nana rushed into the nursery too late. The birds were flown."""
margaret rose,"Oh, to fly away!"
bertie,Weren't they lucky.
lilibet,One would have to learn to fly properly of course.
margaret rose,Now a Daddy story!
bertie,Can I be a penguin instead?
lilibet,"The horsie story, please."
bertie,Ah well.
lilibet,A silly story really. But Father tells it rather well.
bertie,David called. He said come round to The Fort on Friday and stay for dinner.
elizabeth,Will she be there?
bertie,I suppose.
elizabeth,Seriously?
bertie,"Seriously, she'll be there."
elizabeth,I think I meant... is David serious?
bertie,About our coming?
elizabeth,About her!
bertie,A married American? Twice divorced? He can't be.
elizabeth,She can.
director,Now!
lionel,"""Now..."""
director, Thank you. Beautiful diction...but I don't hear the cries of a deformed creature yearning to be King.
lionel,What do you suggest?
director,"Continue to do whatever you do, and hope it gives you a great deal of satisfaction."
bertie,I d-d-don't thu-thu-think I c-c-can.
bertie,"Father, we're not a family, we're a firm."
bertie,What did David say?
bertie,Oh my brother...
bertie,What're you going to say?
bertie,"They didn't come to see us, Father."
bertie,Where's David?
bertie,What's needed is cooperation...
bertie,Is this necessary?
elizabeth,You know perfectly well.
bertie,David has `the touch'. They adore him.
elizabeth,There's no receptionist.
bertie,How'd you find this physician?
elizabeth," Classifieds; next to ""Saucy model, Shepherd's Market""."
bertie,I'm not sure I want to see this fellow.
elizabeth,I'm not sure he wants to see you.
anna,"You can go in now, ""Mr. Johnson""."
bertie,I'm not actually Mr ...
anna, Dr Logue says...
anna,"Lionel says...wait here if you wish. Or, it being a pleasant day, take a stroll.  Was that alright?"
anna, Thank you...Lionel.
bertie,My wife's favorite colours.
lionel,Glad we have something in common.
bertie,Please...
lionel,What?
bertie,You're too close. Five paces is the rule of thumb.
lionel,That might be difficult in this office.
bertie,I can't discuss that.
lionel,What can we talk about?
bertie,That's better. When speaking with a Royal one waits for the Royal to start the conversation and chose the topic.
lionel,Your joking. That won't work here.
bertie,I admit if one waits for me to start a conversation one can wait a rather long time.
lionel,You call this being forthcoming?
bertie,Aren't you interested in treating me?
lionel,Only if you're interested in being cured.
bertie,No thank you.
lionel,I need one.
bertie,"Apparently a great deal of rudeness, Doctor Logue."
lionel,Call me Lionel.
bertie,I prefer Doctor.
lionel,I prefer Lionel. My family calls me far worse. What shall I call you?
bertie,The Duke of York is appropriate.
lionel,Oh please.
bertie,Your Royal Highness then.
lionel,Much more informal.
bertie,Prince Albert? Or Frederick? Arthur? George? I've lots of names to choose from.
lionel,How about Bertie?
bertie, Only my family uses that.
lionel,That's what I'll call you then. We must be true equals.
bertie,"If we were equal I wouldn't be here, I'd be at home with my family and no-one would give a damn."
lionel,Don't do that.
bertie,"My physicians say it's good for stuttering, relaxes the throat."
lionel,They're idiots.
bertie,They've all been knighted.
lionel,Makes it official then. House rules: no smoking.
bertie,"I thought here we're ""equal""."
lionel,As a monarchist I thought you'd appreciate these are my digs and here I rule. No smoking. What was your earliest memory?
bertie,I beg your pardon?
lionel,First recollection of the world?
bertie, I'm not here to discuss personal matters.
lionel,Why're you here then?
bertie, Because I bloody well stutter! And you bloody well can't fix it!!!
lionel,Temper.
bertie,One of my numerous faults.
lionel,Do you stutter when you think?
bertie,Don't be ridiculous.
lionel,One of my many faults. How about when you talk to yourself?
bertie,I don't talk to myself!
lionel,"Come on, everyone natters to themselves once in a while, Bertie."
bertie,Stop calling me that!
lionel,Shan't call you anything else.
bertie,Then we shan't speak!
lionel,"Loads. Now: when you talk to yourself, do you stutter?"
bertie,Of course not!
lionel,Proving your impediment isn't a permanent internal fixture.
bertie,When I give a speech...I bloody stutter!!!
lionel,"Bet you a bob you can read flawlessly, right here, right now."
bertie, Easy money. You're on.
lionel,See your shilling then.
bertie,Royals don't carry money.
lionel,How convenient.
bertie,If there is a next time.
lionel,"Correct, I haven't agreed to take you on."
bertie,I certainly can't read The Bard.
lionel,`Easy money'.
bertie,"""To be or not to be, That is the question. Whether it is wiser..."" There!"
lionel,Not so fast.
bertie,I proved I can't read.
lionel,You proved you can't listen.
bertie,You're playing music.
lionel,I'm aware.
bertie,How can I hear what I'm saying?!
lionel,"Bertie, you're Royal. Surely a prince's brain knows what its mouth is doing?"
bertie,"You're not well acquainted with Royal princes, are you?"
lionel,"I want to demonstrate that when you can't hear your voice, you don't stutter, thus proving your impediment is not innate."
bertie,Rubbish.
lionel,Flawless.
bertie,I know how I sound!
lionel,Would I lie to a prince of the realm to win twelve-pence?
bertie,I've no idea what an Australian might do for that sort of money.
lionel,Souvenir of our first and presumably last encounter.
lionel,I'm finished with your husband.
bertie,I'm finished with Doctor Logue!
lionel,Lionel.
willie's mum,Was that...?
lionel,"Certainly not. How's it going, mate?"
willie's mum,William isn't trying hard enough.
lionel,Willie?
willie,Ddddddoooing ggggggggood.
lionel,Why am I not surprised?
bertie,The bloody man did parlour tricks and cheated me out of a shilling.
elizabeth,They'll see.
david," Hello, B-b-bertie. B-b-been waiting long?"
bertie,Three days. Where've you been?
david,I was busy.
bertie,So was I. Elizabeth has pneumonia.
david,She'll recover.
bertie,Father won't.
david,He's doing this on purpose.
bertie,Dying?!
david,"Some sod tipped him off Wallis is getting a quickie divorce and we're going to make our marriage a fait accompli. As an act of pure spite, Father's trying to depart prematurely in order to complicate matters."
bertie,You believe that?
david,Wallis explained it. She's terribly clever.
wigram,"The Instruments Of Succession, Your Majesty."
wigram,"At the appropriate moment, Your Majesty."
queen mary,I want my jewelry divided equally. Elizabeth gets first choice. She's not greedy.
bertie,"May I remind you, you're not the one who's dying, Mother."
queen mary,Where are the others?
bertie,Lord Wigram and Dr Dawson are making arrangements.
queen mary,What sort of arrangements?
bertie,They didn't say.
queen mary,And David? Fetch him.
david,I'm on with Wallis! 
bertie,Mother says you're late for supper.
david,"Clocks set five minutes in advance, so as not to be late. When I'm King I shall set them back!"
queen mary,Lord Wigram has requested permission to order the coffin.
bulter,The Archbishop of Canterbury.
david,Who the hell invited him?!
queen mary,Nobody. Don't swear.
david,Somebody should bloody well dis-invite him. Father swears.
wigram,That would be rash.
queen mary,You're not your father.
wigram,His Grace can be a persistent enemy. We need friends.
david,Show the toad in.
cosmo lang,Whatever can I contribute in this dreadful hour?!
cosmo lang,"""Tranquilly""? ""Serenely""?"
wigram,Peacefully.
cosmo lang,"""The King's life is moving peacefully to its..."" ""Termination""?"
wigram,Close.
cosmo lang,"""...to its close."""
wigram,As a man of letters you're heaven-sent to assist in the editing of our press communique.
david,Is my father late for death?
wigram,"We wouldn't want the news delivered by the disreputable afternoon press, would we?"
cosmo lang,Who knows what sensational side issues those tabloids might report.
dawson,Perhaps a peaceful termination?
dawson,Three quarters of a gram of morphia and a gram of cocaine injected into the distended jugular vein.
nurse,No! that's...
dawson,You may leave.
queen mary,Long live the King.
bertie,"The look in mother's eyes, it was...ghastly."
elizabeth,Bertie...
bertie,The man was a total fraud!
elizabeth,Not particularly.
bertie,Well   I think you should. You should know what   goes on. Telling me he could help me read   flawlessly. Lying bastard! Listen to this   babble!
winston churchill,Turn that devil off!
baldwin,Chamberlain thinks that Hitler can be reasoned with.
winston churchill,Neville is an old woman.
baldwin,"That's the direction its going, Winston. You're out of step."
winston churchill,We'll see who trips and falls.
baldwin,Enough pleasantries. I've asked you here because you seem to be the only sensible member of the King's camp.
winston churchill,"Nice of you to say so, Stanley."
baldwin,Is he willing to be reasonable?
winston churchill,Depends on the definition.
baldwin, Has he seen the light?
winston churchill,He has.
valentine,Dad?
lionel,Mmmm?
valentine,"Time for a Shake, dad."
lionel, You sure?
the boys,Shake! Shake! Shake!
ian,Bet its the Scottish Play.
valentine,Othello!
peter,Perhaps something with Falstaff?
the boys,Caliban!
lionel,"""Be not afeard; the isle is full of noises, Sounds and sweet airs, that give delight, and hurt not. Sometimes a thousand twanging instruments Will hum about mine ears; and sometimes voices, That, if then I had waked after long sleep, Will make me sleep again: and then, in dreaming, The clouds methought would open, and show riches Ready to drop upon me; that, when I waked, I cried to dream again."""
bertie's voice,Doctor Logue?
lionel,"Must be a tradesman. Off you go, lads. Mum should be home from work."
bertie's voice,Logue...?
bertie,Lionel...it's Bertie.
lionel,My condolences. I didn't expect you.
bertie,Thank you. I didn't expect to be here. May I come in?
lionel,No.
bertie,What?
lionel,My wife doesn't think it's a good idea.
bertie,Your wife?
lionel,Myrtle.
bertie,"Myrtle? Myrtle's never met me. I've never met Myrtle. May we discuss Myrtle in private? Its not proper talking about our women on the street.  Lonel gives him a look, but lets him him."
bertie,What happened to your shoulder?
lionel,Sore back.
bertie,"What's your Myrtle got to do with me? Elizabeth doesn't much care for you either, but here I am."
lionel,That woman has style.
bertie,Which is why she dislikes you. You're far too familiar.  May we discuss this properly?
lionel,You look dreadful.
bertie,Another example of exactly the sort of thing you don't say to a Royal. And you're too close.
lionel,But you're not Royal in this room.
bertie,Which is precisely why Elizabeth dislikes you.
lionel,Not there!
bertie,"Oh I say, I'm terribly sorry. Tell your lads I'll buy a new one."
lionel,"You don't have any money. I'll fix it. So, Bertie, what brings you here? Your father's death?"
bertie,What was he angry about?
lionel,I was a great disappointment.
bertie,Thought he'd be proud of you.
lionel,So did I.
bertie,A man of stature?
lionel,A clerk.
bertie,Oh. 
lionel,Coughed herself to death when I was young.
bertie,Oh.
lionel,I remember going to the theatre with her. Not real theatre...traveling players.
bertie,I've been to Australia.
lionel,Not where I lived.
bertie, My brother. That's why I'm here.
lionel,What's he done?
bertie,Can't say.
lionel,I'm going home now.
bertie,"You must undersand, I can't puh-puh-puh..."
lionel,Try singing it.
bertie,Pardon?
lionel,Know any songs?
bertie,"""Swanee River""."
lionel,Very modern.
bertie,Happens to be my favorite.
lionel,Sing it.
bertie,Certainly not.  May I help? Always wanted to build models. Father wouldn't allow it. I had to collect stamps. He collected stamps.
lionel,"Only if you sing. Goes like this...  ""Way down upon the..."""
bertie,"I know the words!  ""Way down upon the Swanee River. ..."" Etcetera."
lionel,You didn't stutter.
bertie,"Of course I didn't stutter, I was singing! One doesn't stutter when one sings!  Well I can't waltz around on State occasions warbling!"
lionel,You can with me.
bertie,That's because you're peculiar.
lionel,"I take that as a compliment. Cut some struts from the balsa. Sorry, hard to show you what to do at five paces. Would you like a cup of tea?"
bertie,No. Yes. Thank you.
lionel,You were about to sing an aria concerning your brother.
bertie,"I'm not crooning to the tune of ""Swanee River!"""
lionel,"Try ""Camptown Races"" then.  ""The Arch of C, he said to me, doo-dah doo- dah..."" That sort of thing."
bertie,"I can't talk, or sing, about your future King, doo-dah, doo-dah..."
lionel,"My future King? He's your future King too. Did that cause friction? Knowing he'd grow up to be King, but you wouldn't."
bertie,Certainly not. I've always looked up to David. Water's boiling.
lionel,Two lumps or one?
bertie,I've a sweet tooth. To tell the truth...
lionel,Always preferable.  Cover it with tissue.
bertie,...it was a relief. Knowing I wouldn't be King.
lionel,Why's that?
bertie,I wouldn't have to give speeches!
lionel,No smoking. What's the age difference?
bertie,Eighteen months.
lionel,But for eighteen months you would've been King?!
bertie,"We didn't think about it that way, doctor.  David and I were very close."
lionel,As you said: eighteen months.
bertie,As brothers!
lionel,How close?
bertie,Young bucks... You know.
lionel,"I don't, or I wouldn't ask. Did you go after the same girls?"
bertie,Upon occasion.
lionel,Princess Elizabeth?
lionel,Now dope the other wing. Did David tease you?
bertie,"They all did. ""Buh-buh-buh-Bertie"". Father encouraged it. ""Spit it out, boy!"" Thought it would make me stop. Is this necessary?!"
lionel,Otherwise the paint will eat through the tissue.
bertie,I mean the damn questions!
lionel,Mandatory. Tell me more about your storybook childhood. What was your earliest memory?
bertie,You asked that before.
lionel,This time I'd like an answer.
bertie,Being born.
lionel,How can you remember that?
bertie,December 14th.
lionel,I don't understand.
bertie,"""Mausoleum Day"". Prince Albert departed on that date. I was named Bertie to placate Great Grandmamma Victoria. In return, she hated me because it reminded her of her grief. "
lionel,And?
bertie,I was punished. Now I'm right handed.
lionel,Anything else?
bertie,Bandy legs. Also considered inappropriate.
lionel,You sound angry.
bertie,"Yes, I told you, I have a temper."
lionel,"Angry at me, or at your brother?"
bertie,He's fallen in love!
lionel,How dreadful.
bertie,With the wrong sort of woman!
lionel,What's wrong with her?
bertie,She's American.
lionel,Some of them must be lovable.
bertie,"This one's divorced. Twice. Mrs Wallis Simpson of Baltimore. I want David to be happy, but the family, the Church, the nation, won't have it."
lionel,Can't they fornicate privately like adults?
bertie,If only! David used to prefer married women because there was no possible attachment. But now...
lionel,"""Queen Wallis of Baltimore""?"
bertie,Please.
lionel,Does sound a bit iffy.
bertie,I made a smudge!
lionel,Touch it up.
bertie,You want me to beg for help?
lionel,I advise you never to beg. Especially if you might be King.
bertie,Don't say that!
lionel,"I see. For reasons you cannot disclose, fearing ramifications you will not explain, you feel sufficiently anxious to embark upon a course of therapy in which you have no faith? You already owe me a shilling."
bertie,"I brought it along. You won, fair and square. I'll pay you generously."
lionel,I'll continue to ask questions.
bertie,That's what I was afraid of.
lionel, Nice job.
bertie,You've someone waiting?
lionel,I do now.
bertie,"I'd apologize to them in person, but..."
lionel,You don't wish to be seen? Slip out the back way.
bertie,After the funeral...it may be even more difficult. To remain unobserved.
lionel,You're having second thoughts.
bertie,Perhaps the wrong sort.
lionel, Lots of planes.
bertie,"You know, Lionel, you're the first ordinary Englishman..."
lionel,Australian.
bertie,"...I've ever really talked to. Sometimes, when I ride through the streets and see a `bloke' I'm struck by how little I know of his life, and how little he knows of mine. Cuts both ways."
lionel,"And if you decide to come, bring the Duchess. She might be helpful."
bertie,She might. If I asked. Very nicely.  And how will Myrtle take to our coming into your home?
lionel,Not sure. She isn't speaking to me.  After the funeral then?
willie's mum, Still can't say a sentence.
lionel,Willie?
willie,Iiiiiii'm much bbbbbbbetter.
lionel,Well done.
dignitary,"Whereas it has pleased Almighty God to call to His mercy our late Sovereign, King George the Fifth of blessed and glorious memory..."
cosmo lang,Don't be disingenuous. For our late King's crown to fall from his coffin is not a fortuitous portent. What ever is going to happen next?
winston churchill,"Is that be the motto of the new reign? Indeed, will there actually be ""a new reign""?"
cosmo lang,Winston! I'm deeply shocked.
winston churchill,You don't look it.
cosmo lang,My function requires me to appear serene.
winston churchill,"That may be increasingly difficult to maintain. I've been informed by no less an authority than the Prime Minister that our populace has no objection to Royal fornication, but will never tolerate adultery."
cosmo lang,"Well, since we cannot acquire a new populace, perhaps we need a new King?"
winston churchill,My turn to be profoundly shocked.
cosmo lang,"Scoff, Churchill! Go on... scoff! But you more than others know full well we'll soon be under siege from the forces of darkness."
winston churchill,The winds of war...a gathering storm?
cosmo lang,"Oh, you do have a way with words. And who would you suggest to rally the troops, the nation, the Empire, the world?"
winston churchill,Would you prefer the next brother?
cosmo lang,"The youngest, perhaps?"
winston churchill,Now there's dimness.
cosmo lang,I must admit...unburdened with brain.
winston churchill,"Thus we're left with David, the rightful heir, who speaks beautifully, even if he talks nonsense."
david,"Hear you're taking elocution lessons, lad."
bertie,Pardon?
david,Diction. Speechifying. That's the word around Town.
bertie,Merely trying to overcome my dreadful impediment...
bertie,Good lord no! I hope to...
david,Replace me? Well...today's your chance.
bertie, I'm not prepared!
david," As a Boy Scout...and you are one, aren't you, very much a Boy Scout...you must always be prepared. Nice and loud, so everyone can hear."
bertie,I...I...I thu-thu-think we should tuh-tuh- table the document.
david,"Tell the others how Mrs Simpson is to be accommodated in a special alcove above the altar. Now I'll be off. See you at Balmoral this weekend, Buh-buh-Bertie.  In the room, they are appalled.  Bertie stands frozen and shattered."
bertie,Wait down the road.
local lad,"Kick it `ere, aye, Guv?"
lionel,"To be honest, wasn't sure whether to expect you."
bertie,I wasn't sure either.
lionel,Something happened?
bertie, Do I look like a spy?
lionel,With a toothache.
bertie,I was totally unable to speak.
lionel,You seldom stutter with me anymore.  The boys are a bit untidy.
bertie,Because you're paid to listen!
lionel,Like a verbal geisha girl?
lionel,Home.
bertie,"What more does a man need,eh?"
lionel,Coming from a man who's lived all his life in castles and palaces.
bertie,Somebody has to live in them.
lionel,Somebody does.
bertie,I couldn't say anything!
lionel,You could've refused. Don't you know any rude words?
bertie,What a bloody stupid question! I just said one. Bloody. Bloodybloodybloody!
lionel,Perhaps a touch more vulgar?
bertie,Certainly not.
lionel,To prove you know how.
bertie,Bugger!
lionel,A public school prig could do better.
bertie,"Well bloody bugger to you, you beastly bastard!"
lionel,Hardly robust.
bertie,"Shit then. Shit, shit, shit!"
lionel,See how defecation flows trippingly from the tongue? You don't stutter when you swear.
bertie,Because I'm angry!
lionel,Get angry more often. Do you know the f- word?
bertie,Fornication?
lionel,Oh Bertie...
bertie,"Fuck. Fuck, fuck, fuck!"
lionel,Bravissimo! Now a resounding chorus of...
bertie,"Bloody, bloody. bloody! Shit, shit, shit! Bugger, bugger, bugger! Fuck, fuck, fuck!"
bertie, This is your fault!
lionel,"Sorry, pet! Won't happen again!"
bertie,"Apologies, Mrs. Logue."
lionel,First time I've heard you laugh.
bertie,Royals aren't allowed emotions in public.
lionel,Which explains a lot.
bertie,"What do you want me to do, dammit!? Stage my next public appearance as an obscene operetta?!"
lionel,Your next public appearance should be very well rehearsed.
bertie,"Don't take liberties! You're a dangerous man, Logue. Who sent you?"
lionel,Anyone in mind?
bertie,"The lurking shadows. Courtiers and peers...the whole panoply of a class which once ruled the nation which once ruled the world, afraid of losing their last vestige of privilege if the monarchy is further debased."
lionel,Your wife was the one who sought me out.
bertie,"Because, dear sweet deluded woman, she believes in me!"
lionel,But you don't share her belief? Why come here?
bertie,"I'm beginning to ask myself that very same question. Your sailing close to the edge, don't push me, Doctor Logue."
lionel,Lionel.
bertie,"I came here because I was taught from childhood to serve a purpose, and that purpose is to serve. Duty is our sole justification for privilege. "
lionel,Not to worry. They say the King can do no wrong.
bertie,He can bugger things up! And I am not the King. Mrs. Simpson is seeking a divorce. The Coronation is set for the 12th of May. Her decree becomes final on the 27th of April. That gives them two weeks to marry and put this issue to rest.
lionel,And if Mr Baldwin stops them?
bertie,That would be a tragedy. I pray to The Almighty they succeed. I'll do anything within my power to keep my brother on the throne.
lionel,Does that include debasing yourself?
bertie,If necessary!
lionel,Your brother knew perfectly well by giving you a document without warning...
bertie,Are you saying he wanted me to fail?
lionel,"Are you insisting he didn't? In the future we can parse any document into manageable phrases. You can sing them, swear them, rehearse them til you get the rhythm and flow; that, combined with your growing confidence..."
bertie,"Growing confidence? Growing dread!!! You're a wicked man, Lionel Logue, trying to get me to thrust myself forward as an alternative to my brother. Trying to get me to commit treason!"
lionel,"Trying to get you to   realize you need not be governed by fear.   Again, why did you seek me out? To take   polite elocution lessons so you could   attend posh tea parties?!"
