Speaker,Dialogue
bertie,"How dare you! I'm the brother of a King...the son of a King...back through untold centuries. You presume to instruct me on my duty? A jumped-up jackeroo from the outback? The disappointing son of an embittered clerk! You're a monster, Doctor Logue. I'm going to Balmoral to spend a pleasant country weekend with my beloved brother. And these sessions are over!"
director,Were you told? We aren't for London. Playing the provinces.
lionel,Outer Mongolia?
director,"Available, are we?"
lionel,Nothing prevents.
director,"I believe that's called ""desperate for a part!"" Previous experience?"
lionel,Australia.
director,You have played the provinces. Righto! Let's hear what you can do.
lionel,Caliban?
director,Make him deformed. Audiences like that.
lionel,"Of course.  ""Be not afeard; the isle is full of noises, Sounds and sweet airs, that give delight, and hurt not."""
director, Thank you! Don't abandon your day job. Next!
lionel,You may leave.
valentine,"Haven't finished yet, Dad.  Oh! Right!"
the boys,"Thanks, Dad. Thanks, Mum."
myrtle,Lionel?
lionel,First class.
myrtle,What about your...
lionel,Willie's a problem...not much progress. The others have been referred.
myrtle,What'll you do when we get home?
lionel,Try not to act the toff. Teach perhaps.
myrtle,You could...
lionel,No! I'm not good enough!
myrtle,"You gave it a try, Lionel."
lionel,"Yes, I had a go. Thanks to your patience.  I just bloody well wasn't good enough!"
myrtle, Oh Lionel! This must've cost you.
winston churchill,Five hundred year old oaks! Part of the hill! Removed to improve the view!
cosmo lang,How ever does she do it?
winston churchill,"Erotic sexual techniques beyond polite imagination? I realize of course, that may be outside your personal experience."
cosmo lang,You've the Devil in you today.
winston churchill,"If anyone should know, it would be Your Grace."
cosmo lang,"All aspects of mankind are within my venue. Did you know, HM has trouble with his glands?"
winston churchill,I'd not appreciated Your Grace was so well versed concerning things testicular!
cosmo lang,They were severely damaged by the measles when HM and his brother were naval cadets.
winston churchill,A veritable encyclopedic font of scatological information.
cosmo lang,"Apparently it affects the quality, although not the quantity, of HM's endeavors."
winston churchill,And the brother?
cosmo lang,"Unscathed. Two daughters. I shepherd my flock in all matters, Winston, including multiplication."
bertie,We must try to be pleasant.
elizabeth,"Your father not dead six months, and That Woman throws, ""A garden potty."" P-o-t-t-y. She's sleeping in your mother's bedroom. And I know perfectly well she calls me `the Dowdy Duchess"", and ""Cookie""."
winston churchill,"Has it occurred to you, as it has only occurred to me, that a Monarch with a gland problem, who realizes he cannot produce issue, might not wish to be King...? knowing his lack of issue may well become a major issue indeed."
cosmo lang,A dazzling concept...beautifully phrased.
footman,Their Royal Highnesses the Duke and Duchess of York.
elizabeth,I came at the invitation of the King.
winston churchill,"According to the F.B.I.... she is, after all, one of their citizens...our Monarch does not possess exclusive rights to Mrs. Simpson's sexual favours. Hitler's Ambassador, Count von Ribbentrop, has been sending her 17 carnations every day...one for each time they've slept together."
cosmo lang,"Good Lord, Winston, we must see to it this Empress of the Night does not become Queen of England!"
winston churchill,Vividly put.
elizabeth,I don't need to be told I behaved badly.
winston churchill,"On the contrary, Mam. Court etiquette decrees royalty must be greeted by the official host. In this case: the King. You behaved impeccably. As always. "
elizabeth,Distant.
winston churchill," You're well aware, of course, George IV's wife, Mrs. Fitzherbert, was very common indeed...and previously married. She signed an agreement that she could never become Queen, and their children could not be Royal. A rather sensible morganatic arrangement."
elizabeth,"That was   a very long time ago. You're stirring   with a rather large spoon, Winston.   Keep in mind, I'm also a distant relative   of Lady Macbeth."
winston churchill,I would disremember at my peril.
bertie,David...
david,Wally wants more champagne. I have to fetch it. She prefers that.
bertie,Been trying to see you...
david,Been terribly busy.
bertie,Doing what?
david,Being King.
bertie,"Where did you get that American accent? David...Father's not dead six months, yet you've put Mrs. Simpson in the suite used by our mother?"
david,"Mama's not still in bed, is she?"
bertie,That isn't funny.
david,"Ssssssorry, d-d-dear b-b-oy!"
bertie,Please. No more of that.
david,Didn't realize you cared.
bertie,This could end in disaster.
david,This will end splendidly. With Wallis as my wife.
bertie,Whatever will she call herself?
david,"Queen of England, I suspect. Kings do marry. Empress of India. The whole bag of tricks."
bertie,"David! The upper classes are terrified anything which clouds the monarchy makes their situation more dangerous. Hunger marchers are singing the ""Red Flag"" in front of Westminster...demanding a republic...I've seen them..."
david,Herr Hitler will sort that out.
bertie,Who'll sort out Chancellor Hitler?
david,"He's much maligned. By the Jews, according to Wallis. And she's very clever about politics."
bertie,The man's a monster! Our position must remain clear.
david,"Why's that, old chap?"
bertie,We are a German family!
david,Didn't bother anyone during WWI. And Kaiser Willie was our uncle.
bertie,Because we took an English name! Windsor. Because we are England. We are the heart and soul of this nation. That must never change.
david,Are you already in charge?
bertie,I'm trying to warn you.
david,Am I being threatened?
bertie,"David, your role is to consult and to be advised."
david,Sounds like you've studied our wretched constitution.
bertie,Sounds like you haven't.
david,I won't be a lackey to an unwashed politician like Stanley Baldwin!
bertie,He's your Prime Minister.
david,And I'm his King!
bertie,"If you refuse to listen to our Government, they have no choice but to resign."
david,I'll form another. There's Winston. He'd love to be P.M. We'll create a King's Party.
bertie,To fight a general election in which your marriage is the only topic?
david,I'd risk anything and everything for Wallis. Don't I have rights?
bertie,Privileges.
david,Not the same thing.
bertie,No.
david,Yet an ordinary man may marry for love.
bertie,"We're not ordinary men, David! We were bred to be profiles on a coin. If you were ordinary, on what basis could you possibly claim to be King?!"
david,"What's the point then? Just to look posh? You know...your speech is much improved tonight. Hardly a hesitation. Yearning for a larger audience, are we?"
bertie,Don't say such a thing!
david,Is my young brother trying to push me off the throne? Sounds positively medieval.
bertie,"I beg of you, don't do this to my wife, my daughters, to me."
david,The politicians will give in. See you at my Coronation...Bertie.  The champagne cork finally POPS. He strides off.
baldwin,As you may have guessed...
winston churchill,"My opportunity to redecorate will come soon enough, Stanley."
baldwin,"Will it? Well, enough chit-chat. The question of a morganatic marriage, as a possible solution, has been put to the Dominion Prime Ministers. After all, HM is their King too."
winston churchill,David feels there aren't that many people in Australia.
baldwin,"Canada: no. Union of South Africa: an inappropriate marriage would create a permanent wound. The Irish Free State: states it is not really their affair, and, bluntly, our English King may marry any whore he wants, they'll be well out of it."
winston churchill,Bloody Irish.
baldwin,New Zealand...wavers.
winston churchill,"Ah, the Kiwis!"
baldwin,"Being rather remote, they've not even heard of Mrs Simpson. Hardly a winning hand."
winston churchill,He won't budge.
baldwin,Nor will we.
bertie,Don't dismount.
winston churchill,Good of you to see me at this late hour.
bertie,Thought you were in David's camp?
winston churchill,"I was.  ""I am now free to tell you how I was jockeyed out of the Throne."""
bertie,Good Lord! My brother wrote that?
winston churchill,"Wallis wrote it for him. I'll burn it. I fear your brother is like the child in a fairy story, given everything in the world, but they forgot his soul. Quite happy to bring his nation to the brink of civil war just as we face global conflict."
bertie,We're not coming to that?!
winston churchill,"Oh, there'll be war, alright.  Your brother held conversations with the Duke of Saxe-Coburg, your cousin, a ranking member of the Nazi party. I have the Scotland Yard intercept: ""Who is King here? Baldwin or I? I myself wish to talk with Hitler, and will do so here or in Germany."" I doubt England is ready to return to absolute monarchy."
bertie,Surely his motives are misunderstood?
winston churchill,"""If I don't get my way, when the war comes, Hitler will crush everyone, including the Americans. The British may not want me as their King, but I'll soon be back as their leader."" His intent seems crystal clear."
bertie,Winston?! Don't take him seriously!
winston churchill,Mugs for his cancelled Coronation will soon be on clearance sale.
bertie,You're willing to go along with this?! Changing horses in mid-stream is a perilous maneuver!!!
winston churchill,Depends how badly the horse you're on stumbles.
bertie,"It's not too late, Winston, you could form a government on his behalf."
winston churchill,I must decline. Reluctantly.
bertie,I don't want to hear it! Ever!
winston churchill,It does have a rather nice turn of phrase.
margaret rose," Daddy, who broke our rocking horse?"
bertie, A giant.
lionel,"I too ""married the woman I love."""
myrtle,You married a shop girl.
lionel,A wonderful lass. Someone I can talk to heart to heart.
myrtle,Using simple words and short sentences. I'm very ordinary.
lionel,That's why we're suited. I'm just an ordinary bloke.
myrtle,"Ordinary? You're a man with wild dreams, Lionel. Mine are so very small. A job, a husband, a home. Raising our sons. That's all I ever wanted."
lionel,Me too.
myrtle,"Is that why, every day, you've spent hours with a man who's about to be King?"
lionel,That relationship is now past tense.
myrtle,"Yet, for as long as you could, you did what you wanted."
lionel,I wanted to be a great actor. That's what I wanted.
myrtle,And failing that...
lionel,I certainly failed!
myrtle,A great healer. Always...'great'. Where does a shop girl fit in?
lionel,"Very snugly, into my heart! Always have, always will."
myrtle,"Trouble is, Lionel, when you say that, I still believe it."
bertie,Where's the Austin?
driver,"The Palace changed it, Your Highness."
bertie,I liked the Austin.
driver,"So did I, sir."
margaret rose,You look like a chicken.
lilibet,A rooster.
bertie,How did this happen to you?
bertie,"My Lords, members of the Accession Council, I meet you today in circumstances which are without parallel in the history of our Country..."
bertie,Daddy's home.
bertie,I don't want to lose you.
elizabeth,How could you possibly?
bertie,Being what we both dread most.
elizabeth,"Dear, dear, man, I refused your first two marriage proposals because, as much as I loved you, I couldn't abide the thought of living in the Royal gilded cage. Then I realized...you stuttered so beautifully...they'd leave you alone.  She takes his face in her hands tenderly.  ELIZABETH  You know what you must do."
anna,"""Had I the heavens' embroidered cloths Enwrought with golden and silver light, The bbb..."""
lionel,We haven't much more time together. Give it a go.
anna,"""The blue and the dim and the dark cloths Of night and light and the half-light..."""
lionel," Read it to him. If he doesn't profess his love, he's not a man."
anna,Thank you...Lionel.
bertie,That was lovely. Don't take any guff.
anna,Can I tell my Harold that's what you said?
bertie,I'd be honoured.
lionel,"Johnson, isn't it? Have you an appointment?"
bertie,Want me to beg?
lionel,"I told you, Kings don't beg."
bertie,I believe this time a bit of begging might be required. Elizabeth says I must eat humble crow.
lionel,"Its ""crow"" or ""humble pie"". Take your pick."
bertie, I was frightened and took refuge in being `Royal'. What I said was unforgivable. And...
lionel,And?
bertie," What's the one essential thing a King must do? He must believe he is King. How can I possibly do that? For pity sake, Lionel, I beg you: get me through! I'll pay you another shilling."
lionel,What're friends for?
bertie,I wouldn't know.
myrtle,I've got the boys sorting their things. Your office will be a chore...
cosmo lang,We asked to see Your Highness because there's the urgent question of what to call your brother. Aside from the obvious.
bertie,What do you suggest?
cosmo lang,Mr. Edward Windsor? All he deserves.
bertie,"What has my brother given up on his abdication, other than the throne?"
winston churchill,"Very well, Lord E.W. it is."
bertie,"And as a Lord of the realm, he's entitled to be elected to the House of Commons. Heading a King's Party."
cosmo lang,Unacceptable!
bertie,"So you prefer he takes a seat in the House of Lords? Again, on behalf of a King's Party? Is that acceptable?"
winston churchill,Certainly not.
bertie,"But if he's made a Royal Duke, and called His Royal Highness, he cannot stand for Parliament. Nor may he speak or vote in the House of Lords."
cosmo lang, Oh I say...
bertie,The Duke of Windsor it is. Gentlemen.
winston churchill,"Not exactly a dummy, is he?"
lionel,"Splendid. Here's another. ""She sifted seven thick-stalked thistles through strong thick sieves."" At home, twenty-five times, in rapid succession."
bertie,Those are my hardest sounds.
lionel,Shall we invite your wife in now?
myrtle,Milady?
elizabeth,"""Your Majesty"", the first time. After that, ""Ma'am"". Not Malm as in Palm, Mam as in ham. I'm informed your husband calls my husband Bertie and my husband calls your husband Lionel. I trust, however, you won't attempt to call me Liz."
bertie,How're they getting on?
lionel,As to be expected.
myrtle,"You may call me ""Madam Logue""."
elizabeth,"Thank you, Madame Logue, but I'm waiting to be summoned."
myrtle,You don't like my husband. That's what I was told.
elizabeth,I was told the same.
bertie,Do we remain in hiding?
lionel,I'm not going out there!
myrtle,What do you dislike about my Lionel?
elizabeth,I don't wish my husband to be demeaned. What don't you like about mine?
myrtle,I don't want my Lionel getting hurt.
elizabeth,There's only one thing can save him now: success.
bertie,We're being cowards.
lionel,Of course. We're sensible men.
bertie,You should go in.
lionel,Me? You.
bertie,Why me?!
lionel,You're the Royal.
bertie,"Being a monarchist, I recognize these are your digs. Therefore: here you rule. Therefore: you go in."
lionel,"Oh! Hello, Lady Elizabeth! Oh! Hello, Myrtle darling! What a pleasant surprise."
myrtle,Will the Yorks be staying for dinner?
elizabeth,A previous engagement.
lionel,"Some other time, love."
elizabeth,Harley Street is far too public. What is my function here?
lionel,For me to show you how to pitch in.
elizabeth,"Oh dear, I may not be a `pitch in' type."
lionel,Piece of cake.  Please assume a supine position on the floor.
elizabeth,What?!
lionel,Firm support is needed.
bertie,Full of hot air.
lionel,Well on your way to becoming a qualified political speaker. Again...
elizabeth,Good grief.
lionel,Gently of course.
elizabeth,"Are you alright, Bertie?"
lionel,"Now exhale slowly...down goes Princess Elizabeth...inhale slowly...nothing rushed, expanding your chest fully, extending the column of air til it hits the diaphragm...and...up comes Princess Elizabeth. Exhale...down goes Princess Elizabeth...inhale...up comes Princess Elizabeth. You get the idea. Doesn't have to be Princess Elizabeth of course, but I thought you'd prefer your wife to one of the staff. Now comes the fun part."
elizabeth,There's actually more?
lionel,"You will now shout the vowel sounds, all five of them, as loudly as possible, each to last no less than 15 seconds. There's poor coordination between your larynx and diaphragm. Princess Elizabeth, you can be the official timer."
elizabeth,Vowel sounds? Shouted at an open window? On a public street?
lionel,Anyone who can stand at an open window vibrating loudly in full view of the world can learn to give a public speech.
elizabeth,They can also be considered quite dotty. Don't even contemplate it!
bertie,"Sorry, dear, doctor's orders. Aaaaaaaaaaaaaaaaaaa...  She's right, those two chaps are staring at me."
elizabeth,They're always looking at you.
lionel, You're followed?
elizabeth,"Royal scrutiny, Doctor, best get used to it."
bertie,...aaaaaaaaaaaaaaaayyyyyyyyyyy... ...eeeeeeeeeeeeeeeeee...  Are you timing this? iiiiiiiiiiiiiiiiiiiiiiii... ooooooooooooooooooooooooo... uuuuuuuuuuu.
valentine,May we be excused?
lionel,No.
peter, We don't want to hear you fight.
lionel,We're not fighting. Your mother isn't talking.
myrtle,You wish me to speak my mind?
lionel,"Boys, leave."
the boys,"Thank you, Dad! Thank you, Mum!"
myrtle,"Lionel...without warning, I arrive home to find the Queen in my parlour."
lionel,"A Duchess, she hasn't been crowned yet."
myrtle,"Lionel, don't quibble!"
lionel,What'd you think of her?
myrtle,Does it matter!? She's the Queen and he's the King forgodsake! What're they doing here?!
lionel,Why'd you come home so early?
myrtle,Lionel...
lionel,They came for help.
myrtle,"What role are you auditioning for now? Royal saviour?! Who's going to help us?! This will bring us down, Lionel. You know it will."
lionel,"When that poor chap first walked into my office, he was a slim, quiet man with tired eyes and all the outward symptoms of the person upon whom a habitual speech defect has set the sign. You saw him today; once more there was hope."
myrtle,You're not listening to me!
lionel,"Myrtle, I love you."
myrtle,"You say that, but you don't listen when I say, in so many ways, how desperately I want to go home, how I never, ever, intended to stay here. This was to be a holiday trip to see `Mother England', and you turned it into quite something else. What happened, Lionel? We went to Wembley Stadium, next thing...you'd cashed in our tickets."
lionel,Myrtle... I don't deserve a wonderful woman like you.
myrtle,How right you are.
lionel,But why'd you come home so early?
myrtle,Lionel...I was let go.
lionel, Why?!
myrtle,"They're frightened, Lionel. Of what seems so far above them. I sympathize. I'm frightened too."
lionel,"Oh, Myrtle. My love..."
winston churchill,Only the vulgar ones.
cosmo lang,Let's sincerely hope.
winston churchill,Is this a `slightly pregnant pause'?
cosmo lang,They say he is dim.
winston churchill,Demonstrably untrue.
cosmo lang,They say he has epilepsy.
winston churchill,Patently erroneous.
cosmo lang,"Fragile, prone to illness..."
winston churchill,Some correctness in that.
cosmo lang,...and will die prematurely. They predict he'll be unable to complete the Coronation.
winston churchill,What do you propose? Shorten the ceremony? Or no ceremony at all?
cosmo lang,My idea exactly!
winston churchill,I believed so. But what we need is a pageant of pomp and pomposity to impress the world.
cosmo lang,"What we need, and what we'll get, may be two rather different things. Did you hear his pathetic attempt at the Accession Council? He'll never be able to speak in public."
winston churchill,"So, we plonk a tinsel crown on his head and lock him in a closet? Who then will spiritually lead this great nation into war? Who will address the far flung corners of the Empire, rallying all to our defense?"
cosmo lang,Well...
winston churchill,The Head of our Church? Is that what you have in mind?
cosmo lang,Would it be such a calamity?
winston churchill,Best ask our new King.
cosmo lang,Your Majesty.
winston churchill,"Excuse me, sir, duty calls."
bertie,Is this the scene of the crime?
cosmo lang,What a peculiar thing to say.
bertie,Referring to my assault upon the ears of the listeners.
cosmo lang,"Ah, yes, wireless is indeed a Pandora's Box. I have, however, categorically said no to the BBC's new ""radio-with-pictures"" gadget. Imagine, the unwashed viewing us as we blow our noses or scratch our bottoms."
bertie,Radio with pictures?!
cosmo lang,"It is called...""television"". Happily, with a transmission range of only fifteen miles this ""TV"" thing has no future. We shall, however, be forced to permit cinema; the product of which I shall personally edit."
bertie,"That'll keep you busy, removing all my stops and starts."
cosmo lang,Unless of course you'd prefer a quiet ceremony?
bertie,What exactly do you mean?
cosmo lang,Something...discreet...private. We could pre-record an edited version to be broadcast to the world. Or even find an actor with a similar voice.
lionel,A King based upon deception?
cosmo lang,"If your gentleman from Security would give us space, we could discuss this in private."
bertie,"You mean my bodyguard,""Crusher?"""
cosmo lang,"Fret not. As I assured our nation in my recent broadcast: ""When his people listen to their new Monarch they will note an occasional momentary hesitation in his speech. But to those who hear it, it need cause no sort of embarrassment, for it causes none to him who speaks."" You see, I've paved the way. But should you wish to avoid further stress..."
lionel,Why not paint him pink and cover him with sequins?
cosmo lang,Pardon?!
lionel,If you wish to call attention to his anxiety.
cosmo lang,Does your bodyguard know to whom he's speaking? He certainly doesn't know his place!
bertie,"Doctor Lionel Logue, my speech therapist."
cosmo lang,Therapist?! I'd no idea! Had I known Your Majesty was seeking assistance I would've made my own recommendation.
bertie,Dr. Logue is to be present at the Coronation.
cosmo lang,Impossibly to find room. Even for a Doctor.
lionel,Just Lionel.
bertie,Behind the chair of Edward the Confessor.
cosmo lang,The Royal Box!? Your Family will be seated there.
bertie,Which makes it most suitable.
cosmo lang,Perhaps I might be able to add a very small stool.
bertie,Two comfortable chairs. One for Madam Logue. She's a close friend of my wife. The Queen.
cosmo lang,I'll have someone attend to it.
lionel,"And now, if you don't mind, we need the premises."
cosmo lang,"My dear fellow, this is Westminster Abbey! The Church must make preparations."
lionel,So must Bertie.
cosmo lang,"Bertie?! We do not call the King: ""Bertie""!"
lionel,I do. During waking hours we'll need the facilities. It'll be a closed set. No observers.
bertie,"Those are my wishes, Your Grace."
lionel,Wouldn't want him as a friend.
bertie,And don't ever call me Bertie in public.
lionel,Tell me...
bertie,I sense one of your dreadful questions on the horizon.
lionel,Do you really want to be King?
bertie,Knew it! I haven't any choice.
lionel,"You can be a wounded King who stumbles through his Coronation. Or, as the Arch of C so archly suggests, no Coronation at all. Always a choice."
bertie,"What's this, you wait til Westminster Abbey, then ambush me?"
lionel,I'm simply asking questions... which you seem unable to answer.
bertie,I'm a sacrificial lamb being led to slaughter! Damn you!
lionel,Quite possibly. But at least I know what I want. You haven't the foggiest.
bertie, I WANT TO BE HEARD!
lionel,"That's quite different. Let's get down to work then, shall we?"
bertie,George.
lionel,Like your father?
bertie,Like my father.
lionel,Not Albert?
bertie,Given the current situation...too Germanic.
lionel,"""Sirs, I here present unto you, GEORGE, your undoubted King!"""
cosmo lang,I've made inquiries.
myrtle,A bit dry. Tried to keep it warm.
lionel,Mmm... Kedgeree! Lovely.
myrtle,You look done in.
lionel,I've news for you. You're coming to the Coronation.
myrtle,I've news for you. I'm not!
lionel,You must.
myrtle,Stand in the rain hoping for a glimpse?
lionel,Royal Box. You and I.
myrtle,Lionel...I'd need a new dress.
lionel,Rather thought you might.
lionel,Won't be a sec.
cosmo lang,"""The play's the thing, wherein I'll catch the conscience of a King."""
lionel,Bertie? Blast! Stepped on Lord Byron. Bertie...?
bertie,"This is not a rehearsal, ""Doctor"" Logue."
lionel,"Ah, the Star Chamber inquisition. I wondered when that would happen. And I'd promised Myrtle a new frock."
bertie," ""Just call me Lionel""! Never did you call yourself `Doctor'. We did that for you. No diploma, no training, no credentials. Just a great deal of nerve."
lionel,Want to hear my side of the story?
bertie,"There isn't a ""your-side-of-the-story"". This is my story. And you've ruined it! Its not just the Coronation, terrifying enough, its the radio speech to millions afterwards, and the speech after that, and for the rest of my failed miserable life!"
lionel, Wembley Stadium...
bertie,You dare remind me?!
lionel,I was there.
bertie,Then you knew from the start I was hopeless?!
lionel,"My son, Valentine, asked, ""Could you help that poor man?"" I replied, ""He's too old for me to manage a complete cure, but I could very nearly do it, I'm sure of that."""
bertie,Lying bastard!
lionel,I knew I could help you. You refuse to believe?
bertie,In you?!
lionel,In yourself.
bertie,Who the hell do you think you are?!
lionel,A failed actor.
bertie,Actor?
lionel,"Father wanted me to be a doctor, but I couldn't cut flesh. So I worked in the mines, recited in pubs..."
bertie,An actor?!
