Speaker,Dialogue
lionel,"When the war came, by the time I was ready to be shipped out, the first casualties were limping home. Poor buggers, broken in bone and spirit. `Lionel, you're good with your mouth, see if you can help these poor sods.' The shell-shocked were the saddest. Most stuttered profoundly. Far worse than you. Muscle therapy helped somewhat, but I found I had to go deeper, as you might well imagine."
bertie,I know nothing of those poor men!
lionel,"I think you do. They had cried out, and the universe had not listened. So they'd lost faith in their voice. My job was to make them shout in righteous anger: ""I have the right to be heard!"""
bertie,"I suppose that helped them, did it?"
lionel,Make inquiries.
bertie,Inquiries have been made! No credentials.
lionel,But a lot of success. No training was given. 
bertie,To Harley Street?!
lionel,Cashed in our return tickets. I had three months rent.
bertie,"So you set yourself up on Harley Street as an actor? Harley Street, don't you know, is for doctors!"
lionel,"The plaque says, `L. Logue. Speech Specialist'. No mention of a medical degree. No mention of any degree. Some of the diggers I'd helped had come to England. They made referrals. My practice flourished. My acting, however, did not."
bertie,Well enough to deceive me.
lionel,Lock me in the Tower.
bertie,I would if I could!
lionel,What crime?
bertie,You've saddled this nation in its moment of peril with a voiceless King. Destroyed the happiness of my family...all for the sake of ensnaring a star client you knew you couldn't possibly assist!
lionel,I'm tired.
bertie,You can't sit there!
lionel,Why not? It's a chair.
bertie,It's the Chair of Edward The Confessor! The throne upon which every King for six and a half centuries has been crowned.
lionel,It's falling apart. People have carved their initials into it. Needs a stone to keep from blowing away.
bertie,That's the Stone of Scone! The Stone of Destiny that was once Jacob's pillow.
lionel,"You believe such ballocks I don't care how many royal backsides have sat on it, it's a building block with handles attached. You're just like me, an actor with tawdry stage props you choose to believe are real."
bertie,Listen to me... !
lionel,Listen to you?! By what right?
bertie,"Divine right, if you must! I'm your King!!!"
lionel,Noooo you're not! Told me so yourself. Said you didn't want it. So why should I listen to a poor stuttering bloke who can't put one word after another? Why waste my time listening to you?
bertie,Because I have a right to be heard!
lionel,Heard as what?!
bertie,A man! I HAVE A VOICE!!!
lionel, Well then...you're cured.
bertie,Stop trying to squirm off the hook.
lionel,"Bertie, you'll make a bloody good king. And you know it."
voice,Your Majesty?
cosmo lang,You'll be relieved to learn I've found a replacement specialist. Impeccable credentials.
bertie,That won't be necessary.
cosmo lang,The matter's already been settled. For your own well-being.
bertie,What did you say?
cosmo lang,"Your Majesty's function is to consult...and to be advised. You didn't consult, but you've just been advised."
bertie,"Now I advise you, so listen carefully. ...in this personal matter I will make my own decision."
cosmo lang,"May I remind you, you do not place the crown upon your own head."
bertie,"And may I remind you, it is my head upon which the crown is placed!"
cosmo lang,This will end badly.
lionel,"In hushed tones the BBC commentator paints a picture for the world, as you stand at the altar divested of your robes. Trumpets echo through the Abbey. The incessant rain clears miraculously as a shaft of sun streams through the stained-glass window catching your golden tunic and bathing you in light like a mediaeval knight. And you are King!"
winston churchill,"Amidst a vitrine of glittering jewels, bobbing tiaras, and heaving bosoms."
bertie,"""In this grave hour... "" Sorry."
lionel,Try again.
bertie,"""In this grave hour... """
lionel,"Turn the halts into pauses, during which you say to yourself, ""God save the King""."
bertie,"I say that all the time, but apparently no one's listening."
lionel,Use the silence. Long pauses add solemnity to great occasions.
bertie,"Then I'm the solemnest king who ever lived. Lionel, I can't do this!"
lionel,"Take it from the top. ""In this grave hour..."""
bertie," ""In this grave hour, p-p-perhaps..."""
lionel,Go on...
bertie,The letter`P' is always difficult.
lionel,"Get a running start, put the words all together. `Perhaps-the-most-fateful...'"
bertie,"""In this grave hour...perhaps-the-most- fateful...in our history..."""
lionel,Beaut.
bertie,"""... I send to every household of my peoples...both at home and overseas..."""
bertie,"""...this message... """
bertie,"""...spoken with the same depth of feeling for each one of you... as if I were able..."""
lionel,"In your head, now: ""Bugger, bugger, bugger! Damn, damn, damn! All those bloody blighters are going to have to listen to me!"" Can you dance?"
bertie,What?
lionel,Helps relax the body.  Waltz?
bertie,I prefer pipes.
lionel,"Thought you might.  Dance with me. One, two, one-two-three- four. One, two, one- two-three-four. ""For the second time..."" one-two-three-four ""... in the lives of most of us..."" one, two, one-two-three- four ""... we are at war."" Three, four."
bertie,"""For the second time... in the lives of most of us... we are at war."" One-two- three.  ""Over and over again... we have tried to find a peaceful way... out of the differences... between ourselves... and those who are now our enemies."" Bugger, bugger, bugger! Fuck, fuck, fuck!"
lionel,You'll be ready.
bertie, The shilling you won... still have it?
lionel,Of course.
bertie,I'll return it.
lionel,Willie! Where's your mum?
willie, She had to work.
lionel,"You've been waiting here, alone, all this time?"
willie,I heard the King.
lionel,Did you?
willie,He sang. And shouted rude words.
lionel,He did.
lionel,Why am I not surprised?
floor manager,Think he'll manage?
bertie,"`Walk up to the bloody thing boldly, stare it square in the eye, man to man.'"
bertie,I already know. My father taught me.
bertie, Bugger bugger bugger...bloody bloody bloody...
elizabeth,"Bertie, do make sure that's not switched on!"
lionel,You're going to be splendid. And if you're not?
bertie,They'll bloody well have to listen to me anyway. Right?
lionel,Bloody right.
elizabeth,"Mr. Prime Minister, Your Grace, how kind of you to join us."
cosmo lang,"Wouldn't miss this for the world.  Congratulations. Neville didn't last long, did he? Talking to Hitler."
winston churchill,"My tenure will be shorter, if the King fails tonight."
bertie,"No matter how this turns out, I wish to thank you. For asking such dreadful questions. What can I do in recompense?"
lionel, I've always wanted to be knighted.
bertie,Sorry. That would raise too many questions.
lionel, Understood.
bertie,Your shilling. Told you I'd give it back.
lionel,Keep it for good luck.
bertie,"No, you won this, fair and square."
lionel,"My greatest honour, Bertie.  One final question."
bertie,Oh dear.
lionel,Do you believe you're King?
bertie,Almost.
winston churchill,Couldn't have said it better myself.
cosmo lang,I'm speechless.
elizabeth, Thank God.
lionel,"I always called you Bertie. Today, I call you King."
