Speaker,Dialogue
sound,I need to record room tone. I'll need thirty seconds of silence.
wanda,"Oh, alright! Quiet. Quiet! Shut up!! Thirty seconds of room tone. The sooner you're quiet the sooner we're done."
cora, What's room tone?
nick,"It's for the sound, Mom. We just have to be quiet."
wanda,And roll sound. Nobody move.
sound,Speed.
chad,"We have a new category this year: Best Film Ever Made by a Human Being. And the winner is none other than my Best Bud, Nick Reve!"
man,Had any experience?
nicole,I was an actress for a while.
man,"Yeah, but can you cook a hamburger?"
nicole, Probably.
wanda,"Wolf, I'm sorry! Please forgive me! I love you, Wolf! Please! Give me one more chance. Let me prove it! I love you! I love you, Wolf!"
wanda,"What I love about you, Chad, is you're not afraid of my power."
chad,"Oh God, Wanda! I love your power. It's like an afferdesiac to me!"
nick,"In closing I'd like to say to all the people who told me not to make this movie, who wouldn't meet with me or return a simple phone call. To my favorite professor at Film School whose parting advice to me was to take a job teaching at a women's college. To Delores DelSporto, the girl I loved in high school who left me for a Jr. Varsity football player: to all these people I'd like to say thank you but I can't because what I really feel like saying is go fu -- !!"
sound,"And, that's a cut on room tone."
wanda,"OK, strike the set. Props! Art Department! Redress for Scene thirty- one. Let's go! Right away people! Nick! Nick! Anyone seen Nick?!"
