Speaker,Dialogue
mark,"We evac'd eighteen sols into a thirty-one sol mission... Which means we've got thirteen sols of experiment and research schedules. For each of us. So. Commander Lewis... your work's in good hands. Beck -- I'll be honest with you, I don't understand chemolithotrophic detection. At all. But I'm doing my best. Johanssen, I know you don't like it when I touch the ChemCam, but guess what? I'm touching the ChemCam. Vogel, I think I've got a new cataloguing system for the core samples that I've titled ""Das Core Samples"" out of respect for the Fatherland. And Martinez... I still don't know what it is you do. Why did we bring you? No idea. "
vogel,I have a problem.
vogel,"It's an email from my wife. The subject line says ""Our Children,"" but the computer won't open the attachment."
johanssen,Let's take a look.  Huh. This isn't a jpg. It's a plain ASCII text file. Looks like... I don't know what this looks like. Math equations. Does this make any sense to you?
vogel," ""Rich Purnell Maneuver."" Ja. It is a course maneuver for the Hermes..."
lewis,...and the mission would conclude with Earth intercept 211 days later.
martinez,Would this really work?
lewis,We ran the numbers. They check out.
vogel, It's a brilliant course.
beck,Why all the cloak and dagger?
lewis,NASA rejected the idea. They'd rather take a big risk on Watney than a small risk on all of us. Whoever snuck it in Vogel's email obviously disagreed.
martinez,So. We're talking about going directly against NASA's decision?
lewis,"Yes. If we do the maneuver, they'll have to send the supply ship or we'll die. We have the opportunity to force their hand."
johanssen,Are we gonna do it?
lewis,"If it were up to me, we'd already be on our way."
martinez,"Isn't it? Up to you, I mean."
lewis,"Not this time. This is something NASA expressly rejected. We're talking about mutiny. Which is not a word I use lightly. We do this together, or not at all. Before you answer, consider the consequences. If we mess up the supply rendezvous, we die. If we mess up the Earth gravity assist, we die. If we do everything perfectly, we add 533 days to our mission. 533 more days before we see our families again. 533 days of unplanned space travel where anything could go wrong. Something might break that we can't fix. If it's mission critical, we die."
martinez,Sign me up.
lewis,"Easy, cowboy. You and I are military. There's a good chance we'd be court- martialed when we got home. As for the rest of you, I guarantee they'll never send you up again."
beck,If we go for it... how would it work?
vogel, I plot the course and execute it.
johanssen,Remote Override. They can take over the Hermes from Mission Control.
lewis,Can you disable it?
johanssen,"Hermes has four redundant flight computers, each connected to three redundant comm systems. We can't shut down the comms; we'd lose telemetry and guidance. We can't shut down the computers; we need to control the ship. I'd have to disable the Remote Override on each system... It's part of the OS, I'd have to jump over the code... "
beck,"Johanssen used to go by the hacker handle ""Lady Sorrow"" in high school. Just so we're all on the same page."
johanssen,"Beck is a liar. And he should keep our conversations private.  But, yeah. I can do it."
lewis,"It has to be unanimous. If anyone says no, that's it. We go home as planned. But I vote yes."
martinez,I vote yes.
vogel,"If we do this, it would be over nine hundred days of space. That is enough space for one life.  Yes."
beck,Let's go get him.
lewis,Johanssen?
capcom,"Flight, CAPCOM."
brendan,Go CAPCOM.
capcom,Unscheduled status update from Hermes.
brendan,Roger. Read it out.
capcom,"I...I don't get it, Flight. No real status. Just a single sentence."
brendan,What's it say?
capcom,"Message reads: ""Houston, be advised: Rich Purnell is a steely-eyed missile man."""
brendan,What? Who the hell is Rich Purnell?
guidance,"Flight, Guidance."
brendan,Go Guidance.
guidance,Hermes is off-course.
brendan,"CAPCOM, advise Hermes they're drifting. Guidance, get a correction ready --"
guidance,"Negative, Flight. It's not drift, they've adjusted course. Deliberate"
brendan,"What the hell? CAPCOM, ask them what the hell."
capcom,"Roger Flight. Message sent. Minimum reply time 3 minutes, 4 seconds."
brendan,"Telemetry, any chance this is instrumentation failure?"
telemetry,"Negative, Flight."
brendan,"Oh god. Guidance, Flight. "
guidance,Go Flight.
brendan,Work out how long they can stay on this course before it's irreversible.
guidance,"Working on that now, Flight."
brendan,And somebody find out who the hell Rich Purnell is!
teddy,Annie will go before the media this morning and inform them of NASA's decision to reroute the Hermes to Mars.
mitch,That seems like the smart move. Considering the circumstances.
teddy,You may have killed the whole crew.
mitch,Whoever gave them the maneuver only passed along information. The crew made the decision on their own.
teddy,"We're fighting the same war. Every time something goes wrong, the world forgets why we fly. I'm trying to keep us airborne. This is bigger than one person."
mitch,No. It's not.
teddy,When this is over... I'll expect your resignation. 
mitch, I understand.
teddy, Bring our astronauts home.
marissa,Five hundred and thirty-three days longer? And you said yes to this?
martinez,I did. He would have done the same for me. You know that.
marissa,And you think I'm gonna forgive you?
martinez,I do.
mitch,"All due respect to your CNSA protocol, we haven't done things that way since Apollo 9 --"
mark,"Here's the cool part. I leave this morning for the Schiaparelli crater, where I will commandeer the Ares 4 lander. Nobody explicitly gave me permission to do this, and they can't until I'm aboard the Ares 4. So I will take control of a craft in international waters without permission. Which, by definition, makes me a pirate.  Mark Watney, Space Pirate."
vincent,How's our boy doing?
mindy,"So far, so good. He's sticking to schedule. Drives for four hours before noon. Then sets the solar panels. And waits thirteen hours while they recharge. Sleeps somewhere in there. Then starts again."
vincent,How's his morale?
mindy,"He's asked us to call him ""Captain Blondebeard."""
vincent," Mars would be governed by maritime law, so technically --"
mindy,"Yeah, he explained it to us."
bruce,"Okay, we're gonna start by stating, for the record, that you're not gonna like this."
mitch,"The problem is the intercept velocity. The Hermes cannot enter Mars orbit, or they'll never have enough fuel to make it home. The MAV is only designed to get to Low Mars Orbit. So in order for Mark to escape Mars' gravity entirely and intercept the Hermes..."
vincent,He needs to be going fast.
bruce, Which means we need to make the MAV lighter. A lot lighter. Five-thousand kilograms lighter.
vincent,You can do that?
bruce,"There were some gimmes right off the bat. The design presumes 500 kilograms of Martian soil and samples. Obviously, we won't do that."
mitch,"There's just one passenger instead of six. With suits and gear, that saves another 500. Then we ditch the life support. We don't need it. We'll have Watney use his EVA suit for the whole trip."
vincent,How will he use the controls?
mitch,He won't. Martinez will pilot the MAV remotely from the Hermes.
vincent,We've never had a manned ship controlled remotely before.  But... I'm excited for the opportunities that affords.
bruce,"If we go remote, we can lose the control panels. Then we dump the secondary and tertiary comm systems."
vincent,You're going to have a remote controlled ascent with no backup comms?
mitch,"He's not even to the bad stuff yet, Vincent."
vincent,You better skip to the bad stuff.
bruce,"We have to remove the nose airlock, the"
vincent, You're taking the front of the ship off?
bruce,Sure. The nose airlock alone is 400 kilograms.
vincent,You're going to launch a man into space with a giant hole in the front of the ship?
bruce,Well... no. We're gonna have him cover it with Hab canvas.
vincent,You're sending him to space under a tarp.
bruce,Yes. Can I go on? 
vincent," I'm not really sure I want you to, but okay."
mindy,"Mark says... ""Are you f-word-ing kidding me?"""
vincent,"Do you think he meant it like...  ""Are you kidding me?"""
mindy, It's... possible he meant it the first way?
johanssen,And... you killed him.
lewis,Try it again.
lewis,"Martinez will fly the MAV. Johanssen will sysop the ascent. Beck and Vogel, I want you in Airlock 2 with the outer door open before the MAV even launches. Once we reach intercept, it'll be Beck's job to get Watney."
beck,He might be in bad shape. The stripped down MAV will get up to 12 g's during the launch. He could be knocked unconscious and may have internal bleeding.
lewis,"Well, then it's a good thing you're our doctor. What's the intercept plan?"
beck,"We finished attaching the tethers into one long line. It's 214 meters long. I'll have the MMU, so moving around should be easy."
lewis,How fast a relative velocity can you handle?
beck,Once I get to Mark? I can grab the MAV at 5 meters per second. 10 is like jumping onto a moving train. Any more than that and I might miss.
lewis,We've got some leeway. The launch will be 52 minutes before the intercept and it takes 12 minutes. As soon as Mark's engine cuts out we'll know our intercept point and velocity.
beck,"Good. And 214 meters isn't a hard limit, per se."
lewis,Yes. It is.
beck,"I take off the tether, I could get way out to --"
lewis,"Not an option. Vogel, you're Beck's backup. All goes well, you're pulling them back aboard with the tether. If things go wrong, you're going out after them."
vogel,Ja.
lewis,All right. Let's go get our boy.
annie,"If something goes wrong, what can Mission Control do?"
vincent,Not a damned thing.  It's all happening twelve light-minutes away. That means it takes twenty-four minutes for them to get the answer to any question they ask. The whole launch is twelve minutes long. They're on their own.
annie,"Not that we have a choice, but... are we sure we want to be broadcasting this to the world? I mean, if something goes WRONG --"
lewis,"About two minutes, Watney. How you doing down there?"
mark,"It's good to hear your voice, Commander. I'm eager to get up to you."
lewis,"We're on the case. Remember, you'll be pulling some pretty heavy G's. It's okay to pass out. You're in Martinez' hands."
mark,Tell that asshole no barrel-rolls.
lewis,"Copy that, MAV. CAPCOM..."
johanssen,Go.
lewis,Remote Command...
martinez,Go.
lewis,Recovery...
beck,Go.
vogel,Go.
lewis,Pilot...
mark,Go.
martinez,Main engines start.
lewis,"About five seconds, Watney. Hang on."
mark,"See you in a few, Commander."
johanssen,Velocity 741 meters per second. Altitude 1350 meters...
lewis,That's too low --
martinez,I know. It's fighting me --
johanssen,"Velocity 850, altitude 1843 --"
lewis,"Watney? Watney, do you read? Can you report?"
johanssen,He's well below target altitude.
lewis,How far below?
johanssen,Working on it -- Main shutdown in 3...
martinez,Back to automatic guidance. Confirm shutdown.
lewis,Watney? Do you read?
lewis,Copy.
johanssen,I have interval pings. Intercept velocity will be 11 meters per second...
johanssen,Distance at intercept will be --  We'll be 68 kilometers apart.
beck,Did she say 68 kilometers? Kilometers?
martinez,Oh my god...
lewis,"Keep it together. Work the problem. Martinez, do we have any juice in the MAV?"
martinez,"Negative, Commander. They ditched the OMS system to make launch weight."
lewis,"Then we have to go him. Johanssen, time to intercept?"
johanssen,"39 minutes, 12 seconds --"
lewis,What if we point our attitude thrusters all the same direction?
martinez,Depends on how much fuel we want to save for attitude adjustments on the trip home. 
lewis,How much do you need?
martinez,I could get by with maybe 20 percent of what's left.
lewis,JOHANSSEN --
johanssen, Use 75.5 percent of remaining attitude adjust fuel. That'll bring the intercept range to zero.
lewis,Do it.
johanssen,"Hang on -- that gets the range to zero, but the intercept velocity will be 42 meters per second --"
lewis,"Then we have 39 minutes to figure out how to slow down. Martinez, burn the jets."
mark,MAV to Hermes --
mark,"Affirmative, Commander. "
mark,My chest hurts. I think I broke some ribs.  How are you?
mark,Yeah. The canvas didn't hold...
lewis,That's consistent with what we saw.
lewis,"We've corrected the intercept range, but we've got a problem with the intercept velocity."
lewis,42 meters per second.
mark,Well. Shit.
mark,"I could find something sharp in here and poke a hole in the glove of my EVA suit. I could use the escaping air as a thruster and fly my way to you. Since the source is on my arm, I could direct it pretty easy."
lewis,I can't see you having any control if you did that. You'd be eyeballing the intercept and using a thrust vector you can barely control.
mark,I would get to fly around like Iron Man.
lewis,We should have left him on Mars.
lewis,Maybe it's not the worst idea.
martinez,"No, it actually is. The worst idea. Ever."
lewis,"Not his part. But using atmosphere as thrust...  Martinez, get Vogel's station up and running..."
martinez,It's up. What do you need?
lewis,I need to know what happens if we blow the VAL.
martinez,You want to open the Vehicular Airlock?
lewis,It would give us a good kick.
martinez,Yeah. And it might blow the nose of the ship off in the process.
johanssen,And... all the air would leave. And we need air. To not die.
lewis,We'll seal the bridge and reactor room. We let everywhere else go vacuo.
martinez,But we'd still have the same problem as Watney. We can't direct the thrust.
lewis,We don't have to. The VAL is in the nose. We just point the ship at Mark.
martinez, A breach at the VAL would decelerate us 29 meters per second.
johanssen,Which gives us a relative velocity of 13 meters per second.
lewis,Beck -- you hearing this?
martinez,"How do we open the airlock doors? There's no way to open them remotely, and if anyone's nearby when it blows..."
lewis,Right... right...  Vogel?
lewis,Take your suit off.  I need you to come back in and make a bomb.
mark,"Did you say ""bomb?"" You guys are making a bomb without me?"
vogel,"Um... Again, please, Commander."
vogel,"Probably. But... I feel obliged to mention that setting off an explosive device on a spacecraft is a terrible, terrible idea."
vogel, Ja.
lewis,Beck -- leave your suit on. Meet Johanssen at Airlock 1. We'll open the outer door. I need you to place the charge on the inner door...
beck,Copy. On my way.
mark,"Commander, I can't let you guys do this. I'm ready to puncture the suit. Let's go with the Iron Man plan."
lewis,Absolutely not.
mark,"The thing is, I'm selfish. And I want the memorials back home to be just me. I don't want the rest of you losers in them.  Commander... call it off."
lewis,"Oh. Okay. Well, if you want us to call it off, then I guess we have to oh wait... wait a minute. Yep. I'm looking at my shoulder patch and it turns out I'm Commander. So shut up."
mark, Smart ass.
johanssen,Bomb?
vogel," Bomb. In a pure oxygen environment, 16.7 million Joules will be released for every kilogram of sugar used. Eight times more powerful than a stick of dynamite."
johanssen,How do we activate it?
vogel,Can you run this to one of our lighting panels?
johanssen,Make sure you're not still here when this goes off.
beck,Bomb is set. On my way.
martinez,"Guys, I'm running the numbers -- even with optimal VAL blow, we're gonna be off on our angle."
lewis,What's the new intercept distance?  Johanssen.
johanssen,260 meters. Approximate.
lewis,That's too far...
martinez,Commander?
lewis,The intercept distance is gonna be too far. I'm going untethered.
beck,"Commander, I can do this --"
lewis,"It's not a debate, Beck. I'm not risking another crew member. "
lewis,We sure know how to cut it close.
johanssen,10 seconds...
martinez,Strap in.
lewis,Brace for deceleration.
johanssen,Bridge seal holding.
martinez,Damage?
lewis,Copy.
johanssen,312 meters.
mark,You said 312? Great. I'll wave at you guys as I go by.
lewis,Mark -- you're still WAY TOO FAR -- I'm not gonna make it --
mark,Commander. Seriously.  I got this.
mark, I have visual on the Commander.
lewis,Johanssen -- what's my relative velocity to Mark?
mark,Contact.
mark,You have terrible taste in music.
mark,Hi guys.
johanssen,"Oh, hey Mark. Haven't seen you in a while."
martinez,Yeah. What've you been up to?
mark,"Oh. You know. Same old, same old."
vogel,You smell horrible.
mark,I haven't showered in a year and a half. Cut me some slack.
johanssen,You don't know what you're asking us here.
martinez,"Yeah, captain, we may need to put him back."
mark,I missed you guys.
mark,"Welcome to the Astronaut Candidate Program. Pay attention. This could save your life.  Trust me, I know what I'm talking about."
annie,"The Ares 5 team will rendezvous with the Hermes approximately 48 minutes after launch. From there, they've got 414 days of space travel ahead of them, arriving at Mars on March 30th. And I'll let the Director of Mars Missions, Vincent Kapoor, brief you on the particulars."
vincent,Good morning. Their mission is scheduled for 41 Sols. Your briefs detail the research and experiment schedules...
mindy,"Flight, CAPCOM. Ready to begin preflight check."
brendan,"Go ahead, CAPCOM."
wen,Go.
