Speaker,Dialogue
susan,Drew is none of your damn business. Nor is where I put my mouth.
joe,I'm sorry.  Do you live here?
susan,"No, Joe, I'm swimming here.  Then I'm going home."
joe,I guess what I'm trying to say is -- I'd like us to be friends.
susan,I've got plenty of friends.
joe,I don't have any.
susan,I can see why.
joe,"...I didn't mean to offend you at dinner.  I'm not quite at home some- times with people.  I get busy doing - uh - what I do, and I don't seem to have developed --"
susan,Yes --?
joe,"I have a certain function to per- form, and that seems to take all of my time.  Bu sometimes - uh - I speculate - uh - I haven't left room for - uh - anything else."
susan,I'm sorry to say I know what you're saying.
joe,Susan?
susan,Yes?
joe,Did you know you have a wet spot on your shoulder?
susan,"Goodnight, Joe."
joe,"Goodnight to you, Susan."
susan,Shall we dance?
joe,Yes?
susan,I think you want to go to the west wing.  Through there.
joe, Thank you.
parrish,Good morning.
joe,"Good morning, Bill."
parrish,How are you?  How're you feeling?
joe,'Feeling'?  I feel fine.  How do you feel?
parrish,"Um -- well, I didn't sleep too well. This is crazy.  This is the left- field thing of all time.  What do I do?  What do I tell my family?"
joe,"Oh, I wouldn't tell them anything, Bill.  You'll ruin the good start we had last night.  I felt as if I were being treated like a person.  'Joe' this and 'Joe' that - a nice smile - Quince passed me the rolls -- no 'rapture' or 'passion' or any of those mighty things you seem so intent on imparting, but I am cer- tain, should you - uh - say - uh - who I am - our adventure would end abruptly."
parrish,"What about my family?  This 'adven- ture' involved only me, right?"
joe,And what?
parrish,And I won't tell anyone who you are.
joe,Sounds fair enough.
parrish,It is a deal?
joe,A 'deal'?
parrish,"You give your word, I give mine -- that we'll do what we say.  It's a truth exchanged between two people."
joe,Bill --
parrish,Yes?
joe,You've got a deal.
parrish,Shake hands.
parrish,"You know, I got to thinking last night -- with you here, and seem- ingly occupied, how's your work going - uh - elsewhere?"
joe,"When you were shaving this morning, you weren't just shaving, right?"
parrish,What do you mean?
joe,"You were hatching ideas, making plans, arriving at decisions, right?"
parrish,I guess so.
joe,"So you understand the concept then. When you're busy here, your work, what your task is, is being executed elsewhere."
parrish,Of course.
joe,"So you've grasped the idea.  Con- gratulations.  Now multiply it by infinity and take it to the depth of forever, and you still will have barely a glimpse of what I am talking about."
parrish,Joe --?
joe,"Yes, Bill."
parrish,How about giving a guy a break?
joe,Make an exception?
parrish,There's one to every rule.
joe,Not this.
parrish,"-- I don't deserve this.  I'm still young, this is not my time --"
joe,That's what everybody says.
parrish,I'm not everybody.
joe,That's what everybody says.
parrish,I want to live.
joe,I understand.
parrish,What's it like?
joe,What do you mean?
parrish,What's it like where I'm going?
joe,Can you keep a secret?
parrish,Yes.
joe,So can I.
jaime,"Good morning, Mr. Parrish."
parrish,"Good morning, Jaime."
jaime,Knight's Reward in the 4th at Calder --
parrish," I'm sorry, not today, Jaime."
parrish,"-- And call my family, I'd like them to come over for dinner tonight."
jenifer,Didn't the family get together last night --?
parrish, Jennifer.
jenifer,"Of course, Mr. Parrish.  Right away."
parrish, Perhaps you would like to wait in my office --?
joe,No.
parrish,What I'm trying to say is this is a Board meeting and you are not a mem- ber of the Board.
joe,I'm sure you'll see to it that it won't be a problem.
parrish," -- This is Joe Black, a personal associate of mine - uh - he'll be joining us today.  I know it's -- uh -- unusual, and my apologies -- and Drew -- uh -- carry on."
drew," Nice to see you.  I didn't expect you, but certainly you can't get enough of a good thing."
joe,Thank you.
drew, The Board of Parrish Communications - is hereby called to order.  Our sole order of business is an acceptance of John Bontecou's generous offer and --
joe, Do you have any more of these deli- cious cookies?
drew,"Anything else, Mr. Black?  How about some water?"
joe,"Why yes, thank you."
drew,Hot or cold.
joe,Cold.
drew,And a glass.
parrish," Would you like to sit down, Joe?"
joe,Yes.
drew,"To review -- we're really crossing the 't's and dotting the 'i's here. Bill had a great and conclusive meeting with John Bontecou yester- day, all that remains for us is to put it to a vote."
parrish," Thank you, Drew."
drew, ...Sounds like you're not leaving much room for discussion.
parrish, Sorry.  I know it looks like I'm reversing my field.
drew,"That's your privilege, Bill.  But given our needs, given the absolute necessity for growth, given the fu- ture, the truth is... joining John Bontecou is every bit as certain as - Death and Taxes."
joe,'Death and Taxes'?
drew,Yes.
joe,"""Death and Taxes""?"
drew,Yes.
joe,What an odd pairing.
drew,"It's just a saying, Mr. Black,"
joe,Of whom?
drew,It doesn't matter.
joe,Then why did you bring it up?
drew,"You're not familiar with the phrase, ""In this world, nothing is certain but Death and Taxes""?"
parrish,I am now.
drew,Glad I could be of some help.
parrish,Shall we adjourn?
drew,"But the matter's still on the table, Bill --"
sloane,Why don't we let it rest for the moment?  Give it some air?
parrish,"Well said, Eddie.  Mr. Black, shall we?"
joe, Those cookies were excellent.
drew,Who is that guy?
drew,Get me a Field Background check on Joe Black.  Litigations. Bankrupt- cies.  Credit ratings.  The works. Got it?
parrish,-- What's the deal here?  Are you going to be breathing down my neck right 'til the very end?
joe,I don't understand.
parrish,...I'd like to be alone for a while.
joe,"Are you sad, Bill?"
parrish,"Yes, I am.  There's a research lib- rary on the fourth floor.  Why don't you go down and read some magazines?"
joe,"You're not thinking of going some- where, are you, Bill?"
parrish,"Joe, could I ask you to take a walk? Buy a tie or something.  I know I'll be seeing you."
joe,Of course.
parrish, Now I'd like to be alone.
joe,Oh.  Okay.
parrish,Here -- this will hold you for a while.
joe,It can't buy happiness?
parrish,"Jennifer, give Mr. Black a map of the city."
joe,"No thank you, Bill.  I can manage."
susan,Joe --
joe,How nice you look.  Is that your uniform?
susan,Why did you come here?
joe,"Oh goodness, no."
susan,"Then why are you here, Joe?"
joe,I came to see you.
susan,I don't have any time to see you now.  I'm doing grand rounds and then I'm examining back-to-back patients until dinner and then --
joe,"Very well, I'll watch."
susan,Watch me do what?
joe,Whatever you do.
susan,"That's impossible.  I'm a doctor, I'm --"
joe,And I'll be a visitor.
susan,"Patients have visitors, not doctors."
joe,I don't mind --
teena, Miss?  Miss Doctor?
susan," Just a minute, please."
teena,Please.  My momma's sicker'n he is.
easter,Obeah.
teena,"No, Momma."
easter,Obeah mon.  I gonna die.
teena,"Momma, stop it. Is just a man."
susan, What's obeah?
teena,"Bad spirit.  She just all fever, she don' mean nothin'.  Please help us?"
susan,Have you filled out the insurance forms?
joe,"No obeah, sister.  No duppy, no jumbie.  Evera ting gon' be irey."
easter,Don' leave!?
teena, Momma.
easter, Obeah.
joe,Obeah evil.  I not evil.
easter,What you then?
joe,I from dat nex' place.
easter,You wait here'n to take us?  Like you bus driver to dere?
joe," No, no.  I on holiday."
easter, Some spot you pick.
joe,I nuttin' to do wi' dat.
easter,Make it go 'way.
joe,Doctor lady make it irey.
easter,Not dis pain.  Dis pain tru an' tru. Make it go 'way.
joe,"Can't, sistah."
easter," Can, mistah.  Take me to dat nex' place."
joe,Not time yet.
easter,Make it time.
joe,"Can't feel wi' de way tings gotta be, Easter."
easter, Please...
teena,"Come now, Momma."
joe,"Close your eyes, Easter."
susan, Go with her.  I'll be right there.
joe,She's in a great deal of pain.
susan,Yes.
joe,Some.
susan,Don't apologize.  There's nothing to be sorry for -- every hospital should have someone like you.
joe,Thank you.  I'm so very glad to be here.
susan,Yes.
joe,"Well, I could come again some other time."
susan,"Joe, I'm with Drew."
joe, Not now.
susan,"I have to go, I'm sorry to say --"
joe,Be sorry for nothing.
susan,"Yes.  Well...thank you, Joe."
joe,"Good-bye, Susan."
joe,Are you going to eat your lunch
parrish,It's all yours.
joe,Excellent.  What is it?
parrish,Cold lamb sandwich with cilantro.  A little Coleman's mustard.
joe,Truly - uh - splendid.
parrish,Glad you like it.  My wife turned me onto cold lamb sandwiches.  Joan -- that was my wife --
joe, Uh-huh.
parrish,"Cold lamb sandwiches -- not as chewy as roast beef, not as boring as chicken.  She knew stuff like that."
joe,And more.
parrish,Why didn't you stop me?
joe,Well...I don't know.
parrish,I thought you'd heard a trillion times --
joe,This part I'm interested in.
parrish,She had on this little blue suit -- with a little white collar that had little red piping on it --
drew,May I interrupting?
joe,Yes.
parrish,No.
drew, 'Just kidding'?
parrish,"Sit down, Drew."
drew,"Before I do --  I was hoping we might be alone, Bill."
parrish,Joe and I have no secrets from each other.
drew, How nice for you both.
parrish,Why?
drew,"I was hired, you told me, to help bring Parrish Communications into the 21st Century.  This merger is the vehicle --"
joe,"Perhaps a merger is a way to bring Bill's company into the 21st cen- tury.  And perhaps it isn't.  And perhaps cheating on your French Philosophers exam at The Groton School was an expedient way to get your diploma, and perhaps it wasn't. Be that as it may, Drew, a question can often be argued both ways."
parrish,"Joe, cut it out.  And you too, Drew."
drew, I thought this was practically a done deal --
parrish,"Well now it's undone, okay?  Forget Bontecou!  Scrub him!  I'm tired of his fancy name and his fancy offer. I'm not going for it."
drew,Okay.
parrish,Dinner?  Absolutely.
joe,Absolutely.
drew, Damn decent of you.
joe,"Why, at this juncture, are you letting yourself be so concerned by business matters?"
parrish,"I don't want anybody buying up my life's work and turning it into something it wasn't meant to be.  A man wants to leave something behind. And he wants it left behind the way he made it.  And he wants it to be run the way he run it -- with a sense of honor, of dedication, of truth. Okay?"
joe,Okay.
parrish,And I don't need your goddamn permis- sion either!  You!  Drew!  I don't need anyone to tell me how to run my life.
joe,"Easy, Bill.  You'll give yourself a heart attack and ruin my vacation."
allison," ...We're never all together two nights in a row.  Maybe Christmas, Thanksgiving, that's it.  What's going on?"
susan,Nothing's going on.  Maybe he doesn't want to be alone.  He's go- ing to be sixty-five in a minute --
allison,"...I don't know, Daddy seems funny to me.  Ever since Joe showed.  It's like he dropped from the clouds..."
drew, Good question.
allison,-- But he does seem very nice.
susan,You think so?
quince," ...I read you all the way on the Bontecou thing, and I know where you're coming from.  And I'm with you a hundred and one percent."
parrish,"Thank you, Quince."
quince,"But I've got to tell you, if mergers are in the wild, I've got some great prospects I've developed.  I want to talk to you about them next week."
parrish,Next week?
quince,Yeah.  Or the week after.
parrish,"No, anything is possible.  It's up to Joe."
quince,"Joe, you don't know how glad I am you're aboard.  Anybody who can take some of the weight off the old man, I'm in his corner."
joe,"That's very gracious of you, Quince."
quince,No problem.  I'll leave you two alone.  I can tell you guys have something on the fire --
allison, Did you know twenty-six members of your rifle company are coming?
parrish,Who?
allison,From the Korean War.
parrish,"Conflict, honey.  Korean Conflict."
allison,"Whatever it was, they'll be here. We sent out invitations to everyone, plane tickets included -- the RSVP's are amazing.  A few of them we didn't hear from, and some of them are dead, of course --"
parrish,Of course.
allison," You know, we're going to give this party for you whether you like it or not."
parrish,I like it.  I like it.  I'm sorry I don't seem more appreciative.
allison," That's okay, Daddy."
quince,"...I know you're down, but you know when you're down, Drew, there's no place to go but up."
drew,"Thanks, Quince."
quince,"Never mind Bontecou.  I've got some other merger possibilities up my sleeve, and I'm putting them to see old man."
drew,Are you?
quince,We'll do it together.  I'll clue you in.  Timing's got to be right.  The old man says it's up to Joe.
drew,'It's up to Joe'?  Those were his words?
quince,Yeah.
drew,"'It's up to Joe', huh?"
quince,"Yeah, that's what he said."
drew,"Well, that's very interesting."
quince,"I thought so, too.  Joe's a neat guy."
drew,Yeah.  Neat.
joe,"I wanted to apologize, Susan --"
susan,I thought you said 'Be sorry for nothing'.
joe,"Well, now I am sorry.  For intruding on you this afternoon."
susan,"It wasn't an intrusion.  And if it was, it turned out to be welcome."
joe,I appreciate you --
susan,Excuse me?
joe,I mean I appreciate that.
susan,"And I appreciate you, too."
joe," You do?  Well, thank you very much."
parrish,"I was a little abrupt with you this afternoon, Drew.  Forgive me.  I want you to know I value your advice."
drew,As much as Joe's?
parrish,"You're competitive soul, Drew. That's what makes you a great addi- tion to the money.  Joe is just... around."
drew,For how long?  And why?
parrish,"Please.  Don't worry about him.  And above all, don't antagonize him."
drew,"Boss's orders, huh?  I'm great at following them.  And I think I'll start right now."
allison,"Dinner's ready, everybody!"
drew,"I have a confession to make to you, Joe."
joe, No.
drew,"Well, I'm going to tell you anyway. I did cheat on that exam at Groton. But so did twenty-six other guys, and nobody ever mentioned it until today.  And I'm expecting you won't mention it again.  I don't know who you are and where you're getting your information, but I'm willing to pretend I did not hear it, and let bygones be bygones.  But can I tell you something else, it'd be nice to see the big guy without you next to him.  What are you, his shadow?  Do you hold his dick for him when he goes to take a leak?  You know some- times somebody would like a few min- utes alone with W.P.  That means without you.  Okay, pal?  Let's eat."
parrish,-- I - uh - want to thank you all for coming - uh - my family --
susan,Look who's talking.
allison," Yeah, speak for yourself."
parrish,Anyway -- I remember when you were little girls --
quince,I love little girls --
parrish,And now you're all grown up -- and I'm - uh - um --
susan,"It'll come back, Daddy."
parrish,Will it?...
allison," Daddy, you could sit down if you wanted to."
parrish,"There is so much I would like to say -- but I can't --  So I better sit down.  Carry on, everybody."
allison,Dinner?  Again?
susan,"Haven't you had enough of us, Dad?"
parrish, No.
susan,We'll be here.
quince,You bet.
allison,With bells on.
joe, I would prefer some peanut butter.
coyle,"How would you like that, sir?  On some kind of toast?"
joe,Toast?  No...just the butter.
coyle,Right away.
susan,Why do you love peanut butter so much?
joe, I don't know.
susan,I adore things like that....food I can't do without.  Don't you?
joe,Yes...
susan,"It comforts you, doesn't it?"
joe, Yes...I've found that it does.
drew,Mind if I throw up?
parrish," Please, Drew."
joe, I'm very concerned about the woman you attended to today.
susan,"I am, too."
joe,Has her pain abated?
susan,We're doing what we can for her. But it doesn't look good.
joe,I'm sorry to hear that.
drew,Who are we talking about?
joe, But I know she's grateful for the care you're giving her.
drew,Is this a state secret or are we being excluded just for the fun of it?
joe, Susan's patient is whom we are talking about.
susan,Joe visited the hospital today.
allison,Did he?  That's more than we get to do.
drew,"Well, maybe next time Joe goes, he'll take us along."
joe,Perhaps you could remind me.
drew,I'll make a note of it.  Anything else?
quince,"I'd like to come, too.  See Susan strut her stuff."
drew,"You're on, Quin-cee.  Destination Hospital.  Joe, you'll be the Tour Guide.  Okay?  How's that sound to you?"
joe,Susan is a wonderful doctor.
drew,"I have to go, Bill -- it's been a helluva day.  Need a few minutes to sort everything out."
parrish,"Okay, we'll see you tomorrow."
drew,Sure.
parrish,Why did you go to the hospital?
joe,I don't know.
parrish,You were just curious?
joe,I guess...
parrish,About Susan?
joe,I wouldn't put it that way.
parrish,What way would you put it?
joe,"You tell me, Bill."
parrish,"How about you telling me?  When I ask a simple question, I expect a straight answer.  That's what I'm used to.  Anybody who doesn't give it to me, I fire."
joe,"Are you going to fire me, Bill?"
susan,...See you tomorrow night.
drew,Include me out.  I've had enough of the conversations.
susan,You don't mean that.  You wouldn't disappoint Daddy --
drew,"Daddy'll do fine.  Besides, he's got Joe.  And so do you."
susan,"Drew, you're out of line."
drew,That may be.  But I don't like the fucker.  I don't like the way he looks at you and talks to you.  And vice versa.
susan,"Sorry, but I like the way he looks and talks to me.  And vice versa. Okay?"
drew,"No, not okay.  I thought we had a good thing going here.  It shows you never know."
susan,Well... goodnight.
drew,Yeah.  Goodnight.
susan,How long have you been standing there?
joe,I don't like the way Drew spoken to you.  But I feel better about it now because of the way you spoke back.
susan,"Tell me about yourself, Joe.  Who you are.  What you're doing with my father."
joe,Why?
susan,Because guys who never say anything about themselves are always married.
joe,"No, I'm not."
susan,Girlfriend?
joe,No.
susan,Gay?
joe,No.
susan,"Then tell me, Joe, how come a man as attractive, intelligent, well- spoken ,diffident in the most sed- uctive way, and yet powerful, is all alone in this world?"
joe,"Thank you, I appreciate that."
susan,Where are you going?
joe, To bed.
susan, 'To bed'?
joe,Yes.  I'm tired.
parrish,That was wonderful.
susan,"Yeah, it's good to get together."
parrish,Do you mind if I raise a little caution flag?
susan,Raise away.
parrish,What is the nature of your interest in Joe?
susan,"Well, remember how you told me about ""lightning striking""?  The nature of it's in there somewhere."
parrish,I won't say you may be getting onto shaken ground --
susan,Then what will you say?
parrish,"I don't think this is the lightning you are looking for.  Drew's a good man.  I know I didn't seem to be completely in his corner before, but I've come to appreciate --"
susan,Now we love Drew and Joe in verbo- ten?  What's going on?
parrish,Nothing.
susan,"When you say 'nothing' that way, it's not nothing."
parrish,Then what is it?
susan,It's something.
drew,"...I know you're all as uncomfor- table as I am to be meeting without Bill, but I got a call last night from John Bontecou.  Not only is he still interested, he is sweetening his offer.  Oh yes, there is one additional element: Bontecou is so anxious to get us, he said he'd take Parrish Communications with our Chairman or without."
sloane,And what would that be?
drew,"Bill's birthday is the day after tomorrow.  There is a provisory by- law in our charter.  Per the discre- tion of the Board, Corporate off- icers can be retired at age sixty- five."
sloane,"You're taking this too far, Drew."
drew,Am I not obligated to?
sloane,"You're building this thing up too much, Drew.  He's had advisors be- fore.  Nobody tells Bill what to do."
drew,Thank you for coming.
sloane,"Hello, Quince."
quince,"Hi, Ed, hi folks, I didn't know everybody was going to be here, what a nice surprise.  What's the big confab?"
sloane, This is a secret meeting.
drew, I hope you'll respect its nature -- What we're trying to do here is gather our thoughts -- in light of Bill's rejection of Bontecou's offer -- and make an appropriate presenta- tion to him as to how we think the company might proceed.  Won't you share with our Board the information you gave me last night?
quince,"Well, I'm happy to tell you I've got good news.  As I was telling Drew, I've been making a little hay while the Bontecou sun was shining -- two, possibly three new and boiling hot prospects for merger."
drew,How did Bill react to the leads you've developed?
quince,He was interested.
drew, -- But he was concerned about the timing?
quince,The timing -- yes.  He says it's up to Joe.
drew,'It's up to Joe'?
quince,That's what he said.
parrish,What is this?
allison,Annie made them.
parrish,Who's Annie?
allison,"From La Rosette, only the greatest pastry chef in America.  This is orange, from real Seville oranges.  Lemon, on a mille-feuille crust, a little on the fanciful. And a while, nothing like a good old white cake, vanilla, with Angel food but some maroons shavings thrown in."
parrish,I don't like cake.
allison,"It's for the party, Dad --"
parrish,"Oh, the goddam party --"
allison,'Goddam party'!
quince,"This is great, honey.  The orange. Has it got a little vodka in it? Like that Finnish stuff, orange vodka --  Put your lips around this one, Bill. It's out of this world."
parrish,"No thank you, Quince.  I'm sorry, honey.  I'm no good at this.  Why don't you choose whatever cake you like?"
allison,I knew you were going to say that. Tito Puente.  The old platoon.  Now the cake.  You just don't care.  Why did I do this?  I should have my head examined.  I'm trying to throw the party for the century for my father - and you know what -- he doesn't give a shit.
quince,"But he does give a shit.  Don't you, Bill?"
parrish,"Yeah, I give a shit."
quince,See.  There.  What'd I tell you?
allison,"Yeah, but --"
quince,But what?
allison,What will I tell Annie?
parrish,This one.
quince,The vodka.  What'd I tell you?
joe, Cirrhosis of the liver is the fifth leading killer of adult Western males.
quince,I didn't know that.
joe,"On the other hand, Winston Churchill drank a bottle of cognac a day and lived until he was ninety-one."
quince,"You're an original, Joe.  A little hard to figure, maybe..."
joe,"And you're a nice man, Quince."
quince,Thanks.
joe,You're welcome.
drew," Sorry to intrude, Bill, but we've got a bit of a crisis downtown -- it's not something we could talk about on the phone."
parrish,"What is there to say?  They know what John Bontecou is -- and if they didn't, they know now."
drew,"Yes, you made your feeling abun- dantly clear.  Now they want to do the same with theirs."
parrish,What are their feelings?
drew,"If I read this Board right now, they want you to accept Bontecou's offer."
parrish,Over my dead body.
drew,What do you think the Board is going to say when I tell them that?
parrish,I don't care.
drew,"With all due respect, you damn well better care because if you try to stonewall them again, there'll be blood on the floor."
parrish,Whose?
drew,Yours.
parrish,I'm feeling real uncomfortable right now because the guy who reports to me is threatening me.
drew,I'm just giving you the truth.  There was a time when William Parrish liked the truth.
parrish,"I think it's time you went home, Drew."
drew,Certainly.  Goodnight.
susan,Drew!
drew,Don't worry about it.  There's a beginning and a middle and an end to everything.  And I think I've come to the end of my chapter with the Parrishes.
joe,"No, I don't --"
drew,"Not good, not bad, you know what we got?  Nothing.  No credit, no cars, no mortgages -- no wives.  Nothing."
joe,You first.
susan, Why don't you get off his case?
drew,"Oh, you're the great Joe's attorney now?  Are we going to go to court? Or are we going to go to bed?  And I don't mean you and me.  I mean you and him."
susan,That's it.  It's over.  Get out.
drew,So I guess a blowjob's out of the question?
joe,Almost.
susan, I said get out.
joe,What an angry fellow.
susan,I'm sorry about --
joe,Please.  We don't need to talk about Drew.
susan,No.  We don't.
joe,I love your smell.
susan,-- I guess you haven't.
joe,Thank you.
susan,It was everything.
joe,-- Could you?
susan,"Never tried, 'til now.  Joe, may I kiss you?"
joe,"Why, yes.  Thank you."
susan,You're welcome.
joe,You're welcome.
susan,Joe?
joe,Yes?
susan,I don't know who you are.
joe,"Well...I'm -- uh, Joe.  And you're Susan.  And I - uh - have this weak feeling in my knees --"
susan,And is your heart beating strangely?
joe,Faster.  And I want the scent from underneath your ears and the taste of your lips and the touch of your tongue to stay with me -- forever.
susan,I have to go home.
susan,"Goodnight, Daddy."
joe,"Hello, Bill."
parrish," Hello.  Would you like to join me, Quince and Allison for a nightcap?"
joe,Um -- not right now.
parrish,Okay.  Goodnight.
joe,Goodnight.
jenifer,"Good morning, Mr. Parrish."
parrish,"Good morning, Jennifer."
jenifer,The Board is waiting.
parrish,What?
jenifer,Didn't you call a Board meeting?
parrish,Good morning.
drew,"Did you want to have a cup of coffee or something, Bill?"
parrish,I don't think so.  Do you?
drew," To get to the point, we have re- ceived new information from John Bontecou concerning his desires for this company to merge with his, and we wanted to set the details before you."
parrish,That's it?
drew,Bontecou wants a quick response and --
parrish,"The answer is no, quick enough for you?"
drew,Don't you want to hear the details?
