Speaker,Dialogue
parrish,"I'm not interested in the details. And I'm not interested in the big picture either.  What I am inter- ersted in is how my Board got conven- ed behind my back, is entertaining a further proposal from a man whom it offends me to do business with, moreover has the audacity to present this to me like a prize fish, and I am expected to clap for it like a performing seal.  No, thank you."
drew,So I am to understand from your re- sponse that you do not want to hear the details of Bontecou's offer?
parrish,"Yes, you are to understand that, and now may I ask you a question?"
drew,"Certainly, Bill."
parrish,Are you running this Board or am I?
sloane,"We're not getting anywhere here. Why don't we take some of the best out of this thing, let's consider it coolly, let's take a week --"
drew,Bontecou wants a speedier response than that.
sloane,He'll wait --
parrish,"Doesn't need to.  Today, tomorrow, a week from now -- 'a week from now', who can think about a week from now -- the answer is going to be the same -- a loud, unmistakable, all-inclusive, airtight -- 'No'."
drew,"Before we do, while we're here, there is a second question the Board would like a response to, a far simpler one."
parrish,I've already introduced Mr. Black to you all.
drew,But who is he?  What are his creden- tials?  What is his relationship to you?
parrish,"In English, please."
drew,Mandatory retirement upon our Chairman's sixty-fifth birthday.
parrish,"Thank you for allowing me to save face, Drew."
drew, The other motion before us is the acceptance of John Bontecou's offer to merge this corporation with Bontecou International --
parrish,Joe?
joe," Who I am, and my relationship to Bill, will be divulged in our own good time."
sloane," ...It's not over, 'til it's over."
parrish,"Please, Eddie, no 'Fat Lady Sings"" shit."
sloane,"I still sense some doubt in this group, we could turn it around. You'll be up in the country?"
parrish,"Yes, the big 'celebration' of my mandatory retirement birthday. You're an honored guest, Eddie."
sloane,I'm going to stick it out here.  We still have a shot.
quince,What have you done?  You've gotten the old man fired!
drew,"That we did.  Thanks to you.  He was wobbling, mind you, but you stupid the coup de grace."
quince,I'm going to put a stop to this!
drew,"Quince, you can't unscramble scrambled eggs."
quince,But I didn't mean to do it!
drew,"The train's left the station, pal, and you're aboard.  Would you like to hear the silver lining?  Check that, gold.  I've been working with John Bontecou all along.  We had a game plan -- acquire Parrish Communications then break it apart and peddle it piece-by-piece to the highest bidder.  I set it up for him, he smacks it out of the park."
quince,I don't want to get rich this way -- I'm going to expose you.
drew,Go right ahead.  Tell William Parrish how you betrayed him at a secret Board meeting.  And tell Allison how you got her father fired -- and he lost his company.
joe,"I'm sorry, Bill --"
parrish,That's okay.
joe,What's okay?
parrish,Just a manner of speaking.
parrish," What 'okay' is, it's 'okay' it's over.  We've got bigger fish to fry, don't we, Joe?"
joe,'Fish'?
parrish,Never mind.  I'm tired.  I'm going to take a nap.
joe,I'm not hungry.
parrish,Then I can't help you.
susan,You're here?
joe,I am.
susan,"I just thought I'd drop by, scrounge a little lunch, I was in the neigh- borhood --"
joe,How beautiful.
susan,Just throw it on the chair.
joe,He's taking a nap.
susan,He must be tired -- this Bontecou thing --
joe,"Yes, he's tired.  I believe so."
susan,"No, not anymore.  Are you?"
joe,...No.
susan,Maybe it's the draft through the door.
susan,It's so wonderful to make love to you.  It's like making love to some- one who has never made love before.
joe,Thank you.
susan,Did you like making love to me?
joe,I loved it.
susan,More than you love peanut butter?
joe,Yes!
susan,Where are you going?
joe,Nowhere?  I'm...here.
susan,For how long?
joe,"Oh, I hope a long, long time."
susan,"Me, too."
joe,What do we do now?
susan,It will come to us.
joe,"Hello, Bill."
parrish,I couldn't sleep.
joe,I'm sorry to hear that.
parrish,"No, I'll come down"
joe,"Yes, I saw you see me."
parrish,"Well, you're at the wrong place at the wrong time with the wrong woman."
joe,I'll be the judge of that.
parrish,I'm her father!
joe,"With all due respect, Bill, I'm not asking your permission."
parrish,"Well, you goddam well should.  You walk into my life, give me the worst news a guy can get, have me dancing on the heads of pins with my busi- ness and with my family, and now you're spooning with my daughter."
joe,'Spooning'?
parrish,"Yes, and stop repeating everything I sai, and turning it into a question. Spooning, fooling around, God knows what.  You arrive on the scene -- why you picked me, I still don't under- stand --"
joe,"I picked you for your verve, your excellence, and for your ability to - how shall I say - instruct.  You've lived a first-rate life.  And I find it eminently usable."
parrish,What do you want?
joe,"I'm only following the Parrish bywords.  Looking for that 'ounce of excitement', that 'whisper of a thrill' -- What there is no sense living your life without.  You know what I mean, Bill."
parrish,You're violating the laws of the universe.
joe,This universe?
parrish,"Any universe that exists or ever existed.  You may be the pro, Joe. But I know who you are.  And you're all fucked up."
joe,"I don't like your tone, and I don't like your references."
parrish,And I don't give a shit.
joe,"May I remind you this is not just a dispute with a putative suitor, this is me.  So watch it...Bill."
parrish,Cut the 'Bill' crap out -- you sonofabitch.
joe,"I told you, 'watch it'."
receptionist,Can I help you?
joe,Dr. Parrish.
joe,Oh.
easter,Mistah Bad News.  'Bout time you show up.
joe,"Don' be facety, woman."
easter,"None facety, mistah.  You come for me?  Dat's good news."
joe,"No, I come to see Doctor."
easter,Doctor?  What could be wrong wit' you?
joe,Nuthin'.
easter,"Oh, you come to see Doctor Lady?"
joe,Yes.
easter,My Doctor Lady?
joe,"Mine, too."
easter,You in love?
joe,Yah.
easter,You loved back?
joe,I am.
easter,She knows you real self?
joe,She knows how she feel.
easter, Rass!
joe, Don' need you okayin'.
easter,"Schoolboy tings is you head. Badness for you, badness for her, badness for me, lyin' here tumor, big as breadfruit, poison my inners an' waiting."
joe,Brung you flowers and all I gettin's facety back.
easter, Only flowers I wan' see's one's over my peaceful self restin' in the dutty.
joe,"Can do no right by people.  Come to take, you wan' to stay, leave you stay, you wan' to go.  Rahtid!"
easter,"You not in you right place, mistah."
joe,But I not lonely here.  Somebody want me here.
easter,"It nice it happen to you.  It like you came to Cat Island and you had a holiday, sun didn't burn you red, just brown, sleep no mosquito eat you, rum no poung you head nex' day. But trut' is, dat bound to happen, you stay long enough.  So tak dat nice picture home wi' you, but don' be fooled.  We lonely here mostly, too.  If we lucky, we got some nice pictures."
joe," Got enough nice pictured, Easter."
parrish,"Hello, honey."
susan,Where's Joe?
parrish,Joe?
susan,Where is he?
parrish,I don't know.
susan,"Because I was sitting in a staff meeting, incredibly bored, my mind kept wandering and the only place it landed was -- Joe."
parrish,I don't understand.
susan,"Love.  Passion.  Obsession, all those things you told me to wait for.  Well, they've arrived."
parrish,This is crazy --
susan,"Why?  A man appears at your side, almost never leaves it, you clearly trust him, depend on him, I sense you value him deeply, why aren't those things good enough for me?"
parrish,You don't know anything about Joe --
susan,"What are you afraid of, Dad?  That I'll fall head over heels for Joe -- well, I have -- as you did with Mom.  That's always been standard, whether you like or not."
parrish,"Susan, I don't think Joe is going to be with us long."
susan,Where's he going?
parrish,"I don't know, I can't say --"
susan,C'mon!  The guy's working with you. You always know chapter and verse about everyone who works --
parrish,"In this case, I can't.  I - uh -- I just can't help you.  I only would tell you -- that with Joe, you are on very, very dangerous ground."
susan,I love him.
parrish,I don't care if you love him!  I'm telling you he's no good for you!
susan,"Of course not, Daddy.  I'm sorry."
clerk,Change!  Change!
joe,Why are you giving me money?
clerk,Change.
joe,I am who I am.  I cannot change.
clerk,You change!
joe,That's impossible.  You're wasting your money.  I couldn't change even if I wanted to.
joe,Uh --
parrish,Yes?
joe,"-- I have the feeling that, all in all, what I made this voyage for -- has served its purpose."
parrish,"What are you saying, that it's time to go?"
joe,You are?
parrish,Yeah.
joe,"Good.  Tomorrow, after the party."
may," Telephone call, sir.  Mr. Sloane from New York."
parrish,Excuse me.
parrish,Eddie?
parrish,"Fine, fine.  Big doing up here.  Why are you still down here?"
parrish,"Eddie, hold out all the hope you want but, I promise you, it's hope- less, it's over.  Come on up, let's get drunk, if I had your shoulder to lean on I might actually enjoy this --"
parrish,"If you're trying to show me lay- down-in-front-of-the-bus loyalty, forget it."
parrish,"Okay, Eddie -- anyway, thanks for the memory."
allison,"Hi, Daddy, what do you think?"
parrish,It's starting to grow on me.  But what do the 'B' and 'P' mean?
allison,"The fountain is the Caspian Sea and the Sea is serving up caviar.  The 'B's for Beluga, the 'P' for Petrossian.  Of course, they also stand for 'Bill' and for 'Parrish'."
parrish,"Do they, m'dear?"
allison,-- Plus we've got a baritone with a balalaika coming from The Russian Tea Room.  I've dressed him in a Cossack shirt and he'll sing Nelson Eddy songs.
parrish,"You are amazing.  Why, oh why, Allison, are you doing all this?"
allison,"I do it because I love you.  Because everybody I loved you.  Mommy -- wher- ever she is -- Susan, Quince, the people who work for you, everybody who's ever known you."
parrish,Yeah?  And what about my enemies?
allison,They respect you.  Isn't that a kind of love?
parrish,I haven't been the father to you that --
allison,That you've been to Susan?
parrish,I wasn't going to say --
allison,"But that's what you were thinking. And that's okay.  Because I know you love me.  Not like it is with Susan, the way your eyes light up when she comes in the room and the way she always gets a laugh out of you, as opposed to me when I walk in a room and that look comes over your face, ""What does she want now?"""
parrish,"Hey, there's lots to come.  A little excess -- like you love."
parrish,"You know, darling, this is going to be a wonderful party."
allison," Yes, it is."
quince,Give me a Seagrams and '7'.
ambrose,"I'm afraid this is a wine bar, Mr. Quince."
quince,"Okay, give me a bottle of wine."
ambrose,Red or white?
quince,Both.
joe,"No, thank you."
quince,"C'mon, have a drink.  You look like you need one bad as me."
joe,Do I?  I'm a little confused.
quince,"Confused, huh?  About what?"
joe,Love.
quince,"'Love'?  Oh, man, I've got troubles of my own."
joe,"You love Allison, don't you?"
quince,"Oh yes, I do."
joe,How did you meet?
quince,"I was a world-class loser and she was a happy, little rich girl -- and for some reason she took me in."
joe,But she loves you?
quince,"Because there's nothing we don't know about each other and it's okay. I mean the deeper, darkest secrets -- they don't matter."
joe,"'The deepest, darkest secrets --'?"
quince,"Yeah, it's like you know every inch of each other's souls -- and then you're free."
joe,What do you mean 'free'?
quince,Free to love each other.  Com- pletely.  Totally.  No fear.
joe,"Oh yes, you are one of my favorites."
quince,"What would you say if you knew it was me who brought down Bill Parrish?  I told Drew and the Board that Bill depended on you.  Drew led me on, but I had no business telling him in the first place.  He was setting up Bill from day one.  Drew and Bontecou are going to chop up the company and sell it off for parts. Bontecou was outside, Drew was Mr. Inside.  And I was the fool who made it all happen.  Oh God, what do I do?"
joe,Go to Bill Parrish and tell him everything.  He'll forgive you.
quince,You think so?  How do you know?
joe,Because that's the kind of man Bill Parrish is.
quince,"Well, maybe... I guess you know him better than anybody."
joe,-- Getting to.
quince,Do you think I should wait to tell him 'till after the party?
joe,No.
susan,I like you in a black tie.
joe,I love you in an evening gown.
susan,"It beats a surgical, doesn't it?"
joe,"Yes.  Your father and I, our time together has come to an end."
susan,Where are you going?
joe,Well -- I --
susan,And you can't tell me who you are.
joe,I can tell you the when part.  Tonight.
susan,It gets worse.
joe,No worse than it gets for me.  I'm in love with a woman whom I don't want to leave.
susan,Then don't.
joe,We know so little about each other --
susan,We know all that we need to know --
joe,But there's so much to tell you --
susan,Don't.  That will come later.
joe,Will it?
susan,"Lightning struck.  We caught it in a bottle.  Don't let it out.  I want to be with you, Joe --"
joe,What will we do?
susan,'Love will find out the way'.
joe,'Love will find out the way'?
susan,It's a saying.
joe,"I believe that, don't you?"
susan,"Yes, that's why I said it."
quince,"...what can I say after I say that I'm sorry?  I zipped when I should've zagged, I opened my big mouth one too many times, everything got all twisted --"
parrish,"It's okay, Quince.  I understand. You've always meant well and I appreciate that.  Sometimes things just turn out -- wrong."
joe,Excuse me --
quince,"Come in, Joe -- I want to thank you -- okay, Bill?"
parrish,Sure.
quince," Joe knew the whole story.  I told him.  It was his idea that I come clean.  I mean I wanted to come clean but he gave me a pair of balls, you know what I mean?"
parrish,"Yes, I believe I do."
quiche,"Yeah, well -- I can tell you guys got business --"
parrish,"No, I'm out of business, right, Quince?  However I do have some unfinished business -- with Drew. Get him out here.  Get him on the chopper and get him out here to- night.  I want to tell this guy how I feel about him face-to-face."
quince,"Oh, that could be a tall order, B.P. I doubt that Drew's anxious to see you face-to-face."
joe," Tell Drew that Bill acknowledges that this was a contest and he's lost.  The race is to the swift, but could Drew summon a modicum of understanding and allow Bill to save face.  Tell him Bill wants it understood in the business community he has merely moved upstairs in his own company, and the executive continuity is unbroken.  Tonight's the night to do it.  He'll introduce Drew to his press friends as well as some of his close acquaintances from Washington and Drew can tell them that everything's sailing along just fine."
parrish," All in all, what Bill wants to do is build the golden bridge to Drew with no hard feelings."
quince,You think Drew will go for it?
parrish,"Quince, I've got confidence in you."
quince,"Sir, I'll deliver the package."
parrish,Thanks.
joe,Not at all.
parrish,What the hell do you care?
joe,"I was just asking, Bill."
parrish,"You 'want to know', I'll tell you. You're looking at a man who tonight is not about to walk through the Valley of the Shadow of Death, he's galloping into it.  And the same time, the business he built with his own hands and his own head is being commandeered by a couple of cheap pirates.  And, oh yes, I almost forgot, my daughter's fallen in love with Death."
joe,-- And I'm in love with your daughter.
parrish,Say again?
joe,"I'm in love with your daughter, and I'm taking her with me tonight."
parrish,You're what?
joe,"I think you heard me, Bill."
parrish,You're not taking Susan anywhere. And what the hell does that mean anyway?
joe,"I'm sorry, Bill --"
parrish,"Susan is my daughter, she has a wonderful life ahead of her and you're going to deprive her of it and you're telling me you're sorry?  Well, I'm sorry, apology not accepted."
joe,"I love her, Bill.  She is all that I ever wanted, and I've never wanted for anything because I've never wanted anything before, if you can understand."
parrish,How perfect for you -- to take whatever you want because it pleases you.  It's not love --
joe,Then what is it?
parrish,"Some aimless infatuation in which, for the moment, you feel like in- dulging.  It's missing everything that matters."
joe,Which is what?
parrish,"Trust, responsibility, taking the weight, for your choices and feel- ings and spending the rest of your life living up to them.  And above all, not hurting the object of your love."
joe,So that's what love is?
parrish,Multiply it by infinity and take it to the death of forever and you will still have barely a glimpse of what I am talking about.
joe,"Those were my words, Bill."
parrish,"Well, they're mine now."
joe,Susan wants to come.  She says she's in love with me.
parrish,With you?!  Who is 'you'?  Did you tell her who you are?
joe,No.
parrish,Does she know where she's going?
joe,I don't like what you're saying.
parrish,I don't expect you to.
joe,Are you threatening me?
parrish,"I certainly hope so -- I loved Susan from the moment she was born, and I love her now, and every minute in between, and what I dream of is a man who will discover her and she will discover a man who will love her, who is worthy of her, who is of this world, of this time and has the grace and compassion and fortitude to walk beside her as she makes her way through this beautiful thing called life."
joe,Are you telling me I can't be part of it?
parrish,"Why did you come in here and tell me, Joe?  You are the Biggest Shot of all, you don't have to ask my permission, but that's what you're doing.  You know why?  Because you've somewhere, somehow, developed into a good guy, and you know this is all wrong... I don't know what you're going to do -- how can this be love? She doesn't know who you are.  Why don't you tell her?  Try it out on her?  See what happens.  Reveal everything there is to know about yourself and let the chips fall where they may."
susan,"Hello, Joe.  What'd you know?"
joe,There is something I do want to tell you --
susan,But you can't.
joe,Did I say that?
susan,And I said you'd have a hard time finding a woman like that.
joe,The 'coffee shop' --
susan,-- That was the place... and you were the guy.
joe,I - uh --
susan,"You want me to wait for you, you'll be back --"
joe,"Don't you know, that's what I want more than anything."
susan,"You said before you couldn't tell me who or where, only the 'when' -- Is when now?"
joe,May I kiss you?
susan,That felt like a goodbye.
joe,I'm still here.
susan,But you're not.  You're somewhere else.  You're someone else --
susan,Tell me you love me -- tell me you love me now --
joe,"I love you now, I'll love you always --"
susan,Hold me --
joe,Susan --
susan,-- Yes?
joe,Thank you for loving me.
joe,"...We should think about getting started, Bill."
parrish,Thank you.
parrish,Come in.
quince,-- I got him.  The chopper's two minutes away.
parrish, How are we on time?
joe,Okay.
parrish, Get him in here.
parrish,"No, he's at the office."
drew,"This is damn big of Bill, I also think it's smart."
quince,He had no choice.  You're a formidable adversary.
drew,He said that?
quince,"Well, you've got him by the short- hairs."
drew,"Yeah, the short, gray hairs."
parrish,"I appreciate this, Eddie, members of the Board, this will just take a minute of your time.  As the custo- dians of the company, you may re- ceive information from what follows that is valuable to you --  -- or not.  Either way, thanks."
drew,"Hi, Bill, happy birthday --"
parrish,Shut up and sit down.
drew,I don't know where you get that idea -- the Board agreed --
parrish,The Board didn't know you're a mole who burrowed inside so you could bury us all.
drew,"Is this Mr. Black's fantasy?  Another one of his whoppers?  Aren't you sick of this asshole lurking around? No one knows who he is, but one thing everyone does know, he somehow got your ear and has been pouring poison into it ever since."
joe,"You're the poison, Drew.  You've operated behind-the-scenes to suborn the trust of a man who has stamped you with his imprimatur of class and elegance and stature.  I've seen all kinds and degrees of deception in my time, but Bill Parrish has been on the receiving end of machinations so Machiavellian that it has rarely been my experience to encounter.  And yet he has combatted them stoically, and selflessly, without revealing my identity.  Had he violated the vow of secrecy he took, his task would have been far easier, he could have turned defeat into victory, but he is too honorable a man to have done that.  And now I must release him from that vow.  Because of me, he has lost his work, his company, his reputation -- and now he's going to tell you who I am."
drew," So tell me, tell me, I'm peeing in my pants."
joe,-- And now you're going to pee some more.
parrish,"Joe, don't do this --"
joe,It's time to put this person where he belongs.
parrish,"It's not necessary, Joe.  Drew's going to step aside --"
drew,I'm not stepping anywhere --
joe,"I appreciate your gentlemanliness, Bill, but what we need to do here is drive the dagger home --"
drew,The dagger --?
parrish,I told you to shut up.
joe," Prepare yourself, Drew - I am --"
parrish,He is --
joe,I'll take it from here --  I am --
parrish,-- An IRS man.
joe,"Yes, I am.  IRS man."
parrish,"The Treasury Department asked my cooperation in his undercover investigation of John Bontecou. They were convinced that Bontecou, on past deals, had structured his mergers and acquisitions in sus- picious and complicated ways so as to evade paying the taxes he is liable for.  The IRS wanted to go after him, and this deal offered them the opportunity.  I agreed to cooperate."
joe, And we're very grateful.
parrish,"Moreover, Agent Joe Black here -- of course that's not his real name -- smelled out your involvement, Drew.  He developed evidence you were working both sides of the fence.  Unfortunately, that's known as a conflict of interest --"
joe,Undisclosed conflict of interest --
parrish,An offense --
joe,An indictable offense.
drew,I think I'd like to talk to my lawyer --
parrish,"No lawyers, Drew.  We're going to offer you a deal."
drew,And what do I get?
parrish,You get not to go to jail.
drew,You're talking through your hat. You're offering a deal because you've got no proof.
parrish,Proof?  We've got plenty of proof.
joe, And he's talking through his lips.
drew,"All right, you win.  As soon as I get back to the city, I'll meet with the Board."
parrish,"Well, thank you, that's great, but it's more than I bargained for.  I just wanted to set the record straight."
joe,My pleasure.  This is an IRS Agent's dream.  I'll be promoted to Chief of Section off of this.
drew,"Who would've ever believed it?  You, an IRS Agent --"
joe,'Death and Taxes'.
allison,Daddy!  We've been looking all over for you - this is your party - what are you doing in here?  Never mind. You're on.  Let's go.
parrish, I thought I was going to sneak away tonight...
susan,What a night.
parrish,I'm having a helluva time.
susan,"You were right about Joe, he is going somewhere --"
parrish, I'm sorry.
susan,Are you relieved?
parrish,"Yes, but --"
susan,But what?
parrish,"I want you to know how much I love you.  That you've given a meaning to my life that I had no right to expect, and that no one can ever take from me."
susan,Daddy --
parrish,"No -- I love you so much and I want you to promise me something.  I don't want you to ever worry about me.  If anything should happen, I'm going to be fine and everything's going to be all right.  -- And I have no regrets."
susan,"I love you, Daddy --"
parrish,That's why it's okay.
susan,'No regrets'.
parrish,"It's a good feeling, isn't it?"
susan,Everybody's saying goodbye...
parrish,"I'm still here.  Would you like to dance with me, Susan?"
susan,"Oh, yes --"
parrish,If you don't mind dancing with an old fogey like me.
susan,"Oh, Dad, you're not old.  You'll never be old."
waiter,"Can I get you anything, sir?"
joe,Do you have any peanut butter?
waiter,"I don't think so, sir."
joe,"Thank you, anyway."
parrish,What was that?
susan,The fireworks are about to start.
parrish,"You go ahead, honey, I'm going to catch my breath."
joe,"Happy Birthday, Bill."
parrish,Thank you.
joe,Not exactly.
parrish,I guess you have your reasons.
joe,Yes.
parrish,"Now that we have a moment, would you mind if I expressed my gratitude for what you did for Susan?"
joe,"I wouldn't worry about it, Bill. These things have a way of working out."
parrish,"Don't blow smoke up my ass, you'll ruin my autopsy."
joe,Yes.
parrish,That's life.  What can I tell you?
parrish,"I'm getting a little dizzy, I can feel my heart pumping --"
joe,Not a man like you.
susan,Joe...?
joe,-- You bet.
susan,Where did you go?
joe,"I don't know -- y'know, I don't know -- it's all blurred up and hazy.  And would y'know what I mean if I said I don't think it's worth figuring out?"
susan, That's it?
joe,"Well, I don't know what else to say. It's a helluva party --"
susan,You think so?
joe,Yeah...and you're the prettier thing here.
young man,"Hey, you all right?"
susan,The coffee shop --
young man,I asked you if I said something wrong and you said it was so right it scared you.
susan,What has --?
young man,You said you liked me.
susan,No --
young man,Y'didn't?
susan,I said I liked you so much.
young man,"Hey, everything's going great -- don't y'think?"
susan,...We know so little about each other.
young man,But we've got time.
susan,I wish you could've known my father...
young man,"Me, too."
susan,...What do we do now?
young man,It will come to us.
