Speaker,Dialogue
jacob,Do you hear that?
greyhaired man,Hear what?
jacob,That noise.
greyhaired man,I don't hear anything.
jacob,Excuse me.
stewardess,Yes?
jacob,What is that sound?
stewardess,"That's just the engines, sir."
jacob,"No, it's different.  It's not the engines.  It's getting louder."
stewardess,We're just gaining altitude to get above some rough weather.  That's the sound of the engines speeding up a bit. Everything's fine.
jacob,Um...okay.
greyhaired man," Look, kid.  Will you relax?  It's just the damn engines, okay?"
the children,"One two, Freddy's coming for you..."
child,"Nine ten, never sleep again!"
jacob,No!
jacob,Yeah..
alice,"You okay, honey?"
jacob,"Yeah, Mom.  I'm fine."
alice,Alright.  Better get cooking or you'll be late for school.
jacob,On my way.
jacob,Get the hell out of here!  It's coming!
woman,What's coming?
jacob,Don't you see it?
woman,See what?
freddy,Payback time...
jacob,No!
freddy,"Don't worry, I have a strong stomach."
jacob,I dreamed you away before I was born! Mom said you couldn't come back!
freddy,"Is that true?  Then she told you all about me, huh? Let's see what else she has to say."
alice,"Run, Jacob!"
jacob,Leave her alone!
freddy,You're such a momma's boy!
jacob,You fucker!
freddy,Springwood is only the beginning.  All I need from you is a ride!
sound cop,WAKE UP!
jacob,Mom...
jacob,What's going on?
karen,Free speech.  The right of assembly.
jacob,What is this place?
karen,It's a home.  A foster home.  For teenagers.  It's where you go when things get bad.  It's the place to figure out what to do next.  It's a home for kids that no one else wants.  It's MY home.
jacob,Oh...
karen,What have we ever done to you?
jacob,"Lighten up, mister."
jacob,My kind?  What kind is that?
jacob,Swell.  I've just got a couple of questions for you...Do you love your parents?
jacob,Are they alive?
jacob,What's it like?
karen,Assholes.
jacob,I can think of a stronger word.  Are you okay?
karen,Yeah.  Thanks.  I'm Karen.
jacob,Jacob.
karen,Are YOU okay?
jacob,Yeah.  I just haven't had much to eat lately.
karen,Then come help me unpack.
karen,"I guess the sandwich is alright, huh?"
jacob,It's incredible.  Best I've ever had.
karen,"You're not from around here, are you?"
jacob,No.  I've been on the road for a couple of days.
karen,Do you need a place to stay?
mary,"So, we have to get it fixed."
david,We don't have the money to get it fixed.
karen,What's wrong?
david,Our plumbing has a bad case of hardening of the arteries.  Who's your friend?
karen,This is Jacob.
jacob,Jacob Johnson.
david,"David Ross.  My wife, Mary."
karen,They run this house.  They're helping me and three other ids get a footing in reality before they kick us out of the nest to make room for the next batch.
david,If there is a next batch.  I see the welcome wagon is back.  Was there any trouble?
karen,A little.  Jacob came to my rescue.
mary," Where you from, Jacob?"
jacob,Springwood.
mary,Springwood?  Where's that?
jacob,Upstate about a hundred miles.
david, I know this state like the back of my hand.  I've never heard of Springwood.
karen,Jacob's a little down on his luck.  I told him he could stay here a few days.
mary,Are your parents in Springwood?
jacob,"My father died before I was born.  My mother, she's dead, too."
david,You have a legal guardian?
jacob,No.
david,Been in any state or federal program?
jacob,No.
karen,Just for a little while.  So he can get his bearings.
david,Got any ID?
mary," I think we can help him out, honey.  The budget's tight, but we can't turn down someone in need."
david,"Okay.  You got three, maybe four days to rest up while we try and find a more permanent arrangement for you.  But his isn't going to be a free ride.  We're part of a community summer work project and eighty percent of the money you make goes to the house.  Everybody works - and that includes you.  Are you on drugs?"
jacob,No.
david,"Good.  If I catch anything stronger then an aspirin on you, you're outta here.  No arguments.  You got that straight?"
jacob,"Yes, sir."
david,Okay.  Dinner in two hours.  Why don't you go meet the rest of the gang.
karen,"Thanks, David."
mary,I'll go fix up the spare bed in Wesley's room.
david,"And take a shower, for chrissakes."
karen,"Hey, guys, I got someone for you to meet. This is Jacob.  Jacob, this is Wesley and Gina."
jacob,Hi.
wesley,Welcome to fun central.
karen,He's going to be staying with us for a while.
gina,Oh yeah?  How'd you get through the blockade?
scott,"Hey, beautiful.  How's it going?"
karen,"Hi, Scott."
scott,Who's Barney Rubble?
karen,This is Jacob Johnson.  He's a new resident.  At least temporarily.
scott,He better not be rooming with me.  I value my privacy.
karen,"No, I believe that honor goes to Wesley."
wesley,Good.  I could use the company.
scott,So what's your story?  Divorce?  Custody battle?  Your parents just plain assholes?
jacob,They're dead.
karen,"Mellow out, Scott.  Give him a chance to settle in."
scott,Just curious.
jacob,Is he alright?
scott,He'll be fine.  He just has a problem with cigarettes.
gina,His parents used to use them as a sick kind of discipline.  That's why he's here.
jacob,"If you know that, then why do you smoke in front of him?"
scott,It's not my problem.
jacob,"Just what is YOUR problem, then?"
scott,I took care of my problem.  That's why I'M here.
karen,His dad used to beat him.  One day he couldn't take it any more.
jacob,What happened?
karen,He killed him with his father's gun. Self-defense.
gina,"Everyone here has a fun tale to tell. Isn't that right, Karen?"
karen,Yeah.  Right.
karen,Why don't you go to bed?
jacob,I can't sleep.
karen,You need to talk?
jacob,No.  I'm fine.  Thanks.
scott,"Come on.  Let's hop to it.  Gotta make way for those new indoor tennis courts. The fate of the world lies in the balance.  Okay, this load's full."
jacob,"Yeah, no problem."
scott,I don't know.  Maybe you should think about switching to de-caf or something.
jacob,You okay?
gina,No!  Yes!  Let go of me!
karen,She doesn't like to be touched.
jacob,No shit!
karen,Don't take it personally.  It's not her fault.
jacob,What happened to her?
karen,Her mother was a hooker.  She forced Gina to carry on the tradition.  When she was thirteen...
jacob,Jesus.
karen,You look terrible.
jacob, Thanks.
karen,"I'm sorry...I just wish you'd tell me what happened to you, that's all."
jacob,I can't talk about it right now.  I'll tell you later.  I promise.
karen,Okay.  Why don't you sit and rest for a bit.  The supervisor's not around.  You look like you could use it.
jacob,I think I will.
voice,"Hey, you!"
supervisor,No slacking off.  Back to work.
jacob,"What!  Jesus fucking...Oh, shit!"
supervisor,"Whoa!  Get a grip, boy."
jacob,Huh?  What's going on?
supervisor,"Nothing.  That's the problem.  Now that you've gotten your beauty rest, let's see if you can change it, okay?"
wesley,Aren't you going to bed?
jacob,I'm not tired.
wesley,"Bullshit.  If you looked any more tired, you'd be dead."
jacob,That's right.
wesley,"You gotta sleep, man."
jacob,"Why?  Who says?  You know, people don't even really know why we sleep.  They haven't found any physical reason for it."
wesley,But they do know that you go nuts if you don't.
jacob,"Sharks don't sleep.  They can't pump water through their gills on their own. They have to always keep moving.  If they stop, they can't breath.  If they go to sleep, they die."
wesley,You're not a shark.
jacob,"I know.  I'm just a kid.  Don't worry about me, Wes.  Go to sleep."
freddy,"You can't stay awake forever, boy!"
wesley,I told you you'd go nuts!
jacob,Get everybody else.  I have to tell them something.
wesley,In the middle of the night?
jacob,I MEAN it!
scott,I don't get it.  Is this guy alive or dead?
jacob,"He's neither.  He haunts your dreams and if he kills you, you die for real."
wesley,"I haven't dreamed of him. I have nightmares like you wouldn't believe, but never of this guy."
scott,That's because this all rates an eleven on the bullshit meter!  I don't know why we have to listen to this crap.  You're scaring the hell out of Wes here.
gina,Keep your voice down.
scott,"It doesn't matter.  The Ross's sleep like rocks, which is what we all should be doing."
jacob,"I know this sounds crazy, but I swear it's true.  I went to bed one night and woke up in the middle of the road. Freddy Krueger killed my mother, blasted my whole town into his nightmare, and, worst of all, I think he wants to use me to kill more kids and bring more towns into his world."
karen,How?
jacob,I'm not sure.  I think I'm some kind of carrier.  He's somehow inside me and as soon as I fall deep enough into sleep he'll be let loose.  You guys were great to take me in.  I just don't want to thank you by getting you all killed.
scott,Okay.  Show me Springwood.
jacob,That's what I've been trying to tell you.
scott,There's NEVER been a town there.
jacob,"That's how YOU see it.  I was part of the nightmare, so I'm the only one who notices the difference."
scott,"Look, Jacob.  You don't have to convince us that nightmares are real.  Everybody in this room has been through one.  And some of us are still living it.  But the thing is, we know it's just in our heads now.  It can be just as bad as the real thing was, but it's still only a memory. It can't hurt us physically, unless we do the hurting ourselves."
gina,And we don't want to see you get hurt.
wesley,We know it gets crazy.  And we'll help out the best we can.
scott,But this is just too hard to believe.
jacob,"You don't believe me, either, do you?"
karen,I don't know.
jacob,Why are you still here?
karen,"I'm not sure.  I guess, I guess I see a lot of me in you."
jacob,"Feels good to see someone more fucked up than yourself, huh?"
karen,Yeah.  That must be it.
jacob,But you haven't told me why you're here at this place.
karen,I can't talk about it right now.  Maybe later.  Do you want me to stay with you?
jacob,"Yeah, that'd be great.  Don't let me sleep, okay?"
karen,I'll do my best.
jacob,Yeah.  Thank God.
karen,Where are you going?
jacob,I'm leaving.
karen,Why?
jacob,He can't hurt you if I'm gone.  Maybe I'll go to the desert or something.  I'll lie down in the middle of nowhere and finally get some sleep.  Krueger can feed of the dreams of snakes and vultures.
karen,Fine.  You're just going to take off then...
jacob,Don't do this to me.  I'm just trying to protect you and the others.
karen,Right.  You blow into town and then blow right out.  Terrific.
jacob,I don't understand why you're so mad at me.
karen,"You just don't get it, do you?"
jacob,Get what?
karen,Running away doesn't help.
jacob,"And you're going to convince me, huh?"
karen,Maybe.
jacob,Yeah.  Sure.
alice,Jacob!  Help me!
freddy,"Say it, don't spray it, huh, Jacob?  Come and join the fun!"
karen,Jacob!
jacob,Nooooo!
jacob,No!  Don't let them take me!
karen,"Jacob, it'll be alright."
jacob,You don't understand!  Let me go!
david,This is just what we need.
jacob,Don't fucking put me under!  You'll set him free!
freddy,"Thanks for the lift, kid!"
jacob,What do you want from me?
freddy,I already got it!  The rest I'm going to get from your new little friends.
jacob,Leave them alone!
freddy,It's my duty to clean up the neighborhood!
jacob,What have you done with my town?
freddy,"Aw, poor baby's homesick, isn't he? Don't worry.  We'll all be one happy family soon.  Wanna be the first recruit?"
jacob,Over my dead body!
freddy,As you wish.
blade cop,We have to.
sound cop,It's our job.
freddy,Get a new one.
power cop,Goddamnit!
jacob,Alright...just who the hell are you guys?
blade cop,We're the Dream Police.
jacob,The what?
power cop,"The Dream Police.  Didn't you hear her, man?"
sound cop,I think you're the wrong guy to talk about attitudes.
blade cop,"Guys, guys.  This is getting us nowhere."
jacob,Hello?  May I butt in here and ask some more stupid questions?
blade cop,We don't know much more than you do. What we do know is that we've been recruited...
jacob,By who?
sound cop,We don't know.
jacob,Why?
blade cop,I think that's obvious.
power cop,The shit's about to hit the fan.
sound cop,Krueger's discovered new powers.
blade cop,He's ripped a hole between dreams and reality.
power cop,Our own powers have been amplified.
sound cop,We only hope it will be enough.
blade cop,But we're going to need your help.
jacob,Me?  What can I do?  Just who are you guys...really?
blade cop,We were like you.  We fought Freddy Krueger many years ago.  Our souls were released from his grip.  No we're back to try again.
jacob,I still don't understand what...
sound cop,Freddy Krueger can't hurt us anymore.
power cop,Because we're already dead.
jacob,What's going on?
doctor,"Just relax, everything's fine."
jacob,That's what you say...
doctor,You're lucky you're here instead of juvenile hall.  You put up quite a fight. But you're clean.  No traces of drugs or alcohol in your blood.
jacob,I could've told you that.
doctor,Hold on there.
jacob,You said I was fine.  I have to get back. My friends are in trouble.
doctor,"I said you weren't on drugs, but I never said you were fine.  You're suffering from extreme fatigue and stress that manifested itself into one hell of an anxiety attack.  At least that's what we hope it is.  You had a major seizure, Jacob."
jacob,You don't understand.  This whole town is in danger.
doctor,We're keeping you here for observation. You're not going anywhere tonight.
jacob,You can't do that.  You don't have the right!
doctor,"Yes we do.  Your temporary guardian, Mr. Ross, signed all the papers.  If you're okay in the morning we might let you go home.  Until then, you're bed bound."
jacob,But...
doctor,We took off the restraints.  Do you want us to put them back on?
david,Sleep.
jacob,Shit...
gina,"Nice movie, huh?  And I came in here to mellow out."
second orderly,"Yeah, mac.  You've just had a hard day, that's all."
second orderly,"Yeah, Wesley.  Have a smoke."
wesley,Fuck this.
first orderly,"Relax, Wesley."
wesley,Dad?
freddy,"Yeah, Wesley.  Everything's gonna be great!  Just have a smoke on us!"
freddy,Didn't Daddy ever tell you what the Surgeon General says...?
wesley,Go to hell!
freddy,Right...
wesley,Noooooooo!
assistant,I don't get it.  The couch is barely scorched.  And how can he burn from just the neck down?
coroner,It happens.
assistant,It happens?  That's your explanation?
coroner,I've seen worse.
assistant,What?  What worse?
coroner,Never mind.
assistant,No.  I wanna know.  Really.  What could be worse than...
fire marshall,You know what the gossip rags are going to say?  Spontaneous human combustion.
cop,What's that?
fire marshall,"That's where bodies are supposed to go up in smoke for no reason.  It's all psychic bullshit.  What really happened is called the candle effect.  A tiny fire gets started, usually from a cigarette.  It slowly smolders through the blanket and clothes until the skin starts to actually bake.  The body fat begins to melt and liquefy, fueling the fire like a slow burning candle.  It takes hours, but it's real."
cop,He fell asleep while smoking.  What a waste.
scott,That's impossible.
jacob,Who?
karen,Wes...
jacob,Oh my God.  It's started.
scott,He fucking burned alive.
karen,They said he fell asleep smoking.
scott,And we all know that can't be.
jacob,I already told you how it would happen.
scott,Don't start with that shit.
jacob,It's not shit.
david,"C'mon, kids.  Everyone inside.  Now."
david,We have to be strong.
scott,He would never touch a cigarette.  You know that.
david,"We don't know anything until the authorities are finished with their investigation.  In the mean time, no work for tomorrow - three day weekend.  But Monday, it's back on the job.  Jacob wasn't covered in our health plan and his little stint at the hospital cost us a bundle.  We have to work together or we might lose this place.  Okay?"
jacob,"When I was put under, Freddy was released.  I know this because I dreamed it."
scott,And that dream was real?
jacob,Yes.  Wesley was his first victim.
scott,"Aw, man..."
jacob,You said it yourself.  How could it have been a cigarette?
karen,And how could he...dire that way and not wake up?
gina," Maybe the ""authorities"" will figure it out."
scott,I'm sorry.  I just can't buy into this.
jacob,Call me crazy...but I think he's after Rosedale.  The whole place.  In my dream he said something about needing a few souls to get the job done. I think he has to kill in order to get the power to suck in a new town.
scott,You are crazy.
jacob,Thank you.  There's more.  There are... other people in there.  In the nightmares.
karen,Like him?
jacob,"No. Different.  There are three of them. They're dressed in black. They have powers like Freddy, but they seem to be on our side."
karen,Who are they?
jacob,"Well, you gotta hang in there with me on this one.  They call themselves... the Dream Police."
scott,This is too much.
gina,You mean...like cops?
jacob,I guess.
karen,Where are they from?
jacob,They're kids that Freddy killed years ago.  THEY don't even know how they got there.  But they're somehow patrolling dreamworld to put a stop to Krueger.
scott,Then why haven't these guys done the job already?
jacob,They say they need help.  I don't know what or why...yet.
scott,I can tell you who needs help.
jacob,"Hey, I'm trying to save all of us."
scott,I won't believe it until I see it.
jacob,By then it'll be too late.  It was too late for Wesley.
karen,They're going to use all this to shut us down.
jacob,I know.  It's my fault.
karen,You going to try to run away again?
jacob,It's too late for that. I have to stay and try and put a stop to it.
karen,I'm sorry.  It's all so hard to accept.
jacob,I wish I could convince you of the danger you and the others are in.
karen,I've been in danger before. THAT I can handle.
jacob,This is worse than anything you can imagine.
karen,I wouldn't be so sure about that.  Come on.  Let's go inside.
karen,"She was great. Loving.  Supportive, caring - everything a mom should be. Except she had one fatal flow: my father. You see, she was raised at a time when they still had the ""obey"" part in the wedding vows.  He was always jealous. She couldn't talk to another man without him thinking she wanted to go to bed with him.  He never hit me. But the things he did to her...and she would always just take it.  She never fought back.  He'd get drunk and...she'd tell people she just fell down or something.  Then one night...I was thirteen.  Something happened.  My mom suddenly wouldn't take it anymore.  Something made her say enough is enough.  She hit back.  Tat only made it worse.  I watched as he hit her over and over.  Then he knocked her down the stairs.  She broke her neck. And when y father saw what he'd done - he finally became human.  He cried over her body for a while, then went into the garage and blew his brains out with a shotgun.  To this day I don't remember what that final straw was.  The shrinks say I've blocked it out of my memory. There's no one else alive who knows what really happened.  I have dreams about it sometimes, but there's always that blank spot.  A missing piece."
jacob,I'm sorry.
karen,"I know nightmares are real, Jacob.  I know."
jacob,So did my mom.  She taught me a lot about dreams.
karen,Like what?
jacob,She told me that a lot of people have special dream powers.  I inherited some from her - and some I have all to myself. She showed me how I could link up with other people's dreams - to actually be inside with them.
karen,That sounds wonderful.  But...I don't know...
jacob,"A little hard to imagine, huh?"
karen,Yeah.  I'm sorry.
jacob,I can convince you.
karen,How?
jacob,Easy.  We're doing it now.
karen,What do you mean?
jacob,I mean we're dreaming.  You and me. Together.
karen,I don't believe it.
jacob,It's true.  We're really doing it.
karen,But what if I'm just dreaming of you telling me that?
jacob,We'll compare notes when we wake up. Then you'll know.
karen,Did you bring us here on purpose?  Can you go anywhere you want?
jacob,"Sometimes.  It's not as easy as linking up, though."
karen,"Wow, I never knew..."
jacob,Show off.
jacob,I think I like you the way you always are.
karen,Look!
jacob,"Karen, no!"
karen,Oh no...
freddy,Welcome to Romper Room!
karen,Why are you doing this?
freddy,Don't you remember?
jacob,Come on!
karen,What?
jacob,You heard me.  I said wake up!
karen,How?  This is my old house.  How did I get here?
jacob,"This is a dream!  You have to get out of here.  I'm not hurting you, only he can really do that!  Wake up now!"
freddy,"Gettin' kinky, huh?"
karen,I think I get it now.
karen,You hit me.
jacob,Are you hurt?
karen,Um...no.
jacob,"If he had done it, you'd be dead."
karen,You better get back to your room.  We don't want anybody to get the wrong idea.
jacob, Or the right one?
karen,Get out of here.
jacob,That's something else my mom taught me.
karen,No.  Not tonight.
karen,"I'm telling you, this Freddy guy is for real."
scott,And I'm telling you a dream is a dream.
karen,Jacob was in there with me.
scott,And where else was he with you last night?
jacob,What the hell is that supposed to mean?
karen,I have the picture in my room if you want to see it.  He brought it out from the nightmare.
scott,Or from your hope chest.  I bet your bed isn't the only thing he's been into.
karen,That picture was destroyed years ago.
jacob,"You better watch your mouth, pal."
scott,I'm the last person you want to start fucking with.
jacob,"Go ahead and be a tough guy, Scott. Krueger will cut you to pieces before you can even flex a muscle."
gina,Will you two stop it!  You're scaring the shit out of me.
karen,You should be scared.
david,Alright.  What's going on here?
scott,Join the fun.  Jacob and Karen were just telling us about their new excuse to sleep together.
jacob,Nothing happened between us last night.
scott,"You mean in plain old reality, right?"
david,"Okay, everybody.  Out.  Jacob and I are going to have a little talk.  Now."
jacob,"I'm sorry, but..."
david,"Hey, I don't know what kind of shit you're shoveling to these kids, but it's going to stop.  My Good Samaritan instincts have their limits.  We've had enough tragedy around this place.  We don't need you making things worse with fantasies."
jacob,You don't understand
david,And I want you to stay away from Karen.
jacob,It's a free country.
david,"This isn't America, it's my house.  I've been checking up on you.  You have no record with the police or the state or any of the runaway groups.  You're the invisible kid.  And if I sense even a little bit more trouble-making from you, you're going to vanish from here.  Got it?"
jacob,"Yes, sir."
jacob,You're supposed to be off-limits to me.
karen,It's okay.  The Ross's have gone to a council meeting and Scott's in his room. We should be safe for awhile.
jacob,Wonderful.
karen,"Jacob, what are we going to do?"
jacob,I'm going to go to bed soon.
karen,Now you WANT to sleep?
jacob,I have to find the Dream Police.  I think I'm somehow their link to all this.  They only seem to appear when I'm around.  You woke me up before I had a chance to talk to them last night.
karen,I'm sorry.  I was scared.
jacob,your fault.  I have to ask them what we're supposed to do to help them.  And maybe I can protect Gina while I'm in there.
karen,What about Scott?
jacob,He's on his own.
karen,Oh...
jacob,"I don't mean to be cold,but we've done everything to convince him.  Gina's too scared to understand.  I think Freddy will go after her next."
karen,What should I do?
jacob,You have to stay awake.
karen,That's not going to be easy.  I'm half asleep already.
jacob,You have to try.
karen,I'd better get out of here.
jacob,Okay.  Be careful.
karen,YOU be careful.  I'm not going anywhere.
freddy,Going up?
gina,You're not real!
freddy,"Ah, but who is?"
fat man,"Hi there, princess.  Your mom's told me all about you."
freddy,...is a maniac trying to get out!
freddy,Huh?  I didn't order anything...
jacob,Come on!
gina,Let go of me!
jacob,I'm here to help!
gina,Let's get out of here.
power cop,Where'd he go?
sound cop,I thought you had him.
blade cop,Shit...
jacob,No no no no!
sound cop,Stand back.
jacob,You let him get away!
sound cop,It's difficult.
power cop,He's been at this longer than we have.
blade cop,He can do anything.
sound cop,But we have to catch him in the act to get him.
jacob,What...there are rules to all this?
sound cop,They're not rules.
power cop,It's just the way it is.
blade cop,"Jacob, we need you to bring the rest together."
jacob,The rest?  You mean the kids at the home?
blade cop,Yes.  We need as many of you as we can get.  And you must bring them to Springwood.
jacob,How?
blade cop,"You have the power to link your dreams with other's.  Dream of Springwood, then bring the rest with you."
sound cop,Living souls are what he thrives on. Living souls are what we need to help stop him.
power cop,Before it's too late.
blade cop,Before he takes everyone.
sound cop,And every THING.
freddy,Ah...alone at last.
jacob,Gina!
karen,Is it an earthquake?
jacob,No.  It's Freddy.
david,"Pack your bags, kids."
jacob,You're kicking us out?
david,No.  They're taking you away.  They say it's for your own good.
karen,They can't do that.
david,"Yes, they can.  They consider Mary and I possibly unfit to act as foster parents. They're going to find temporary homes for you until this mess is straightened out. I'm so very sorry."
karen,"No, please."
david,They're not calling it an accident this time.  They don't really know what to call it.
scott,What's going to happen to us?
david,You'll be alright.
karen,What's going to happen to you?
david,I don't know.  They're thinking of pressing charges.
jacob,"Aw, Jesus..."
david,Come on.  A car from juvenile hall will be here in an hour.
karen,What about it?
scott,Are we considered suspects?
karen,Will we be able to go back to the Ross's?
karen,Will we be together?
scott,Great...
jacob,If it's still here.
karen,"Jacob, what are we going to do?"
jacob,Nothing.
karen,"What do you mean, nothing?"
