Speaker,Dialogue
jacob,It's over.  We're finished.  He's won.
scott,Looks like your hero just gave up.
karen,How can you do this?
jacob,Do what?  I'm not doing anything.
karen,Exactly.  After all we've been through you just throw in the towel.  Why?
jacob,Because we're fucked.  The last thing the Dream Police told me was that they needed all our help.  Together.  Even if we weren't about to be split up there aren't enough of us left to make a difference.
karen,How do you know that?
jacob,"I don't.  But, it's all just too much. I've tried so hard and nothing's worked. I'm spent.  I'm wasted.  I'm...I'm so tired."
karen,So you're just going to give up?  I'll bet that's something your mother never taught you.
jacob,And we're not going to waste it.
karen,"Scott, we need you."
scott,"Look, I don't know what's going on anymore.  Two of my friends die and now you tell me I have to drop into dreamland with you guys to do battle with the dude that did it."
jacob,We'll have help.
scott,"Ah, yes.  I almost forgot.  The Sleepy Squad.  Alright.  I'll make you a deal. I told you I wouldn't believe this stuff unless I saw it.  If I understand this correctly, all I have to do is fall asleep and you just whisk me into the action."
jacob,Right.
scott,"Okay.  If that happens, if both of you show up in my dream, I'll help you out. If nothing happens, then I'll get a good night's sleep and laugh at you in the morning."
jacob,Fine.  You got a deal.  And you won't be disappointed.
karen,I'm going to be sleeping in the girl's dorm.  Will you be able to bring me in?
jacob,I hope so.  Then I got to make sure we all end up in Springwood.
scott,The old stomping ground?
jacob,Yeah.  Only right now it's not a very pretty place.
karen,What do we do when we get there?
jacob,Play it by ear.  And try and stay alive.
social worker,"Half hour til lights out, everyone."
jacob,Off we go.
scott,Into the wild black yonder.
scott,"Freddy Krueger.  Yeah, right.  Years ago some sicko gets fried and now he comes back to stick it to you when you're snoozing.  Stupid bedtime story."
scott,"Oh, this is lovely."
bum,"Hey, buddy?"
scott,"Yeah, what?"
bum,Can you spare some change?
scott,"Um, well, let me see..."
karen,Scott!  You're here.
scott,"Yeah.  Fun town.  Talk to any of the neighbors, yet? They're a swell bunch of folks."
karen,"Uh-huh.  Real friendly, too."
scott,So this is a dream?
karen,And I'm in it with you.  Convinced?
scott,Maybe I'm just dreaming bout being here with you.  Wouldn't be the first time.
karen,"Nope.  I tired that one already.  Doesn't work.  Come on, we have to find Jacob."
karen,Jacob!  Thank God!
scott,"So this is the place, huh?"
jacob,I'm home.
karen,What now?
jacob,"Scott, are you with us?"
scott,A deal's a deal.
jacob,Then we wait.
scott,Whoa!
power cop,Is this all?
jacob,All that's left.
sound cop,It'll have to do.
scott,We can always come back later.  Like when it's daytime.
power cop,It's always night here.
jacob,What's the plan?
blade cop,We need you to draw him out.
scott,Terrific.  We're supposed to be bait.
sound cop,Essentially.
jacob,Then let's do it.
blade cop,Fan out.
jacob,Oh no...
mutant bouncer,Two drink minimum.
scott,"Ah, that's okay.  I think I'm underage, anyway."
mutant bouncer,Two drink minimum.
scott,"No, really.  I'm driving."
mutant bouncer,Two drink minimum.
mutant waitress,Can I get you anything?
scott,That's okay.  I'll just sit at the bar.
mutant waitress,"Alright, honey.  You call if you need anything."
scott,You bet.  You'll be the first to know.
bartender,What'll it be?
scott,"Um, a beer, I guess."
bartender,Go on.  Puts hair on your back.
scott,And that's all?
bartender,No charge.  Compliments of the man at the end of the bar.
freddy,Welcome to my favorite haunt.
scott,So you're the man.
freddy,At your service.
scott,What's on your mind?
freddy,A deal.
scott,A deal's what got me into this.
freddy,Bring Jacob to me.
scott,What's in it for me?
freddy,"Power.  You don't need to hang out with those losers. You're a take-charge kind of guy, Scott.  Like when you took charge of your father."
scott,Leave my father out of this.
freddy,I'll make you mayor of Rosedale.
scott,After you make it look like this?
freddy,You can have Karen.
scott,Alive?
freddy,Any way you want her.
scott, Okay.
freddy,Shake?
scott,No thanks.  I trust you.
jacob,Mother?
scott,Mayor of Rosedale.
freddy,I hate a snitch!
scott,Eat shit...
jacob,Krueger...
freddy,"Lighten up, bone brain."
mutant bouncer,Take it outside!
freddy,No more playing around.
sound cop,Kincaid!
freddy,Put a lid on it!
jacob,"I'm sorry, Scott."
blade cop,You shouldn't be.
sound cop,He still exists.
jacob,What!  How?
power cop,"We're already dead, that's why he couldn't destroy us."
blade cop,But he's not dead. He's not alive either. He's something in between.
sound cop,He's not entirely part of reality or part of dreams.  He's unique.
blade cop,WE can't kill him.
power cop,We can wail away on each other until doomsday and not do any good.
jacob,Then who's going to kill this fucker?
sound cop,YOU have to.
jacob,How the hell am I supposed to do that?
blade cop,Krueger's power comes from his rage and the souls of children.
power cop,You have to find the original source of that rage and use it against him.
blade cop,This town in its present condition encompasses all evils from all times in its history.  The answer is here somewhere...
jacob,I think I know where...
blade cop,"Jacob, wait.  We have to find him first."
jacob,No time.  You guys find Karen!
karen,No more...
karen,Jacob!  You scared the shit out of me!
jacob,The feeling is mutual.
karen,Where are the Dream Police?
jacob,I told them to look for you.  What are you doing here?  Don't you know what this place is?
karen,I do now.  Look what I found.
jacob,You've got to get out of here.
karen,Wait.  You have to see this.
jacob,You don't understand.  The Police can't kill Freddy.  They literally chopped each other to pieces and he's still alive! Now I'm supposed to figure out how to get rid of him.
karen,But I think I found the answer.  Shut up for a second and look at these.
jacob,"Okay, so he's a bad artist."
karen,"No!  You told me Krueger's mother committed suicide and no one knows who his father was, right?"
jacob,Yeah...
karen,"Freddy's been pushing all our buttons with our pasts.  These are HIS past. Don't you get it? HE was a foster child, too!"
jacob,But in reality Freddy hasn't lived here for decades.
karen,"Like you tried to tell me once before, this is a dream.  Who knows why this is all here."
jacob,All evils from all times in history...
karen,And isn't this where it all started in Springwood?  On Elm Street?
jacob,But what does this do for us?
karen,There's got to be a way to use it against him.
jacob,"Okay, but we're not going to stand around here to figure out how. It's too dangerous."
freddy,Time to join your mommy.
karen,No no no no no no no...Jacob...
freddy,Young love...ha!
jacob,Karen...dream...powers....
freddy,"It's past your bedtime, young lady."
karen's father,That's my baby.  That's Daddy's little girl.
karen,Oh no...
karen's father, Now do you remember?
karen,You're NOT my father.
karen's father,But we're going to have the same fun!
karen's mother,That's enough!
karen,"Mommy, no!"
karen's mother,You're never going to touch her again!
karen's father,I'll touch what I want!
freddy,"Be honored, bitch.  You're the last soul I need."
jacob,I'll be back...
freddy,I'll be waiting.
voice,FREDERICK!
freddy,Daddy?
freddy,"No, Daddy. Please..."
power cop,We gotta get outta here!
blade cop,"It took a human touch.  It took knowing HIS nightmare.  Goodbye, Karen."
woman,"You okay, honey?"
karen,Yes.  I'm alright.
woman,I've never seen you around.  Are you new in town?
karen,Sort of.
woman,Well then...  Welcome to Springwood.
