Speaker,Dialogue
mayor,With what? We got five guns maybe 20 rounds of ammo in the whole town! How do we fight them with that?!
the postman,You don't. Negotiate a settlement. Give them extra supplies.
mayor,Okay. You're a government rep. You go tell them.
bethlehem,Make it quick.     I've got an attack to coordinate.
the postman,"General, um, they've asked me to negotiate a peace treaty."
bethlehem,Do I know you?
the postman,"I don't think so, sir. I --"
bethlehem," You're the Postman, aren't you?"
abby, watches from the flap of Bethlehem's tent.    The guard sees and shoves her back inside.
bethlehem,The restored United States. Do these people really believe that shit? Who are you really?
the postman,I am a United States Postman. Authorized by order 417 of the restored Congress to --
bethlehem,I was at the Battle of Georgetown. I watched the White House burn to the ground. Don't try to sell me on any restored U.S...
the postman,"The new capital is based in Minneapolis. Inside the Hubert Humphrey Metrodome. You know, where the Vikings used to play?"
bethlehem,"You're funny.    Now, what are the terms?"
the postman,They'll open the gate and give you double what they usually give. Just don't hurt anybody. This was all a misunderstanding.
bethlehem,"Appreciate your offer, Postman. Problem is, you're in no position to negotiate. These people made it through the bugs and the riots and the three year winter. But they're not going to survive you."
bethlehem,"Law six, justice can be dictated.  Kill him. And kill the restored United States with him."
captain," In accordance with law eight and by the authority of Emergency Order 46, you are hereby --"
bethlehem,Get her.
bethlehem,Colonel Getty!
abby,We can't stop now. They'll be coming after us.
the postman, Abby...
abby,Don't move.
sixth soldier,"If you'd had a bullet, you'd a used it by now."
abby,You're right.
the postman,Thank you.
the postman,I don't think I ever had water soup before. Maybe next time we could try it with a little sand?  A twig garnish?
the postman,You used to think I was funny.
abby,They killed Michael.
the postman,I'm sorry.
abby,How sorry are you?
the postman,What's that supposed to mean?
the postman,What's with you?
abby,You got the mark of eight on you.
the postman,A mark doesn't mean I'm a --
abby,You're a liar.     I should've let you die.
the postman,"Then, why didn't you?"
the postman,You were with Bethlehem. Does that make you one of them?
the postman, Don't make me use this.
the postman,Wind's come up.  Getting colder too. Must be another storm --
abby,Anything else?
the postman,I didn't mean for you to --
abby,Your legs are going to rot off if you don't try to walk.
the postman,I'm hurt.
abby,You're lazy.
the postman,Lazy?! I got a hole in my stomach. I'm weak. The two big meals around here are grass and snow. And we're running out of grass.
the postman,Where are you going?
the postman,"You're not leaving me here, are you?"
abby,This is the last of it.
the postman, Give me a break...
abby,I'm going to check the pass.
the postman,Why are you in such a hurry to get out of here? I can think of worse places. And worse company to --
the postman,You can't play tic-tac-toe with yourself.
abby,Help!
the postman,I can't help you.
abby,I told you that's all there was.
the postman,That's why you should have it.
abby,I knew you could walk.
the postman,"You're weird, you know that?"
the postman,"We walked on the moon once, Abby."
abby,So?    What good is that now?
the postman,Obviously you've forgotten Tang and microwave ovens.  Your face looks pretty.
the postman,Not so bruised.
abby,"Look, there's something you'd better know. You're going to find out soon enough. I'm pregnant.  It's Michael's baby. You're just the body father."
the postman,How do you know it's mine and not Bethlehem's?
abby,He tried with me almost every night. He couldn't do it. So he beat me. Said it was my fault.
the postman,Abby.
the postman,What is it?   What's wrong?    Is it the baby?
abby,The pass is clear. It's time to go.
the postman,What happened?
the postman,You got our stuff out.
abby,Of course.
the postman,Of course?   I don't understand.
abby,I set the fire.
the postman,Am I missing the point here?
abby,"You didn't think we'd stay here forever, did you?  You shaved."
the postman,Yeah...
abby,It looks nice.
the postman,"You're really weird, you know that?"
the postman,"Have you ever heard of St. Rose, Abby?"
abby,I've heard people talk. I've heard lots of names. Bliss. Hesperia. New Eden. Sheriff Briscoe says it's a fantasy.
the postman,He's wrong. St. Rose is out there. And I'm going to find it.
abby,But you're The Postman.
the postman,"Look, I'm nobody, Abby. I'm just..."
the postman,"This is what I hate. Strangers. Do you say 'hi' or do you blow their head off? Do they want to share what they got or take what you have? And if they want to take, how far are you willing to go to stop them? Damn it.  All right. That's far enough."
the postman,We don't want any trouble.
rider,"Me neither, mister."
abby,What are you?
the postman,That's impossible.
ponytail,Ain't you heard of The Postman?
abby,"No, tell us."
ponytail,"He's only the greatest man who ever lived. He crossed the wasteland, shook his fist at the enemy and spit in the eye of General Bethlehem himself. He's back east with President Starkey right now."
the postman,Who told you all this?
ponytail,Postmaster Ford Lincoln Mercury. He's in direct contact with the restored congress.
the postman,Direct contact... I don't believe this.
ponytail," Do you have mail, or don't you?"
the postman,You said Carrier Eighteen. That mean there's eighteen of you?
ponytail,Thirty-two.    As of midnight.
chubby,You got another letter?
ford,More recruits?
red,Seven of them. They're coming from everywhere.
chubby,Did you get a letter or didn't you?
ford,"Gather 'round, everybody. Got another letter here. Came in last night."
the postman,What's all this?
young carrier,Postman sent Ford another letter. He's gonna read it.
ford," 'Hello, all postal carriers.'"
carriers, Hello!
ford,"I'm here in Minneapolis with President Starkey, but my thoughts are with you. Remember, nothing worth doing can be done overnight. Keep your chins up and do your best not to get shot. Signed, The Postman."
ponytail,His letters are always kind of short.
ford, Hold on now. There's a P.S... Anybody know what P.S. stands for?
chubby,Holy shit...
red,"That would be H.S., Chubby."
chubby,I seen him once when I lived in Benning. It's The Postman!
the postman,P.S.   Ford knows what to do.
ford,Guess you want to talk about this?
ponytail,I found him!   I found him!
the postman,President Starkey? Minneapolis? Ford knows what to do?
ford,I thought you were dead.
the postman,So? I'm not making the connection. What's all this then?
ford,I lied. I told people you were in contact with me.
the postman,Why?
ford,Because I didn't want it to end.
the postman,"I don't know how long I can stay, Ford. President Starkey will send word one day and I'll have to move on. Understand?"
ford,Sure. But you'll stay till he sends word? Right?
the postman,"Aw, don't do that. Hands down."
ford,"You'll stay 'til President Starkey sends word, right? Right?"
the postman,"Yeah, till he sends word, right."
ford,Could you say a few words?
the postman,Two plus two equals four.
ford,"We bring all the mail here first. We sort it, group it and then it goes out. So far we got thirty routes."
the postman,You spelled tyranny wrong.
chubby," Boy, he's smart."
the postman,How old are you?
old george,"Seventy-five, sir."
the postman,Can you ride?
old george,"Nope. Can't walk too good, either."
the postman,Why are you here?
old george,I know stuff.
the postman, When did you get that?
old george,1970. A girl with eyes as big as saucers did me in a little town called Saigon.
the postman,Abby --
abby,Yes?
the postman,Ford wants me to have his trailer. Said it's the best one.
abby,I'm on the other side of town.
the postman,I got plenty of room here.
the postman,So much for the uniform theory.
bethlehem,"What do you think, Lieutenant?"
gibbs,"Can't tell what it is if you stand too close. The colors all kinda run together, don't they?"
bethlehem,Yes...
bethlehem,"Well, if it isn't our old friend the U.P.S. man."
gibbs,We captured him on the Oregon border.
bethlehem,Who the hell are you?
bethlehem,I want the camp struck at dawn. We're moving north.
gibbs,"Yes, sir."
bethlehem, You spelled tyranny wrong.
the postman,I wish they'd stop saluting.
the postman,Just stay safe and remember. The mailman's more important than the mail.
chubby,"Boy, he's smart."
the postman,What the hell?
the postman,"For President Starkey and the First Congress of the Restored United States, I officially declare Postal Station 10... What's the name of this town?"
young leader,We never named it.
the postman," I officially declare Postal Station 10 in Elvis, Oregon, open for business!"
little boy,I missed him.
briscoe,"Phil, this better not be another of your U.F.O.'s."
the postman,I'm back!   And I got mail.
briscoe, I'll be damned.
ford,Bethlehem is offering a 1000 pounds of gold to whoever brings you in. Dead or alive.
the postman,Thank God it wasn't a carton of cigarettes.
briscoe,I'd have shot you myself.
briscoe,"Things are getting better. Getting better all the time.  I don't know who you are, but I do know I was wrong about you."
the postman,"Got a letter for you, Sheriff."
briscoe,It's from my sister. I thought she was dead.
the postman,You thought wrong.
dance," The Postman taps Ford's shoulder, wants to cut in on him and Abby. Ford steps aside. A beat before Abby decides it's okay. They begin. Her eyes are on her feet, careful that she doesn't take a misstep. But his eyes are on her. And over it all, BLEEDING IN, the sound of HOOF BEATS."
dance, They whirl as the tempo picks up. The Postman pulls Abby in closer. Her eyes now move up to his.
road, They're closing in on the terrified Red.
dance, Abby and The Postman.    The chemistry is undeniable.
road," RIFLES CRACK. SHOT in the back, Red throws back his arms. Letters flutter from the mail bag over his shoulder; he seems to glide along that way forever."
the postman,"Tell me about the baby, Abby.   I want to know."
road, Red falls from his horse.    One of the soldiers scoops up his mailbag.  CUT TO:
gibbs,"Births and deaths, the weather, gossip. There's nothing here."
bethlehem,Nothing? Everything is here.    Am I the only one who sees that?  Get out!
bethlehem,Give the people back their hope and their dreams won't be far behind.
bethlehem,"What is it, Getty?"
bethlehem," A military man, especially a commander, should keep a journal. After he's gone, it's the only real defense against the slander that arises."
the postman,Who do you talk to?
old george,Not a soul in seven years of trying. But I will.
old george,Go ahead. Take a look.  Want some?
the postman,"No. No thanks. Hey, don't let the kids see that."
old george,I was an aerospace engineer. I helped design the Galileo space station.  I dream it's orbiting Earth forever. With a dozen human skeletons all grinning at each other. Laughing at us down here.
the postman,What is it?
ford,It's Red.   He's overdue.
the postman,That makes five. All on Southern routes.
bethlehem,No.  No. Not him. No.  Children. I want a man and you bring me children!
gibbs,Not yet. General wants the message to get back.
the postman,Tell me about the other stuff you know...
the postman,"Ford, I want you to get rid of the bodies. I don't want these people blamed for what we did."
sentry,Halt!   Identify yourself!
sentries," They raise their rifles as the riderless wagon looms out of the night. They each get off a SHOT before being forced to dive out of the way. The wagon continues on, down to..."
bethlehem, Postage due...
bethlehem,You want a war? I'll give you a war. I was born for it!
the postman,Get this mail sorted. Bring me a fresh horse. Something to eat.
the postman,And all the mail going South!
the postman,They changed the oath.
abby,Ford's idea.
the postman,Figures.  They don't think to ask who they're replacing. Or why.
luke,Sir? It'd be an honor if I could shake your hand.
luke,Sir?
the postman,You look like... Do I know you?
luke,"No, sir."
the postman,"Well, good luck to you."
the postman,Nice kid.   Probably be dead in a week.
abby, You're exhausted. You need rest. There's food in the trailer --
the postman,Where are you going?
ponytail,Route twenty-two. I'm already an hour late.
the postman,You're grounded. Get off the horse. You know the rule.
ponytail,What rule?
the postman,Twenty-two's too far south.
ponytail,But they're waiting on their mail down there.
the postman,Get off the goddamn horse.
the postman, Tie him off to this one.
abby,You can't keep doing this.
the postman,Doing what?
abby,Riding all the routes.   You're not saving anyone.
the postman,"Did I ever tell you how I got to be a postman, Abby?  I don't know if you'd laugh or cry."
gibbs,Ready!
soldier,"The post office, General?"
bethlehem,No. Let it stand. All by itself. So it can remind them what it cost them.
gibbs,Aim!
gibbs,Fire!
bethlehem,You think you can ride?  Then today's your lucky day.
bloodied carrier,Bethlehem says...
bloodied carrier,... he's... headed north. He's gonna kill ten people in every town. Then burn it to the ground. For what you did...
bloodied carrier,"He said to tell you Pine View's on his way. He said he'd wait there, but not for long.  I was so scared, sir... I thought they were going to kill me, too... I wish they would have..."
postman's pov, Pine View in flames. The big John Deere gun has blown several gaps into the palisade. Bethlehem watches as his army sacks the town. The people have been rounded up. The selection of the ten has begun.
ford,What are you going to do?
the postman,I'm going to stop this.
ford,You can't.
the postman,"Get out of my way, Ford. All of you."
ford, They'll kill you.
the postman,Goddamnit --
ford,You can't help them!
the postman,"There's still time, Ford!"
ponytail, You're hurting him.
ford,"No, this is all my doing.    I went against your orders."
ford,The Holnists we killed. You told me to bury them. But I didn't. I sent Bethlehem the bodies.
the postman,Why?
ford,Because Bethlehem has to know that we're not going to stop.
the postman,"God damn you, Ford. Those people down there are dying because of us. Because of what we did."
ford,"Bullshit. They're dying because of Bethlehem. They're dying because this is a shitty world. And if we're ever going to change it, then somebody might have to die. If I could make it be me down there I would. But I can't."
the postman,"My God, what have I done?  We don't even know their names..."
ponytail, We know their names. The little one's my brother. His name is Billy.
ponytail,What Ford did was wrong. But it doesn't change anything for any of us. Does it?
bethlehem, He's out there somewhere. Watching. I can feel it.
bethlehem,"You feel it too, don't you? Didn't have to end like this, Sheriff. He knew where I'd be if he wanted to face me like a man. Instead, he's hiding like a rabbit. So much for your Postman."
gibbs,Ready!    Aim!
briscoe,"Ride, Postman! Ride! You hear me? I said ride!"
bethlehem,Fire!
abby,Ford thinks you're going to do something.
the postman,I am.
the postman,"If I don't, those kids are going to keep on getting themselves killed."
abby,Ford doesn't know what it means to be a kid. He doesn't have your memories. None of them do. All they've got is the lousy world we gave them. And this is the only decent thing in it.
the postman,"What? Being a postman? It's all bullshit, Abby. All of it.  I took this uniform off a skeleton to stay warm. I made up the rest to stay fed. There is no restored United States."
abby,I knew it was something like that.
the postman,"Weird thing is, being a Postman was almost the best thing that ever happened to me...  Remember this? You left it behind that night."
abby,I remember...
the postman,I always liked to think you left it on purpose. But maybe you just forgot it.
the postman,Is this everybody?
ford,The rest are on the overdue list.
the postman,This is everybody.  Got a letter from President Starkey.
the postman,'Greetings all carriers.'
carriers,"Greetings, President Starkey!"
the postman, 'I've been in contact with The Postman. I've received all the reports. I'm proud of you all.'
the postman,"In dark days, in a weary world, you gave everything and asked for nothing. You beat back despair and replaced it with hope and for that your country can never repay you. But the price is too high. I won't see anymore of my bravest die. It is my duty to hereby disband the Postal Service of the restored United States. You are to burn your uniforms and The Postman is to return to Minneapolis at once. Thank you and that is all."
ford, The President never wrote that letter.
the postman,If he could've that's what he would have said.
ford,Who's the other letter to?
the postman,Bethlehem. I'm taking it to him in the morning.
ford,What does it say?
the postman,Mail's private. You know that.
ford,What does it say?
the postman, It says it's over. It says we quit.
ford,It says you quit. What about the oath?
the postman,"Tell me something, Ford. How much mail can a dead postman deliver? It's over."
ford,Then I'll take it.
the postman,I can't trust you.
ford,If this is the end. If this is the last piece of mail that ever gets delivered. I'll take it.
the postman,Whoever takes this letter probably dies for it.
ford,I'm still a postman. You owe it to me... I owe it to me.
the postman,"I'm going to St. Rose, Abby. And I'm taking you with me. I know you don't want to hear it, but that's my child inside you. I want to see it born somewhere safe. I have a right to that, Abby. Whether you like it or not."
the postman,Thought I recognized you.
luke,General Bethlehem said...  ... You should be on your knees when I do it.
the postman,I don't give a damn what that asshole said.
luke,The general is a great man.
the postman,The general is a fucking lunatic.
the postman,"You don't own a thought in that goddamn head of yours, do you?  You want to see a man?"
the postman,That's a man.
the postman,"You don't understand, do you? You never will until you can think for yourself and be willing to pay the price for it."
the postman,You ready?
the postman,"You're a better man than Bethlehem, Luke. I've seen it."
chubby,Guess Minneapolis is that way.
the postman,We can't help you. We're just as lost as you are.
bethlehem,"Good lord, what do we have here?"
ford,I'm a representative of the restored United States --
gibbs,He's got a letter. Says The Postman sent it.
bethlehem,A letter?
bethlehem,"'Bethlehem. This letter is my testimony to the fact that there is no restored United States and there is no Postal Service.'  'My carriers are returning home. In exchange, I'm asking you to let them be. The Postman.'"
bethlehem,He expects me to believe this?
ford,Traitor...
bethlehem,Then I've won.     I've won.
bethlehem,You were supposed to kill him.
luke,I couldn't get close enough.  This one's his second in command.
bethlehem,Why doesn't that surprise me?
bethlehem,Bring out the one we found yesterday. They can die together.
ford,Who are you?
cal carrier,Name's Clark. Postal Carrier of the restored Republic of California. Who are you?
ford,Postmaster Ford Lincoln Mercury.
cali carrier,It's an honor.
bethlehem,Wait a minute... wait a minute!
gibbs,Sir?
bethlehem,Hold your fire! You don't know each other?  This will never be over. It'll go on except I'll be fighting a goddamn ghost.
gibbs,"Should we fire, sir?"
bethlehem,No goddamnit.
bethlehem,"No, I won't fight a ghost. Tabula rasa, gentlemen. A clean slate. I want all mail carriers hunted down. I want The Postman found. I want him dealt with.  He rode west?"
the postman,I don't know him. Do you?
abby, Where do you think he came from?
squatter,Howdy. Welcome to sunny California.
the postman, What happened here?
squatter,Little accident. The ground started to shake big time and the Hanford nuclear plant went...  ... 'Poof.' Destroyed everything for miles. But the sunsets are beautiful.
the postman,You ever hear of a city called St. Rose?
squatter,"Friend, I've never heard of St. Shit."
squatter,"Hey, don't go! I got Monopoly in the house! Boardwalk, Park Place and the Reading Railroad!"
chubby,You think that's President Starkey?
ponytail,No.
chubby,What makes you so sure?
ponytail,President lives in a white house. That guy's place is gray.
the postman, We can rest in there.
the postman,Did you see that?
abby," I'm hungry, Postman."
guard,Set the rifle on the ground.
the postman,This old thing? It isn't even loaded. Where are we?
the postman,I know you.     You're famous.
the postman,"We will be. Right now, we'd just appreciate some food.  I got some kids behind me, too."
the postman,"Three.  Hey, guys, come on in! I know you're out there!"
chubby sentry,"Boy, is he smart..."
the postman,Thanks.    She's not my wife.
the postman,"Let me ask you something, have you ever heard of a town with electric lights?"
the postman,Yeah!
the postman,How far?
the postman,You seem like a decent man. And these seem like decent people.
the postman,And this seems like a safe place.
the postman,All of them. I'll give you the horses and my gear. Abby's special. She's strong. Probably end up running the place.
abby, You never heard of a postman?
abby,There used to be a postman for every street in America. They wore uniforms. And hats. Like this one...
abby,My postman knew the name of every kid on my street. He knew our birthdays. He'd even find the baseballs you'd hit down the street. I can still see the smile on his face. The tip of his cap -- when he had a letter in his bag with my name on it. Mine always came just after school. You could set your watch by him. Unless you were waiting on something special -- like a present from somewhere far away or a letter from your sweetheart. Then it seemed like he'd never come. I used to think they could make time stand still.
abby,"I don't think we ever really understood what they meant to us until they were gone. Getting a letter made you feel like you were part of something bigger than yourself. No place was ever too far away for the postman. So nobody ever had to be alone. The postman was someone you could count on. Things just made more sense when they were around.  That's the kind of world we used to have. A world a lot of us took for granted. And now we've got this one. And it makes me wonder -- what kind of world do I want my child to live in? I want my child to live in a world where hopes and dreams aren't just lies you tell yourself to get through another day. I want my child, and I want my friends -- I want all of us to live in a world where you still get your mail."
the postman,Yes.
the postman,"Yeah, I guess I am. And all of a sudden, I'm not wearing the right clothes."
the postman,I'm sorry I've brought this on you.
the postman,The order was to burn all uniforms.
the postman,You know what to do then?
ponytail,Talk to the people. Gather who's willing. Tell them it's important. Tell them we can make a difference.
chubby sentry,And tell 'em we're going to kick ass.
the postman,"Yeah, tell them that, too."
abby,"This is hard for me.  I don't know why I've been so blessed. And I've tried to find a way to be thankful, but I swear, if I lose you..."
the postman,"Abby, do you think a lie can become the truth?"
abby,"I don't know, but I believe in you. You have a gift, Postman.     I saw it back in Pine View. "
abby,"When you come back, we'll be waiting here for you. So you can take us to St. Rose."
the postman,How do I stop --
counterweight, Plummeting into the Columbia River Gorge.      The Mayor lets out a rebel yell.
basket," The Postman is whipped along, past the riders below.     The speed exhilarating."
old george,"Steady, boys, steady."
gibbs,In accordance with Law Eight...
old george,"Get on with it, you floppy-eared sonuvabitch!"
the postman," Riding over the crest. Galloping toward them. Behind him, forty new mail carriers. All riding like mad. One of them carries the flag of the restored United States.  Gibbs and his men run for their horses. SHOTS are FIRED. Four Holnists go down. The rest gallop away.  The Postman and his carriers meet."
bethlehem,How many?
gibbs,A least a hundred. With guns.
bethlehem, With guns? Are you sure?
gibbs,"Yes, sir..."
bethlehem,Looks more like two hundred to me...
bethlehem," Only thing worse than a coward is one who can't count. Lieutenant, do yourself a favor. Die well in this battle. In my army a deserter's life is a brief and unpleasant one."
bethlehem," At last, someone with courage enough to bring the fight to me."
bethlehem,"Reckoning, gentlemen. This is the day I've dreamed of."
bethlehem,They're an eager-looking bunch. Morale's a dangerous thing.  Bring him up. I want this postman to see how the game is played.
the postman, Stay here. No one moves until I give the orders.
sergeant,Are they surrendering?
bethlehem,"God, I hope not."
bethlehem,My little shipping clerk.
the postman,We're both a couple of frauds. You know it; I know it.
bethlehem,Great men are made by other great men. Patton had Rommel. Grant had Lee. But I get you.
bethlehem,Are you trying to goad me into a fight?
the postman,Wouldn't it be great if wars could be fought just by the assholes who started them? We could settle this thing right here. You and me.
bethlehem,"Unfortunately, it doesn't work that way."
the postman,It does in your army.
the postman,I invoke law seven of the Laws of Eight! Any man may challenge for leadership of the clan!
bethlehem,What?
the postman,I challenge you.
bethlehem,You're not a Holnist. You're not a member of the clan. You don't have the right.
the postman,I have every right. I invoke law seven!
the postman,I challenge for leadership of the clan!
bethlehem,Where do I know you from?
the postman,'Cry Havoc! And let slip the dogs of war.' Remember that?
