Speaker,Dialogue
bethlehem,Shakespeare. The one who didn't want to fight.
the postman,I should've found a way to kill you then. But you seemed so strong.
bethlehem,Law seven it is.  This war is settled here!
bethlehem,I study people. I know your problem. Do you know why you can't fight?
bethlehem,You have nothing to fight for. You don't care about anything. You don't value anything. You don't believe in anything. That's what makes me better.
the postman, I believe in the United States Postal Service.
the postman,Neither snow...  Will stay this courier from the swift completion of his appointed rounds...
the postman,It doesn't have to be this way. We don't have to kill each other. We can live together. We can --
ford,Law three.   Mercy is for the weak.
the postman,"Ford, don't..."
ford,Law eight. There is only one penalty and that penalty is death.
the postman,He isn't worth it. I'm the head of the clan now! There are going to be new laws!  Law one! No more killing! There's going to be peace!
the postman,Who else?   Who else has a law?
woman,Everyone has to learn how to read.
the postman,That's law two. Who else?!
luke,Four.    No more tattoos.
the postman,"How about it, Ford Lincoln Mercury? You give us law eight."
the postman," Be a leader, Ford."
ford,Law eight...
ford,... Live and let live.
bethlehem,"Would I had bestowed that time in the tongues that I have in fencing, dancing and bear-baiting. Oh, had I but followed the arts..."
the postman,Grow like savages -- as soldiers will -- that nothing do but mediate on blood.
the postman,Somebody take a letter.
chubby,Huh?
the postman,A letter...
abby,Your daddy wrote to tell you that he'll be here as soon as he can. And that he loves you very much.
the postman,Mail's slow.   I'll have to see about that.
abby,Your daughter.     Her name is Hope.
hope,"But he never did see St. Rose. There was too much to be done. He'd made a promise and in keeping it -- he traded one dream for another. With no regrets. And so, in honor of my father..."
older man,That was me.
