Speaker,Dialogue
gabriel,"Oh man, this just isn't my day."
lucifer,Long time.
gabriel,"The world's young, man."
lucifer,And full of ambition.
gabriel,This isn't your war.
lucifer,But I remember the last one. Michael's war.
gabriel,You lost.
lucifer,But lots of angels were with me. every one followed their leader out of heaven.
gabriel,"Yeah yeah, I was there, remember?"
lucifer,"Except one. Oh, he was with me all right. He hated the Eagle Scout. Envied the power He gave to His Son. But this angel never came out front during the war. And when it ended he thought maybe, maybe the Eagle Scout didn't notice. So he laid low and towed the company line till he could start his own war. It was all just jealousy."
gabriel,You're dreaming.
lucifer,But maybe He did notice. Maybe that's why I'm here.
gabriel,-- Stay away from me.
lucifer,"You've always been a part of me, Gabriel. And now it's time to come home."
gabriel,Fuck you!
grey horse,The enemy spirit is gone.
daggett, Where?
daggett,More will come... To look for the soul...
katherine,And they won't find it. Not in Mary.
katherine,Can you help him?
villager,We have some bandages.
katherine,"Are you all right, pumpkin?"
mary,I'm okay.
katherine,It's going to be okay... We're all going to be okay...
katherine,I can't quite bring myself to say thank you.
lucifer,I understand.
katherine,Then this is done.
lucifer,Not necessarily. Maybe I like you. Maybe I want you to come with me.
lucifer,"You owe me, Katherine. And you're going to ask me to take you home."
katherine, No.
lucifer,You will. You will because any other way is going to be more awful than you can imagine.
katherine,Are you threatening me?
katherine,"Then you've picked the wrong person this time. I've just about had it up to here with ghosts. So you can put away the horror movie sneer and the K-Mart halloween eyes, because we know you now. We know you all. And if you want to force the issue then go ahead because you're just another angel to me. Take a look at your buddy Gabriel. Then ask yourself, do you really, really want to fuck with us?"
lucifer,Perhaps another time.
katherine,I'm holding my breath.
lucifer,"Goodbye, Katherine. For now."
mary,Is he coming back?
katherine,"I don't think so, honey... I don't think so..."
sheriff, Is he going to live?
deputy,With any luck.
sheriff, I thought I told you to give me a call if anything snarled.
daggett,There wasn't a phone.
sheriff,Hmmm.
sheriff,"This fella, Gabriel..."
daggett,Yeah.
sheriff,Gabriel what?
daggett,Just Gabriel.
sheriff,"Pretty violent guy, Gabriel. Even for out here."
daggett,Yeah.
sheriff,Caught up with him at the village?
daggett,He caught up with me.
sheriff,What were you doing way up here?
daggett,Enemy Ghost Way for Mary Tsosie.
sheriff,Indian stuff.
daggett,Yeah. Indian stuff.
sheriff,Did you kill this Gabriel?
daggett,Maybe. I think so.
sheriff,Don't have any idea where the body is I suppose.
daggett,No.
sheriff,"Well, if he's alive he won't get far out there. Us or the coyotes, it'll be the same.  I rang your office in LA. They don't have a warrant out for a Gabriel. Or anybody else in Arizona."
daggett,I hadn't gotten around to it.
sheriff,Sort of an out of pocket thing.
daggett,Yes.
sheriff,"That woman lying at the bottom of the arroyo, the one still in her hospital gown, know anything about that?"
daggett,No.
sheriff,Really.
daggett,Really.
sheriff,This Gabriel was sure one busy dude.
daggett,"Yes, he was."
sheriff,You'll be going back to Los Angeles now?
daggett,Yeah.
sheriff,Don't hurry back.
deputy,Don't do much but breathe the next few days. And get to a hospital. You're going to need some serious stitches.
daggett,Thanks.
deputy,Say hi to Hollywood for me.
mary,You look bad.
daggett,Thank you. I feel worse.  They lean on you much?
katherine,Not really. I think they might have even understood. One of them's related to this clan. He'll give us a ride back if we want.
daggett,Good. I think I've about run out of hospitality with the sheriff's department.
katherine,Do you think it's really over?
daggett,Till we die.
katherine,"When I die, I want you with me."
daggett,I want that too.
