Speaker,Dialogue
merlin,"DROP 'EM! DROP, DROP, DROP!!!"
rudy, DROP THE GUNS! NOW!
merlin,"Hold it right there, Nick. Your squirt gun's all you need."
merlin,Cover 'em.
rudy,"Sorry, guys. But what the hell were you doing here an Christmas Eve anyway."
jack bangs,No... not here... please... mister...
jack bangs,"Mister. I'm begging, 'kay? I'm begging. This is not some card club, 'kay? This is the Tomahawk. We're an international gaming destination. We're in guidebooks. You can't do this... you can't do this to me..."
gabriel,Show's over.
rudy,"Get down and stay down, and you're gonna be fine. Just don't do anything. My friends are disturbed --"
pug,What's the security code to the Count Room?
pug,NICK SAID SECURITY CODE!
merlin,You said no GUNS in there! NO GUNS!
firemen,DROP IT! DROP THE GUNS!
ashley," WHERE'S THE FUCKING CASH, NICK!"
rudy,Yeah. That's love.
ashley,"MOVE, MOVE, MOVE!"
merlin,You knew there were guns in here!
rudy,"Merlin, I didn't know --"
merlin,You got Pug killed! You tried to get ME killed! You just lost your Get- Outta-Jail-Free --
rudy,"I promise you, I didn't know!"
jack bangs,I can't go back to Vegas... I can't... go back...
gabriel,"I told you not to fuck us with that map, Nick. I told you not to, and you did. How am I s'posed to keep my promises now?  How's she s'posed to keep hers?"
gabriel,He won't tell us where it is. The Powwow Safe.
jack bangs,I don't know... what you're...
gabriel,THE POWWOW SAFE! WHERE IS THE POWWOW SAFE!
jack bangs,What... Powwow...
gabriel,The Powwow Safe where you steal your money! Where you cheat your Indians!
jack bangs,I don't steal any --
gabriel,We KNOW about the Powwow Safe! We KNOW it's in here! We KNOW how you work! Because WE know who's worked for you!  Remember a guy named Nick Mason!?  A security guard named Nick Mason!?
jack bangs,Nick... Mason... ?
jack bangs,...so where is he?
gabriel, Where is he?! Where is he?!
jack bangs,He's not Nick Mason...
jack bangs,Nick Mason... worked for me two years ago. This man...  ...he's some cowboy...
rudy,"Fucked the wrong guy, Ashley.  Story of your life."
rudy,"I did time with Nick Mason, Monster. Told you that from the start."
ashley,You... you... YOU --
rudy,We still gonna spend Christmas together?
gabriel,"You are lucky, convict. You're spending Christmas with the birthday boy himself --"
rudy,Hey! HEY! THERE IS A POWWOW SAFE!
rudy,"I did time with Nick Mason, remember? I knew he worked here, didn't I!? Well, some shit he told me!"
rudy,"Nick told me his manager kept a safe in his office, his stealing safe. His Powwow Safe. I swear, please... Nick told me.  Behind the liquor cabinet."
gabriel,Open it.
jack bangs,I can't go back to Vegas...
gabriel,OPEN IT!!!
rudy, Pow. Wow.
jack bangs,VEEEEGGGGAAAASSSS!!!
jack bangs,I CAN'T! GO BACK! I CAN'T! GO BACK! I CAN'T! GO BACK!
gabriel,GO!!!
merlin,Hell. I'm gonna take pleasure in this...
rudy,Me too.
rudy,Smoke 'em if you got 'em.
rudy,I'm sorry.
jack bangs,That's why they call it gambling.
ashley,Your turn.
gabriel,With the wrong fucking guy! We took the place down with the wrong fucking guy! Is that Christmas?! Huh?! Is that Christmas?!
gabriel,God bless us every one...
gabriel,"You almost got away with it, Santa. Got outta the Tomahawk, got to your car, got halfway to Canada till you caught some ice in the road. By the time you hit bottom down there, whole car was burning like a comet.  Musta burned up all that money too."
gabriel,"Buncha guys in red suits busted in, they'll say. Started shooting. They won't be able to remember... if it was three, or four... or five. Four dead Santas and some burned-up cash. Merry Christmas, The End."
rudy,"Was it your plan, Monster? Or was it hers."
gabriel,She told me 'bout the convict magazines. Had to figure there'd be some boys in the pen with some useful knowledge. With nobody to talk to. Nobody to listen. So we stocked up on stationery.
gabriel,Hard life being a trucker's girl.
rudy,I saved your life.
ashley,You shouldn't have.
rudy,"He did love you, you know. Nick. He did love you."
ashley,Who wouldn't.
rudy,"Maybe this is where you wanted him, Ashley. At the bottom of a ravine, dead as ice with a burnt-up heart. Maybe. But it didn't happen. 'Cause what you did for him was make him the happiest held ever been. You showed him hope and taught him mercy. And he died a peaceful man. You wanted to destroy some convict... and all you did was save his soul. Remember that. Love your money and remember that."
ashley,"Merry Christmas, Rudy."
rudy,I'm glad it was me.
ashley,Merry Christmas.
gabriel,Get in the car.
gabriel,Get in the CAR!
rudy,How'd you know my name...
ashley,What?
rudy,Rudy. How'd you know my name?
ashley,What are you talking about?
rudy,"You said Merry Christmas, Rudy."
ashley,"I... you told me your name was Rudy. You told me a million times, back in the truck, telling me you weren't Nick --"
rudy,No --
ashley,You were screaming you weren't Nick! And we just didn't fucking believe you!
rudy,But I never said Rudy.
ashley,You said it a million times!
rudy,I never told you my name.
gabriel,Ash?
rudy,How'd you know my name was Rudy.
gabriel,Ash?
rudy,How'd you know my name.
ashley,Men.
rudy,Where is he.
nick,"Merry Christmas, Rudy."
nick,"I missed you, beautiful."
ashley,"I missed you too, Nicky baby."
ashley,For your information. I never fuck the wrong guy.
nick,"Oh, hey. Have you two been properly introduced? Sweetness, this is Rudy Duncan, I did almost a year with him in the Mountain. Read him all your letters, talked about you all the time, made him feel like he really knew you.  My friend... wantcha to meet Millie Bobek. 'Member Millie Bobek, dontcha? My girlfriend fore I went in? Worked at that bar in Motor City, where I manslaughtered that guy? Hell. Didn't talk about her much once the Ashley letters started coming, I guess."
nick,"Millie here used to serve drinks to these gunrunning truckers, real big talkers, talking bout a real score one day. I was in the Mountain, man, what the hell, why not let her get friendly with 'em? Let her tell 'em an idea she had, 'bout writing guys in prison. Getting one who could show 'em a sure thing."
rudy,She set them up. All of them.
nick,Why not have her pretend to find me? Pretend to write me and reel me in? Tell her new trucker-man she'd pose as some sister of his named Ashley?
rudy,And you set me up.
nick,"Always wanted to rob that casino, Rudy. Way back when I worked there. What better way than to get some guys to rob it for me."
nick,"Paid the Alamo ten bucks to put the shiv in me. He's a lifer, what does he care. Paid a hospital guard fifty to put out the story I was dead. Once the wound healed up...  Got out of the Mountain this morning. And tonight I'm a rich man."
rudy,How'd you know I'd do it.
nick,Do what?
rudy,Walk outta there and tell her I was you.
nick,"Because every time I read her letters, Rudy... you listened.  Keep your gun on him."
nick,"Five Santas walked into that Tomahawk, Rudy. That's what the witnesses'll say. So we gotta have five Santas not walk out. Gotta have five...  This'll burn right away... in the fire..."
nick,"Hell, you never needed to convince Ashley you were me. Just the dumb fucking truckers. I figured I'd talked enough about the Tomahawk in the pen for you to get by --"
rudy,"Talked about the old man's weapons stash, probably forgot I'd remember"
nick,"Hm. Well. They'd have killed you if you weren't me, Rudy. We knew you'd start convincing 'em soon enough."
nick,They had the weapons and the willpower. We just gave them their inside man.
rudy,You gave them me.
nick,"I gave them me.  Said some nice things about me, Rudy. I appreciate it. But don't worry. I do love her. And she loves me. You had that right all along."
nick,Sweetness! Let's light up the tree!
nick,"Goodbye, Rudy! Nice spending time with you!"
rudy,"LIKE RIDING A BIKE, LIKE RIDING A BIKE, LIKE RIDING A BIIIIIKE!"
rudy,RULE ONE! NEVER PUT A CAR THIEF BEHIND THE WHEEL!
ashley,NOOOOOOO!!!
rudy,RULE TWO!
nick,...Rudy... help me... Rudy...
mother,Rudy...? Rudy?
father,Son? Is... is that you...?
