Speaker,Dialogue
frank,Give yourself over to absolutely pleasure Swim the warm waters of sins of the flesh Erotic nightmares Beyond any measure And sensual daydreams To treasure forever.
all,Don't dream it.  Be it.
brad,It's beyond me Help me Mo-ommy.
janet,God bless Lilly Saint Cyr.
frank,My my my my I'm a wild and an untamed thing. I'm a bee with a deadly sting. Get a hit and your mind goes ping. Your heart'll thump and your blood will sing. So let the party and the sounds rock on. Gonna shake it till the life has gone.
all,I'm a wild and an untamed thing I'm a bee with a deadly sting. Get a hit and your mind goes ping Your heart'll thump and your blood will sing.
riff raff,Frank N. Furter It's all over Your mission is a failure.
frank,Wait!  I can explain.
frank,On the day I went away.
guests,Goodbye
frank,Was all I had to say
guests,Now I
frank,Want to come again and stay
guests,"Oh my, my,"
frank,Smile and that will mean I may
frank,I've seen blue skies Through the tears in my eyes And I realise I'm going home I'm going home
guests,Feeling
frank,Like I'm outside in the rain
guests,Wheeling
frank,Free to try and find a game
guests,Dealing
frank,"Cards for sorrow, Cards for pain."
magenta,How sentimental.
riff raff,"And also presumptuous of you.  You see when I said ""we"" were to return to Transylvania, I referred only to Magenta and myself."
riff raff,"You see, you are to remain here, in spirit anyway."
dr scott,"Great Heavens, that's a laser."
riff raff,"Yes, Dr Scott.  A laser capable of emitting a beam of pure anti-matter."
brad,You mean you're going to kill him? What's his crime?
dr scott,You saw what became of Eddie. Society must be protected.
riff raff,"Exactly, Dr Scott.  Now Frank N. Furter, your time has come.  Say goodbye to all this and hello to oblivion."
frank,Do your worse - inferior one.
brad,Good God.
riff raff,Yes.
janet,You've killed them.
magenta,I thought you liked them.  They liked you.
riff raff,They didn't like me.  They never liked me.
dr scott, You did right.
riff raff,A decision had to be made.
dr scott, You're OK by me.
riff raff,Dr Scott I'm sorry about your nephew.
dr scott,"Yes, well perhaps it was for the best."
riff raff,You must leave now Dr Scott while it's still possible.  We are about to beam the entire house back to the planet of transexual in the galaxy of Transylvania. Go now.
riff raff,"Our noble mission is almost completed my most beautiful sister, soon we will return to the moon-drenched shores of our ""androgenous"" planet."
magenta,Ah - sweet Transexual - land of night - to sing and dance once more to your dark refrains.  To take that step to the right...
riff raff,But it's the pelvic thrust that really drives you insane.
magenta,And our World will do the Time Warp again.
brad,I've done a lot God knows I've tried To find the truth I've even lied But all I know is down inside.
janet, And super heroes Come to feast To taste the flesh Not yet deceased And al I know Is still the beast
trio,Is feeding.
narrator,"And crawling on the planet's face Some insects called the human race Lost in time, and lost in space And meaning."
voices off,Meaning.
voice over,Science Fiction - double-feature Frank has built and lost his creature Darkness has conquered Brad and Janet The servants gone to a distant planet Oh - at the late night double-feature Picture Show - I want to go - Ohh - To the late night double-feature picture show.
