Speaker,Dialogue
mills,"I'm going to kill you, Johnny.  I'm going to see you dead."
john doe,"The irony, David, is that you policemen and I want the same things.  But, you are so short sighted.  In this city, where you can see a deadly sin on every street corner... and in every home, we want repentance."
somerset," Let him go, God damn you."
john doe,"There were two men once, who had wonderful gardens.  Two gardens of flowers that went on as far as the eye could see.  Beautiful gardens... the fragrance was inspiration in itself."
mills,Fuck you!
john doe,The other man plowed his garden under.  He plowed it under the soil.  He started over.
somerset,"Alright... you don't have to do this, John.  You've already made your point."
john doe,Do you think I chose this?  Can you even begin to understand how painful my existence has been?  It's like... like having every sense heightened beyond comprehension.
somerset,You're insane.  That's why.
john doe, No!  You're wrong!
somerset,Don't do this!
john doe,I meant what I said.  I admire David Mills.  I envy David Mills.  Envy is my sin.
somerset,No!
captain,I don't know if I should do this.  We found the motel room Doe must have been staying in after you found his apartment.
somerset,I wish I could say something...  Something to... I don't know...
tracy,I'll be okay.
somerset,We'll keep in touch.  I'll come visit.
tracy,I'll write to you when we get there.
somerset,Take care of yourself.  Take care of the baby.
mover,"That's all, Mrs. Mills.  We got everything."
somerset,"Goodbye, Tracy."
tracy,"Goodbye, Somerset."
somerset, Oh... man...
