Speaker,Dialogue
waiter,"Otis Elwell wants to see you, Sidney."
elwell," Hey, wait a minute!"
sidney, I'm late for a date with a dame.
sidney,"Otis, if you're trying to blow this brawl into an item for your column - forget it!"
elwell, How is dear old J.J. by the way?
sidney, Call him up and ask - he might drop dead with shock.
elwell," If it were that easy, you wouldn't find an empty phone booth for the next two hours..."
elwell, ...Talk of a wake! - they'd club each other to cater the affair for free!
elwell, Why?
sidney,"You don't know that lunatic yet? Whims - egotistic whims!  Like the gag - when you got him for a friend, you don't need an enemy!  That's what the fight with Bartha was about. ""Leo"", I says, ""Hunsecker froze me out.  So I'm eating humble pie this month - please print me an item."""
elwell," And, instead, he printed his heel in your face?"
sidney, I see you're full of human feelings...
elwell," Like most of the human race, Sidney, I'm bored.  I'd go a mile for a chuckle..."
sidney, ...and two miles for a pretty girl...?
elwell, Three...even four...
elwell, Then you're really washed up with Hunsecker...?
sidney,This is how much I'm washed with J.J....
sidney,"Look, Otis, I make no brief for my bilious private life, but he's got the morals of a guinea pig and the scruples of a gangster."
elwell, Who's it about?
sidney,"A kid named Dallas, who runs a dinky jazz quintet.  He keeps company with J.J.'s screwball sister..."
sidney,"It's a real goody if, like me, you wanna clobber J.J.!"
sidney,He's got his TV tomorrow.  He'd read it just before rehearsals.
elwell, Mmm.  Trouble is I can't think of any good reason why I should print anything you give me.  I can't even think of a bad reason.
sidney," Suppose I introduce you to a lovely reason, Otis.  One that's good and bad...and available?"
elwell,I'm not an unreasonable man...
sidney,Waiter!  The check.
rita, Hi!
sidney," Rita, say hello to Otis Elwell."
rita, Hello.
elwell,Friends call me Otis - sometimes Tricky Otis.
sidney,"Otis was outraged when I told him Van Cleve was going to fire you. Tell him not to pay any attention to anything you-know-who says about you-know-what.  Right, Otis?"
elwell,Right!
sidney,I thought you two could talk the whole thing over till I got back.
rita,Back?
sidney,"One of those business meetings, honey - always coming up in the middle of the night."
rita, Hold on.  You can drop me off on your way...
elwell, Consternation reigns...
sidney," Now, Otis..."
elwell,I hate J.J. -- but not that much at this moment...
sidney,Give me a chance --
sidney,Don't you know who that man is?
rita, Yeah.  Otis Elwell.  The columnist.
sidney, Yeah!
rita, And he's a perfect stranger to me.
sidney, So take five minutes!  Get acquainted!  He's an important man - he's lonely - don't be dumb!
rita,What do you want all of a sudden - Lady Godiva...?  Where's my other shoe?
sidney,What kind of an act is this?
rita,Don't you think I have any feelings? What am I?  A bowl of fruit?  A tangerine that peels in a minute?
sidney," Here's your shoe, there's your coat, that's the door!"
rita,Sidney...I...I don't do this sort of thing...
sidney,What sort of thing?
rita, This sort of thing!
sidney, Didn't you ask me to do something about your job?  Don't you have a kid in Military School?
rita,"You're a snake, Falco.  You're a louse, a real louse."
sidney, Honey - he's going to help you! You want to lose your job?
rita, A girl needs a little romancing before she -
sidney, Next time I'll call in a guy to paint silver stars on the ceiling!
rita, What would you think of me if -
sidney, Nothing I didn't think of you before.
rita, - that's what I mean!
sidney, How many snorts does it take to put you in that Tropical Island Mood?
elwell, Havana!  That's where we met!
rita, Here's mud in your column!
sidney,"Blessings on thee, the both...well... Gotta run now.  See you two kids later!"
elwell, Hurry back.
sidney,Don't do anything I wouldn't do. That gives you lots of leeway.
rita,Palm Springs.  Two years ago.
elwell, That's right!
rita,Don't tell Sidney.
hunsecker, It's an item - I hear he goes out with three-eyed girls.
hunsecker,We shall see what we shall see...  And don't ever use this apartment phone again; I have a nervous sister.
news vendor,The Globe?
sidney, Gimme The Record.
mary," I have no power to retract, Mr. Cummings... I'm only Mr. Hunsecker's secretary.  No.  Nor can I agree that can retraction is necessary. Thank you for calling."
lawyer, I fail to see what's amusing about these papers.
mary,I'll get the boss to sign them.
lawyer, They're important.
mary,You've said that six times - that's why I'm smiling.
sidney,"Hello, Mary, me darlin' and phwat are ye up to today?"
mary,That's a question I usually like to ask YOU.  Your secretary phoned.
sidney,What about?
mary, Something about a Frank D'Angelo trying to reach you...
mary, Is that the man who manages Susie's boyfriend?
mary,"Have you seen this?  In Otis Elwell's column.  ""The dreamy marijuana smoke of a lad who heads a highbrow jazz quintet is giving an inelegant odor to that elegant East Side Club where he works.  That's no way for a card-holding Party Member to act. Moscow won't like, you naughty boy!"""
sidney," Sally?  I got the message.  If D'Angelo calls again, tell him I'll be at the office around noon."
mary,Could this be that boy?
sidney, Dallas?  Could be.  He doesn't look like a reefer smoker...
mary," If this is true, J.J.'s going to hit the ceiling..."
sidney,Can it be news to you that J.J.'s ceiling needs a plaster job every six weeks?
mary," Sidney, you know that J.J. doesn't like people to look at the column proof in advance..."
sidney,"Mary, I'm not ""people"" - there's Falco blood, sweat and tears in that column."
sidney,How about dinner tonight?
mary,Bribing me again?
sidney, And why should I bribe the woman who holds most of my heart?
mary,"You're a real rascal, Sidney.  I'd certainly dislike you if I didn't like you.  You're an amusing boy, but there isn't a drop of respect in you for anything alive - you're too immersed in the theology of making a fast buck.  Not that I don't sometimes feel that you yearn for something better..."
sidney," Mary, don't try to sell me the Brooklyn Bridge.  I happen to know it belongs to the Dodgers."
mary," I don't mind you looking at the proof of the column in advance, as long as J.J. doesn't know.  But don't do it like a boy stealing gum from a slot machine."
sidney,"Who put this item in about the comic?  ""If there's a more hilarious funny man around than Herbie Temple at the Palace, you'll have to pardon us for not catching the name.  We were too busy screaming."" Does this Temple have a press agent?"
mary,"No.  It's one of J.J.'s occasional beau gestes.  Evidently the fellow's funny, so he gave him a plug."
sidney,What's your favorite ribbon to go around your favorite chocolates?
mary,Let's wait till Christmas - it's more legitimate then.
doorman, Hey!
sidney,Herbit Temple here yet?
doorman,"Yeah, but you can't come in now!"
sidney,"I'm in, Sonny Boy!"
evans,"I didn't waste words, Herbie, take my word.  I says, ""look, Figo, I'm not selling you a dozen eggs, I'm selling you HERBIE TEMPLE"", I says, so don't gimme your lip!"
sidney,"Hiya, Al!"
evans,Since when did you two get acquainted?
sidney,"How do you do, Mr. Temple..."
evans, Delighted.
sidney,I'm Sidney Falco.
temple," Yeah, delighted..."
evans,"Watch this guy, Herbie, he's a press agent."
temple,"You watch him, Al, I s...s...stutter!"
sidney," Temple, I caught your act the other night and -"
temple,Did you now?  On which bounce?
sidney,- and I just had to drop by and tell you how great I thought you were.
temple," Cheers.  What time is it, Al?"
evans,"You got ten minutes.  Hope you don't mind, Falco: we're busy and if -"
sidney,"No, I don't mind.  I'm busy too."
temple," Good!  We're all off to Utica, so excuse me, Mr. Frannis-on-the- Portisan."
sidney,"But can I ask one impertinent question here?  With no criticism intended, because I know, Al, you earn your ten percent, how come you let a sock act like Herbie Temple tip-toe through town without a publicity build...?"
evans,"We're not buying it, Falco - no fish today."
sidney,"I'm not selling.  I'm just curious, that's all."
temple,"Answer the man, Al, if he asks you a question.  Quick, before he thinks up another!"
evans,Mr. Temple doesn't believe in press agents - does that answer you something?
sidney,"Take your hand off, lump!  No one believes in press agents, Temple, when they make claims they can't perform.  I got nothing to sell - I didn't come here to peddle - but if I tell a client that Hunsecker will give him space, it's not just talk!"
evans," Listen, you bull artist - !"
temple,"Let him go, Al..."
sidney," Hello?  Mary, let me speak to J.J., please...it's Sidney Falco..."
sidney, Tell him it's important...
gloria,What?  Is this Sidney?...
sidney," Sure, I'll wait..."
evans," Look, nobody hired you!  We didn't talk any deal, and -"
sidney,"Relax, lump!  I told you I'm not selling fish...  No, not a relative, but important..."
sidney,"Yeah, if you got a pencil there I'll suggest a word or two. Uh...uh..."
sidney," It's sweet of you, J.J., thanks. Probably see you at Twenty One tonight.  No, for supper, late. Right. 'Bye..."
temple,"Speak to this lad, Al, ... to Mr. Falco."
sidney,See me in my office.
temple,Wait a minute.  Al makes all my deals.
sidney," Temple, you've been three passes behind for twenty years.  This could start you off big - T.V. and anywhere."
temple,"And it would cost a pretty penny, huh?"
sidney," You tell him, I stutter!"
evans, Uh...Why don't we wait till tomorrow?
sidney, Wait as long as you like - you know where my office is.
sidney," What is here, a wake?"
steve,"You read as you run, don't you?"
sidney,It's a habit with me.  So now I'm briefed.  So what?
steve, Frank thinks I shouldn't have come here -
steve, I thought you might have a faint idea of how this item originated.
sidney,Why me...?
steve,Why not you?
sidney,"That's your idea of logic?  I tell the Judge I didn't murder the man - the Judge says, ""Why not you?"""
steve,Only two men in this town could be responsible for that smear - you or Hunsecker or both.
sidney," Dallas, ask your own manager - he's standing here like a pained wolfhound - Hunsecker and Elwell are enemies to the knife.  So how do you get him doing J.J. a favor?"
steve," It is a favor, isn't it?"
sidney," Dallas, your mouth is as big as a basket and twice as empty!  I don't like you, comma, but neither do I go along with this column saying you smoke marijuana and belong with the Reds.  Also, since we're talking repulsive, J.J. won't like this for two cents!  Don't give me that look, Dallas - J.J. believes in fair play.  And secondly, this could splatter his sister with rotten egg by implication - your her boyfriend!"
steve,You're talking very fast.
sidney, How do you like it?  He comes to my office and -
steve," Don't apologize for me, Frank!"
sidney, Should I cry...?
sidney,"Then what are you doing here?  Go over there and fight!  If Van Cleve fires your boy, it gives a lie the ring of truth!"
steve,"I want to speak to Miss Hunsecker, please."
sidney, What are you calling her for...?
steve," This is Steve, Susie.  Don't be alarmed, Susie, but I want you to look at Elwell's column in The Record...today...No, about me..."
susan,A smear?...What...What kind of smear...?  Where are you?
steve," We're on our way to the Elysian Room to dicker with Van Cleve - he's fired us already.  I'll call you later, dear... 'Bye!..."
steve,"Come on, Frank."
sidney, What are you looking at...?
sidney, Tell him.
sidney,What's the matter?
sally, Nothing...
sidney,"You know, Sally, sometimes I get the impression you think you live in Star-Bright Park.  This is life, kid - get used to it!"
sidney," Nikko, is Mr. Hunsecker there? This is Mr. Falco.  Well, have him call me as soon as he can.  It's important."
sidney,Did you send my folks in Philly the check...?
sally,Yes.
sidney," I put a lotta trust in you, Chickie..."
sally," I know you do, Sidney."
sidney,Don't judge a situation where you don't know what's involved...
sally,I'm not judging...
sally," I swear, Sidney, I can't help it - sometimes I wonder what I see in you..."
sidney, That's no way to talk...
sally,"Or what you see in me, for that matter..."
sidney,"Stay down town tonight.  Maybe we'll take in a show, etc."
sally,If you want me to -
sidney, You see?  Hunsecker's gotta phone ME!
sidney," No, no medals - not yet.  Oh, it's worse than that - Aunty Van Cleve is firing them...from the horse's mouth... They were just here - in a panic..."
hunsecker,Who was just there?  You'll be the death of me.  Sidalee! Why?  Didn't you just tell me that they've already traced this smear to you?  All they have to do now is to put two and two together and I'm a chicken in a pot!
sidney,"J.J., peace on earth, good will to men - it's working out just the way I planned.  Yeah, I guarantee this bomb will pop right on schedule, but you have to play your part - you be a Saint and let me be the Devil.  But I wanna talk to you first..."
hunsecker,Don't come here.  Susie is up and about.  He called her?  You'd better see me at the TV - three o'clock.
sally,What are you going to do?
sidney," Chickie, a lotta people think they're smart.  You watch.  They're dumb: they'll do the work for me! Just watch."
hunsecker,The table can wait.  No calls.  I have to think about my TV show.
nikko,Pleased to do.  I will come back later. HUNSECKER  Did you put the bread out on the terrace for the birds?
nikko,"Yes, but they don't come no more this time of year."
hunsecker,"Susie!  Come in a minute, dear..."
hunsecker,"Susie, you're very much in my thoughts today."
susan,Why?
hunsecker,"What a question, dear, with that newspaper in your hand..."
susan, Did Sidney tell you about it?
hunsecker,"Yes, he phoned.  I don't know this boy too well.  Anything in these charges?"
hunsecker,"Not being partial, are you?"
susan," No, I'm not.  I'm not!"
hunsecker,"Susie, take it easy.  I'll trust your judgment - you don't have to protest with me."
hunsecker,"Why are you trembling, dear...?"
susan,History repeats itself.  Everything that happened to Alan Leslie...began with a smear like this...
hunsecker,Yes...
susan, It's just as if I've seen a ghost today...
hunsecker," But that wasn't your fault, dear, what happened to Leslie.  I've told you that a million times..."
susan,"Then whose fault was it, J.J.?  It was someone's fault, wasn't it?"
hunsecker, I wouldn't have called the boy exactly balanced...
susan," I'm not fighting with you, puss..."
susan,He never would have killed himself if I hadn't gone through with the annulment.  Don't you see that made all the rumors seem true?  I should have stood up for him...not run out.
sidney,"J.J., I want you to get them back their job, Steve and the Quintet."
hunsecker," You mean they've been fired already, on the basis of this crude smear?"
hunsecker,"Susie, you're sure there isn't some fire where there's this much smoke?"
sidney, I know Steve.  No.
hunsecker,"Then maybe you can tell me if he's as solid as you say, why does he rap me every chance he gets?"
susan, Sidney is a liar!
hunsecker,Who said Sidney?
susan, I said Sidney!...
hunsecker,"You know, dear, we're drifting apart, you and I, and I don't like that."
susan,I thought we were talking about Sidney?
hunsecker," Let me finish, dear.  You had your say, now let me have mine..."
susan," I haven't said anything yet, J.J., but if -"
hunsecker," I started to say we're drifting apart.  A year ago, in your wildest dreams, would you have walked by that door without taking up this situation with me?  Today I had to call you in!"
susan,I'm taking up the situation with you now...
hunsecker," Susie, I want to help you--, there's nothing I won't do for you. You're all I've got in the whole, wide world."
hunsecker," Well, what have I got?  Alimony to a pair of tramps?  They're of no concern to me.  It's you who count, but don't get me wrong - I don't intend to let you break your neck again!"
sidney,"J.J., you said you want to help me - prove it!"
hunsecker, How?
sidney,Get Steve back his job...please...
hunsecker, He means that much to you...?
sidney," With your ""prestige"" it only takes a minute - ten cents worth of American Tel and Tel."
hunsecker,"You're picking up my lingo, hon."
sidney, I read your column every day...
hunsecker,"Susie, I like this new attitude of yours.  You're growing up and I like it!  I don't like it when you're limp and dependent, when you're odd and wayward.  This gives you a chance for real survival in a very lousy world.  Because, don't forget, dear, you won't always have me with you, will you...?"
sidney,"No, I won't..."
hunsecker,"This Dallas boy must be good for you.  Why not bring him around today, before the show?  This time I'll clean my glasses for a better look."
sidney,I'm not sure I can reach him in time.
hunsecker," By the way, what's your beef against little Sidney?"
susan," When I'm certain, I'll let you know..."
hunsecker,"A man couldn't ask for a squarer shake.  No, don't explain your point of view, but..."
hunsecker,"""I was reminded of it this morning, when I noticed that the birds had gone South.  We want the same kind of freedom for ourselves - that's what the man said!  A man has the right to face his accusers!  That's the American Way! Who said?  The man said!  From..."""
hunsecker,"Burton, don't stand around.  If I go over I'll cut some items off the tail..."
hunsecker,"""From Washington through to Jefferson, from Lincoln and F.D.R. right up to today - the Democratic Way of Life!  That's what the man said!  Nowadays it doesn't export to well...  Let's never forget it, ladies and gentlemen."""
mildred tam,"That's grand, just grand, J.J.!  Is my makeup all right?  You know, despite the scads of movies I've made, I've never appeared on TV yet..."
hunsecker," Mary, help Miss Tam - anything she wants; she's our star today."
hunsecker,I got that boy coming over here.  What's so funny?
sidney, With a pocket fulla firecrackers - good.
hunsecker," I think you loused this up but good. If I can trust my eyes, and I think I can, Susie knows all about your dirty work."
sidney, Can't hurt...
hunsecker, Can't hurt?  I had to get him back his job.
sidney," Look, J.J., we can wrap this up in one neat bundle, addressed to the dumps - to oblivion.  We're going great, but please play it my way. I cased this kid. Know his ins and outs...He's fulla juice and vinegar, just begging for some big shot like you to give him a squeeze.  Do little Sidney a favor: squeeze! - You know, J.J. - the porcupine bit - needles."
hunsecker,But it's too late.  I got him back the job...
sidney," No, that's the point - he won't accept your favor!  The manager yes, but not the boy."
hunsecker,"Well he's got her in a tizzy, I'll tell you that!"
sidney,"Sure, he steams her up - wants her to stand on her own two feet and all that jazz!"
hunsecker,And who's feet is she on now?
sidney,Presumably yours...  That's according to St. Dallas.
hunsecker,What's this boy got that Susie likes?
sidney,"Integrity - acute, like indigestion."
hunsecker,What does that mean - integrity?
sidney," It's a new wrinkle to tell the truth... I never thought I'd make a killing on some guy's ""integrity""."
hunsecker,"Full of beans, ain't you?  But you know that you'll stand or fall by what you're doing now..."
sidney," Calculated risk.  Only we happen to know, J.J., that you like me.  I'm your star pupil -- I reflect back to you your own talent."
hunsecker,I wouldn't like to take a bite of you; you're a cookie full of arsenic.
steve, I still think he's responsible for the smear.
steve,"I guess you're right, but -"
susan," Steve, before we go in - I'd like to..."
sidney,"Hey, Susie - This is a real surprise -- not one but three. J.J.'s just finishing up his rehearsal."
hunsecker,Looks like a wedding.
susan,"Steve, you remember my brother..."
hunsecker,"Well, son, looks like you went out and bought yourself a packet of trouble..."
steve,"You've been very kind about it, Mr. Hunsecker. HUNSECKER Give Susie credit for that.  I took her word that there was nothing to the smear.  Matter of fact, I'll have my say about smears on the show today.  That's why I'd like YOUR personal assurance, too."
steve," Mr. Hunsecker, there's nothing to that smear.  You have my sincere word..."
hunsecker, Be good to my kid sister...
sidney," Yeah, she's had a peck of trouble for a kid..."
hunsecker,"Susie likes to keep her girlish secrets.  But in her heart of hearts I imagine, Dallas, that she fancies you in an uncommon way. Now, what about YOU, son?  Not just tom-catting around...I hope?"
susan," J.J., Steve isn't..."
hunsecker,"Take it easy, Susie.  He wouldn't be much of a man if he didn't understand my concern.  Would you, son?"
steve," No, I wouldn't..."
hunsecker," Serious as a deacon...I like it.  I like your style, son!  In a world of old rags and bones, I like it! For instance, take Sidney."
hunsecker, Don't amplify.
sidney," Frank, you don't listen!  J.J. just told you to shut your mouth!"
steve, Don't you think it's about time you shut yours?  Who are you to tell a man like Frank D'Angelo to shut up?!
steve,Does he have to be here in our hair?
hunsecker,"Why, has he bothered you before?"
steve,Is it news to you?
hunsecker,"Son, lots of people tell me I'm a gifted man, but I still can't see around corners."
hunsecker," I mean, I know it's a difficult thing to be an artist in this crudest of possible worlds, but --"
steve," Nuts!  I'm not here as an artist! I'm here as an average Joe, who happens to love your sister Susie!"
hunsecker," Well, just be careful you don't knock her down, huh?"
hunsecker," Frankly, son, you lost me on that last hill.  Just give us the punch line..."
steve, No punch line.  Maybe I was just admiring your know-how---yours and Falco's.
hunsecker,Why do you keep coupling me with Falco?
steve," He's here, isn't he?  Do you think, sir, when he dies he'll go to the dog and cat heaven?"
sidney,"Let's forget cats and dogs and other pseudo-literary remarks--- I'll just lay it on the line!  What about that big rumpus in my office today?  You were there, Frank! Where, according to St. Dallas, J.J. was responsible for the Elwell smear!"
hunsecker,"Don't go wild, Sidney."
sidney,Wild?  Take a look at them and see who's wild...
hunsecker,What about that...?
hunsecker, How did you mean it...?
hunsecker,"Both of you keep quiet!  Come on, let's go!  Let's go!..."
steve,"I don't take kindly to you and Falco selling me ethics.  Who's the injured party here, you?"
hunsecker, Right now you're in no position to ask questions!  And your snide remarks---
steve," Wait a minute, I haven't handed over punishing privileges to you YET!  Put the whip down and I might respect what you're saying..."
hunsecker,"Susie, did you know about this accusation...?"
susan, No...
hunsecker, Or will I be hearing next that I don't even have my sister's welfare at heart...
steve,"Mr. Hunsecker, you've got more twists than a barrel of pretzels."
hunsecker, Continue please...
steve, I'm afraid I can't cope with them.
sidney,Give him credit---the boy's gall is gorgeous!
steve,Why don't we hear what Susie has to say?
hunsecker," That's stout of you, Dallas, but Susie may not care to air her dismal views in public..."
steve,Susie...?
hunsecker,"Susie, as always, is free to say anything she thinks.  Go on, dear, say exactly what's on your mind, dear."
steve,"Those ""dears"" sound like daggers. May I suggest that you stop DARING her to speak?"
hunsecker,May I lift my eyebrows?  What is this?  What are you trying to do?
steve, I'm trying to get Susie to stand up to you.  But your manner is so threatening that she's afraid to speak!
hunsecker,"Son, you raise your voice again and you'll be outa here on your golden pratt!"
susan,"Steve, if only for my sake, I want this stopped!  And the same goes for you, too, J.J.!"
hunsecker," Susie, I'm sorry if---"
susan, Sometimes I think ALL men are fools!...
hunsecker,"You see, Dallas, a plague on both our houses...  We may have to call this game on account of darkness..."
hunsecker,"If looks could kill, I'm dead..."
steve," No, I don't care about you -- you're fantastic.  My whole interest, if it's not too late, is in Susie...and how to undo what you've done to her..."
hunsecker," And what have I done to her, besides not buy her a new fur coat lately?  Sidney, you were right -- the boy's a dilly."
steve," Why?  Because I don't like the way you toy with human lives? - Your contempt and malice?  Because I won't be the accomplice of your sick ego - and the way it's crippled Susie...?  You think of yourself - you and your column - you see yourself as a national glory...but to me, and thousands of others like me, you and your slimy scandal, your phony patriotics - to me, Mr. Hunsecker, you are a national disgrace!"
hunsecker," Son, I don't fancy shooting mosquitoes with elephant guns.  So suppose you just shuffle along and call it a day..."
steve,But my day with Susie isn't over yet and--
hunsecker, Ten'll get you fifty you're playing hookey from a padded cell!
sidney," You did it, J.J., you did it good..."
hunsecker," You in a mood, Susie, to run over to Milgrim's later and buy a few new frocks?"
susan, No.  I'm going home.
hunsecker,Want Sidney to drive you over?
hunsecker,Drive Susie home.
hunsecker,Susie...I...I'd have to take it very much amiss if you ever saw that boy again.
susan, I'll never see him again.
hunsecker,Call Van Cleve.  Tell him he was right.  Tell him I said the Dallas boys are not worthy of his club.
hunsecker, Mary...for Susie's own good...don't give her misplaced sympathy...
sidney,I'll get you a cab...
susan, Get away from me.
sidney,J.J. asked me to drive you over and -
susan,I told you to leave!  I don't know if Steve'll ever talk to me again and I'm ready to blame it all on you!
