Speaker,Dialogue
sidney,Susie...!
hunsecker,"So that's what ""integrity"" looks like.  Well, I'm always willing to learn...  How is that slob, D'Angelo, your uncle?"
sidney,"My mother's side--her brother. That reminds me, J.J., Susie looks run down.  She can stand a vacation and so can you.  People say, ""Oh, the great J.J., he's made of iron!"", but you can use a rest, guy."
hunsecker,"What are you so chipper about?  If I put a cross on every one of your mistakes, you'd look like a graveyard!"
sidney, But not for anything I did today...
hunsecker,"Sidney, I know human nature.  Susie lied to me - she'll see that boy again."
sidney,"You're right, J.J. - she won't give him up, but it doesn't matter. Because the real ""money ball"" is the boy, not Susan.  And if --"
hunsecker,These drinks are warm.
waiter,You said you like to have them on your table.
hunsecker,What are you a critic?
waiter,I'll change --
hunsecker,Forget it.  The real money ball is the boy...
sidney,"Yeah, the boy...we're on the verge of a farce, a real farce.  As I see it, if Susie had stood behind him today he might have proved a threat. But since primarily he's wedded to his work, he's not going to be able to take it."
hunsecker," Stop tinkering, pal - that horse radish won't jump a fence!"
sidney,"In brief, J.J., it's all over because any hour now the boy will give her up.  Is it a farce or not?"
hunsecker,"This syrup you're giving out, Sidney, you pour over waffles, not J.J. Hunsecker!  What do you mean that lousy kid will give up my sister?"
hunsecker,Are you listening?
sidney," How does it matter who's sister? The main thing, they're through and -"
hunsecker,Am I supposed to forget how that boy talked to me today?
sidney,"J.J., is he worthy of a second glance from a man like you?  Is he, I mean?..."
hunsecker,"Brief epitaph: ""The boy was talking when he should have been listening.""  Bite on this."
sidney,"Steamship tickets? HUNSECKER  For the next sailing of the Mary. Susan's run down - she's never been abroad and as you so cogently put it, I'm not made of iron."
sidney,That's good.  Now that louse is outa Susie's hair for good.
hunsecker,I want that boy taken apart.
sidney, Why do something that would drive them right back into each other's arms?  Not to mention that this time Susie would know who shot the arrow...
hunsecker, She knows now.
sidney," Why give her real proof?  You nearly ruined her with her first husband - and you were right, J.J., - but she almost followed him out the window.  What do you want - a chronic invalid?"
hunsecker,"I know how to handle Susie.  You just handle the boy, Sidney... "
sidney,"Why, what's tomorrow - a holiday?"
sidney,I think I'll go home - maybe I left my sense of humor in another suit.
hunsecker,"You've got that God-given brain - learn to use it!  Do you think it's a personal matter with me, this boy? Are you telling me I see things in terms of personal pique?  Don't you see that today that boy wiped his feet on the choice, on the predilections of sixty million men and women of the greatest country in the world!  If you had any morals yourself, you would understand the immorality of that boy's stand today!  It was not me he criticized - it was my readers!..."
sidney,"I'm leaving, J.J...."
hunsecker," Don't remove the gangplank, Sidney; you may wanna get back on board."
hunsecker,This crab gumbo - terrific!
sidney,"J.J., it's one thing to wear your dog collar...but when it gets to be a noose...I'd rather have my freedom."
hunsecker,The man in jail is always for freedom.
sidney," Except, if you'll excuse me, I'm not in jail."
hunsecker," Sure you're in jail, Sidney. You're a prisoner of your own fears, of your own greed and ambition; you're in jail."
sidney,J.J.  If you're trying to -
hunsecker," You, little boy, don't know who you are!  Talking around corners with the big shots, ten dollar dinners - fourteen suits and cashmere coats - you tell yourself THAT'S who you are!  Later you won't know who you are without a penthouse on upper Park!  But underneath it all, ratting around from day to day, you DO know who you are!  You're a fearful, ignorant nobody - a poor wop kid from the slums of Philly - hoping nobody else finds it out!"
sidney,A little hunch occurs to me - you have just painted a self-portrait. You know who YOU are because you scare people - that's what you've got against this boy.  He -
hunsecker, I told you what I want you to do tonight!
sidney,"You're blind, Mr. Magoo.  This is a crossroads for me.  I won't get Kello.  Not for a life-time pass to the Polo Grounds.  Not if you serve me Ingrid Bergman on a plate."
hunsecker," Sidney, I told you -"
sidney, If you gave me your COLUMN I wouldn't do a thing like that...
hunsecker, And who do you think writes the column while Susie and I are away for three months?...
hunsecker," Thank you, Sidney."
hunsecker,"And, Sidney, I'll have that piece of paper back..."
steve,She'll be down in a minute.
steve,She didn't say.
steve, I doubt that it matters any more.
susan," Good evening, Mr. D'Angelo."
susan,"Hello, Steve.  I'm glad you could come."
steve,Why did you call me?
susan,Would you buy me a cup of coffee? In there...
steve,Sure.
steve,We're on our way to Robard's for a benefit.  I've only got five minutes...
counterman,Too late for service.
steve,Just two cups of java.
counterman, We serve here only moka coffee.
steve, Make it moke.
susan,"Steve...what you tried to do today...you tried to take me up on a high mountain...I couldn't go all the way...I failed you...  Have I lost you, Steve?  Have I...?"
steve,"Well, maybe I was wrong, too... But there's no doubt, Susie, that we have to face some serious things..."
susan,No one's ever stood up to my brother the way you did.
steve," But you didn't do much about it, Susie.  You walked out, and there I was...solo...and not too good at that."
susan,"I just didn't think that I could antagonize him, Steve -- for OUR sake, I mean."
steve,"Susie, I was there for OUR sake, too.  But what a world it would be if we were all afraid to learn to walk and talk because it might offend poppa!  By the way, I think your brother was completely responsible for the smears..."
susan,"Steve, I..."
steve," But I don't care about that now. He knew what he was doing today. He was laying down the conditions under which he MIGHT consent to our marriage - if I would bend to every whim of his, like Sidney!  I couldn't do that, Susie..."
susan,"You're saying goodbye, aren't you?"
steve,No!  I'm saying that for your sake you have to make a clean break with your brother!
susan," But, please, Steve, please - one step at a time!  I was born only yesterday!..."
steve," I told your brother I couldn't be his accomplice.  I can't be yours either, Susie, and encourage him to go on pulverizing you.  I know what type - he's my old man all over again!"
steve,This beautiful coat is more than just a coat... I hate it!  It's a mink straight-jacket!
susan," Steve, I feel exhausted...what do you want me to do?"
steve, Not what you're doing now.  At least don't ask me - don't ask him. You're fighting for your life! What do YOU want to do?
susan," You are saying goodbye, aren't you...?"
steve," That's fish four days old...!  I can't buy it, Susie!  Right out of that mouth I love, like you're a ventriloquist's dummy, your BROTHER is saying goodbye!  Gee!...you want me to be honest, don't you?!"
susan,"No, Steve, I don't.  I don't.  Not if it KILLS me I don't!..."
susan, Let's not talk any more...you have to go...
susan,"Goodbye, Mr. D'Angelo.  Take care of Steve."
susan,Say something funny...Mr. Hasenfeffer.
steve," Look back, Frank, see if she's still standing there..."
steve,"Frank, I don't want to make the benefit.  They'll be jammin' all night, and the way I feel -- I'd like to be alone -- I'd like just to walk and walk and never come back."
robard, I'm sorry to hear it.
robard,"I like that boy, Frank.  Anything he does is okay with me..."
kello,What's all the rush?  You said three o'clock.
sidney," He's leaving early.  After this ""set"".  He'll be out in a couple of minutes..."
murph," One of the lieutenant's ""surprise parties"", I think."
sidney,"Can't you wait up the block?  It's not going to look so good, right in front of the club..."
kello," It's nice, Sidney, that you give me this tip..."
sidney, - He's got them on him.
kello, ...And he's got them on him.  I appreciate a thing like that - I appreciate where you are looking out for the virtue of the city.
kello,"What's your hurry, Snooks?"
sidney," Take your hands off, Kello..."
kello,"Murph, how do you like this face? Why, I'll be darned -- it's melting! Something got you scared, Sidney...? Listen, rectify me a certain thing. Wasn't you kidding, Snooks, when you told J.J. I was fat...?"
sidney,"Sleep in peace, Kello -- you're skinny -- but J.J. says you sweat!"
kello,"Is that a fact?  He's a dilly, ain't he?  By the by, what did he have against this boy?"
sidney,He goes out with girls.
kello,"Well, I'll be darned.  And what does J.J. think he SHOULD do?"
sidney, Go out with DIFFERENT girls!
kello," I get the peculiar impression, Snooks, that you don't like me. Could I be wrong?"
sidney," You could be right, you fat slob?"
kello," Come back here, Sidney...I wanna chastise you!..."
steve,"I like it that way, Frank...don't change."
kello,"Hey, fella...!"
sidney,"A bunch of nickels, mister!"
sidney,A double Johnny Walker Black.  Or whatever you got.  Scotch.
bouncer,"Hey, Robard, somebody just picked up one of your boys."
robard,What sa -- Wha --
robard, I'm trying to find out myself. They just picked up Steve.
loiterer, Some fat guy...
loiterer,They smeared him all over the lot.
susan,No.  Mr. D'Angelo - is something wrong?
susan,Seldom before five.  What's the matter?  Would you care to come in a minute?
susan, Something's happened.  To Steve.
susan, Where is he...I want to go to him...
susan," Who is ""they""?"
sidney,Susan?
sidney,Where's J.J.?
susan,He isn't here...
sidney,But he called and said...
susan,"No, I called..."
susan,"Mr. D'Angelo phoned about Steve...I went down to the hospital, but they wouldn't let me in.  He promised to keep in touch with me - Mr. D'Angelo, I mean..."
sidney, How is he?
susan,He's...unconscious...
susan,I...I gave Steve up...  Why did you and J.J. do it?
sidney,"Susie, if I get your meaning, you're pitching very wild balls. What -"
susan,"Don't bother to lie, Sidney.  I don't care anymore."
sidney,"Listen, get a good night's sleep - tomorrow's another day.  Feeling sorry for yourself won't help."
susan," I'm sorry about Steve, not myself. I'm even sorry for my brother.  To be so lonely, without one real friend in the world - to have to hang on to a worthless rag of a girl like me because she's his only real family -"
sidney," Come on now, chickie, why don't you go to bed...?"
susan,"And I'm sorry for you, too, Sidney. You're going down with the ship."
sidney,What ship?
susan,THIS ship.
susan,Don't you know how my brother will see you after tonight?  You'll be the man who drove his little stainless sister to suicide... REVERSE ANGLE
sidney,"Honey, I'll just have to smile at that."
sidney, It's late and I'm going home...
sidney,"Susie, whatever problems you have with J.J. - I didn't invent them! What're you blaming me for?  If you learned to let out your hatred you would be better off!"
susan,Like you?
sidney,"Yeah!  Like me!  I don't choke on my own gall - I fight back!  Let THEM choke, not me!"
susan,"I'm not a man, Sidney, I'm -"
sidney,"I know that bit - you're a girl; you need a man to give you strength! So what do you pick such weak sisters for?  Don't you know yet that you fight fire with fire, not with tear drops?"
susan,I could almost forgive you if what you did to Steve came from jealousy and love...
sidney, I didn't do anything!
susan,"...but you did it for greed, Sidney - and that's pathetic."
sidney,Don't run away - I was always the man for you!  I'm talking to you out of two years of silence - listen to what I say!  Inside of six months -
susan," Please, Sidney, I can't stand this -"
sidney," Listen to me, lunatic!  All your life you've been doing penance for crimes you never committed!  I could change that, I'd teach you, I'd show you - !"
hunsecker,"Go to bed, Susie.  It's late..."
hunsecker, What is he doing here?
susan,I called him.
sidney, She was depressed - she heard about Dallas.
hunsecker, He's made all the papers tonight.
hunsecker," I've put up with a lot of your guff, Susie, because you were a child.  But you're a woman now and I suspect, despite my best intentions, more than a bit of a slut..."
sidney," J.J., if you think -"
susan," Don't explain, Sidney... It doesn't matter now..."
hunsecker," Whose arms will I have to pry you out of next?  Not that I don't think you didn't invite it!  I know that look of yours, that pose of being wronged - and how it arouses the crusading instinct in even a Sidney Falco -"
sidney,"I was trying to build her up, not tear her down -"
hunsecker," And as for marriage, let me hit you with a few choice facts: you aren't ready for marriage!  You're incompetent - a capricious and shaky frail with a sick fatality for frail and useless men!"
hunsecker," She'll be fast asleep in five minutes, loaded with those headache pills..."
hunsecker,"Now we'll get to you, Sidney.  As far as the column is concerned - tonight you have forfeited every ethical consideration I ever felt for you..."
sidney, Susie's off her rocker tonight!  Go in and see what she's doing!  Go in and talk to her quietly - unless you want a corpse!
hunsecker, Let me finish what I started to say -
hunsecker," What a cornball you are, Sidney..."
sidney, SUSIE!
hunsecker," Susie, this is J.J.!  Open up!"
susan, No!  NO!  Don't touch me!
hunsecker, Susan!...
susan, Go away!...Go away!...
susan, GO AWAY!
hunsecker," Talk to her, Sidney..."
sidney, Talk to her yourself...
hunsecker,"Yuh...Yuh...  Susie, it's Mr. D'Angelo - from the hospital..."
susan,Yes...yes...yes...
susan, Steve...is out of danger...
hunsecker, That means a lot to you?
susan,Yes.
hunsecker,"But I have to warn you, Susie - for your own sake - he'll still do time..."
hunsecker," He's a hop-head - that's a felony in New York.  I can try, of course, to..."
sidney,"You're unholy, J.J.!  You'd rather kill this girl than let her go!"
hunsecker, GET OUT OF THIS HOUSE!
sidney," Susie, YOU get out of this house! - Get out before it's too late!"
sidney," Listen with care - this will cost me everything, so you know I'm telling you the truth!"
hunsecker, You're incapable of the truth...
sidney," Your brother and I arranged it all. And if the Leslie boy is still a squooshy item in your life, forget it! - your brother arranged that one, too!  I don't usually give away presents; but this is my gift to you: Get out of here!  Leave this man!"
hunsecker,"Like most Italians, Sidney's got a big gift for dramatics.  I, however, prefer the cool and stubborn facts. Sidney has not appeared in my column in weeks - check that fact with Mary.  That leads right to another fact: Sidney had nothing to lose tonight!  To the contrary, dear - ONLY HIS OBVIOUS GREED TO BEAT HIS WAY BACK INTO THE COLUMN EXPLAINS HIS ACCUSATIONS AGAINST ME! In brief, BLACKMAIL!"
hunsecker, Am I doing right?
susan, He's sick.
sidney," Yes, he's sick and you're the only idiot alive who didn't know it."
sidney,But what are you going to do?
sidney, You don't owe your brother a cup of water!
sidney,What are you going to do?
susan,Go to Steve.
sidney," For Pete's sake, straighten out the seams of your stockings - comb your hair - don't be so helpless all the time!"
hunsecker," No, he's admitted that, Harry.  My kid sister's a witness."
hunsecker,Yeah...jealousy.
hunsecker, ...He's been trying to make my sister behind my back.
kello," Oh, that's serious, J.J.  Real reprehensible..."
kello," Don't worry, I'll get there.  I'm on Broadway now."
hunsecker, That's a pretty coat.
hunsecker, - but it's about time you had a new one.
susan," I'm leaving, J.J."
hunsecker, Don't kid a kidder.  I'll see you for breakfast around eleven.
sidney,"Hello, Harry..."
kello,Hi!  I just been on the phone to J.J.
kello," You been a bad boy, Sidney.  J.J.'s going to write about you in his column tomorrow."
sidney,I thought he would.
kello,Yeah...  You know J.J....!
hunsecker, Are you in bed...?
hunsecker," I don't have to tell you, of course, that I cleared your boyfriend's name; I didn't let you down..."
hunsecker,"...I was saving this news for breakfast, but I think I'll jump the gun!  I'M GONNA GIVE YOU AND DALLAS THE BIGGEST WEDDING THIS TOWN HAS EVER SEEN!"
hunsecker,Susie...?
hunsecker," Susie!...You won't threaten me!...Nobody walks out on J.J. Hunsecker! CAMERA NOW MOVES CLOSER and closer to Hunsecker.  The ANGLE is a weird one, tilting grotesquely upward."
hunsecker, You need me - you all need me!...
hunsecker," ...I don't ask them to get on their knees, but they come to me for advice and guidance!  Who are you to reject me!"
hunsecker," What makes YOU fit to sit in judgment on a man like me.  Only a great person understands another great person, and that leaves you out!"
hunsecker," - That leaves you ALL out!  You're pigmies!  You're all sick, weak midgets!  I'm proud to be alone!..."
