Speaker,Dialogue
for educational,PURPOSES ONLY  2.  THREE MEN AND A BABY  FADE IN:
jack,"Yes, I'm the pilot...  ... I'm not even asking for your phone number... BUSINESSMAN Isn't there a pilot whose name is Paul?"
jack, Yeah... Are you Jim? BUSINESSMAN Yeah. He hands Paul a man's purse. BUSINESSMAN Here's your cash. PAUL What about the stuff? BUSINESSMAN I don't have it. We've got problems. Too much heat. Too
businessman,"I mean shut up and listen. Two guys will be waiting for you in a black T-Bird, expecting the dope. Just ignore them. It'll be delivered to you on Sunday and picked up the following Thursday, okay? PAUL But I won't be home, I'll be in the air for two weeks. BUSINESSMAN That's your problem. Make arrangements, a deal's a deal. Got it!? PAUL Got it. Jack returns. JACK  I got her phone number!   She gave me her phone number! BUSINESSMAN That's some magnificent view, isn't it? JACK It's wonderful -- Life is wonderful! The Businessman goes back to his seat and Jack grabs hold of the microphone. JACK This is your captain speaking. In honor of your victory, in honor of your beauty, and in honor of Jane, the most beautiful gymnast I have ever met. I'm going to give you a little demonstration of aviation gymnastics -- reserved only for the most important guest, hip, hip... Everyone shouts ""HOORAY!"" except for Paul and the"
jack,"God, what a woman! Paul is nervous, glancing uneasily from car to car. JACK Wanna share a cab? Paul Yeah, sure! A black Ford pulls up in front of them and its driver looks at Paul who immediately turns his back on him. JACK She's so beautiful! I've never been so in love before. Can you believe she gave me her phone number... Oh, Christ -- where is it?... Oh, no, don't tell me I lost it... It's a matter of life and death... Oh here it is -- thank God! All the while    Jack has been rambling on, a beige car on the other    side of the street has slowed down. Paul notices it.     In the beige car, a narcotics agent, GRATON, is behind the    wheel with one of his colleagues sitting beside him. GRATON They're slowing down.    Take a picture. The colleague snaps a picture of everyone who happens to be standing near the black Ford, including Jack and Paul. The black Ford pulls out. The beige car follows it. Paul observes all this out of the corner of his eye. PAUL Listen, I need a favor, I got"
peter," He's around somewhere.     Check under all the couches. Paul walks off in Jack's direction. We STAY WITH Peter, who reaches Natalie. She is talking with a very styl- ishly-dressed, tall, young man, CARL."
peter,"Oh Natalie, I've been looking for you all night. CARL All night? I just saw you deep in conversation with Nicole! PETER Deep? Hell no, we were just talking shop. NATALIE Oh come on Peter, we all know what a ladies' man you are. PETER Who, me? Jack's the ladies' man, not me. You're the only lady I'm after. CARL  So tell me, how's your project coming along? I heard you're not ready yet. PETER We've still got two weeks left before the semi-finals. We'll be ready. CARL We've been ready for three days now. We're gonna kick your ass. NATALIE Their project is really incredible. PETER Oh really?   You've seen it?"
natalie," No, it's top secret but he's been telling me about it..."
peter," ... Please darling, don't move... I'll be right back, okay? I'll bring us back some champagne... He disappears with Paul. JACK You're a lifesaver, Paul. I thought I'd never get away. Rosalie's waiting for me in the living room. Isn't she terrific? PAUL Who?   Rosalie? JACK Clementine. PAUL Oh yeah, for sure, I dunno. Listen, can you do me a favor? With some difficulty, Paul follows Jack as he picks his way through the people dancing, heading in Rosalie's direction."
jack,"Yeah... What kind of favor? Damn, I've got to get her a glass of champagne. PAUL Listen, I've got a little problem. I'm having a valuable package delivered to me on Sunday, but I'm not going to be home. I've got to do the Hawaii-Tahiti-Australia route, so can I have the package delivered here instead? JACK  But it's okay. Peter and Michael will be here. They'll take care of it. PAUL Will you be sure to tell them about it? JACK Absolutely.   Don't worry about a thing. PAUL It'll be delivered Sunday and picked up next Thursday, okay? JACK Delivered Sunday picked up Thursday. Got it. No problem. PAUL This is a very delicate matter, Jack. It's very important they don't tell anybody about this package. It could be very... uh, embarrassing for me, you know what I'm saying? JACK Sure. You got it.    I'll see you later..."
jack,"Okay, sure, not to anyone at all... Look, I'm sorry Paul, but I gotta get back to Rosalie. Now go have a good time. I'll take care of everything. PAUL Bye and thanks a lot."
jack,"Don't mention it. Paul leaves. Jack finally reaches the armchair where Rosalie is sitting. He stops short, obviously disappointed. JACK Uh-oh.   Too late. Michael is sitting next to Rosalie, right next to her. They get up to dance. As he passes Jack, Michael smiles broadly. MICHAEL All's fair, old buddy... Jack watches a moment, then breaks into a wide smile. JACK  Oh my darling, oh my darling, oh my darling Clementine. Jack whirls around and heads back towards Clementine."
carl," Terrific... time. He, too, leaves the living room and runs into Jack, who has his arm around Clementine's waist as he heads toward his bedroom with her.  5   INT. APARTMENT - NIGHT                                     5 In the kitchen Peter is straightening up. Michael joins him, dumping the ashes. Peter begins washing the glasses. PETER Where's Jack?    Did he leave? MICHAEL No, he's cuddling up with a blonde named Clementine... PETER That's not Clementine. I saw him doing his famous routine with Christie... "
michael,"No, it is Clementine, the one with the tits this big... PETER Christie's got tits that big, too... MICHAEL Yeah, but he was with Christie at the beginning of the evening -- after that he was with Rosalie and then with Clementine. And since I stole Rosalie away from him... Are you following this?"
peter,"I'm not. Jack enters the kitchen in very high spirits, singing. JACK Nice work if you can get it, and you can get it if you try... Any scotch left? PETER Yeah, here, I just put it away. JACK Sorry I can't give you guys a hand, but I've got something cooking. PETER I thought you were leaving at dawn for South America? JACK I am, the night's still young!... It's gonna be a lively one. I'm gonna make us a little snack. He makes up a tray with sandwiches. MICHAEL So, who is it anyway -- Christie or Clementine? JACK Maxine.    Beautiful, enchanting Maxine. Peter and Michael look at one another surprised, mouthing silently, ""Maxine?"""
jack,"Hey, Michael -- how'd it go with Rosalie? MICHAEL Well, things were going great until... JACK Your old friend Sophia appeared and dragged you into a thrilling conversation about modern art and in the meantime Rosalie took off with someone else. MICHAEL How did you know? JACK I dunno -- lucky guess... MICHAEL Well, I don't give a damn anyway, I have 24 drawings to hand in to my editor three days from now and I gotta work all night anyway... So it was all for the best. But you better not leave that Maxine's phone number lying around because when I'm done... JACK Don't worry, I'll leave you her phone number on the hall table. If she's really terrific I'll put a big 'X' next to it. 'Bye, guys -- love ya. I won't wake you tomorrow morning. See you in three weeks..."
jerry,"Of course, it's a piece of shit, but it's a ready piece of shit. JAY We're just going to have to buckle down, that's all. JERRY You're damn right we are. Starting now, everybody works around the clock! Everybody! We have two weeks to be ready for the semi- final selection. And we will be ready. And we will win. You want to know why we'll win? JAY Because we're gonna cheat. PETER I'll go bribe the judges! JERRY I don't think this is a joking matter, gentlemen. PETER Come on, Jerry... A SECRETARY enters. SECRETARY There's an urgent call for you, Peter. PETER I'm not in."
secretary,It's Jack -- he says it's 'super important...' Peter picks up the phone.
peter,"Hi... yeah... listen, make it quick, I'm in a meeting here... yeah, a package... okay... someone'll drop it off Sunday and pick it up Thursday... No problem ... yeah... we'll put it aside, okay... no, no, we won't tell anybody about it... Is that it?... Right, we won't tell anyone... Hey -- love 'n' kisses to the Brazilian girls, vaya con dios, old buddy. Peter hangs up, laughing.    Jerry gives him a dirty look. PETER What?"
peter,"No shit.  'Dearest Jack, here is the fruit of our love. Take good care of her. I have to go to Europe and Japan for six months, her name is Mary. Good luck, Love, Sylvia.' MICHAEL What are we going to do with it? PETER Give it back to her mother, that's what. MICHAEL But it says she went to Europe. PETER Well, we'll see about that, d'you have her phone number? MICHAEL Whose phone number? SYLVIA The girl's... Sylvia's... MICHAEL Why the hell would I have her number? I've never even heard of this chick! PETER You mean you don't know who she is? MICHAEL No way. If I had to keep track of all Jack's girlfriends, I'd have to be a full-time secretary. PETER Well, what are we gonna do? MICHAEL Hey, look, she's waking up... Hey, look, she's crying... PETER Oh no, this can't be happening! She's not gonna start to cry now?! MICHAEL"
michael,Soft stuff... I guess. PETER  Let's call Jack's mother!
peter,"She lives in Miami for Christsake. She can't stop the baby crying from Miami. MICHAEL Well, just to ask her advice... PETER No, he said not to tell anyone... MICHAEL But this is an emergency! PETER No! No way! You know what a pain that woman is -- she'll be on the next plane here to move in with us... MICHAEL Maybe I should call my mother... PETER No, please -- leave the mothers out of this, okay?! It's only four days. We should be able to handle that, besides you know the rule around here: it's fine to have a woman over once in a while, but... Michael finishes the sentence in unison with him. PETER AND MICHAEL ... never for more than one night at a time! PETER And that includes mothers! Peter steps over the basket and heads towards the elevator. MICHAEL Where are you going?! PETER I'm going to the store to buy some baby food. MICHAEL What am I supposed to do while you're gone? PETER Pick her up and hold her."
michael," Whaddya mean, pick her up? I've never held a baby -- I'll drop her!"
store clerk,"Depends on what your pediatrician recommends. PETER Oh right, the pediatrician... But which one sells the most? STORE CLERK  This kind. PETER Oh, so this is the best kind?"
store clerk,"It's the cheapest. PETER Then it's the worst kind? STORE CLERK They're all good, sir. PETER  Oh, okay, well I'll take this kind then. STORE CLERK That kind doesn't have any milk in it."
peter,"Oh, I see, there's milk with no milk in it? STORE CLERK Some babies are allergic to milk."
peter,"So what's the stuff that no babies are allergic to? STORE CLERK Soy formula. PETER Oh, okay, I'll take the soy formula."
store clerk, Is she teething? PETER Teething? WOMAN #1 Does she drool? Does she cry all night long? Does she chew on her fists? Does she put everything into her mouth? She acts out her words. PETER I know she can't talk. WOMAN #2
manager,This package came for you... Oh! What a cute little baby! Is it yours?
michael,"No, it's not me, I mean she's not mine... MANAGER Oh, so it's Peter's? MICHAEL No, no, it's Jack's, I mean it's not Jack's, it's... someone loaned it to us, I mean someone... MANAGER And what's the little girl's name? MICHAEL Mary. MANAGER Ooh, what a pwetty wittle name, Mary! I didn't know you had a baby... MICHAEL Yeah, well, I have to put her to bed now. MANAGER You have to put her to bed?    Where's Mary's mommy? MICHAEL She's... she's not here.   She'll be back soon. Michael starts to close the door.    She pushes it back open and holds out the package. MANAGER Oh here, this just came for you. They just dropped it off. Can I hold her for a second? MICHAEL Well, like, y'see... she doesn't like to be held by strangers... The apartment Manager has already given Michael the package and grabbed Mary. She covers her with kisses. Mary smiles. Michael absent-mindedly looks at the package."
manager,"She loves to be held by strangers! Hey, she's soaking wet hmm, no I think it's number 2. Want me to give you a hand changing her?"
michael,"Oh no, don't worry, I'm used to it.  Well, so long, Mrs. Razzolini. MANAGER 'Bye, Mary, I'll come back to visit."
peter,"To figure out how old she is so we know what to feed her, that's why. Peter attempts to look into Mary's mouth but she squirms. MICHAEL Do you look on top or bottom? PETER How do I know? MICHAEL Try feeling with your finger. Peter slides his finger over Mary's gums. PETER I can't feel anything -- I'll give her the stuff for newborns and hope she's not allergic to it. Peter starts off toward the kitchen, Michael follows. PETER And then we'll    have to  see if she's allergic    to iron,  to soy or to milk --    you can't  imagine how much stuff    they can  be allergic to! MICHAEL She's soaking wet -- did you buy any diapers? PETER Diapers? MICHAEL"
peter,"Go ahead... No, not on the towels, they're all covered with crap... Michael lays Mary down right on the couch. Peter vigor- ously undoes the tape, and the whole PLASTIC lining RIPS apart. PETER ... What the hell is this friggin' mess? Oh, man, this is unbelievable! To think, they bombard us day and night with their goddamn TV commercials! And will you look at this junk? This stuff is pure shit -- You tape it closed, it sags, you undo the tape: bingo -- the whole goddamn thing falls apart! MICHAEL  Oh shit! Now she's pissing. Look at the couch. The sneaky little bitch was just waiting for me to get the diaper off, then whammo... Mary gives them a big smile. PETER I happen to like my furniture. I'm going out to get some real diapers.  You can clean the couch up in the meantime. He exits, slamming the door."
peter," Hey, hey, hey, I'll work round the clock all weekend long... I swear, Jerry, I am not lying to you..."
michael," ... Mr. Oxman? Hello, Mr. Oxman?"
michael,She could have at least given us a phone number or the name of someone to contact... PUNK #1  I don't get it. Didn't they tell you we were gonna be here today?
michael,"Sure they told us! So what? That doesn't make the last four days any less hellish than they were! PETER Well, anyway, they're here now, that's all that matters! Peter turns and walks toward the basket. PETER The next bottle's in 45 minutes. I made it already. It's in the basket. PUNK #1 Bottle?   Whadda ya mean, bottle? MICHAEL About an hour after her bottle, she starts yawning. Put her to bed right away or it's pure hell for the next three hours, at least that's what we've noticed. Peter has returned with the basket. The Punks look at the baby, their eyes wide with disbelief. PUNK #1 What the hell is that?   A baby? PETER  No, it's a very short teenager. Of course it's a baby! Now listen carefully: I'm giving you a can of the milk she's been getting. She loves it, and more importantly,"
michael,"You bet that's the plan! We're not keeping her one more second. PUNK #1 Okay, if that's the plan... He passes the basket to Punk #2 PUNK #1 ... Here, hold this. Okay, so long! They start to leave, pressing the elevator button."
peter," Oh shit, I don't have it on me... But I'll call you. Okay, so long! PETER & MICHAEL So long! The elevator has arrived.    The Punks quickly slip inside it with the basket. Michael closes the door. Peter plops down in the armchair by the front door. PETER Aah, relief at last!    Good riddance! MICHAEL You said it! Now maybe I can get some work done. He disappears in the direction of his room. Peter is sitting    on something hard. He pulls it out from under him, it's    a package. He looks at it, casually reading: ""Care     of Jack Collins."" He tosses it to the side. Suddenly,     it dawns on him. He leaps up, grabs the package and    runs into Michael's room."
michael,"But did the cops see the dope? PETER No, it's right here.  He takes out the package. MICHAEL Shit! PETER We'll get twenty years if the cops find this on us! Climb down the fire escape and hide it... anywhere! Michael takes the package, opens the window and starts to climb out it when Peter stops him. PETER Hey, whatever you do,   don't lose the goddamn dope, we   gotta be able to return it to   those dealers or we're dead. Those    guys are serious. MICHAEL Don't worry. He starts down the fire escape, then stops and turns back. MICHAEL Oh, by the way, I put some water up to boil for her bottle. Michael disappears. Peter picks up Mary, grabs his  wal- let and leaves the room. When he gets to the hall,  he discovers that Cop #1 has joined Cop #2, to whom he is whispering something. Peter holds his license out  for them to see. PETER Here's my license. COP #1 I'm afraid I'm going to have to ask you to remain in the apartment. The narcotics squad will be arriving any moment now. They want to ask you a few questions. PETER Narcotics squad? What do they want with me? I don't even use aspirin! "
michael,"Did you change her? PETER No, she's soaking wet."
michael,"Okay, I'll do it. Michael puts down his bag of groceries, takes Mary from Peter and disappears with the box of diapers. In his room, he lays Mary down on his bed and starts undressing her."
michael,"Okey-dokey, honeybunch, it's time to go beddy-bye now... We're gonna take a nice long nappy-wappy..."
peter," Sure.   This is Jack Collins. AGENT #1 Oh yeah?   Now that's interesting. Michael has laid Mary down for a nap in her basket, observed by the five cops. He now sits down, cheerful and bubbling over with enthusiasm. MICHAEL So! Can I get you something to drink? Agent #1 totally ignores him. AGENT #1 So, who's the baby belong to? PETER It's Jack's daughter. AGENT #1 And why are you two taking care of her? PETER Because her mother's in Europe for six months, and since Jack had to be away for two weeks, I took my vacation to take care of her, I love kids. MICHAEL Yeah, Peter and I just love kids! AGENT #1 Now that's interesting. Well, we'll be seeing each other again soon, in fact very soon. In the"
michael,"Come back anytime, gentlemen. You're always welcome here. We have no particular plans to leave New York in the near future, so don't worry about us now. 'Bye now. Once the cops are gone, Michael races back to the living room. Peter has collapsed into his armchair."
peter, I diapered the dope on her right in front of the cop and he never noticed a thing! PETER I told the cops we were taking care of her. You realize we're now stuck with the kid till Jack
peter,"You're going now? MICHAEL Yeah, but don't worry about it, I'll be back before it's time for her next bottle. She's asleep now. PETER Terrific, just terrific! Jerry just called: I have to go to the office right now. MICHAEL Well, call him back. Tell him you'll come later. PETER There's no way. I can't, he's suicidal. Why don't you call Oxman and tell him you'll be there in a few hours. MICHAEL You're crazy. Oxman is leaving in an hour. If I don't meet him before then, I blow my 15,000 dollar contract. PETER Oh shit, I can't take this anymore! MICHAEL Look, maybe we could pawn her off on Mrs. Razzolini, just for a couple of hours -- she's crazy about her! PETER Good idea!    Let's go."
michael,Wait -- I hear someone... I'll go see... Peter waits with the basket.   Michael tiptoes to the corner of the corridor.
peter,"Bullshit, it's a trick. MICHAEL You think so?    Really?"
peter,"They just said that to put us off guard. They saw the condition this apartment's in. PETER  They know the punks were here looking for the dope and that they probably didn't find it. So that means we've still got it. MICHAEL But he said the investigation was closed. PETER Okay, let's just see how closed it is. I'll go downstairs. You watch out the window and see if I'm being tailed."
peter,We'll have to be very careful.
punk,"Hi! Doin' a little shopping, huh? How's your place -- not too much damage, I hope. MICHAEL What do you guys want? PUNK We want the dope. Tomorrow. MICHAEL And we want to give it to you. But the cops are tailing us nonstop. Matter of fact, there's one right behind us now... PUNK That's your problem, man. Figure out a way to shake 'em. Either we safely get the dope tomorrow, or you, your friend and the kid'll get this.  We'll call you tonight. He runs off, disappearing into the darkness. From the slit-open grocery bag milk flows out onto the sidewalk. Michael is shaking all over. Standing about twenty yards away, Graton hasn't missed a thing."
graton,"... My snitch told me the gang hasn't gotten the dope back yet, but they will soon. They made contact with the two guys tonight ... No, no, they don't know I'm tailing them. These jerks are going to fall right into my hands..."
michael,"All right, Jack. Why don't we start at the very beginning. The very day you left for your vacation... JACK Hey, will you please stop talking like Mr. Rogers? It's getting on my nerves. PETER  His nerves! Ha. Ha. Ha. His nerves! Michael, his nerves! You wanna talk about nerves! Then just shut up and listen. It so happens we don't want a kid here either, but when someone dumps one on us, we take goddamn care of it. MICHAEL Yeah, we take goddam care of it. PETER We haven't had a decent night's sleep in two weeks. Michael's probably going to lose a $15,000 contract... MICHAEL Peter couldn't leave. Jerry almost jumped out the window. It's lucky they even made it to the finals! JACK What? PETER First, we've got the    narcs on our ass, then there's the    drug gang threatening to carve    us up. Then bottles... bottles...    every three hours, bottles. MICHAEL And diapers. Have you ever tried to do diapers?"
peter,"'La Paz, Bolivia...' He calls from ... 'I'm onto something hot.' He says. 'Did the package get there?' He says. You asshole!"
michael,"And the day they wrecked the apartment, Peter came home and couldn't find Mary. I've never seen him in tears like that bef... PETER  Never mind about that. Look, Jack, you got us into this mess, and you're going to help us get out of it. JACK What are you guys talking about? What narcs? What gang? And who's that fucking baby? PETER For your information, the 'fucking' baby's name is Mary. And if I were you, I'd watch what I said about her... because she just so happens to be your daughter! JACK What?? MICHAEL And it just so happens, we've got a lot better things to do with our lives than wipe a baby's ass, even if she's yours! Peter and Michael exit, slamming the door."
peter,"What's the problem? GRATON You guys must think you're pretty smart, don't ya?  Holy shit! The diaper! Graton starts running like crazy back to the fountain. He rummages like a sick dog all around the spot where Michael had been lying. Suddenly he dashes toward the trash can and dumps out its contents, throwing the garbage around like a lunatic."
graton,"The goddam diaper! What a jerk, what a goddam schmuck I am! Peter, Michael, Jack and the 10 plainclothes detectives watch Graton going bananas. MICHAEL  I think that guy needs a vacation. JACK He should try South America. PETER Yeah, I hear it's nice there this time of year."
michael,"Sylvia -- She wanted to know how Mary was doing. JACK What? Jesus Christ, Michael, why didn't you let me talk to her!? MICHAEL She would have just hung up on you again. The important thing is she knows Mary's fine. JACK You jerk! You should've said she was terrible, sick as hell! Practically on death's door!  What's with him? The kid's doing really great!"
jack,"... Yeah... A little girl, Mary... SCREAMING coming over the phone. JACK ... I'd love you to see her. In fact, I was gonna bring her down tomorrow... today?... Great, I think there's a flight in three hours. I'll be at your place by two. See you real soon! He hangs up gleefully, rubbing his hands together."
jack,"Really, by hand? MICHAEL  I gotta get going, I'll miss my plane..."
michael,I am! PETER How 'bout Jack?
michael,"On his way to Miami. PETER Oh, yeah. He's got a lot of nerve! Leaving us with the kid again... MICHAEL No, he took Mary to his mother's, she couldn't wait to see her. He's gonna try to unload her on her till Sylvia gets back. I made her four bott... PETER  Of course not! What, are you crazy? I'm relieved! Thank God she's out of here! MICHAEL I made her four bott... PETER"
michael," Four bottles for the goddam trip. There, I finally got it out."
peter," What do you want? JACK Nothing, nothing. PETER Don't go into my room, she's asleep. JACK Yeah, but the nanny, Mrs. Bretsaws, she wants to see her."
peter,"No, damn it, no! You're gonna wake her up! It already took me an hour to sing her to sleep... JACK Yeah, but she wants to see her. PETER All right, I'll go explain the situation. JACK  Wanna bet she's out of here in ten minutes slamming the door behind her? They tiptoe over to the living room door and eavesdrop."
