Speaker,Dialogue
peter,"Oh, yeah?   How do you figure that? MRS. BRETSAWS Shouldn't I be discussing all this with the father? PETER Well, listen, Mrs. Fretsaw, umm... Brainsore... MRS. BRETSAWS Bretsaws, Mrs. Bretsaws. PETER Right... Bratsnot, lemme tell you something. With a child you always know who the mother is, but the father -- that's another kettle of fish. So don't give me that bullshit, okay? MRS. BRETSAWS Very well. I won't discuss it any further with you. Will you please show me where the kitchen and the bathroom are? PETER What for? MRS. BRETSAWS So I can make you a list of the things we need. PETER What do you mean, make you a list? -- Don't you do the shopping yourself? MRS. BRETSAWS No shopping or laundry or housekeeping. I am a professional nanny. PETER We have plenty of everything. MRS. BRETSAWS Do you have a sufficient amount of fruit and vegetables for the child? PETER She only eats milk and cereal."
peter,"Oh that's bullshit. You don't feed a baby like an adult. MRS. BRETSAWS  I knew you'd say something like that, you jerk! MRS.    BRETSAWS Fine. Anything you     say, sir. Let me just remind    you that I have my diploma and that    medicine is a serious matter. PETER Do you know the song that goes 'Medicine's a whore and the pharmacist is her pimp'? MRS. BRETSAWS No, I don't. We must listen to different music. Personally I'm very fond of opera."
peter,"Mrs. Breakballs, if you don't get out of here right this minute I'm gonna punch you in the nose! This is my home, now get out!"
peter,"Not a    chance! I'm not doing the night    shift. I absolutely refuse. I have    too much work to catch up on for    the competition. JACK Well, needless to say I refuse, too!"
michael,"Listen to me, you selfish bastards! My shift is eight hours in a row. No way I'm gonna do nights too. After 6 P.M. she can scream all she wants, I don't give a shit. PETER You know, Jack, you're a real slime ball! We give you the easiest shift: the morning. She's always in great shape in the morning, isn't she? We've got to work like crazy to save our jobs and you have the nerve to refuse nights. Goddamit, she's your daughter. Are you that horny? JACK  Hey, horny yourself! I don't give a shit. I don't need you guys. I'll find some other way to do it. And I won't take the New York-Washington shuttle! He exits, furious."
jack," Oh, hi... Nah, nothing's wrong. PAUL What were you doing in the boss's office? JACK I was asking to do the New York- Washington shuttle for a few months. PAUL Oh, and he said 'no,' huh?"
jack," As a matter of fact, he said 'yes.' Paul backs up against the wall, protecting his face with his arms. Jack leaves, disgusted. Paul watches him go, totally confused."
michael,"Coochie, coochie, coo... woo, woo, woo... bippity, boppity boo... Peter comes rushing into the apartment and runs toward his room. He stops short in the corridor -- he hears Mary's laughter and Michael's coochie-coo's. Noiselessly he tiptoes over to the living room door and listens, troubled. Then he walks away and shouts, as though he were just coming out of his room. PETER Hi, Michael, I just came back to get a file I forgot..."
peter," Okay, that's it. Into the kitchen. He exits, furious. Peter and Jack follow after him. Fuming, they file one after the other down the corridor past the stunned Brunette in her T-shirt who was waiting"
michael,"I'm not a punching bag!   You assholes! JACK If I can't bring a girl back here anymore, just say so. And I'm gone. I'm outta here. With Mary. PETER You can bring whoever you want as long as they speak softly like everyone else! MICHAEL One thing I know: I can't goddamn wait till Sylvia gets back! PETER Yeah, you can say that again! JACK And again, and again, and again... Meanwhile, the Brunette has put her clothes back on and gathered up her belongings. Now she enters the kitchen. BRUNETTE Sorry to disturb you guys, but I'm splitting. I didn't come here to be a bedwarmer. 'Bye. JACK "
jay's wife,"So what's it made of? In the b.g., the BABY starts CRYING again. PETER Umm, it's made with whipped cream and loads of nipples on top -- I mean, loads of... raspberries ... I'll be right back..."
jack,That's not fair -- let's take Mary out there... MICHAEL And the hell with it.
jack," Who's her mother, anyway? PETER She's in Europe, she'll be back in a few days. CARL Does she always cry like that? MICHAEL No, it's only because she's teething, she's usually very sweet... The guests remain silent. CAROLINE"
jerry,"What if you just put her back to bed? NATALIE Right -- she's just throwing a temper tantrum, put her to bed... PETER We already tried..."
jack,"It's her teeth... NATALIE  Oh, nothing, nothing -- I was just trying to liven up the"
carl," You motherfucker, get out of here! Get out of my house right now or I'll kick the shit out"
jack,"Stop it, Peter. Give her to me, I'll put her to bed... PETER  Hey, Caroline, I think we should"
jerry's wife,"Well, the atmosphere wasn't exactly festive... JERRY Sorry about the cake, Mike... It looks great! MICHAEL Oh, never mind, don't worry... Good night... Jerry and his Wife exit. Michael is left standing there with his cake. Jack comes in, full of beans. JACK Well, she's asleep at last! We sang in har... Hey, where is everybody? MICHAEL Gone. Can you make a little room for me on the table to put the... JACK You mean they're all gone? MICHAEL Yeah, all of 'em, hey, can you make a little room for me to... JACK  Peter! Peter, goddamit, get out here! Peter comes back in with Jack. JACK They're all gone!"
peter,"Who gives a shit, they're all jerks anyway. MICHAEL Hey, could you make a little room for me on the table so I can... JACK It's because of the kid.     They can't stand kids. PETER I can't stand kids either but that's not a reason to leave! Dipshits, they're all a bunch of dipshits, every one of 'em. MICHAEL Oh, fuck it -- I'm sitting down. He sits down on a chair with the cake on his lap. JACK And did    you hear Natalie: 'She's throwing    a temper tantrum, just put her    to bed.' What a pain-in- the-ass    that broad is! PETER  Hey, you're the pain-in-the-ass! First you dump a baby on us, then you scare everyone away from the party, then... JACK I scared    everyone aw... Just cut the    crap, will you? My whole life is    diapers, shuttles and bottles.     I do the graveyard shift, I'm the    one who never gets any sleep.     I... PETER Listen, we all have two full-time jobs! That's for sure! MICHAEL And what about me? I'm a prisoner in this house all day long, forget about chasing ass, I haven't gotten laid in six months. When the hell is your friggin' Sylvia gonna come back? "
jack,"She's been gone for six months and four days. PETER If she's not back by the end of next week, I'm kicking her kid out! MICHAEL You better give your goddam Sylvia hell for this! JACK Don't worry, she's gonna get it but good! PETER And you can tell her we have a lot better things to do with our lives than wipe a baby's ass, goddamn it! He exits. So does Jack. Michael is buried under the three-tiered cake, unable to see around it. MICHAEL Do you guys want some cake?  Guys?"
peter," Fine, fine, she's doing great... She's getting her back teeth in lately, it's been a bit rough... SYLVIA Can I see her?"
peter,"Oh, yeah, sure, she's in there... They both enter the living room. Mary stares at Sylvia. When she spots Mary, Sylvia suddenly breaks down in tears. Peter is dumbfounded. SYLVIA I don't believe how much she's grown! Recovering, wiping away her tears, she walks over to the playpen. SYLVIA Hello, Mary, hello my darling... She picks her up, hugs her tightly, showers kisses on her. MARY LAUGHS. Sylvia starts crying again. SYLVIA How beautiful she is... Her hair has grown... Look how much she changed, I missed it all. I missed her so much! Peter, in a kind of daze, stares at Sylvia. Without looking at Peter, she dries her eyes and tries to stop crying. SYLVIA I wanted to make life difficult for Jack but I never thought I'd miss her so much... PETER  Oh, yeah... make life difficult for Jack..."
sylvia,Is he here? PETER What?
sylvia,"Is Jack here? PETER  Oh, yeah, yeah, I'll go get him... He exits like a sleepwalker and goes straight into Michael's room. The latter is asleep."
sylvia," Do you want me to take her? PETER No, I have to burp her first. With dexterity, he places Mary face down on his shoulder and walks around in the kitchen, patting her on the back."
jack," Yeah, sure... Michael bustles about. Sylvia's gaze comes to rest on the crib which stands imposingly in the middle of the living room. Music boxes, little booties and stuffed animals are hanging from the bars, and a pretty white tulle frames the crib."
michael,You'll have to come back and get the crib later. SYLVIA Yeah...
sylvia,"Yeah, I bet... Actually, that was kind of the point... But I'm the one who really got screwed... She starts to cry again."
jack,"Don't cry, c'mon... you're taking her back now, it's great... SYLVIA  Okay, well, thanks again -- 'Bye! PETER, MICHAEL AND JACK"
peter,"Oh shit -- I forgot to explain about the cereal! JACK She'll figure it out by herself... MICHAEL Yeah, she'll manage... JACK Now it's back to the good life for us! MICHAEL Sleeping late! Different women every night! I can't wait! JACK Forget about the New York-Washington shuttle! I'm off to Caracas! PETER And I'm gonna be able to get back to work, so Carl better watch it -- I'm gonna slaughter that son-of-a-bitch! First with this goddam competition... and then with Natalie. MICHAEL And I've got six months' worth of sex to catch up on with Cathy, Nora, Frances, Susan, Barbra... They have entered the elevator. The doors close. They come out of the elevator, in front of their apartment. MICHAEL ...Christie, Paula, Sheila, Lisa, Kimberly, Rhonda, Rebecca, Louisa..."
michael,They won!    They won! BLONDE Who won? MICHAEL Peter.     He won the competition! BLONDE Great!     Who's Peter?
graton,"Hi... JACK  Oh yeah, I see... JACK So, shall we go for a walk?"
jack,"And you know what, it's not even like they wanted us to believe it -- it might have been us who wanted to believe it... But let's face it, nobody comes out of our rib... GRATON  But wait -- the baby's gone..."
michael, It doesn't knock me out at all... MICHAEL Is there any jam left? PETER Do. Silence. PETER You eatig here todight? JACK
jack,"Sylvia doing okay? YOUNG MAN I don't know -- I'm a med student. I'm just babysitting. I only met her a couple hours ago. JACK Oh, I see... Silence. The Young Man sits down at the table and immerses himself in his books. Mary doesn't look up from her pack of cigarettes anymore. JACK Listen, on second thought, I don't think I'll wait for her. Just give her this when she gets back, okay? And this is for the baby. Jack hands the bouquet and the rabbit to the Young Man, who plops them down on a chair. YOUNG MAN Sure, no problem. He immerses himself again in his books. Jack heads toward the door, then turns around. JACK Shouldn't the baby be in bed by now? YOUNG MAN Yeah... I don't know... When I put her to bed she cries so I just let her stay up... JACK Don't you have any tights to put on her legs? YOUNG MAN Tights?... Well, it's pretty hot in here anyway..."
jack,"No, I'm not going anywhere anymore, I've had it with traveling. I quit. MICHAEL C'mon, I'll call you a cab, you've still got time. JACK Don't you call anybody. MICHAEL But the plane's s'posed to take off in half an hour -- They won't have time to replace you. This is serious -- you'll lose your job and you won't be able to pay your share of the apartment anymore... you... Jack takes off his pilot's jacket and throws it aside. JACK I'll be a dishwasher, I'll live in a flophouse. MICHAEL What the hell happened? JACK I'm not going, I told you; I'm not going ever again. I'm sick and tired of traveling, sick and tired of broads. They all have the same asses and I can't seem to love them anyway. I can't take another hotel room, and swimming pools and trendy restaurants! I want to know"
michael," Jack!   Jack, c'mere for Chrissake! SYLVIA 'Cause my place is tiny, y'know, and my schedule's insane -- and I just finished four days of posing and we ended up every day at..."
sylvia,"Oh, so the flowers and the rabbit were from you... JACK I could have strangled that guy... SYLVIA I mean it, I can't cope anymore. My parents and I don't talk to each other and anyway they live in Texas, and the baby needs to get out to the park... MICHAEL Yeah, tell me about it! Finding time to take her to the park every day is a real bitch! SYLVIA And I have to work, I need the money to survive and anyway I love my job... A distraught Peter, bare-chested and in jeans, comes running in from his room. SYLVIA But to work I've gotta have a babysitter, and to have a babysitter I need to work, so I run around all day...  It's just 'cause I haven't slept in four nights -- she must be teething or something, I don't know but I can't manage... PETER Don't worry, it's nothing, she's"
michael,"But you're beautiful -- At your age all you need is a good night's sleep and you'll look like new. SYLVIA Right, a good night's sleep -- but when? PETER Well, why don't you leave the baby with us for a few days, till you recuperate... I mean, if you want. MICHAEL We're old pros -- it's not a big deal for us... SYLVIA  Really? I can leave her with you for a little while? JACK Of course. Leave her with us. Come back whenever you want. Get some rest. Sylvia, between two sobs, picks up a big bag beside her on the doorstep. SYLVIA I brought a couple of things for her, just for a few days... Michael eagerly takes the bag from her.    It's followed by a second, and then a third. PETER"
jack,"She'll need two or three months to recover, at least... Maybe more! PETER We could set up a room for her here... MICHAEL A room for her and a room for Mary... JACK Then we could have four shifts instead of three!"
peter,"Yeah, but I don't think she'll agree. She's got her own life to live. MICHAEL Yeah, she probably wouldn't want to move here. She'd think we'd jump on her any chance we could... JACK But we'd make a rule, she'd just be 'one of the guys!' MICHAEL She'll never want to... SYLVIA  Deal. Mary    suddenly comes in from the kitchen, walking unstead- ily    but determinedly. She's dragging Graton's rabbit by its    ear. She looks at the four of them and laughs her head    off. FREEZE FRAME."
