Speaker,Dialogue
edward,In a couple hours. Then you and I will go somewhere. Together. The others will keep hunting.
bella,"Mom, I'm so glad you got my - -"
bella,"Calm down, Mom. Everything is fine, okay? I'll explain every -"
bella,... Mom? Are you there?
james,I was prepared to wait for you. But then Mom came home after she received a very worried call from your Dad. It all worked out quite well.
james,"I must say, Forks High School doesn't protect its students' privacy very well. It was just too easy for Victoria to find your previous address."
bella,Leave my mother out of this.
james,You're protective of her. That's nice. You can still save her. But you'll need to get away from your friends. Can you do that?
bella,I... don't think so.
bella,Where should I meet you?
james,The old ballet studio around the corner. And I'll know if you bring anyone along. Poor mommy would pay the price for that mistake.
bella," 8th and Palo Verde, please."
bella,Everyone makes fun of me.
rene,But you're a wonderful dancer.
bella,"Mom, I suck."
james,"That's my favorite part. Stubborn child, weren't you?"
bella,She's not here.
james,Sorry. But you really made it too easy.
james,"So to make things more entertaining, I'm going to make a little film of our time together. Borrowed this from your house. Hope you don't mind."
james,Excellent! An escape attempt.
james,It'll break Edward's little heart.
bella,Edward has nothing to do with this.
james,Beautiful! Very visually dynamic. I chose my stage well.
james,"Still stubborn, aren't you? Is that what makes you special? Because frankly, I don't see it."
james,"Too bad he didn't have the strength to turn you. Instead, he kept you this fragile little human. It's cruel, really."
james,Well done! You've succeeded in annoying me.
james,Tell Edward how much it hurts.
james,Tell him to avenge you.
bella,"No! Edward, don't.. ."
james,Cut! The end.
james,You're alone... because you're faster than the others. But not stronger.
edward,I'm strong enough to kill you.
bella,It's on fire! My hand!
edward,Venom - -
edward,No!
alice,It's going to happen. I've seen it -
edward,It doesn't have to be that way.
bella,It's burning!
edward,What's the other choice? You said -
edward,I -- won't be able to stop -
edward,"It's alright, Bella. I'll make it go away."
rene,He never leaves. And your dad's down in the cafeteria.
bella,What... happened?
rene,"Baby, you fell down two flights of stairs and through a window."
rene,It's Phil. He's worried about you.
bella,"Mom, you're... texting."
bella,That's great mom.
rene,Jacksonville is always sunny and you'll have your own bathroom.. .
bella,"Mom, wait. I want to live in Forks. I have Dad.. ."
rene, And he's there.
rene,Charlie doesn't like him. Blames him for your leaving.
bella,What do you think?
bella,"Um, Mom, would you mind getting Dad? I want to talk to him. Apologize."
rene,"I'm sure he doesn't care about that, Baby. But Ill go get him."
bella,Is James - did you -- ?
edward,"We took care of him. And the woman, Victoria, she ran off."
bella,I'm alive because of you.
edward, You're in here because of me.
edward,The worst of it... was thinking I couldn't stop -
bella,But you did.
edward,"Bella, you should go to Jacksonville. Where I can't hurt you anymore.. ."
bella,What? No! I want to be with you! I don't want -
charlie,Heard that before.
charlie,... and... you look beautiful.
edward,Prom is an important rite of passage. I don't want you to miss anything.
edward,Shall we?
bella, You're serious.
edward,See? You're dancing.
bella,At prom.
bella,I want you. Always.
edward, I won't end your life for you.
bella,"I'm dying anyway. Every minute, I get closer, older"
edward,That's how it's supposed to happen.
bella,Not the way Alice saw it.  I heard her. She saw me like you.
edward,"Her visions change, Bella."
bella,Based on what someone decides. And I've decided.
edward,Is that what you dream about? Becoming a monster?
bella,I dream about being with you forever.
edward,You really want this?
bella,Yes.
bella,Yes.
edward,You're going to have a long and happy life with me. Isn't that enough?
bella,For now.
