Speaker,Dialogue
on black,"We hear a whooshing sound, getting louder.  A BLINK OF AN IMAGE New York City from a perspective of flight, not an airplane, a swooping diving shot. Back to black.  A WOMAN'S VOICE Abre los ojos... open your eyes... open your eyes...  INT. DAVID'S BEDROOM - EARLY MORNING  DAVID AAMES, JR., 32, swings out of bed and sits on the corner of his mattress. it's a chilly New York City morning. Early sunlight glows around the corner's of his curtains.  A WOMAN'S VOICE open your eyes... He reaches behind him to shut off a slim voice-activated clock-radio. He rises, a comforter draped around his shoulders, and heads to the bathroom.  INT. DAVID'S BATHROOM - MORNING  David regards himself in the mirror of a beautifully-tiled and well-appointed bathroom. in his thirties now, his looks have only deepened and improved. He brushes his teeth. He spots a gray hair, and holding tweezers, seizes and plucks it.  INT. DAVID'S BEDROOM - MORNING  David puts on a shirt. Checks his wallet for money. His bedroom is elegant and spare.  INT. DAVID'S NEW YORK CITY APARTMENT - MORNING  He slips down the stairs into the expansive living area of this deeply-textured apartment. A stunning, inherited book collection lines the walls.  INT./EXT. NEW YORK CITY GARAGE BELOW APARTMENT/STREETS -"
morning,"David starts up his dark green sports car, and roars onto the New York City streets."
david's voice,You're a shrink. You've got to do better than that.
david's voice,"What do you want to know? I was about to turn 33. I ran three magazines, and a world-wide publishing house. On most days I actually fooled myself into believing it would last forever."
david's voice,"Isn't that what being young is about? Believing secretly that you would be the one person, in the history of man, who would live forever?"
julianna,Where you going so early?
david," Hey, don't record any more messages on my alarm--clock, okay?"
julianna,Why not?
david,I'll think we're married or something.
julianna,Don't you ever say that word. Or I'll never come over here and bring you chicken soup and fuck your brains out again.
julianna,Still there. How's yours?
julianna,"Reyna, it's Julianna. I missed my audition.  I'm with David."
david,"Help yourself to whatever you want. Set the alarm, Maria will clean up. Lock up when you go. And... you are the greatest."
julianna,"Bye ""honey!"""
david,"Bye ""honey!"" I'll call you later."
julianna,When? When?
david,"Soon! They have a comfortable, healthy, mutually satisfying, gloriously superficial relationship."
david,Did you reserve the court?
brian,Easy. I can't handle heavy conversation at this ungodly hour.
david,I'm sorry to do this early. I gotta be done by 10. Car phone rings. David checks Caller ID - it's his office. He clicks on.
david,How did you find me?
rachel's voice,"David Aames, you have to check the colors of the letters for the new issue of Rise."
david,What are the colors?
rachel's voice,Yellow-and-red... or the traditional white.
david,"Let, me think about it."
rachel's voice,"David, please. Don't be late for the ten o'clock with the board."
david,"Okay, but. don't tell anybody where I am I don't care if God calls. I'm very busy."
brian,Can't you just get rid of that board?
david,The Seven Dwarves? No.
brian,Those people drive you nuts.
david,"And that was the desire of my father, who hired them."
brian," You fucked Julie Gianni again, didn't you? David takes off driving."
brian,"I know someone was there when I called. You had that tone.  Oh, no man, I've got a cold. I'm hanging in tonight."
david, I had a cold. I was alone.
brian,Fine. You can do whatever you want with your life -
david,Thanks.
brian,-- but one day you'll know what love truly is. It's the sour and the sweet. And I know sour which allows me to appreciate the sweet.
david,"Julie Gi.anni is a friend. Sometimes we sleep together. Brian howls in pain, like a hurt dog."
david,What --
brian,My dream girl... Julie Gianni... is your... fuck buddy. Brian emits another pained howl. David reaches over to change the music.
david,What do you want to listen to?
brian,"Slow down, man."
david,"What have we got here - Barcelona, Looper... Radiohead? Brian freezes at what he sees."
brian,"Look out! Look out! David turns and sees he's hurtling into the back of a car stopped just in front of him. Clenching he hits the brakes, narrowly avoiding a high-speech collision. And then... to his right... another car comes hurtling toward him... and stops within an inch of deadly impact.           There is an awful moment, as the second car blares on the horn. Traffic continues, but the lingering feeling of dread and confusion is still in the air."
brian,Fuck!
david, We almost died.
brian,"I know. My own death was right there in front of me, and you know what happened? Your life flashed before my eyes."
david,How was it?
brian,Almost worth dying for. Pedestrians continue walking around the honking tangled mass of the near-.accident.
rachel,"The art department needs a decision on the colors. Yellow- and- red, or white? And the board is pissed you're late."
david,"You changed your hair. David taps on the window of the art department, in panic over several cover mock-ups. He gives a presidential thumbs-up, moves on. They look at each other, trying to decipher if the thumbs-up was a decision."
art editor,"Did he mean the yellow-and-red or the white? David passes a holdover from the old days, older Receptionist        who speaks uncomfortably and gruffly into a headset. She gives David a knowing look - late again."
rachel,They're all waiting for you. And David - opinions are expected.
grumpy, How was Aspen?
david," How's it going? He gestures charmingly, easily, and bows with apology over his lateness. All are happy to see him. Sort of."
david's voice,They still look at me like I was still eleven years old.
flashback,"David at          11, blithely skateboarding the hallways. He passes Beatrice, who turns to an editor."
beatrice,He's going to inherit everything. He gets it all. if
mccabe,"You're scared of your dreams, aren't you?"
david,It's a nightmare either way.
mccabe,Is that how do you explain what's happened to you?
david,What --
mccabe,What happened to your face?
david,I'm not talking to you anymore.
mccabe,And you don't want to show me your face.
david,No.
mccabe,Do you know why you're here?
david," The conversation, the coffee --"
mccabe,"David - the part where we parry and joust, and get to know each other bit-by-bit... we're going to have to skip it. You've been charged with murder. In four weeks, a judge will determine your fate based on what I write. You will talk to me --"
david,There is no murder! It didn't happen! I don't have to talk to anybody! A Contentious Prison Guard  swings his feet down and gets up from watching a 17-inch television on a stool. He exits into the bigger room to quiet down David Aames.
aaron,You want me to help -
david,Get the fuck away from me.
aaron,"Take it easy, sunshine."
david,Get the fuck away from me.
aaron,"Take it easy, Face. Your whole story is full of holes! With great power, McCabe advances on the guard. His presence, when he turns on the switches, is considerable."
aaron," I'm gonna get you, Daddy's boy little freak."
david,"My parents are dead, you fuck!"
mccabe,Enough! The Contentious Guard leaves.
mccabe,Is it true?
david, Good cop... bad cop.
mccabe,That you're a Daddy's boy?
david," Primer on David Aames, Senior. My father was not built for the 21st Century. He never ate at"
mccabe,"I've read it. Page  127.           ""David Junior was a delight as a child."" Did I miss something here? Is that all he wrote about you?"
david,"I don't think he ever got over the fact that I was terrified of heights. And when he and my mother were run over by a drunken teenager on New Year's Eve, ten years ago... David Aames moves closer to the light. We see a strange bland expression of his mask, at first other--worldly... and then more clearly."
david,"he left the keys to the Kingdom to me...    51% control,   49% going to a group of seven board members who all thought they were first in line."
mccabe,"And you believe the Board, the Seven Dwarves, put you here to take control of your company."
david,What do you care?
mccabe,"We're just talking. And tonight's Wednesday night, and I go to Black Angus for dinner with my daughters on Wednesday nights, so I'll have to leave soon. You understand that our time is limited, don't you?"
david,"If I talk, you'll just think I'm crazy. McCabe gathers his things."
mccabe,"With all the respect I can offer a man wearing a latex mask and spouting conspiracy theories, David, trust me - you've crossed that bridge."
david,Fine. Enjoy your dinner. Somehow the lilt in McCabe's voice draws him closer.
mccabe,"There are five basic emotions in life. Tell me. what emotion gripped... him... before he entered that cell? Was it Guilt? Shadows. There is no answer, just a rustling and a growing sense of anticipation in the darkness."
mccabe,Hate? Shame? Shadows. Still no answer.
mccabe,"Revenge... McCabe now shows the invisible skill with which he has brought his client to the precipice. And now, with one word, he invites David Aames to look over."
mccabe,"Love? In the darkness, a rustling and the slight turn of a head."
mccabe,"I'm completely on the wrong track, aren't I?"
david,"Who needs ice? Aames moves swirls is more like it - through into his party, which is nicely underway. Upscale. Modern. Part literary crowd. Part fashion crowd.       He's great in a crowd. Surrounded by people, David Aames comes alive."
lynette,David! Happy Birthday.
david,"Jesus, you have the greatest taste in shoes I've ever seen. Bar none. Anywhere. A Woman Caterer in Whites     slips by with a knowing smile."
david,"Emma, do you know Lynette?"
peter brown,The Living Stereo system is online and looking great. it's an
peter brown,"and happy birthday, sir."
brian,Hey man. Happy birthday and all the usual shit people say to each other. How you doing?
david,"Livin' the dream, baby. Livin' the dream. The two friends hug. David shares a quick glance with Brian's date, who still burdened with coat."
brian, Meet David Aames.
david," And to what do I owe this pleasure, the pleasure of --"
sofia, -- the pleasure of Sofia. Serrano.
brian,"We met today at the library, if you can believe that --"
sofia,I'm sorry about my coat. It's too big for your closet.
brian,- we were both pretending to be intellectuals.
david,"No no, I think it's amazing. I love your coat."
sofia,I overdressed. I mean I underdressed.
brian,I'll just continue like you're both actually listening to me.
sofia, Do you have another room to put it in?
brian, I have ceased to exist.
david,"Well, Madison Square Garden is nearby, it might fit there."
sofia, Happy Birthday. Her upbeat physicality is intoxicating. Sofia hands David her present.
brian,We picked it out together. Neither look at Brian. Brian takes a breath. He's been here before.
david,Thank you.
brian,We picked it out together. We...
sofia,Welcome.
brian,Stop flirting and open it.
david,Okay.
brian,Let's get a drink.
sofia,Okay.
david,I'll leave this upstairs. David exits. They are left to consider his personal charisma.
on david,"David is approached by THOMAS TIPP, a Brit, and an Associate board-member at Aames Publications. Tipp is ten years older than David, and he is the rarest of birds. A sentimental lawyer. And at the moment he's a bit drunk."
david,Hey Tommy. David moves to address him so he can still track Sofia.
tipp,"Hey.  Listen to me. Don't blow me off. I'm all packed, I'm going back to London and I understand. You put me up for that other attorney's job, so you didn't have to fire me. A classy move, and your father would have done the same ---"
david,"It's okay, Tommy --"
tipp,"I became incompetent. Is there anything more unbecoming than an aging mascot? I cared about your father. I lived and breathed for him. But these guys, the board, they think you're stupid.  A corporate hazard, a rogue. But the word ""stupid"" is what David heard loudest of all. Nearby, we see a Woman Partner           taking a quick look at David."
tipp,"But they're going to find a way to get you out. They're lined up for your office - David scans the room. Beneath the good cheer, he sees the other layer. Lying. Disloyalty. All part of the institution he enjoys forgetting exists. Each word bashes his soul."
tipp,"-- your job. Your life. Your position. They are working day and night. to cheat you out of your 51% vote. And they are going to sell this tradition, this tradition of words, so they can eat at a better cafeteria. And what they don't know is this -  - people will read again. David's gaze falls upon Sofia, who is looking directly at him. And for one blinding moment, something passes between them. She looks away. He feels saved."
david, I got it.
tipp,"They even have a nickname for you behind your back. David smiles faintly. Understandingly.   Tipp kisses him on the cheek, boldly and drunkenly. He feels like a hero to himself."
tipp,"Citizen Dildo. David flinches, just a little."
tipp,Now you've got great instincts. But I say this with complete love. Claim your life... Learn to be an Asshole... Don't be         -
david, Two's enough -
tipp,Don ' t be-  Okay. Forgive me. I still believe in this family. Even if it's only you. David continues tracking Sofia as he slips over to Peter Brown.
david,"Get Tipp out of here, drive him home, and in the morning tell him he's re-hired with a 50% raise. Set up a meeting with the other attorneys. I'm going to be in early tomorrow --  -- earlier than usual."
julianna,"Hello handsome. He turns to see Julie Gianni in the bathroom doorway, wrapped in a comforter."
julianna,I've come to wish you happy birthday.
david,"I didn't invite you, Julie."
julianna,"Yeah, that was a little weird -"
david,But that's how it works with parties. You have to be invited.
julianna,"I'm mad at you, you dick. We made love four times the other night."
david,Is that good?
julianna,Two is good. Three is very good. But four -
david, Four is pretty good?
julianna,"No, four is... four is... just hold me."
david,Four is what?
julianna,"Hold me, and then I'll leave, and you can go talk to that cute brunette."
david,Four is what?
julianna,I don't want to meet your fancy friends. I knew 'em all back when I was fancy too. He holds her. They talk in between friendly kisses.
david,"Four is what? She pulls away, and talks plainly to him."
julianna,"She looks like a moth, David."
david,A moth?
julianna,"Sometimes I worry about one of these clever girls in a big silly coat who'll play you in just the right way, and I'll lose my friend. And there'll be no more chicken soup parties for you and me."
julianna,"When will you call me? And don't say soon. I hate it when you say ""soon."""
sofia,So this is what's become of rock and roll. A smashed guitar behind a glass case displayed on some rich guy's wall.
david,"It was a gift, actually. She turns and sees it's David, engaging smile in place. She jumps slightly."
sofia," I like it. She turns and walks away, David following close behind."
david,"Whoa, whoa, whoa."
sofia,"- how did you get all this stuff, this apartment, this life - David is looking just over her shoulder. She turns to see an almost disturbingly large portrait of David Aames, Sr. She turns back."
sofia,I see.
david,How about if you help me? Unless I'm horning in here.
sofia,"You are, but the food's good."
david," See, I've got a little problem. I've got a stalker."
sofia,"It doesn't. sound life-threatening. Someone passes, bumping her slightly, into him."
david,I need a cover. I need for you to pretend we're having a scintillating conversation. And you're wildly entertained. I know it's tough.
sofia,I'll improvise    -
david,"She's right across the room and she's burning a hole in my back right now, isn't she?"
sofia,"Red dress, strappy shoes?"
david,Yes_
sofia," -- wow, she's really staring at you."
david,Shit.
sofia,And she seems to be growing... less happy.
david,Hmm.
sofia,"I think she's the saddest girl to ever hold a martini. Julie Gianni sits on the steps watching. The girl, and the dress, looked much happier in the bedroom. Julie rises and begins to move."
on brian,"Brian holds a drink, attempts to crash a conversation between two models. His debonair act is shaky."
sofia,You have another apartment?
david,Sort of a day office. Come on - They arrive at the door to a smaller upstairs apartment.
sofia,I'm not going in there.
david,"Well I am. Goodnight. He enters and shuts the door. Frustrated, she stands for    a moment, listening to the music streaming from the downstairs apartment. We watch her private moment as she decides to leave him, turns, feels the emotional pull, dances back and knocks sharply three times."
sofia,I hear her coming.
sofia,No. David pulls her inside. Shuts the door behind them.
david,We're safe.      And I've got nothing to drink...
sofia,Who did these paintings?
david,This is Joni Mitchell. This one is Monet. And this one is done by me.  It is a snowboard.
sofia,"Well, two of them are geniuses. "
david, It's the real thing. His paintbrush painted that vanilla sky. His canvas. It. was my mother's.
david,You know what I think? You're either a very good actress or you really do sort of like me.
sofia,I am an actress.
david,There's probably not too much you aren't great at.
sofia,"Are you about to compliment, my phone voice?"
david,"It's pretty good, you know -"
sofia,"Oh, I'd only disappoint, you. See - I'm not. qualified. I can spell."
david,I'm surprised you're available.
sofia,I'm surprised you're surprised.
david,I can't keep this banter going.
sofia,"Me neither. Beat. They drop the act. A powerful, awkward moment... and the door opens."
brian,I caught you.
sofia,Brian! Come in here!
david,What's going on --
brian,Your friends are fun and I'm drunk.
david, Julie Gianni is stalking me.
sofia,She looked dangerous.
brian,Nobody stalks me. So I drink.
david,"Well, we're out of drinks up here."
brian,"Here, finish my Jack and Coke. He messily tries to hand his drink to David, but spills it embarrassingly. All his cool is gone, and what's left are his friends covering for him, cleaning up."
david,These stupid glasses        -
brian,"No, it's the stupid guy holding it."
sofia," Don't worry. I'll get. us all something. Jacks and Cokes? She exits, leaving the two friends."
brian,I better hit it. I drank too much and I didn't fucking eat.
david,Don't be stupid. The party's just starting.
brian, For you it is.
david,You can't go. You're my guest of honor.
brian,"Fuck you, David. You're paying me to write my novel, so you own me."
david,"I don't own you. You're brilliant, you're good-looking, you're handsome."
brian,But why'd you have to hit on Sofia?
david,No one's hitting on Sofia.
brian,"Fine. Whatever you say.               I'm crazy, I'm blind."
david,"No, you're not blind. You're just drinking Jack Daniels. And when you drink Jack, you start. in with that Frank Sinatra, ""She Shot. Me Down,"" gimme a cigarette, King of Sad thing..."
brian,That. I do. Gimme a cigarette.
david,I'll find one.
brian,But wait. You're rich and women love you and I'm from Ohio and I'm drunk. Can I tell you the truth?
david,Everyone does.
brian,"I dig her.        And I've never said this to you before, about any girl. But she could be... could be could be could be... the girl of my fuckin dreams."
david,You're not from Ohio.
brian,I know.
brian,But if she fucks tip our friendship - she can go to hell. I won't allow it!         We are bros.
david,I feel the same way.
brian," Sure you do. Brianprepares to leave, as Sofia returns with   drinks."
sofia,Where you going?
brian,I am Frank. And Frank must go.
sofia,Huh?
brian,"I good you bid evening. Sofialooks at her watch, and the situation."
sofia,"Hang on, I'll go with you."
brian,"Stay, baby."
david,I'll give you a lift home later.
sofia,"No, I have to work tomorrow."
brian,"You're in great. hands.  I'm just humoring myself that my opinion matters. Brian looks at the two of them. Life is telling him, and he knows it's time to go. Portrait of a man who will not get what. he wants. David notes the poetry in his friend."
brian," You will never know the exquisite pain of the guy who goes home alone. Because without. the bitter, baby, the sweet ain't as sweet. Have a good time. He exits like a champ, a glorious sad-sack, with a hand flourish."
david,The Sweet and Sour speech again.
david,"A lot of people are scared of heights. It's not the heights that bother me, it's the impact that terrifies me.  I won't stay long. She laughs. It was never his decision to make."
sofia,"Hey Paulo! A large goofy dog comes running at her, and then proceeds to slather David with love too."
david,I'm glad he protects you. This is a lethal canine.
sofia, I love living here. And I refuse to clean up!
david,No problem.
sofia,I've got to work around the clock to keep this place. David eases the dog away as he examines the oddly exquisite dolls. He grabs a look at her in the other room. A bit of leg between boot and skirt.  As he admires the dolls:
david,"So you're really a dancer, huh?"
sofia,"For     14     years.   But I don't dance like you dance. She laughs to herself, steals a look at him. Turns away."
sofia,Do you want something to drink?
david,Sure. David looks at her refrigerator. A note reads: Call Dad! An odd epiphany occurs as he sees the collage of photos
david,I like your life.
sofia,"Well, it's mine and you can't have it. David examines a humorously embarrassing vacation photo of a sloshed Sofia, a guy's arm reaching for her breast. Dedication reads: To Sergio! Marry me!"
david,I do not want to know the story behind this photo. Who's Sergio?
sofia,It's a nickname.
david,Your nickname is Sergio?
sofia,"It's a long story, and we don't know each other."
david,So many secrets.
sofia,That's because I'm really an arms dealer.
david,I've never known an arms dealer.
sofia,You do now. What about you? What's your nickname? David freezes. And then decides what the hell - to tell the truth.
david,Citizen Dildo.
sofia,You're not staying over.
david, Never run a company. Stay an artist. Stay an arms dealer.
sofia,"Oh please. Somehow, I can't play the violin for you.  Although. It must be hard controlling all those people's lives. Everyone at that party is connected to you for survival in some way, it seems. David looks at her, mentally assessing her level of guile."
sofia,Ever been married?
david,"No. Ever accept any of your 12,000 proposals?"
david,And you moved to New York. To dance and paint and act and deal arms.
sofia,Right.  Do you want to hear Jeff Buckley... or Vikki Carr?
david,Jeff Buckley... or Vikki Carr? Both - simultaneously. He continues looking. Flashes of the photos on her refrigerator.
sofia,"Everyone said ""don't go to New York."" But I just think good"
sofia,You think I'm naive. He decides she's for real. He turns back to the photos on her fridge.
david,No. I really don't.
sofia,I have to get to sleep. Truthfully -- I'm also working mornings as a dental assistant.
david," Boy, am I going to the wrong dentist."
mccabe,- actually no I don't. I've been married for twenty-two years.
david,"Ah, you've got dinner with your daughters."
mccabe,That's right. I do.
david,Back then I had intricate systems with women you wouldn't believe.
mccabe,Like... what...
david,Hey Doc. Don't get all melancholy over the thirty seconds you were single a long time ago.
mccabe,That's what you think I'm doing?
david,Yes.
mccabe,"Well, you may have a point. Let's continue. Time is not our friend."
david,Just our shortcomings. That's all we're allowed to draw.
sofia, I've never drawn such a true likeness before.
david,Mine's finished.
sofia,"Already? Hang on. Okay - done. Sofia offers her drawing. It's a caricature of a good- looking guy surrounded by money, cars and very thin girls. He snatches it, studies it, and what he sees hurts him in surprising ways."
david, Jesus. That's how you see me?
sofia,Maybe I didn't add enough money --
david,"No. It's wonderful. It's something you'd see on the wall of a steak-house in hell, but it's wonderful. Sign it. Sofia's face falls a bit. She sees she's hurt him. She takes the drawing and signs it, a little guilty."
sofia,Let's see yours.
david,"No. She grabs it. Its a rich portrait, filled with detail, humor and style. She is rocked by its elegance."
sofia,Wow. I feel bad.  You said to draw a caricature.
david,I know. I couldn't. I saw you like that.
sofia,"Well, it's very good."
david,I'll sell it to you.
sofia,You monster. How much for?
david,One kiss. She smiles. Something is developing between them.
david,That smile is gonna be the end of me.
sofia, And what happens when your friend calls you tomorrow?
david,He only met you a few hours before me. He would do the same.
sofia,I see that friendship is important to you.
david,"It is. But as his best friend, I also know that he's trying to finish a novel about inadequacy and rejection. So the longer I stay, the better it is for his career. Sofia smiles, shakes her head. And yawns."
sofia,Your career is one I'd worry about. David looks down. She's hit a nerve.
sofia,I'm sorry -
david,"No, no. You're more right then you even know. I used to be one of those guys who was just"
sofia,When did you change?
david, About five minutes ago.
sofia, Every passing minute is another chance to turn it all around. David shakes his head a little. Her words strike right to the heart of him.
sofia,What are you watching?
david,"It's the greatest show... it's called ""Sofia."" Sofia looks at him and smiles. They look back to the television."
sofia, I've seen this thirty times.
david,We did a story on this guy. He owns half of Arizona.
sofia,Is he a fraud?
david,How would you ever know?
sofia,Good point.
sofia,"Oh, well that's comforting. It's safe for Benny. I'm in! David moves closer to her."
