Speaker,Dialogue
sofia,"We better watch out. They regard each other, and David gets up off the sofa. It's true. The promise is too great to not savor it, and walk away for now. Thrill remains in the air."
sofia,Where are you going?
david,I left my number on your fridge. He makes a courtly bow and turns. She feels the loss of his company.
sofia,"Come here, I want to tell you a secret. He pauses a moment, and turns. In this instant, a fleeting instant, it's the oddest thing. He can see their entire"
sofia,I meant that to be your forehead. David stands. He looks around the small apartment.
david,"Thank you for the inspiration. I will now attempt to run my company, showing compassion for the seething throng of my partners who root quietly for me to fail. She looks at him, quite aware of his personal and business crossroads. Silently, she roots for him like crazy."
david,For things you don't even know - thank you. I'm going to go to work. I have a company to run.
sofia,"Pleasure delayer. He is still somewhat stunned by the evening, and the girl. He actually wants to run his company."
julianna,"David Aames. David leans on his car, turns and shakes his head."
david,Julie Gianni.     You're following me.
julianna,only a little.    I wanted to finish what we were talking about.
david,And _-
jul ianna,How'd it work out with our Moth Girl? Did she turn into a butterfly for you?
david,Yes she did.
julianna,But I can see from your walk that you didn't sleep with her. David turns.
julianna,Let me see if I can guess. You haven't slept with her because... it's more fun when you can draw it out. Sex just isn't as good if the woman hasn't told all her friends she'd never sleep with you.
david,"You're right on the money, Julie."
julianna,She must be exhausted from trying to be witty for you all night long.
david,"Hey, Julie."
jul ianna,Sorry. You're just never there for your friends until they've already given up on you.
david,"I'm not blowing you off! I just want to be alone for a little bit. Trust me - I have a lot of things I gotta take care of. If we're friends, which we are, you'll understand."
julianna, I'm sorry I got weird. I missed an audition and I just felt bad
julianna,"Do you want to make it up to me? I won't tell a soul. Slowly, he is drawn to her. His old self rallies one last time. He gets in the car."
julianna,Would you do a story about me if I made a CD?
david,Sure I would -
julianna,Do you like my music?
david, It's vivid.
julianna,"If I weren't me, I would buy a CD by me."
david,"Well, you know, if you can reach one person. Julianna is a little hurt, hides it well."
julianna,"What is happiness to you, David?"
david, what is happiness?
julianna,"For me, this is happiness. Being with you. David doesn't look at her. She speeds up, slowly."
david,I didn't tell him that. I didn't say that.
julianna,When did you stop caring?
david, About what --
julianna,About the consequences of the promises you made.
david,Promises         - I thought we had an understanding.
julianna,"Do you know how hard it is to pretend to be your ""buddy?"" I love you, David. You fucked me four times in one night. You have been inside me and I have swallowed your come. That means something."
david,Julie...
julianna,"Four times, David! That means something. Four times. He grabs at the wheel. She won't let go, and speeds up."
david,"stop the car! She picks at things on the dashboard, as she talks with a manic energy."
julianna,Twenty-four hours a day I live with the aching possibility that you might call me to do something.
david," Take me to your house. We'll talk this out. I want to see where you live. I want you to stop the car, Julie. I want you to stop the car!"
julianna,"Don't you know, David? Every time you sleep with someone... your body makes a promise whether you do or not?"
julianna,"Tell me something, David. Do you believe in God? Sweet pop music swells. She bursts the barrier of the winding road, and the car sails into an embankment of a road below. All sound disappears, as we hear a new kind of music. Ethereal, almost wondrous. This music continues."
sofia,Hello. He steals a kiss. They both feel like they're getting away with something.
david,You're amazing. Hello.
sofia,Did you get to work alright?
david,"Yeah, well, actually... I had a horrible dream."
sofia,You dreamed you'd never see me again.
david,"I left your house. I went to the car, and my friend the stalker had been following me."
sofia,Julie.
david,"Yes. She followed me down the street. She wanted to talk, and I had that buzz... from you and me, and I think my mind was on that terrible drawing of me... and, you know, I got inside. And she drove me off a bridge and committed suicide with me in the car."
sofia,I thought you were going straight to work.
david,But I survive! I survive with my arm and my face reconstructed. And what's worse I couldn't wake up.
sofia, How was your house after the party?
david,What party? A party?
sofia,"The PARTY. Remember? Red dress... strappy shoes... I spilled something on your SHIRT... sweet and sour... and the saddest girl to ever hold a martini. He looks at her, completely lost and spacy."
david,I don't... I don't remember.
mccabe,Do you dream about the car accident?
david,"And then... I came back to life. Just like that dog, Benny. Benny The Dog."
mccabe, Benny. Benny The Dog.
david,Except my life was no longer normal. There were blinding migranes now...
david,". nerve damage. Why?        This is how big business operates. A random accident. A ""lifestyle mishap?"" They are not coincidences. How do you think air-tight contracts are broken? These are power upheavals."
mccabe,I'm from Ohio - we don't have power upheavals.
david,"And they're in the news every day, right. between the lines. Someone did this to me. My father wrote this in his book, you know. Chapter One, Page One, Paragraph One. What is the answer to 99           out of a hundred questions? Money."
tipp,"David David David. I don't want to worry you, I'm holding them off. But we've got a situation here. The by-laws of the Board protect your 51% vote only if you're mentally acute. Now I'm sorry that poor girl died, but you've given the Board a real gift with your mishap. They'd like to declare you ""incapacitated."" But you are back, and you sound good to me - so let's fight the fuckers._. and have a full recovery. And maybe you should let people see you. I mean, the last time we were together you were in a coma and you were very fucking rude to me. You didn't say a word. Camera reveals the extent of David's facial damage."
david,"Yes, well, the rumors of my death have been mildly exaggerated."
david,Is that the procedure for all Bilateral Periorbital Hematomas in a LeFort III fracture of a comatose patient?
david,"And beyond the cheek grafts, Dr. Pomeranz is, are the pins fastened"
david,Experiment. Use me.
david,These are more than headaches. This is like a steel plate slicing through my every thought.
david,Because I can't think straight most of the time.
david,Yes. Medication.
david,"This isn't about vanity, Dr. Pomeranz!  This isn't about vanity. This is about functioning in the world."
other doctor,We could do something about your arm --
david,Fuck my arm! Dr. Pomeranz looks over to a young assistant.
david,Tell me. Bring it on.
david,A facial prosthetic.
other doctor," And the plastic in the aesthetic shield also filters out abusive rays, and assists in the regeneration of cells."
david,So it's an aesthetic regenerative shield.
third doctor,And the ergonomics of the plate- barrier allows it to reflexively interact with the movements of your own face.
david,I see --
david,Good. Because for a minute there I thought we were talking about a fucking mask!
david,No it's great. This completely takes care of Halloween. But what about the other 364         days of the year?
david,Sofia. Sofia. Sofia. Sofia. Sofia. Sofia.
david,because nobody's buying books let's invest... my father was an adventurer.
david,Sofiaaaaaaaaaaa. Serrano.
david,"You won't believe this... but this is me smiling. She laughs a little at his strange new humor, keeps a brave front."
sofia,It's been a long time. I tried to see you but your people wouldn't let me.
david,"I didn't want to see me, okay. But then I woke up today and finally, a good hair day. David fights anxiety, smoothes his coat."
david,"You want to go out, you want to do something?"
sofia, Sure.
david,What?
sofia,Let's go out and do something.
david,"This weekend. I'll cancel an operation or two. We'll have fun. Because I am all about fun. She kisses his cheek, pulls back quickly, and as she exits... he sees her fighting tears."
conan," He is thawed out, right? Laughter on the t.v. Riding the buzz of what he's watching, David dials."
david,"Hey listen, it's David. I'm back in your life. I saw you earlier tonight. I was just watching our old friend Benny the Dog on... on Conan... and I thought of you.  Whatever. I loved seeing you today. So I'll see you soon. You're a great dancer! He hangs up and feels instantly mortified. He looks at the phone in his hand."
sofia, Hi!
brian, Hey.
david,What are you drinking?
sofia,Nothing.
brian,I am in the mood for cheap sugary overpriced rum-and-cokes. You want one?
david, Is there any other kind?
brian,I'll go get us some         -
sofia,Where's the bathroom?
brian,"Behind... over by the place next to the door by the chick... I mean, girl who looks like Bjork. She leaves. David turns to Brian immediately."
david,"You look good, man. How's your book?"
brian,Take it off.
david,I can't. It's a facial shield. It's an antiseptic prosthesis to stop infections. These fucking doctors.
brian, Take off the mask! It's freaking me out.
david,I can't. It's my face. This is my face.
brian,Oh no. Trust me. It's a little different.
david,"Hey, if you're embarrassed, just go. Nobody asked you to chaperone"
brian,Sofia asked me.
david,She didn't want to be alone with me?  That's bullshit. Because I think I'm being pretty fucking cool about the whole thing.
brian,"Talk to a shrink!        Or you can call me sometime, instead of hiding in your apartment. Don't take it out on a girl you only met once."
david," Did she say that? I met her ""once?"" Did she say I met her ""once?"" Brian looks away. He's said too much."
brian,Cut it out. I miss the old you. We all miss the old you. Because the new guy is shit. David turns away. The perfectly wrong thing to say.
brian,"Oh. Man. Wait. That came out wrong. I love you - period. How's your arm, man? David shakes his head, moves toward the bar."
david,"Fuck you, Brian. How about no more sympathy? How about if that's the deal we make with each other? Okay? David shakes him off, goes to the bar, and rips off his mask. His head thuds from a migraine."
david,Gimme a Budweiser and a shot of tequila.
barman, What kind of tequila?
david,What did you say to me?
barman, I said - What. Kind. Of. Tequila.
david,"Why don't you ask me to my face, bitch? The barman looks up, expressionless."
david,Patron. If you have it.
david,"Another shot, another Bud. He throws bills on the bar."
barman,No. This is on the house.
david,Why -
barman," It just is. Bitch. David looks across the club to see Sofia. A Clubgoer Guy whispers something in her ear. She shakes it off. He pounds down another shot at the bar, this time with the Barman."
david,"Patron! David regards a video monitor behind the bar. Someone's camera is fixed on Sofia dancing with Brian, and another good-looking Young Man. She playfully shoves the good- looking Young Man away, not unlike the move that won David"
david,Hello again.
sofia,Hello again.
david,"Idea. Let's start all over. He regards her for a moment, sees her apprehension and discomfort."
david,"How about if you help me? Unless I'm horning in here -  You are. But the food is good. He continues, taking a step."
david,"See, I've got a little problem. I've got a stalker.  I need a cover. I need for you to pretend we're having a"
sofia, I don't talk like that.
david,"She's right across the room and she's burning a hole in my back right now, isn't she?"
sofia,"Red dress, strappy shoes?"
david,"That's right! Their heads are close together, looking off into the club. David doesn't notice that Sofia is having a hard time playing along with this game. She is overwhelmed, holding it in. David continues."
david,I think she' s the saddest girl to ever hold a martini.
sofia, David --
david,Are you okay?
sofia,No.
david,What's wrong? Is it me?
sofia,I'll tell you later.
david,Come on. Tell me now. Something's wrong. Tell me everything. Let's talk about it right now.
sofia,"I'll tell you in another life... when we are both cats. David looks at her. His eyes flash at her choice of words. Perhaps there is hope. Sofia stares at. him, worried about his sanity as he goes overboard with his praise of her turn of a phrase. Push into close-ups as they struggle to deal with the discomfort of this moment."
david,"I don't believe you just said that. That. is the best thing I've ever heard. That is hilarious. God, that just killed me. The way you said that. See - that's what I love about you. ""I'll tell you in another life when we are both cats."""
sofia,"Well, this is where I leave you."
brian,Wait. I'll walk you to your door.
sofia,"No, I live just around the corner."
brian,I've got my bike here.
sofia,I'd rather walk.
david,Don't be a drag. Can't you see she wants to go on her own?
brian,"Shut up, you're drunk."
david,"I may be an idiot, but I'm not drunk."
sofia,"Seriously, I don't need you to walk me home. Thank you."
brian,Okay then. So. We'll call you.
sofia, Great. We'll go catch a movie or something.
sofia,So. We'll meet up soon. The word sounds a lot like goodbye and they both know it.
david,We'll meet up soon. Sofia turns and runs away.
david, We'll call you again to go out with me!
brian,We'll call you. David and Brian walk on. Brian turns back to see Sofia running to the corner.
brian,"Well, it's been a real blast, David. I bid you good evening."
david,Where you going?
brian,My bike. It's back over there. We'll hang soon. Bring your mask if you want. I'm getting used to it.
david,Wait a minute.
brian, What?
david, I don't know.
brian,You drank a little too much. Call me tomorrow if you want.
david,Tomorrow I'll wish I was dead.
brian, No you won't. You just need to sleep.
david,Hey!
brian, What!
david,What did you say to Julie Gianni the night of the accident?
brian,What?
david,"You told her she was a ""fuck buddy."""
brian,Never.
david,And she was a little more than pissed about it.
brian, Have you been harboring this shit all along? I never talked to her.
david,"Whatever. I mean - who am I, if I can't. be the one who tells you you're not ugly? Aw, give me a courtesy laugh. Come on! Brian shakes his head, starts running."
david,"Brian!! I'm so fucked up. I'm just so fucked up! Brian stops one last time, irritated, at the far end of the street."
david,We're best friends! We're bros! Brian needs to rid himself of David. He turns and runs in the direction of Sofia. David feels the deep pangs of rejection. Breathing hard. His head hurts. His body hurts.
david,"Come on, man, we're bros. Beat. He sprints down the middle of the street after Brian."
his mind,"Brian catches up to Sofia. She turns, relieved. They kiss messily, hungrily. Her shoes arch to reach his height. David runs the streets, nearing her home. The images are tearing his mind apart. He stops and leans against a car, unsteady and nauseous. Holding his head in pain, he manages to run further. David stops on the street outside her apartment. His sobs overwhelm him. He drops to the pavement. He passes out, mouth agape. The empty street visible in the b.g., his hand loosens its grip on the mask."
woman's voice,Open your eyes... open your eyes...
woman's voice,This is a cheap ploy for sympathy. David wakes up and looks into the kind face of Julie Gianni.
julianna,"Boo! He recoils. His vision sharpens. In the morning shadows, with increasing focus, we see that it is actually Sofia."
david,"No, I'm okay -"
david pov,Sofia examines him with a look of concern and understanding. Everything takes on a clear and sharp focus. Behind her is a beautiful vanilla sky.
sofia,And it worked. Get up.
david,Ugh -
sofia, That's right. I agree. Ugh.
david,This is a joke.
sofia," David. I'm not going to lie to you. I liked the way you looked. But if you don't pull it together, I'll forget the other guy. You know that. other guy - YOU?"
david," I'm still that guy. I'm still that guy. Sofia speaks with rapid-fire conviction, as if she might change her mind if she thought about it too much."
sofia,I don't. have a mother-savior bone in my body. It's not about that. You're coming inside. But if this
david,I am still that guy.
sofia,Shut up.
david,Where's Brian?
sofia,"He went with you, didn't he?"
david, I thought you guys hooked up. She stops in profile with him. She's astonished at his jealousy. Then:
sofia, I wish you hadn't gotten in the car with that girl.
david," Sofia... I'm... She covers his mouth, nose and face. Only his eyes remain."
sofia,"Your eyes apologized better. Come on. Portrait of the two, her leading him to the door, the crisp glycerine morning overhead."
sofia,"Holy God, this is going to change my life in a zillion different ways... I must be nuts."
mccabe,"I see you haven't been wasting your time. Do you ever draw anything else? All the drawings are of Sofia, drawn in a similar fashion. David is a little jumpy, a little amped. He moves to the window. The yard is filled with prisoners."
david,No.
mccabe,Did you sleep last night.?
david,No. I did not sleep.
mccabe,"I've got to leave early today, so you'll have to be brief. Now. What can you tell me about the name ""Ellie?"""
david,Ellie?
mccabe,Is that a girl you knew? A girl you were in love with?
david,I've only been in love once.
mccabe,"Apparently, you kept repeating it last night. You did sleep, David, and your advisor said you cried out, you had a nightmare."
david,Everything is a nightmare --
mccabe,"You cried out for ""Ellie,"" David. Do you remember what happened?"
david,No... no...
mccabe,"Dig deep, David. Dig deep. You cried out for Ellie. What do you remember about Ellie? Show me your face, David. Help me. Open the door. David rises and goes to the prison window. ANGLE ON McCABE In powerful framing, lower shot capturing him powerfully."
mccabe," They did fix your face. Take off that mask, David. You'll see your face is perfect under there."
david,"I never trusted the Doctors. What happened next was surreal. That same arrogant bastard, Dr."
david,"He'd discovered a new form of reconstructive surgery, with the help of a doctor from Berlin."
david,The next thing I knew they shot me full of drugs I'd never heard of and away we went.
mccabe,Suspicious of whom? Of what?
david,"Once you've been driven off a bridge at 80 miles an hour, somehow you don't invite happiness in without a full body search."
mccabe,"Well, at the risk of boring you, I can present the alternate argument. I once knew a guy who was a real loner. And one day he woke up at 40, with two daughters who lit his life up with purpose. Suddenly he goes to endless school plays, he gets home at       9:20                  for the evening discussion, and he has the time of his life. His favorite Beatle was once John, and now it's Paul."
david,I always liked... George.
mccabe,"It all depends on the individual, doesn't it? Tell me. What's happiness for you?"
julianna,"What's happiness to you, David?  INT. PRISON PSYCHIATRIC UNIT - NIGHT - BACK TO PRESENT"
david,How about another question -
mccabe,"Well, you won't show me your face. So back to the time-line. Hurry. Let's move through this."
sofia,"You've got to take the plates off, David."
david,I don't want to know what's under here.
sofia,"It's going to be fine, you'll see."
david,I already called Pomeranz and switched it to Wednesday.
sofia,I hope that shrew at the front desk gave you shit about it.
david,"I'll go in the morning. The car'll be fixed. She advances, takes his face in her hands. She tugs at the corner of one of the plates."
sofia,"Good, because I know that the problem wouldn't be you delaying something you were dreading."
david,Couldn't be that.
sofia,"Nooooo, it couldn't be that. She pulls off one of the plates."
sofia,"I mean, I agree, it's very important to have... She pulls off another one of the plates. She grows a bit emotional."
sofia,. the right car... She pulls off another one of the plates. Tearing slightly.
sofia,". to take you where you want to go...  24   hours a day... Quadrant by quadrant, his face is restored to a pale- skinned and tender... perfection."
david,How bad is it?
sofia,"Well, your ears are in the right place. And the rest of it is... not too bad at all. Tenderly she kisses, and hugs him."
sofia,"Do you love me? I mean, really love me... because if you don't, I'll just... have to kill you."
david,In my next life I want to come back as this mole -
sofia,I love you. I love you. I love you.
david,- I could live right there.
sofia,Is this a dream?
david,"Oh absolutely. She grabs his face, kisses him... a powerful moment, like few others in this life."
brian,"What, did she say?"
david, I have no idea. Brian shakes his head.
david,"How's things, Brian?"
brian,Fine. David's face is huge in the Brian's viewfinder.
david,"How's things, Brian?"
brian,"Don't flatter yourself. I'm fine. Besides - Sofia is great, but by no means one-of--a-kind. She was a proximity infatuation. Brian, naturally suspicious and somewhat jealous,             spots  a writer at a nearby table making notes."
brian," And don't use that, it's mine. The writer looks busted."
david,Where'd you get the camera?
brian,I'm into things... you have no idea.
david,"Well, as long as you're okay."
brian,"And anyway, we're friends, aren't we?"
david,Always. David offers his hand. They shake.
david's pov,"David's gaze moves to a 40 year-old man staring at him with a bemused smile. A plate of food sits in front of him. His eyes suggest a piercing intellect, he looks at David with deep familiarity. David can't quite place the face."
brian,"Hey what's up with your face? Fuck, there's a seam opening or something!"
david, What - what are you talking about? Brian laughs. The spell is broken. Friends again.
david,You asshole!
sofia,Was I snoring?
david," No, I think it was me. Thirsty, that's all. She kisses his hand reassuringly."
sofia,I'm dreaming about you. Mmmmmmm. He gets up and goes to the bathroom.
david," I could listen to you say ""mmmmm"" for the rest of my life."
sofia,"They kiss. The kiss expands, as he moves to the back of her neck. He caresses her body. She kisses his fingertips. Her back to him. Tangled in sheets, they ease into lovemaking with the perfect fit of two bodies meant for each other. He gently grabs a handful of her hair. His hand stops.   It's not Sofia's hair. He slowly turns her face to his, and we glimpse David over the shoulder of the woman who is not Sofia. He leaps out of bed, falling to the floor, the sheet tangled around him. He turns on the light. Julie Gianni hides her face from the light, like a night animal caught in the intrusive glare of day. When she speaks, it is with Sofia's cadence and accent."
julianna," Baby, what's wrong? He gasps for breath, backing away. Totally terrified. Paralyzed. In a low voice:"
david,Where. Is. She.
julianna,Who? His instinct is to protect his lifeline Sofia - and he pounces on her with a manic will to survive.
julianna, I'm Sofia.
david,"Now I'm going to make sure that I tie this four times. Do you know why, Julie? Because four times really means something. David pulls his pants on, frantically opens the wardrobe closet. No Sofia. Goes to the kitchen. No Sofia. Julie sobs quietly, sweetly, tied to the bed. She behaves and acts like Sofia."
julianna,"David, don't hurt me. David returns and sits across from her on the bed, terrified and barely hanging on."
david,"Okay, I'm freaked out. It worked. So just tell me right now - where is Sofia?"
julianna,I am Sofia.
david,In one minute I'm going to call the police --
julianna," Don't do it, honey."
david,I knew you'd survived the accident. She looks at him with tearful eyes.
julianna,What. accident?
david,Whose body was it? Who's the one who hired you? The Seven Dwarves?
julianna,I haven't had any accident!
david,"No, of course not. It wasn't an accident at all. It was attempted murder!"
julianna,"Honey, please."
david,Police Department? I've captured an intruder who's entered my home. He turns to her. Her eyes are yearning.
tipp,"Guys, can you give us a minute here? Detective Larson... Detective Andrews... thank you. The room empties, and Tipp approaches David."
david,They think that I had something to so with this.
tipp,I'm going to handle this exactly the way your father would have handled this. I've got it solved.
david,You've got it solved? Where is she?
tipp,She's going to be fine. David hugs Tipp.
david,"Thank God you're here, man. I love her."
tipp,"Yeah... Now, I want you to look at these photos and then I'm going to destroy them. Sofia's testimony is also in here. It won't exist. She's not going to press charges."
david,Press charges against. me?
tipp,"David, wake up. As your friend, I think you should see what you did to Sofia. The press won't get hold of this if you get. away quickly. David leans back in his seat. It's all of them - everybody - against him. Tipp opens a file thick with paperwork, two computer discs and photos. He displays a photo to David, moving it into the light so he sees it clearly.              Julie Gianni, battered."
david,"This is Julie Gianni. That's not Sofia. This is Julie Gianni. I didn't do that do that to her.  Tommy, someone's setting me up."
