Speaker,Dialogue
tipp,"David, the Board and I have taken care of everything. They've been really great, actually. All of this is going to disappear. We're all behind you... even the Board. David looks at Tipp. It's very clear now. He's one of them. David attempts calm."
tipp, Get out of here. A migraine is thundering in David's head. His world is spinning backwards.
brian,"You're in fucking sad shape, man. Don't fucking ever hit a girl, man. Hit me, but don't fucking EVER hit a girl. David looks up -- sees a small security camera trained on them - pulls Brian out of the station."
david,It wasn't Sofia. It was Julie.
brian,"Oh... it was Julie Gianni. So, Sofia was abducted by Julie, and now Julie is posing as Sofia."
david,Yes.
brian,"You're in O.J. land, man. Julie Gianni is fucking dead!"
david,"I don't know what the cops have told you, but let me assure you - Julie Gianni is alive alive ALIVE."
brian,I didn't talk to the cops. I talked to Sofia!
david,Where is she?
brian,I just dropped Sofia off. And I saw everything you did to her.
david,"Let me tell you something - I did not do that to her. Look me in the eye and tell me that it was the same girl you brought to the party. Tell me it was your dream girl, your ""proximity infatuation."""
brian," Yes! And you stole her from me! David backs away, as Brian responds bitterly, from his heart."
brian,"The one girl I really wanted, and you took her from me. You're insane. You're losing it, man. David nods powerfully. He now understands. Brian is one of them too."
david,You have revealed yourself.
brian,"Oh yeah, I'm with them."
david,"Where'd you get the coat, Brian? Where'd you get the camera? How much did they pay you?"
brian,"Listen to me, 'cause it's the last time we're ever gonna speak. I was your only friend."
david,You have revealed yourself to me.
ventura,Problems?
david, I'm in no mood to be fucked with. So do yourself a favor and le -
ventura,"There's an explanation for all this, David."
david,Who the fuck are you?
ventura,You and I know each other. You found me on the Internet. Silence. David stares at the man.
david,What do you want? Why are you following me?
ventura,"I'm here to help you. And first of all, it's very important that you calm down."
david,Calm down?
ventura,You must overcome your fears and regain control. Take hold of your life again. It's as easy as holding that glass. What if I told you that you can take control of all of this... everything... even me... David turns to him.
david,"Look. I'm straight, okay?"
ventura,"David, look at these people. It seems as though they're chatting away, doesn't it? Nothing to do with you -"
ventura,"-- and yet, they might only be here because you wanted them to be. You are their God. And not only that, you could make them obey you... or even destroy you. David shakes his head, exhausted and in no mood. He shuts his eyes, fights off a headache."
david, What I'd like them to do is shut up! Especially you! Silence. David opens his eyes. They're all staring at him. Casually waiting for orders.
ventura,"You see? David looks at him with horror, backing away. Receding in his vision:"
ventura,"You and I signed a contract, David."
mccabe,Who is the man in the restaurant? Who is it?
david,I can' t.        --
mccabe,Can you tell the difference between dreams and reality?
david,Of course. Can you?
mccabe,"Think about it. Think with your head. You signed a contract, did you not.?"
racing thoughts,"A woman walks down the hallway, looking back. Flash   of papers signed."
david,I signed something.
mccabe,Was the man at the restaurant there? McCabe's voice becomes infinitely calm and helpful.
david,Fuck!
mccabe,Accept your body's resistance. Let your head answer.
david,Yes.
mccabe,That's right. Who is Ellie?
david,I... I don't know what's real.
mccabe,"What happened that night, David? Somebody died."
david,I don't want to remember.
mccabe,Do you understand that you hold the keys to this prison?
david,It wasn't Sofia.
mccabe,Who was it?
david,No.
mccabe,Who was it?
david,No!
mccabe,"You want to let it out, don't you David? You're about to tell me. Tell me what your heart and soul will not allow you to forget. David shudders. It's coming."
mccabe,"Did you kill Sofia? McCabe stands tall, stunned and curious, still pressing to pull the nightmare out of him."
julianna,I thought you were a vandal.
david, Who... are... you?
julianna,I'm Sofia.
david,You are not Sofia... you're not Sofia...
julianna,I'm Sofia.
david,"Whatever. Julie starts to cry. Battling tears, she offers her heart and soul."
julianna,"David, honey. This will all be over soon. We'll be together again. You'll forget Julianna and I won't be afraid of you. Let me get you a cold towel. She exits. He struggles to rise. His head is a swirling mess. And then:"
david,Sofia?
sofia," Yes, David, I'm Sofia. I'm Sofia. He accepts it, all of it, whatever it is, just to hold her. They kiss, gently, then more powerfully."
david,"Where were you... Sofia doesn't answer, doesn't want to lose the moment."
david,"I don't want to know.  Just tell me you love me. David keeps his face buried in her shoulder'. He doesn't want to look. The passion gives way to a mounting dread, as he hears a voice almost like Sofia's."
david,What the fuck is happening? Julie begins to react to what is clearly no longer an advanced lovemaking session.
david,I want to see your face! She grabs at the pillow.
david,"I want to see your face! David reaches orgasm, sobbing, recklessly out of control. Julie's body stops kicking and settles into silence. He loosens the pillow, and is rewarded with one last violent attempt at life. Her hand smacks his neck. He's so taut it bounces off. She grabs at his face one last time, her hand is left with enough power only to caress his face. She goes limp. Silence. David's crying turns to a whimper. He looks at the pillow over Julie's head. He's confused, a puddle of jagged adrenaline. He doesn't want to remove the pillow for fear of who could be underneath. He rises up, his elbow across her lifeless chest. With true horror, he knows he has to move his hand, but his hand will reveal who he's just killed."
david,"I did it, didn't I? I don't... feel... like I killed someone. I feel like..."
mccabe,"David, who..."
david,I'm in a dream...
mccabe,. was the man at the restaurant? David shakes his head.
mccabe, Do you know what derangement is?
david,I need your help.
mccabe,"All I know is, you killed your girlfriend and I don't know what's in your mind."
david,I need your help.
mccabe,"I'd work on this case forever if I could, but we've run out of time."
david,What will you plead?
mccabe,Temporary derangement. It's your best chance. They won't believe me.
david,What do you believe?
mccabe,"Believe it or not, I care about you. You've become like family to me. I don't want to give up on you. David looks at, him oddly. Suddenly, the archetype seems very familiar. McCabe continues with the noble concern of a towering father figure."
mccabe," But I needed more. I needed an answer. I... I even thought there was more than a good chance someone was playing tricks on you. Maybe it was the board. But I can't exceed my duties here. I'm just a psychologist, and I have to leave you."
david,Will I see you at the trial?
mccabe,No. I'm just the opening act. He exits. David sits at. the table as McCabe and Aaron exit. He hears Aaron's television; it's the Life Extension Infomercial.
david,McCABE!!! McCABE!!! COME BACK!!!
mccabe," Life Extension Corporation, please."
guard,What -
mccabe, L.E. We hold a court order.
david,"I think I've been here before - McCabe strides purposefully past the Building Guard. Aaron shows the pass, and hustles to keep up."
day,The elevator door opens to reveal a very pleasant and peaceful environment. Comfortable lounging chairs. On the reception station is written - L.E. and underneath it the words: Life Extension Corporation. Two more Guards meet
david,Her name is Libby. A stunning young woman rises and moves to greet them.
libby,Good morning. I'm Libby. I'm here to assist you. Libby stares at David's masked face. It's slightly unsettling to her.
mccabe,He's my son. He's very shy.
libby," You're not. with the media or part. of any legal consortium, correct?"
mccabe,No.
libby,"Welcome to Life Extension. Have a look at our proposal. Please follow me. She-offers them two bound folders featuring the logo - L.E. - and guides them down the hallway, looking back with great style, beckoning, just as in David's dream recollections."
mccabe, You can wait out here.
libby,You'll be meeting Rebecca Dearborn.  My personal role model.
mccabe," ""Cryonization - a journey of re- awakening after the preservation of the human body at extremely low temperatures."""
david,They laughed at Jules Verne too.
mccabe," David, you're not- Account Liaison REBECCA DEARBORN enters with paperwork. She is an electric presence. Efficient, caring and oddly compassionate."
dearborn,"Mr. McCabe, how are you? I'm Rebecca Dearborn.  Life Extension, or L.E. as we like to refer to it, is a glimpse of the future... a ticket... not in the juvenile sense, but in the deeply meaningful sense that can only be borne in the human heart."
dearborn,"Within an hour of your passing, L.E. will transfer your body to a vessel where you will be sealed and frozen at     196                   degrees below zero. Power outages, earthquakes, nothing will effect your suspension-hibernation."
mccabe,"Did you sign this contract, David? David looks down at pamphlet, looks up."
david,"What's the ""Lucid Dream"" option?"
dearborn,"Good choice. The Lucid Dream is Life Extension's newest option. For a little extra, we offer the cryonic union of science and entertainment."
mccabe," ""Cryo-tainment. "" Dearborn spreads apart the paperwork on her desk to reveal a thin Video Monitor built into the glass table-top. Aames and McCabe peer into the table--top as Dearborn presses play."
dearborn,Some find this presentation helpful.
narration,"Portrait of a modern human life. American, male.  and Death. Imagine that you are suffering from a terminal illness. You'd like to be cryonized, but you'd rather be resurrected to continue your own life, as you know it now. L.E. offers you the answer. Upon resurrection you will continue in an ageless state - preserved - but living in the ""present"" with a future of your choosing."
narration,"Another chapter begins seamlessly, a living dream. Life Extension's promise to you. Life -- Part Two."
dearborn,A living dream.
mccabe,"Your death will be wiped from your memory. I guess I missed that one in USA Today. David sits, reeling from the revelation he may be living a Lucid Dream."
david,. a dream... What if there was a mistake? What if the dream became a nightmare?
dearborn,"Of course, your subconscious can always play tricks on you. The subconscious is a very powerful thing -"
mccabe,"Did you sign a contract with these people, David?"
dearborn, -but this is a serious business. The Lucid Dream is worth the risk.
dearborn,"I love you, David. Te Quiero. Roam free, David. Most of us live our whole lives with no real adventure to call our own. It's hard to comprehend-but they laughed at Jules Verne too."
david,I want to wake up! I want to wake up! Aaron grabs for him. David wrenches free.
david,It's a nightmare! The doors shut. Music rising.
david,Tech Support!! Music stops. We hear the ding of the elevator.
ventura,"David Aames. I think it's time we had a proper re-introduction. I'm Edmund Ventura from the oasis Project, formerly Life Extension --"
david,Tech support.
ventura,"Yes, I'm your Tech Support. We first met      150   years ago."
david,Oh shit. You sold me the Lucid Dream. Ventura smiles.
david,"Well, what the hell happened?"
ventura,"I tried to warn you in the bar. I told you to exercise control, that it all depended on your mind. All of this, everything is your creation. And we're now heading toward your true moment, of choice."
david,"""True moment of choice?"""
ventura,Yes.
david,When did the Lucid Dream begin?
ventura,Remember the day of the nightclub?
david, Yes.
ventura," That night, when Sofia left you and you fell asleep on the pavement, that was the moment you chose for the splice..."
david, The splice?
ventura,"Splice. The end of your ""real"" life and the beginning of L.E.'s Lucid Dream. A splice of many years which passed while you were frozen and dreaming."
sofia,"Open your eyes. They walk away, down the street, into a beautiful Vanilla Sky. Sofia slips her arm around his shoulder, as we've seen earlier."
ventura,"From the moment you woke up on that street, nothing was ""real"" in"
ventura,Forgive me. I'm blowing your mind. David looks down with dread.
david,I'm not a big fan of heights.
ventura,I know.  We erased what really happened from your memory.
david, ..erased?
ventura,Replaced by a better life under these beautiful Monet-like skies.
david, My mother's favorite.
ventura,That's right.. A better life because you had Sofia.
ventura,And you sculpted your Lucid Dream out of the iconography of your youth.
ventura,An album cover that once moved you...
david,An album cover?
ventura,a movie you once saw late at night that showed you what a father could be like...
ventura,or what love could be like...
ventura,"This was a kind woman, an individual, more than your equal. Ventura nods wistfully. He fell in love with her a little, too."
ventura,"You barely knew her in real life, but. in your Lucid Dream, she was your savior."
david,What happened in my real life? Something happened. What did you erase?
ventura,Do you really want to know?
david,Tell me everything.
ventura,"The morning after the nightclub, you woke up on that street, hung- over and along. You got up and walked away. You never saw Sofia again."
david,I didn't kill Sofia.
ventura,No.
ventura,"You battled your board, the Seven Dwarves, for control. In the end it was Thomas Tipp, your father's"
david, But then... somebody died.
ventura,You longed for Sofia. You shut yourself away for months. You were alone. You couldn't take the pain anymore. Headaches... you could barely function.
david,I found you on the Internet. I signed the contract with you. And then...
david,"I remember... It comes back to him, powerfully."
david,Somebody died. It was me.
ventura,"And on a day in late December, you gave yourself to us. You're now in a suspended state."
ventura,Your friend Brian Shelby threw a three-day memorial in your old home. He was a true friend.
ventura,"You were missed, David. She moves into close-up, and we see the wonder and the joy of a perfect love, nearly attained. She soaks in the beautiful, painful mystery of life."
ventura,"It was Sofia who never fully recovered. It was she who somehow knew you best. And like you, she never forgot that one night where real, true love seemed possible."
ventura,"Consequences, David. It's the little things."
david," The little things. There's nothing bigger, is there?"
ventura,Your subconscious did create problems. Your dream turned into a nightmare. The glitch has been corrected.
david,"So all I have to do is imagine something? If I wanted McCabe to come back, right now - McCabe comes flying out of the door."
mccabe,David. Listen to me. These people are dangerous. We're in trouble. We need to get off this roof now.
mcc david,Who turns from McCabe to Ventura. Ventura leads David away.
ventura,"We're now on ""pause"". And you're about to return to your Lucid Dream..."
mccabe,"""Pause""?"
ventura," .. with all of the upgrades. You won't remember any of this, nor be charged for the technical support. it is now your moment of choice. You can return to your Lucid Dream, and live a beautiful life"
david,"The world out. there. And you can bring me back, just. like Benny the Dog."
ventura,"Yes. Just like Benny the Dog. Your face and body can now be fixed, of course. But it's very different out there now. Your finances won't last long. Your panel of observers are waiting for you to choose. Ventura gestures into the camera. He begins walking backwards to the roof's ledge."
ventura,"There are no guarantees. But remember, even in the future, the sweet is never as sweet without the sour. David sees that Brian Shelby has now joined McCabe on the roof. He nods to Brian, who nods back."
david,How do I wake up?
ventura,The decision is yours. Ventura glances over the edge.
david,"And I chose this scenario, didn't"
ventura," Yes, to face your last remaining fear of heights."
mccabe,"David, don't listen to him. You were right. This is the Seven Dwarves. It's a set up! You can't trust him. David looks at McCabe with compassion."
ventura,"Don't feel bad, David. This winning man is your creation. It's in his nature to fight for his existence. But he's not real."
mccabe,I'm real. I have two daughters. You know that.
ventura,What are their names?
mccabe,"Mortality as home entertainment. This cannot be the future. Can it? David regards McCabe. Once dynamic, McCabe now seems unsure of his own existence. Slowly, always looking at David, he settles into the truth of his very being. With great nobility, McCabe shoves his hands into his pockets and faces his own destiny... or lack thereof."
mccabe, Goodbye.
ventura,"It's been a brilliant journey of self-awakening, and you've simply got to ask yourself -- what is happiness to you?"
david,I want to live a real life. I don't want to dream any longer.
ventura,Any last wishes?
david,Let them out there read my mind.
ventura,"I wish you well, David. Music rises as he turns to see Sofia. He moves to her. She touches his cheek. His face is restored. They embrace."
david,"Look at us. I'm frozen, and you're dead. And I love you."
sofia,It's a problem.
david,"I lost you when I got in that car. I'm sorry. She looks at him, beguiling and understanding."
david,But remember what you told me once? Every passing minute is another chance to turn it all around. She kisses him.
sofia,"I'll find you again. She regards her lost love, taking him in. David treasures his last moments with her."
david,"I'll see you in another life when we are both cats. David backs up and begins to run. He arrives at the edge, looking down at the distance to the ground, stopping himself at the precipice. He looks back to Sofia one last time, and then leaps out into the celestial future. For a fraction of a moment, he is suspended in mid-air. And he hurtles to the ground. And the ground hurtles to meet him."
