Speaker,Dialogue
jackie,Kyle he needs to be at Oak Knoll.
mike,"Kyle, we talked about this."
kyle,Yeah. We did! Listen to this.
jackie,What is that?
kyle,It's from the court.
jackie,Where did you get this?
kyle,"From my mother.  It's true isn't, Mike?"
jackie,Mike?
kyle,You're just like her.
mike,"Hey. Hey, Kyle."
kyle,Leave me alone!
mike,Kyle please. 5/15/10 - FULL SHOOTING SCRIPT - WIN WIN 109 CONTINUED:
kyle,Don't touch me!
terry,Oh shit.
mike,Would you let me explain?!
kyle,Explain what? How you lied to me? How you lied to Leo?
mike,Kyle I don't want to wrestle you.
jackie terry,"Kyle, stop for a minute. Keep your hands out, Mike. Hands out."
jackie,"Terry, stop it!"
terry,I'm just trying to help.
jackie,You're not helping.
mike,I'm trying to stop it!
terry,Sit out Mike! Sit out!
jackie mike,"Shut up, Terry! Kyle, stop it!"
jackie,Would you stop coaching and break that up!
terry,I'm the ref. I'm just the ref!
jackie,Kyle! Stop! Please!
mike,"Yeah, it is."
jackie,So why'd you move him if he wanted to stay here.
mike,Because it would have been too much work to leave him here. I couldn't have done it.
jackie,Then you shouldn't have taken him. 5/15/10 - FULL SHOOTING SCRIPT - WIN WIN 111 CONTINUED:
mike,"I had to, alright?"
jackie,Why?!
mike,Because I needed the money! We needed the money.
jackie,You moved an old man out of his house to make money? Have you lost your freaking mind?
mike,No! I just didn't think it would get this complicated.
jackie,Really? Or you just didn't think you'd get caught?
mike,"Jack! Jack, where are you going?"
jackie,Home!
kyle,Hello. Hello. Mom?
stemler,Did your mom just crank call you?
kyle,No. 5/15/10 - FULL SHOOTING SCRIPT - WIN WIN 112 CONTINUED:
stemler,So you and Coach Mike get in a fight because you lost?
kyle,No. We got in a fight because he's an asshole.
stemler,Really?
kyle,"Yeah, really, Stem."
stemler,"Well I'm sure he'll make it up to you, bro. You're the best wrestler he's ever had. I mean he's always been cool to me and I suck."
mike,Hey Leo.
leo,Hi.
mike,I fell asleep. I'm sorry.
leo,Sorry for what?
mike,You want to go home?
leo,Yeah.
jackie,Hi.
mike,Hi. Is he here?
jackie,No. He slept at Stemler's. How about you?
mike,"Oak Knoll.  You're right, that's not who I am."
jackie,So what are you going to do?
mike,I have to go court.
jackie,You can't. You told the Judge you were keeping Leo at home.
mike,I know.
jackie,So then tell her you changed your mind. No one can question that.
mike,"I can't, Jack."
jackie,Why not?
mike,Because it's not true.
jackie,"Well I'm glad your done lying now, just in time to lose your practice. That's how we survive, Mike. Your family. You ever think of that?"
mike,Yeah. All the time.
jackie,Shit.
mike,"I'm sorry, Jack. I really am."
jackie,I know.
jackie,Hey Kyle. How'd you get down here?
kyle,The window.
jackie,Are you hungry? I was gonna make some pancakes.
kyle,No. I'm leaving. I just came to get my shit.
mike,"Kyle, listen, I just wanted to say I'm sorry..."
kyle,"I know, Mike, you're sorry. Everyone's always sorry."
mike,"I moved Leo back home, Kyle. And I'm gonna fight to keep him there."
kyle,It's too late. You'll lose. My mother's gonna take him. 5/15/10 - FULL SHOOTING SCRIPT - WIN WIN 115 CONTINUED:
mike,Maybe but I'm still gonna try.
kyle,"So what?! You want me to forgive you now? Is that it, Mike?!"
mike,No. I just want you to give me another chance. That's all I'm asking.
kyle,This is bullshit!
mike,"Hey, Kyle, listen -"
kyle,I want to be alone.
mike,What?
kyle, I JUST WANT TO BE DOWN HERE ALONE!
mike,OK. All right. Yeah.
jackie,"Kyle, I just wanna say - we love you."
terry,Hi guys.
mike,What are you doing here?
terry,"Dude, I'm your assistant coach. And just notice who isn't here."
mike,"Yeah, I got it."
eleanor,Mike?
mike,Hi Eleanor.
eleanor,Can I talk to you?
mike,Sure.
eleanor,You know the transcript alone is enough to hang you.
mike,"Yeah, well, we'll see what happens."
eleanor,Shame on you counselor.
mike,Is that it?
eleanor,No. My client would like to talk to you.
mike,Hi Cindy.
cindy,Hi. Is your deal still available?
mike,What about Kyle?
cindy,He can stay.
mike,Then yes. It is. 5/15/10 - FULL SHOOTING SCRIPT - WIN WIN 118 CONTINUED:
cindy,And you'll send me the checks?
mike,Every month.
cindy,You take good care of him.
mike,We will.
cindy,I want to say goodbye.
stemler,I know. Don't rush me.
mike,Hi guys!
abby,"Hi, Daddy. I'm winning. 5/15/10 - FULL SHOOTING SCRIPT - WIN WIN 119 CONTINUED:"
stemler kyle,"What's up, coach? Hi."
mike,"That's great, honey. Kyle, can you drag those garbage cans to the side of the house for me?"
kyle,OK.
mike,"Thanks, pal."
mike,Hi Honey.
mike,Good. I got stuck at the office with a client.
jackie,"I know, Shelly called. Oh, I dropped off the fan at Leo's today."
mike,Thanks for doing that.
jackie,Do you have time to eat.
mike,I'll eat there.
jackie,Make sure you do. 5/15/10 - FULL SHOOTING SCRIPT - WIN WIN 120
terry,"Can I get a banana daiquiri, please?"
mike,Sure.
terry,Nah. I'm good. But keep these coming.
mike,Me? I'm pretty good.
