Speaker,Dialogue
nick,"If the world's only gonna see a fox as shifty and untrustworthy, there's no point in trying to be anything else."
hopps,"Nick, you are so much more than that..."
nick,"Boy, look at that traffic down there.  How about we go out to Chuck in Traffic Central-- Chuck, how are things looking on the Jam Cams?"
hopps,"Nick, I'm glad you told me..."
nick, The Jam Cams...!
hopps,"Seriously, it's okay..."
nick,No-n-shh-shush! There are traffic cameras everywhere. All over the canopy. Whatever happened to that jaguar--
hopps,The traffic cams would have caught it!
nick,Bingo!
hopps,"Pretty sneaky, Slick."
nick,"However. If you didn't have access to the system before, I doubt Chief Buffalo Butt is gonna let you into it now."
hopps, No... But I have a friend at City Hall who might.
bellwether,Sir? If we could just review these very important--  Sir?
lionheart,"Okay. I heard you, Bellwether. Just take care of it!  Please. And clear my afternoon, I'm going out."
bellwether,"No, no! But, sir, you do have a meeting with Herds and Grazing... sir, if I could just--"
hopps,Assistant Mayor Bellwether? We need your help.
hopps,We just need to get into the traffic cam database.
nick, So fluffy!
hopps,Hey!
nick,Sheep never let me this close.
hopps,You can't just touch a sheep's wool...
bellwether,Where to?
hopps,"Rainforest District, Vine and Tujunga."
bellwether,"There! Traffic cams for the whole city. This is so exciting, actually. Well, you know, I never get to do anything this important."
hopps,But you're the Assistant Mayor of Zootopia.
bellwether,"Oh, I'm more of a glorified secretary. I think Mayor Lionheart just wanted the sheep vote...  But he did give me that nice mug."
bellwether,"That's a fun little name he likes to use. I called him Lionfart once. He did not care for that, let me tell you. It was not a good day for me.  Yes, sir?"
bellwether,"Oh, dear. I better go --  Let me know what you find. It was really nice for me to be--"
nick,You think when she goes to sleep she counts herself?
hopps,"Shush. Okay, traffic cams...  Tujunga, Tujunga... we're in."
nick,Timberwolves. Look at these dumdums.
hopps, Howlers! Night howlers! That's what Manchas was afraid of... wolves! The wolves are the night howlers. If they took Manchas...
nick,...I bet they took Otterton too.
hopps,All we gotta do is find out where they went.
nick,"You know, if I wanted to avoid surveillance because I was doing something illegal-- which I never have-- I would use the maintenance tunnel 6B... which would put them out..."
hopps,"Well, look at you, Junior Detective. You know, I think you'd actually make a pretty good cop."
nick,How dare you.
hopps,They're heading out of town... Where does that road go?
wolf guard,"Gary, quit it, you're gonna start a howl."
wolf guard,Oooooooooo!
hopps,Come on!
nick,You are a clever bunny.
hopps,It looks like this was a hospital.
nick," You know, after you, you're the cop."
nick,Okay. All clear.
hopps,All this equipment is brand new...
hopps,Claw marks...
nick,"Yeah. Huge, huge, claw marks. I mean, what kind of--"
hopps,Mr. Manchas.
nick,Or not. Guess he's in no rush to get home to the Missus.
hopps,"...11, 12, 13, 14. Not including Manchas it's 14...  Chief Bogo handed out 14 Missing Mammal files... They're all here. All the missing mammals are right here."
badger doctor,"Mayor Lionheart, please, we're doing everything we can."
lionheart,"Really? Cuz I got a dozen and a half animals here who've gone off the rails crazy-- and you can't tell me why. Now, I'd call that awfully far from doing everything."
badger doctor,"Sir, it may be time to consider their biology."
lionheart,What? What do you mean biology?
badger doctor,The only animals going savage are predators. We cannot keep it a secret. We need to come forward.
lionheart,"Hmm... Great idea. Tell the public. And how do you think they're gonna feel about their mayor, who is a lion?! I'll be ruined!"
badger doctor,"Well, what does Chief Bogo say?"
lionheart,Chief Bogo doesn't know. And we are going to keep it that way.
badger doctor,"Sir, you need to go, now!  Security! Sweep the area!"
nick,Great! We're dead. We're dead. That's it. I'm dead. You're dead. Everybody's dead.
hopps,Can you swim?
nick,"What? Can I swim? Yes, I can swim. Why?"
hopps,We gotta tell Bogo!
clawhauser,Chief Bogo!
bogo, Not now!
clawhauser,"Wait, is that Gazelle?"
bogo, No!
clawhauser,"You have the app too?!  Oh, jeeeeez!"
bogo,"Clawhauser, can't you see I'm working on the missing mammal cases?!"
clawhauser,"Oh, yes of course! About that, sir... Officer Hopps just called... She found all of `em."
hopps,"Mayor Lionheart, you have the right to remain silent. Anything--"
lionheart,You don't understand. I was trying to protect the city.
hopps,You were just trying to protect your job.
lionheart,"No. Listen, we still don't know why this is happening. It could destroy Zootopia."
hopps,You have the right to remain silent. Anything you say can and will be used against you in a court of law...
bogo,"Ladies and Gentlemammals... 14 mammals went missing and all 14 have been found by our newest recruit, who will speak to you in a moment. But first, let me remind you--"
hopps,Rrrgh. I am so nervous...
nick,"Okay, press conference 101: You wanna look smart? "
hopps,You should be there with me. We did this together.
nick,"Well, am I a cop? No. No, I am not."
hopps,"Funny you should say that, because I've been thinking... it would be nice to have a partner."
bellwether,"Officer Hopps, it's time."
bogo,"So now, I'll turn things over to the officer who cracked the case. Officer Judy Hopps."
press,Officer Hopps! / Over here! / Here!
hopps, Yes?
reporter,What can you tell us about the animals that went savage?
hopps,"Well, the animals in question...  Are they all different species? Yes. Yes they are."
reporter 2,"Okay, so what is the connection?"
hopps,"Well, all we know is that they are all members of the predator family."
another reporter,"So, predators are the only ones going savage?"
hopps,"That is accu-- Yes, that is accurate. Yes..."
reporter 3,Wow. Why is that happening?
hopps,We still don't know--
hopps,"A biological component. You know, something in their DNA..."
reporter 4," In their DNA? Can you elaborate on that, please?"
hopps,"Yes. What I mean is, thousands of years ago... um... predators survived through their aggressive hunting instincts. For whatever reason, they seem to be reverting back to their primitive, savage ways."
hopps,It is possible. So we must be vigilant. And we at the ZPD are prepared and are here to protect you...
press,Will more mammals go savage? / What is being done to protect us? / Have you considered a mandatory quarantine on predators?
bellwether,"Okay, thank you Officer Hopps, uh, that's all the time that we have. No more questions..."
hopps,Was I okay?
bellwether,"Oh, you did fine."
hopps, That went so fast! I didn't get a chance to mention you or say anything about how we--
nick," Oh, I think you said plenty."
hopps,What do you mean?
nick," Clearly, there's a biological component? These predators may be reverting back to their primitive, savage ways. Are you serious?"
hopps,"I just stated the facts of the case. I mean, it's not like a bunny could go savage..."
nick,Right. But a fox could? Huh?
hopps,"Nick, stop it. You're not like them."
nick,"Oh, there's a them now?"
hopps,You know what I mean. You're not that kind of predator.
nick,The kind that needs to be muzzled? The kind that makes you think you need to carry around Fox Repellent?
hopps,No. Nick. Nick!
reporter 5,Officer Hopps! Were you just threatened by that predator?
hopps,No. He's my friend.
reporter 6,We can't even trust our own friends?
hopps,That is not what I said! Please!
reporters,Are we safe? / Have any other foxes gone savage?
pig,"Go back to the forest, predator!"
leopard,I'm from the savannah!
gazelle,"Zootopia is a unique place. It's a crazy, beautiful, diverse city where we celebrate our differences.  This is not the Zootopia I know."
gazelle,We cannot let fear divide us. Please-- give me back the Zootopia I love...
bogo,Come on Hopps. The new Mayor wants to see us.
hopps,The Mayor? Why?
bogo,It would seem you've arrived.
hopps,Clawhauser? What're you doing?
clawhauser,"Um, they thought it would be better if a predator such as myself wasn't the first face you that you see when you walk into the ZPD."
hopps,What?
clawhauser,They're gonna move me to Records. It's downstairs. By the boiler.
bogo,Hopps!
hopps,Um... I don't understand.
bellwether,"Our city is 90% prey, Judy. And right now they're just really scared. You're a hero to them. They trust you. And so that's why Chief Bogo and I want you to be the public face of the ZPD."
hopps," I'm not... I'm not a hero. I came here to make the world a better place, but I think I broke it."
bogo,"Don't give yourself so much credit, Hopps. The world has always been broken. That's why we need good cops-- like you."
hopps,"With all due respect, sir, a good cop is supposed to serve and protect-- help the city. Not tear it apart.  I don't deserve this badge."
bogo,Hopps.
bellwether,"Judy, you've worked so hard to get here. It's what you've wanted since you were a kid. You can't quit..."
hopps,Thank you for the opportunity.
hopps,A dozen carrots.
rabbit mom,Thanks!
hopps,Have a nice day.
rabbit mom, Come on.
stu hopps,"Hey there, Jude-- Jude the dude, remember that one? How we doin?"
bonnie hopps,You are not fine. Your ears are droopy.
hopps,Why did I think I could make a difference?
stu hopps,"Because you're a trier, that's why."
bonnie hopps,You've always been a trier.
hopps,"Oh, I tried. And it made life so much worse for so many innocent predators."
stu hopps,"Oh, not all of them, though. Speak of the devil. Right on time."
hopps,Is that... Gideon Grey?
stu hopps,Yep. It sure is. We work with him now.
bonnie hopps,He's our partner. And we never would have considered it had you not opened our minds.
stu hopps,"That's right. I mean, Gid's turned into one of the top pastry chefs in the tri-burrows."
hopps,"That's really cool, you guys."
hopps,"Well, I know a thing or two about being a jerk..."
stu hopps,Hey kids! Don't you run through that midnicampum holicithias!
rabbit kid," Whoa, whoa, whoa!"
hopps,"I'm sorry, what did you say?"
stu hopps,"Oh, Gid's talking about those flowers, Judy. I use `em to keep bugs off the produce. But I don't like the little ones going near `em on account of what happened to your Uncle Terry."
bonnie hopps,"Yeah, Terry ate one whole when we were kids and went completely nuts."
stu hopps,He bit the dickens out of your mother.
hopps, A bunny can go savage...
bonnie hopps,"Savage? Well, that's a strong word. But it did hurt like the devil."
stu hopps,Well sure it did. There's a sizable divot in your arm. I'd call that savage.
hopps, Night howlers aren't wolves. They're flowers. The flowers are making the predators go savage. That's it! That's what I've been missing!
stu hopps,"You catch any of that, Bon?"
bonnie hopps,Not one bit.
gideon grey,"Well, that makes me feel a little better. I thought she was talking in tongues or something."
finnick,Who is it?
hopps,I need to find Nick. Please.
hopps,Nick? Nick!
nick,Wow. Isn't that interesting.
hopps,"Wait! Wait, please-- I know you'll never forgive me. And I don't blame you. I wouldn't forgive me either. I was ignorant and irresponsible and small-minded... But predators shouldn't suffer because of my mistakes. I have to fix this, but I can't do it without you."
nick,"Don't worry, Carrots, I'll let you erase it... in 48 hours."
hopps,I'm sorry.
nick,I thought you guys only grew carrots.  What's the plan?
hopps,We are gonna follow the night howlers.
nick,Okay. How?
hopps, Know this guy?
nick,"Uh-huh. I told you, I know everybody."
duke weaselton,"Well, hello, step right up! Anything you need... I got it. All your favorite movies! I got movies that haven't even been released yet!"
nick," Well, well, look who it is. The duke of bootleg."
duke weaselton,"What's it to you, Wilde? Shouldn't you be melting down a popsicle or something?  Hey, if it isn't Flopsy the Copsy."
hopps,"We both know those weren't moldy onions I caught you stealing. What were you gonna do with those night howlers, Wessleton?"
duke weaselton,"It's Weaselton. Duke Weaselton. And I ain't talking, rabbit. And ain't nothing you can do to make me."
duke weaselton,Aaagh! Agh!  Ya dirty rat! Why ya helping her?! She's a cop!
hopps,Aw.
duke weaselton,"All right, all right, please! I'll talk! I'll talk. I stole them night howlers so I could sell `em. They offered me what I couldn't refuse... Money."
hopps,And to whom did you sell them?
hopps,Come on!  As they sneak up to it... Hopps pulls open the window and looks inside the car. They both jump into...
hopps,The weasel wasn't lying.
nick,"Yeah, looks like old Doug's cornered the market on night howlers..."
doug, You got Doug here. What's the mark? Cheetah in Sahara Square. Got it.
doug, Out.
nick,"Hey. Hey! Where are you going? Get back here! What are you doing?! He's gonna see you! What are you looking at? Hey! Whatever you're thinking, stop thinking it. Carrots! Carrots!"
doug,It better have the extra foam this time--
nick,What are you doing?! You just trapped us in here!
hopps,We need to get this evidence to the ZPD.
nick,Okay. Great. Here it is. Got it.
hopps,No. All of it!
nick,"Wait, what?"
doug, Oh! It just got worse!
nick,Mission accomplished. Would it be premature for me to do a little victory toot-toot?
hopps,All right. One toot-toot.
nick,"Well, I can cross that off the bucket list."
hopps, Don't stop! Keep going!
jesse, No! No! Please stop!
hopps,Do not stop this car!
nick, There's another train coming!
hopps,Trust me! SPEED! UP!
woolter,Stop the train! Hey!
hopps,Hey. Need some help?
nick,"Oh no! Oh no, no, no! Too fast! Hold on!"
hopps,Okay... Maybe some of the evidence survived.
nick," Yeah. Oh, except for this."
hopps,"Oh, Nick! Yes!"
nick,Ow.
hopps,Come on! We gotta get to the ZPD. Cut through the Natural History Museum!
hopps,Oh! There it is!
hopps,Mayor Bellwether!  We found out what's happening. Someone's darting predators with a serum-- that's what's making them go savage.
bellwether," I am so proud of you, Judy. You did just a super job."
hopps,"Thank you, ma'am.  How did you know where to find us?"
bellwether,I'll go ahead and I'll take that case now.
hopps,You know what... I think Nick and I will just take this to the ZPD...
bellwether,Get them!
hopps,Ach!
nick,Ah Carrots!
hopps,Pass.
hopps,Take the case. Get it to Bogo.
nick,I'm not gonna leave you behind. That's not happening.
hopps,I can't walk.
nick,"Just, we'll think of something."
bellwether,"We're on the same team, Judy!"
bellwether,"Underestimated. Under-appreciated. Aren't you sick of it? Predators. They may be strong and loud, but prey out-number predators 10 to one."
hopps,What are you going to do? Kill me?
bellwether,No! Of course not... he is.
hopps,No! Nick?!
bellwether,"Yes, police! There's a savage fox in the natural history museum. Officer Hopps is down! Please hurry!"
hopps,"No. Nick, don't do this. Fight it."
bellwether,"Oh, but he can't help it, can he? Since preds are just biologically predisposed to be savages."
hopps,"So that's it, prey fears predator, and you stay in power?"
bellwether,"Yeah, pretty much."
hopps,It won't work.
bellwether,Fear always works. And I'll dart every predator in Zootopia to keep it that way.
hopps," Oh, Nick! No!"
bellwether,"Bye-Bye, Bunny."
hopps,"Blood, blood, blood! And death."
nick,"All right, you're milking it. Besides, I think we got it, I think we got it. We got it up there, thank you yakkety-yak-- you laid it all out beautifully."
bellwether,What?
nick,"Yea, oh, are you looking for the serum?  Well, it's right here."
hopps,What you've got in the weapon there- - those are blueberries. From my family's farm.
nick,They are delicious.  You should try some.
bellwether,"I framed Lionheart, I can frame you too! It's my word against yours!"
hopps,"Oooo, actually--"
hopps,"--It's your word against yours. It's called a hustle, sweetheart. Boom."
prey anchor,"Her predecessor, Leodore Lionheart, denies any knowledge of her plot, claiming he was just trying to protect the city."
lionheart,"Did I falsely imprison those animals? Well, yes. Yes I did. It was a classic ""doing the wrong thing for the right reason"" kind of a deal."
pred anchor,"In related news, doctors say the night howler antidote is proving effective in rehabilitating the afflicted predators..."
hopps,"So, no matter what type of animal you are, from the biggest elephant to our first fox..."
bogo,"...Enough! Shut it! We have some new recruits with us this morning, including our first fox. Who cares."
nick,"Ha! You should have your own line of inspirational greeting cards, sir."
bogo,"Shut your mouth, Wilde. Assignments! Officers Grizzoli, Fangmeyer, Delgato: Tundratown Swat. Snarlov, Higgins, Wolfard: Undercover. Hopps, Wilde...  Just kidding! We have reports of a street racer tearing up Savannah Central. Find him, shut him down."
nick,So are all rabbits bad drivers or is it just you?
hopps,Oops. Sorry.
nick, Sly bunny.
hopps,Dumb fox.
nick,You know you love me.
hopps,"Do I know that? Yes. Yes, I do."
hopps,"Sir, you were going 115 miles per hour. I hope you have a good explanation."
nick,Flash? Flash? Hundred yard dash?!
flash, Nick.
